mal_id,url,images,trailer,title,title_english,title_japanese,title_synonyms,type,source,episodes,status,airing,aired,duration,rating,score,scored_by,rank,popularity,members,favorites,synopsis,background,season,year,broadcast,producers,licensors,studios,genres,explicit_genres,themes,demographics
120,https://myanimelist.net/anime/120/Fruits_Basket,"{'jpg': {'image_url': 'https://cdn.myanimelist.net/images/anime/4/75204.jpg', 'small_image_url': 'https://cdn.myanimelist.net/images/anime/4/75204t.jpg', 'large_image_url': 'https://cdn.myanimelist.net/images/anime/4/75204l.jpg'}, 'webp': {'image_url': 'https://cdn.myanimelist.net/images/anime/4/75204.webp', 'small_image_url': 'https://cdn.myanimelist.net/images/anime/4/75204t.webp', 'large_image_url': 'https://cdn.myanimelist.net/images/anime/4/75204l.webp'}}","{'youtube_id': None, 'url': None, 'embed_url': None, 'images': {'image_url': None, 'small_image_url': None, 'medium_image_url': None, 'large_image_url': None, 'maximum_image_url': None}}","""Fruits Basket""",Fruits Basket,フルーツバスケット,['Furuba'],TV,Manga,26,Finished Airing,False,"{'from': '2001-07-05T00:00:00+00:00', 'to': '2001-12-27T00:00:00+00:00', 'prop': {'from': {'day': 5, 'month': 7, 'year': 2001}, 'to': {'day': 27, 'month': 12, 'year': 2001}}, 'string': 'Jul 5, 2001 to Dec 27, 2001'}",24 min per ep,PG-13 - Teens 13 or older,7.68,251555.0,1130,346,491346,8601,"After the accident in which she lost her mother, 16-year-old Tooru moves in with her grandfather, but due to his home being renovated, is unable to continue living with him. Claiming she will find someone to stay with but also fearing the criticism of her family and not wanting to burden any of her friends, Tooru resorts to secretly living on her own in a tent in the woods. One night on her way back from work, she finds her tent buried underneath a landslide. Yuki Souma, the ""prince"" of her school, and his cousin Shigure Souma, a famous author, stumble across Tooru's situation and invite her to stay with them until her grandfather's home renovations are complete. Upon arriving at the Souma house, Tooru discovers their secret: if a Souma is hugged by someone of the opposite gender, they temporarily transform into one of the animals of the zodiac! However, this strange phenomenon is no laughing matter; rather, it is a terrible curse that holds a dark history. As she continues her journey, meeting more members of the zodiac family, will Tooru's kindhearted yet resilient nature be enough to prepare her for what lies behind the Souma household's doors? [Written by MAL Rewrite]",Fruits Basket won the 2001 Animage's Anime Grand Prix Award.,summer,2001,"{'day': 'Thursdays', 'time': '18:00', 'timezone': 'Asia/Tokyo', 'string': 'Thursdays at 18:00 (JST)'}","[{'mal_id': 16, 'type': 'anime', 'name': 'TV Tokyo', 'url': 'https://myanimelist.net/anime/producer/16/TV_Tokyo'}, {'mal_id': 139, 'type': 'anime', 'name': 'Nihon Ad Systems', 'url': 'https://myanimelist.net/anime/producer/139/Nihon_Ad_Systems'}, {'mal_id': 1344, 'type': 'anime', 'name': 'King Records', 'url': 'https://myanimelist.net/anime/producer/1344/King_Records'}]","[{'mal_id': 102, 'type': 'anime', 'name': 'Funimation', 'url': 'https://myanimelist.net/anime/producer/102/Funimation'}]","[{'mal_id': 37, 'type': 'anime', 'name': 'Studio Deen', 'url': 'https://myanimelist.net/anime/producer/37/Studio_Deen'}]","[{'mal_id': 4, 'type': 'anime', 'name': 'Comedy', 'url': 'https://myanimelist.net/anime/genre/4/Comedy'}, {'mal_id': 8, 'type': 'anime', 'name': 'Drama', 'url': 'https://myanimelist.net/anime/genre/8/Drama'}, {'mal_id': 22, 'type': 'anime', 'name': 'Romance', 'url': 'https://myanimelist.net/anime/genre/22/Romance'}, {'mal_id': 36, 'type': 'anime', 'name': 'Slice of Life', 'url': 'https://myanimelist.net/anime/genre/36/Slice_of_Life'}, {'mal_id': 37, 'type': 'anime', 'name': 'Supernatural', 'url': 'https://myanimelist.net/anime/genre/37/Supernatural'}]",[],[],"[{'mal_id': 25, 'type': 'anime', 'name': 'Shoujo', 'url': 'https://myanimelist.net/anime/genre/25/Shoujo'}]"
154,https://myanimelist.net/anime/154/Shaman_King,"{'jpg': {'image_url': 'https://cdn.myanimelist.net/images/anime/1722/99235.jpg', 'small_image_url': 'https://cdn.myanimelist.net/images/anime/1722/99235t.jpg', 'large_image_url': 'https://cdn.myanimelist.net/images/anime/1722/99235l.jpg'}, 'webp': {'image_url': 'https://cdn.myanimelist.net/images/anime/1722/99235.webp', 'small_image_url': 'https://cdn.myanimelist.net/images/anime/1722/99235t.webp', 'large_image_url': 'https://cdn.myanimelist.net/images/anime/1722/99235l.webp'}}","{'youtube_id': None, 'url': None, 'embed_url': None, 'images': {'image_url': None, 'small_image_url': None, 'medium_image_url': None, 'large_image_url': None, 'maximum_image_url': None}}","""Shaman King""",Shaman King,シャーマンキング,[],TV,Manga,64,Finished Airing,False,"{'from': '2001-07-04T00:00:00+00:00', 'to': '2002-09-25T00:00:00+00:00', 'prop': {'from': {'day': 4, 'month': 7, 'year': 2001}, 'to': {'day': 25, 'month': 9, 'year': 2002}}, 'string': 'Jul 4, 2001 to Sep 25, 2002'}",23 min per ep,PG-13 - Teens 13 or older,7.77,171359.0,929,537,332131,3518,"A battle is about to begin in Tokyo: the Shaman Fight, a tournament held every five hundred years where shaman—those who can command spirits—confront each other in combat. The victor of this contest becomes the Shaman King and the only one who is able to contact and control the Great Spirit, allowing them to reshape the world as they please through its immense power. During a late night walk, Manta Oyamada runs into his classmate, the carefree You Asakura, who invites him to come stargazing with some friends, who, to Manta's horror, turn out to be ghosts from a local cemetery! However, the knowledge that Manta possesses—a rare sixth sense that allows Manta to see these spirits—endears the boy to You. So when You finds out that his new comrade has been beaten up by a local gang, he decides to avenge him with the help of Amidamaru, a samurai ghost whose tomb was broken by the gang leader. Soon Manta uncovers more about the world of spirits, including the Shaman Fight, in which his new friend You aims to claim victory. [Written by MAL Rewrite]",,summer,2001,"{'day': 'Wednesdays', 'time': '18:30', 'timezone': 'Asia/Tokyo', 'string': 'Wednesdays at 18:30 (JST)'}","[{'mal_id': 16, 'type': 'anime', 'name': 'TV Tokyo', 'url': 'https://myanimelist.net/anime/producer/16/TV_Tokyo'}, {'mal_id': 139, 'type': 'anime', 'name': 'Nihon Ad Systems', 'url': 'https://myanimelist.net/anime/producer/139/Nihon_Ad_Systems'}, {'mal_id': 717, 'type': 'anime', 'name': 'TV Tokyo Music', 'url': 'https://myanimelist.net/anime/producer/717/TV_Tokyo_Music'}]","[{'mal_id': 252, 'type': 'anime', 'name': '4Kids Entertainment', 'url': 'https://myanimelist.net/anime/producer/252/4Kids_Entertainment'}, {'mal_id': 467, 'type': 'anime', 'name': 'Discotek Media', 'url': 'https://myanimelist.net/anime/producer/467/Discotek_Media'}]","[{'mal_id': 27, 'type': 'anime', 'name': 'Xebec', 'url': 'https://myanimelist.net/anime/producer/27/Xebec'}]","[{'mal_id': 1, 'type': 'anime', 'name': 'Action', 'url': 'https://myanimelist.net/anime/genre/1/Action'}, {'mal_id': 2, 'type': 'anime', 'name': 'Adventure', 'url': 'https://myanimelist.net/anime/genre/2/Adventure'}, {'mal_id': 4, 'type': 'anime', 'name': 'Comedy', 'url': 'https://myanimelist.net/anime/genre/4/Comedy'}, {'mal_id': 37, 'type': 'anime', 'name': 'Supernatural', 'url': 'https://myanimelist.net/anime/genre/37/Supernatural'}]",[],"[{'mal_id': 31, 'type': 'anime', 'name': 'Super Power', 'url': 'https://myanimelist.net/anime/genre/31/Super_Power'}]","[{'mal_id': 27, 'type': 'anime', 'name': 'Shounen', 'url': 'https://myanimelist.net/anime/genre/27/Shounen'}]"
168,https://myanimelist.net/anime/168/sCRYed,"{'jpg': {'image_url': 'https://cdn.myanimelist.net/images/anime/8/89882.jpg', 'small_image_url': 'https://cdn.myanimelist.net/images/anime/8/89882t.jpg', 'large_image_url': 'https://cdn.myanimelist.net/images/anime/8/89882l.jpg'}, 'webp': {'image_url': 'https://cdn.myanimelist.net/images/anime/8/89882.webp', 'small_image_url': 'https://cdn.myanimelist.net/images/anime/8/89882t.webp', 'large_image_url': 'https://cdn.myanimelist.net/images/anime/8/89882l.webp'}}","{'youtube_id': None, 'url': None, 'embed_url': None, 'images': {'image_url': None, 'small_image_url': None, 'medium_image_url': None, 'large_image_url': None, 'maximum_image_url': None}}","""s.CRY.ed""",s-CRY-ed,スクライド,['Scryed'],TV,Original,26,Finished Airing,False,"{'from': '2001-07-04T00:00:00+00:00', 'to': '2001-12-26T00:00:00+00:00', 'prop': {'from': {'day': 4, 'month': 7, 'year': 2001}, 'to': {'day': 26, 'month': 12, 'year': 2001}}, 'string': 'Jul 4, 2001 to Dec 26, 2001'}",24 min per ep,PG-13 - Teens 13 or older,7.37,35114.0,2110,1996,76784,617,"A strange environmental phenomenon 22 years ago in the Kanazawa prefecture caused the land to split and protrude upwards reaching unprecedented heights, creating the secluded area known as The Lost Ground. Kazuma is a young mercenary who lives in the Lost Ground, looking for any work he can find to sustain his livelihood within the harsh environment. He is one of the few people that are gifted with the Alter ability, which allows him to plaster his right arm and torso with a metallic alloy. When this mercenary encounters HOLY, an order whose purpose is to suppress and capture what they call Native Alter Users, and one of the elite members of HOLY, Ryuho, an epic rivalry begins. (Source: ANN)",,summer,2001,"{'day': 'Wednesdays', 'time': '18:00', 'timezone': 'Asia/Tokyo', 'string': 'Wednesdays at 18:00 (JST)'}","[{'mal_id': 127, 'type': 'anime', 'name': 'Yomiko Advertising', 'url': 'https://myanimelist.net/anime/producer/127/Yomiko_Advertising'}]","[{'mal_id': 233, 'type': 'anime', 'name': 'Bandai Entertainment', 'url': 'https://myanimelist.net/anime/producer/233/Bandai_Entertainment'}, {'mal_id': 376, 'type': 'anime', 'name': 'Sentai Filmworks', 'url': 'https://myanimelist.net/anime/producer/376/Sentai_Filmworks'}, {'mal_id': 467, 'type': 'anime', 'name': 'Discotek Media', 'url': 'https://myanimelist.net/anime/producer/467/Discotek_Media'}]","[{'mal_id': 14, 'type': 'anime', 'name': 'Sunrise', 'url': 'https://myanimelist.net/anime/producer/14/Sunrise'}]","[{'mal_id': 1, 'type': 'anime', 'name': 'Action', 'url': 'https://myanimelist.net/anime/genre/1/Action'}, {'mal_id': 2, 'type': 'anime', 'name': 'Adventure', 'url': 'https://myanimelist.net/anime/genre/2/Adventure'}, {'mal_id': 8, 'type': 'anime', 'name': 'Drama', 'url': 'https://myanimelist.net/anime/genre/8/Drama'}, {'mal_id': 24, 'type': 'anime', 'name': 'Sci-Fi', 'url': 'https://myanimelist.net/anime/genre/24/Sci-Fi'}]",[],"[{'mal_id': 31, 'type': 'anime', 'name': 'Super Power', 'url': 'https://myanimelist.net/anime/genre/31/Super_Power'}]",[]
551,https://myanimelist.net/anime/551/Grappler_Baki__Saidai_Tournament-hen,"{'jpg': {'image_url': 'https://cdn.myanimelist.net/images/anime/1433/96723.jpg', 'small_image_url': 'https://cdn.myanimelist.net/images/anime/1433/96723t.jpg', 'large_image_url': 'https://cdn.myanimelist.net/images/anime/1433/96723l.jpg'}, 'webp': {'image_url': 'https://cdn.myanimelist.net/images/anime/1433/96723.webp', 'small_image_url': 'https://cdn.myanimelist.net/images/anime/1433/96723t.webp', 'large_image_url': 'https://cdn.myanimelist.net/images/anime/1433/96723l.webp'}}","{'youtube_id': None, 'url': None, 'embed_url': None, 'images': {'image_url': None, 'small_image_url': None, 'medium_image_url': None, 'large_image_url': None, 'maximum_image_url': None}}","""Grappler Baki: Saidai Tournament-hen""",,グラップラー刃牙(バキ) 最大トーナメント編,"['Baki the Grappler II', 'Grappler Baki Second Season', 'Baki The Grappler - The Ultimate Tournament', 'Grappler Baki Maximum Tournament']",TV,Manga,24,Finished Airing,False,"{'from': '2001-07-24T00:00:00+00:00', 'to': '2001-12-25T00:00:00+00:00', 'prop': {'from': {'day': 24, 'month': 7, 'year': 2001}, 'to': {'day': 25, 'month': 12, 'year': 2001}}, 'string': 'Jul 24, 2001 to Dec 25, 2001'}",24 min per ep,R - 17+ (violence & profanity),7.47,34226.0,1726,2280,61727,200,"Mitsunari Tokugawa, the organizer of the historic Tokugawa underground fighting ring, has created a tournament featuring 38 of the world's best fighters, many of whom are grandmasters in their respective form of martial arts. With the exception of weapons, anything goes in Tokugawa's ring so that each fighter is able to showcase their true power and strongest secret moves. Baki Hanma earned a place in the tournament due to his status as the reigning champion of Tokugawa's fighting ring. Will he be able to come out on top? [Written by MAL Rewrite]",,summer,2001,"{'day': None, 'time': None, 'timezone': None, 'string': 'Unknown'}",[],"[{'mal_id': 102, 'type': 'anime', 'name': 'Funimation', 'url': 'https://myanimelist.net/anime/producer/102/Funimation'}]","[{'mal_id': 86, 'type': 'anime', 'name': 'Group TAC', 'url': 'https://myanimelist.net/anime/producer/86/Group_TAC'}]","[{'mal_id': 1, 'type': 'anime', 'name': 'Action', 'url': 'https://myanimelist.net/anime/genre/1/Action'}, {'mal_id': 30, 'type': 'anime', 'name': 'Sports', 'url': 'https://myanimelist.net/anime/genre/30/Sports'}]",[],"[{'mal_id': 17, 'type': 'anime', 'name': 'Martial Arts', 'url': 'https://myanimelist.net/anime/genre/17/Martial_Arts'}]","[{'mal_id': 27, 'type': 'anime', 'name': 'Shounen', 'url': 'https://myanimelist.net/anime/genre/27/Shounen'}]"
509,https://myanimelist.net/anime/509/I_My_Me_Strawberry_Eggs,"{'jpg': {'image_url': 'https://cdn.myanimelist.net/images/anime/1414/93964.jpg', 'small_image_url': 'https://cdn.myanimelist.net/images/anime/1414/93964t.jpg', 'large_image_url': 'https://cdn.myanimelist.net/images/anime/1414/93964l.jpg'}, 'webp': {'image_url': 'https://cdn.myanimelist.net/images/anime/1414/93964.webp', 'small_image_url': 'https://cdn.myanimelist.net/images/anime/1414/93964t.webp', 'large_image_url': 'https://cdn.myanimelist.net/images/anime/1414/93964l.webp'}}","{'youtube_id': None, 'url': None, 'embed_url': None, 'images': {'image_url': None, 'small_image_url': None, 'medium_image_url': None, 'large_image_url': None, 'maximum_image_url': None}}","""I My Me! Strawberry Eggs""",I My Me! Strawberry Eggs,あぃまぃみぃ！ストロベリー・エッグ,['Ai Mai Mi! Strawberry Egg'],TV,Original,13,Finished Airing,False,"{'from': '2001-07-04T00:00:00+00:00', 'to': '2001-09-26T00:00:00+00:00', 'prop': {'from': {'day': 4, 'month': 7, 'year': 2001}, 'to': {'day': 26, 'month': 9, 'year': 2001}}, 'string': 'Jul 4, 2001 to Sep 26, 2001'}",25 min per ep,PG-13 - Teens 13 or older,6.78,18262.0,4775,3089,35595,88,"Amawa Hibiki is a young man just out of college, with an education to be an athletics teacher. He's been having a hard time finding a job since he graduated, so all his money has gone towards living expenses. When his landlady demands his first payment to live in her living establishment upfront, he heads to the local middle school to get hired as a teacher. However, the principal refuses to hire him without hesitation. She will not hire men as teachers and makes it clear that she hates all men, saying they put no love into their passions and work. Amawa does not give up and with the help of his landlady, he crossdresses as a woman without a second thought, and gets hired, so he can earn money and also prove the principal wrong. Now, he has to keep his real gender a secret, and avoid strange situations, including the affections of his students (from both genders). (Source: ANN)",,summer,2001,"{'day': 'Wednesdays', 'time': '18:30', 'timezone': 'Asia/Tokyo', 'string': 'Wednesdays at 18:30 (JST)'}","[{'mal_id': 204, 'type': 'anime', 'name': 'Pioneer LDC', 'url': 'https://myanimelist.net/anime/producer/204/Pioneer_LDC'}, {'mal_id': 1685, 'type': 'anime', 'name': 'Toshiba Digital Frontiers', 'url': 'https://myanimelist.net/anime/producer/1685/Toshiba_Digital_Frontiers'}]","[{'mal_id': 1459, 'type': 'anime', 'name': 'Geneon Entertainment USA', 'url': 'https://myanimelist.net/anime/producer/1459/Geneon_Entertainment_USA'}]","[{'mal_id': 120, 'type': 'anime', 'name': 'TNK', 'url': 'https://myanimelist.net/anime/producer/120/TNK'}]","[{'mal_id': 4, 'type': 'anime', 'name': 'Comedy', 'url': 'https://myanimelist.net/anime/genre/4/Comedy'}, {'mal_id': 8, 'type': 'anime', 'name': 'Drama', 'url': 'https://myanimelist.net/anime/genre/8/Drama'}, {'mal_id': 22, 'type': 'anime', 'name': 'Romance', 'url': 'https://myanimelist.net/anime/genre/22/Romance'}, {'mal_id': 36, 'type': 'anime', 'name': 'Slice of Life', 'url': 'https://myanimelist.net/anime/genre/36/Slice_of_Life'}]",[],"[{'mal_id': 23, 'type': 'anime', 'name': 'School', 'url': 'https://myanimelist.net/anime/genre/23/School'}]",[]
397,https://myanimelist.net/anime/397/Seikai_no_Senki_II,"{'jpg': {'image_url': 'https://cdn.myanimelist.net/images/anime/12/61109.jpg', 'small_image_url': 'https://cdn.myanimelist.net/images/anime/12/61109t.jpg', 'large_image_url': 'https://cdn.myanimelist.net/images/anime/12/61109l.jpg'}, 'webp': {'image_url': 'https://cdn.myanimelist.net/images/anime/12/61109.webp', 'small_image_url': 'https://cdn.myanimelist.net/images/anime/12/61109t.webp', 'large_image_url': 'https://cdn.myanimelist.net/images/anime/12/61109l.webp'}}","{'youtube_id': None, 'url': None, 'embed_url': None, 'images': {'image_url': None, 'small_image_url': None, 'medium_image_url': None, 'large_image_url': None, 'maximum_image_url': None}}","""Seikai no Senki II""",Banner of the Stars II,星界の戦旗 II,['Battle Flag of the Stars II'],TV,Light novel,10,Finished Airing,False,"{'from': '2001-07-11T00:00:00+00:00', 'to': '2001-09-26T00:00:00+00:00', 'prop': {'from': {'day': 11, 'month': 7, 'year': 2001}, 'to': {'day': 26, 'month': 9, 'year': 2001}}, 'string': 'Jul 11, 2001 to Sep 26, 2001'}",25 min per ep,PG-13 - Teens 13 or older,7.81,10863.0,857,3959,21678,111,"Due to a lack of ambassadors for the recently-conquered worlds the rapidly advancing fleet of the Bebaus brothers leave behind, Lafiel is appointed Territorial Ambassador of the planet Lobnas II. Upon arriving to the planet Jinto and Lafiel discover that the planet was used by the United Mankind as a prison planet and now has a million prisoners on the only inhabited island. The prisoners are parted in three blocks. The western where women are housed, the eastern belongs to the men and the central is mixed under the restriction that all prisoners living there are sterilized. The women in the western sector want to emigrate from the planet of fear for the men and when they do the men in the east rebel, overthrowing the guards and capturing Jinto to try to stop the emigration of the women. At the same time an enemy fleet heads toward the system forcing Lafiel to abandon Jinto. (Source: ANN)",,summer,2001,"{'day': None, 'time': None, 'timezone': None, 'string': 'Unknown'}","[{'mal_id': 23, 'type': 'anime', 'name': 'Bandai Visual', 'url': 'https://myanimelist.net/anime/producer/23/Bandai_Visual'}, {'mal_id': 33, 'type': 'anime', 'name': 'WOWOW', 'url': 'https://myanimelist.net/anime/producer/33/WOWOW'}]","[{'mal_id': 102, 'type': 'anime', 'name': 'Funimation', 'url': 'https://myanimelist.net/anime/producer/102/Funimation'}, {'mal_id': 233, 'type': 'anime', 'name': 'Bandai Entertainment', 'url': 'https://myanimelist.net/anime/producer/233/Bandai_Entertainment'}]","[{'mal_id': 14, 'type': 'anime', 'name': 'Sunrise', 'url': 'https://myanimelist.net/anime/producer/14/Sunrise'}]","[{'mal_id': 1, 'type': 'anime', 'name': 'Action', 'url': 'https://myanimelist.net/anime/genre/1/Action'}, {'mal_id': 22, 'type': 'anime', 'name': 'Romance', 'url': 'https://myanimelist.net/anime/genre/22/Romance'}, {'mal_id': 24, 'type': 'anime', 'name': 'Sci-Fi', 'url': 'https://myanimelist.net/anime/genre/24/Sci-Fi'}]",[],"[{'mal_id': 38, 'type': 'anime', 'name': 'Military', 'url': 'https://myanimelist.net/anime/genre/38/Military'}, {'mal_id': 29, 'type': 'anime', 'name': 'Space', 'url': 'https://myanimelist.net/anime/genre/29/Space'}]",[]
1098,https://myanimelist.net/anime/1098/Samurai_Girl_Real_Bout_High_School,"{'jpg': {'image_url': 'https://cdn.myanimelist.net/images/anime/8/15419.jpg', 'small_image_url': 'https://cdn.myanimelist.net/images/anime/8/15419t.jpg', 'large_image_url': 'https://cdn.myanimelist.net/images/anime/8/15419l.jpg'}, 'webp': {'image_url': 'https://cdn.myanimelist.net/images/anime/8/15419.webp', 'small_image_url': 'https://cdn.myanimelist.net/images/anime/8/15419t.webp', 'large_image_url': 'https://cdn.myanimelist.net/images/anime/8/15419l.webp'}}","{'youtube_id': None, 'url': None, 'embed_url': None, 'images': {'image_url': None, 'small_image_url': None, 'medium_image_url': None, 'large_image_url': None, 'maximum_image_url': None}}","""Samurai Girl Real Bout High School""",Samurai Girl Real Bout High School,SAMURAI GIRL　リアルバウトハイスクール,[],TV,Light novel,13,Finished Airing,False,"{'from': '2001-07-30T00:00:00+00:00', 'to': '2001-10-22T00:00:00+00:00', 'prop': {'from': {'day': 30, 'month': 7, 'year': 2001}, 'to': {'day': 22, 'month': 10, 'year': 2001}}, 'string': 'Jul 30, 2001 to Oct 22, 2001'}",23 min per ep,PG-13 - Teens 13 or older,5.94,3625.0,8920,5536,9458,10,"At Daimon High School, kids settle their disputes by dueling with each other in the school's official K-Fight battle arena. Ryoko Mitsurugi, samurai girl and undefeated K-Fight champion, is called upon by a mysterious Priestess to protect the Earth from an invasion coming from the alternate universe of Solvania. She must face battles that will test her skills, her friendships, and her heart in order to find her true strength as a samurai warrior. (Source: ANN)",,summer,2001,"{'day': None, 'time': None, 'timezone': None, 'string': 'Unknown'}",[],"[{'mal_id': 484, 'type': 'anime', 'name': 'Tokyopop', 'url': 'https://myanimelist.net/anime/producer/484/Tokyopop'}]","[{'mal_id': 3, 'type': 'anime', 'name': 'Gonzo', 'url': 'https://myanimelist.net/anime/producer/3/Gonzo'}]","[{'mal_id': 2, 'type': 'anime', 'name': 'Adventure', 'url': 'https://myanimelist.net/anime/genre/2/Adventure'}, {'mal_id': 4, 'type': 'anime', 'name': 'Comedy', 'url': 'https://myanimelist.net/anime/genre/4/Comedy'}, {'mal_id': 10, 'type': 'anime', 'name': 'Fantasy', 'url': 'https://myanimelist.net/anime/genre/10/Fantasy'}]",[],[],"[{'mal_id': 27, 'type': 'anime', 'name': 'Shounen', 'url': 'https://myanimelist.net/anime/genre/27/Shounen'}]"
952,https://myanimelist.net/anime/952/Magical_Nyan_Nyan_Taruto,"{'jpg': {'image_url': 'https://cdn.myanimelist.net/images/anime/1/952.jpg', 'small_image_url': 'https://cdn.myanimelist.net/images/anime/1/952t.jpg', 'large_image_url': 'https://cdn.myanimelist.net/images/anime/1/952l.jpg'}, 'webp': {'image_url': 'https://cdn.myanimelist.net/images/anime/1/952.webp', 'small_image_url': 'https://cdn.myanimelist.net/images/anime/1/952t.webp', 'large_image_url': 'https://cdn.myanimelist.net/images/anime/1/952l.webp'}}","{'youtube_id': None, 'url': None, 'embed_url': None, 'images': {'image_url': None, 'small_image_url': None, 'medium_image_url': None, 'large_image_url': None, 'maximum_image_url': None}}","""Magical Nyan Nyan Taruto""",Magical Meow Meow Taruto,魔法少女猫[まじかる にゃん にゃん]たると,"['Mahou Shoujo Neko Taruto', 'MNNT']",TV,Unknown,12,Finished Airing,False,"{'from': '2001-07-05T00:00:00+00:00', 'to': '2001-09-27T00:00:00+00:00', 'prop': {'from': {'day': 5, 'month': 7, 'year': 2001}, 'to': {'day': 27, 'month': 9, 'year': 2001}}, 'string': 'Jul 5, 2001 to Sep 27, 2001'}",22 min per ep,G - All Ages,6.21,1740.0,7649,6412,6590,8,"Taruto is a little cat who has just moved to a new city with her master's family. Taruto spends her days making friends and exploring her new home town. She also has a knack for getting herself into trouble. And it turns out that Taruto just might be a legendary magical princess. Almost none of Taruto’s friends believe that she can use magic or that she’s a princess, but Taruto is determined to prove it to them. But Taruto's magic is so unpredictable, you never know what's going to happen when she uses it. (Source: ANN)",,summer,2001,"{'day': None, 'time': None, 'timezone': None, 'string': 'Unknown'}","[{'mal_id': 23, 'type': 'anime', 'name': 'Bandai Visual', 'url': 'https://myanimelist.net/anime/producer/23/Bandai_Visual'}, {'mal_id': 53, 'type': 'anime', 'name': 'Dentsu', 'url': 'https://myanimelist.net/anime/producer/53/Dentsu'}]","[{'mal_id': 233, 'type': 'anime', 'name': 'Bandai Entertainment', 'url': 'https://myanimelist.net/anime/producer/233/Bandai_Entertainment'}]","[{'mal_id': 11, 'type': 'anime', 'name': 'Madhouse', 'url': 'https://myanimelist.net/anime/producer/11/Madhouse'}, {'mal_id': 120, 'type': 'anime', 'name': 'TNK', 'url': 'https://myanimelist.net/anime/producer/120/TNK'}]","[{'mal_id': 4, 'type': 'anime', 'name': 'Comedy', 'url': 'https://myanimelist.net/anime/genre/4/Comedy'}]",[],[],[]
