mal_id,url,images,trailer,title,title_english,title_japanese,title_synonyms,type,source,episodes,status,airing,aired,duration,rating,score,scored_by,rank,popularity,members,favorites,synopsis,background,season,year,broadcast,producers,licensors,studios,genres,explicit_genres,themes,demographics
1316,https://myanimelist.net/anime/1316/Idaten_Jump,"{'jpg': {'image_url': 'https://cdn.myanimelist.net/images/anime/4/21027.jpg', 'small_image_url': 'https://cdn.myanimelist.net/images/anime/4/21027t.jpg', 'large_image_url': 'https://cdn.myanimelist.net/images/anime/4/21027l.jpg'}, 'webp': {'image_url': 'https://cdn.myanimelist.net/images/anime/4/21027.webp', 'small_image_url': 'https://cdn.myanimelist.net/images/anime/4/21027t.webp', 'large_image_url': 'https://cdn.myanimelist.net/images/anime/4/21027l.webp'}}","{'youtube_id': None, 'url': None, 'embed_url': None, 'images': {'image_url': None, 'small_image_url': None, 'medium_image_url': None, 'large_image_url': None, 'maximum_image_url': None}}","""Idaten Jump""",Idaten Jump,韋駄天翔(ジャンプ),[],TV,Manga,52,Finished Airing,False,"{'from': '2005-10-01T00:00:00+00:00', 'to': '2006-09-30T00:00:00+00:00', 'prop': {'from': {'day': 1, 'month': 10, 'year': 2005}, 'to': {'day': 30, 'month': 9, 'year': 2006}}, 'string': 'Oct 1, 2005 to Sep 30, 2006'}",20 min per ep,PG - Children,7.11,8467.0,3334,4692,14436,117,"Sho liked MTB very much and he always practiced at the practice field, “X-Zone”, with his friends, Takumi and Makoto. Takumi was a good mechanic and Makoto was a competitive girl rider. One day, he was challenged by a MTB team, “Shark Tooth”, of Samejima brothers’ betting the X-Zone. For Sho, X-Zone was a memorable place where he had spent days with his dead father, and he couldn’t lose the game. The day came, and during the race with the leader of Shark Tooth, black smoke suddenly covered around, and they were sent to another world. When he came to, he found Kakeru, Makoto, and his MTB, “Flame Caesar”, were also there. While they were wondering what had happened, MTB riders came. They challenged Sho to a MTB bout. They said Sho had to collect 10 pieces of emblems by winning MTB bout, “Idaten Battle”. This is how Sho came down to compete in Idaten Battle at various courses, such as, volcanos, ruins, deserts, snowy montains, and grave yards. Whether will show win the race to come back to his world?",,fall,2005,"{'day': None, 'time': None, 'timezone': None, 'string': 'Unknown'}","[{'mal_id': 10, 'type': 'anime', 'name': 'Production I.G', 'url': 'https://myanimelist.net/anime/producer/10/Production_IG'}, {'mal_id': 16, 'type': 'anime', 'name': 'TV Tokyo', 'url': 'https://myanimelist.net/anime/producer/16/TV_Tokyo'}, {'mal_id': 17, 'type': 'anime', 'name': 'Aniplex', 'url': 'https://myanimelist.net/anime/producer/17/Aniplex'}, {'mal_id': 135, 'type': 'anime', 'name': 'MediaNet', 'url': 'https://myanimelist.net/anime/producer/135/MediaNet'}]",[],"[{'mal_id': 80, 'type': 'anime', 'name': 'Trans Arts', 'url': 'https://myanimelist.net/anime/producer/80/Trans_Arts'}]","[{'mal_id': 30, 'type': 'anime', 'name': 'Sports', 'url': 'https://myanimelist.net/anime/genre/30/Sports'}]",[],"[{'mal_id': 11, 'type': 'anime', 'name': 'Game', 'url': 'https://myanimelist.net/anime/genre/11/Game'}, {'mal_id': 23, 'type': 'anime', 'name': 'School', 'url': 'https://myanimelist.net/anime/genre/23/School'}]",[]
915,https://myanimelist.net/anime/915/Ginga_Densetsu_Weed,"{'jpg': {'image_url': 'https://cdn.myanimelist.net/images/anime/5/74037.jpg', 'small_image_url': 'https://cdn.myanimelist.net/images/anime/5/74037t.jpg', 'large_image_url': 'https://cdn.myanimelist.net/images/anime/5/74037l.jpg'}, 'webp': {'image_url': 'https://cdn.myanimelist.net/images/anime/5/74037.webp', 'small_image_url': 'https://cdn.myanimelist.net/images/anime/5/74037t.webp', 'large_image_url': 'https://cdn.myanimelist.net/images/anime/5/74037l.webp'}}","{'youtube_id': None, 'url': None, 'embed_url': None, 'images': {'image_url': None, 'small_image_url': None, 'medium_image_url': None, 'large_image_url': None, 'maximum_image_url': None}}","""Ginga Densetsu Weed""",,銀牙伝説ウィード,['Ginga Legend Weed'],TV,Manga,26,Finished Airing,False,"{'from': '2005-11-03T00:00:00+00:00', 'to': '2006-05-11T00:00:00+00:00', 'prop': {'from': {'day': 3, 'month': 11, 'year': 2005}, 'to': {'day': 11, 'month': 5, 'year': 2006}}, 'string': 'Nov 3, 2005 to May 11, 2006'}",24 min per ep,PG-13 - Teens 13 or older,7.22,6907.0,2814,4764,13804,231,"A dog named Weed happens to hear that he is the son of Gin, the great leader of Ohu who lead the dogs of Ohu to victory in a fight against monsterous bear, Akakabuto. Weed wants to find his father no matter what. On a journey to find his father Weed meets many friends and enemies. (Source: ANN)",,fall,2005,"{'day': None, 'time': None, 'timezone': None, 'string': 'Unknown'}","[{'mal_id': 139, 'type': 'anime', 'name': 'Nihon Ad Systems', 'url': 'https://myanimelist.net/anime/producer/139/Nihon_Ad_Systems'}, {'mal_id': 147, 'type': 'anime', 'name': 'SKY Perfect Well Think', 'url': 'https://myanimelist.net/anime/producer/147/SKY_Perfect_Well_Think'}]",[],"[{'mal_id': 37, 'type': 'anime', 'name': 'Studio Deen', 'url': 'https://myanimelist.net/anime/producer/37/Studio_Deen'}]","[{'mal_id': 2, 'type': 'anime', 'name': 'Adventure', 'url': 'https://myanimelist.net/anime/genre/2/Adventure'}, {'mal_id': 8, 'type': 'anime', 'name': 'Drama', 'url': 'https://myanimelist.net/anime/genre/8/Drama'}]",[],[],"[{'mal_id': 27, 'type': 'anime', 'name': 'Shounen', 'url': 'https://myanimelist.net/anime/genre/27/Shounen'}]"
69,https://myanimelist.net/anime/69/Cluster_Edge,"{'jpg': {'image_url': 'https://cdn.myanimelist.net/images/anime/1980/103243.jpg', 'small_image_url': 'https://cdn.myanimelist.net/images/anime/1980/103243t.jpg', 'large_image_url': 'https://cdn.myanimelist.net/images/anime/1980/103243l.jpg'}, 'webp': {'image_url': 'https://cdn.myanimelist.net/images/anime/1980/103243.webp', 'small_image_url': 'https://cdn.myanimelist.net/images/anime/1980/103243t.webp', 'large_image_url': 'https://cdn.myanimelist.net/images/anime/1980/103243l.webp'}}","{'youtube_id': None, 'url': None, 'embed_url': None, 'images': {'image_url': None, 'small_image_url': None, 'medium_image_url': None, 'large_image_url': None, 'maximum_image_url': None}}","""Cluster Edge""",,CLUSTER EDGE（クラスターエッジ）,[],TV,Original,25,Finished Airing,False,"{'from': '2005-10-05T00:00:00+00:00', 'to': '2006-03-29T00:00:00+00:00', 'prop': {'from': {'day': 5, 'month': 10, 'year': 2005}, 'to': {'day': 29, 'month': 3, 'year': 2006}}, 'string': 'Oct 5, 2005 to Mar 29, 2006'}",24 min per ep,PG-13 - Teens 13 or older,6.33,2536.0,7034,5421,9938,12,"Cluster Edge Academy isn't just any school; it's THE school, where the offspring of the elite come together to prepare for their roles running a world where artificial soldiers and religious sects are major factors in the battle for total control. Which may be part of why new transfer student Agate Fluorite doesn't quite seem to fit in. It's not just that Agate's enthusiastic attitude stands out among the somber, brooding balance of the student body. There's something about him that demands notice, even from jaded honors students like Beryl Jasper, and from the moment of arrival he's been at the center of a series of mysteries that not even Agate understands. Because Agate's not just another student, he's part of a something so momentous, and dangerous, that the world that built Cluster Edge may not survive its passing. (Source: Sentai Filmworks)",,fall,2005,"{'day': 'Wednesdays', 'time': '01:00', 'timezone': 'Asia/Tokyo', 'string': 'Wednesdays at 01:00 (JST)'}","[{'mal_id': 23, 'type': 'anime', 'name': 'Bandai Visual', 'url': 'https://myanimelist.net/anime/producer/23/Bandai_Visual'}, {'mal_id': 2135, 'type': 'anime', 'name': 'Imagine', 'url': 'https://myanimelist.net/anime/producer/2135/Imagine'}]","[{'mal_id': 376, 'type': 'anime', 'name': 'Sentai Filmworks', 'url': 'https://myanimelist.net/anime/producer/376/Sentai_Filmworks'}]","[{'mal_id': 14, 'type': 'anime', 'name': 'Sunrise', 'url': 'https://myanimelist.net/anime/producer/14/Sunrise'}]","[{'mal_id': 1, 'type': 'anime', 'name': 'Action', 'url': 'https://myanimelist.net/anime/genre/1/Action'}, {'mal_id': 10, 'type': 'anime', 'name': 'Fantasy', 'url': 'https://myanimelist.net/anime/genre/10/Fantasy'}, {'mal_id': 24, 'type': 'anime', 'name': 'Sci-Fi', 'url': 'https://myanimelist.net/anime/genre/24/Sci-Fi'}]",[],"[{'mal_id': 38, 'type': 'anime', 'name': 'Military', 'url': 'https://myanimelist.net/anime/genre/38/Military'}]",[]
2110,https://myanimelist.net/anime/2110/RockmanEXE_Beast,"{'jpg': {'image_url': 'https://cdn.myanimelist.net/images/anime/1358/98824.jpg', 'small_image_url': 'https://cdn.myanimelist.net/images/anime/1358/98824t.jpg', 'large_image_url': 'https://cdn.myanimelist.net/images/anime/1358/98824l.jpg'}, 'webp': {'image_url': 'https://cdn.myanimelist.net/images/anime/1358/98824.webp', 'small_image_url': 'https://cdn.myanimelist.net/images/anime/1358/98824t.webp', 'large_image_url': 'https://cdn.myanimelist.net/images/anime/1358/98824l.webp'}}","{'youtube_id': None, 'url': None, 'embed_url': None, 'images': {'image_url': None, 'small_image_url': None, 'medium_image_url': None, 'large_image_url': None, 'maximum_image_url': None}}","""Rockman.EXE Beast""",,ロックマン エグゼ ＢＥＡＳＴ,['Rockman EXE Beast'],TV,Game,25,Finished Airing,False,"{'from': '2005-10-01T00:00:00+00:00', 'to': '2006-04-01T00:00:00+00:00', 'prop': {'from': {'day': 1, 'month': 10, 'year': 2005}, 'to': {'day': 1, 'month': 4, 'year': 2006}}, 'string': 'Oct 1, 2005 to Apr 1, 2006'}",25 min per ep,PG - Children,7.05,2740.0,3613,6134,7401,14,"Trill, a mysterious navi said to have originated from the world of Beyondard, is discovered. And new beast-type enemies, the Zoanoroids, want him for his special power. Netto Hikari and Rockman must protect their new friend while they try to figure out what Trill is really and his connection to the two legendary cyber beasts, Grega and Faltzer. (Source: ANN)",,fall,2005,"{'day': None, 'time': None, 'timezone': None, 'string': 'Unknown'}","[{'mal_id': 16, 'type': 'anime', 'name': 'TV Tokyo', 'url': 'https://myanimelist.net/anime/producer/16/TV_Tokyo'}, {'mal_id': 62, 'type': 'anime', 'name': 'Shogakukan-Shueisha Productions', 'url': 'https://myanimelist.net/anime/producer/62/Shogakukan-Shueisha_Productions'}, {'mal_id': 474, 'type': 'anime', 'name': 'Shogakukan Music & Digital Entertainment', 'url': 'https://myanimelist.net/anime/producer/474/Shogakukan_Music___Digital_Entertainment'}]",[],"[{'mal_id': 27, 'type': 'anime', 'name': 'Xebec', 'url': 'https://myanimelist.net/anime/producer/27/Xebec'}]","[{'mal_id': 1, 'type': 'anime', 'name': 'Action', 'url': 'https://myanimelist.net/anime/genre/1/Action'}, {'mal_id': 2, 'type': 'anime', 'name': 'Adventure', 'url': 'https://myanimelist.net/anime/genre/2/Adventure'}, {'mal_id': 24, 'type': 'anime', 'name': 'Sci-Fi', 'url': 'https://myanimelist.net/anime/genre/24/Sci-Fi'}]",[],"[{'mal_id': 11, 'type': 'anime', 'name': 'Game', 'url': 'https://myanimelist.net/anime/genre/11/Game'}, {'mal_id': 18, 'type': 'anime', 'name': 'Mecha', 'url': 'https://myanimelist.net/anime/genre/18/Mecha'}]","[{'mal_id': 27, 'type': 'anime', 'name': 'Shounen', 'url': 'https://myanimelist.net/anime/genre/27/Shounen'}]"
1123,https://myanimelist.net/anime/1123/Bouken_Ou_Beet_Excellion,"{'jpg': {'image_url': 'https://cdn.myanimelist.net/images/anime/4/21570.jpg', 'small_image_url': 'https://cdn.myanimelist.net/images/anime/4/21570t.jpg', 'large_image_url': 'https://cdn.myanimelist.net/images/anime/4/21570l.jpg'}, 'webp': {'image_url': 'https://cdn.myanimelist.net/images/anime/4/21570.webp', 'small_image_url': 'https://cdn.myanimelist.net/images/anime/4/21570t.webp', 'large_image_url': 'https://cdn.myanimelist.net/images/anime/4/21570l.webp'}}","{'youtube_id': None, 'url': None, 'embed_url': None, 'images': {'image_url': None, 'small_image_url': None, 'medium_image_url': None, 'large_image_url': None, 'maximum_image_url': None}}","""Bouken Ou Beet Excellion""",Beet the Vandel Buster Excellion,冒険王ビィト エクセリオン,['Adventure King Beet Excellion'],TV,Manga,25,Finished Airing,False,"{'from': '2005-10-06T00:00:00+00:00', 'to': '2006-03-30T00:00:00+00:00', 'prop': {'from': {'day': 6, 'month': 10, 'year': 2005}, 'to': {'day': 30, 'month': 3, 'year': 2006}}, 'string': 'Oct 6, 2005 to Mar 30, 2006'}",24 min per ep,PG - Children,6.69,3140.0,5164,6199,7241,6,"It is the dark century and the people are suffering under the rule of the devil, Vandel, who is able to manipulate monsters. The Vandel Busters are a group of people who hunt these devils, and among them, the Zenon Squad is known to be the strongest busters on the continent. A young boy, Beet, dreams of joining the Zenon Squad. However, one day, as a result of Beet's fault, the Zenon squad was defeated by the devil, Beltose. The five dying busters sacrificed their life power into their five weapons, Saiga. After giving their weapons to Beet, they passed away. Years have passed since then and the young Vandel Buster, Beet, begins his adventure to carry out the Zenon Squad's will to put an end to the dark century.",,fall,2005,"{'day': 'Thursdays', 'time': '18:30', 'timezone': 'Asia/Tokyo', 'string': 'Thursdays at 18:30 (JST)'}","[{'mal_id': 16, 'type': 'anime', 'name': 'TV Tokyo', 'url': 'https://myanimelist.net/anime/producer/16/TV_Tokyo'}, {'mal_id': 53, 'type': 'anime', 'name': 'Dentsu', 'url': 'https://myanimelist.net/anime/producer/53/Dentsu'}]",[],"[{'mal_id': 18, 'type': 'anime', 'name': 'Toei Animation', 'url': 'https://myanimelist.net/anime/producer/18/Toei_Animation'}]","[{'mal_id': 2, 'type': 'anime', 'name': 'Adventure', 'url': 'https://myanimelist.net/anime/genre/2/Adventure'}, {'mal_id': 10, 'type': 'anime', 'name': 'Fantasy', 'url': 'https://myanimelist.net/anime/genre/10/Fantasy'}, {'mal_id': 37, 'type': 'anime', 'name': 'Supernatural', 'url': 'https://myanimelist.net/anime/genre/37/Supernatural'}]",[],[],"[{'mal_id': 27, 'type': 'anime', 'name': 'Shounen', 'url': 'https://myanimelist.net/anime/genre/27/Shounen'}]"
913,https://myanimelist.net/anime/913/Kakutou_Bijin_Wulong,"{'jpg': {'image_url': 'https://cdn.myanimelist.net/images/anime/7/2768.jpg', 'small_image_url': 'https://cdn.myanimelist.net/images/anime/7/2768t.jpg', 'large_image_url': 'https://cdn.myanimelist.net/images/anime/7/2768l.jpg'}, 'webp': {'image_url': 'https://cdn.myanimelist.net/images/anime/7/2768.webp', 'small_image_url': 'https://cdn.myanimelist.net/images/anime/7/2768t.webp', 'large_image_url': 'https://cdn.myanimelist.net/images/anime/7/2768l.webp'}}","{'youtube_id': None, 'url': None, 'embed_url': None, 'images': {'image_url': None, 'small_image_url': None, 'medium_image_url': None, 'large_image_url': None, 'maximum_image_url': None}}","""Kakutou Bijin Wulong""",Fighting Beauty Wulong,格闘美神 武龍,[],TV,Manga,25,Finished Airing,False,"{'from': '2005-10-10T00:00:00+00:00', 'to': '2006-03-26T00:00:00+00:00', 'prop': {'from': {'day': 10, 'month': 10, 'year': 2005}, 'to': {'day': 26, 'month': 3, 'year': 2006}}, 'string': 'Oct 10, 2005 to Mar 26, 2006'}",25 min per ep,R - 17+ (violence & profanity),6.6,1222.0,5677,6951,5379,6,"At first glance, Mao Ran is a normal cute girl, but she is a master of a martial arts handed down by Mao family. One day, she is tricked by her grandfather, and forced to take part in the fighting match, ""Prime Mat"". First, she is reluctant to fight, but fighting against the rivals, she is gradually fascinated by the ""fighting"". (Source: AnimeNfo)",,fall,2005,"{'day': None, 'time': None, 'timezone': None, 'string': 'Unknown'}",[],[],"[{'mal_id': 73, 'type': 'anime', 'name': 'TMS Entertainment', 'url': 'https://myanimelist.net/anime/producer/73/TMS_Entertainment'}]","[{'mal_id': 1, 'type': 'anime', 'name': 'Action', 'url': 'https://myanimelist.net/anime/genre/1/Action'}, {'mal_id': 9, 'type': 'anime', 'name': 'Ecchi', 'url': 'https://myanimelist.net/anime/genre/9/Ecchi'}]",[],"[{'mal_id': 17, 'type': 'anime', 'name': 'Martial Arts', 'url': 'https://myanimelist.net/anime/genre/17/Martial_Arts'}]",[]
1193,https://myanimelist.net/anime/1193/Happy_Seven__The_TV_Manga,"{'jpg': {'image_url': 'https://cdn.myanimelist.net/images/anime/12/5509.jpg', 'small_image_url': 'https://cdn.myanimelist.net/images/anime/12/5509t.jpg', 'large_image_url': 'https://cdn.myanimelist.net/images/anime/12/5509l.jpg'}, 'webp': {'image_url': 'https://cdn.myanimelist.net/images/anime/12/5509.webp', 'small_image_url': 'https://cdn.myanimelist.net/images/anime/12/5509t.webp', 'large_image_url': 'https://cdn.myanimelist.net/images/anime/12/5509l.webp'}}","{'youtube_id': None, 'url': None, 'embed_url': None, 'images': {'image_url': None, 'small_image_url': None, 'medium_image_url': None, 'large_image_url': None, 'maximum_image_url': None}}","""Happy Seven: The TV Manga""",,はっぴぃセブン ～ざ・テレビまんが～,['Happy 7'],TV,Light novel,13,Finished Airing,False,"{'from': '2005-10-02T00:00:00+00:00', 'to': '2005-12-25T00:00:00+00:00', 'prop': {'from': {'day': 2, 'month': 10, 'year': 2005}, 'to': {'day': 25, 'month': 12, 'year': 2005}}, 'string': 'Oct 2, 2005 to Dec 25, 2005'}",24 min per ep,PG - Children,6.27,1426.0,7351,7192,4942,5,"Amano Sakogami is a girl who has an unnatural amount of bad luck. One day, she stumbles into the clubroom of the Better Fortune Research Organization, which consists of a boy and seven other girls who secretly use the power of the luck deities to fight against the Magatsugami, monsters who can affect a person's luck & well-being. Amano soon becomes the club's manager, and joins the club in their fight against the Magatsugami and their controller, Kukitomoe. (Source: ANN)",,fall,2005,"{'day': None, 'time': None, 'timezone': None, 'string': 'Unknown'}","[{'mal_id': 63, 'type': 'anime', 'name': 'Trinet Entertainment', 'url': 'https://myanimelist.net/anime/producer/63/Trinet_Entertainment'}, {'mal_id': 208, 'type': 'anime', 'name': 'Three Fat Samurai', 'url': 'https://myanimelist.net/anime/producer/208/Three_Fat_Samurai'}]",[],"[{'mal_id': 101, 'type': 'anime', 'name': 'Studio Hibari', 'url': 'https://myanimelist.net/anime/producer/101/Studio_Hibari'}]","[{'mal_id': 4, 'type': 'anime', 'name': 'Comedy', 'url': 'https://myanimelist.net/anime/genre/4/Comedy'}, {'mal_id': 10, 'type': 'anime', 'name': 'Fantasy', 'url': 'https://myanimelist.net/anime/genre/10/Fantasy'}]",[],"[{'mal_id': 23, 'type': 'anime', 'name': 'School', 'url': 'https://myanimelist.net/anime/genre/23/School'}]",[]
1845,https://myanimelist.net/anime/1845/Gaiking__Legend_of_Daiku-Maryu,"{'jpg': {'image_url': 'https://cdn.myanimelist.net/images/anime/13/74215.jpg', 'small_image_url': 'https://cdn.myanimelist.net/images/anime/13/74215t.jpg', 'large_image_url': 'https://cdn.myanimelist.net/images/anime/13/74215l.jpg'}, 'webp': {'image_url': 'https://cdn.myanimelist.net/images/anime/13/74215.webp', 'small_image_url': 'https://cdn.myanimelist.net/images/anime/13/74215t.webp', 'large_image_url': 'https://cdn.myanimelist.net/images/anime/13/74215l.webp'}}","{'youtube_id': None, 'url': None, 'embed_url': None, 'images': {'image_url': None, 'small_image_url': None, 'medium_image_url': None, 'large_image_url': None, 'maximum_image_url': None}}","""Gaiking: Legend of Daiku-Maryu""",,ガイキング Legend of Daiku-Maryu,"['Great Sky Demon Dragon Gaiking', 'Gaiking: Legend of Daikuu-Maryuu']",TV,Original,39,Finished Airing,False,"{'from': '2005-11-12T00:00:00+00:00', 'to': '2006-09-24T00:00:00+00:00', 'prop': {'from': {'day': 12, 'month': 11, 'year': 2005}, 'to': {'day': 24, 'month': 9, 'year': 2006}}, 'string': 'Nov 12, 2005 to Sep 24, 2006'}",25 min per ep,G - All Ages,7.13,1182.0,3236,7558,4377,10,"A boy, Tsuwabaki Daiya found a black fire in an ocean when he and his father were in a small boat. A big monster came out of the fire, and the father and the crews were disappeared into the sea. When he was about to become the next victim, a large mecka dragon appeared and saved him. 5 years later since then, Daiya becomes a junior high school student. A big monster reappear, and he meets the mecha dragon,""Daiku Maryu"". The head of the dragon separates from the body, and it turns into the body of a super robot, Gaiking. He gets in Gaiking, fights against the monster, and beats it. He learns that there is an enemy that plots to conquer the world, and he leaves for another world, Darius, to stop the plot. (Source: AnimeNfo)",,fall,2005,"{'day': None, 'time': None, 'timezone': None, 'string': 'Unknown'}",[],[],"[{'mal_id': 18, 'type': 'anime', 'name': 'Toei Animation', 'url': 'https://myanimelist.net/anime/producer/18/Toei_Animation'}]","[{'mal_id': 1, 'type': 'anime', 'name': 'Action', 'url': 'https://myanimelist.net/anime/genre/1/Action'}, {'mal_id': 24, 'type': 'anime', 'name': 'Sci-Fi', 'url': 'https://myanimelist.net/anime/genre/24/Sci-Fi'}]",[],"[{'mal_id': 18, 'type': 'anime', 'name': 'Mecha', 'url': 'https://myanimelist.net/anime/genre/18/Mecha'}]",[]
858,https://myanimelist.net/anime/858/Gunparade_Orchestra,"{'jpg': {'image_url': 'https://cdn.myanimelist.net/images/anime/9/9074.jpg', 'small_image_url': 'https://cdn.myanimelist.net/images/anime/9/9074t.jpg', 'large_image_url': 'https://cdn.myanimelist.net/images/anime/9/9074l.jpg'}, 'webp': {'image_url': 'https://cdn.myanimelist.net/images/anime/9/9074.webp', 'small_image_url': 'https://cdn.myanimelist.net/images/anime/9/9074t.webp', 'large_image_url': 'https://cdn.myanimelist.net/images/anime/9/9074l.webp'}}","{'youtube_id': None, 'url': None, 'embed_url': None, 'images': {'image_url': None, 'small_image_url': None, 'medium_image_url': None, 'large_image_url': None, 'maximum_image_url': None}}","""Gunparade Orchestra""",Gunparade Orchestra,ガンパレード・オーケストラ,['GPO'],TV,Game,24,Finished Airing,False,"{'from': '2005-10-04T00:00:00+00:00', 'to': '2006-03-28T00:00:00+00:00', 'prop': {'from': {'day': 4, 'month': 10, 'year': 2005}, 'to': {'day': 28, 'month': 3, 'year': 2006}}, 'string': 'Oct 4, 2005 to Mar 28, 2006'}",25 min per ep,PG-13 - Teens 13 or older,5.85,1011.0,9267,7574,4361,3,"The story focuses and revolves around the 108th Guard Squad, stationed in Aomori. A poorly equipped unit with very little military standing, it is often viewed as a 'reject camp' for pilots not making the grade for the elite units based in Hokkaido. The apparent helpless nature of this force is hardly a deterrent for the encroaching enemy armies, ever closing in on both the 108th and the rest of the empire. The young pilots of the 108th, who had dreamed on returning home, are plunged forcefully and unwillingly into a war. (Source: ANN)",,fall,2005,"{'day': None, 'time': None, 'timezone': None, 'string': 'Unknown'}",[],[],"[{'mal_id': 112, 'type': 'anime', 'name': ""Brain's Base"", 'url': 'https://myanimelist.net/anime/producer/112/Brains_Base'}]","[{'mal_id': 8, 'type': 'anime', 'name': 'Drama', 'url': 'https://myanimelist.net/anime/genre/8/Drama'}, {'mal_id': 22, 'type': 'anime', 'name': 'Romance', 'url': 'https://myanimelist.net/anime/genre/22/Romance'}, {'mal_id': 24, 'type': 'anime', 'name': 'Sci-Fi', 'url': 'https://myanimelist.net/anime/genre/24/Sci-Fi'}, {'mal_id': 36, 'type': 'anime', 'name': 'Slice of Life', 'url': 'https://myanimelist.net/anime/genre/36/Slice_of_Life'}]",[],"[{'mal_id': 18, 'type': 'anime', 'name': 'Mecha', 'url': 'https://myanimelist.net/anime/genre/18/Mecha'}, {'mal_id': 38, 'type': 'anime', 'name': 'Military', 'url': 'https://myanimelist.net/anime/genre/38/Military'}]",[]
1778,https://myanimelist.net/anime/1778/Dae_Jang_Geum__Jang_Geums_Dream,"{'jpg': {'image_url': 'https://cdn.myanimelist.net/images/anime/1/1778.jpg', 'small_image_url': 'https://cdn.myanimelist.net/images/anime/1/1778t.jpg', 'large_image_url': 'https://cdn.myanimelist.net/images/anime/1/1778l.jpg'}, 'webp': {'image_url': 'https://cdn.myanimelist.net/images/anime/1/1778.webp', 'small_image_url': 'https://cdn.myanimelist.net/images/anime/1/1778t.webp', 'large_image_url': 'https://cdn.myanimelist.net/images/anime/1/1778l.webp'}}","{'youtube_id': None, 'url': None, 'embed_url': None, 'images': {'image_url': None, 'small_image_url': None, 'medium_image_url': None, 'large_image_url': None, 'maximum_image_url': None}}","""Dae Jang Geum: Jang Geum's Dream""",,少女チャングムの夢,"['Shoujo Changumu no Yume', ""Janggeum's Dream"", 'Changumu no Yume - Dae Jang Geum', '장금이의 꿈']",TV,Other,26,Finished Airing,False,"{'from': '2005-10-29T00:00:00+00:00', 'to': '2006-04-29T00:00:00+00:00', 'prop': {'from': {'day': 29, 'month': 10, 'year': 2005}, 'to': {'day': 29, 'month': 4, 'year': 2006}}, 'string': 'Oct 29, 2005 to Apr 29, 2006'}",24 min per ep,PG - Children,7.17,1136.0,3023,8050,3662,26,Story is about the girl Jang Geum who wants to be a cook. She gets accepted as a palace servant. Clever and cheerful Jang Geum quickly finds friends. But all to soon she encounters intrigue and corruption. A Korean/Japanese joint production.,,fall,2005,"{'day': None, 'time': None, 'timezone': None, 'string': 'Unknown'}","[{'mal_id': 367, 'type': 'anime', 'name': 'Heewon Entertainment', 'url': 'https://myanimelist.net/anime/producer/367/Heewon_Entertainment'}]",[],[],"[{'mal_id': 2, 'type': 'anime', 'name': 'Adventure', 'url': 'https://myanimelist.net/anime/genre/2/Adventure'}, {'mal_id': 4, 'type': 'anime', 'name': 'Comedy', 'url': 'https://myanimelist.net/anime/genre/4/Comedy'}, {'mal_id': 47, 'type': 'anime', 'name': 'Gourmet', 'url': 'https://myanimelist.net/anime/genre/47/Gourmet'}]",[],"[{'mal_id': 13, 'type': 'anime', 'name': 'Historical', 'url': 'https://myanimelist.net/anime/genre/13/Historical'}]",[]
