mal_id,url,images,trailer,title,title_english,title_japanese,title_synonyms,type,source,episodes,status,airing,aired,duration,rating,score,scored_by,rank,popularity,members,favorites,synopsis,background,season,year,broadcast,producers,licensors,studios,genres,explicit_genres,themes,demographics
469,https://myanimelist.net/anime/469/Karin,"{'jpg': {'image_url': 'https://cdn.myanimelist.net/images/anime/3/46833.jpg', 'small_image_url': 'https://cdn.myanimelist.net/images/anime/3/46833t.jpg', 'large_image_url': 'https://cdn.myanimelist.net/images/anime/3/46833l.jpg'}, 'webp': {'image_url': 'https://cdn.myanimelist.net/images/anime/3/46833.webp', 'small_image_url': 'https://cdn.myanimelist.net/images/anime/3/46833t.webp', 'large_image_url': 'https://cdn.myanimelist.net/images/anime/3/46833l.webp'}}","{'youtube_id': None, 'url': None, 'embed_url': None, 'images': {'image_url': None, 'small_image_url': None, 'medium_image_url': None, 'large_image_url': None, 'maximum_image_url': None}}","""Karin""",Karin,かりん,['Chibi Vampire Karin'],TV,Manga,24,Finished Airing,False,"{'from': '2005-11-03T00:00:00+00:00', 'to': '2006-05-11T00:00:00+00:00', 'prop': {'from': {'day': 3, 'month': 11, 'year': 2005}, 'to': {'day': 11, 'month': 5, 'year': 2006}}, 'string': 'Nov 3, 2005 to May 11, 2006'}",23 min per ep,PG-13 - Teens 13 or older,7.13,84578.0,3249,1109,166138,717,"Vampires—supernatural beings that feed on the life essence of the unsuspecting at night—have been around for centuries. However, high schooler Karin Maaka is unusual, even among her own kind. Unlike her vampire family, ever since she was a child, Karin has suffered from polycythemia: a rare disorder which causes her to periodically produce excessive amounts of blood. And the more blood she produces, the more anemic and lightheaded she gets, ultimately leading to frequent nosebleeds. Her only solution? Force her excess blood onto random strangers, which surprisingly causes these ""victims"" to become livelier and happier than before. With her siblings—Anju, her reserved yet affectionate younger sister, and Ren, her womanizing elder brother—helping her abilities remain a secret by altering the affected humans' memories, no one is the wiser. That is, until Karin's newly transferred classmate, Kenta Usui, finds her behavior suspicious. And to make matters even more complicated, Karin feels her blood reacting unusually to Kenta's presence. [Written by MAL Rewrite]",,fall,2005,"{'day': 'Fridays', 'time': '00:00', 'timezone': 'Asia/Tokyo', 'string': 'Fridays at 00:00 (JST)'}","[{'mal_id': 33, 'type': 'anime', 'name': 'WOWOW', 'url': 'https://myanimelist.net/anime/producer/33/WOWOW'}, {'mal_id': 61, 'type': 'anime', 'name': 'Frontier Works', 'url': 'https://myanimelist.net/anime/producer/61/Frontier_Works'}, {'mal_id': 113, 'type': 'anime', 'name': 'Kadokawa Shoten', 'url': 'https://myanimelist.net/anime/producer/113/Kadokawa_Shoten'}, {'mal_id': 213, 'type': 'anime', 'name': 'Half H.P Studio', 'url': 'https://myanimelist.net/anime/producer/213/Half_HP_Studio'}]","[{'mal_id': 102, 'type': 'anime', 'name': 'Funimation', 'url': 'https://myanimelist.net/anime/producer/102/Funimation'}, {'mal_id': 1459, 'type': 'anime', 'name': 'Geneon Entertainment USA', 'url': 'https://myanimelist.net/anime/producer/1459/Geneon_Entertainment_USA'}]","[{'mal_id': 7, 'type': 'anime', 'name': 'J.C.Staff', 'url': 'https://myanimelist.net/anime/producer/7/JCStaff'}]","[{'mal_id': 4, 'type': 'anime', 'name': 'Comedy', 'url': 'https://myanimelist.net/anime/genre/4/Comedy'}, {'mal_id': 22, 'type': 'anime', 'name': 'Romance', 'url': 'https://myanimelist.net/anime/genre/22/Romance'}, {'mal_id': 37, 'type': 'anime', 'name': 'Supernatural', 'url': 'https://myanimelist.net/anime/genre/37/Supernatural'}]",[],"[{'mal_id': 23, 'type': 'anime', 'name': 'School', 'url': 'https://myanimelist.net/anime/genre/23/School'}, {'mal_id': 32, 'type': 'anime', 'name': 'Vampire', 'url': 'https://myanimelist.net/anime/genre/32/Vampire'}]","[{'mal_id': 27, 'type': 'anime', 'name': 'Shounen', 'url': 'https://myanimelist.net/anime/genre/27/Shounen'}]"
477,https://myanimelist.net/anime/477/Aria_the_Animation,"{'jpg': {'image_url': 'https://cdn.myanimelist.net/images/anime/2/77620.jpg', 'small_image_url': 'https://cdn.myanimelist.net/images/anime/2/77620t.jpg', 'large_image_url': 'https://cdn.myanimelist.net/images/anime/2/77620l.jpg'}, 'webp': {'image_url': 'https://cdn.myanimelist.net/images/anime/2/77620.webp', 'small_image_url': 'https://cdn.myanimelist.net/images/anime/2/77620t.webp', 'large_image_url': 'https://cdn.myanimelist.net/images/anime/2/77620l.webp'}}","{'youtube_id': 'NraaWUZxWZw', 'url': 'https://www.youtube.com/watch?v=NraaWUZxWZw', 'embed_url': 'https://www.youtube.com/embed/NraaWUZxWZw?enablejsapi=1&wmode=opaque&autoplay=1', 'images': {'image_url': 'https://img.youtube.com/vi/NraaWUZxWZw/default.jpg', 'small_image_url': 'https://img.youtube.com/vi/NraaWUZxWZw/sddefault.jpg', 'medium_image_url': 'https://img.youtube.com/vi/NraaWUZxWZw/mqdefault.jpg', 'large_image_url': 'https://img.youtube.com/vi/NraaWUZxWZw/hqdefault.jpg', 'maximum_image_url': 'https://img.youtube.com/vi/NraaWUZxWZw/maxresdefault.jpg'}}","""Aria the Animation""",Aria the Animation,ARIA The ANIMATION,[],TV,Manga,13,Finished Airing,False,"{'from': '2005-10-06T00:00:00+00:00', 'to': '2005-12-29T00:00:00+00:00', 'prop': {'from': {'day': 6, 'month': 10, 'year': 2005}, 'to': {'day': 29, 'month': 12, 'year': 2005}}, 'string': 'Oct 6, 2005 to Dec 29, 2005'}",24 min per ep,G - All Ages,7.68,42607.0,1123,1260,145071,1942,"Drift peacefully into Neo Venezia, a city on the planet Aqua (formerly known as Mars). By the 24th century, humans have found a way to colonize the previously uninhabitable planet. As futuristic as that sounds, Neo Venezia is still teeming with rustic beauty; gondolas on wide canals and waterways are the main mode of transportation. The city itself is a faithful replication of Manhome's (the planet formerly known as Earth) Venice. To make sure that residents and tourists alike get the most from Neo Venezia's many wonders, companies offering guided tours via gondola were formed, one of which is named Aria Company. This is the workplace of Akari Mizunashi, a free spirited teenager from Manhome who is now a novice Undine (the title given to tour guides). Join Akari as she becomes intimately acquainted with other Undine, tourists, Neo Venezia's residents, and even the city itself, learning many valuable life lessons along the way, such as the wonderful truth that there are such things as manmade miracles. [Written by MAL Rewrite]",,fall,2005,"{'day': 'Thursdays', 'time': '01:30', 'timezone': 'Asia/Tokyo', 'string': 'Thursdays at 01:30 (JST)'}","[{'mal_id': 10, 'type': 'anime', 'name': 'Production I.G', 'url': 'https://myanimelist.net/anime/producer/10/Production_IG'}, {'mal_id': 16, 'type': 'anime', 'name': 'TV Tokyo', 'url': 'https://myanimelist.net/anime/producer/16/TV_Tokyo'}, {'mal_id': 109, 'type': 'anime', 'name': 'Shochiku', 'url': 'https://myanimelist.net/anime/producer/109/Shochiku'}, {'mal_id': 1452, 'type': 'anime', 'name': 'Mag Garden', 'url': 'https://myanimelist.net/anime/producer/1452/Mag_Garden'}]","[{'mal_id': 217, 'type': 'anime', 'name': 'Nozomi Entertainment', 'url': 'https://myanimelist.net/anime/producer/217/Nozomi_Entertainment'}]","[{'mal_id': 34, 'type': 'anime', 'name': 'Hal Film Maker', 'url': 'https://myanimelist.net/anime/producer/34/Hal_Film_Maker'}]","[{'mal_id': 10, 'type': 'anime', 'name': 'Fantasy', 'url': 'https://myanimelist.net/anime/genre/10/Fantasy'}, {'mal_id': 24, 'type': 'anime', 'name': 'Sci-Fi', 'url': 'https://myanimelist.net/anime/genre/24/Sci-Fi'}, {'mal_id': 36, 'type': 'anime', 'name': 'Slice of Life', 'url': 'https://myanimelist.net/anime/genre/36/Slice_of_Life'}]",[],[],"[{'mal_id': 27, 'type': 'anime', 'name': 'Shounen', 'url': 'https://myanimelist.net/anime/genre/27/Shounen'}]"
65,https://myanimelist.net/anime/65/Rozen_Maiden__Träumend,"{'jpg': {'image_url': 'https://cdn.myanimelist.net/images/anime/4/10242.jpg', 'small_image_url': 'https://cdn.myanimelist.net/images/anime/4/10242t.jpg', 'large_image_url': 'https://cdn.myanimelist.net/images/anime/4/10242l.jpg'}, 'webp': {'image_url': 'https://cdn.myanimelist.net/images/anime/4/10242.webp', 'small_image_url': 'https://cdn.myanimelist.net/images/anime/4/10242t.webp', 'large_image_url': 'https://cdn.myanimelist.net/images/anime/4/10242l.webp'}}","{'youtube_id': None, 'url': None, 'embed_url': None, 'images': {'image_url': None, 'small_image_url': None, 'medium_image_url': None, 'large_image_url': None, 'maximum_image_url': None}}","""Rozen Maiden: Träumend""",Rozen Maiden: Träumend,ローゼンメイデン トロイメント,['Rozen Maiden 2'],TV,Manga,12,Finished Airing,False,"{'from': '2005-10-21T00:00:00+00:00', 'to': '2006-01-27T00:00:00+00:00', 'prop': {'from': {'day': 21, 'month': 10, 'year': 2005}, 'to': {'day': 27, 'month': 1, 'year': 2006}}, 'string': 'Oct 21, 2005 to Jan 27, 2006'}",24 min per ep,PG-13 - Teens 13 or older,7.63,55208.0,1254,1702,98567,439,"As the story of Rozen Maiden closes, a new chapter begins in Rozen Maiden: Träumend. Shinku and the other sentient dolls of the Rozen Maiden collection are living life as usual at Jun Sakurada's house. Having settled into his role as Shinku's partner in the deadly Alice Game, Jun overcomes his former fears and prepares to return to school. And although Shinku and the other dolls idly pass the days by in the comfort of Jun's home, dark times lie ahead as a new foe presents herself: Barasuishou, the seventh Rozen Maiden. But Barasuishou is a mystery even to her sisters, none of whom have ever laid eyes on her until now. Shinku considers this a sign that the Alice Game is coming to an end, meaning the dolls will soon be forced to fight one another. Haunted by the upcoming battle and nightmares concerning another doll, Shinku begins distancing herself from the others. If she wishes to claim victory, it will come at a high cost—the lives of her sisters. [Written by MAL Rewrite]",,fall,2005,"{'day': 'Fridays', 'time': '01:55', 'timezone': 'Asia/Tokyo', 'string': 'Fridays at 01:55 (JST)'}","[{'mal_id': 71, 'type': 'anime', 'name': 'Mellow Head', 'url': 'https://myanimelist.net/anime/producer/71/Mellow_Head'}, {'mal_id': 145, 'type': 'anime', 'name': 'TBS', 'url': 'https://myanimelist.net/anime/producer/145/TBS'}]","[{'mal_id': 376, 'type': 'anime', 'name': 'Sentai Filmworks', 'url': 'https://myanimelist.net/anime/producer/376/Sentai_Filmworks'}, {'mal_id': 1459, 'type': 'anime', 'name': 'Geneon Entertainment USA', 'url': 'https://myanimelist.net/anime/producer/1459/Geneon_Entertainment_USA'}]","[{'mal_id': 70, 'type': 'anime', 'name': 'Nomad', 'url': 'https://myanimelist.net/anime/producer/70/Nomad'}]","[{'mal_id': 1, 'type': 'anime', 'name': 'Action', 'url': 'https://myanimelist.net/anime/genre/1/Action'}, {'mal_id': 4, 'type': 'anime', 'name': 'Comedy', 'url': 'https://myanimelist.net/anime/genre/4/Comedy'}, {'mal_id': 8, 'type': 'anime', 'name': 'Drama', 'url': 'https://myanimelist.net/anime/genre/8/Drama'}]",[],[],"[{'mal_id': 42, 'type': 'anime', 'name': 'Seinen', 'url': 'https://myanimelist.net/anime/genre/42/Seinen'}]"
658,https://myanimelist.net/anime/658/Touhai_Densetsu_Akagi__Yami_ni_Maiorita_Tensai,"{'jpg': {'image_url': 'https://cdn.myanimelist.net/images/anime/11/53587.jpg', 'small_image_url': 'https://cdn.myanimelist.net/images/anime/11/53587t.jpg', 'large_image_url': 'https://cdn.myanimelist.net/images/anime/11/53587l.jpg'}, 'webp': {'image_url': 'https://cdn.myanimelist.net/images/anime/11/53587.webp', 'small_image_url': 'https://cdn.myanimelist.net/images/anime/11/53587t.webp', 'large_image_url': 'https://cdn.myanimelist.net/images/anime/11/53587l.webp'}}","{'youtube_id': None, 'url': None, 'embed_url': None, 'images': {'image_url': None, 'small_image_url': None, 'medium_image_url': None, 'large_image_url': None, 'maximum_image_url': None}}","""Touhai Densetsu Akagi: Yami ni Maiorita Tensai""",Akagi,闘牌伝説アカギ　闇に舞い降りた天才,"['Mahjong Legend Akagi: The Genius Who Descended Into the Darkness', 'The Legend of Mahjong: Akagi']",TV,Manga,26,Finished Airing,False,"{'from': '2005-10-05T00:00:00+00:00', 'to': '2006-03-29T00:00:00+00:00', 'prop': {'from': {'day': 5, 'month': 10, 'year': 2005}, 'to': {'day': 29, 'month': 3, 'year': 2006}}, 'string': 'Oct 5, 2005 to Mar 29, 2006'}",23 min per ep,R - 17+ (violence & profanity),7.93,38143.0,655,1794,90912,1102,"While mahjong is a game that is often played with family and friends, it is also a game that is played in the darkest corners of society. Nangou is a compulsive gambler who has accumulated debt over three million yen. In a last ditch attempt to clear his record, he decides to wager his life on a game of mahjong with the mafia. Unfortunately, as the game progresses, Nangou only moves further from the prize and closer to death. When all hope seems lost, the game parlor is suddenly intruded upon by Shigeru Akagi, a young boy on the run from the police. Desperate to turn the game around, Nangou hands the game over to Akagi after teaching him a few of the rules. The mafia can only smirk as Akagi sits down to play. However, they soon come to learn that Akagi is a natural-born gambler. An imposing figure who does not fear death. One who is destined to become a legend. [Written by MAL Rewrite]",,fall,2005,"{'day': None, 'time': None, 'timezone': None, 'string': 'Wednesdays at Unknown'}","[{'mal_id': 29, 'type': 'anime', 'name': 'VAP', 'url': 'https://myanimelist.net/anime/producer/29/VAP'}, {'mal_id': 1003, 'type': 'anime', 'name': 'Nippon Television Network', 'url': 'https://myanimelist.net/anime/producer/1003/Nippon_Television_Network'}]",[],"[{'mal_id': 11, 'type': 'anime', 'name': 'Madhouse', 'url': 'https://myanimelist.net/anime/producer/11/Madhouse'}]","[{'mal_id': 41, 'type': 'anime', 'name': 'Suspense', 'url': 'https://myanimelist.net/anime/genre/41/Suspense'}]",[],"[{'mal_id': 11, 'type': 'anime', 'name': 'Game', 'url': 'https://myanimelist.net/anime/genre/11/Game'}, {'mal_id': 40, 'type': 'anime', 'name': 'Psychological', 'url': 'https://myanimelist.net/anime/genre/40/Psychological'}]","[{'mal_id': 42, 'type': 'anime', 'name': 'Seinen', 'url': 'https://myanimelist.net/anime/genre/42/Seinen'}]"
584,https://myanimelist.net/anime/584/Noein__Mou_Hitori_no_Kimi_e,"{'jpg': {'image_url': 'https://cdn.myanimelist.net/images/anime/1/584.jpg', 'small_image_url': 'https://cdn.myanimelist.net/images/anime/1/584t.jpg', 'large_image_url': 'https://cdn.myanimelist.net/images/anime/1/584l.jpg'}, 'webp': {'image_url': 'https://cdn.myanimelist.net/images/anime/1/584.webp', 'small_image_url': 'https://cdn.myanimelist.net/images/anime/1/584t.webp', 'large_image_url': 'https://cdn.myanimelist.net/images/anime/1/584l.webp'}}","{'youtube_id': 'HNoXnl9USWo', 'url': 'https://www.youtube.com/watch?v=HNoXnl9USWo', 'embed_url': 'https://www.youtube.com/embed/HNoXnl9USWo?enablejsapi=1&wmode=opaque&autoplay=1', 'images': {'image_url': 'https://img.youtube.com/vi/HNoXnl9USWo/default.jpg', 'small_image_url': 'https://img.youtube.com/vi/HNoXnl9USWo/sddefault.jpg', 'medium_image_url': 'https://img.youtube.com/vi/HNoXnl9USWo/mqdefault.jpg', 'large_image_url': 'https://img.youtube.com/vi/HNoXnl9USWo/hqdefault.jpg', 'maximum_image_url': 'https://img.youtube.com/vi/HNoXnl9USWo/maxresdefault.jpg'}}","""Noein: Mou Hitori no Kimi e""",Noein: to your other self,ノエイン もうひとりの君へ,['Noein: Toward Another You'],TV,Original,24,Finished Airing,False,"{'from': '2005-10-12T00:00:00+00:00', 'to': '2006-03-29T00:00:00+00:00', 'prop': {'from': {'day': 12, 'month': 10, 'year': 2005}, 'to': {'day': 29, 'month': 3, 'year': 2006}}, 'string': 'Oct 12, 2005 to Mar 29, 2006'}",25 min per ep,PG-13 - Teens 13 or older,7.59,26710.0,1354,1886,84374,707,"During their last summer of elementary school, four friends decide to undertake a test of courage at their local graveyard. Before the test begins, Haruka Kaminogi makes a last effort to pull Yuu Gotou away from his controlling mother. While doing so, Haruka suddenly has a strange vision of blue snow followed by the appearance of an imposing silver-haired man. Later, a similar vision occurs at the graveyard to both Haruka and her friends before they try to escape what they assume are ghosts. Unbeknownst to the children, the people who appeared before them are Dragon Soldiers: an elite military group from a dimension known as La'cryma. The soldiers have traveled to this dimension to secure the ""Dragon Torque""—an entity they believe to be their last hope for survival. However, both the Dragon Soldiers and Haruka are shocked to learn that the Dragon Torque is Haruka herself. She attempts to escape from the Dragon Soldiers as she finds her own last ray of hope—the strange silver-haired man who claims to be another version of Yuu himself. [Written by MAL Rewrite]",,fall,2005,"{'day': 'Wednesdays', 'time': '01:30', 'timezone': 'Asia/Tokyo', 'string': 'Wednesdays at 01:30 (JST)'}","[{'mal_id': 104, 'type': 'anime', 'name': 'Lantis', 'url': 'https://myanimelist.net/anime/producer/104/Lantis'}, {'mal_id': 108, 'type': 'anime', 'name': 'Media Factory', 'url': 'https://myanimelist.net/anime/producer/108/Media_Factory'}, {'mal_id': 253, 'type': 'anime', 'name': 'Rikuentai', 'url': 'https://myanimelist.net/anime/producer/253/Rikuentai'}, {'mal_id': 741, 'type': 'anime', 'name': 'Toshiba Entertainment', 'url': 'https://myanimelist.net/anime/producer/741/Toshiba_Entertainment'}, {'mal_id': 1588, 'type': 'anime', 'name': 'Bandai Channel', 'url': 'https://myanimelist.net/anime/producer/1588/Bandai_Channel'}]","[{'mal_id': 102, 'type': 'anime', 'name': 'Funimation', 'url': 'https://myanimelist.net/anime/producer/102/Funimation'}, {'mal_id': 947, 'type': 'anime', 'name': 'Manga Entertainment', 'url': 'https://myanimelist.net/anime/producer/947/Manga_Entertainment'}]","[{'mal_id': 41, 'type': 'anime', 'name': 'Satelight', 'url': 'https://myanimelist.net/anime/producer/41/Satelight'}]","[{'mal_id': 2, 'type': 'anime', 'name': 'Adventure', 'url': 'https://myanimelist.net/anime/genre/2/Adventure'}, {'mal_id': 8, 'type': 'anime', 'name': 'Drama', 'url': 'https://myanimelist.net/anime/genre/8/Drama'}, {'mal_id': 24, 'type': 'anime', 'name': 'Sci-Fi', 'url': 'https://myanimelist.net/anime/genre/24/Sci-Fi'}, {'mal_id': 36, 'type': 'anime', 'name': 'Slice of Life', 'url': 'https://myanimelist.net/anime/genre/36/Slice_of_Life'}]",[],[],[]
77,https://myanimelist.net/anime/77/Mahou_Shoujo_Lyrical_Nanoha_As,"{'jpg': {'image_url': 'https://cdn.myanimelist.net/images/anime/4/6767.jpg', 'small_image_url': 'https://cdn.myanimelist.net/images/anime/4/6767t.jpg', 'large_image_url': 'https://cdn.myanimelist.net/images/anime/4/6767l.jpg'}, 'webp': {'image_url': 'https://cdn.myanimelist.net/images/anime/4/6767.webp', 'small_image_url': 'https://cdn.myanimelist.net/images/anime/4/6767t.webp', 'large_image_url': 'https://cdn.myanimelist.net/images/anime/4/6767l.webp'}}","{'youtube_id': None, 'url': None, 'embed_url': None, 'images': {'image_url': None, 'small_image_url': None, 'medium_image_url': None, 'large_image_url': None, 'maximum_image_url': None}}","""Mahou Shoujo Lyrical Nanoha A's""",Magical Girl Lyrical Nanoha A's,魔法少女リリカルなのは エース,"[""Mahou Shoujo Lyrical Nanoha A's""]",TV,Original,13,Finished Airing,False,"{'from': '2005-10-02T00:00:00+00:00', 'to': '2005-12-25T00:00:00+00:00', 'prop': {'from': {'day': 2, 'month': 10, 'year': 2005}, 'to': {'day': 25, 'month': 12, 'year': 2005}}, 'string': 'Oct 2, 2005 to Dec 25, 2005'}",25 min per ep,PG-13 - Teens 13 or older,7.97,31237.0,593,2307,60409,954,"After solving the incident of the scattered Jewel Seeds, Nanoha Takamachi happily returns to her everyday life, though now with added magic practice in the morning. Exchanging video messages with Fate Testarossa and the crew of the Arthra, Nanoha eagerly awaits the chance to speak with them in person again. But while studying in her room one day, Raising Heart suddenly calls out to Nanoha and warns her of an incoming attack! The attacker is a young girl named Vita, who calls herself a Belka Knight. She proves her strength by using an intelligent device with a mysterious cartridge system to quickly overwhelm Nanoha. Luckily, the Space-Time Administration Bureau is able to step in before she is completely crushed. Vita and her fellow knights Shamal, Signum, and Zafila are on a mission to steal magical power from mages in order to complete the Book of Darkness, one of the Lost Logia. For what sinister purpose are the knights after this Book of Darkness? [Written by MAL Rewrite]",,fall,2005,"{'day': None, 'time': None, 'timezone': None, 'string': 'Unknown'}","[{'mal_id': 92, 'type': 'anime', 'name': 'Starchild Records', 'url': 'https://myanimelist.net/anime/producer/92/Starchild_Records'}, {'mal_id': 313, 'type': 'anime', 'name': 'Omnibus Japan', 'url': 'https://myanimelist.net/anime/producer/313/Omnibus_Japan'}]","[{'mal_id': 1459, 'type': 'anime', 'name': 'Geneon Entertainment USA', 'url': 'https://myanimelist.net/anime/producer/1459/Geneon_Entertainment_USA'}]","[{'mal_id': 35, 'type': 'anime', 'name': 'Seven Arcs', 'url': 'https://myanimelist.net/anime/producer/35/Seven_Arcs'}]","[{'mal_id': 1, 'type': 'anime', 'name': 'Action', 'url': 'https://myanimelist.net/anime/genre/1/Action'}, {'mal_id': 4, 'type': 'anime', 'name': 'Comedy', 'url': 'https://myanimelist.net/anime/genre/4/Comedy'}, {'mal_id': 8, 'type': 'anime', 'name': 'Drama', 'url': 'https://myanimelist.net/anime/genre/8/Drama'}]",[],"[{'mal_id': 31, 'type': 'anime', 'name': 'Super Power', 'url': 'https://myanimelist.net/anime/genre/31/Super_Power'}]",[]
99,https://myanimelist.net/anime/99/Mai-Otome,"{'jpg': {'image_url': 'https://cdn.myanimelist.net/images/anime/2/46897.jpg', 'small_image_url': 'https://cdn.myanimelist.net/images/anime/2/46897t.jpg', 'large_image_url': 'https://cdn.myanimelist.net/images/anime/2/46897l.jpg'}, 'webp': {'image_url': 'https://cdn.myanimelist.net/images/anime/2/46897.webp', 'small_image_url': 'https://cdn.myanimelist.net/images/anime/2/46897t.webp', 'large_image_url': 'https://cdn.myanimelist.net/images/anime/2/46897l.webp'}}","{'youtube_id': None, 'url': None, 'embed_url': None, 'images': {'image_url': None, 'small_image_url': None, 'medium_image_url': None, 'large_image_url': None, 'maximum_image_url': None}}","""Mai-Otome""",My-Otome,舞-乙HiME,"['Mai Oto-Hime', 'Mai-OtoHiME', 'Dancing Maiden']",TV,Original,26,Finished Airing,False,"{'from': '2005-10-07T00:00:00+00:00', 'to': '2006-03-31T00:00:00+00:00', 'prop': {'from': {'day': 7, 'month': 10, 'year': 2005}, 'to': {'day': 31, 'month': 3, 'year': 2006}}, 'string': 'Oct 7, 2005 to Mar 31, 2006'}",24 min per ep,PG-13 - Teens 13 or older,7.29,23565.0,2471,2623,48310,298,"Arika Yumemiya has traveled far in search of her goal: the prestigious Gualderobe Academy. This is the school where young girls are trained to become Otomes, protectors of royal leaders throughout the lands. Here, Arika makes plenty of friends, but some enemies know something about her past that she does not. Nevertheless, her spirit and determination will keep pushing her forward. Adapted from its predecessor, Mai-HiME, this series is not a direct sequel, but an alternate universe setting featuring some of the Mai-HiME cast (though with different personalities). (Source: ANN)",,fall,2005,"{'day': 'Fridays', 'time': '01:30', 'timezone': 'Asia/Tokyo', 'string': 'Fridays at 01:30 (JST)'}","[{'mal_id': 23, 'type': 'anime', 'name': 'Bandai Visual', 'url': 'https://myanimelist.net/anime/producer/23/Bandai_Visual'}, {'mal_id': 104, 'type': 'anime', 'name': 'Lantis', 'url': 'https://myanimelist.net/anime/producer/104/Lantis'}, {'mal_id': 717, 'type': 'anime', 'name': 'TV Tokyo Music', 'url': 'https://myanimelist.net/anime/producer/717/TV_Tokyo_Music'}]","[{'mal_id': 102, 'type': 'anime', 'name': 'Funimation', 'url': 'https://myanimelist.net/anime/producer/102/Funimation'}, {'mal_id': 233, 'type': 'anime', 'name': 'Bandai Entertainment', 'url': 'https://myanimelist.net/anime/producer/233/Bandai_Entertainment'}]","[{'mal_id': 14, 'type': 'anime', 'name': 'Sunrise', 'url': 'https://myanimelist.net/anime/producer/14/Sunrise'}]","[{'mal_id': 4, 'type': 'anime', 'name': 'Comedy', 'url': 'https://myanimelist.net/anime/genre/4/Comedy'}, {'mal_id': 8, 'type': 'anime', 'name': 'Drama', 'url': 'https://myanimelist.net/anime/genre/8/Drama'}, {'mal_id': 10, 'type': 'anime', 'name': 'Fantasy', 'url': 'https://myanimelist.net/anime/genre/10/Fantasy'}]",[],[],[]
