mal_id,url,images,trailer,title,title_english,title_japanese,title_synonyms,type,source,episodes,status,airing,aired,duration,rating,score,scored_by,rank,popularity,members,favorites,synopsis,background,season,year,broadcast,producers,licensors,studios,genres,explicit_genres,themes,demographics
457,https://myanimelist.net/anime/457/Mushishi,"{'jpg': {'image_url': 'https://cdn.myanimelist.net/images/anime/2/73862.jpg', 'small_image_url': 'https://cdn.myanimelist.net/images/anime/2/73862t.jpg', 'large_image_url': 'https://cdn.myanimelist.net/images/anime/2/73862l.jpg'}, 'webp': {'image_url': 'https://cdn.myanimelist.net/images/anime/2/73862.webp', 'small_image_url': 'https://cdn.myanimelist.net/images/anime/2/73862t.webp', 'large_image_url': 'https://cdn.myanimelist.net/images/anime/2/73862l.webp'}}","{'youtube_id': 'h371H0KIuPo', 'url': 'https://www.youtube.com/watch?v=h371H0KIuPo', 'embed_url': 'https://www.youtube.com/embed/h371H0KIuPo?enablejsapi=1&wmode=opaque&autoplay=1', 'images': {'image_url': 'https://img.youtube.com/vi/h371H0KIuPo/default.jpg', 'small_image_url': 'https://img.youtube.com/vi/h371H0KIuPo/sddefault.jpg', 'medium_image_url': 'https://img.youtube.com/vi/h371H0KIuPo/mqdefault.jpg', 'large_image_url': 'https://img.youtube.com/vi/h371H0KIuPo/hqdefault.jpg', 'maximum_image_url': 'https://img.youtube.com/vi/h371H0KIuPo/maxresdefault.jpg'}}","""Mushishi""",Mushi-Shi,蟲師,[],TV,Manga,26,Finished Airing,False,"{'from': '2005-10-23T00:00:00+00:00', 'to': '2006-06-19T00:00:00+00:00', 'prop': {'from': {'day': 23, 'month': 10, 'year': 2005}, 'to': {'day': 19, 'month': 6, 'year': 2006}}, 'string': 'Oct 23, 2005 to Jun 19, 2006'}",25 min per ep,PG-13 - Teens 13 or older,8.67,228048.0,54,194,720301,24001,"""Mushi"": the most basic forms of life in the world. They exist without any goals or purposes aside from simply ""being."" They are beyond the shackles of the words ""good"" and ""evil."" Mushi can exist in countless forms and are capable of mimicking things from the natural world such as plants, diseases, and even phenomena like rainbows. This is, however, just a vague definition of these entities that inhabit the vibrant world of Mushishi, as to even call them a form of life would be an oversimplification. Detailed information on Mushi is scarce because the majority of humans are unaware of their existence. So what are Mushi and why do they exist? This is the question that a ""Mushishi,"" Ginko, ponders constantly. Mushishi are those who research Mushi in hopes of understanding their place in the world's hierarchy of life. Ginko chases rumors of occurrences that could be tied to Mushi, all for the sake of finding an answer. It could, after all, lead to the meaning of life itself. [Written by MAL Rewrite]","Mushishi is an adaptation of Yuki Urushibara's award-winning manga of the same name. The series adapts the first 26 chapters of the manga, adapting one per episode. The anime aired these stories in a different order than that of the manga. The series won the Tokyo Anime Award in the Television category in 2006. The series premiered on October 23, 2005, but went on hiatus on March 12, 2006 after having aired 20 episodes. Broadcast resumed on May 15, and aired the remaining 6 episodes, concluding on June 19, 2006.",fall,2005,"{'day': 'Sundays', 'time': '03:40', 'timezone': 'Asia/Tokyo', 'string': 'Sundays at 03:40 (JST)'}","[{'mal_id': 52, 'type': 'anime', 'name': 'Avex Entertainment', 'url': 'https://myanimelist.net/anime/producer/52/Avex_Entertainment'}, {'mal_id': 82, 'type': 'anime', 'name': 'Marvelous', 'url': 'https://myanimelist.net/anime/producer/82/Marvelous'}, {'mal_id': 147, 'type': 'anime', 'name': 'SKY Perfect Well Think', 'url': 'https://myanimelist.net/anime/producer/147/SKY_Perfect_Well_Think'}, {'mal_id': 711, 'type': 'anime', 'name': 'Delfi Sound', 'url': 'https://myanimelist.net/anime/producer/711/Delfi_Sound'}]","[{'mal_id': 102, 'type': 'anime', 'name': 'Funimation', 'url': 'https://myanimelist.net/anime/producer/102/Funimation'}]","[{'mal_id': 8, 'type': 'anime', 'name': 'Artland', 'url': 'https://myanimelist.net/anime/producer/8/Artland'}]","[{'mal_id': 2, 'type': 'anime', 'name': 'Adventure', 'url': 'https://myanimelist.net/anime/genre/2/Adventure'}, {'mal_id': 10, 'type': 'anime', 'name': 'Fantasy', 'url': 'https://myanimelist.net/anime/genre/10/Fantasy'}, {'mal_id': 7, 'type': 'anime', 'name': 'Mystery', 'url': 'https://myanimelist.net/anime/genre/7/Mystery'}, {'mal_id': 36, 'type': 'anime', 'name': 'Slice of Life', 'url': 'https://myanimelist.net/anime/genre/36/Slice_of_Life'}, {'mal_id': 37, 'type': 'anime', 'name': 'Supernatural', 'url': 'https://myanimelist.net/anime/genre/37/Supernatural'}]",[],"[{'mal_id': 13, 'type': 'anime', 'name': 'Historical', 'url': 'https://myanimelist.net/anime/genre/13/Historical'}]","[{'mal_id': 42, 'type': 'anime', 'name': 'Seinen', 'url': 'https://myanimelist.net/anime/genre/42/Seinen'}]"
355,https://myanimelist.net/anime/355/Shakugan_no_Shana,"{'jpg': {'image_url': 'https://cdn.myanimelist.net/images/anime/8/21197.jpg', 'small_image_url': 'https://cdn.myanimelist.net/images/anime/8/21197t.jpg', 'large_image_url': 'https://cdn.myanimelist.net/images/anime/8/21197l.jpg'}, 'webp': {'image_url': 'https://cdn.myanimelist.net/images/anime/8/21197.webp', 'small_image_url': 'https://cdn.myanimelist.net/images/anime/8/21197t.webp', 'large_image_url': 'https://cdn.myanimelist.net/images/anime/8/21197l.webp'}}","{'youtube_id': '9C2nhALMzrk', 'url': 'https://www.youtube.com/watch?v=9C2nhALMzrk', 'embed_url': 'https://www.youtube.com/embed/9C2nhALMzrk?enablejsapi=1&wmode=opaque&autoplay=1', 'images': {'image_url': 'https://img.youtube.com/vi/9C2nhALMzrk/default.jpg', 'small_image_url': 'https://img.youtube.com/vi/9C2nhALMzrk/sddefault.jpg', 'medium_image_url': 'https://img.youtube.com/vi/9C2nhALMzrk/mqdefault.jpg', 'large_image_url': 'https://img.youtube.com/vi/9C2nhALMzrk/hqdefault.jpg', 'maximum_image_url': 'https://img.youtube.com/vi/9C2nhALMzrk/maxresdefault.jpg'}}","""Shakugan no Shana""",Shakugan no Shana: Season I,灼眼のシャナ,['Burning-Eyed Shana'],TV,Light novel,24,Finished Airing,False,"{'from': '2005-10-06T00:00:00+00:00', 'to': '2006-03-23T00:00:00+00:00', 'prop': {'from': {'day': 6, 'month': 10, 'year': 2005}, 'to': {'day': 23, 'month': 3, 'year': 2006}}, 'string': 'Oct 6, 2005 to Mar 23, 2006'}",24 min per ep,PG-13 - Teens 13 or older,7.48,233818.0,1696,343,498611,4859,"The world has become a slaughtering ground for the Crimson Denizens, mysterious beings from a parallel universe who thrive on the life energy of humans. These merciless murderers only leave behind scant remainders of souls called ""Torches,"" which are mere residues that will eventually be destroyed, along with the very fact of the victims' existence from the minds of the living. In an ambitious endeavor to put an end to this invisible, hungry massacre, warriors called Flame Hazes relentlessly fight these monsters. One fateful day, Yuuji Sakai ceases to be a regular high schooler—he becomes trapped in a crevice of time and is suddenly attacked by a Denizen. Coming to his rescue just in the nick of time is a nameless hunter who seems no different from an ordinary young girl except for her blazing eyes and burning crimson hair. However, before Yuuji can learn anything more about his situation, he discovers that he has already been reduced to a Torch—merely a scrap of memory waiting to be extinguished. [Written by MAL Rewrite]","Shakugan no Shana is licensed in North America by Funimation after Geneon withdrew from the American market, and made its first North American television debut in September of 2012 on the Funimation Channel.",fall,2005,"{'day': 'Thursdays', 'time': '00:45', 'timezone': 'Asia/Tokyo', 'string': 'Thursdays at 00:45 (JST)'}","[{'mal_id': 31, 'type': 'anime', 'name': 'Geneon Universal Entertainment', 'url': 'https://myanimelist.net/anime/producer/31/Geneon_Universal_Entertainment'}, {'mal_id': 681, 'type': 'anime', 'name': 'ASCII Media Works', 'url': 'https://myanimelist.net/anime/producer/681/ASCII_Media_Works'}, {'mal_id': 741, 'type': 'anime', 'name': 'Toshiba Entertainment', 'url': 'https://myanimelist.net/anime/producer/741/Toshiba_Entertainment'}, {'mal_id': 745, 'type': 'anime', 'name': 'Cosmic Ray', 'url': 'https://myanimelist.net/anime/producer/745/Cosmic_Ray'}, {'mal_id': 777, 'type': 'anime', 'name': 'Showgate', 'url': 'https://myanimelist.net/anime/producer/777/Showgate'}]","[{'mal_id': 102, 'type': 'anime', 'name': 'Funimation', 'url': 'https://myanimelist.net/anime/producer/102/Funimation'}, {'mal_id': 1459, 'type': 'anime', 'name': 'Geneon Entertainment USA', 'url': 'https://myanimelist.net/anime/producer/1459/Geneon_Entertainment_USA'}]","[{'mal_id': 7, 'type': 'anime', 'name': 'J.C.Staff', 'url': 'https://myanimelist.net/anime/producer/7/JCStaff'}]","[{'mal_id': 1, 'type': 'anime', 'name': 'Action', 'url': 'https://myanimelist.net/anime/genre/1/Action'}, {'mal_id': 8, 'type': 'anime', 'name': 'Drama', 'url': 'https://myanimelist.net/anime/genre/8/Drama'}, {'mal_id': 10, 'type': 'anime', 'name': 'Fantasy', 'url': 'https://myanimelist.net/anime/genre/10/Fantasy'}, {'mal_id': 22, 'type': 'anime', 'name': 'Romance', 'url': 'https://myanimelist.net/anime/genre/22/Romance'}, {'mal_id': 37, 'type': 'anime', 'name': 'Supernatural', 'url': 'https://myanimelist.net/anime/genre/37/Supernatural'}]",[],"[{'mal_id': 23, 'type': 'anime', 'name': 'School', 'url': 'https://myanimelist.net/anime/genre/23/School'}]",[]
150,https://myanimelist.net/anime/150/Blood_,"{'jpg': {'image_url': 'https://cdn.myanimelist.net/images/anime/10/10183.jpg', 'small_image_url': 'https://cdn.myanimelist.net/images/anime/10/10183t.jpg', 'large_image_url': 'https://cdn.myanimelist.net/images/anime/10/10183l.jpg'}, 'webp': {'image_url': 'https://cdn.myanimelist.net/images/anime/10/10183.webp', 'small_image_url': 'https://cdn.myanimelist.net/images/anime/10/10183t.webp', 'large_image_url': 'https://cdn.myanimelist.net/images/anime/10/10183l.webp'}}","{'youtube_id': 'mjJ1W08vCKM', 'url': 'https://www.youtube.com/watch?v=mjJ1W08vCKM', 'embed_url': 'https://www.youtube.com/embed/mjJ1W08vCKM?enablejsapi=1&wmode=opaque&autoplay=1', 'images': {'image_url': 'https://img.youtube.com/vi/mjJ1W08vCKM/default.jpg', 'small_image_url': 'https://img.youtube.com/vi/mjJ1W08vCKM/sddefault.jpg', 'medium_image_url': 'https://img.youtube.com/vi/mjJ1W08vCKM/mqdefault.jpg', 'large_image_url': 'https://img.youtube.com/vi/mjJ1W08vCKM/hqdefault.jpg', 'maximum_image_url': 'https://img.youtube.com/vi/mjJ1W08vCKM/maxresdefault.jpg'}}","""Blood+""",Blood+,ブラッドプラス,['Blood Plus'],TV,Original,50,Finished Airing,False,"{'from': '2005-10-08T00:00:00+00:00', 'to': '2006-09-23T00:00:00+00:00', 'prop': {'from': {'day': 8, 'month': 10, 'year': 2005}, 'to': {'day': 23, 'month': 9, 'year': 2006}}, 'string': 'Oct 8, 2005 to Sep 23, 2006'}",24 min per ep,R - 17+ (violence & profanity),7.64,137207.0,1214,511,346433,4100,"Saya Otonashi is a seemingly ordinary girl living a mundane life with her adoptive family in Okinawa City. In fact, her only peculiarities are suffering from anemia and being unable to remember any of her life beyond the previous year. However, Saya's forgotten past quickly comes back to haunt her—one night, she is attacked at school by a creature that feeds on human blood. Just when all hope seems lost, a mysterious man named Haji appears and fends off the creature temporarily. But when her rescuer forces her to drink his blood, Saya suddenly enters a trance and slays the monster with ease, using her own blood as a catalyst. Saya then learns of an organization named Red Shield, founded for the sole purpose of defeating the hellish beasts. Now Saya and Haji must work together with Red Shield to fight these fearsome monsters and unlock the secrets to the girl's past. [Written by MAL Rewrite]",,fall,2005,"{'day': 'Saturdays', 'time': '18:00', 'timezone': 'Asia/Tokyo', 'string': 'Saturdays at 18:00 (JST)'}","[{'mal_id': 17, 'type': 'anime', 'name': 'Aniplex', 'url': 'https://myanimelist.net/anime/producer/17/Aniplex'}, {'mal_id': 143, 'type': 'anime', 'name': 'Mainichi Broadcasting System', 'url': 'https://myanimelist.net/anime/producer/143/Mainichi_Broadcasting_System'}]","[{'mal_id': 15, 'type': 'anime', 'name': 'Sony Pictures Entertainment', 'url': 'https://myanimelist.net/anime/producer/15/Sony_Pictures_Entertainment'}]","[{'mal_id': 10, 'type': 'anime', 'name': 'Production I.G', 'url': 'https://myanimelist.net/anime/producer/10/Production_IG'}]","[{'mal_id': 1, 'type': 'anime', 'name': 'Action', 'url': 'https://myanimelist.net/anime/genre/1/Action'}, {'mal_id': 8, 'type': 'anime', 'name': 'Drama', 'url': 'https://myanimelist.net/anime/genre/8/Drama'}, {'mal_id': 14, 'type': 'anime', 'name': 'Horror', 'url': 'https://myanimelist.net/anime/genre/14/Horror'}, {'mal_id': 7, 'type': 'anime', 'name': 'Mystery', 'url': 'https://myanimelist.net/anime/genre/7/Mystery'}, {'mal_id': 37, 'type': 'anime', 'name': 'Supernatural', 'url': 'https://myanimelist.net/anime/genre/37/Supernatural'}]",[],"[{'mal_id': 38, 'type': 'anime', 'name': 'Military', 'url': 'https://myanimelist.net/anime/genre/38/Military'}, {'mal_id': 32, 'type': 'anime', 'name': 'Vampire', 'url': 'https://myanimelist.net/anime/genre/32/Vampire'}]",[]
228,https://myanimelist.net/anime/228/Jigoku_Shoujo,"{'jpg': {'image_url': 'https://cdn.myanimelist.net/images/anime/4/86907.jpg', 'small_image_url': 'https://cdn.myanimelist.net/images/anime/4/86907t.jpg', 'large_image_url': 'https://cdn.myanimelist.net/images/anime/4/86907l.jpg'}, 'webp': {'image_url': 'https://cdn.myanimelist.net/images/anime/4/86907.webp', 'small_image_url': 'https://cdn.myanimelist.net/images/anime/4/86907t.webp', 'large_image_url': 'https://cdn.myanimelist.net/images/anime/4/86907l.webp'}}","{'youtube_id': 'ofIl6PWLY8g', 'url': 'https://www.youtube.com/watch?v=ofIl6PWLY8g', 'embed_url': 'https://www.youtube.com/embed/ofIl6PWLY8g?enablejsapi=1&wmode=opaque&autoplay=1', 'images': {'image_url': 'https://img.youtube.com/vi/ofIl6PWLY8g/default.jpg', 'small_image_url': 'https://img.youtube.com/vi/ofIl6PWLY8g/sddefault.jpg', 'medium_image_url': 'https://img.youtube.com/vi/ofIl6PWLY8g/mqdefault.jpg', 'large_image_url': 'https://img.youtube.com/vi/ofIl6PWLY8g/hqdefault.jpg', 'maximum_image_url': 'https://img.youtube.com/vi/ofIl6PWLY8g/maxresdefault.jpg'}}","""Jigoku Shoujo""",Hell Girl,地獄少女,['Jigoku Shojo'],TV,Original,26,Finished Airing,False,"{'from': '2005-10-05T00:00:00+00:00', 'to': '2006-04-05T00:00:00+00:00', 'prop': {'from': {'day': 5, 'month': 10, 'year': 2005}, 'to': {'day': 5, 'month': 4, 'year': 2006}}, 'string': 'Oct 5, 2005 to Apr 5, 2006'}",25 min per ep,R - 17+ (violence & profanity),7.63,113145.0,1242,562,321009,2901,"Have you heard of Hell Correspondence? Those with a powerful grudge may only access this mysterious website at midnight, allowing them to enter anyone's name and have that person be ferried straight to hell. Ai Enma, the Hell Girl, will not judge whether or not the chosen target deserves punishment; she will merely exact revenge on them for you. Not much is known about this young girl other than that she swiftly carries out her tasks with the help of three straw dolls. There is just one catch, however—as payment for carrying out such a request, the user must condemn themselves to an afterlife in hell. [Written by MAL Rewrite]",,fall,2005,"{'day': None, 'time': None, 'timezone': None, 'string': 'Unknown'}","[{'mal_id': 17, 'type': 'anime', 'name': 'Aniplex', 'url': 'https://myanimelist.net/anime/producer/17/Aniplex'}, {'mal_id': 147, 'type': 'anime', 'name': 'SKY Perfect Well Think', 'url': 'https://myanimelist.net/anime/producer/147/SKY_Perfect_Well_Think'}]","[{'mal_id': 102, 'type': 'anime', 'name': 'Funimation', 'url': 'https://myanimelist.net/anime/producer/102/Funimation'}]","[{'mal_id': 37, 'type': 'anime', 'name': 'Studio Deen', 'url': 'https://myanimelist.net/anime/producer/37/Studio_Deen'}]","[{'mal_id': 14, 'type': 'anime', 'name': 'Horror', 'url': 'https://myanimelist.net/anime/genre/14/Horror'}, {'mal_id': 7, 'type': 'anime', 'name': 'Mystery', 'url': 'https://myanimelist.net/anime/genre/7/Mystery'}, {'mal_id': 37, 'type': 'anime', 'name': 'Supernatural', 'url': 'https://myanimelist.net/anime/genre/37/Supernatural'}]",[],"[{'mal_id': 40, 'type': 'anime', 'name': 'Psychological', 'url': 'https://myanimelist.net/anime/genre/40/Psychological'}]",[]
68,https://myanimelist.net/anime/68/Black_Cat_TV,"{'jpg': {'image_url': 'https://cdn.myanimelist.net/images/anime/1485/110010.jpg', 'small_image_url': 'https://cdn.myanimelist.net/images/anime/1485/110010t.jpg', 'large_image_url': 'https://cdn.myanimelist.net/images/anime/1485/110010l.jpg'}, 'webp': {'image_url': 'https://cdn.myanimelist.net/images/anime/1485/110010.webp', 'small_image_url': 'https://cdn.myanimelist.net/images/anime/1485/110010t.webp', 'large_image_url': 'https://cdn.myanimelist.net/images/anime/1485/110010l.webp'}}","{'youtube_id': 'AwHhnVLrTZk', 'url': 'https://www.youtube.com/watch?v=AwHhnVLrTZk', 'embed_url': 'https://www.youtube.com/embed/AwHhnVLrTZk?enablejsapi=1&wmode=opaque&autoplay=1', 'images': {'image_url': 'https://img.youtube.com/vi/AwHhnVLrTZk/default.jpg', 'small_image_url': 'https://img.youtube.com/vi/AwHhnVLrTZk/sddefault.jpg', 'medium_image_url': 'https://img.youtube.com/vi/AwHhnVLrTZk/mqdefault.jpg', 'large_image_url': 'https://img.youtube.com/vi/AwHhnVLrTZk/hqdefault.jpg', 'maximum_image_url': 'https://img.youtube.com/vi/AwHhnVLrTZk/maxresdefault.jpg'}}","""Black Cat (TV)""",Black Cat,ブラックキャット,[],TV,Manga,23,Finished Airing,False,"{'from': '2005-10-07T00:00:00+00:00', 'to': '2006-03-31T00:00:00+00:00', 'prop': {'from': {'day': 7, 'month': 10, 'year': 2005}, 'to': {'day': 31, 'month': 3, 'year': 2006}}, 'string': 'Oct 7, 2005 to Mar 31, 2006'}",24 min per ep,PG-13 - Teens 13 or older,7.35,116349.0,2168,751,250673,1701,"Completing every job with ruthless accuracy, Train Heartnet is an infamous assassin with no regard for human life. Donning the moniker ""Black Cat"" in the underground world, the elite killer works for the powerful secret organization known only as Chronos. One gloomy night, the blasé gunman stumbles upon Saya Minatsuki, an enigmatic bounty hunter, and soon develops an odd friendship with her. Influenced by Saya's positive outlook on life, Train begins to rethink his life. Deciding to abandon his role as the Black Cat, he instead opts to head down a virtuous path as an honest bounty hunter. However, Chronos—and particularly Creed Diskenth, Train's possessive underling—is not impressed with Train's sudden change of heart and vows to resort to extreme measures in order to bring back the emissary of bad luck. This assassin turned ""stray cat"" can only wander so far before the deafening sound of gunfire rings out. [Written by MAL Rewrite]",,fall,2005,"{'day': 'Fridays', 'time': '01:25', 'timezone': 'Asia/Tokyo', 'string': 'Fridays at 01:25 (JST)'}","[{'mal_id': 42, 'type': 'anime', 'name': 'GDH', 'url': 'https://myanimelist.net/anime/producer/42/GDH'}, {'mal_id': 53, 'type': 'anime', 'name': 'Dentsu', 'url': 'https://myanimelist.net/anime/producer/53/Dentsu'}, {'mal_id': 145, 'type': 'anime', 'name': 'TBS', 'url': 'https://myanimelist.net/anime/producer/145/TBS'}, {'mal_id': 1597, 'type': 'anime', 'name': 'Sotsu Music Publishing', 'url': 'https://myanimelist.net/anime/producer/1597/Sotsu_Music_Publishing'}]","[{'mal_id': 102, 'type': 'anime', 'name': 'Funimation', 'url': 'https://myanimelist.net/anime/producer/102/Funimation'}]","[{'mal_id': 3, 'type': 'anime', 'name': 'Gonzo', 'url': 'https://myanimelist.net/anime/producer/3/Gonzo'}]","[{'mal_id': 2, 'type': 'anime', 'name': 'Adventure', 'url': 'https://myanimelist.net/anime/genre/2/Adventure'}, {'mal_id': 4, 'type': 'anime', 'name': 'Comedy', 'url': 'https://myanimelist.net/anime/genre/4/Comedy'}, {'mal_id': 24, 'type': 'anime', 'name': 'Sci-Fi', 'url': 'https://myanimelist.net/anime/genre/24/Sci-Fi'}]",[],"[{'mal_id': 31, 'type': 'anime', 'name': 'Super Power', 'url': 'https://myanimelist.net/anime/genre/31/Super_Power'}]","[{'mal_id': 27, 'type': 'anime', 'name': 'Shounen', 'url': 'https://myanimelist.net/anime/genre/27/Shounen'}]"
322,https://myanimelist.net/anime/322/Paradise_Kiss,"{'jpg': {'image_url': 'https://cdn.myanimelist.net/images/anime/7/80636.jpg', 'small_image_url': 'https://cdn.myanimelist.net/images/anime/7/80636t.jpg', 'large_image_url': 'https://cdn.myanimelist.net/images/anime/7/80636l.jpg'}, 'webp': {'image_url': 'https://cdn.myanimelist.net/images/anime/7/80636.webp', 'small_image_url': 'https://cdn.myanimelist.net/images/anime/7/80636t.webp', 'large_image_url': 'https://cdn.myanimelist.net/images/anime/7/80636l.webp'}}","{'youtube_id': 'btG48UGYVLM', 'url': 'https://www.youtube.com/watch?v=btG48UGYVLM', 'embed_url': 'https://www.youtube.com/embed/btG48UGYVLM?enablejsapi=1&wmode=opaque&autoplay=1', 'images': {'image_url': 'https://img.youtube.com/vi/btG48UGYVLM/default.jpg', 'small_image_url': 'https://img.youtube.com/vi/btG48UGYVLM/sddefault.jpg', 'medium_image_url': 'https://img.youtube.com/vi/btG48UGYVLM/mqdefault.jpg', 'large_image_url': 'https://img.youtube.com/vi/btG48UGYVLM/hqdefault.jpg', 'maximum_image_url': 'https://img.youtube.com/vi/btG48UGYVLM/maxresdefault.jpg'}}","""Paradise Kiss""",Paradise Kiss,Paradise kiss,['ParaKiss'],TV,Manga,12,Finished Airing,False,"{'from': '2005-10-14T00:00:00+00:00', 'to': '2005-12-30T00:00:00+00:00', 'prop': {'from': {'day': 14, 'month': 10, 'year': 2005}, 'to': {'day': 30, 'month': 12, 'year': 2005}}, 'string': 'Oct 14, 2005 to Dec 30, 2005'}",24 min per ep,R - 17+ (violence & profanity),7.84,81686.0,787,997,186362,3411,"On her way home from school, Yukari Hayasaka is approached by a weird-looking guy who starts looking at her body intently. He's got blond spiky hair, a spiked choker, and multiple piercings on his ears and face. She wants nothing to do with him, and runs away, only to bump into a very tall and beautiful purple-haired woman with a flower pattern around her eye. Yukari faints from shock and wakes up later in a strange place called the Atelier. It turns out that these strangers are fashion designers who attend the most famous art school around, Yazawa Art Academy, and their group wants Yukari to model for their brand in Yazawa Academy's upcoming show. Yukari turns down their offer and escapes the Atelier, but unknowingly leaves her school ID behind. George Koizumi, the head designer, later sees it and immediately knows she would be the perfect model for them and will not stop until he gets what he wants—and he wants her. Yukari had never considered something as frivolous as modeling before, but could life among these eccentric designers actually prove to be fun? Or will Yukari lose herself in this world of art and passion? [Written by MAL Rewrite]",Paradise Kiss aired on Fuji Television's noitaminA block.,fall,2005,"{'day': 'Fridays', 'time': '00:35', 'timezone': 'Asia/Tokyo', 'string': 'Fridays at 00:35 (JST)'}","[{'mal_id': 17, 'type': 'anime', 'name': 'Aniplex', 'url': 'https://myanimelist.net/anime/producer/17/Aniplex'}, {'mal_id': 169, 'type': 'anime', 'name': 'Fuji TV', 'url': 'https://myanimelist.net/anime/producer/169/Fuji_TV'}]","[{'mal_id': 1459, 'type': 'anime', 'name': 'Geneon Entertainment USA', 'url': 'https://myanimelist.net/anime/producer/1459/Geneon_Entertainment_USA'}]","[{'mal_id': 11, 'type': 'anime', 'name': 'Madhouse', 'url': 'https://myanimelist.net/anime/producer/11/Madhouse'}]","[{'mal_id': 4, 'type': 'anime', 'name': 'Comedy', 'url': 'https://myanimelist.net/anime/genre/4/Comedy'}, {'mal_id': 8, 'type': 'anime', 'name': 'Drama', 'url': 'https://myanimelist.net/anime/genre/8/Drama'}, {'mal_id': 22, 'type': 'anime', 'name': 'Romance', 'url': 'https://myanimelist.net/anime/genre/22/Romance'}, {'mal_id': 36, 'type': 'anime', 'name': 'Slice of Life', 'url': 'https://myanimelist.net/anime/genre/36/Slice_of_Life'}]",[],[],"[{'mal_id': 43, 'type': 'anime', 'name': 'Josei', 'url': 'https://myanimelist.net/anime/genre/43/Josei'}]"
