mal_id,url,images,trailer,title,title_english,title_japanese,title_synonyms,type,source,episodes,status,airing,aired,duration,rating,score,scored_by,rank,popularity,members,favorites,synopsis,background,season,year,broadcast,producers,licensors,studios,genres,explicit_genres,themes,demographics
476,https://myanimelist.net/anime/476/Ginban_Kaleidoscope,"{'jpg': {'image_url': 'https://cdn.myanimelist.net/images/anime/8/19926.jpg', 'small_image_url': 'https://cdn.myanimelist.net/images/anime/8/19926t.jpg', 'large_image_url': 'https://cdn.myanimelist.net/images/anime/8/19926l.jpg'}, 'webp': {'image_url': 'https://cdn.myanimelist.net/images/anime/8/19926.webp', 'small_image_url': 'https://cdn.myanimelist.net/images/anime/8/19926t.webp', 'large_image_url': 'https://cdn.myanimelist.net/images/anime/8/19926l.webp'}}","{'youtube_id': None, 'url': None, 'embed_url': None, 'images': {'image_url': None, 'small_image_url': None, 'medium_image_url': None, 'large_image_url': None, 'maximum_image_url': None}}","""Ginban Kaleidoscope""",Skating Rink Kaleidoscope,銀盤カレイドスコープ,[],TV,Light novel,12,Finished Airing,False,"{'from': '2005-10-09T00:00:00+00:00', 'to': '2005-12-25T00:00:00+00:00', 'prop': {'from': {'day': 9, 'month': 10, 'year': 2005}, 'to': {'day': 25, 'month': 12, 'year': 2005}}, 'string': 'Oct 9, 2005 to Dec 25, 2005'}",24 min per ep,PG-13 - Teens 13 or older,7.31,21053.0,2361,2687,46051,145,"Figure skater Tazusa Sakurano is on the fast track to the Olympics. As a top contender, her chances rest on a single competition in Canada. However, during her program, she falls and hits her head on the ice, knocking her unconscious. At the same time, Canadian stunt pilot Pete Pumps goes down in a fiery blaze. After her devastating failure, Tazusa returns home to Japan, but she starts hearing a voice in her head. In reality, when Pete had arrived at the gates of heaven, he was denied access for his sins. Instead, he was told to wait 100 days and is now trapped in Tazusa's body! Unwilling to let this interrupt her life—even if her body is a bit crowded—Tazusa moves forward with skating, all while a pesky voice may just be able to help her achieve her dream. [Written by MAL Rewrite]",,fall,2005,"{'day': 'Sundays', 'time': '02:40', 'timezone': 'Asia/Tokyo', 'string': 'Sundays at 02:40 (JST)'}","[{'mal_id': 17, 'type': 'anime', 'name': 'Aniplex', 'url': 'https://myanimelist.net/anime/producer/17/Aniplex'}]",[],"[{'mal_id': 890, 'type': 'anime', 'name': 'Karaku', 'url': 'https://myanimelist.net/anime/producer/890/Karaku'}]","[{'mal_id': 8, 'type': 'anime', 'name': 'Drama', 'url': 'https://myanimelist.net/anime/genre/8/Drama'}, {'mal_id': 22, 'type': 'anime', 'name': 'Romance', 'url': 'https://myanimelist.net/anime/genre/22/Romance'}, {'mal_id': 30, 'type': 'anime', 'name': 'Sports', 'url': 'https://myanimelist.net/anime/genre/30/Sports'}, {'mal_id': 37, 'type': 'anime', 'name': 'Supernatural', 'url': 'https://myanimelist.net/anime/genre/37/Supernatural'}]",[],[],[]
670,https://myanimelist.net/anime/670/Lamune,"{'jpg': {'image_url': 'https://cdn.myanimelist.net/images/anime/4/15900.jpg', 'small_image_url': 'https://cdn.myanimelist.net/images/anime/4/15900t.jpg', 'large_image_url': 'https://cdn.myanimelist.net/images/anime/4/15900l.jpg'}, 'webp': {'image_url': 'https://cdn.myanimelist.net/images/anime/4/15900.webp', 'small_image_url': 'https://cdn.myanimelist.net/images/anime/4/15900t.webp', 'large_image_url': 'https://cdn.myanimelist.net/images/anime/4/15900l.webp'}}","{'youtube_id': None, 'url': None, 'embed_url': None, 'images': {'image_url': None, 'small_image_url': None, 'medium_image_url': None, 'large_image_url': None, 'maximum_image_url': None}}","""Lamune""",,ラムネ,[],TV,Visual novel,12,Finished Airing,False,"{'from': '2005-10-11T00:00:00+00:00', 'to': '2005-12-27T00:00:00+00:00', 'prop': {'from': {'day': 11, 'month': 10, 'year': 2005}, 'to': {'day': 27, 'month': 12, 'year': 2005}}, 'string': 'Oct 11, 2005 to Dec 27, 2005'}",24 min per ep,PG-13 - Teens 13 or older,6.81,16675.0,4614,2932,39317,66,"Lamune tells the story of a boy named Kenji and his childhood friend Nanami. Although, everyone seems to know that they have a relationship, neither are determined to push it anymore than close friends. The story goes through flashbacks, explaining why they are such close friends and any action doesn't seem to push them apart, but draw them closer. (Source: ANN)",,fall,2005,"{'day': 'Tuesdays', 'time': '02:00', 'timezone': 'Asia/Tokyo', 'string': 'Tuesdays at 02:00 (JST)'}","[{'mal_id': 81, 'type': 'anime', 'name': 'Radix', 'url': 'https://myanimelist.net/anime/producer/81/Radix'}]",[],"[{'mal_id': 63, 'type': 'anime', 'name': 'Trinet Entertainment', 'url': 'https://myanimelist.net/anime/producer/63/Trinet_Entertainment'}, {'mal_id': 78, 'type': 'anime', 'name': 'Picture Magic', 'url': 'https://myanimelist.net/anime/producer/78/Picture_Magic'}]","[{'mal_id': 8, 'type': 'anime', 'name': 'Drama', 'url': 'https://myanimelist.net/anime/genre/8/Drama'}, {'mal_id': 22, 'type': 'anime', 'name': 'Romance', 'url': 'https://myanimelist.net/anime/genre/22/Romance'}, {'mal_id': 36, 'type': 'anime', 'name': 'Slice of Life', 'url': 'https://myanimelist.net/anime/genre/36/Slice_of_Life'}]",[],[],[]
152,https://myanimelist.net/anime/152/Solty_Rei,"{'jpg': {'image_url': 'https://cdn.myanimelist.net/images/anime/3/75582.jpg', 'small_image_url': 'https://cdn.myanimelist.net/images/anime/3/75582t.jpg', 'large_image_url': 'https://cdn.myanimelist.net/images/anime/3/75582l.jpg'}, 'webp': {'image_url': 'https://cdn.myanimelist.net/images/anime/3/75582.webp', 'small_image_url': 'https://cdn.myanimelist.net/images/anime/3/75582t.webp', 'large_image_url': 'https://cdn.myanimelist.net/images/anime/3/75582l.webp'}}","{'youtube_id': 'VsNf2QE7QZU', 'url': 'https://www.youtube.com/watch?v=VsNf2QE7QZU', 'embed_url': 'https://www.youtube.com/embed/VsNf2QE7QZU?enablejsapi=1&wmode=opaque&autoplay=1', 'images': {'image_url': 'https://img.youtube.com/vi/VsNf2QE7QZU/default.jpg', 'small_image_url': 'https://img.youtube.com/vi/VsNf2QE7QZU/sddefault.jpg', 'medium_image_url': 'https://img.youtube.com/vi/VsNf2QE7QZU/mqdefault.jpg', 'large_image_url': 'https://img.youtube.com/vi/VsNf2QE7QZU/hqdefault.jpg', 'maximum_image_url': 'https://img.youtube.com/vi/VsNf2QE7QZU/maxresdefault.jpg'}}","""Solty Rei""",,ソルティレイ,['SoltyRei'],TV,Original,24,Finished Airing,False,"{'from': '2005-10-07T00:00:00+00:00', 'to': '2006-03-31T00:00:00+00:00', 'prop': {'from': {'day': 7, 'month': 10, 'year': 2005}, 'to': {'day': 31, 'month': 3, 'year': 2006}}, 'string': 'Oct 7, 2005 to Mar 31, 2006'}",23 min per ep,R - 17+ (violence & profanity),7.27,11007.0,2588,3544,27359,118,"In a future-based disaster-ridden city with an enormous gap between the rich and the poor, it is hard to tell which humans are walking around with cybernetic body parts. This makes Roy Revant's job as a renegade bounty hunter/bodyguard-for-hire even more difficult. When a young girl with unbeliveable strength rescues him from a particularly dangerous criminal, Roy realizes that perhaps help can be found in the strangest of places. Joining together with a few others, they engage in a battle to find out the truth behind the giant conglomerates that are supposedly serving mankind and making life better. Solty, an android who has lost her memory, has escaped and is being hunted by the RUC Security Bureau. She encounters the bounty hunter Roy and he adopts her as his daughter after being hired as a bodygaurd for Miranda. (Source: ANN)",,fall,2005,"{'day': 'Fridays', 'time': '02:40', 'timezone': 'Asia/Tokyo', 'string': 'Fridays at 02:40 (JST)'}","[{'mal_id': 55, 'type': 'anime', 'name': 'TV Asahi', 'url': 'https://myanimelist.net/anime/producer/55/TV_Asahi'}, {'mal_id': 1597, 'type': 'anime', 'name': 'Sotsu Music Publishing', 'url': 'https://myanimelist.net/anime/producer/1597/Sotsu_Music_Publishing'}]","[{'mal_id': 102, 'type': 'anime', 'name': 'Funimation', 'url': 'https://myanimelist.net/anime/producer/102/Funimation'}]","[{'mal_id': 3, 'type': 'anime', 'name': 'Gonzo', 'url': 'https://myanimelist.net/anime/producer/3/Gonzo'}, {'mal_id': 48, 'type': 'anime', 'name': 'AIC', 'url': 'https://myanimelist.net/anime/producer/48/AIC'}]","[{'mal_id': 1, 'type': 'anime', 'name': 'Action', 'url': 'https://myanimelist.net/anime/genre/1/Action'}, {'mal_id': 24, 'type': 'anime', 'name': 'Sci-Fi', 'url': 'https://myanimelist.net/anime/genre/24/Sci-Fi'}]",[],"[{'mal_id': 31, 'type': 'anime', 'name': 'Super Power', 'url': 'https://myanimelist.net/anime/genre/31/Super_Power'}]",[]
694,https://myanimelist.net/anime/694/Canvas_2__Niji-iro_no_Sketch,"{'jpg': {'image_url': 'https://cdn.myanimelist.net/images/anime/6/74076.jpg', 'small_image_url': 'https://cdn.myanimelist.net/images/anime/6/74076t.jpg', 'large_image_url': 'https://cdn.myanimelist.net/images/anime/6/74076l.jpg'}, 'webp': {'image_url': 'https://cdn.myanimelist.net/images/anime/6/74076.webp', 'small_image_url': 'https://cdn.myanimelist.net/images/anime/6/74076t.webp', 'large_image_url': 'https://cdn.myanimelist.net/images/anime/6/74076l.webp'}}","{'youtube_id': None, 'url': None, 'embed_url': None, 'images': {'image_url': None, 'small_image_url': None, 'medium_image_url': None, 'large_image_url': None, 'maximum_image_url': None}}","""Canvas 2: Niji-iro no Sketch""",Canvas 2: Rainbow Colored Sketch,Canvas2 ～虹色のスケッチ～,[],TV,Visual novel,24,Finished Airing,False,"{'from': '2005-10-02T00:00:00+00:00', 'to': '2006-03-26T00:00:00+00:00', 'prop': {'from': {'day': 2, 'month': 10, 'year': 2005}, 'to': {'day': 26, 'month': 3, 'year': 2006}}, 'string': 'Oct 2, 2005 to Mar 26, 2006'}",24 min per ep,PG-13 - Teens 13 or older,6.75,10522.0,4881,3666,25492,46,"Kamikura Hiroki is an art student at the local school Nadesico Academy (High School and college level) whom intends to be an art teacher in the future. He is also the advisor to the high school arts society where his cousin, Housen Elis, attends. While Elis is a painter like Hiroki, Hiroki seems to have given up on his dreams and no longer paints. There appears to be some mysterious trauma in the both of their pasts which may have changed them. Meanwhile, the high school hires a new PE teacher, Kikyo Kiri. On the first day, she bumps into Hiroki and is stunned. Here is the boy she confessed to and he refused her... (Source: ANN)",,fall,2005,"{'day': None, 'time': None, 'timezone': None, 'string': 'Unknown'}","[{'mal_id': 315, 'type': 'anime', 'name': 'DAX Production', 'url': 'https://myanimelist.net/anime/producer/315/DAX_Production'}]",[],"[{'mal_id': 218, 'type': 'anime', 'name': 'Zexcs', 'url': 'https://myanimelist.net/anime/producer/218/Zexcs'}]","[{'mal_id': 4, 'type': 'anime', 'name': 'Comedy', 'url': 'https://myanimelist.net/anime/genre/4/Comedy'}, {'mal_id': 8, 'type': 'anime', 'name': 'Drama', 'url': 'https://myanimelist.net/anime/genre/8/Drama'}, {'mal_id': 22, 'type': 'anime', 'name': 'Romance', 'url': 'https://myanimelist.net/anime/genre/22/Romance'}, {'mal_id': 36, 'type': 'anime', 'name': 'Slice of Life', 'url': 'https://myanimelist.net/anime/genre/36/Slice_of_Life'}]",[],[],[]
388,https://myanimelist.net/anime/388/Capeta,"{'jpg': {'image_url': 'https://cdn.myanimelist.net/images/anime/5/17667.jpg', 'small_image_url': 'https://cdn.myanimelist.net/images/anime/5/17667t.jpg', 'large_image_url': 'https://cdn.myanimelist.net/images/anime/5/17667l.jpg'}, 'webp': {'image_url': 'https://cdn.myanimelist.net/images/anime/5/17667.webp', 'small_image_url': 'https://cdn.myanimelist.net/images/anime/5/17667t.webp', 'large_image_url': 'https://cdn.myanimelist.net/images/anime/5/17667l.webp'}}","{'youtube_id': None, 'url': None, 'embed_url': None, 'images': {'image_url': None, 'small_image_url': None, 'medium_image_url': None, 'large_image_url': None, 'maximum_image_url': None}}","""Capeta""",,カペタ,[],TV,Manga,52,Finished Airing,False,"{'from': '2005-10-04T00:00:00+00:00', 'to': '2006-09-26T00:00:00+00:00', 'prop': {'from': {'day': 4, 'month': 10, 'year': 2005}, 'to': {'day': 26, 'month': 9, 'year': 2006}}, 'string': 'Oct 4, 2005 to Sep 26, 2006'}",23 min per ep,PG - Children,7.83,9970.0,813,3827,23305,253,"After losing his mother at a very young age, elementary school student Capeta Taira is forced to become more independent to avoid his father worrying for him. Working in a paving company, his father is often busy and has to work overtime to make ends meet. However, no matter how tough he acts in front of his father, Capeta is ultimately just a lonely kid with a rough life. In addition to his typical house duties, he has to deal with the bully Nobu Andou which makes him feel worse, despite support from his classmate, Monami Suzuki. One day, Capeta's father sees young go-kart drivers racing at high speeds and gets inspired by the scene. He then decides to collect scrapped parts available on the track and begins working on a gift for his son. Meanwhile, Capeta and Monami sneak into his workplace, suspecting that his father is up to something. Much to their surprise, they see a go-kart built from discarded parts—with Capeta's name attached to it! Although it lacks an engine and looks worn out, the kart is mostly complete and functional. Despite the heavy rain, Capeta cannot resist the urge to try out this new machinery. As he drives the kart downhill on a wet road, an incident that is almost a dangerous accident instead becomes a thrilling obsession. No longer bored with life, the engine of Capeta's heart is ignited with a new passion as he journeys into the world of racing. [Written by MAL Rewrite]",,fall,2005,"{'day': 'Tuesdays', 'time': '18:00', 'timezone': 'Asia/Tokyo', 'string': 'Tuesdays at 18:00 (JST)'}","[{'mal_id': 16, 'type': 'anime', 'name': 'TV Tokyo', 'url': 'https://myanimelist.net/anime/producer/16/TV_Tokyo'}, {'mal_id': 64, 'type': 'anime', 'name': 'Sotsu', 'url': 'https://myanimelist.net/anime/producer/64/Sotsu'}, {'mal_id': 82, 'type': 'anime', 'name': 'Marvelous', 'url': 'https://myanimelist.net/anime/producer/82/Marvelous'}, {'mal_id': 711, 'type': 'anime', 'name': 'Delfi Sound', 'url': 'https://myanimelist.net/anime/producer/711/Delfi_Sound'}]",[],"[{'mal_id': 126, 'type': 'anime', 'name': 'Studio Comet', 'url': 'https://myanimelist.net/anime/producer/126/Studio_Comet'}]","[{'mal_id': 30, 'type': 'anime', 'name': 'Sports', 'url': 'https://myanimelist.net/anime/genre/30/Sports'}]",[],"[{'mal_id': 3, 'type': 'anime', 'name': 'Cars', 'url': 'https://myanimelist.net/anime/genre/3/Cars'}]","[{'mal_id': 27, 'type': 'anime', 'name': 'Shounen', 'url': 'https://myanimelist.net/anime/genre/27/Shounen'}]"
471,https://myanimelist.net/anime/471/To_Heart_2,"{'jpg': {'image_url': 'https://cdn.myanimelist.net/images/anime/3/57423.jpg', 'small_image_url': 'https://cdn.myanimelist.net/images/anime/3/57423t.jpg', 'large_image_url': 'https://cdn.myanimelist.net/images/anime/3/57423l.jpg'}, 'webp': {'image_url': 'https://cdn.myanimelist.net/images/anime/3/57423.webp', 'small_image_url': 'https://cdn.myanimelist.net/images/anime/3/57423t.webp', 'large_image_url': 'https://cdn.myanimelist.net/images/anime/3/57423l.webp'}}","{'youtube_id': None, 'url': None, 'embed_url': None, 'images': {'image_url': None, 'small_image_url': None, 'medium_image_url': None, 'large_image_url': None, 'maximum_image_url': None}}","""To Heart 2""",To Heart 2,トゥハート2,['ToHeart2'],TV,Visual novel,13,Finished Airing,False,"{'from': '2005-10-04T00:00:00+00:00', 'to': '2006-01-03T00:00:00+00:00', 'prop': {'from': {'day': 4, 'month': 10, 'year': 2005}, 'to': {'day': 3, 'month': 1, 'year': 2006}}, 'string': 'Oct 4, 2005 to Jan 3, 2006'}",24 min per ep,PG-13 - Teens 13 or older,6.49,6360.0,6261,4137,19456,32,"Following her graduation from middle school, Konomi Yuzuhara enters the same high school as Takaaki Kono, her childhood friend. As the new school year begins, they meet their childhood friend Tamaki Kosaka, as well as many new accquaintances. Unbeknownst to the group, their encounters with each other will soon lead to many memorable adventures. (Source: ANN)",,fall,2005,"{'day': None, 'time': None, 'timezone': None, 'string': 'Unknown'}",[],"[{'mal_id': 490, 'type': 'anime', 'name': 'Maiden Japan', 'url': 'https://myanimelist.net/anime/producer/490/Maiden_Japan'}]","[{'mal_id': 28, 'type': 'anime', 'name': 'OLM', 'url': 'https://myanimelist.net/anime/producer/28/OLM'}]","[{'mal_id': 4, 'type': 'anime', 'name': 'Comedy', 'url': 'https://myanimelist.net/anime/genre/4/Comedy'}, {'mal_id': 8, 'type': 'anime', 'name': 'Drama', 'url': 'https://myanimelist.net/anime/genre/8/Drama'}, {'mal_id': 22, 'type': 'anime', 'name': 'Romance', 'url': 'https://myanimelist.net/anime/genre/22/Romance'}, {'mal_id': 36, 'type': 'anime', 'name': 'Slice of Life', 'url': 'https://myanimelist.net/anime/genre/36/Slice_of_Life'}]",[],"[{'mal_id': 35, 'type': 'anime', 'name': 'Harem', 'url': 'https://myanimelist.net/anime/genre/35/Harem'}, {'mal_id': 23, 'type': 'anime', 'name': 'School', 'url': 'https://myanimelist.net/anime/genre/23/School'}]",[]
3270,https://myanimelist.net/anime/3270/IGPX__Immortal_Grand_Prix_2005,"{'jpg': {'image_url': 'https://cdn.myanimelist.net/images/anime/9/5176.jpg', 'small_image_url': 'https://cdn.myanimelist.net/images/anime/9/5176t.jpg', 'large_image_url': 'https://cdn.myanimelist.net/images/anime/9/5176l.jpg'}, 'webp': {'image_url': 'https://cdn.myanimelist.net/images/anime/9/5176.webp', 'small_image_url': 'https://cdn.myanimelist.net/images/anime/9/5176t.webp', 'large_image_url': 'https://cdn.myanimelist.net/images/anime/9/5176l.webp'}}","{'youtube_id': '63hFWe2N0mU', 'url': 'https://www.youtube.com/watch?v=63hFWe2N0mU', 'embed_url': 'https://www.youtube.com/embed/63hFWe2N0mU?enablejsapi=1&wmode=opaque&autoplay=1', 'images': {'image_url': 'https://img.youtube.com/vi/63hFWe2N0mU/default.jpg', 'small_image_url': 'https://img.youtube.com/vi/63hFWe2N0mU/sddefault.jpg', 'medium_image_url': 'https://img.youtube.com/vi/63hFWe2N0mU/mqdefault.jpg', 'large_image_url': 'https://img.youtube.com/vi/63hFWe2N0mU/hqdefault.jpg', 'maximum_image_url': 'https://img.youtube.com/vi/63hFWe2N0mU/maxresdefault.jpg'}}","""IGPX: Immortal Grand Prix (2005)""",IGPX: Immortal Grand Prix,IGPX -Immortal Grand Prix-,[],TV,Original,13,Finished Airing,False,"{'from': '2005-10-06T00:00:00+00:00', 'to': '2006-03-30T00:00:00+00:00', 'prop': {'from': {'day': 6, 'month': 10, 'year': 2005}, 'to': {'day': 30, 'month': 3, 'year': 2006}}, 'string': 'Oct 6, 2005 to Mar 30, 2006'}",23 min per ep,PG-13 - Teens 13 or older,7.09,7597.0,3415,4274,18245,79,"In the year 2048, people are raving about a fighting race called “Immortal Grand Prix”, or IGPX in short, which is faster and more exciting than any of the existing motor sports. The phenomenon is so big that an entire city was built for the racing industry where competitions take place on a huge track. In the “Immortal Grand Prix,” two teams of three IG machines, high-tech humanoid mechs driven by humans, race at speeds greater than 400km/h. The teams make three laps of a 60 km course while intercepting the opponent as they vie for a first place finish. The best machine performance, the best pilots and the best teamwork are the only factors that can make them the winners. (Source: Production I.G.)",,fall,2005,"{'day': None, 'time': None, 'timezone': None, 'string': 'Unknown'}","[{'mal_id': 23, 'type': 'anime', 'name': 'Bandai Visual', 'url': 'https://myanimelist.net/anime/producer/23/Bandai_Visual'}]","[{'mal_id': 233, 'type': 'anime', 'name': 'Bandai Entertainment', 'url': 'https://myanimelist.net/anime/producer/233/Bandai_Entertainment'}, {'mal_id': 467, 'type': 'anime', 'name': 'Discotek Media', 'url': 'https://myanimelist.net/anime/producer/467/Discotek_Media'}]","[{'mal_id': 10, 'type': 'anime', 'name': 'Production I.G', 'url': 'https://myanimelist.net/anime/producer/10/Production_IG'}]","[{'mal_id': 8, 'type': 'anime', 'name': 'Drama', 'url': 'https://myanimelist.net/anime/genre/8/Drama'}, {'mal_id': 24, 'type': 'anime', 'name': 'Sci-Fi', 'url': 'https://myanimelist.net/anime/genre/24/Sci-Fi'}, {'mal_id': 30, 'type': 'anime', 'name': 'Sports', 'url': 'https://myanimelist.net/anime/genre/30/Sports'}]",[],"[{'mal_id': 18, 'type': 'anime', 'name': 'Mecha', 'url': 'https://myanimelist.net/anime/genre/18/Mecha'}]","[{'mal_id': 27, 'type': 'anime', 'name': 'Shounen', 'url': 'https://myanimelist.net/anime/genre/27/Shounen'}]"
282,https://myanimelist.net/anime/282/Angel_Heart,"{'jpg': {'image_url': 'https://cdn.myanimelist.net/images/anime/1/282.jpg', 'small_image_url': 'https://cdn.myanimelist.net/images/anime/1/282t.jpg', 'large_image_url': 'https://cdn.myanimelist.net/images/anime/1/282l.jpg'}, 'webp': {'image_url': 'https://cdn.myanimelist.net/images/anime/1/282.webp', 'small_image_url': 'https://cdn.myanimelist.net/images/anime/1/282t.webp', 'large_image_url': 'https://cdn.myanimelist.net/images/anime/1/282l.webp'}}","{'youtube_id': None, 'url': None, 'embed_url': None, 'images': {'image_url': None, 'small_image_url': None, 'medium_image_url': None, 'large_image_url': None, 'maximum_image_url': None}}","""Angel Heart""",,エンジェル・ハート,[],TV,Manga,50,Finished Airing,False,"{'from': '2005-10-04T00:00:00+00:00', 'to': '2006-09-26T00:00:00+00:00', 'prop': {'from': {'day': 4, 'month': 10, 'year': 2005}, 'to': {'day': 26, 'month': 9, 'year': 2006}}, 'string': 'Oct 4, 2005 to Sep 26, 2006'}",23 min per ep,PG-13 - Teens 13 or older,7.28,4519.0,2523,4506,15977,73,"A young Taiwanese assassin codenamed ""Glass Heart"" committed suicide by jumping off a building, and her heart was pierced by metal fence. Miraculously, her life was saved by heart transplantation. During her recovery she began to experience strange dreams, which lead her to Japan looking for the donor of her heart, who happens to be Kaori Makimura, former partner of City Hunter Ryo Saeba. The author mentioned in the first tankoubon volume that Angel Heart only shares the same characters of City Hunter but not its continuation. The events are all parallel universe, therefore it has nothing to do with City Hunter. (Source: Wikipedia)",,fall,2005,"{'day': None, 'time': None, 'timezone': None, 'string': 'Tuesdays at Unknown'}","[{'mal_id': 17, 'type': 'anime', 'name': 'Aniplex', 'url': 'https://myanimelist.net/anime/producer/17/Aniplex'}]",[],"[{'mal_id': 73, 'type': 'anime', 'name': 'TMS Entertainment', 'url': 'https://myanimelist.net/anime/producer/73/TMS_Entertainment'}]","[{'mal_id': 1, 'type': 'anime', 'name': 'Action', 'url': 'https://myanimelist.net/anime/genre/1/Action'}, {'mal_id': 8, 'type': 'anime', 'name': 'Drama', 'url': 'https://myanimelist.net/anime/genre/8/Drama'}, {'mal_id': 7, 'type': 'anime', 'name': 'Mystery', 'url': 'https://myanimelist.net/anime/genre/7/Mystery'}, {'mal_id': 22, 'type': 'anime', 'name': 'Romance', 'url': 'https://myanimelist.net/anime/genre/22/Romance'}]",[],[],"[{'mal_id': 42, 'type': 'anime', 'name': 'Seinen', 'url': 'https://myanimelist.net/anime/genre/42/Seinen'}]"
