mal_id,url,images,trailer,title,title_english,title_japanese,title_synonyms,type,source,episodes,status,airing,aired,duration,rating,score,scored_by,rank,popularity,members,favorites,synopsis,background,season,year,broadcast,producers,licensors,studios,genres,explicit_genres,themes,demographics
935,https://myanimelist.net/anime/935/Witchblade,"{'jpg': {'image_url': 'https://cdn.myanimelist.net/images/anime/1/935.jpg', 'small_image_url': 'https://cdn.myanimelist.net/images/anime/1/935t.jpg', 'large_image_url': 'https://cdn.myanimelist.net/images/anime/1/935l.jpg'}, 'webp': {'image_url': 'https://cdn.myanimelist.net/images/anime/1/935.webp', 'small_image_url': 'https://cdn.myanimelist.net/images/anime/1/935t.webp', 'large_image_url': 'https://cdn.myanimelist.net/images/anime/1/935l.webp'}}","{'youtube_id': 'sPpK3Nnn15A', 'url': 'https://www.youtube.com/watch?v=sPpK3Nnn15A', 'embed_url': 'https://www.youtube.com/embed/sPpK3Nnn15A?enablejsapi=1&wmode=opaque&autoplay=1', 'images': {'image_url': 'https://img.youtube.com/vi/sPpK3Nnn15A/default.jpg', 'small_image_url': 'https://img.youtube.com/vi/sPpK3Nnn15A/sddefault.jpg', 'medium_image_url': 'https://img.youtube.com/vi/sPpK3Nnn15A/mqdefault.jpg', 'large_image_url': 'https://img.youtube.com/vi/sPpK3Nnn15A/hqdefault.jpg', 'maximum_image_url': 'https://img.youtube.com/vi/sPpK3Nnn15A/maxresdefault.jpg'}}","""Witchblade""",Witchblade,ウィッチブレイド,[],TV,Other,24,Finished Airing,False,"{'from': '2006-04-06T00:00:00+00:00', 'to': '2006-09-21T00:00:00+00:00', 'prop': {'from': {'day': 6, 'month': 4, 'year': 2006}, 'to': {'day': 21, 'month': 9, 'year': 2006}}, 'string': 'Apr 6, 2006 to Sep 21, 2006'}",24 min per ep,R - 17+ (violence & profanity),7.23,41563.0,2782,1610,105307,517,"Masane Amaha and her daughter Rihoko are on the run from a government child welfare agency that wants to take Rihoko away from her mother. They are caught and Rihoko is taken away. Meanwhile, Masane is attacked by an advanced weapon that can disguise itself as a human being. When faced with the danger, a strange light emits from her wrist and she transforms into a powerful being. She destroys the weapon and consequently becomes involved in a power struggle between powerful organizations, with her at the center of their attention. Because she holds the greatest power of them all, the legendary Witchblade. (Source: AniDB)","Witchblade is based on the American comic book series of the same name. Although it is set in the same universe, the story and characters are entirely new.",spring,2006,"{'day': 'Thursdays', 'time': '01:45', 'timezone': 'Asia/Tokyo', 'string': 'Thursdays at 01:45 (JST)'}","[{'mal_id': 42, 'type': 'anime', 'name': 'GDH', 'url': 'https://myanimelist.net/anime/producer/42/GDH'}, {'mal_id': 147, 'type': 'anime', 'name': 'SKY Perfect Well Think', 'url': 'https://myanimelist.net/anime/producer/147/SKY_Perfect_Well_Think'}, {'mal_id': 1597, 'type': 'anime', 'name': 'Sotsu Music Publishing', 'url': 'https://myanimelist.net/anime/producer/1597/Sotsu_Music_Publishing'}]","[{'mal_id': 102, 'type': 'anime', 'name': 'Funimation', 'url': 'https://myanimelist.net/anime/producer/102/Funimation'}]","[{'mal_id': 3, 'type': 'anime', 'name': 'Gonzo', 'url': 'https://myanimelist.net/anime/producer/3/Gonzo'}]","[{'mal_id': 1, 'type': 'anime', 'name': 'Action', 'url': 'https://myanimelist.net/anime/genre/1/Action'}, {'mal_id': 24, 'type': 'anime', 'name': 'Sci-Fi', 'url': 'https://myanimelist.net/anime/genre/24/Sci-Fi'}]",[],"[{'mal_id': 31, 'type': 'anime', 'name': 'Super Power', 'url': 'https://myanimelist.net/anime/genre/31/Super_Power'}]",[]
957,https://myanimelist.net/anime/957/Saiunkoku_Monogatari,"{'jpg': {'image_url': 'https://cdn.myanimelist.net/images/anime/1/957.jpg', 'small_image_url': 'https://cdn.myanimelist.net/images/anime/1/957t.jpg', 'large_image_url': 'https://cdn.myanimelist.net/images/anime/1/957l.jpg'}, 'webp': {'image_url': 'https://cdn.myanimelist.net/images/anime/1/957.webp', 'small_image_url': 'https://cdn.myanimelist.net/images/anime/1/957t.webp', 'large_image_url': 'https://cdn.myanimelist.net/images/anime/1/957l.webp'}}","{'youtube_id': None, 'url': None, 'embed_url': None, 'images': {'image_url': None, 'small_image_url': None, 'medium_image_url': None, 'large_image_url': None, 'maximum_image_url': None}}","""Saiunkoku Monogatari""",The Story of Saiunkoku,彩雲国物語,"['The Tale of Saiun Country', 'Story of the Land of Many-Colored Clouds', 'Kokumono', 'Saimono', 'ColourCloud Palace']",TV,Light novel,39,Finished Airing,False,"{'from': '2006-04-08T00:00:00+00:00', 'to': '2007-02-24T00:00:00+00:00', 'prop': {'from': {'day': 8, 'month': 4, 'year': 2006}, 'to': {'day': 24, 'month': 2, 'year': 2007}}, 'string': 'Apr 8, 2006 to Feb 24, 2007'}",25 min per ep,PG-13 - Teens 13 or older,7.91,30495.0,685,1844,87084,1076,"Shuurei Kou, the daughter of a noble yet impoverished family, is a clever young lady who dreams of becoming a government official and contributing toward her country. However, her dream is out of her reach as such a position is forbidden to women. While her father works a low wage job as an archivist at the palace, Shuurei has to juggle odd jobs to make ends meet. Then, one day, an unexpected visit changes her life. Shuurei is called to assist Ryuuki Shi, the new emperor who is known for slacking on his duties and preferring the company of men. Tempted by the generous compensation, she readily accepts the chance to become the young emperor's consort for six months. Luckily, she is not alone as Seiran Shi, her trusty friend, joins her as Ryuuki's bodyguard. While tasked with transforming the new emperor into a responsible ruler, court life and politics prove troublesome as Shuurei faces the challenges of her new life. Set in a fictional country, Saiunkoku Monogatari centers on the idea of meaningful leadership, its adversities and the rewards that come alongside a prospering nation. [Written by MAL Rewrite]",,spring,2006,"{'day': None, 'time': None, 'timezone': None, 'string': 'Unknown'}","[{'mal_id': 111, 'type': 'anime', 'name': 'NHK', 'url': 'https://myanimelist.net/anime/producer/111/NHK'}, {'mal_id': 161, 'type': 'anime', 'name': 'Sogo Vision', 'url': 'https://myanimelist.net/anime/producer/161/Sogo_Vision'}]","[{'mal_id': 102, 'type': 'anime', 'name': 'Funimation', 'url': 'https://myanimelist.net/anime/producer/102/Funimation'}, {'mal_id': 1459, 'type': 'anime', 'name': 'Geneon Entertainment USA', 'url': 'https://myanimelist.net/anime/producer/1459/Geneon_Entertainment_USA'}]","[{'mal_id': 11, 'type': 'anime', 'name': 'Madhouse', 'url': 'https://myanimelist.net/anime/producer/11/Madhouse'}]","[{'mal_id': 2, 'type': 'anime', 'name': 'Adventure', 'url': 'https://myanimelist.net/anime/genre/2/Adventure'}, {'mal_id': 4, 'type': 'anime', 'name': 'Comedy', 'url': 'https://myanimelist.net/anime/genre/4/Comedy'}, {'mal_id': 8, 'type': 'anime', 'name': 'Drama', 'url': 'https://myanimelist.net/anime/genre/8/Drama'}, {'mal_id': 10, 'type': 'anime', 'name': 'Fantasy', 'url': 'https://myanimelist.net/anime/genre/10/Fantasy'}, {'mal_id': 22, 'type': 'anime', 'name': 'Romance', 'url': 'https://myanimelist.net/anime/genre/22/Romance'}]",[],"[{'mal_id': 13, 'type': 'anime', 'name': 'Historical', 'url': 'https://myanimelist.net/anime/genre/13/Historical'}]",[]
859,https://myanimelist.net/anime/859/Digimon_Savers,"{'jpg': {'image_url': 'https://cdn.myanimelist.net/images/anime/1415/100541.jpg', 'small_image_url': 'https://cdn.myanimelist.net/images/anime/1415/100541t.jpg', 'large_image_url': 'https://cdn.myanimelist.net/images/anime/1415/100541l.jpg'}, 'webp': {'image_url': 'https://cdn.myanimelist.net/images/anime/1415/100541.webp', 'small_image_url': 'https://cdn.myanimelist.net/images/anime/1415/100541t.webp', 'large_image_url': 'https://cdn.myanimelist.net/images/anime/1415/100541l.webp'}}","{'youtube_id': None, 'url': None, 'embed_url': None, 'images': {'image_url': None, 'small_image_url': None, 'medium_image_url': None, 'large_image_url': None, 'maximum_image_url': None}}","""Digimon Savers""",Digimon Data Squad,デジモンセイバーズ,[],TV,Original,48,Finished Airing,False,"{'from': '2006-04-02T00:00:00+00:00', 'to': '2007-03-25T00:00:00+00:00', 'prop': {'from': {'day': 2, 'month': 4, 'year': 2006}, 'to': {'day': 25, 'month': 3, 'year': 2007}}, 'string': 'Apr 2, 2006 to Mar 25, 2007'}",23 min per ep,PG - Children,6.94,44709.0,4054,1953,79503,289,"Upon meeting for the first time, undefeated street fighter Daimon, Masaru and renegade Digimon Agumon become friends in the most natural way possible for the knuckleheaded duo—by fighting their hearts out. The self-proclaimed ""ultimate team"" are recruited by a secret government organization called the Digimon Data Squad, or DATS, who had witnessed an unbelievable human fighting blow for blow with a Digimon. Their primary objective is investigating mysterious problems caused by Digimon entering the real world, and the world is currently in the midst of a crisis with Digimon appearing at an unprecedented rate. Embarking on various missions with DATS, Daimon and Agumon become colleagues with adolescent genius Touma Norstein and his Digimon partner Gaoman, along with the kind-hearted Yoshino ""Yoshi"" Fujeda and her Digimon partner Lalamon. As the group continues to investigate the rapid increase of Digimon in their world, a darker truth begins to surface, and it is up to Daimon, Agumon, and their friends to get to the bottom of things. [Written by MAL Rewrite]",,spring,2006,"{'day': 'Sundays', 'time': '09:00', 'timezone': 'Asia/Tokyo', 'string': 'Sundays at 09:00 (JST)'}","[{'mal_id': 169, 'type': 'anime', 'name': 'Fuji TV', 'url': 'https://myanimelist.net/anime/producer/169/Fuji_TV'}]","[{'mal_id': 1163, 'type': 'anime', 'name': 'Flatiron Film Company', 'url': 'https://myanimelist.net/anime/producer/1163/Flatiron_Film_Company'}]","[{'mal_id': 18, 'type': 'anime', 'name': 'Toei Animation', 'url': 'https://myanimelist.net/anime/producer/18/Toei_Animation'}]","[{'mal_id': 2, 'type': 'anime', 'name': 'Adventure', 'url': 'https://myanimelist.net/anime/genre/2/Adventure'}, {'mal_id': 4, 'type': 'anime', 'name': 'Comedy', 'url': 'https://myanimelist.net/anime/genre/4/Comedy'}, {'mal_id': 8, 'type': 'anime', 'name': 'Drama', 'url': 'https://myanimelist.net/anime/genre/8/Drama'}, {'mal_id': 10, 'type': 'anime', 'name': 'Fantasy', 'url': 'https://myanimelist.net/anime/genre/10/Fantasy'}]",[],[],"[{'mal_id': 27, 'type': 'anime', 'name': 'Shounen', 'url': 'https://myanimelist.net/anime/genre/27/Shounen'}]"
845,https://myanimelist.net/anime/845/Kiba,"{'jpg': {'image_url': 'https://cdn.myanimelist.net/images/anime/1522/114250.jpg', 'small_image_url': 'https://cdn.myanimelist.net/images/anime/1522/114250t.jpg', 'large_image_url': 'https://cdn.myanimelist.net/images/anime/1522/114250l.jpg'}, 'webp': {'image_url': 'https://cdn.myanimelist.net/images/anime/1522/114250.webp', 'small_image_url': 'https://cdn.myanimelist.net/images/anime/1522/114250t.webp', 'large_image_url': 'https://cdn.myanimelist.net/images/anime/1522/114250l.webp'}}","{'youtube_id': None, 'url': None, 'embed_url': None, 'images': {'image_url': None, 'small_image_url': None, 'medium_image_url': None, 'large_image_url': None, 'maximum_image_url': None}}","""Kiba""",Kiba,牙-KIBA-,['Fang'],TV,Original,51,Finished Airing,False,"{'from': '2006-04-02T00:00:00+00:00', 'to': '2007-03-25T00:00:00+00:00', 'prop': {'from': {'day': 2, 'month': 4, 'year': 2006}, 'to': {'day': 25, 'month': 3, 'year': 2007}}, 'string': 'Apr 2, 2006 to Mar 25, 2007'}",24 min per ep,PG-13 - Teens 13 or older,7.3,29034.0,2440,2057,72756,422,"In a dystopian future, two friends dream of freedom... and gain more than they bargain for! Hothead Zed is on the run from the authorities, while his brainy pal Noah struggles with his own battered body. Both find a magical world that seems to offer escape and power undreamed of. Join Zed and his powerful, rebellious spirit Amir Gaul on their search for the ultimate power. It's a force that can save the world—or destroy life as we know it. This is the world of KIBA! Where you must harness the power within and fight with all you got! (Source: RightStuf)",,spring,2006,"{'day': None, 'time': None, 'timezone': None, 'string': 'Unknown'}","[{'mal_id': 17, 'type': 'anime', 'name': 'Aniplex', 'url': 'https://myanimelist.net/anime/producer/17/Aniplex'}, {'mal_id': 242, 'type': 'anime', 'name': 'Ashi Production', 'url': 'https://myanimelist.net/anime/producer/242/Ashi_Production'}, {'mal_id': 757, 'type': 'anime', 'name': 'Sony Music Entertainment', 'url': 'https://myanimelist.net/anime/producer/757/Sony_Music_Entertainment'}]","[{'mal_id': 97, 'type': 'anime', 'name': 'ADV Films', 'url': 'https://myanimelist.net/anime/producer/97/ADV_Films'}, {'mal_id': 376, 'type': 'anime', 'name': 'Sentai Filmworks', 'url': 'https://myanimelist.net/anime/producer/376/Sentai_Filmworks'}]","[{'mal_id': 11, 'type': 'anime', 'name': 'Madhouse', 'url': 'https://myanimelist.net/anime/producer/11/Madhouse'}]","[{'mal_id': 2, 'type': 'anime', 'name': 'Adventure', 'url': 'https://myanimelist.net/anime/genre/2/Adventure'}, {'mal_id': 10, 'type': 'anime', 'name': 'Fantasy', 'url': 'https://myanimelist.net/anime/genre/10/Fantasy'}]",[],[],"[{'mal_id': 27, 'type': 'anime', 'name': 'Shounen', 'url': 'https://myanimelist.net/anime/genre/27/Shounen'}]"
962,https://myanimelist.net/anime/962/Aria_the_Natural,"{'jpg': {'image_url': 'https://cdn.myanimelist.net/images/anime/2/77621.jpg', 'small_image_url': 'https://cdn.myanimelist.net/images/anime/2/77621t.jpg', 'large_image_url': 'https://cdn.myanimelist.net/images/anime/2/77621l.jpg'}, 'webp': {'image_url': 'https://cdn.myanimelist.net/images/anime/2/77621.webp', 'small_image_url': 'https://cdn.myanimelist.net/images/anime/2/77621t.webp', 'large_image_url': 'https://cdn.myanimelist.net/images/anime/2/77621l.webp'}}","{'youtube_id': 'L4o29FP2C64', 'url': 'https://www.youtube.com/watch?v=L4o29FP2C64', 'embed_url': 'https://www.youtube.com/embed/L4o29FP2C64?enablejsapi=1&wmode=opaque&autoplay=1', 'images': {'image_url': 'https://img.youtube.com/vi/L4o29FP2C64/default.jpg', 'small_image_url': 'https://img.youtube.com/vi/L4o29FP2C64/sddefault.jpg', 'medium_image_url': 'https://img.youtube.com/vi/L4o29FP2C64/mqdefault.jpg', 'large_image_url': 'https://img.youtube.com/vi/L4o29FP2C64/hqdefault.jpg', 'maximum_image_url': 'https://img.youtube.com/vi/L4o29FP2C64/maxresdefault.jpg'}}","""Aria the Natural""",Aria the Natural,ARIA The NATURAL,['Aria 2'],TV,Manga,26,Finished Airing,False,"{'from': '2006-04-03T00:00:00+00:00', 'to': '2006-09-25T00:00:00+00:00', 'prop': {'from': {'day': 3, 'month': 4, 'year': 2006}, 'to': {'day': 25, 'month': 9, 'year': 2006}}, 'string': 'Apr 3, 2006 to Sep 25, 2006'}",24 min per ep,G - All Ages,8.18,25624.0,345,2093,70979,756,"Akari Mizunashi continues her training to become a Prima Undine (a professional tour guide gondolier) along with her friends Aika and Alice in the peaceful city of Neo Venezia. Despite the fact that these three girls are from competing companies, they are constantly together, learning more about how to become better tour guides and more about the mysteries of Neo Venezia. As the group continues to meet interesting and unforgettable people through their daily routines, they will also come closer to the secrets that make the enigmatic and ever beautiful city of Neo Venezia so warm and alive. Welcome back to Neo Venezia: the city where miracles can be created by hand. [Written by MAL Rewrite]",,spring,2006,"{'day': 'Mondays', 'time': '01:00', 'timezone': 'Asia/Tokyo', 'string': 'Mondays at 01:00 (JST)'}","[{'mal_id': 10, 'type': 'anime', 'name': 'Production I.G', 'url': 'https://myanimelist.net/anime/producer/10/Production_IG'}, {'mal_id': 16, 'type': 'anime', 'name': 'TV Tokyo', 'url': 'https://myanimelist.net/anime/producer/16/TV_Tokyo'}, {'mal_id': 109, 'type': 'anime', 'name': 'Shochiku', 'url': 'https://myanimelist.net/anime/producer/109/Shochiku'}, {'mal_id': 1452, 'type': 'anime', 'name': 'Mag Garden', 'url': 'https://myanimelist.net/anime/producer/1452/Mag_Garden'}]","[{'mal_id': 217, 'type': 'anime', 'name': 'Nozomi Entertainment', 'url': 'https://myanimelist.net/anime/producer/217/Nozomi_Entertainment'}]","[{'mal_id': 34, 'type': 'anime', 'name': 'Hal Film Maker', 'url': 'https://myanimelist.net/anime/producer/34/Hal_Film_Maker'}]","[{'mal_id': 10, 'type': 'anime', 'name': 'Fantasy', 'url': 'https://myanimelist.net/anime/genre/10/Fantasy'}, {'mal_id': 24, 'type': 'anime', 'name': 'Sci-Fi', 'url': 'https://myanimelist.net/anime/genre/24/Sci-Fi'}, {'mal_id': 36, 'type': 'anime', 'name': 'Slice of Life', 'url': 'https://myanimelist.net/anime/genre/36/Slice_of_Life'}]",[],[],"[{'mal_id': 27, 'type': 'anime', 'name': 'Shounen', 'url': 'https://myanimelist.net/anime/genre/27/Shounen'}]"
873,https://myanimelist.net/anime/873/hack__Roots,"{'jpg': {'image_url': 'https://cdn.myanimelist.net/images/anime/3/13050.jpg', 'small_image_url': 'https://cdn.myanimelist.net/images/anime/3/13050t.jpg', 'large_image_url': 'https://cdn.myanimelist.net/images/anime/3/13050l.jpg'}, 'webp': {'image_url': 'https://cdn.myanimelist.net/images/anime/3/13050.webp', 'small_image_url': 'https://cdn.myanimelist.net/images/anime/3/13050t.webp', 'large_image_url': 'https://cdn.myanimelist.net/images/anime/3/13050l.webp'}}","{'youtube_id': '6BynXXDlFB4', 'url': 'https://www.youtube.com/watch?v=6BynXXDlFB4', 'embed_url': 'https://www.youtube.com/embed/6BynXXDlFB4?enablejsapi=1&wmode=opaque&autoplay=1', 'images': {'image_url': 'https://img.youtube.com/vi/6BynXXDlFB4/default.jpg', 'small_image_url': 'https://img.youtube.com/vi/6BynXXDlFB4/sddefault.jpg', 'medium_image_url': 'https://img.youtube.com/vi/6BynXXDlFB4/mqdefault.jpg', 'large_image_url': 'https://img.youtube.com/vi/6BynXXDlFB4/hqdefault.jpg', 'maximum_image_url': 'https://img.youtube.com/vi/6BynXXDlFB4/maxresdefault.jpg'}}",""".hack//Roots""",.hack//roots,.hack//Roots,[],TV,Original,26,Finished Airing,False,"{'from': '2006-04-06T00:00:00+00:00', 'to': '2006-09-28T00:00:00+00:00', 'prop': {'from': {'day': 6, 'month': 4, 'year': 2006}, 'to': {'day': 28, 'month': 9, 'year': 2006}}, 'string': 'Apr 6, 2006 to Sep 28, 2006'}",24 min per ep,PG-13 - Teens 13 or older,6.88,31945.0,4316,2109,70234,226,"After the termination of the incredibly popular virtual reality MMORPG ""The World,"" a new version of the game—The World R:2—is brought online. On his first day in the game, newcomer Haseo thinks he has made some friends to quest with. However, as if mocking his sentiments, they kill his character just for fun. Luckily, he is saved by a mysterious, one-armed player named Ovan who offers to show him around The World. Alongside Ovan and his cleric friend Shino, Haseo enjoys a wonderful first year in the game. But this peaceful life is shattered when Shino's character is killed by a familiar figure notoriously known as Tri-Edge, whose victims have all fallen into comas in the real world. In a fit of rage, Haseo vows to find the elusive Tri-Edge and kill him. Taking place during Haseo's first year in The World, .hack//Roots explores the friendships Haseo built in the game before Tri-Edge ripped them away. [Written by MAL Rewrite]",,spring,2006,"{'day': None, 'time': None, 'timezone': None, 'string': 'Unknown'}","[{'mal_id': 16, 'type': 'anime', 'name': 'TV Tokyo', 'url': 'https://myanimelist.net/anime/producer/16/TV_Tokyo'}, {'mal_id': 23, 'type': 'anime', 'name': 'Bandai Visual', 'url': 'https://myanimelist.net/anime/producer/23/Bandai_Visual'}, {'mal_id': 231, 'type': 'anime', 'name': 'CyberConnect2', 'url': 'https://myanimelist.net/anime/producer/231/CyberConnect2'}]","[{'mal_id': 102, 'type': 'anime', 'name': 'Funimation', 'url': 'https://myanimelist.net/anime/producer/102/Funimation'}, {'mal_id': 233, 'type': 'anime', 'name': 'Bandai Entertainment', 'url': 'https://myanimelist.net/anime/producer/233/Bandai_Entertainment'}]","[{'mal_id': 5, 'type': 'anime', 'name': 'Bee Train', 'url': 'https://myanimelist.net/anime/producer/5/Bee_Train'}]","[{'mal_id': 2, 'type': 'anime', 'name': 'Adventure', 'url': 'https://myanimelist.net/anime/genre/2/Adventure'}, {'mal_id': 8, 'type': 'anime', 'name': 'Drama', 'url': 'https://myanimelist.net/anime/genre/8/Drama'}, {'mal_id': 10, 'type': 'anime', 'name': 'Fantasy', 'url': 'https://myanimelist.net/anime/genre/10/Fantasy'}, {'mal_id': 24, 'type': 'anime', 'name': 'Sci-Fi', 'url': 'https://myanimelist.net/anime/genre/24/Sci-Fi'}]",[],"[{'mal_id': 11, 'type': 'anime', 'name': 'Game', 'url': 'https://myanimelist.net/anime/genre/11/Game'}]",[]
953,https://myanimelist.net/anime/953/Juu_Ou_Sei,"{'jpg': {'image_url': 'https://cdn.myanimelist.net/images/anime/3/14079.jpg', 'small_image_url': 'https://cdn.myanimelist.net/images/anime/3/14079t.jpg', 'large_image_url': 'https://cdn.myanimelist.net/images/anime/3/14079l.jpg'}, 'webp': {'image_url': 'https://cdn.myanimelist.net/images/anime/3/14079.webp', 'small_image_url': 'https://cdn.myanimelist.net/images/anime/3/14079t.webp', 'large_image_url': 'https://cdn.myanimelist.net/images/anime/3/14079l.webp'}}","{'youtube_id': '-VPRBGoQ0so', 'url': 'https://www.youtube.com/watch?v=-VPRBGoQ0so', 'embed_url': 'https://www.youtube.com/embed/-VPRBGoQ0so?enablejsapi=1&wmode=opaque&autoplay=1', 'images': {'image_url': 'https://img.youtube.com/vi/-VPRBGoQ0so/default.jpg', 'small_image_url': 'https://img.youtube.com/vi/-VPRBGoQ0so/sddefault.jpg', 'medium_image_url': 'https://img.youtube.com/vi/-VPRBGoQ0so/mqdefault.jpg', 'large_image_url': 'https://img.youtube.com/vi/-VPRBGoQ0so/hqdefault.jpg', 'maximum_image_url': 'https://img.youtube.com/vi/-VPRBGoQ0so/maxresdefault.jpg'}}","""Juu Ou Sei""",Jyu-Oh-Sei: Planet of the Beast King,獣王星,"['Juuousei', 'Jyu Oh Sei']",TV,Manga,11,Finished Airing,False,"{'from': '2006-04-14T00:00:00+00:00', 'to': '2006-06-23T00:00:00+00:00', 'prop': {'from': {'day': 14, 'month': 4, 'year': 2006}, 'to': {'day': 23, 'month': 6, 'year': 2006}}, 'string': 'Apr 14, 2006 to Jun 23, 2006'}",22 min per ep,R - 17+ (violence & profanity),7.23,29985.0,2759,2176,67193,348,"After the murder of their parents, 11-year-old twin brothers Thor and Rai Klein are sent away from their home planet. They find themselves awakening on the terraformed planet of Chimaera, where carnivorous plants dominate and the few humans who live there are divided into four groups known as ""Rings."" Soon after, they meet a young man by the name of Zagi, and the twins learn that only the ""Jyu Oh Sei""—the one who conquers these four Rings—is allowed to leave the planet. Driven by the desire to return home and discover the truth behind the death of his parents, Thor resolves to survive in the harsh, merciless environment of Chimaera. However, he quickly learns there is more than meets the eye in this strange ecosystem. As Thor is swept up in the politics that entangle the Rings, he uncovers more about his parents' murder, and ultimately, humanity's fate as a whole. [Written by MAL Rewrite]",Jyu Oh Sei aired on Fuji Television's noitaminA block.,spring,2006,"{'day': None, 'time': None, 'timezone': None, 'string': 'Unknown'}","[{'mal_id': 53, 'type': 'anime', 'name': 'Dentsu', 'url': 'https://myanimelist.net/anime/producer/53/Dentsu'}, {'mal_id': 147, 'type': 'anime', 'name': 'SKY Perfect Well Think', 'url': 'https://myanimelist.net/anime/producer/147/SKY_Perfect_Well_Think'}, {'mal_id': 169, 'type': 'anime', 'name': 'Fuji TV', 'url': 'https://myanimelist.net/anime/producer/169/Fuji_TV'}, {'mal_id': 517, 'type': 'anime', 'name': 'Asmik Ace', 'url': 'https://myanimelist.net/anime/producer/517/Asmik_Ace'}, {'mal_id': 757, 'type': 'anime', 'name': 'Sony Music Entertainment', 'url': 'https://myanimelist.net/anime/producer/757/Sony_Music_Entertainment'}]","[{'mal_id': 102, 'type': 'anime', 'name': 'Funimation', 'url': 'https://myanimelist.net/anime/producer/102/Funimation'}]","[{'mal_id': 4, 'type': 'anime', 'name': 'Bones', 'url': 'https://myanimelist.net/anime/producer/4/Bones'}]","[{'mal_id': 1, 'type': 'anime', 'name': 'Action', 'url': 'https://myanimelist.net/anime/genre/1/Action'}, {'mal_id': 2, 'type': 'anime', 'name': 'Adventure', 'url': 'https://myanimelist.net/anime/genre/2/Adventure'}, {'mal_id': 8, 'type': 'anime', 'name': 'Drama', 'url': 'https://myanimelist.net/anime/genre/8/Drama'}, {'mal_id': 7, 'type': 'anime', 'name': 'Mystery', 'url': 'https://myanimelist.net/anime/genre/7/Mystery'}, {'mal_id': 24, 'type': 'anime', 'name': 'Sci-Fi', 'url': 'https://myanimelist.net/anime/genre/24/Sci-Fi'}]",[],[],"[{'mal_id': 25, 'type': 'anime', 'name': 'Shoujo', 'url': 'https://myanimelist.net/anime/genre/25/Shoujo'}]"
