mal_id,url,images,trailer,title,title_english,title_japanese,title_synonyms,type,source,episodes,status,airing,aired,duration,rating,score,scored_by,rank,popularity,members,favorites,synopsis,background,season,year,broadcast,producers,licensors,studios,genres,explicit_genres,themes,demographics
860,https://myanimelist.net/anime/860/Makai_Senki_Disgaea,"{'jpg': {'image_url': 'https://cdn.myanimelist.net/images/anime/11/20439.jpg', 'small_image_url': 'https://cdn.myanimelist.net/images/anime/11/20439t.jpg', 'large_image_url': 'https://cdn.myanimelist.net/images/anime/11/20439l.jpg'}, 'webp': {'image_url': 'https://cdn.myanimelist.net/images/anime/11/20439.webp', 'small_image_url': 'https://cdn.myanimelist.net/images/anime/11/20439t.webp', 'large_image_url': 'https://cdn.myanimelist.net/images/anime/11/20439l.webp'}}","{'youtube_id': 'LAXCGxlO7Zw', 'url': 'https://www.youtube.com/watch?v=LAXCGxlO7Zw', 'embed_url': 'https://www.youtube.com/embed/LAXCGxlO7Zw?enablejsapi=1&wmode=opaque&autoplay=1', 'images': {'image_url': 'https://img.youtube.com/vi/LAXCGxlO7Zw/default.jpg', 'small_image_url': 'https://img.youtube.com/vi/LAXCGxlO7Zw/sddefault.jpg', 'medium_image_url': 'https://img.youtube.com/vi/LAXCGxlO7Zw/mqdefault.jpg', 'large_image_url': 'https://img.youtube.com/vi/LAXCGxlO7Zw/hqdefault.jpg', 'maximum_image_url': 'https://img.youtube.com/vi/LAXCGxlO7Zw/maxresdefault.jpg'}}","""Makai Senki Disgaea""",Disgaea,魔界戦記ディスガイア,['Netherworld Battle Chronicle: Disgaea'],TV,Game,12,Finished Airing,False,"{'from': '2006-04-05T00:00:00+00:00', 'to': '2006-06-21T00:00:00+00:00', 'prop': {'from': {'day': 5, 'month': 4, 'year': 2006}, 'to': {'day': 21, 'month': 6, 'year': 2006}}, 'string': 'Apr 5, 2006 to Jun 21, 2006'}",24 min per ep,PG-13 - Teens 13 or older,6.73,18410.0,5010,2841,41234,138,"An angel arrives in Hell! A demon lord is awakened! There are penguins everywhere! What’s going on here? Angel assassin-in-training Flonne is on a quest to destroy the demon Overlord. Instead of accomplishing her mission, the ditzy Flonne manages to wake Laharl, the demon lord and heir to the throne, from his two year slumber. Now the pair, along with Laharl’s not-so-faithful vassal Etna and her army of explosive souls in penguin costumes, must restore order to the crumbling Netherworld. Based on the events of the game Disgaea: Hour of Darkness, Makai Senki Disgaea follows Laharl’s journey to squash the demon rebellion, reclaim the throne, and destroy anyone who stands in his path. Or, you know, let them join him on his travels if they really want. Just remember: Laharl is a demon lord. There’s no way he’ll ever show kindness, compassion, or love... right?",A preview animation of Makai Senki Disgaea included with the game Disgaea 2: Cursed Memories.,spring,2006,"{'day': None, 'time': None, 'timezone': None, 'string': 'Unknown'}","[{'mal_id': 1623, 'type': 'anime', 'name': 'Nippon Ichi Software', 'url': 'https://myanimelist.net/anime/producer/1623/Nippon_Ichi_Software'}]","[{'mal_id': 102, 'type': 'anime', 'name': 'Funimation', 'url': 'https://myanimelist.net/anime/producer/102/Funimation'}, {'mal_id': 1459, 'type': 'anime', 'name': 'Geneon Entertainment USA', 'url': 'https://myanimelist.net/anime/producer/1459/Geneon_Entertainment_USA'}]","[{'mal_id': 28, 'type': 'anime', 'name': 'OLM', 'url': 'https://myanimelist.net/anime/producer/28/OLM'}]","[{'mal_id': 1, 'type': 'anime', 'name': 'Action', 'url': 'https://myanimelist.net/anime/genre/1/Action'}, {'mal_id': 4, 'type': 'anime', 'name': 'Comedy', 'url': 'https://myanimelist.net/anime/genre/4/Comedy'}, {'mal_id': 10, 'type': 'anime', 'name': 'Fantasy', 'url': 'https://myanimelist.net/anime/genre/10/Fantasy'}]",[],"[{'mal_id': 6, 'type': 'anime', 'name': 'Demons', 'url': 'https://myanimelist.net/anime/genre/6/Demons'}]",[]
879,https://myanimelist.net/anime/879/Simoun,"{'jpg': {'image_url': 'https://cdn.myanimelist.net/images/anime/9/29109.jpg', 'small_image_url': 'https://cdn.myanimelist.net/images/anime/9/29109t.jpg', 'large_image_url': 'https://cdn.myanimelist.net/images/anime/9/29109l.jpg'}, 'webp': {'image_url': 'https://cdn.myanimelist.net/images/anime/9/29109.webp', 'small_image_url': 'https://cdn.myanimelist.net/images/anime/9/29109t.webp', 'large_image_url': 'https://cdn.myanimelist.net/images/anime/9/29109l.webp'}}","{'youtube_id': None, 'url': None, 'embed_url': None, 'images': {'image_url': None, 'small_image_url': None, 'medium_image_url': None, 'large_image_url': None, 'maximum_image_url': None}}","""Simoun""",,シムーン,"['Shimuun', 'Simoon']",TV,Original,26,Finished Airing,False,"{'from': '2006-04-03T00:00:00+00:00', 'to': '2006-09-25T00:00:00+00:00', 'prop': {'from': {'day': 3, 'month': 4, 'year': 2006}, 'to': {'day': 25, 'month': 9, 'year': 2006}}, 'string': 'Apr 3, 2006 to Sep 25, 2006'}",24 min per ep,PG-13 - Teens 13 or older,7.44,10009.0,1837,2944,38863,406,"In the peaceful theocracy of Simulicram, everyone is born female. At age 17, each maiden undergoes a special ceremony where she chooses her sex. However, only Pairs of maiden priestesses can synchronize with the ancient flying ships known as Simoun needed to defend Simulicram. These Pairs refrain from undergoing the ceremony as long as they wish to keep piloting their Simoun. Aer is recruited to be a Simoun pilot after a terrifying attack by an enemy nation decimates the squadron known as Chor Tempest. To earn her wings she needs to find her way into the heart of Neviril, Regina of Chor Tempest. But Neviril's heart still belongs to her previous Pair, lost in the battle when she attempted a forbidden Simoun maneuver. (Source: Media Blasters)",,spring,2006,"{'day': None, 'time': None, 'timezone': None, 'string': 'Unknown'}","[{'mal_id': 23, 'type': 'anime', 'name': 'Bandai Visual', 'url': 'https://myanimelist.net/anime/producer/23/Bandai_Visual'}, {'mal_id': 64, 'type': 'anime', 'name': 'Sotsu', 'url': 'https://myanimelist.net/anime/producer/64/Sotsu'}, {'mal_id': 717, 'type': 'anime', 'name': 'TV Tokyo Music', 'url': 'https://myanimelist.net/anime/producer/717/TV_Tokyo_Music'}]","[{'mal_id': 250, 'type': 'anime', 'name': 'Media Blasters', 'url': 'https://myanimelist.net/anime/producer/250/Media_Blasters'}]","[{'mal_id': 37, 'type': 'anime', 'name': 'Studio Deen', 'url': 'https://myanimelist.net/anime/producer/37/Studio_Deen'}]","[{'mal_id': 8, 'type': 'anime', 'name': 'Drama', 'url': 'https://myanimelist.net/anime/genre/8/Drama'}, {'mal_id': 10, 'type': 'anime', 'name': 'Fantasy', 'url': 'https://myanimelist.net/anime/genre/10/Fantasy'}, {'mal_id': 26, 'type': 'anime', 'name': 'Girls Love', 'url': 'https://myanimelist.net/anime/genre/26/Girls_Love'}, {'mal_id': 22, 'type': 'anime', 'name': 'Romance', 'url': 'https://myanimelist.net/anime/genre/22/Romance'}]",[],"[{'mal_id': 38, 'type': 'anime', 'name': 'Military', 'url': 'https://myanimelist.net/anime/genre/38/Military'}]",[]
1067,https://myanimelist.net/anime/1067/Kishin_Houkou_Demonbane_TV,"{'jpg': {'image_url': 'https://cdn.myanimelist.net/images/anime/1/1067.jpg', 'small_image_url': 'https://cdn.myanimelist.net/images/anime/1/1067t.jpg', 'large_image_url': 'https://cdn.myanimelist.net/images/anime/1/1067l.jpg'}, 'webp': {'image_url': 'https://cdn.myanimelist.net/images/anime/1/1067.webp', 'small_image_url': 'https://cdn.myanimelist.net/images/anime/1/1067t.webp', 'large_image_url': 'https://cdn.myanimelist.net/images/anime/1/1067l.webp'}}","{'youtube_id': None, 'url': None, 'embed_url': None, 'images': {'image_url': None, 'small_image_url': None, 'medium_image_url': None, 'large_image_url': None, 'maximum_image_url': None}}","""Kishin Houkou Demonbane (TV)""",,機神咆吼デモンベイン,"['Roar of the Machine God Demonbane', 'Kishin Houkou Demonbane (2006)']",TV,Visual novel,12,Finished Airing,False,"{'from': '2006-05-19T00:00:00+00:00', 'to': '2006-08-18T00:00:00+00:00', 'prop': {'from': {'day': 19, 'month': 5, 'year': 2006}, 'to': {'day': 18, 'month': 8, 'year': 2006}}, 'string': 'May 19, 2006 to Aug 18, 2006'}",25 min per ep,R - 17+ (violence & profanity),6.56,11928.0,5884,3142,34675,39,"Kurou Daijuuji is a poor detective living in Arkham City. One day, he was requested by Ruri Hado of Hado Financial Group, to search for a magic book. While he initially refused, Ruri offered him a large sum of money upon completion of her request, in which bribed Kuro to accept. As Kurou searches for the book, he unexpectedly runs into Al, a pretty girl that is actually a powerful grimoire. They forge a contract with each other, bestowing Kuro with powerful magic. Soon afterwards, Al also activates Demonbane, a deus machina owned by the Hado Financial Group, to combat the mechanical menace from the Black Lodge. With this, the war between the Hado Financial Group and the Black Lodge begins.... (Source: ANN)",,spring,2006,"{'day': None, 'time': None, 'timezone': None, 'string': 'Unknown'}",[],[],"[{'mal_id': 433, 'type': 'anime', 'name': 'View Works', 'url': 'https://myanimelist.net/anime/producer/433/View_Works'}]","[{'mal_id': 1, 'type': 'anime', 'name': 'Action', 'url': 'https://myanimelist.net/anime/genre/1/Action'}, {'mal_id': 22, 'type': 'anime', 'name': 'Romance', 'url': 'https://myanimelist.net/anime/genre/22/Romance'}, {'mal_id': 9, 'type': 'anime', 'name': 'Ecchi', 'url': 'https://myanimelist.net/anime/genre/9/Ecchi'}]",[],"[{'mal_id': 35, 'type': 'anime', 'name': 'Harem', 'url': 'https://myanimelist.net/anime/genre/35/Harem'}, {'mal_id': 18, 'type': 'anime', 'name': 'Mecha', 'url': 'https://myanimelist.net/anime/genre/18/Mecha'}]",[]
863,https://myanimelist.net/anime/863/Joshikousei__Girls_High,"{'jpg': {'image_url': 'https://cdn.myanimelist.net/images/anime/5/23224.jpg', 'small_image_url': 'https://cdn.myanimelist.net/images/anime/5/23224t.jpg', 'large_image_url': 'https://cdn.myanimelist.net/images/anime/5/23224l.jpg'}, 'webp': {'image_url': 'https://cdn.myanimelist.net/images/anime/5/23224.webp', 'small_image_url': 'https://cdn.myanimelist.net/images/anime/5/23224t.webp', 'large_image_url': 'https://cdn.myanimelist.net/images/anime/5/23224l.webp'}}","{'youtube_id': None, 'url': None, 'embed_url': None, 'images': {'image_url': None, 'small_image_url': None, 'medium_image_url': None, 'large_image_url': None, 'maximum_image_url': None}}","""Joshikousei: Girl's High""",High School Girls,女子高生 GIRL'S HIGH,"[""Joshi Kousei: Girl's High""]",TV,Manga,12,Finished Airing,False,"{'from': '2006-04-04T00:00:00+00:00', 'to': '2006-06-20T00:00:00+00:00', 'prop': {'from': {'day': 4, 'month': 4, 'year': 2006}, 'to': {'day': 20, 'month': 6, 'year': 2006}}, 'string': 'Apr 4, 2006 to Jun 20, 2006'}",24 min per ep,PG-13 - Teens 13 or older,6.58,13077.0,5774,3176,34005,53,"Eriko and her friends Yuma and Ayano are excited about entering high school. Their excitement leads to their breaking of the rules when they toured the school before the opening ceremony. They find out their preconceptions about the all female school may not be as true as they had first thought. Despite that, Eriko and her friends are joined by new friends. They aim to get through high school life together. (Source: ANN)",,spring,2006,"{'day': 'Tuesdays', 'time': '01:30', 'timezone': 'Asia/Tokyo', 'string': 'Tuesdays at 01:30 (JST)'}","[{'mal_id': 31, 'type': 'anime', 'name': 'Geneon Universal Entertainment', 'url': 'https://myanimelist.net/anime/producer/31/Geneon_Universal_Entertainment'}, {'mal_id': 79, 'type': 'anime', 'name': 'Genco', 'url': 'https://myanimelist.net/anime/producer/79/Genco'}, {'mal_id': 777, 'type': 'anime', 'name': 'Showgate', 'url': 'https://myanimelist.net/anime/producer/777/Showgate'}, {'mal_id': 1377, 'type': 'anime', 'name': 'Futabasha', 'url': 'https://myanimelist.net/anime/producer/1377/Futabasha'}]","[{'mal_id': 250, 'type': 'anime', 'name': 'Media Blasters', 'url': 'https://myanimelist.net/anime/producer/250/Media_Blasters'}]","[{'mal_id': 38, 'type': 'anime', 'name': 'Arms', 'url': 'https://myanimelist.net/anime/producer/38/Arms'}]","[{'mal_id': 4, 'type': 'anime', 'name': 'Comedy', 'url': 'https://myanimelist.net/anime/genre/4/Comedy'}, {'mal_id': 8, 'type': 'anime', 'name': 'Drama', 'url': 'https://myanimelist.net/anime/genre/8/Drama'}, {'mal_id': 36, 'type': 'anime', 'name': 'Slice of Life', 'url': 'https://myanimelist.net/anime/genre/36/Slice_of_Life'}, {'mal_id': 9, 'type': 'anime', 'name': 'Ecchi', 'url': 'https://myanimelist.net/anime/genre/9/Ecchi'}]",[],"[{'mal_id': 23, 'type': 'anime', 'name': 'School', 'url': 'https://myanimelist.net/anime/genre/23/School'}]",[]
878,https://myanimelist.net/anime/878/Zegapain,"{'jpg': {'image_url': 'https://cdn.myanimelist.net/images/anime/6/76949.jpg', 'small_image_url': 'https://cdn.myanimelist.net/images/anime/6/76949t.jpg', 'large_image_url': 'https://cdn.myanimelist.net/images/anime/6/76949l.jpg'}, 'webp': {'image_url': 'https://cdn.myanimelist.net/images/anime/6/76949.webp', 'small_image_url': 'https://cdn.myanimelist.net/images/anime/6/76949t.webp', 'large_image_url': 'https://cdn.myanimelist.net/images/anime/6/76949l.webp'}}","{'youtube_id': None, 'url': None, 'embed_url': None, 'images': {'image_url': None, 'small_image_url': None, 'medium_image_url': None, 'large_image_url': None, 'maximum_image_url': None}}","""Zegapain""",Zegapain,ゼーガペイン,[],TV,Original,26,Finished Airing,False,"{'from': '2006-04-06T00:00:00+00:00', 'to': '2006-09-28T00:00:00+00:00', 'prop': {'from': {'day': 6, 'month': 4, 'year': 2006}, 'to': {'day': 28, 'month': 9, 'year': 2006}}, 'string': 'Apr 6, 2006 to Sep 28, 2006'}",23 min per ep,PG-13 - Teens 13 or older,7.31,9647.0,2392,3297,31724,157,"Average high school student Kyou Sogoru is an avid swimmer living in beautiful Maihama City. He spends his days hanging out with friends, swimming, and playing video games. However, his normal life turns upside down when a beautiful and mysterious girl named Shizuno Misaki approaches him with a strange request—jump into their school's pool together. This fateful leap transports Kyou into a war-torn world where humans pilot impressive humanoid robots known as Zegas to fight against malicious aliens known as Gards-Orm. To spearhead this endeavor, humans have formed Cerebrum, a rebel organization working to prevent the Gards-Orm from eradicating humankind. As Kyou participates in combat operations, meets his fellow Zega pilots, and witnesses countless deaths, he begins to question the true nature of this world as well as his own life. [Written by MAL Rewrite]",,spring,2006,"{'day': 'Thursdays', 'time': '18:00', 'timezone': 'Asia/Tokyo', 'string': 'Thursdays at 18:00 (JST)'}","[{'mal_id': 16, 'type': 'anime', 'name': 'TV Tokyo', 'url': 'https://myanimelist.net/anime/producer/16/TV_Tokyo'}, {'mal_id': 53, 'type': 'anime', 'name': 'Dentsu', 'url': 'https://myanimelist.net/anime/producer/53/Dentsu'}, {'mal_id': 1175, 'type': 'anime', 'name': 'Atelier Musa', 'url': 'https://myanimelist.net/anime/producer/1175/Atelier_Musa'}]","[{'mal_id': 233, 'type': 'anime', 'name': 'Bandai Entertainment', 'url': 'https://myanimelist.net/anime/producer/233/Bandai_Entertainment'}, {'mal_id': 376, 'type': 'anime', 'name': 'Sentai Filmworks', 'url': 'https://myanimelist.net/anime/producer/376/Sentai_Filmworks'}]","[{'mal_id': 14, 'type': 'anime', 'name': 'Sunrise', 'url': 'https://myanimelist.net/anime/producer/14/Sunrise'}]","[{'mal_id': 1, 'type': 'anime', 'name': 'Action', 'url': 'https://myanimelist.net/anime/genre/1/Action'}, {'mal_id': 22, 'type': 'anime', 'name': 'Romance', 'url': 'https://myanimelist.net/anime/genre/22/Romance'}, {'mal_id': 24, 'type': 'anime', 'name': 'Sci-Fi', 'url': 'https://myanimelist.net/anime/genre/24/Sci-Fi'}]",[],"[{'mal_id': 18, 'type': 'anime', 'name': 'Mecha', 'url': 'https://myanimelist.net/anime/genre/18/Mecha'}]",[]
941,https://myanimelist.net/anime/941/Renkin_San-kyuu_Magical_Pokaan,"{'jpg': {'image_url': 'https://cdn.myanimelist.net/images/anime/6/75229.jpg', 'small_image_url': 'https://cdn.myanimelist.net/images/anime/6/75229t.jpg', 'large_image_url': 'https://cdn.myanimelist.net/images/anime/6/75229l.jpg'}, 'webp': {'image_url': 'https://cdn.myanimelist.net/images/anime/6/75229.webp', 'small_image_url': 'https://cdn.myanimelist.net/images/anime/6/75229t.webp', 'large_image_url': 'https://cdn.myanimelist.net/images/anime/6/75229l.webp'}}","{'youtube_id': None, 'url': None, 'embed_url': None, 'images': {'image_url': None, 'small_image_url': None, 'medium_image_url': None, 'large_image_url': None, 'maximum_image_url': None}}","""Renkin San-kyuu Magical? Pokaan""",,錬金3級 まじかる?ぽか〜ん,"['Magipoka', 'Renkin Sankyu Magical? Pokan', 'Renkin 3-kyuu Magical? Pokan']",TV,Original,12,Finished Airing,False,"{'from': '2006-04-04T00:00:00+00:00', 'to': '2006-06-20T00:00:00+00:00', 'prop': {'from': {'day': 4, 'month': 4, 'year': 2006}, 'to': {'day': 20, 'month': 6, 'year': 2006}}, 'string': 'Apr 4, 2006 to Jun 20, 2006'}",24 min per ep,R+ - Mild Nudity,6.98,8840.0,3881,3415,29420,113,"Renkin San-kyuu Magical? Pokaan follows the daily lives of four young girls. There is just one catch: they are anything but normal. This group of friends—the energetic werewolf Liru, the joyful witch-in-training Uma, the motherly android Aiko, and the seductive vampire Pachira—are actually princesses from the netherworld who have traveled to the human world in search of a new home. Unfortunately, their naivety and severe lack of knowledge make living peacefully among earthlings much more difficult than they imagined. As they attempt to adapt to their brand new lifestyle, they cause all sorts of trouble, and end up attracting the unwanted attention of a woman by the name of Dr. K-Ko. The scientist believes that these new residents of Earth are up to no good and attempts to capture the girls to prove the existence of the supernatural and gain credibility with the scientific community. Every day brings a new adventure as the girls deal with the insanity of her antics and all that the human realm has to offer. [Written by MAL Rewrite]",,spring,2006,"{'day': None, 'time': None, 'timezone': None, 'string': 'Unknown'}","[{'mal_id': 79, 'type': 'anime', 'name': 'Genco', 'url': 'https://myanimelist.net/anime/producer/79/Genco'}, {'mal_id': 104, 'type': 'anime', 'name': 'Lantis', 'url': 'https://myanimelist.net/anime/producer/104/Lantis'}, {'mal_id': 108, 'type': 'anime', 'name': 'Media Factory', 'url': 'https://myanimelist.net/anime/producer/108/Media_Factory'}]",[],"[{'mal_id': 49, 'type': 'anime', 'name': 'Remic', 'url': 'https://myanimelist.net/anime/producer/49/Remic'}]","[{'mal_id': 4, 'type': 'anime', 'name': 'Comedy', 'url': 'https://myanimelist.net/anime/genre/4/Comedy'}, {'mal_id': 9, 'type': 'anime', 'name': 'Ecchi', 'url': 'https://myanimelist.net/anime/genre/9/Ecchi'}]",[],"[{'mal_id': 20, 'type': 'anime', 'name': 'Parody', 'url': 'https://myanimelist.net/anime/genre/20/Parody'}, {'mal_id': 32, 'type': 'anime', 'name': 'Vampire', 'url': 'https://myanimelist.net/anime/genre/32/Vampire'}]",[]
1516,https://myanimelist.net/anime/1516/Kirarin☆Revolution,"{'jpg': {'image_url': 'https://cdn.myanimelist.net/images/anime/1796/94726.jpg', 'small_image_url': 'https://cdn.myanimelist.net/images/anime/1796/94726t.jpg', 'large_image_url': 'https://cdn.myanimelist.net/images/anime/1796/94726l.jpg'}, 'webp': {'image_url': 'https://cdn.myanimelist.net/images/anime/1796/94726.webp', 'small_image_url': 'https://cdn.myanimelist.net/images/anime/1796/94726t.webp', 'large_image_url': 'https://cdn.myanimelist.net/images/anime/1796/94726l.webp'}}","{'youtube_id': None, 'url': None, 'embed_url': None, 'images': {'image_url': None, 'small_image_url': None, 'medium_image_url': None, 'large_image_url': None, 'maximum_image_url': None}}","""Kirarin☆Revolution""",Kirarin Revolution,きらりん☆レボリューション,[],TV,Manga,153,Finished Airing,False,"{'from': '2006-04-07T00:00:00+00:00', 'to': '2009-03-27T00:00:00+00:00', 'prop': {'from': {'day': 7, 'month': 4, 'year': 2006}, 'to': {'day': 27, 'month': 3, 'year': 2009}}, 'string': 'Apr 7, 2006 to Mar 27, 2009'}",22 min per ep,PG-13 - Teens 13 or older,7.05,10005.0,3597,3487,28262,219,"Kirari Tsukishima, a gluttonous 14-year-old beauty, is a girl who does not care about idols and the entertainment world because her mind is occupied by food. Her obsession with food only causes her to be clueless about love. One day, after saving a turtle that is stranded in a tree, Kirari meets with a handsome and gentle boy named Seiji, who gives her ticket to a SHIPS (a popular idol group) concert to show his gratitude for her saving his pet. Kirari then storms off to the concert and runs into another boy, who tears up her ticket and warns her to stay away from Seiji because she and Seiji live in different worlds. The outraged Kirari then sneaks into the concert, only to discover that Seiji and the boy who tore her ticket, named Hiroto, are actually members of SHIPS. Finally understanding the meaning of ""different worlds"" (Seiji is a popular idol while she is an average middle school student), Kirari refuses to give up. Filled with determination to be with Seiji, she declares that she will also become an idol. (Source: Wikipedia)",,spring,2006,"{'day': 'Fridays', 'time': '18:00', 'timezone': 'Asia/Tokyo', 'string': 'Fridays at 18:00 (JST)'}","[{'mal_id': 62, 'type': 'anime', 'name': 'Shogakukan-Shueisha Productions', 'url': 'https://myanimelist.net/anime/producer/62/Shogakukan-Shueisha_Productions'}, {'mal_id': 119, 'type': 'anime', 'name': 'VIZ Media', 'url': 'https://myanimelist.net/anime/producer/119/VIZ_Media'}, {'mal_id': 131, 'type': 'anime', 'name': 'G&G Entertainment', 'url': 'https://myanimelist.net/anime/producer/131/G_G_Entertainment'}, {'mal_id': 135, 'type': 'anime', 'name': 'MediaNet', 'url': 'https://myanimelist.net/anime/producer/135/MediaNet'}, {'mal_id': 757, 'type': 'anime', 'name': 'Sony Music Entertainment', 'url': 'https://myanimelist.net/anime/producer/757/Sony_Music_Entertainment'}]",[],"[{'mal_id': 118, 'type': 'anime', 'name': 'SynergySP', 'url': 'https://myanimelist.net/anime/producer/118/SynergySP'}]","[{'mal_id': 4, 'type': 'anime', 'name': 'Comedy', 'url': 'https://myanimelist.net/anime/genre/4/Comedy'}, {'mal_id': 8, 'type': 'anime', 'name': 'Drama', 'url': 'https://myanimelist.net/anime/genre/8/Drama'}, {'mal_id': 22, 'type': 'anime', 'name': 'Romance', 'url': 'https://myanimelist.net/anime/genre/22/Romance'}]",[],[],"[{'mal_id': 25, 'type': 'anime', 'name': 'Shoujo', 'url': 'https://myanimelist.net/anime/genre/25/Shoujo'}]"
910,https://myanimelist.net/anime/910/Himawari,"{'jpg': {'image_url': 'https://cdn.myanimelist.net/images/anime/3/10221.jpg', 'small_image_url': 'https://cdn.myanimelist.net/images/anime/3/10221t.jpg', 'large_image_url': 'https://cdn.myanimelist.net/images/anime/3/10221l.jpg'}, 'webp': {'image_url': 'https://cdn.myanimelist.net/images/anime/3/10221.webp', 'small_image_url': 'https://cdn.myanimelist.net/images/anime/3/10221t.webp', 'large_image_url': 'https://cdn.myanimelist.net/images/anime/3/10221l.webp'}}","{'youtube_id': None, 'url': None, 'embed_url': None, 'images': {'image_url': None, 'small_image_url': None, 'medium_image_url': None, 'large_image_url': None, 'maximum_image_url': None}}","""Himawari!""",Himawari!,ひまわりっ!,['Himawari'],TV,Original,13,Finished Airing,False,"{'from': '2006-04-09T00:00:00+00:00', 'to': '2006-07-02T00:00:00+00:00', 'prop': {'from': {'day': 9, 'month': 4, 'year': 2006}, 'to': {'day': 2, 'month': 7, 'year': 2006}}, 'string': 'Apr 9, 2006 to Jul 2, 2006'}",24 min per ep,PG-13 - Teens 13 or older,6.33,6719.0,7042,3875,22696,13,"Himawari Hinata recently transfered to Shinobi Gakuen to train to become the best kunoichi she can be. She wanted to be a ninja ever since she was saved by one when she was little. On her first day, she meets Hayato Madenokoji (a new transfer teacher) who saves her life. Hayato does not possess any ninja skills or traits, he is teaching the ninjas about normal society to pay off his debt. However, Himawari notices that Hayato bares the same mark on his neck as the ninja who saved her when she was young. (Source: ANN)",,spring,2006,"{'day': None, 'time': None, 'timezone': None, 'string': 'Unknown'}","[{'mal_id': 79, 'type': 'anime', 'name': 'Genco', 'url': 'https://myanimelist.net/anime/producer/79/Genco'}, {'mal_id': 92, 'type': 'anime', 'name': 'Starchild Records', 'url': 'https://myanimelist.net/anime/producer/92/Starchild_Records'}, {'mal_id': 577, 'type': 'anime', 'name': 'Tohokushinsha Film Corporation', 'url': 'https://myanimelist.net/anime/producer/577/Tohokushinsha_Film_Corporation'}]","[{'mal_id': 490, 'type': 'anime', 'name': 'Maiden Japan', 'url': 'https://myanimelist.net/anime/producer/490/Maiden_Japan'}]","[{'mal_id': 38, 'type': 'anime', 'name': 'Arms', 'url': 'https://myanimelist.net/anime/producer/38/Arms'}]","[{'mal_id': 2, 'type': 'anime', 'name': 'Adventure', 'url': 'https://myanimelist.net/anime/genre/2/Adventure'}, {'mal_id': 4, 'type': 'anime', 'name': 'Comedy', 'url': 'https://myanimelist.net/anime/genre/4/Comedy'}]",[],"[{'mal_id': 17, 'type': 'anime', 'name': 'Martial Arts', 'url': 'https://myanimelist.net/anime/genre/17/Martial_Arts'}]",[]
