mal_id,url,images,trailer,title,title_english,title_japanese,title_synonyms,type,source,episodes,status,airing,aired,duration,rating,score,scored_by,rank,popularity,members,favorites,synopsis,background,season,year,broadcast,producers,licensors,studios,genres,explicit_genres,themes,demographics
2926,https://myanimelist.net/anime/2926/Myself__Yourself,"{'jpg': {'image_url': 'https://cdn.myanimelist.net/images/anime/13/75247.jpg', 'small_image_url': 'https://cdn.myanimelist.net/images/anime/13/75247t.jpg', 'large_image_url': 'https://cdn.myanimelist.net/images/anime/13/75247l.jpg'}, 'webp': {'image_url': 'https://cdn.myanimelist.net/images/anime/13/75247.webp', 'small_image_url': 'https://cdn.myanimelist.net/images/anime/13/75247t.webp', 'large_image_url': 'https://cdn.myanimelist.net/images/anime/13/75247l.webp'}}","{'youtube_id': None, 'url': None, 'embed_url': None, 'images': {'image_url': None, 'small_image_url': None, 'medium_image_url': None, 'large_image_url': None, 'maximum_image_url': None}}","""Myself; Yourself""",Myself; Yourself,マイセルフ; ユアセルフ,[],TV,Visual novel,13,Finished Airing,False,"{'from': '2007-10-03T00:00:00+00:00', 'to': '2007-12-26T00:00:00+00:00', 'prop': {'from': {'day': 3, 'month': 10, 'year': 2007}, 'to': {'day': 26, 'month': 12, 'year': 2007}}, 'string': 'Oct 3, 2007 to Dec 26, 2007'}",25 min per ep,PG-13 - Teens 13 or older,7.15,89663.0,3158,1048,175831,761,"In the peaceful little town of Sakuranomori, a group of young friends are about to bid farewell to one of their own. Due to his parents’ business plans, Sana Hidaka has to move away from his quiet childhood home to the boisterous city of Tokyo. Though it pains him, he must say goodbye to his precious friends—the kind-hearted Aoi Oribe, the spunky Wakatsuki twins, Shuri and Shuusuke, and the cheerful and upbeat Nanaka Yatsushiro. But even though he is reluctant to leave them behind, he believes that no matter how far apart they are, they will always cherish the memories of their friendship. Five years later, Sana, now a 16-year-old high school student, returns to his hometown with the hope of restoring his old life. However, he quickly realizes that although his town may not have changed drastically, the friends he left behind are not who they used to be. Unsettling shadows loom over Sakuranomori as his friends hold new secrets and bear burdens that threaten the bonds they once shared. [Written by MAL Rewrite]",,fall,2007,"{'day': 'Wednesdays', 'time': '02:15', 'timezone': 'Asia/Tokyo', 'string': 'Wednesdays at 02:15 (JST)'}","[{'mal_id': 82, 'type': 'anime', 'name': 'Marvelous', 'url': 'https://myanimelist.net/anime/producer/82/Marvelous'}, {'mal_id': 144, 'type': 'anime', 'name': 'Pony Canyon', 'url': 'https://myanimelist.net/anime/producer/144/Pony_Canyon'}, {'mal_id': 787, 'type': 'anime', 'name': 'Happinet Pictures', 'url': 'https://myanimelist.net/anime/producer/787/Happinet_Pictures'}, {'mal_id': 1425, 'type': 'anime', 'name': '5pb.', 'url': 'https://myanimelist.net/anime/producer/1425/5pb'}]","[{'mal_id': 490, 'type': 'anime', 'name': 'Maiden Japan', 'url': 'https://myanimelist.net/anime/producer/490/Maiden_Japan'}]","[{'mal_id': 95, 'type': 'anime', 'name': 'Doga Kobo', 'url': 'https://myanimelist.net/anime/producer/95/Doga_Kobo'}]","[{'mal_id': 8, 'type': 'anime', 'name': 'Drama', 'url': 'https://myanimelist.net/anime/genre/8/Drama'}, {'mal_id': 22, 'type': 'anime', 'name': 'Romance', 'url': 'https://myanimelist.net/anime/genre/22/Romance'}]",[],"[{'mal_id': 23, 'type': 'anime', 'name': 'School', 'url': 'https://myanimelist.net/anime/genre/23/School'}]",[]
2963,https://myanimelist.net/anime/2963/Minami-ke,"{'jpg': {'image_url': 'https://cdn.myanimelist.net/images/anime/2/75279.jpg', 'small_image_url': 'https://cdn.myanimelist.net/images/anime/2/75279t.jpg', 'large_image_url': 'https://cdn.myanimelist.net/images/anime/2/75279l.jpg'}, 'webp': {'image_url': 'https://cdn.myanimelist.net/images/anime/2/75279.webp', 'small_image_url': 'https://cdn.myanimelist.net/images/anime/2/75279t.webp', 'large_image_url': 'https://cdn.myanimelist.net/images/anime/2/75279l.webp'}}","{'youtube_id': 'SPKY_xH15GU', 'url': 'https://www.youtube.com/watch?v=SPKY_xH15GU', 'embed_url': 'https://www.youtube.com/embed/SPKY_xH15GU?enablejsapi=1&wmode=opaque&autoplay=1', 'images': {'image_url': 'https://img.youtube.com/vi/SPKY_xH15GU/default.jpg', 'small_image_url': 'https://img.youtube.com/vi/SPKY_xH15GU/sddefault.jpg', 'medium_image_url': 'https://img.youtube.com/vi/SPKY_xH15GU/mqdefault.jpg', 'large_image_url': 'https://img.youtube.com/vi/SPKY_xH15GU/hqdefault.jpg', 'maximum_image_url': 'https://img.youtube.com/vi/SPKY_xH15GU/maxresdefault.jpg'}}","""Minami-ke""",,みなみけ,"['Minamike', 'The Minami Family']",TV,Manga,13,Finished Airing,False,"{'from': '2007-10-08T00:00:00+00:00', 'to': '2007-12-31T00:00:00+00:00', 'prop': {'from': {'day': 8, 'month': 10, 'year': 2007}, 'to': {'day': 31, 'month': 12, 'year': 2007}}, 'string': 'Oct 8, 2007 to Dec 31, 2007'}",24 min per ep,PG-13 - Teens 13 or older,7.67,65059.0,1148,1158,160400,1037,"The Minami residence is home to three sisters: the strict and diligent eldest sister Haruka; air-headed and lively Kana; and the youngest, Chiaki, whose sharp tongue spares no one. Living without adult supervision, the sisters share the workload of cooking and laundry, as well as the occasional romantic adventure. From combating chronic laziness to hanging out with friends, there is never a boring day in the Minami household. [Written by MAL Rewrite]",,fall,2007,"{'day': None, 'time': None, 'timezone': None, 'string': 'Mondays at Unknown'}","[{'mal_id': 92, 'type': 'anime', 'name': 'Starchild Records', 'url': 'https://myanimelist.net/anime/producer/92/Starchild_Records'}, {'mal_id': 306, 'type': 'anime', 'name': 'Magic Capsule', 'url': 'https://myanimelist.net/anime/producer/306/Magic_Capsule'}, {'mal_id': 759, 'type': 'anime', 'name': 'Eye Move', 'url': 'https://myanimelist.net/anime/producer/759/Eye_Move'}, {'mal_id': 761, 'type': 'anime', 'name': 'Sunny Side Up', 'url': 'https://myanimelist.net/anime/producer/761/Sunny_Side_Up'}]",[],"[{'mal_id': 39, 'type': 'anime', 'name': 'Daume', 'url': 'https://myanimelist.net/anime/producer/39/Daume'}]","[{'mal_id': 4, 'type': 'anime', 'name': 'Comedy', 'url': 'https://myanimelist.net/anime/genre/4/Comedy'}, {'mal_id': 36, 'type': 'anime', 'name': 'Slice of Life', 'url': 'https://myanimelist.net/anime/genre/36/Slice_of_Life'}]",[],"[{'mal_id': 23, 'type': 'anime', 'name': 'School', 'url': 'https://myanimelist.net/anime/genre/23/School'}]",[]
2596,https://myanimelist.net/anime/2596/Shinreigari,"{'jpg': {'image_url': 'https://cdn.myanimelist.net/images/anime/3/22691.jpg', 'small_image_url': 'https://cdn.myanimelist.net/images/anime/3/22691t.jpg', 'large_image_url': 'https://cdn.myanimelist.net/images/anime/3/22691l.jpg'}, 'webp': {'image_url': 'https://cdn.myanimelist.net/images/anime/3/22691.webp', 'small_image_url': 'https://cdn.myanimelist.net/images/anime/3/22691t.webp', 'large_image_url': 'https://cdn.myanimelist.net/images/anime/3/22691l.webp'}}","{'youtube_id': 'HtTQDbC07U8', 'url': 'https://www.youtube.com/watch?v=HtTQDbC07U8', 'embed_url': 'https://www.youtube.com/embed/HtTQDbC07U8?enablejsapi=1&wmode=opaque&autoplay=1', 'images': {'image_url': 'https://img.youtube.com/vi/HtTQDbC07U8/default.jpg', 'small_image_url': 'https://img.youtube.com/vi/HtTQDbC07U8/sddefault.jpg', 'medium_image_url': 'https://img.youtube.com/vi/HtTQDbC07U8/mqdefault.jpg', 'large_image_url': 'https://img.youtube.com/vi/HtTQDbC07U8/hqdefault.jpg', 'maximum_image_url': 'https://img.youtube.com/vi/HtTQDbC07U8/maxresdefault.jpg'}}","""Shinreigari""",Ghost Hound,神霊狩 GHOST HOUND,['Shinreigari: Ghost Hound'],TV,Original,22,Finished Airing,False,"{'from': '2007-10-18T00:00:00+00:00', 'to': '2008-04-04T00:00:00+00:00', 'prop': {'from': {'day': 18, 'month': 10, 'year': 2007}, 'to': {'day': 4, 'month': 4, 'year': 2008}}, 'string': 'Oct 18, 2007 to Apr 4, 2008'}",25 min per ep,PG-13 - Teens 13 or older,7.43,38825.0,1888,1332,134204,735,"Strange things are happening around the town of Suiten. The daughter of a priest begins to see strange visions, spirits have started to roam the mountains, and Tarou Komori is having unsettling dreams. Due to the trauma of being kidnapped 11 years ago, he has repressed most of the memories that could shed light on what really happened all those years ago. But they return in his sleep, combined with encounters beyond the realm of dreams. In Shinreigari: Ghost Hound, the supernatural and psychological collide, as three children struggle to face their demons and repair the breach between the spiritual and corporeal worlds. [Written by MAL Rewrite]",,fall,2007,"{'day': None, 'time': None, 'timezone': None, 'string': 'Unknown'}","[{'mal_id': 33, 'type': 'anime', 'name': 'WOWOW', 'url': 'https://myanimelist.net/anime/producer/33/WOWOW'}, {'mal_id': 144, 'type': 'anime', 'name': 'Pony Canyon', 'url': 'https://myanimelist.net/anime/producer/144/Pony_Canyon'}, {'mal_id': 777, 'type': 'anime', 'name': 'Showgate', 'url': 'https://myanimelist.net/anime/producer/777/Showgate'}, {'mal_id': 1451, 'type': 'anime', 'name': 'TYO', 'url': 'https://myanimelist.net/anime/producer/1451/TYO'}, {'mal_id': 1452, 'type': 'anime', 'name': 'Mag Garden', 'url': 'https://myanimelist.net/anime/producer/1452/Mag_Garden'}]","[{'mal_id': 376, 'type': 'anime', 'name': 'Sentai Filmworks', 'url': 'https://myanimelist.net/anime/producer/376/Sentai_Filmworks'}]","[{'mal_id': 10, 'type': 'anime', 'name': 'Production I.G', 'url': 'https://myanimelist.net/anime/producer/10/Production_IG'}]","[{'mal_id': 7, 'type': 'anime', 'name': 'Mystery', 'url': 'https://myanimelist.net/anime/genre/7/Mystery'}, {'mal_id': 24, 'type': 'anime', 'name': 'Sci-Fi', 'url': 'https://myanimelist.net/anime/genre/24/Sci-Fi'}, {'mal_id': 37, 'type': 'anime', 'name': 'Supernatural', 'url': 'https://myanimelist.net/anime/genre/37/Supernatural'}]",[],"[{'mal_id': 40, 'type': 'anime', 'name': 'Psychological', 'url': 'https://myanimelist.net/anime/genre/40/Psychological'}]",[]
2403,https://myanimelist.net/anime/2403/Kodomo_no_Jikan_TV,"{'jpg': {'image_url': 'https://cdn.myanimelist.net/images/anime/8/28234.jpg', 'small_image_url': 'https://cdn.myanimelist.net/images/anime/8/28234t.jpg', 'large_image_url': 'https://cdn.myanimelist.net/images/anime/8/28234l.jpg'}, 'webp': {'image_url': 'https://cdn.myanimelist.net/images/anime/8/28234.webp', 'small_image_url': 'https://cdn.myanimelist.net/images/anime/8/28234t.webp', 'large_image_url': 'https://cdn.myanimelist.net/images/anime/8/28234l.webp'}}","{'youtube_id': None, 'url': None, 'embed_url': None, 'images': {'image_url': None, 'small_image_url': None, 'medium_image_url': None, 'large_image_url': None, 'maximum_image_url': None}}","""Kodomo no Jikan (TV)""",,こどものじかん,"['Nymphet', ""A Child's Time"", 'Kojika']",TV,Manga,12,Finished Airing,False,"{'from': '2007-10-12T00:00:00+00:00', 'to': '2007-12-28T00:00:00+00:00', 'prop': {'from': {'day': 12, 'month': 10, 'year': 2007}, 'to': {'day': 28, 'month': 12, 'year': 2007}}, 'string': 'Oct 12, 2007 to Dec 28, 2007'}",24 min per ep,R - 17+ (violence & profanity),6.75,48317.0,4899,1634,103572,503,"3rd grade teacher Aoki Daisuke didn't expect the first class he ever taught to be one of the toughest obstacles of his life. After getting off on the wrong foot with the entire class, a moment of kind-heartedness instantly convinces one of his students, Rin Kokonoe, to make the ill-fated Aoki-sensei her lover. But what exactly are Rin's intentions for wanting to actively seduce Aoki-sensei, and will Aoki-sensei be able to help her to deal with them?",,fall,2007,"{'day': None, 'time': None, 'timezone': None, 'string': 'Unknown'}","[{'mal_id': 23, 'type': 'anime', 'name': 'Bandai Visual', 'url': 'https://myanimelist.net/anime/producer/23/Bandai_Visual'}, {'mal_id': 104, 'type': 'anime', 'name': 'Lantis', 'url': 'https://myanimelist.net/anime/producer/104/Lantis'}, {'mal_id': 166, 'type': 'anime', 'name': 'Movic', 'url': 'https://myanimelist.net/anime/producer/166/Movic'}, {'mal_id': 399, 'type': 'anime', 'name': 'Dream Force', 'url': 'https://myanimelist.net/anime/producer/399/Dream_Force'}, {'mal_id': 1377, 'type': 'anime', 'name': 'Futabasha', 'url': 'https://myanimelist.net/anime/producer/1377/Futabasha'}]",[],"[{'mal_id': 51, 'type': 'anime', 'name': 'Diomedéa', 'url': 'https://myanimelist.net/anime/producer/51/Diomed%C3%A9a'}]","[{'mal_id': 4, 'type': 'anime', 'name': 'Comedy', 'url': 'https://myanimelist.net/anime/genre/4/Comedy'}, {'mal_id': 8, 'type': 'anime', 'name': 'Drama', 'url': 'https://myanimelist.net/anime/genre/8/Drama'}, {'mal_id': 9, 'type': 'anime', 'name': 'Ecchi', 'url': 'https://myanimelist.net/anime/genre/9/Ecchi'}]",[],"[{'mal_id': 23, 'type': 'anime', 'name': 'School', 'url': 'https://myanimelist.net/anime/genre/23/School'}]",[]
2494,https://myanimelist.net/anime/2494/Goshuushou-sama_Ninomiya-kun,"{'jpg': {'image_url': 'https://cdn.myanimelist.net/images/anime/6/75603.jpg', 'small_image_url': 'https://cdn.myanimelist.net/images/anime/6/75603t.jpg', 'large_image_url': 'https://cdn.myanimelist.net/images/anime/6/75603l.jpg'}, 'webp': {'image_url': 'https://cdn.myanimelist.net/images/anime/6/75603.webp', 'small_image_url': 'https://cdn.myanimelist.net/images/anime/6/75603t.webp', 'large_image_url': 'https://cdn.myanimelist.net/images/anime/6/75603l.webp'}}","{'youtube_id': None, 'url': None, 'embed_url': None, 'images': {'image_url': None, 'small_image_url': None, 'medium_image_url': None, 'large_image_url': None, 'maximum_image_url': None}}","""Goshuushou-sama Ninomiya-kun""",Good Luck! Ninomiya-kun,ご愁傷さま二ノ宮くん,"['Goshusho-sama Ninomiya-kun', 'Gosyushosama Ninomiyakun', 'My Condolences', 'Ninomiya-kun', 'My Heartfelt Sympathy', 'Ninomiya-kun']",TV,Light novel,12,Finished Airing,False,"{'from': '2007-10-05T00:00:00+00:00', 'to': '2007-12-21T00:00:00+00:00', 'prop': {'from': {'day': 5, 'month': 10, 'year': 2007}, 'to': {'day': 21, 'month': 12, 'year': 2007}}, 'string': 'Oct 5, 2007 to Dec 21, 2007'}",24 min per ep,R+ - Mild Nudity,6.69,45315.0,5176,1769,92385,158,"Shungo Ninomiya is just an ordinary, run-of-the-mill high school student who lives at home with his older sister Ryoko—at least when she's not away doing her job as a mercenary. However, Shungo's life ceases to be normal the moment a cute girl named Mayu Tsukimura descends into the middle of his school's campus in a military-grade helicopter. It turns out Ryoko sent this girl, along with her older brother Mikihiro, to live at the Ninomiya household. But the newly-arrived siblings are a little special: Mayu is, in fact, a succubus and her brother, an incubus! And as if the circumstances are not problematic enough, Mayu is crippled with androphobia—the fear of men—and it's up to Shungo to help her overcome this at the behest of his sister. Ryoko plans to force Mayu to be closer to Shungo, and to do this, she’ll employ some questionable methods such as having them share the same bed and even take baths together. The situation further complicates when student council president Reika Houjou arrives as the new maid of the Ninomiya family, and she will stop at nothing to thwart Shungo and Mayu’s sexually-geared training. With the sudden arrival of all these oddities, Shungo's ordinary life is about to be thrown into utter turmoil. [Written by MAL Rewrite]",,fall,2007,"{'day': None, 'time': None, 'timezone': None, 'string': 'Unknown'}","[{'mal_id': 113, 'type': 'anime', 'name': 'Kadokawa Shoten', 'url': 'https://myanimelist.net/anime/producer/113/Kadokawa_Shoten'}]","[{'mal_id': 102, 'type': 'anime', 'name': 'Funimation', 'url': 'https://myanimelist.net/anime/producer/102/Funimation'}]","[{'mal_id': 83, 'type': 'anime', 'name': 'AIC Spirits', 'url': 'https://myanimelist.net/anime/producer/83/AIC_Spirits'}]","[{'mal_id': 4, 'type': 'anime', 'name': 'Comedy', 'url': 'https://myanimelist.net/anime/genre/4/Comedy'}, {'mal_id': 10, 'type': 'anime', 'name': 'Fantasy', 'url': 'https://myanimelist.net/anime/genre/10/Fantasy'}, {'mal_id': 9, 'type': 'anime', 'name': 'Ecchi', 'url': 'https://myanimelist.net/anime/genre/9/Ecchi'}]",[],"[{'mal_id': 35, 'type': 'anime', 'name': 'Harem', 'url': 'https://myanimelist.net/anime/genre/35/Harem'}]",[]
2927,https://myanimelist.net/anime/2927/KimiKiss_Pure_Rouge,"{'jpg': {'image_url': 'https://cdn.myanimelist.net/images/anime/3/19934.jpg', 'small_image_url': 'https://cdn.myanimelist.net/images/anime/3/19934t.jpg', 'large_image_url': 'https://cdn.myanimelist.net/images/anime/3/19934l.jpg'}, 'webp': {'image_url': 'https://cdn.myanimelist.net/images/anime/3/19934.webp', 'small_image_url': 'https://cdn.myanimelist.net/images/anime/3/19934t.webp', 'large_image_url': 'https://cdn.myanimelist.net/images/anime/3/19934l.webp'}}","{'youtube_id': None, 'url': None, 'embed_url': None, 'images': {'image_url': None, 'small_image_url': None, 'medium_image_url': None, 'large_image_url': None, 'maximum_image_url': None}}","""KimiKiss Pure Rouge""",KimiKiss: Pure Rouge,キミキス pure rouge,['Kimi-kiss pure rouge'],TV,Visual novel,24,Finished Airing,False,"{'from': '2007-10-07T00:00:00+00:00', 'to': '2008-03-23T00:00:00+00:00', 'prop': {'from': {'day': 7, 'month': 10, 'year': 2007}, 'to': {'day': 23, 'month': 3, 'year': 2008}}, 'string': 'Oct 7, 2007 to Mar 23, 2008'}",24 min per ep,PG-13 - Teens 13 or older,7.29,37725.0,2467,1871,85208,283,"Kouichi Sanada and Kazuki Aihara's childhood friend Mao Mizusawa has returned after living in France for a couple of years. Kouichi is surprised to learn that, since her parents are remaining overseas for the time being, his mother has agreed to let Mao stay with them. The three friends help each other deal with the ups and downs of high school romance. (Source: ANN)",,fall,2007,"{'day': None, 'time': None, 'timezone': None, 'string': 'Unknown'}","[{'mal_id': 23, 'type': 'anime', 'name': 'Bandai Visual', 'url': 'https://myanimelist.net/anime/producer/23/Bandai_Visual'}, {'mal_id': 104, 'type': 'anime', 'name': 'Lantis', 'url': 'https://myanimelist.net/anime/producer/104/Lantis'}]","[{'mal_id': 376, 'type': 'anime', 'name': 'Sentai Filmworks', 'url': 'https://myanimelist.net/anime/producer/376/Sentai_Filmworks'}]","[{'mal_id': 7, 'type': 'anime', 'name': 'J.C.Staff', 'url': 'https://myanimelist.net/anime/producer/7/JCStaff'}]","[{'mal_id': 8, 'type': 'anime', 'name': 'Drama', 'url': 'https://myanimelist.net/anime/genre/8/Drama'}, {'mal_id': 22, 'type': 'anime', 'name': 'Romance', 'url': 'https://myanimelist.net/anime/genre/22/Romance'}]",[],"[{'mal_id': 23, 'type': 'anime', 'name': 'School', 'url': 'https://myanimelist.net/anime/genre/23/School'}]",[]
2986,https://myanimelist.net/anime/2986/Bamboo_Blade,"{'jpg': {'image_url': 'https://cdn.myanimelist.net/images/anime/1790/114537.jpg', 'small_image_url': 'https://cdn.myanimelist.net/images/anime/1790/114537t.jpg', 'large_image_url': 'https://cdn.myanimelist.net/images/anime/1790/114537l.jpg'}, 'webp': {'image_url': 'https://cdn.myanimelist.net/images/anime/1790/114537.webp', 'small_image_url': 'https://cdn.myanimelist.net/images/anime/1790/114537t.webp', 'large_image_url': 'https://cdn.myanimelist.net/images/anime/1790/114537l.webp'}}","{'youtube_id': None, 'url': None, 'embed_url': None, 'images': {'image_url': None, 'small_image_url': None, 'medium_image_url': None, 'large_image_url': None, 'maximum_image_url': None}}","""Bamboo Blade""",Bamboo Blade,バンブーブレード,[],TV,Manga,26,Finished Airing,False,"{'from': '2007-10-02T00:00:00+00:00', 'to': '2008-04-01T00:00:00+00:00', 'prop': {'from': {'day': 2, 'month': 10, 'year': 2007}, 'to': {'day': 1, 'month': 4, 'year': 2008}}, 'string': 'Oct 2, 2007 to Apr 1, 2008'}",24 min per ep,PG-13 - Teens 13 or older,7.32,36833.0,2328,1893,84053,271,"Kojirou is the kendo instructor for Muroe High School and he's totally broke. But then an unexpected chance is given to him: his team must win against his senpai's team and the prize is: free meals for a whole year! Now, the only problem left... where to find girls skilled enough and willing to join the kendo team?",,fall,2007,"{'day': 'Tuesdays', 'time': '01:30', 'timezone': 'Asia/Tokyo', 'string': 'Tuesdays at 01:30 (JST)'}","[{'mal_id': 48, 'type': 'anime', 'name': 'AIC', 'url': 'https://myanimelist.net/anime/producer/48/AIC'}, {'mal_id': 58, 'type': 'anime', 'name': 'Square Enix', 'url': 'https://myanimelist.net/anime/producer/58/Square_Enix'}, {'mal_id': 164, 'type': 'anime', 'name': 'd-rights', 'url': 'https://myanimelist.net/anime/producer/164/d-rights'}, {'mal_id': 210, 'type': 'anime', 'name': 'Studio Tulip', 'url': 'https://myanimelist.net/anime/producer/210/Studio_Tulip'}, {'mal_id': 460, 'type': 'anime', 'name': 'KlockWorx', 'url': 'https://myanimelist.net/anime/producer/460/KlockWorx'}, {'mal_id': 464, 'type': 'anime', 'name': 'flying DOG', 'url': 'https://myanimelist.net/anime/producer/464/flying_DOG'}]","[{'mal_id': 102, 'type': 'anime', 'name': 'Funimation', 'url': 'https://myanimelist.net/anime/producer/102/Funimation'}]","[{'mal_id': 88, 'type': 'anime', 'name': 'AIC ASTA', 'url': 'https://myanimelist.net/anime/producer/88/AIC_ASTA'}]","[{'mal_id': 4, 'type': 'anime', 'name': 'Comedy', 'url': 'https://myanimelist.net/anime/genre/4/Comedy'}, {'mal_id': 30, 'type': 'anime', 'name': 'Sports', 'url': 'https://myanimelist.net/anime/genre/30/Sports'}]",[],"[{'mal_id': 23, 'type': 'anime', 'name': 'School', 'url': 'https://myanimelist.net/anime/genre/23/School'}]","[{'mal_id': 42, 'type': 'anime', 'name': 'Seinen', 'url': 'https://myanimelist.net/anime/genre/42/Seinen'}]"
2508,https://myanimelist.net/anime/2508/Genshiken_2,"{'jpg': {'image_url': 'https://cdn.myanimelist.net/images/anime/1958/94708.jpg', 'small_image_url': 'https://cdn.myanimelist.net/images/anime/1958/94708t.jpg', 'large_image_url': 'https://cdn.myanimelist.net/images/anime/1958/94708l.jpg'}, 'webp': {'image_url': 'https://cdn.myanimelist.net/images/anime/1958/94708.webp', 'small_image_url': 'https://cdn.myanimelist.net/images/anime/1958/94708t.webp', 'large_image_url': 'https://cdn.myanimelist.net/images/anime/1958/94708l.webp'}}","{'youtube_id': 'iD6ufvvwi-A', 'url': 'https://www.youtube.com/watch?v=iD6ufvvwi-A', 'embed_url': 'https://www.youtube.com/embed/iD6ufvvwi-A?enablejsapi=1&wmode=opaque&autoplay=1', 'images': {'image_url': 'https://img.youtube.com/vi/iD6ufvvwi-A/default.jpg', 'small_image_url': 'https://img.youtube.com/vi/iD6ufvvwi-A/sddefault.jpg', 'medium_image_url': 'https://img.youtube.com/vi/iD6ufvvwi-A/mqdefault.jpg', 'large_image_url': 'https://img.youtube.com/vi/iD6ufvvwi-A/hqdefault.jpg', 'maximum_image_url': 'https://img.youtube.com/vi/iD6ufvvwi-A/maxresdefault.jpg'}}","""Genshiken 2""",Genshiken 2,げんしけん2,['Gendai Shikaku Bunka Kenkyuukai 2'],TV,Manga,12,Finished Airing,False,"{'from': '2007-10-10T00:00:00+00:00', 'to': '2007-12-26T00:00:00+00:00', 'prop': {'from': {'day': 10, 'month': 10, 'year': 2007}, 'to': {'day': 26, 'month': 12, 'year': 2007}}, 'string': 'Oct 10, 2007 to Dec 26, 2007'}",24 min per ep,R - 17+ (violence & profanity),7.76,41704.0,943,1984,77354,196,"The Society for the Study of Modern Visual Culture, otherwise known as Genshiken, is now under the charge of a more confident Sasahara. Things have changed in between semesters, and the otaku club now has a new otaku-hating member named Ogiue. Sasahara's initial goal of starting a doujin circle and selling those fan-made magazines at the next Comic Festival becomes a reality, but reality is a cruel master... who apparently crossplays. Afterward, the club is abuzz with talk about Tanaka and Ohno's relationship, which takes a hesitant step forward. (Source: Media Blasters)",,fall,2007,"{'day': None, 'time': None, 'timezone': None, 'string': 'Unknown'}","[{'mal_id': 79, 'type': 'anime', 'name': 'Genco', 'url': 'https://myanimelist.net/anime/producer/79/Genco'}, {'mal_id': 104, 'type': 'anime', 'name': 'Lantis', 'url': 'https://myanimelist.net/anime/producer/104/Lantis'}, {'mal_id': 108, 'type': 'anime', 'name': 'Media Factory', 'url': 'https://myanimelist.net/anime/producer/108/Media_Factory'}, {'mal_id': 158, 'type': 'anime', 'name': 'Kids Station', 'url': 'https://myanimelist.net/anime/producer/158/Kids_Station'}, {'mal_id': 306, 'type': 'anime', 'name': 'Magic Capsule', 'url': 'https://myanimelist.net/anime/producer/306/Magic_Capsule'}, {'mal_id': 455, 'type': 'anime', 'name': 'Palm Studio', 'url': 'https://myanimelist.net/anime/producer/455/Palm_Studio'}, {'mal_id': 777, 'type': 'anime', 'name': 'Showgate', 'url': 'https://myanimelist.net/anime/producer/777/Showgate'}]","[{'mal_id': 250, 'type': 'anime', 'name': 'Media Blasters', 'url': 'https://myanimelist.net/anime/producer/250/Media_Blasters'}]","[{'mal_id': 38, 'type': 'anime', 'name': 'Arms', 'url': 'https://myanimelist.net/anime/producer/38/Arms'}]","[{'mal_id': 4, 'type': 'anime', 'name': 'Comedy', 'url': 'https://myanimelist.net/anime/genre/4/Comedy'}, {'mal_id': 36, 'type': 'anime', 'name': 'Slice of Life', 'url': 'https://myanimelist.net/anime/genre/36/Slice_of_Life'}]",[],"[{'mal_id': 20, 'type': 'anime', 'name': 'Parody', 'url': 'https://myanimelist.net/anime/genre/20/Parody'}]",[]
