mal_id,url,images,trailer,title,title_english,title_japanese,title_synonyms,type,source,episodes,status,airing,aired,duration,rating,score,scored_by,rank,popularity,members,favorites,synopsis,background,season,year,broadcast,producers,licensors,studios,genres,explicit_genres,themes,demographics
2167,https://myanimelist.net/anime/2167/Clannad,"{'jpg': {'image_url': 'https://cdn.myanimelist.net/images/anime/1804/95033.jpg', 'small_image_url': 'https://cdn.myanimelist.net/images/anime/1804/95033t.jpg', 'large_image_url': 'https://cdn.myanimelist.net/images/anime/1804/95033l.jpg'}, 'webp': {'image_url': 'https://cdn.myanimelist.net/images/anime/1804/95033.webp', 'small_image_url': 'https://cdn.myanimelist.net/images/anime/1804/95033t.webp', 'large_image_url': 'https://cdn.myanimelist.net/images/anime/1804/95033l.webp'}}","{'youtube_id': 'pTTsmwHxHns', 'url': 'https://www.youtube.com/watch?v=pTTsmwHxHns', 'embed_url': 'https://www.youtube.com/embed/pTTsmwHxHns?enablejsapi=1&wmode=opaque&autoplay=1', 'images': {'image_url': 'https://img.youtube.com/vi/pTTsmwHxHns/default.jpg', 'small_image_url': 'https://img.youtube.com/vi/pTTsmwHxHns/sddefault.jpg', 'medium_image_url': 'https://img.youtube.com/vi/pTTsmwHxHns/mqdefault.jpg', 'large_image_url': 'https://img.youtube.com/vi/pTTsmwHxHns/hqdefault.jpg', 'maximum_image_url': 'https://img.youtube.com/vi/pTTsmwHxHns/maxresdefault.jpg'}}","""Clannad""",Clannad,CLANNAD,[],TV,Visual novel,23,Finished Airing,False,"{'from': '2007-10-05T00:00:00+00:00', 'to': '2008-03-28T00:00:00+00:00', 'prop': {'from': {'day': 5, 'month': 10, 'year': 2007}, 'to': {'day': 28, 'month': 3, 'year': 2008}}, 'string': 'Oct 5, 2007 to Mar 28, 2008'}",24 min per ep,PG-13 - Teens 13 or older,8.02,668851.0,533,73,1267329,26065,"Tomoya Okazaki is a delinquent who finds life dull and believes he'll never amount to anything. Along with his friend Youhei Sunohara, he skips school and plans to waste his high school days away. One day while walking to school, Tomoya passes a young girl muttering quietly to herself. Without warning she exclaims ""Anpan!"" (a popular Japanese food) which catches Tomoya's attention. He soon discovers the girl's name is Nagisa Furukawa and that she exclaims things she likes in order to motivate herself. Nagisa claims they are now friends, but Tomoya walks away passing the encounter off as nothing. However, Tomoya finds he is noticing Nagisa more and more around school. Eventually he concedes and befriends her. Tomoya learns Nagisa has been held back a year due to a severe illness and that her dream is to revive the school's drama club. Claiming he has nothing better to do, he decides to help her achieve this goal along with the help of four other girls. As Tomoya spends more time with the girls, he learns more about them and their problems. As he attempts to help each girl overcome her respective obstacle, he begins to realize life isn't as dull as he once thought. [Written by MAL Rewrite]","Clannad is the anime adaptation of the visual novel developed by KEY for Windows PCs in 2004, which was later ported to PlayStation consoles and the Xbox 360. The game was the best-selling PC game in 2004 and charted in national top 50 rankings several more times afterwards. Clannad has been adapted into four manga adaptations, an animated film, two anime series, two OVAs, comic anthologies, light novels and art books. The anime series and OVAs were licensed in North America by Sentai Filmworks in 2009. The first season of the animated series received positive to mixed reviews, while the second season Clannad After Story received wide critical acclaim.",fall,2007,"{'day': 'Fridays', 'time': '01:55', 'timezone': 'Asia/Tokyo', 'string': 'Fridays at 01:55 (JST)'}","[{'mal_id': 144, 'type': 'anime', 'name': 'Pony Canyon', 'url': 'https://myanimelist.net/anime/producer/144/Pony_Canyon'}, {'mal_id': 145, 'type': 'anime', 'name': 'TBS', 'url': 'https://myanimelist.net/anime/producer/145/TBS'}, {'mal_id': 166, 'type': 'anime', 'name': 'Movic', 'url': 'https://myanimelist.net/anime/producer/166/Movic'}, {'mal_id': 929, 'type': 'anime', 'name': 'Animation Do', 'url': 'https://myanimelist.net/anime/producer/929/Animation_Do'}]","[{'mal_id': 376, 'type': 'anime', 'name': 'Sentai Filmworks', 'url': 'https://myanimelist.net/anime/producer/376/Sentai_Filmworks'}]","[{'mal_id': 2, 'type': 'anime', 'name': 'Kyoto Animation', 'url': 'https://myanimelist.net/anime/producer/2/Kyoto_Animation'}]","[{'mal_id': 4, 'type': 'anime', 'name': 'Comedy', 'url': 'https://myanimelist.net/anime/genre/4/Comedy'}, {'mal_id': 8, 'type': 'anime', 'name': 'Drama', 'url': 'https://myanimelist.net/anime/genre/8/Drama'}, {'mal_id': 22, 'type': 'anime', 'name': 'Romance', 'url': 'https://myanimelist.net/anime/genre/22/Romance'}, {'mal_id': 36, 'type': 'anime', 'name': 'Slice of Life', 'url': 'https://myanimelist.net/anime/genre/36/Slice_of_Life'}, {'mal_id': 37, 'type': 'anime', 'name': 'Supernatural', 'url': 'https://myanimelist.net/anime/genre/37/Supernatural'}]",[],"[{'mal_id': 23, 'type': 'anime', 'name': 'School', 'url': 'https://myanimelist.net/anime/genre/23/School'}]",[]
3002,https://myanimelist.net/anime/3002/Gyakkyou_Burai_Kaiji__Ultimate_Survivor,"{'jpg': {'image_url': 'https://cdn.myanimelist.net/images/anime/12/80032.jpg', 'small_image_url': 'https://cdn.myanimelist.net/images/anime/12/80032t.jpg', 'large_image_url': 'https://cdn.myanimelist.net/images/anime/12/80032l.jpg'}, 'webp': {'image_url': 'https://cdn.myanimelist.net/images/anime/12/80032.webp', 'small_image_url': 'https://cdn.myanimelist.net/images/anime/12/80032t.webp', 'large_image_url': 'https://cdn.myanimelist.net/images/anime/12/80032l.webp'}}","{'youtube_id': None, 'url': None, 'embed_url': None, 'images': {'image_url': None, 'small_image_url': None, 'medium_image_url': None, 'large_image_url': None, 'maximum_image_url': None}}","""Gyakkyou Burai Kaiji: Ultimate Survivor""",Kaiji: Ultimate Survivor,逆境無頼カイジ Ultimate Survivor,"['Tobaku Mokushiroku Kaiji', 'The Suffering Pariah Kaiji']",TV,Manga,26,Finished Airing,False,"{'from': '2007-10-03T00:00:00+00:00', 'to': '2008-04-02T00:00:00+00:00', 'prop': {'from': {'day': 3, 'month': 10, 'year': 2007}, 'to': {'day': 2, 'month': 4, 'year': 2008}}, 'string': 'Oct 3, 2007 to Apr 2, 2008'}",23 min per ep,R - 17+ (violence & profanity),8.28,135199.0,252,597,301898,8770,"Kaiji Itou is a good-for-nothing loiterer who spends his days drinking beer and stealing hubcaps—that is, until he ends up being tricked by his former co-worker. Unable to suddenly repay his friend's huge debt all by himself, Kaiji is offered a shady deal to participate in an illegal underground gamble on a cruise ship. This turns out to be nothing more than the beginning of his new life of hell—thrown headlong into a life-threatening roller coaster of mind games, cheating, and deceit. Based on the first entry of the famous gambling manga series by Nobuyuki Fukumoto, Gyakkyou Burai Kaiji: Ultimate Survivor follows our unlucky protagonist as he is forced to fight not only other people, but also the mysteries of their psyches. Kaiji finds out the hard way that the worst sides of human nature surface when people's backs are against the wall, and that the most fearsome dangers of all are greed, paranoia, and the human survival instinct itself. [Written by MAL Rewrite]",,fall,2007,"{'day': 'Wednesdays', 'time': '00:59', 'timezone': 'Asia/Tokyo', 'string': 'Wednesdays at 00:59 (JST)'}","[{'mal_id': 29, 'type': 'anime', 'name': 'VAP', 'url': 'https://myanimelist.net/anime/producer/29/VAP'}, {'mal_id': 1003, 'type': 'anime', 'name': 'Nippon Television Network', 'url': 'https://myanimelist.net/anime/producer/1003/Nippon_Television_Network'}]","[{'mal_id': 376, 'type': 'anime', 'name': 'Sentai Filmworks', 'url': 'https://myanimelist.net/anime/producer/376/Sentai_Filmworks'}]","[{'mal_id': 11, 'type': 'anime', 'name': 'Madhouse', 'url': 'https://myanimelist.net/anime/producer/11/Madhouse'}]","[{'mal_id': 41, 'type': 'anime', 'name': 'Suspense', 'url': 'https://myanimelist.net/anime/genre/41/Suspense'}]",[],"[{'mal_id': 11, 'type': 'anime', 'name': 'Game', 'url': 'https://myanimelist.net/anime/genre/11/Game'}, {'mal_id': 40, 'type': 'anime', 'name': 'Psychological', 'url': 'https://myanimelist.net/anime/genre/40/Psychological'}]","[{'mal_id': 42, 'type': 'anime', 'name': 'Seinen', 'url': 'https://myanimelist.net/anime/genre/42/Seinen'}]"
2787,https://myanimelist.net/anime/2787/Shakugan_no_Shana_II_Second,"{'jpg': {'image_url': 'https://cdn.myanimelist.net/images/anime/10/18669.jpg', 'small_image_url': 'https://cdn.myanimelist.net/images/anime/10/18669t.jpg', 'large_image_url': 'https://cdn.myanimelist.net/images/anime/10/18669l.jpg'}, 'webp': {'image_url': 'https://cdn.myanimelist.net/images/anime/10/18669.webp', 'small_image_url': 'https://cdn.myanimelist.net/images/anime/10/18669t.webp', 'large_image_url': 'https://cdn.myanimelist.net/images/anime/10/18669l.webp'}}","{'youtube_id': 'MHNV0nLHLno', 'url': 'https://www.youtube.com/watch?v=MHNV0nLHLno', 'embed_url': 'https://www.youtube.com/embed/MHNV0nLHLno?enablejsapi=1&wmode=opaque&autoplay=1', 'images': {'image_url': 'https://img.youtube.com/vi/MHNV0nLHLno/default.jpg', 'small_image_url': 'https://img.youtube.com/vi/MHNV0nLHLno/sddefault.jpg', 'medium_image_url': 'https://img.youtube.com/vi/MHNV0nLHLno/mqdefault.jpg', 'large_image_url': 'https://img.youtube.com/vi/MHNV0nLHLno/hqdefault.jpg', 'maximum_image_url': 'https://img.youtube.com/vi/MHNV0nLHLno/maxresdefault.jpg'}}","""Shakugan no Shana II (Second)""",Shakugan no Shana: Season II,灼眼のシャナII –Second–,['Shakugan no Shana 2'],TV,Light novel,24,Finished Airing,False,"{'from': '2007-10-05T00:00:00+00:00', 'to': '2008-03-28T00:00:00+00:00', 'prop': {'from': {'day': 5, 'month': 10, 'year': 2007}, 'to': {'day': 28, 'month': 3, 'year': 2008}}, 'string': 'Oct 5, 2007 to Mar 28, 2008'}",24 min per ep,PG-13 - Teens 13 or older,7.57,159482.0,1421,633,289578,976,"Denizens from the Crimson Realm continue to infiltrate Misaki City and steal life energy from humans. To combat this threat, Flame Hazes are tasked with saving humans from losing their existences. But while it is a Flame Haze's duty to protect humans, Shana—the ""Flame-Haired Burning-Eyed Hunter""—seems to be focusing her attention on one human in particular: Yuuji Sakai, a teenage boy who was unwittingly dragged into the fight between Crimson Denizens and Flame Hazes. Since her first encounter with Yuuji, Shana has started to see him as more than just a friend. In fact, Yuuji wonders if Shana might have revealed her feelings to him once before, but it is difficult for him to confirm due to her hot-and-cold personality. Nonetheless, their days pass like any other, until a new transfer student arrives at their high school—one who bears a striking resemblance to an old enemy. Yuuji and Shana have no time to dance around their feelings for each other; while their adversaries from the Bal Masqué organization plan their next attack, the two must keep their guard up as they explore the origin behind the coveted magical object within Yuuji's body, the ""Midnight Lost Child."" [Written by MAL Rewrite]",,fall,2007,"{'day': 'Fridays', 'time': '01:25', 'timezone': 'Asia/Tokyo', 'string': 'Fridays at 01:25 (JST)'}","[{'mal_id': 31, 'type': 'anime', 'name': 'Geneon Universal Entertainment', 'url': 'https://myanimelist.net/anime/producer/31/Geneon_Universal_Entertainment'}, {'mal_id': 681, 'type': 'anime', 'name': 'ASCII Media Works', 'url': 'https://myanimelist.net/anime/producer/681/ASCII_Media_Works'}]","[{'mal_id': 102, 'type': 'anime', 'name': 'Funimation', 'url': 'https://myanimelist.net/anime/producer/102/Funimation'}]","[{'mal_id': 7, 'type': 'anime', 'name': 'J.C.Staff', 'url': 'https://myanimelist.net/anime/producer/7/JCStaff'}]","[{'mal_id': 1, 'type': 'anime', 'name': 'Action', 'url': 'https://myanimelist.net/anime/genre/1/Action'}, {'mal_id': 8, 'type': 'anime', 'name': 'Drama', 'url': 'https://myanimelist.net/anime/genre/8/Drama'}, {'mal_id': 10, 'type': 'anime', 'name': 'Fantasy', 'url': 'https://myanimelist.net/anime/genre/10/Fantasy'}, {'mal_id': 22, 'type': 'anime', 'name': 'Romance', 'url': 'https://myanimelist.net/anime/genre/22/Romance'}, {'mal_id': 37, 'type': 'anime', 'name': 'Supernatural', 'url': 'https://myanimelist.net/anime/genre/37/Supernatural'}]",[],"[{'mal_id': 23, 'type': 'anime', 'name': 'School', 'url': 'https://myanimelist.net/anime/genre/23/School'}]",[]
2924,https://myanimelist.net/anime/2924/ef__A_Tale_of_Memories,"{'jpg': {'image_url': 'https://cdn.myanimelist.net/images/anime/11/50411.jpg', 'small_image_url': 'https://cdn.myanimelist.net/images/anime/11/50411t.jpg', 'large_image_url': 'https://cdn.myanimelist.net/images/anime/11/50411l.jpg'}, 'webp': {'image_url': 'https://cdn.myanimelist.net/images/anime/11/50411.webp', 'small_image_url': 'https://cdn.myanimelist.net/images/anime/11/50411t.webp', 'large_image_url': 'https://cdn.myanimelist.net/images/anime/11/50411l.webp'}}","{'youtube_id': None, 'url': None, 'embed_url': None, 'images': {'image_url': None, 'small_image_url': None, 'medium_image_url': None, 'large_image_url': None, 'maximum_image_url': None}}","""ef: A Tale of Memories.""",ef - a tale of memories.,ef - a tale of memories.,[],TV,Visual novel,12,Finished Airing,False,"{'from': '2007-10-07T00:00:00+00:00', 'to': '2007-12-23T00:00:00+00:00', 'prop': {'from': {'day': 7, 'month': 10, 'year': 2007}, 'to': {'day': 23, 'month': 12, 'year': 2007}}, 'string': 'Oct 7, 2007 to Dec 23, 2007'}",24 min per ep,PG-13 - Teens 13 or older,7.91,99241.0,676,792,237210,2695,"On Christmas Eve, Hiro Hirono runs into Miyako Miyamura, a frivolous girl who ""borrows"" his bicycle in order to chase down a purse thief. After Hiro finds his bicycle wrecked and Miyako unconscious, the two unexpectedly spend their Christmas Eve together, and when they discover they go to the same high school, their accidental relationship develops even further. This sparks the jealousy of Hiro's childhood friend Kei Shindou, whose pure approach to life catches the eye of Kyosuke Tsutsumi, a womanizing photographer searching for the perfect shot. Elsewhere, Renji Asou, a boy who dreams of being a girl's knight in shining armor, has a chance encounter with Kei's twin sister—the overly shy Chihiro Shindou, who spends her time reading alone—at an abandoned train station. The two quickly become friends and eventually decide to write a novel together. However, when Renji discovers Chihiro's secret, a disability that causes her to have an eternally ephemeral memory, his childish ideals will be put to the test. Guided by two mysterious adults, these youths' relationships intertwine in a heart-rending tale of love, rejection, acceptance, and memories. [Written by MAL Rewrite]",,fall,2007,"{'day': 'Sundays', 'time': '01:35', 'timezone': 'Asia/Tokyo', 'string': 'Sundays at 01:35 (JST)'}","[{'mal_id': 160, 'type': 'anime', 'name': 'Rondo Robe', 'url': 'https://myanimelist.net/anime/producer/160/Rondo_Robe'}]","[{'mal_id': 376, 'type': 'anime', 'name': 'Sentai Filmworks', 'url': 'https://myanimelist.net/anime/producer/376/Sentai_Filmworks'}]","[{'mal_id': 44, 'type': 'anime', 'name': 'Shaft', 'url': 'https://myanimelist.net/anime/producer/44/Shaft'}]","[{'mal_id': 8, 'type': 'anime', 'name': 'Drama', 'url': 'https://myanimelist.net/anime/genre/8/Drama'}, {'mal_id': 7, 'type': 'anime', 'name': 'Mystery', 'url': 'https://myanimelist.net/anime/genre/7/Mystery'}, {'mal_id': 22, 'type': 'anime', 'name': 'Romance', 'url': 'https://myanimelist.net/anime/genre/22/Romance'}]",[],[],[]
2581,https://myanimelist.net/anime/2581/Mobile_Suit_Gundam_00,"{'jpg': {'image_url': 'https://cdn.myanimelist.net/images/anime/3/13200.jpg', 'small_image_url': 'https://cdn.myanimelist.net/images/anime/3/13200t.jpg', 'large_image_url': 'https://cdn.myanimelist.net/images/anime/3/13200l.jpg'}, 'webp': {'image_url': 'https://cdn.myanimelist.net/images/anime/3/13200.webp', 'small_image_url': 'https://cdn.myanimelist.net/images/anime/3/13200t.webp', 'large_image_url': 'https://cdn.myanimelist.net/images/anime/3/13200l.webp'}}","{'youtube_id': 'yTGzkTQjGak', 'url': 'https://www.youtube.com/watch?v=yTGzkTQjGak', 'embed_url': 'https://www.youtube.com/embed/yTGzkTQjGak?enablejsapi=1&wmode=opaque&autoplay=1', 'images': {'image_url': 'https://img.youtube.com/vi/yTGzkTQjGak/default.jpg', 'small_image_url': 'https://img.youtube.com/vi/yTGzkTQjGak/sddefault.jpg', 'medium_image_url': 'https://img.youtube.com/vi/yTGzkTQjGak/mqdefault.jpg', 'large_image_url': 'https://img.youtube.com/vi/yTGzkTQjGak/hqdefault.jpg', 'maximum_image_url': 'https://img.youtube.com/vi/yTGzkTQjGak/maxresdefault.jpg'}}","""Mobile Suit Gundam 00""",Mobile Suit Gundam 00,機動戦士ガンダム00,"['Kidou Senshi Gundam 00', 'Gundam Double O']",TV,Original,25,Finished Airing,False,"{'from': '2007-10-06T00:00:00+00:00', 'to': '2008-03-29T00:00:00+00:00', 'prop': {'from': {'day': 6, 'month': 10, 'year': 2007}, 'to': {'day': 29, 'month': 3, 'year': 2008}}, 'string': 'Oct 6, 2007 to Mar 29, 2008'}",24 min per ep,R - 17+ (violence & profanity),8.12,108990.0,401,942,200526,4216,"In the distant future, mankind's dependence on fossil fuels will lead to their complete depletion, an energy crisis unlike anything the world witnessed. Out of retaliation and fear, humanity began focusing at an alternative source of energy: solar power. Different nations have united together to form three major factions—the Union of Solar Energy and Free Nations, the Advanced European Union, and the Human Reform League. Each of these sectors has access to a solar power generator, which gives them limitless energy. As a result, countries that were once dependent on the sale of fossil fuels are now plunged in poverty, leading to years of warfare and internal strife over the control of solar energy. Amid this chaos, an unknown paramilitary organization appeared identifying themselves as ""Celestial Being,"" aspire to end all warfare through armed intervention by using mysterious and technologically advanced Mobile Suits known as Gundams. Mobile Suit Gundam 00 follows the story of Celestial Being's Gundam Meisters Setsuna F. Seiei, Lockon Stratos, Allelujah Haptism, and Tieria Erde. These four dive into the devastating battle between the three superpowers to accomplish their goal of changing the world. [Written by MAL Rewrite]",,fall,2007,"{'day': 'Saturdays', 'time': '18:00', 'timezone': 'Asia/Tokyo', 'string': 'Saturdays at 18:00 (JST)'}","[{'mal_id': 64, 'type': 'anime', 'name': 'Sotsu', 'url': 'https://myanimelist.net/anime/producer/64/Sotsu'}, {'mal_id': 142, 'type': 'anime', 'name': 'Asatsu DK', 'url': 'https://myanimelist.net/anime/producer/142/Asatsu_DK'}, {'mal_id': 143, 'type': 'anime', 'name': 'Mainichi Broadcasting System', 'url': 'https://myanimelist.net/anime/producer/143/Mainichi_Broadcasting_System'}, {'mal_id': 757, 'type': 'anime', 'name': 'Sony Music Entertainment', 'url': 'https://myanimelist.net/anime/producer/757/Sony_Music_Entertainment'}]","[{'mal_id': 233, 'type': 'anime', 'name': 'Bandai Entertainment', 'url': 'https://myanimelist.net/anime/producer/233/Bandai_Entertainment'}]","[{'mal_id': 14, 'type': 'anime', 'name': 'Sunrise', 'url': 'https://myanimelist.net/anime/producer/14/Sunrise'}]","[{'mal_id': 1, 'type': 'anime', 'name': 'Action', 'url': 'https://myanimelist.net/anime/genre/1/Action'}, {'mal_id': 8, 'type': 'anime', 'name': 'Drama', 'url': 'https://myanimelist.net/anime/genre/8/Drama'}, {'mal_id': 24, 'type': 'anime', 'name': 'Sci-Fi', 'url': 'https://myanimelist.net/anime/genre/24/Sci-Fi'}]",[],"[{'mal_id': 18, 'type': 'anime', 'name': 'Mecha', 'url': 'https://myanimelist.net/anime/genre/18/Mecha'}, {'mal_id': 38, 'type': 'anime', 'name': 'Military', 'url': 'https://myanimelist.net/anime/genre/38/Military'}, {'mal_id': 29, 'type': 'anime', 'name': 'Space', 'url': 'https://myanimelist.net/anime/genre/29/Space'}]",[]
2923,https://myanimelist.net/anime/2923/Shugo_Chara,"{'jpg': {'image_url': 'https://cdn.myanimelist.net/images/anime/7/5061.jpg', 'small_image_url': 'https://cdn.myanimelist.net/images/anime/7/5061t.jpg', 'large_image_url': 'https://cdn.myanimelist.net/images/anime/7/5061l.jpg'}, 'webp': {'image_url': 'https://cdn.myanimelist.net/images/anime/7/5061.webp', 'small_image_url': 'https://cdn.myanimelist.net/images/anime/7/5061t.webp', 'large_image_url': 'https://cdn.myanimelist.net/images/anime/7/5061l.webp'}}","{'youtube_id': 'W6MxRZahEgA', 'url': 'https://www.youtube.com/watch?v=W6MxRZahEgA', 'embed_url': 'https://www.youtube.com/embed/W6MxRZahEgA?enablejsapi=1&wmode=opaque&autoplay=1', 'images': {'image_url': 'https://img.youtube.com/vi/W6MxRZahEgA/default.jpg', 'small_image_url': 'https://img.youtube.com/vi/W6MxRZahEgA/sddefault.jpg', 'medium_image_url': 'https://img.youtube.com/vi/W6MxRZahEgA/mqdefault.jpg', 'large_image_url': 'https://img.youtube.com/vi/W6MxRZahEgA/hqdefault.jpg', 'maximum_image_url': 'https://img.youtube.com/vi/W6MxRZahEgA/maxresdefault.jpg'}}","""Shugo Chara!""",Shugo Chara!,しゅごキャラ！,['Guardian Character!'],TV,Manga,51,Finished Airing,False,"{'from': '2007-10-06T00:00:00+00:00', 'to': '2008-09-27T00:00:00+00:00', 'prop': {'from': {'day': 6, 'month': 10, 'year': 2007}, 'to': {'day': 27, 'month': 9, 'year': 2008}}, 'string': 'Oct 6, 2007 to Sep 27, 2008'}",24 min per ep,PG - Children,7.4,90297.0,1975,944,200086,2713,"Amu Hinamori is a shy girl who struggles to make friends in part due to the rumors spread around school about her ""cool and spicy"" personality. Wishing that she could show everyone her ""would-be"" self, Amu wakes up to the presence of three colorful and ornately decorated eggs in her bed. Each of these ""Hearts Eggs"" houses a ""Guardian Character""—manifestations of someone's would-be self and their dreams. With the aid of Ran, Miki, and Su, Amu now finds herself able to express who she truly is. However, things do not always pan out in her favor. The sudden appearance of Amu's Guardian Characters prompts the Seiyo Elementary Guardians, a student council-like group with each member possessing their own Guardian Character, to take notice of her. As someone who has multiple Characters, Amu is roped into being the Guardians' ""Joker,"" tasked with helping them find X Eggs—corrupted versions of one's Hearts Egg. As she becomes entangled in the Guardians' quest, Amu begins to uncover more about these mysterious Characters, the X Eggs, and the organization that seems to be at the center of it all. [Written by MAL Rewrite]","Shugo Chara! was released in 16 compilation DVDs by Pony Canyon, each containing three to four episodes, from February 20, 2008 to May 20, 2009. The series has been dubbed in French and Italian by Studio La Dame Blanche and LOGOS srl respectively.",fall,2007,"{'day': None, 'time': None, 'timezone': None, 'string': 'Unknown'}","[{'mal_id': 16, 'type': 'anime', 'name': 'TV Tokyo', 'url': 'https://myanimelist.net/anime/producer/16/TV_Tokyo'}, {'mal_id': 64, 'type': 'anime', 'name': 'Sotsu', 'url': 'https://myanimelist.net/anime/producer/64/Sotsu'}, {'mal_id': 144, 'type': 'anime', 'name': 'Pony Canyon', 'url': 'https://myanimelist.net/anime/producer/144/Pony_Canyon'}]",[],"[{'mal_id': 41, 'type': 'anime', 'name': 'Satelight', 'url': 'https://myanimelist.net/anime/producer/41/Satelight'}]","[{'mal_id': 4, 'type': 'anime', 'name': 'Comedy', 'url': 'https://myanimelist.net/anime/genre/4/Comedy'}]",[],"[{'mal_id': 23, 'type': 'anime', 'name': 'School', 'url': 'https://myanimelist.net/anime/genre/23/School'}]","[{'mal_id': 25, 'type': 'anime', 'name': 'Shoujo', 'url': 'https://myanimelist.net/anime/genre/25/Shoujo'}]"
