mal_id,url,images,trailer,title,title_english,title_japanese,title_synonyms,type,source,episodes,status,airing,aired,duration,rating,score,scored_by,rank,popularity,members,favorites,synopsis,background,season,year,broadcast,producers,licensors,studios,genres,explicit_genres,themes,demographics
1735,https://myanimelist.net/anime/1735/Naruto__Shippuuden,"{'jpg': {'image_url': 'https://cdn.myanimelist.net/images/anime/5/17407.jpg', 'small_image_url': 'https://cdn.myanimelist.net/images/anime/5/17407t.jpg', 'large_image_url': 'https://cdn.myanimelist.net/images/anime/5/17407l.jpg'}, 'webp': {'image_url': 'https://cdn.myanimelist.net/images/anime/5/17407.webp', 'small_image_url': 'https://cdn.myanimelist.net/images/anime/5/17407t.webp', 'large_image_url': 'https://cdn.myanimelist.net/images/anime/5/17407l.webp'}}","{'youtube_id': '1dy2zPPrKD0', 'url': 'https://www.youtube.com/watch?v=1dy2zPPrKD0', 'embed_url': 'https://www.youtube.com/embed/1dy2zPPrKD0?enablejsapi=1&wmode=opaque&autoplay=1', 'images': {'image_url': 'https://img.youtube.com/vi/1dy2zPPrKD0/default.jpg', 'small_image_url': 'https://img.youtube.com/vi/1dy2zPPrKD0/sddefault.jpg', 'medium_image_url': 'https://img.youtube.com/vi/1dy2zPPrKD0/mqdefault.jpg', 'large_image_url': 'https://img.youtube.com/vi/1dy2zPPrKD0/hqdefault.jpg', 'maximum_image_url': 'https://img.youtube.com/vi/1dy2zPPrKD0/maxresdefault.jpg'}}","""Naruto: Shippuuden""",Naruto: Shippuden,ナルト- 疾風伝,['Naruto Hurricane Chronicles'],TV,Manga,500,Finished Airing,False,"{'from': '2007-02-15T00:00:00+00:00', 'to': '2017-03-23T00:00:00+00:00', 'prop': {'from': {'day': 15, 'month': 2, 'year': 2007}, 'to': {'day': 23, 'month': 3, 'year': 2017}}, 'string': 'Feb 15, 2007 to Mar 23, 2017'}",23 min per ep,PG-13 - Teens 13 or older,8.23,1194348.0,290,16,2031354,92960,"It has been two and a half years since Naruto Uzumaki left Konohagakure, the Hidden Leaf Village, for intense training following events which fueled his desire to be stronger. Now Akatsuki, the mysterious organization of elite rogue ninja, is closing in on their grand plan which may threaten the safety of the entire shinobi world. Although Naruto is older and sinister events loom on the horizon, he has changed little in personality—still rambunctious and childish—though he is now far more confident and possesses an even greater determination to protect his friends and home. Come whatever may, Naruto will carry on with the fight for what is important to him, even at the expense of his own body, in the continuation of the saga about the boy who wishes to become Hokage. [Written by MAL Rewrite]",,winter,2007,"{'day': 'Thursdays', 'time': '19:30', 'timezone': 'Asia/Tokyo', 'string': 'Thursdays at 19:30 (JST)'}","[{'mal_id': 16, 'type': 'anime', 'name': 'TV Tokyo', 'url': 'https://myanimelist.net/anime/producer/16/TV_Tokyo'}, {'mal_id': 17, 'type': 'anime', 'name': 'Aniplex', 'url': 'https://myanimelist.net/anime/producer/17/Aniplex'}, {'mal_id': 50, 'type': 'anime', 'name': 'KSS', 'url': 'https://myanimelist.net/anime/producer/50/KSS'}, {'mal_id': 211, 'type': 'anime', 'name': 'Rakuonsha', 'url': 'https://myanimelist.net/anime/producer/211/Rakuonsha'}, {'mal_id': 717, 'type': 'anime', 'name': 'TV Tokyo Music', 'url': 'https://myanimelist.net/anime/producer/717/TV_Tokyo_Music'}, {'mal_id': 1365, 'type': 'anime', 'name': 'Shueisha', 'url': 'https://myanimelist.net/anime/producer/1365/Shueisha'}]","[{'mal_id': 119, 'type': 'anime', 'name': 'VIZ Media', 'url': 'https://myanimelist.net/anime/producer/119/VIZ_Media'}]","[{'mal_id': 1, 'type': 'anime', 'name': 'Studio Pierrot', 'url': 'https://myanimelist.net/anime/producer/1/Studio_Pierrot'}]","[{'mal_id': 1, 'type': 'anime', 'name': 'Action', 'url': 'https://myanimelist.net/anime/genre/1/Action'}, {'mal_id': 2, 'type': 'anime', 'name': 'Adventure', 'url': 'https://myanimelist.net/anime/genre/2/Adventure'}, {'mal_id': 4, 'type': 'anime', 'name': 'Comedy', 'url': 'https://myanimelist.net/anime/genre/4/Comedy'}]",[],"[{'mal_id': 17, 'type': 'anime', 'name': 'Martial Arts', 'url': 'https://myanimelist.net/anime/genre/17/Martial_Arts'}, {'mal_id': 31, 'type': 'anime', 'name': 'Super Power', 'url': 'https://myanimelist.net/anime/genre/31/Super_Power'}]","[{'mal_id': 27, 'type': 'anime', 'name': 'Shounen', 'url': 'https://myanimelist.net/anime/genre/27/Shounen'}]"
1698,https://myanimelist.net/anime/1698/Nodame_Cantabile,"{'jpg': {'image_url': 'https://cdn.myanimelist.net/images/anime/9/11986.jpg', 'small_image_url': 'https://cdn.myanimelist.net/images/anime/9/11986t.jpg', 'large_image_url': 'https://cdn.myanimelist.net/images/anime/9/11986l.jpg'}, 'webp': {'image_url': 'https://cdn.myanimelist.net/images/anime/9/11986.webp', 'small_image_url': 'https://cdn.myanimelist.net/images/anime/9/11986t.webp', 'large_image_url': 'https://cdn.myanimelist.net/images/anime/9/11986l.webp'}}","{'youtube_id': None, 'url': None, 'embed_url': None, 'images': {'image_url': None, 'small_image_url': None, 'medium_image_url': None, 'large_image_url': None, 'maximum_image_url': None}}","""Nodame Cantabile""",Nodame Cantabile,のだめカンタービレ,[],TV,Manga,23,Finished Airing,False,"{'from': '2007-01-12T00:00:00+00:00', 'to': '2007-06-15T00:00:00+00:00', 'prop': {'from': {'day': 12, 'month': 1, 'year': 2007}, 'to': {'day': 15, 'month': 6, 'year': 2007}}, 'string': 'Jan 12, 2007 to Jun 15, 2007'}",22 min per ep,PG-13 - Teens 13 or older,8.29,116798.0,241,636,287679,4774,"Shinichi Chiaki is a first class musician whose dream is to play among the elites in Europe. Coming from a distinguished family, he is an infamous perfectionist—not only is he highly critical of himself, but of others as well. The only thing stopping Shinichi from leaving for Europe is his fear of flying. As a result, he's grounded in Japan. During his fourth year at Japan's top music university, Shinichi happens to meet Megumi Noda or, as she refers to herself, Nodame. On the surface, she seems to be an unkempt girl with no direction in life. However, when Shinichi hears Nodame play the piano for the first time, he is in awe of the kind of music she creates. Nevertheless, Shinichi is dismayed to discover that Nodame is his neighbor, and worse, she ends up falling head over heels in love with him. [Written by MAL Rewrite]",,winter,2007,"{'day': None, 'time': None, 'timezone': None, 'string': 'Fridays at Unknown'}","[{'mal_id': 53, 'type': 'anime', 'name': 'Dentsu', 'url': 'https://myanimelist.net/anime/producer/53/Dentsu'}, {'mal_id': 79, 'type': 'anime', 'name': 'Genco', 'url': 'https://myanimelist.net/anime/producer/79/Genco'}, {'mal_id': 159, 'type': 'anime', 'name': 'Kodansha', 'url': 'https://myanimelist.net/anime/producer/159/Kodansha'}, {'mal_id': 169, 'type': 'anime', 'name': 'Fuji TV', 'url': 'https://myanimelist.net/anime/producer/169/Fuji_TV'}, {'mal_id': 306, 'type': 'anime', 'name': 'Magic Capsule', 'url': 'https://myanimelist.net/anime/producer/306/Magic_Capsule'}, {'mal_id': 757, 'type': 'anime', 'name': 'Sony Music Entertainment', 'url': 'https://myanimelist.net/anime/producer/757/Sony_Music_Entertainment'}, {'mal_id': 769, 'type': 'anime', 'name': 'Fujipacific Music', 'url': 'https://myanimelist.net/anime/producer/769/Fujipacific_Music'}]",[],"[{'mal_id': 7, 'type': 'anime', 'name': 'J.C.Staff', 'url': 'https://myanimelist.net/anime/producer/7/JCStaff'}]","[{'mal_id': 4, 'type': 'anime', 'name': 'Comedy', 'url': 'https://myanimelist.net/anime/genre/4/Comedy'}, {'mal_id': 8, 'type': 'anime', 'name': 'Drama', 'url': 'https://myanimelist.net/anime/genre/8/Drama'}, {'mal_id': 22, 'type': 'anime', 'name': 'Romance', 'url': 'https://myanimelist.net/anime/genre/22/Romance'}, {'mal_id': 36, 'type': 'anime', 'name': 'Slice of Life', 'url': 'https://myanimelist.net/anime/genre/36/Slice_of_Life'}]",[],"[{'mal_id': 19, 'type': 'anime', 'name': 'Music', 'url': 'https://myanimelist.net/anime/genre/19/Music'}]","[{'mal_id': 43, 'type': 'anime', 'name': 'Josei', 'url': 'https://myanimelist.net/anime/genre/43/Josei'}]"
1860,https://myanimelist.net/anime/1860/Tokyo_Majin_Gakuen_Kenpucho__Tou,"{'jpg': {'image_url': 'https://cdn.myanimelist.net/images/anime/1894/113730.jpg', 'small_image_url': 'https://cdn.myanimelist.net/images/anime/1894/113730t.jpg', 'large_image_url': 'https://cdn.myanimelist.net/images/anime/1894/113730l.jpg'}, 'webp': {'image_url': 'https://cdn.myanimelist.net/images/anime/1894/113730.webp', 'small_image_url': 'https://cdn.myanimelist.net/images/anime/1894/113730t.webp', 'large_image_url': 'https://cdn.myanimelist.net/images/anime/1894/113730l.webp'}}","{'youtube_id': 'e1cOAM0RiEg', 'url': 'https://www.youtube.com/watch?v=e1cOAM0RiEg', 'embed_url': 'https://www.youtube.com/embed/e1cOAM0RiEg?enablejsapi=1&wmode=opaque&autoplay=1', 'images': {'image_url': 'https://img.youtube.com/vi/e1cOAM0RiEg/default.jpg', 'small_image_url': 'https://img.youtube.com/vi/e1cOAM0RiEg/sddefault.jpg', 'medium_image_url': 'https://img.youtube.com/vi/e1cOAM0RiEg/mqdefault.jpg', 'large_image_url': 'https://img.youtube.com/vi/e1cOAM0RiEg/hqdefault.jpg', 'maximum_image_url': 'https://img.youtube.com/vi/e1cOAM0RiEg/maxresdefault.jpg'}}","""Tokyo Majin Gakuen Kenpucho: Tou""",Tokyo Majin,東京魔人學園剣風帖　龖（トウ）,['Tokyo Majin Gakuen Kenpuchou'],TV,Game,14,Finished Airing,False,"{'from': '2007-01-19T00:00:00+00:00', 'to': '2007-04-20T00:00:00+00:00', 'prop': {'from': {'day': 19, 'month': 1, 'year': 2007}, 'to': {'day': 20, 'month': 4, 'year': 2007}}, 'string': 'Jan 19, 2007 to Apr 20, 2007'}",24 min per ep,R - 17+ (violence & profanity),7.1,24181.0,3377,1940,80373,269,"Something evil is stirring in the shadows of Tokyo... During the spring of his senior year in high school, quiet Tatsuma Hiyuu transfers to Magami Academy in Shinjuku. The mysterious boy's ""outsider"" status and his profound skills in martial arts quickly earn him the friendship of class delinquent Kyouichi Houraiji. Through an uncanny connection and a happenstance challenge, he also meets Yuuya Daigo of the wrestling club, the captain of the girls' archery club, Komaki Sakurai, and Aoi Misato, the Student Council President. During their encounter, there is a sudden, harsh disruption of the Ryumyaku (literally Dragon Pulse, otherwise known as Dragon Vein or Dragon Stream), the flow of arcane energy. The surge awakens within the five teenagers a latent power, giving them each a supernatural ability. Enlightened to their newly acquired gifts by Hisui, the young heir of the Kisaragi Clan who maintains his family's antiques shop - as well as their duty to protect Tokyo from Oni (demons) - the Magami students decide to use their power to protect the city from the onslaught of dark forces. Battling the demons alongside Hisui Kisaragi, the five unlikely friends discover that they may have to face a greater threat to Tokyo other than destroying a few malevolent, random monsters. The Ryumyaku had been disrupted by force, from someone invoking the Dark Arts - and that person has a wicked desire to unleash a long-dead evil. Can the teenagers overcome their own fears and flaws to fight against the Dark Arts? And soon they will also have to face their own destinies as they discover their Stars of Fate. This anime is based on a manga, which was based on the Nintendo role-playing video game originally released in 1998.",,winter,2007,"{'day': 'Fridays', 'time': '23:00', 'timezone': 'Asia/Tokyo', 'string': 'Fridays at 23:00 (JST)'}","[{'mal_id': 643, 'type': 'anime', 'name': 'Trinity Sound', 'url': 'https://myanimelist.net/anime/producer/643/Trinity_Sound'}, {'mal_id': 2135, 'type': 'anime', 'name': 'Imagine', 'url': 'https://myanimelist.net/anime/producer/2135/Imagine'}]","[{'mal_id': 97, 'type': 'anime', 'name': 'ADV Films', 'url': 'https://myanimelist.net/anime/producer/97/ADV_Films'}, {'mal_id': 102, 'type': 'anime', 'name': 'Funimation', 'url': 'https://myanimelist.net/anime/producer/102/Funimation'}]","[{'mal_id': 83, 'type': 'anime', 'name': 'AIC Spirits', 'url': 'https://myanimelist.net/anime/producer/83/AIC_Spirits'}, {'mal_id': 89, 'type': 'anime', 'name': 'BeSTACK', 'url': 'https://myanimelist.net/anime/producer/89/BeSTACK'}]","[{'mal_id': 1, 'type': 'anime', 'name': 'Action', 'url': 'https://myanimelist.net/anime/genre/1/Action'}, {'mal_id': 8, 'type': 'anime', 'name': 'Drama', 'url': 'https://myanimelist.net/anime/genre/8/Drama'}, {'mal_id': 10, 'type': 'anime', 'name': 'Fantasy', 'url': 'https://myanimelist.net/anime/genre/10/Fantasy'}, {'mal_id': 14, 'type': 'anime', 'name': 'Horror', 'url': 'https://myanimelist.net/anime/genre/14/Horror'}, {'mal_id': 37, 'type': 'anime', 'name': 'Supernatural', 'url': 'https://myanimelist.net/anime/genre/37/Supernatural'}]",[],"[{'mal_id': 17, 'type': 'anime', 'name': 'Martial Arts', 'url': 'https://myanimelist.net/anime/genre/17/Martial_Arts'}, {'mal_id': 23, 'type': 'anime', 'name': 'School', 'url': 'https://myanimelist.net/anime/genre/23/School'}]",[]
1956,https://myanimelist.net/anime/1956/Ikkitousen__Dragon_Destiny,"{'jpg': {'image_url': 'https://cdn.myanimelist.net/images/anime/6/85202.jpg', 'small_image_url': 'https://cdn.myanimelist.net/images/anime/6/85202t.jpg', 'large_image_url': 'https://cdn.myanimelist.net/images/anime/6/85202l.jpg'}, 'webp': {'image_url': 'https://cdn.myanimelist.net/images/anime/6/85202.webp', 'small_image_url': 'https://cdn.myanimelist.net/images/anime/6/85202t.webp', 'large_image_url': 'https://cdn.myanimelist.net/images/anime/6/85202l.webp'}}","{'youtube_id': 'qZz_RikHMyM', 'url': 'https://www.youtube.com/watch?v=qZz_RikHMyM', 'embed_url': 'https://www.youtube.com/embed/qZz_RikHMyM?enablejsapi=1&wmode=opaque&autoplay=1', 'images': {'image_url': 'https://img.youtube.com/vi/qZz_RikHMyM/default.jpg', 'small_image_url': 'https://img.youtube.com/vi/qZz_RikHMyM/sddefault.jpg', 'medium_image_url': 'https://img.youtube.com/vi/qZz_RikHMyM/mqdefault.jpg', 'large_image_url': 'https://img.youtube.com/vi/qZz_RikHMyM/hqdefault.jpg', 'maximum_image_url': 'https://img.youtube.com/vi/qZz_RikHMyM/maxresdefault.jpg'}}","""Ikkitousen: Dragon Destiny""",Ikkitousen: Dragon Destiny,一騎当千 Dragon Destiny,['Ikkitosen Season 2'],TV,Manga,12,Finished Airing,False,"{'from': '2007-02-26T00:00:00+00:00', 'to': '2007-05-14T00:00:00+00:00', 'prop': {'from': {'day': 26, 'month': 2, 'year': 2007}, 'to': {'day': 14, 'month': 5, 'year': 2007}}, 'string': 'Feb 26, 2007 to May 14, 2007'}",24 min per ep,R+ - Mild Nudity,6.77,33608.0,4806,2066,72237,112,"Loosely based on the novel Romance of the Three Kingdoms, modern day Japan sees a similar struggle for power between different rival schools with the three strongest being; Kyosho Academy led by Sousou Moutoku, Nanyo Academy by Sonsaku Hakufu and Ryuubi Gentoku from Seito High School. Together these three tousei, each with their own mangatama, fight for the honor of becoming ikkitousen and fulfilling their fated destiny through battle and conquest. (Source: ANN)",,winter,2007,"{'day': 'Mondays', 'time': '10:30', 'timezone': 'Asia/Tokyo', 'string': 'Mondays at 10:30 (JST)'}","[{'mal_id': 79, 'type': 'anime', 'name': 'Genco', 'url': 'https://myanimelist.net/anime/producer/79/Genco'}, {'mal_id': 1175, 'type': 'anime', 'name': 'Atelier Musa', 'url': 'https://myanimelist.net/anime/producer/1175/Atelier_Musa'}, {'mal_id': 1636, 'type': 'anime', 'name': 'Gigno Systems', 'url': 'https://myanimelist.net/anime/producer/1636/Gigno_Systems'}]","[{'mal_id': 250, 'type': 'anime', 'name': 'Media Blasters', 'url': 'https://myanimelist.net/anime/producer/250/Media_Blasters'}]","[{'mal_id': 38, 'type': 'anime', 'name': 'Arms', 'url': 'https://myanimelist.net/anime/producer/38/Arms'}]","[{'mal_id': 1, 'type': 'anime', 'name': 'Action', 'url': 'https://myanimelist.net/anime/genre/1/Action'}, {'mal_id': 9, 'type': 'anime', 'name': 'Ecchi', 'url': 'https://myanimelist.net/anime/genre/9/Ecchi'}]",[],"[{'mal_id': 17, 'type': 'anime', 'name': 'Martial Arts', 'url': 'https://myanimelist.net/anime/genre/17/Martial_Arts'}, {'mal_id': 23, 'type': 'anime', 'name': 'School', 'url': 'https://myanimelist.net/anime/genre/23/School'}, {'mal_id': 31, 'type': 'anime', 'name': 'Super Power', 'url': 'https://myanimelist.net/anime/genre/31/Super_Power'}]",[]
1852,https://myanimelist.net/anime/1852/Hidamari_Sketch,"{'jpg': {'image_url': 'https://cdn.myanimelist.net/images/anime/1/1852.jpg', 'small_image_url': 'https://cdn.myanimelist.net/images/anime/1/1852t.jpg', 'large_image_url': 'https://cdn.myanimelist.net/images/anime/1/1852l.jpg'}, 'webp': {'image_url': 'https://cdn.myanimelist.net/images/anime/1/1852.webp', 'small_image_url': 'https://cdn.myanimelist.net/images/anime/1/1852t.webp', 'large_image_url': 'https://cdn.myanimelist.net/images/anime/1/1852l.webp'}}","{'youtube_id': None, 'url': None, 'embed_url': None, 'images': {'image_url': None, 'small_image_url': None, 'medium_image_url': None, 'large_image_url': None, 'maximum_image_url': None}}","""Hidamari Sketch""",Hidamari Sketch,ひだまりスケッチ,[],TV,4-koma manga,12,Finished Airing,False,"{'from': '2007-01-12T00:00:00+00:00', 'to': '2007-03-30T00:00:00+00:00', 'prop': {'from': {'day': 12, 'month': 1, 'year': 2007}, 'to': {'day': 30, 'month': 3, 'year': 2007}}, 'string': 'Jan 12, 2007 to Mar 30, 2007'}",24 min per ep,PG-13 - Teens 13 or older,7.45,22924.0,1801,2087,71167,961,"Ever since she was young, Yuno has always had an interest in art. Now that she has been accepted to Yamabuki Arts High School, it means one thing—moving out. Living in a dorm at Hidamari Apartments alone, Yuno meets her neighbors: the hyperactive Miyako, the self-conscious Hiro, and the mature Sae. Despite their different personalities, they go to the same school, spend time together, and develop a strong friendship. Yuno's life won't be so lonely after all! Hidamari Sketch revolves around the antics and day-to-day lives of the girls living at Hidamari Apartments. [Written by MAL Rewrite]",,winter,2007,"{'day': 'Fridays', 'time': '01:25', 'timezone': 'Asia/Tokyo', 'string': 'Fridays at 01:25 (JST)'}","[{'mal_id': 17, 'type': 'anime', 'name': 'Aniplex', 'url': 'https://myanimelist.net/anime/producer/17/Aniplex'}, {'mal_id': 104, 'type': 'anime', 'name': 'Lantis', 'url': 'https://myanimelist.net/anime/producer/104/Lantis'}, {'mal_id': 145, 'type': 'anime', 'name': 'TBS', 'url': 'https://myanimelist.net/anime/producer/145/TBS'}, {'mal_id': 166, 'type': 'anime', 'name': 'Movic', 'url': 'https://myanimelist.net/anime/producer/166/Movic'}, {'mal_id': 797, 'type': 'anime', 'name': 'Houbunsha', 'url': 'https://myanimelist.net/anime/producer/797/Houbunsha'}]","[{'mal_id': 376, 'type': 'anime', 'name': 'Sentai Filmworks', 'url': 'https://myanimelist.net/anime/producer/376/Sentai_Filmworks'}]","[{'mal_id': 44, 'type': 'anime', 'name': 'Shaft', 'url': 'https://myanimelist.net/anime/producer/44/Shaft'}]","[{'mal_id': 4, 'type': 'anime', 'name': 'Comedy', 'url': 'https://myanimelist.net/anime/genre/4/Comedy'}, {'mal_id': 36, 'type': 'anime', 'name': 'Slice of Life', 'url': 'https://myanimelist.net/anime/genre/36/Slice_of_Life'}]",[],"[{'mal_id': 23, 'type': 'anime', 'name': 'School', 'url': 'https://myanimelist.net/anime/genre/23/School'}]","[{'mal_id': 42, 'type': 'anime', 'name': 'Seinen', 'url': 'https://myanimelist.net/anime/genre/42/Seinen'}]"
1842,https://myanimelist.net/anime/1842/Major_S3,"{'jpg': {'image_url': 'https://cdn.myanimelist.net/images/anime/9/73971.jpg', 'small_image_url': 'https://cdn.myanimelist.net/images/anime/9/73971t.jpg', 'large_image_url': 'https://cdn.myanimelist.net/images/anime/9/73971l.jpg'}, 'webp': {'image_url': 'https://cdn.myanimelist.net/images/anime/9/73971.webp', 'small_image_url': 'https://cdn.myanimelist.net/images/anime/9/73971t.webp', 'large_image_url': 'https://cdn.myanimelist.net/images/anime/9/73971l.webp'}}","{'youtube_id': None, 'url': None, 'embed_url': None, 'images': {'image_url': None, 'small_image_url': None, 'medium_image_url': None, 'large_image_url': None, 'maximum_image_url': None}}","""Major S3""",,メジャー (第3シリーズ),"['Major 3rd Season', 'Major 3', 'm3']",TV,Manga,26,Finished Airing,False,"{'from': '2007-01-06T00:00:00+00:00', 'to': '2007-06-30T00:00:00+00:00', 'prop': {'from': {'day': 6, 'month': 1, 'year': 2007}, 'to': {'day': 30, 'month': 6, 'year': 2007}}, 'string': 'Jan 6, 2007 to Jun 30, 2007'}",25 min per ep,PG-13 - Teens 13 or older,8.24,39333.0,281,2265,62681,339,"Having bid farewell to his former teammates at Kaido High School's baseball club, Gorou Honda returns to his hometown eager to continue playing. Attending a new high school proves to be more difficult than he initially expected, as Tetsufumi Egashira's merciless slandering of his name prevents Gorou from being accepted into any school with an existing baseball team. Left with no other options, Gorou joins Seishuu High School, where his childhood friend Kaoru Shimizu also attends. However, Seishuu has always been an all-girls school until two years ago, so there is not yet a dedicated men’s baseball team. But nothing will stop Gorou in his pursuit of Koshien. He must now create a baseball team from scratch with the seven male students at Seishuu, but all of them are complete amateurs! He decides to train the incompetent team up to nationally competitive levels, but such a feat is easier said than done. Will Gorou once again perform miracles? Or will he give up on achieving his goal of defeating Kaido with his own team? [Written by MAL Rewrite]",,winter,2007,"{'day': None, 'time': None, 'timezone': None, 'string': 'Unknown'}","[{'mal_id': 111, 'type': 'anime', 'name': 'NHK', 'url': 'https://myanimelist.net/anime/producer/111/NHK'}]",[],"[{'mal_id': 101, 'type': 'anime', 'name': 'Studio Hibari', 'url': 'https://myanimelist.net/anime/producer/101/Studio_Hibari'}]","[{'mal_id': 8, 'type': 'anime', 'name': 'Drama', 'url': 'https://myanimelist.net/anime/genre/8/Drama'}, {'mal_id': 30, 'type': 'anime', 'name': 'Sports', 'url': 'https://myanimelist.net/anime/genre/30/Sports'}]",[],[],"[{'mal_id': 27, 'type': 'anime', 'name': 'Shounen', 'url': 'https://myanimelist.net/anime/genre/27/Shounen'}]"
1836,https://myanimelist.net/anime/1836/Shuffle_Memories,"{'jpg': {'image_url': 'https://cdn.myanimelist.net/images/anime/4/19624.jpg', 'small_image_url': 'https://cdn.myanimelist.net/images/anime/4/19624t.jpg', 'large_image_url': 'https://cdn.myanimelist.net/images/anime/4/19624l.jpg'}, 'webp': {'image_url': 'https://cdn.myanimelist.net/images/anime/4/19624.webp', 'small_image_url': 'https://cdn.myanimelist.net/images/anime/4/19624t.webp', 'large_image_url': 'https://cdn.myanimelist.net/images/anime/4/19624l.webp'}}","{'youtube_id': 'rnvHQ_pcN9w', 'url': 'https://www.youtube.com/watch?v=rnvHQ_pcN9w', 'embed_url': 'https://www.youtube.com/embed/rnvHQ_pcN9w?enablejsapi=1&wmode=opaque&autoplay=1', 'images': {'image_url': 'https://img.youtube.com/vi/rnvHQ_pcN9w/default.jpg', 'small_image_url': 'https://img.youtube.com/vi/rnvHQ_pcN9w/sddefault.jpg', 'medium_image_url': 'https://img.youtube.com/vi/rnvHQ_pcN9w/mqdefault.jpg', 'large_image_url': 'https://img.youtube.com/vi/rnvHQ_pcN9w/hqdefault.jpg', 'maximum_image_url': 'https://img.youtube.com/vi/rnvHQ_pcN9w/maxresdefault.jpg'}}","""Shuffle! Memories""",,シャッフル！メモリーズ,[],TV,Visual novel,12,Finished Airing,False,"{'from': '2007-01-08T00:00:00+00:00', 'to': '2007-03-26T00:00:00+00:00', 'prop': {'from': {'day': 8, 'month': 1, 'year': 2007}, 'to': {'day': 26, 'month': 3, 'year': 2007}}, 'string': 'Jan 8, 2007 to Mar 26, 2007'}",24 min per ep,PG-13 - Teens 13 or older,6.53,21244.0,6044,2511,52175,42,"A recap of the Shuffle world, set ten years in the future. Gods, Demons, and Humans freely visit the other worlds as if traveling overseas, and romance is in the air. Demons, Gods, And Humans together have been falling in love and creating new families, breaking down the wall that once seperated them. Past memories are visited by Rin Tsuchimi and the events that occured between him and Lisianthus, Nerine, Kaede, Asa, and Primula. (Source: ANN)",,winter,2007,"{'day': 'Mondays', 'time': '00:00', 'timezone': 'Asia/Tokyo', 'string': 'Mondays at 00:00 (JST)'}","[{'mal_id': 647, 'type': 'anime', 'name': 'Memory-Tech', 'url': 'https://myanimelist.net/anime/producer/647/Memory-Tech'}]","[{'mal_id': 262, 'type': 'anime', 'name': 'Kadokawa Pictures USA', 'url': 'https://myanimelist.net/anime/producer/262/Kadokawa_Pictures_USA'}]","[{'mal_id': 163, 'type': 'anime', 'name': 'asread.', 'url': 'https://myanimelist.net/anime/producer/163/asread'}]","[{'mal_id': 4, 'type': 'anime', 'name': 'Comedy', 'url': 'https://myanimelist.net/anime/genre/4/Comedy'}, {'mal_id': 8, 'type': 'anime', 'name': 'Drama', 'url': 'https://myanimelist.net/anime/genre/8/Drama'}, {'mal_id': 10, 'type': 'anime', 'name': 'Fantasy', 'url': 'https://myanimelist.net/anime/genre/10/Fantasy'}, {'mal_id': 22, 'type': 'anime', 'name': 'Romance', 'url': 'https://myanimelist.net/anime/genre/22/Romance'}, {'mal_id': 9, 'type': 'anime', 'name': 'Ecchi', 'url': 'https://myanimelist.net/anime/genre/9/Ecchi'}]",[],"[{'mal_id': 35, 'type': 'anime', 'name': 'Harem', 'url': 'https://myanimelist.net/anime/genre/35/Harem'}, {'mal_id': 23, 'type': 'anime', 'name': 'School', 'url': 'https://myanimelist.net/anime/genre/23/School'}]","[{'mal_id': 42, 'type': 'anime', 'name': 'Seinen', 'url': 'https://myanimelist.net/anime/genre/42/Seinen'}]"
