mal_id,url,images,trailer,title,title_english,title_japanese,title_synonyms,type,source,episodes,status,airing,aired,duration,rating,score,scored_by,rank,popularity,members,favorites,synopsis,background,season,year,broadcast,producers,licensors,studios,genres,explicit_genres,themes,demographics
1810,https://myanimelist.net/anime/1810/Kyoushirou_to_Towa_no_Sora,"{'jpg': {'image_url': 'https://cdn.myanimelist.net/images/anime/7/20958.jpg', 'small_image_url': 'https://cdn.myanimelist.net/images/anime/7/20958t.jpg', 'large_image_url': 'https://cdn.myanimelist.net/images/anime/7/20958l.jpg'}, 'webp': {'image_url': 'https://cdn.myanimelist.net/images/anime/7/20958.webp', 'small_image_url': 'https://cdn.myanimelist.net/images/anime/7/20958t.webp', 'large_image_url': 'https://cdn.myanimelist.net/images/anime/7/20958l.webp'}}","{'youtube_id': None, 'url': None, 'embed_url': None, 'images': {'image_url': None, 'small_image_url': None, 'medium_image_url': None, 'large_image_url': None, 'maximum_image_url': None}}","""Kyoushirou to Towa no Sora""",Shattered Angels,京四郎と永遠（とわ）の空,"['Kyoshiro to Towa no Sora', 'Kyoshiro and the Eternal Sky']",TV,Manga,12,Finished Airing,False,"{'from': '2007-01-05T00:00:00+00:00', 'to': '2007-03-23T00:00:00+00:00', 'prop': {'from': {'day': 5, 'month': 1, 'year': 2007}, 'to': {'day': 23, 'month': 3, 'year': 2007}}, 'string': 'Jan 5, 2007 to Mar 23, 2007'}",24 min per ep,PG-13 - Teens 13 or older,6.44,13258.0,6520,2880,40351,91,"Kyoshiro to Towa no Sora revolves around the life of Kuu Shiratori, a seemingly normal high school girl who enjoys her school life in the giant city Academia, which is thought of as a symbol of recovery for humanity since already ten years have passed since the greatest disaster mankind had ever seen, occurred. Kuu has recently been having a recurring dream where a prince meets her and takes her away. One day, while all the students at her school are preparing for the upcoming school festival, the prince, whom she has met several times in her dreams, appears. The prince, Kyoshiro Ayanokoji, requests of her just as he had done in Kuu's dreams, ""Let's go... together..."" (Source: Wikipedia)",,winter,2007,"{'day': 'Fridays', 'time': '13:30', 'timezone': 'Asia/Tokyo', 'string': 'Fridays at 13:30 (JST)'}","[{'mal_id': 31, 'type': 'anime', 'name': 'Geneon Universal Entertainment', 'url': 'https://myanimelist.net/anime/producer/31/Geneon_Universal_Entertainment'}, {'mal_id': 238, 'type': 'anime', 'name': 'AT-X', 'url': 'https://myanimelist.net/anime/producer/238/AT-X'}, {'mal_id': 460, 'type': 'anime', 'name': 'KlockWorx', 'url': 'https://myanimelist.net/anime/producer/460/KlockWorx'}, {'mal_id': 719, 'type': 'anime', 'name': 'Studio Mausu', 'url': 'https://myanimelist.net/anime/producer/719/Studio_Mausu'}, {'mal_id': 741, 'type': 'anime', 'name': 'Toshiba Entertainment', 'url': 'https://myanimelist.net/anime/producer/741/Toshiba_Entertainment'}]","[{'mal_id': 97, 'type': 'anime', 'name': 'ADV Films', 'url': 'https://myanimelist.net/anime/producer/97/ADV_Films'}, {'mal_id': 102, 'type': 'anime', 'name': 'Funimation', 'url': 'https://myanimelist.net/anime/producer/102/Funimation'}]","[{'mal_id': 120, 'type': 'anime', 'name': 'TNK', 'url': 'https://myanimelist.net/anime/producer/120/TNK'}]","[{'mal_id': 8, 'type': 'anime', 'name': 'Drama', 'url': 'https://myanimelist.net/anime/genre/8/Drama'}, {'mal_id': 22, 'type': 'anime', 'name': 'Romance', 'url': 'https://myanimelist.net/anime/genre/22/Romance'}]",[],[],"[{'mal_id': 27, 'type': 'anime', 'name': 'Shounen', 'url': 'https://myanimelist.net/anime/genre/27/Shounen'}]"
1858,https://myanimelist.net/anime/1858/Gakuen_Utopia_Manabi_Straight,"{'jpg': {'image_url': 'https://cdn.myanimelist.net/images/anime/13/4907.jpg', 'small_image_url': 'https://cdn.myanimelist.net/images/anime/13/4907t.jpg', 'large_image_url': 'https://cdn.myanimelist.net/images/anime/13/4907l.jpg'}, 'webp': {'image_url': 'https://cdn.myanimelist.net/images/anime/13/4907.webp', 'small_image_url': 'https://cdn.myanimelist.net/images/anime/13/4907t.webp', 'large_image_url': 'https://cdn.myanimelist.net/images/anime/13/4907l.webp'}}","{'youtube_id': None, 'url': None, 'embed_url': None, 'images': {'image_url': None, 'small_image_url': None, 'medium_image_url': None, 'large_image_url': None, 'maximum_image_url': None}}","""Gakuen Utopia Manabi Straight!""",,がくえんゆーとぴあ まなびストレート！,['Manabi Straight!'],TV,Original,12,Finished Airing,False,"{'from': '2007-01-08T00:00:00+00:00', 'to': '2007-03-26T00:00:00+00:00', 'prop': {'from': {'day': 8, 'month': 1, 'year': 2007}, 'to': {'day': 26, 'month': 3, 'year': 2007}}, 'string': 'Jan 8, 2007 to Mar 26, 2007'}",24 min per ep,G - All Ages,7.28,9567.0,2528,3463,28597,109,"Manabi Straight! follows the lives of a group of young high school girls living in the year 2035 while they attend the all-girl Seioh Private High School. Since the birth rate has dropped dramatically, schools are being closed down due to the sheer lack of students available to teach. Morale in schools has dropped dramatically, and Seioh is no exception. The story begins when the main character, Manami Amamiya, transfers to Seioh. After some initial hijinks involving a futuristic scooter and a swim meet, followed by an inspirational school song performance, she is inducted as the student council president. The story that follows pertains to Manami working with Mika Inamori, the only other student council member, and three other classmates named Mutsuki Uehara, Mei Etoh, and Momoha Odori, in student council matters. After some remodeling of the student council room, Manami and her friends set forth to plan for the upcoming student festival. (Source: Wikipedia, edited)",,winter,2007,"{'day': None, 'time': None, 'timezone': None, 'string': 'Unknown'}","[{'mal_id': 92, 'type': 'anime', 'name': 'Starchild Records', 'url': 'https://myanimelist.net/anime/producer/92/Starchild_Records'}, {'mal_id': 460, 'type': 'anime', 'name': 'KlockWorx', 'url': 'https://myanimelist.net/anime/producer/460/KlockWorx'}, {'mal_id': 681, 'type': 'anime', 'name': 'ASCII Media Works', 'url': 'https://myanimelist.net/anime/producer/681/ASCII_Media_Works'}]","[{'mal_id': 467, 'type': 'anime', 'name': 'Discotek Media', 'url': 'https://myanimelist.net/anime/producer/467/Discotek_Media'}]","[{'mal_id': 43, 'type': 'anime', 'name': 'ufotable', 'url': 'https://myanimelist.net/anime/producer/43/ufotable'}]","[{'mal_id': 4, 'type': 'anime', 'name': 'Comedy', 'url': 'https://myanimelist.net/anime/genre/4/Comedy'}, {'mal_id': 36, 'type': 'anime', 'name': 'Slice of Life', 'url': 'https://myanimelist.net/anime/genre/36/Slice_of_Life'}]",[],"[{'mal_id': 23, 'type': 'anime', 'name': 'School', 'url': 'https://myanimelist.net/anime/genre/23/School'}]",[]
1607,https://myanimelist.net/anime/1607/Venus_Versus_Virus,"{'jpg': {'image_url': 'https://cdn.myanimelist.net/images/anime/4/18842.jpg', 'small_image_url': 'https://cdn.myanimelist.net/images/anime/4/18842t.jpg', 'large_image_url': 'https://cdn.myanimelist.net/images/anime/4/18842l.jpg'}, 'webp': {'image_url': 'https://cdn.myanimelist.net/images/anime/4/18842.webp', 'small_image_url': 'https://cdn.myanimelist.net/images/anime/4/18842t.webp', 'large_image_url': 'https://cdn.myanimelist.net/images/anime/4/18842l.webp'}}","{'youtube_id': 'kEwW_65I5nQ', 'url': 'https://www.youtube.com/watch?v=kEwW_65I5nQ', 'embed_url': 'https://www.youtube.com/embed/kEwW_65I5nQ?enablejsapi=1&wmode=opaque&autoplay=1', 'images': {'image_url': 'https://img.youtube.com/vi/kEwW_65I5nQ/default.jpg', 'small_image_url': 'https://img.youtube.com/vi/kEwW_65I5nQ/sddefault.jpg', 'medium_image_url': 'https://img.youtube.com/vi/kEwW_65I5nQ/mqdefault.jpg', 'large_image_url': 'https://img.youtube.com/vi/kEwW_65I5nQ/hqdefault.jpg', 'maximum_image_url': 'https://img.youtube.com/vi/kEwW_65I5nQ/maxresdefault.jpg'}}","""Venus Versus Virus""",Venus Versus Virus,ヴィーナス ヴァーサス ヴァイアラス,['Venus vs. Virus'],TV,Manga,12,Finished Airing,False,"{'from': '2007-01-12T00:00:00+00:00', 'to': '2007-03-30T00:00:00+00:00', 'prop': {'from': {'day': 12, 'month': 1, 'year': 2007}, 'to': {'day': 30, 'month': 3, 'year': 2007}}, 'string': 'Jan 12, 2007 to Mar 30, 2007'}",24 min per ep,PG-13 - Teens 13 or older,6.37,10249.0,6873,3503,27990,47,"Venus Versus Virus follows regular schoolgirl Sumire who's had the ability to see ghosts since a young age. She tells friends and family about this fact and they just dismiss it, thinking she's a liar. A chance encounter with a broach flying out of nowhere, a monster and gothloli clad monster killer named Lucia leaves her with a life changing decision to use her ability and fight against these ""viruses"" feeding upon the human race. (Source: AnimeNewsService)",,winter,2007,"{'day': 'Fridays', 'time': '01:55', 'timezone': 'Asia/Tokyo', 'string': 'Fridays at 01:55 (JST)'}","[{'mal_id': 145, 'type': 'anime', 'name': 'TBS', 'url': 'https://myanimelist.net/anime/producer/145/TBS'}, {'mal_id': 212, 'type': 'anime', 'name': 'Venus Vangard', 'url': 'https://myanimelist.net/anime/producer/212/Venus_Vangard'}, {'mal_id': 213, 'type': 'anime', 'name': 'Half H.P Studio', 'url': 'https://myanimelist.net/anime/producer/213/Half_HP_Studio'}, {'mal_id': 214, 'type': 'anime', 'name': 'BS-i', 'url': 'https://myanimelist.net/anime/producer/214/BS-i'}]","[{'mal_id': 97, 'type': 'anime', 'name': 'ADV Films', 'url': 'https://myanimelist.net/anime/producer/97/ADV_Films'}, {'mal_id': 102, 'type': 'anime', 'name': 'Funimation', 'url': 'https://myanimelist.net/anime/producer/102/Funimation'}]","[{'mal_id': 101, 'type': 'anime', 'name': 'Studio Hibari', 'url': 'https://myanimelist.net/anime/producer/101/Studio_Hibari'}]","[{'mal_id': 8, 'type': 'anime', 'name': 'Drama', 'url': 'https://myanimelist.net/anime/genre/8/Drama'}, {'mal_id': 22, 'type': 'anime', 'name': 'Romance', 'url': 'https://myanimelist.net/anime/genre/22/Romance'}, {'mal_id': 37, 'type': 'anime', 'name': 'Supernatural', 'url': 'https://myanimelist.net/anime/genre/37/Supernatural'}]",[],[],[]
1826,https://myanimelist.net/anime/1826/Deltora_Quest,"{'jpg': {'image_url': 'https://cdn.myanimelist.net/images/anime/12/88164.jpg', 'small_image_url': 'https://cdn.myanimelist.net/images/anime/12/88164t.jpg', 'large_image_url': 'https://cdn.myanimelist.net/images/anime/12/88164l.jpg'}, 'webp': {'image_url': 'https://cdn.myanimelist.net/images/anime/12/88164.webp', 'small_image_url': 'https://cdn.myanimelist.net/images/anime/12/88164t.webp', 'large_image_url': 'https://cdn.myanimelist.net/images/anime/12/88164l.webp'}}","{'youtube_id': None, 'url': None, 'embed_url': None, 'images': {'image_url': None, 'small_image_url': None, 'medium_image_url': None, 'large_image_url': None, 'maximum_image_url': None}}","""Deltora Quest""",Deltora Quest,デルトラクエスト,[],TV,Book,65,Finished Airing,False,"{'from': '2007-01-06T00:00:00+00:00', 'to': '2008-03-29T00:00:00+00:00', 'prop': {'from': {'day': 6, 'month': 1, 'year': 2007}, 'to': {'day': 29, 'month': 3, 'year': 2008}}, 'string': 'Jan 6, 2007 to Mar 29, 2008'}",25 min per ep,PG-13 - Teens 13 or older,7.05,9764.0,3582,3634,26005,159,"Long ago, the blacksmith Adin forged a belt of seven powerful gems, one from each of the seven tribes of Deltora. Wielding the belt's unparalleled power, he repelled the Shadow Lord's attempt to overthrow the kingdom. Adin was crowned king of Deltora, but he never forgot that the enemy remained unbeaten. Centuries later, memory of the Shadow Lord has become faded and almost forgotten, and the people of Deltora see their monarchy as detached and uncaring. Much to their dismay, the Shadow Lord strikes once more, breaking the Belt of Deltora by scattering the seven gems across the continent. Jarred, a close friend of the young king Endon, assists him and his wife in escaping from the castle as the Shadow Lord takes over, and they part ways to go into hiding. The Shadow Lord now reigns over Deltora and many years pass under his tyrannical rule. However, there is a glimmer of hope in Jarred's son Lief, whom he has lovingly raised and trained to find the scattered gemstones and reassemble the Belt of Deltora. Along with his companions Barda and Jasmine, Lief must face devious enemies and dangerous beasts to oust the Shadow Lord and return peace to Deltora. [Written by MAL Rewrite]","Deltora Quest is based on Australian author Emily Rodda's book series of the same title. The anime series adapts the first 8 books, which comprises the first series of the saga.",winter,2007,"{'day': None, 'time': None, 'timezone': None, 'string': 'Unknown'}","[{'mal_id': 31, 'type': 'anime', 'name': 'Geneon Universal Entertainment', 'url': 'https://myanimelist.net/anime/producer/31/Geneon_Universal_Entertainment'}, {'mal_id': 53, 'type': 'anime', 'name': 'Dentsu', 'url': 'https://myanimelist.net/anime/producer/53/Dentsu'}, {'mal_id': 79, 'type': 'anime', 'name': 'Genco', 'url': 'https://myanimelist.net/anime/producer/79/Genco'}, {'mal_id': 159, 'type': 'anime', 'name': 'Kodansha', 'url': 'https://myanimelist.net/anime/producer/159/Kodansha'}, {'mal_id': 213, 'type': 'anime', 'name': 'Half H.P Studio', 'url': 'https://myanimelist.net/anime/producer/213/Half_HP_Studio'}]","[{'mal_id': 1163, 'type': 'anime', 'name': 'Flatiron Film Company', 'url': 'https://myanimelist.net/anime/producer/1163/Flatiron_Film_Company'}]","[{'mal_id': 28, 'type': 'anime', 'name': 'OLM', 'url': 'https://myanimelist.net/anime/producer/28/OLM'}]","[{'mal_id': 2, 'type': 'anime', 'name': 'Adventure', 'url': 'https://myanimelist.net/anime/genre/2/Adventure'}, {'mal_id': 10, 'type': 'anime', 'name': 'Fantasy', 'url': 'https://myanimelist.net/anime/genre/10/Fantasy'}]",[],[],"[{'mal_id': 15, 'type': 'anime', 'name': 'Kids', 'url': 'https://myanimelist.net/anime/genre/15/Kids'}]"
1695,https://myanimelist.net/anime/1695/Les_Misérables__Shoujo_Cosette,"{'jpg': {'image_url': 'https://cdn.myanimelist.net/images/anime/1/1695.jpg', 'small_image_url': 'https://cdn.myanimelist.net/images/anime/1/1695t.jpg', 'large_image_url': 'https://cdn.myanimelist.net/images/anime/1/1695l.jpg'}, 'webp': {'image_url': 'https://cdn.myanimelist.net/images/anime/1/1695.webp', 'small_image_url': 'https://cdn.myanimelist.net/images/anime/1/1695t.webp', 'large_image_url': 'https://cdn.myanimelist.net/images/anime/1/1695l.webp'}}","{'youtube_id': None, 'url': None, 'embed_url': None, 'images': {'image_url': None, 'small_image_url': None, 'medium_image_url': None, 'large_image_url': None, 'maximum_image_url': None}}","""Les Misérables: Shoujo Cosette""",,レ・ミゼラブル 少女コゼット,['Les Miserables: Shoujo Cosette'],TV,Novel,52,Finished Airing,False,"{'from': '2007-01-07T00:00:00+00:00', 'to': '2007-12-30T00:00:00+00:00', 'prop': {'from': {'day': 7, 'month': 1, 'year': 2007}, 'to': {'day': 30, 'month': 12, 'year': 2007}}, 'string': 'Jan 7, 2007 to Dec 30, 2007'}",24 min per ep,G - All Ages,7.87,7399.0,752,3700,25054,222,"In 19th century France, a struggling single mother, Fantine, leaves her three-year-old daughter Cosette in the care of her new acquaintances, the Thernadiers. Unfortunately, Cosette's caretakers prove to be anything but loving, and the poor girl is subjected to repeated abuse and forced servitude. Still, she endures the torment in the hopes of seeing her mother once again. One night, while doing errands for her host family, Cosette is assisted by an honorable stranger named Jean Valjean. After a brief conversation with the young girl, Jean acknowledges her as the type of person he has been seeking and rescues her from the clutches of the Thernadiers. They make their way to a nearby town where Cosette enjoys a new life thanks to her savior. Under Jean's guidance, Cosette promises to help others with her newfound freedom. She pledges to heal the nation, ensuring that no one else suffers her fate. Though the road ahead is paved with tragedies left by the French Revolution, this idealistic girl will not rest until France is freed from poverty and suffering. [Written by MAL Rewrite]",,winter,2007,"{'day': None, 'time': None, 'timezone': None, 'string': 'Unknown'}",[],[],"[{'mal_id': 22, 'type': 'anime', 'name': 'Nippon Animation', 'url': 'https://myanimelist.net/anime/producer/22/Nippon_Animation'}]","[{'mal_id': 8, 'type': 'anime', 'name': 'Drama', 'url': 'https://myanimelist.net/anime/genre/8/Drama'}, {'mal_id': 36, 'type': 'anime', 'name': 'Slice of Life', 'url': 'https://myanimelist.net/anime/genre/36/Slice_of_Life'}]",[],"[{'mal_id': 13, 'type': 'anime', 'name': 'Historical', 'url': 'https://myanimelist.net/anime/genre/13/Historical'}]","[{'mal_id': 25, 'type': 'anime', 'name': 'Shoujo', 'url': 'https://myanimelist.net/anime/genre/25/Shoujo'}]"
3576,https://myanimelist.net/anime/3576/Kodai_Ouja_Kyouryuu_King,"{'jpg': {'image_url': 'https://cdn.myanimelist.net/images/anime/10/75397.jpg', 'small_image_url': 'https://cdn.myanimelist.net/images/anime/10/75397t.jpg', 'large_image_url': 'https://cdn.myanimelist.net/images/anime/10/75397l.jpg'}, 'webp': {'image_url': 'https://cdn.myanimelist.net/images/anime/10/75397.webp', 'small_image_url': 'https://cdn.myanimelist.net/images/anime/10/75397t.webp', 'large_image_url': 'https://cdn.myanimelist.net/images/anime/10/75397l.webp'}}","{'youtube_id': None, 'url': None, 'embed_url': None, 'images': {'image_url': None, 'small_image_url': None, 'medium_image_url': None, 'large_image_url': None, 'maximum_image_url': None}}","""Kodai Ouja Kyouryuu King""",Dinosaur King,古代王者 恐竜キング Ｄキッズアドベンチャー,"['Kodai Oja Kyoryu King D-Kids Adventure', 'Ancient Ruler Dinosaur King']",TV,Game,49,Finished Airing,False,"{'from': '2007-02-04T00:00:00+00:00', 'to': '2008-01-27T00:00:00+00:00', 'prop': {'from': {'day': 4, 'month': 2, 'year': 2007}, 'to': {'day': 27, 'month': 1, 'year': 2008}}, 'string': 'Feb 4, 2007 to Jan 27, 2008'}",25 min per ep,PG - Children,6.26,11999.0,7425,4026,20769,84,"Dr. Taylor was on a paleontology mission with his son, Max in Africa. Rex, Max's best friend, joins along as well. When Max had stumbled across some magic stone slabs with images of dinosaurs, the boys and their friend Zoe were being called out by the dinosaurs for help. It seems that an evil organization called the ""Alpha Gang,"" led by the nefarious Dr. Z, traveled back in time to hunt down the dinosaurs so that they could take over the world by using those dinosaurs. It is up to Max, Rex, and their friend Zoe to travel around the world, defeating Dr. Z and the Alpha Gang while hunting down the dinosaurs. (Source: Wikipedia)",,winter,2007,"{'day': None, 'time': None, 'timezone': None, 'string': 'Unknown'}","[{'mal_id': 142, 'type': 'anime', 'name': 'Asatsu DK', 'url': 'https://myanimelist.net/anime/producer/142/Asatsu_DK'}, {'mal_id': 167, 'type': 'anime', 'name': 'Sega', 'url': 'https://myanimelist.net/anime/producer/167/Sega'}, {'mal_id': 252, 'type': 'anime', 'name': '4Kids Entertainment', 'url': 'https://myanimelist.net/anime/producer/252/4Kids_Entertainment'}, {'mal_id': 787, 'type': 'anime', 'name': 'Happinet Pictures', 'url': 'https://myanimelist.net/anime/producer/787/Happinet_Pictures'}, {'mal_id': 1366, 'type': 'anime', 'name': 'Nagoya Broadcasting Network', 'url': 'https://myanimelist.net/anime/producer/1366/Nagoya_Broadcasting_Network'}]","[{'mal_id': 467, 'type': 'anime', 'name': 'Discotek Media', 'url': 'https://myanimelist.net/anime/producer/467/Discotek_Media'}]","[{'mal_id': 14, 'type': 'anime', 'name': 'Sunrise', 'url': 'https://myanimelist.net/anime/producer/14/Sunrise'}]","[{'mal_id': 2, 'type': 'anime', 'name': 'Adventure', 'url': 'https://myanimelist.net/anime/genre/2/Adventure'}, {'mal_id': 10, 'type': 'anime', 'name': 'Fantasy', 'url': 'https://myanimelist.net/anime/genre/10/Fantasy'}]",[],[],"[{'mal_id': 15, 'type': 'anime', 'name': 'Kids', 'url': 'https://myanimelist.net/anime/genre/15/Kids'}]"
1932,https://myanimelist.net/anime/1932/Yes_Precure_5,"{'jpg': {'image_url': 'https://cdn.myanimelist.net/images/anime/4/7535.jpg', 'small_image_url': 'https://cdn.myanimelist.net/images/anime/4/7535t.jpg', 'large_image_url': 'https://cdn.myanimelist.net/images/anime/4/7535l.jpg'}, 'webp': {'image_url': 'https://cdn.myanimelist.net/images/anime/4/7535.webp', 'small_image_url': 'https://cdn.myanimelist.net/images/anime/4/7535t.webp', 'large_image_url': 'https://cdn.myanimelist.net/images/anime/4/7535l.webp'}}","{'youtube_id': None, 'url': None, 'embed_url': None, 'images': {'image_url': None, 'small_image_url': None, 'medium_image_url': None, 'large_image_url': None, 'maximum_image_url': None}}","""Yes! Precure 5""",Yes! Pretty Cure 5,Yes! プリキュア5,[],TV,Original,49,Finished Airing,False,"{'from': '2007-02-04T00:00:00+00:00', 'to': '2008-01-27T00:00:00+00:00', 'prop': {'from': {'day': 4, 'month': 2, 'year': 2007}, 'to': {'day': 27, 'month': 1, 'year': 2008}}, 'string': 'Feb 4, 2007 to Jan 27, 2008'}",24 min per ep,G - All Ages,7.17,5485.0,3068,4667,14565,85,"Yumehara Nozomi, a regular student, finds a magical book called the Dream Collet in the library and meets Coco and Nuts, two creatures from the Palmier Kingdom. They plead with Nozomi to restore their world, which has been destroyed by an organization called the Nightmares, by completing the Dream Collet and finding the 55 Pinkies to make any wish come true. Meanwhile, the Nightmares are moving into the real world. Once Nozomi agrees to help, Coco and Nuts transform her into the magical girl Cure Dream and turn four fellow students into her Pretty Cure team. (Source: ANN)",,winter,2007,"{'day': None, 'time': None, 'timezone': None, 'string': 'Unknown'}","[{'mal_id': 1415, 'type': 'anime', 'name': 'Asahi Broadcasting', 'url': 'https://myanimelist.net/anime/producer/1415/Asahi_Broadcasting'}]",[],"[{'mal_id': 18, 'type': 'anime', 'name': 'Toei Animation', 'url': 'https://myanimelist.net/anime/producer/18/Toei_Animation'}]","[{'mal_id': 1, 'type': 'anime', 'name': 'Action', 'url': 'https://myanimelist.net/anime/genre/1/Action'}, {'mal_id': 10, 'type': 'anime', 'name': 'Fantasy', 'url': 'https://myanimelist.net/anime/genre/10/Fantasy'}]",[],"[{'mal_id': 23, 'type': 'anime', 'name': 'School', 'url': 'https://myanimelist.net/anime/genre/23/School'}]","[{'mal_id': 25, 'type': 'anime', 'name': 'Shoujo', 'url': 'https://myanimelist.net/anime/genre/25/Shoujo'}]"
1988,https://myanimelist.net/anime/1988/Himawari,"{'jpg': {'image_url': 'https://cdn.myanimelist.net/images/anime/9/60061.jpg', 'small_image_url': 'https://cdn.myanimelist.net/images/anime/9/60061t.jpg', 'large_image_url': 'https://cdn.myanimelist.net/images/anime/9/60061l.jpg'}, 'webp': {'image_url': 'https://cdn.myanimelist.net/images/anime/9/60061.webp', 'small_image_url': 'https://cdn.myanimelist.net/images/anime/9/60061t.webp', 'large_image_url': 'https://cdn.myanimelist.net/images/anime/9/60061l.webp'}}","{'youtube_id': None, 'url': None, 'embed_url': None, 'images': {'image_url': None, 'small_image_url': None, 'medium_image_url': None, 'large_image_url': None, 'maximum_image_url': None}}","""Himawari!!""",Himawari Too!!,ひまわりっ！！,[],TV,Original,13,Finished Airing,False,"{'from': '2007-01-07T00:00:00+00:00', 'to': '2007-04-01T00:00:00+00:00', 'prop': {'from': {'day': 7, 'month': 1, 'year': 2007}, 'to': {'day': 1, 'month': 4, 'year': 2007}}, 'string': 'Jan 7, 2007 to Apr 1, 2007'}",25 min per ep,PG-13 - Teens 13 or older,6.46,3274.0,6401,5325,10429,5,"Himawari is back in all her comical ninja mischief. The sequel to Himawari continues with the many odd and hilarious adventures of Himawari, Hayato and her ninja classmates. Season two delves into Himawari and Hayato's past. Will new secrets be revealed? Will Himawari finally find out about her past and the mysterious ninja that saved her when she was little? (Source: ANN)",,winter,2007,"{'day': None, 'time': None, 'timezone': None, 'string': 'Unknown'}","[{'mal_id': 92, 'type': 'anime', 'name': 'Starchild Records', 'url': 'https://myanimelist.net/anime/producer/92/Starchild_Records'}, {'mal_id': 577, 'type': 'anime', 'name': 'Tohokushinsha Film Corporation', 'url': 'https://myanimelist.net/anime/producer/577/Tohokushinsha_Film_Corporation'}]","[{'mal_id': 490, 'type': 'anime', 'name': 'Maiden Japan', 'url': 'https://myanimelist.net/anime/producer/490/Maiden_Japan'}]","[{'mal_id': 38, 'type': 'anime', 'name': 'Arms', 'url': 'https://myanimelist.net/anime/producer/38/Arms'}]","[{'mal_id': 4, 'type': 'anime', 'name': 'Comedy', 'url': 'https://myanimelist.net/anime/genre/4/Comedy'}, {'mal_id': 22, 'type': 'anime', 'name': 'Romance', 'url': 'https://myanimelist.net/anime/genre/22/Romance'}]",[],[],[]
