mal_id,url,images,trailer,title,title_english,title_japanese,title_synonyms,type,source,episodes,status,airing,aired,duration,rating,score,scored_by,rank,popularity,members,favorites,synopsis,background,season,year,broadcast,producers,licensors,studios,genres,explicit_genres,themes,demographics
2795,https://myanimelist.net/anime/2795/Dragonaut__The_Resonance,"{'jpg': {'image_url': 'https://cdn.myanimelist.net/images/anime/12/28917.jpg', 'small_image_url': 'https://cdn.myanimelist.net/images/anime/12/28917t.jpg', 'large_image_url': 'https://cdn.myanimelist.net/images/anime/12/28917l.jpg'}, 'webp': {'image_url': 'https://cdn.myanimelist.net/images/anime/12/28917.webp', 'small_image_url': 'https://cdn.myanimelist.net/images/anime/12/28917t.webp', 'large_image_url': 'https://cdn.myanimelist.net/images/anime/12/28917l.webp'}}","{'youtube_id': 'VxaPLXc8khs', 'url': 'https://www.youtube.com/watch?v=VxaPLXc8khs', 'embed_url': 'https://www.youtube.com/embed/VxaPLXc8khs?enablejsapi=1&wmode=opaque&autoplay=1', 'images': {'image_url': 'https://img.youtube.com/vi/VxaPLXc8khs/default.jpg', 'small_image_url': 'https://img.youtube.com/vi/VxaPLXc8khs/sddefault.jpg', 'medium_image_url': 'https://img.youtube.com/vi/VxaPLXc8khs/mqdefault.jpg', 'large_image_url': 'https://img.youtube.com/vi/VxaPLXc8khs/hqdefault.jpg', 'maximum_image_url': 'https://img.youtube.com/vi/VxaPLXc8khs/maxresdefault.jpg'}}","""Dragonaut: The Resonance""",Dragonaut - The Resonance,ドラゴノーツ-ザ・レソナンス-,[],TV,Original,25,Finished Airing,False,"{'from': '2007-10-04T00:00:00+00:00', 'to': '2008-03-27T00:00:00+00:00', 'prop': {'from': {'day': 4, 'month': 10, 'year': 2007}, 'to': {'day': 27, 'month': 3, 'year': 2008}}, 'string': 'Oct 4, 2007 to Mar 27, 2008'}",25 min per ep,R+ - Mild Nudity,6.62,29400.0,5565,2099,70744,104,"Twenty years prior to the story's beginning, an asteroid headed for Earth destroys Pluto. Due to Pluto's destruction, the asteroid, which is dubbed Thanatos, becomes temporarily stagnant. Now, in order to avoid Earth's impending destruction, the International Solarsystem Development Agency (ISDA) works on the ""D-Project"", and creates the ""Dragonaut"" after finding a dragon egg under the ocean. This weapon's primary purpose is to destroy the asteroid when the time comes. However, they soon find out that the asteroid is not their only threat, as powerful dragon-like creatures, which are bent on destruction, appear on Earth. After witnessing a murder by one of the creatures, Jin Kamishina, a lonely 18-year-old boy who lost his family in a shuttle accident two years ago, gets involved in the mysteries of the dragons and becomes the chosen pilot of the Dragonaut. Helping him on his journey is Toa, a mysterious girl who saves him from falling to his death after the creature attacks him. As they get deeper into the mysteries of the dragons, they encounter new friends and enemies, and also begin to develop a closer relationship. (Source: Wikipedia)",,fall,2007,"{'day': None, 'time': None, 'timezone': None, 'string': 'Unknown'}","[{'mal_id': 139, 'type': 'anime', 'name': 'Nihon Ad Systems', 'url': 'https://myanimelist.net/anime/producer/139/Nihon_Ad_Systems'}, {'mal_id': 1597, 'type': 'anime', 'name': 'Sotsu Music Publishing', 'url': 'https://myanimelist.net/anime/producer/1597/Sotsu_Music_Publishing'}]","[{'mal_id': 102, 'type': 'anime', 'name': 'Funimation', 'url': 'https://myanimelist.net/anime/producer/102/Funimation'}]","[{'mal_id': 3, 'type': 'anime', 'name': 'Gonzo', 'url': 'https://myanimelist.net/anime/producer/3/Gonzo'}]","[{'mal_id': 1, 'type': 'anime', 'name': 'Action', 'url': 'https://myanimelist.net/anime/genre/1/Action'}, {'mal_id': 8, 'type': 'anime', 'name': 'Drama', 'url': 'https://myanimelist.net/anime/genre/8/Drama'}, {'mal_id': 10, 'type': 'anime', 'name': 'Fantasy', 'url': 'https://myanimelist.net/anime/genre/10/Fantasy'}, {'mal_id': 22, 'type': 'anime', 'name': 'Romance', 'url': 'https://myanimelist.net/anime/genre/22/Romance'}, {'mal_id': 24, 'type': 'anime', 'name': 'Sci-Fi', 'url': 'https://myanimelist.net/anime/genre/24/Sci-Fi'}]",[],"[{'mal_id': 18, 'type': 'anime', 'name': 'Mecha', 'url': 'https://myanimelist.net/anime/genre/18/Mecha'}]",[]
3001,https://myanimelist.net/anime/3001/Moyashimon,"{'jpg': {'image_url': 'https://cdn.myanimelist.net/images/anime/5/37533.jpg', 'small_image_url': 'https://cdn.myanimelist.net/images/anime/5/37533t.jpg', 'large_image_url': 'https://cdn.myanimelist.net/images/anime/5/37533l.jpg'}, 'webp': {'image_url': 'https://cdn.myanimelist.net/images/anime/5/37533.webp', 'small_image_url': 'https://cdn.myanimelist.net/images/anime/5/37533t.webp', 'large_image_url': 'https://cdn.myanimelist.net/images/anime/5/37533l.webp'}}","{'youtube_id': None, 'url': None, 'embed_url': None, 'images': {'image_url': None, 'small_image_url': None, 'medium_image_url': None, 'large_image_url': None, 'maximum_image_url': None}}","""Moyashimon""",,もやしもん,"['Moyasimon', 'Tales of Agriculture']",TV,Manga,11,Finished Airing,False,"{'from': '2007-10-12T00:00:00+00:00', 'to': '2007-12-21T00:00:00+00:00', 'prop': {'from': {'day': 12, 'month': 10, 'year': 2007}, 'to': {'day': 21, 'month': 12, 'year': 2007}}, 'string': 'Oct 12, 2007 to Dec 21, 2007'}",23 min per ep,PG-13 - Teens 13 or older,7.57,26283.0,1415,2161,67785,249,"One could say that freshman college student Tadayasu Sawaki has a wide range of vision. He has a peculiar ability that allows him to see microorganisms with the naked eye. Sawaki can see all sorts of microbes, from the fungi that cause athlete's foot to the yeast used to make alcohol, with him perceiving his little friends as cute chibi creatures. Attending an agricultural university, his talent piques the interest of numerous professors, including Professor Itsuki, who specializes in fermentation. Sawaki starts school indifferent toward his ability, choosing an agricultural school in Tokyo. However, with the help of the eccentric community around him, he slowly learns to appreciate these visible microbes and his talent. The whimsical cast of professors and classmates attending the university almost makes Sawaki seem normal despite his ability. [Written by MAL Rewrite]",,fall,2007,"{'day': None, 'time': None, 'timezone': None, 'string': 'Unknown'}","[{'mal_id': 53, 'type': 'anime', 'name': 'Dentsu', 'url': 'https://myanimelist.net/anime/producer/53/Dentsu'}, {'mal_id': 159, 'type': 'anime', 'name': 'Kodansha', 'url': 'https://myanimelist.net/anime/producer/159/Kodansha'}, {'mal_id': 169, 'type': 'anime', 'name': 'Fuji TV', 'url': 'https://myanimelist.net/anime/producer/169/Fuji_TV'}, {'mal_id': 757, 'type': 'anime', 'name': 'Sony Music Entertainment', 'url': 'https://myanimelist.net/anime/producer/757/Sony_Music_Entertainment'}, {'mal_id': 769, 'type': 'anime', 'name': 'Fujipacific Music', 'url': 'https://myanimelist.net/anime/producer/769/Fujipacific_Music'}]",[],"[{'mal_id': 94, 'type': 'anime', 'name': 'Telecom Animation Film', 'url': 'https://myanimelist.net/anime/producer/94/Telecom_Animation_Film'}, {'mal_id': 235, 'type': 'anime', 'name': 'Shirogumi', 'url': 'https://myanimelist.net/anime/producer/235/Shirogumi'}]","[{'mal_id': 4, 'type': 'anime', 'name': 'Comedy', 'url': 'https://myanimelist.net/anime/genre/4/Comedy'}, {'mal_id': 47, 'type': 'anime', 'name': 'Gourmet', 'url': 'https://myanimelist.net/anime/genre/47/Gourmet'}, {'mal_id': 37, 'type': 'anime', 'name': 'Supernatural', 'url': 'https://myanimelist.net/anime/genre/37/Supernatural'}]",[],"[{'mal_id': 23, 'type': 'anime', 'name': 'School', 'url': 'https://myanimelist.net/anime/genre/23/School'}]","[{'mal_id': 42, 'type': 'anime', 'name': 'Seinen', 'url': 'https://myanimelist.net/anime/genre/42/Seinen'}]"
2985,https://myanimelist.net/anime/2985/Majin_Tantei_Nougami_Neuro,"{'jpg': {'image_url': 'https://cdn.myanimelist.net/images/anime/12/20930.jpg', 'small_image_url': 'https://cdn.myanimelist.net/images/anime/12/20930t.jpg', 'large_image_url': 'https://cdn.myanimelist.net/images/anime/12/20930l.jpg'}, 'webp': {'image_url': 'https://cdn.myanimelist.net/images/anime/12/20930.webp', 'small_image_url': 'https://cdn.myanimelist.net/images/anime/12/20930t.webp', 'large_image_url': 'https://cdn.myanimelist.net/images/anime/12/20930l.webp'}}","{'youtube_id': None, 'url': None, 'embed_url': None, 'images': {'image_url': None, 'small_image_url': None, 'medium_image_url': None, 'large_image_url': None, 'maximum_image_url': None}}","""Majin Tantei Nougami Neuro""",Neuro: Supernatural Detective,魔人探偵 脳噛ネウロ,"['Private Evil-Eye Nougami Neuro', 'Demon Detective Nougami Neuro']",TV,Manga,25,Finished Airing,False,"{'from': '2007-10-03T00:00:00+00:00', 'to': '2008-03-26T00:00:00+00:00', 'prop': {'from': {'day': 3, 'month': 10, 'year': 2007}, 'to': {'day': 26, 'month': 3, 'year': 2008}}, 'string': 'Oct 3, 2007 to Mar 26, 2008'}",23 min per ep,R - 17+ (violence & profanity),7.6,24591.0,1334,2256,62966,561,"Yako Katsuragi is an acclaimed high school detective, who, despite her young age, has solved many cases. In fact, there seems to be no case that she can't solve, or any culprit that escapes justice. But within the walls of her detective agency lies the secret to her prolific crime-solving skills: the cases are actually solved by her assistant, Neuro Nougami. However, to call Neuro an ordinary man would be incorrect. In reality, he is a demon, who came to the human world in search of the ultimate mystery, having already solved every mystery in the demon world. With Yako as his proxy, he feasts on the negative energy released by humans when they commit crimes. Thus, he promises to help Yako solve the mystery of her father's death. But to do so, he must avoid drawing too much attention to himself, which is why Yako plays the role of the detective. Majin Tantei Nougami Neuro follows this unlikely duo as they solve case after case to satisfy Neuro's ravenous appetite and Yako's desperate search for the truth of her father's death. [Written by MAL Rewrite]",,fall,2007,"{'day': None, 'time': None, 'timezone': None, 'string': 'Unknown'}","[{'mal_id': 29, 'type': 'anime', 'name': 'VAP', 'url': 'https://myanimelist.net/anime/producer/29/VAP'}, {'mal_id': 1365, 'type': 'anime', 'name': 'Shueisha', 'url': 'https://myanimelist.net/anime/producer/1365/Shueisha'}]",[],"[{'mal_id': 11, 'type': 'anime', 'name': 'Madhouse', 'url': 'https://myanimelist.net/anime/producer/11/Madhouse'}]","[{'mal_id': 4, 'type': 'anime', 'name': 'Comedy', 'url': 'https://myanimelist.net/anime/genre/4/Comedy'}, {'mal_id': 7, 'type': 'anime', 'name': 'Mystery', 'url': 'https://myanimelist.net/anime/genre/7/Mystery'}, {'mal_id': 37, 'type': 'anime', 'name': 'Supernatural', 'url': 'https://myanimelist.net/anime/genre/37/Supernatural'}]",[],"[{'mal_id': 6, 'type': 'anime', 'name': 'Demons', 'url': 'https://myanimelist.net/anime/genre/6/Demons'}]","[{'mal_id': 27, 'type': 'anime', 'name': 'Shounen', 'url': 'https://myanimelist.net/anime/genre/27/Shounen'}]"
2369,https://myanimelist.net/anime/2369/Rental_Magica,"{'jpg': {'image_url': 'https://cdn.myanimelist.net/images/anime/5/73999.jpg', 'small_image_url': 'https://cdn.myanimelist.net/images/anime/5/73999t.jpg', 'large_image_url': 'https://cdn.myanimelist.net/images/anime/5/73999l.jpg'}, 'webp': {'image_url': 'https://cdn.myanimelist.net/images/anime/5/73999.webp', 'small_image_url': 'https://cdn.myanimelist.net/images/anime/5/73999t.webp', 'large_image_url': 'https://cdn.myanimelist.net/images/anime/5/73999l.webp'}}","{'youtube_id': 'djNLQ-lNgdI', 'url': 'https://www.youtube.com/watch?v=djNLQ-lNgdI', 'embed_url': 'https://www.youtube.com/embed/djNLQ-lNgdI?enablejsapi=1&wmode=opaque&autoplay=1', 'images': {'image_url': 'https://img.youtube.com/vi/djNLQ-lNgdI/default.jpg', 'small_image_url': 'https://img.youtube.com/vi/djNLQ-lNgdI/sddefault.jpg', 'medium_image_url': 'https://img.youtube.com/vi/djNLQ-lNgdI/mqdefault.jpg', 'large_image_url': 'https://img.youtube.com/vi/djNLQ-lNgdI/hqdefault.jpg', 'maximum_image_url': 'https://img.youtube.com/vi/djNLQ-lNgdI/maxresdefault.jpg'}}","""Rental Magica""",Rental Magica,レンタルマギカ,[],TV,Light novel,24,Finished Airing,False,"{'from': '2007-10-08T00:00:00+00:00', 'to': '2008-03-24T00:00:00+00:00', 'prop': {'from': {'day': 8, 'month': 10, 'year': 2007}, 'to': {'day': 24, 'month': 3, 'year': 2008}}, 'string': 'Oct 8, 2007 to Mar 24, 2008'}",24 min per ep,PG-13 - Teens 13 or older,7.03,18417.0,3711,2365,58125,102,"Due to his father's disappearance, Itsuki Iba has to take over the family business: a magician dispatch service. Their family employs countless magicians and other supernatural beings in order to send them out to help those who need magical assistance. As a leader, Itsuki now has to be tough, commanding, and reliable, but there's one problem, he's a coward. Also, in order to run a successful business, he must connect with his employees, which is more difficult than it seems due to his personality. But not only does he have to deal with his own employees, he also has to deal with those who threaten the family business. (Source: CrunchyRoll)",,fall,2007,"{'day': 'Mondays', 'time': '00:00', 'timezone': 'Asia/Tokyo', 'string': 'Mondays at 00:00 (JST)'}","[{'mal_id': 113, 'type': 'anime', 'name': 'Kadokawa Shoten', 'url': 'https://myanimelist.net/anime/producer/113/Kadokawa_Shoten'}, {'mal_id': 689, 'type': 'anime', 'name': 'NTT Docomo', 'url': 'https://myanimelist.net/anime/producer/689/NTT_Docomo'}]","[{'mal_id': 217, 'type': 'anime', 'name': 'Nozomi Entertainment', 'url': 'https://myanimelist.net/anime/producer/217/Nozomi_Entertainment'}]","[{'mal_id': 218, 'type': 'anime', 'name': 'Zexcs', 'url': 'https://myanimelist.net/anime/producer/218/Zexcs'}]","[{'mal_id': 10, 'type': 'anime', 'name': 'Fantasy', 'url': 'https://myanimelist.net/anime/genre/10/Fantasy'}, {'mal_id': 7, 'type': 'anime', 'name': 'Mystery', 'url': 'https://myanimelist.net/anime/genre/7/Mystery'}, {'mal_id': 37, 'type': 'anime', 'name': 'Supernatural', 'url': 'https://myanimelist.net/anime/genre/37/Supernatural'}]",[],[],[]
2970,https://myanimelist.net/anime/2970/Night_Wizard,"{'jpg': {'image_url': 'https://cdn.myanimelist.net/images/anime/12/75604.jpg', 'small_image_url': 'https://cdn.myanimelist.net/images/anime/12/75604t.jpg', 'large_image_url': 'https://cdn.myanimelist.net/images/anime/12/75604l.jpg'}, 'webp': {'image_url': 'https://cdn.myanimelist.net/images/anime/12/75604.webp', 'small_image_url': 'https://cdn.myanimelist.net/images/anime/12/75604t.webp', 'large_image_url': 'https://cdn.myanimelist.net/images/anime/12/75604l.webp'}}","{'youtube_id': None, 'url': None, 'embed_url': None, 'images': {'image_url': None, 'small_image_url': None, 'medium_image_url': None, 'large_image_url': None, 'maximum_image_url': None}}","""Night Wizard""",,ナイトウィザード,['Night Wizard The Animation'],TV,Game,13,Finished Airing,False,"{'from': '2007-10-03T00:00:00+00:00', 'to': '2007-12-26T00:00:00+00:00', 'prop': {'from': {'day': 3, 'month': 10, 'year': 2007}, 'to': {'day': 26, 'month': 12, 'year': 2007}}, 'string': 'Oct 3, 2007 to Dec 26, 2007'}",25 min per ep,PG-13 - Teens 13 or older,6.67,13472.0,5293,3115,35058,50,"Night Wizard. A term given to those whose mission is to protect the world from impending darkness. Renji Hiiragi is one such Night Wizard, who is constantly called on missions, even though all he wants is to be able to go to school and graduate. However, his latest order was to protect Elis Shiho, who is a new transfer student at his academy. Being dragged into the Astronomy Club by Renji's childhood friend, Kureha Akabane on her first day at school, Elis soon realises that she too, has the power to become a night wizard, after possessing one of seven secret Jewels, the Jewel of Kindness. Along with Renji and Kureha, Elis now begins her fight and her new life, as a Night Wizard (Source: ANN)",,fall,2007,"{'day': None, 'time': None, 'timezone': None, 'string': 'Unknown'}","[{'mal_id': 1451, 'type': 'anime', 'name': 'TYO', 'url': 'https://myanimelist.net/anime/producer/1451/TYO'}]",[],"[{'mal_id': 34, 'type': 'anime', 'name': 'Hal Film Maker', 'url': 'https://myanimelist.net/anime/producer/34/Hal_Film_Maker'}]","[{'mal_id': 2, 'type': 'anime', 'name': 'Adventure', 'url': 'https://myanimelist.net/anime/genre/2/Adventure'}, {'mal_id': 10, 'type': 'anime', 'name': 'Fantasy', 'url': 'https://myanimelist.net/anime/genre/10/Fantasy'}]",[],[],"[{'mal_id': 27, 'type': 'anime', 'name': 'Shounen', 'url': 'https://myanimelist.net/anime/genre/27/Shounen'}]"
2595,https://myanimelist.net/anime/2595/DCII__Da_Capo_II,"{'jpg': {'image_url': 'https://cdn.myanimelist.net/images/anime/9/75305.jpg', 'small_image_url': 'https://cdn.myanimelist.net/images/anime/9/75305t.jpg', 'large_image_url': 'https://cdn.myanimelist.net/images/anime/9/75305l.jpg'}, 'webp': {'image_url': 'https://cdn.myanimelist.net/images/anime/9/75305.webp', 'small_image_url': 'https://cdn.myanimelist.net/images/anime/9/75305t.webp', 'large_image_url': 'https://cdn.myanimelist.net/images/anime/9/75305l.webp'}}","{'youtube_id': None, 'url': None, 'embed_url': None, 'images': {'image_url': None, 'small_image_url': None, 'medium_image_url': None, 'large_image_url': None, 'maximum_image_url': None}}","""D.C.II: Da Capo II""",,D.C.II ～ダ・カーポII～,[],TV,Visual novel,13,Finished Airing,False,"{'from': '2007-10-02T00:00:00+00:00', 'to': '2007-12-25T00:00:00+00:00', 'prop': {'from': {'day': 2, 'month': 10, 'year': 2007}, 'to': {'day': 25, 'month': 12, 'year': 2007}}, 'string': 'Oct 2, 2007 to Dec 25, 2007'}",25 min per ep,PG-13 - Teens 13 or older,6.89,15072.0,4264,3126,34856,36,"The undying Sakura Trees return. Based on a PS2 sequel of the original DaCapo game, the story once again takes place on Hatsunejima, but is set 53 years after the events of D.C. and D.C.S.S.. Although some characters will probably look a bit familiar to the initiated eye, the cast is a new one. The new main protagonist is Yoshiyuki Sakurai, who lives next door to the Asakura sisters Yume and Otome, who are the granddaughters of Junichi and Nemu from the first season. [Written by MAL Rewrite]",,fall,2007,"{'day': None, 'time': None, 'timezone': None, 'string': 'Unknown'}","[{'mal_id': 92, 'type': 'anime', 'name': 'Starchild Records', 'url': 'https://myanimelist.net/anime/producer/92/Starchild_Records'}]",[],"[{'mal_id': 91, 'type': 'anime', 'name': 'feel.', 'url': 'https://myanimelist.net/anime/producer/91/feel'}]","[{'mal_id': 8, 'type': 'anime', 'name': 'Drama', 'url': 'https://myanimelist.net/anime/genre/8/Drama'}, {'mal_id': 22, 'type': 'anime', 'name': 'Romance', 'url': 'https://myanimelist.net/anime/genre/22/Romance'}, {'mal_id': 9, 'type': 'anime', 'name': 'Ecchi', 'url': 'https://myanimelist.net/anime/genre/9/Ecchi'}]",[],"[{'mal_id': 23, 'type': 'anime', 'name': 'School', 'url': 'https://myanimelist.net/anime/genre/23/School'}]",[]
2562,https://myanimelist.net/anime/2562/Shion_no_Ou,"{'jpg': {'image_url': 'https://cdn.myanimelist.net/images/anime/5/74050.jpg', 'small_image_url': 'https://cdn.myanimelist.net/images/anime/5/74050t.jpg', 'large_image_url': 'https://cdn.myanimelist.net/images/anime/5/74050l.jpg'}, 'webp': {'image_url': 'https://cdn.myanimelist.net/images/anime/5/74050.webp', 'small_image_url': 'https://cdn.myanimelist.net/images/anime/5/74050t.webp', 'large_image_url': 'https://cdn.myanimelist.net/images/anime/5/74050l.webp'}}","{'youtube_id': None, 'url': None, 'embed_url': None, 'images': {'image_url': None, 'small_image_url': None, 'medium_image_url': None, 'large_image_url': None, 'maximum_image_url': None}}","""Shion no Ou""",,しおんの王 - The Flowers of Hard Blood,"['Shion no Oh', 'The Flowers of Hard Blood']",TV,Manga,22,Finished Airing,False,"{'from': '2007-10-14T00:00:00+00:00', 'to': '2008-03-23T00:00:00+00:00', 'prop': {'from': {'day': 14, 'month': 10, 'year': 2007}, 'to': {'day': 23, 'month': 3, 'year': 2008}}, 'string': 'Oct 14, 2007 to Mar 23, 2008'}",23 min per ep,PG-13 - Teens 13 or older,7.53,9708.0,1563,3385,29890,86,"Shion no Ou follows the story of Yasuoka Shion, a 13-year-old Shougi player with a past of tragedy. Shion's parents were brutally murdered in front of her when she was 5 years old. The murderer sat down with her and challenged her to a game of Shougi, after telling her that if she wanted to stay alive she should forget how to speak, and forget what happened that night. Now Shion has entered the realm of female pro Kishi, mute but strong. As her playing gathers more and more attention, so do the questions about her past and the brutal murder she witnessed. Shion's memories slowly come back, and the mystery begins to unravel, thread by thread.",,fall,2007,"{'day': None, 'time': None, 'timezone': None, 'string': 'Unknown'}","[{'mal_id': 127, 'type': 'anime', 'name': 'Yomiko Advertising', 'url': 'https://myanimelist.net/anime/producer/127/Yomiko_Advertising'}, {'mal_id': 144, 'type': 'anime', 'name': 'Pony Canyon', 'url': 'https://myanimelist.net/anime/producer/144/Pony_Canyon'}, {'mal_id': 169, 'type': 'anime', 'name': 'Fuji TV', 'url': 'https://myanimelist.net/anime/producer/169/Fuji_TV'}, {'mal_id': 315, 'type': 'anime', 'name': 'DAX Production', 'url': 'https://myanimelist.net/anime/producer/315/DAX_Production'}]",[],"[{'mal_id': 37, 'type': 'anime', 'name': 'Studio Deen', 'url': 'https://myanimelist.net/anime/producer/37/Studio_Deen'}]","[{'mal_id': 8, 'type': 'anime', 'name': 'Drama', 'url': 'https://myanimelist.net/anime/genre/8/Drama'}, {'mal_id': 7, 'type': 'anime', 'name': 'Mystery', 'url': 'https://myanimelist.net/anime/genre/7/Mystery'}, {'mal_id': 41, 'type': 'anime', 'name': 'Suspense', 'url': 'https://myanimelist.net/anime/genre/41/Suspense'}]",[],"[{'mal_id': 11, 'type': 'anime', 'name': 'Game', 'url': 'https://myanimelist.net/anime/genre/11/Game'}]",[]
2964,https://myanimelist.net/anime/2964/Blue_Drop__Tenshi-tachi_no_Gikyoku,"{'jpg': {'image_url': 'https://cdn.myanimelist.net/images/anime/3/50485.jpg', 'small_image_url': 'https://cdn.myanimelist.net/images/anime/3/50485t.jpg', 'large_image_url': 'https://cdn.myanimelist.net/images/anime/3/50485l.jpg'}, 'webp': {'image_url': 'https://cdn.myanimelist.net/images/anime/3/50485.webp', 'small_image_url': 'https://cdn.myanimelist.net/images/anime/3/50485t.webp', 'large_image_url': 'https://cdn.myanimelist.net/images/anime/3/50485l.webp'}}","{'youtube_id': None, 'url': None, 'embed_url': None, 'images': {'image_url': None, 'small_image_url': None, 'medium_image_url': None, 'large_image_url': None, 'maximum_image_url': None}}","""Blue Drop: Tenshi-tachi no Gikyoku""",Blue Drop,BLUE DROP ～天使達の戯曲～,['Blue Drop: Tenshitachi no Gikyoku'],TV,Manga,13,Finished Airing,False,"{'from': '2007-10-03T00:00:00+00:00', 'to': '2007-12-26T00:00:00+00:00', 'prop': {'from': {'day': 3, 'month': 10, 'year': 2007}, 'to': {'day': 26, 'month': 12, 'year': 2007}}, 'string': 'Oct 3, 2007 to Dec 26, 2007'}",26 min per ep,PG-13 - Teens 13 or older,6.7,10931.0,5143,3472,28472,102,"Five years ago, something horrifying happened on Kamioki Island. Something so nightmarish that it stripped all memory from Mari Wakatake's mind even as it left every other human on the island dead in its wake! Now enrolled against her will at an isolated girl's academy, Mari is unaware that hidden eyes are watching her, waiting for her memory to return. Buried in her psyche is the most terrifying secret of all: while Mari was the only human who lived, she may not have been the only survivor! As something in a female skin invades Kaihou Academy, Mari's only hope may lie in a strange girl to whom she is inexplicably drawn yet cannot trust. (Source: Sentai Filmworks)",,fall,2007,"{'day': 'Wednesdays', 'time': '02:00', 'timezone': 'Asia/Tokyo', 'string': 'Wednesdays at 02:00 (JST)'}","[{'mal_id': 144, 'type': 'anime', 'name': 'Pony Canyon', 'url': 'https://myanimelist.net/anime/producer/144/Pony_Canyon'}, {'mal_id': 647, 'type': 'anime', 'name': 'Memory-Tech', 'url': 'https://myanimelist.net/anime/producer/647/Memory-Tech'}, {'mal_id': 777, 'type': 'anime', 'name': 'Showgate', 'url': 'https://myanimelist.net/anime/producer/777/Showgate'}, {'mal_id': 1344, 'type': 'anime', 'name': 'King Records', 'url': 'https://myanimelist.net/anime/producer/1344/King_Records'}]","[{'mal_id': 376, 'type': 'anime', 'name': 'Sentai Filmworks', 'url': 'https://myanimelist.net/anime/producer/376/Sentai_Filmworks'}]","[{'mal_id': 89, 'type': 'anime', 'name': 'BeSTACK', 'url': 'https://myanimelist.net/anime/producer/89/BeSTACK'}, {'mal_id': 406, 'type': 'anime', 'name': 'Asahi Production', 'url': 'https://myanimelist.net/anime/producer/406/Asahi_Production'}]","[{'mal_id': 8, 'type': 'anime', 'name': 'Drama', 'url': 'https://myanimelist.net/anime/genre/8/Drama'}, {'mal_id': 26, 'type': 'anime', 'name': 'Girls Love', 'url': 'https://myanimelist.net/anime/genre/26/Girls_Love'}, {'mal_id': 24, 'type': 'anime', 'name': 'Sci-Fi', 'url': 'https://myanimelist.net/anime/genre/24/Sci-Fi'}]",[],[],[]
