mal_id,url,images,trailer,title,title_english,title_japanese,title_synonyms,type,source,episodes,status,airing,aired,duration,rating,score,scored_by,rank,popularity,members,favorites,synopsis,background,season,year,broadcast,producers,licensors,studios,genres,explicit_genres,themes,demographics
1864,https://myanimelist.net/anime/1864/Koisuru_Tenshi_Angelique__Kagayaki_no_Ashita,"{'jpg': {'image_url': 'https://cdn.myanimelist.net/images/anime/11/76296.jpg', 'small_image_url': 'https://cdn.myanimelist.net/images/anime/11/76296t.jpg', 'large_image_url': 'https://cdn.myanimelist.net/images/anime/11/76296l.jpg'}, 'webp': {'image_url': 'https://cdn.myanimelist.net/images/anime/11/76296.webp', 'small_image_url': 'https://cdn.myanimelist.net/images/anime/11/76296t.webp', 'large_image_url': 'https://cdn.myanimelist.net/images/anime/11/76296l.webp'}}","{'youtube_id': None, 'url': None, 'embed_url': None, 'images': {'image_url': None, 'small_image_url': None, 'medium_image_url': None, 'large_image_url': None, 'maximum_image_url': None}}","""Koisuru Tenshi Angelique: Kagayaki no Ashita""",Loving Angel Angelique: Radiant Tomorrow,恋する天使アンジェリーク ～かがやきの明日～,"['Koi Suru Tenshi Angelique', 'Angelique (2007)', 'Beloved Angel Angelique: Radiant Tomorrow', 'Koi Suru Tenshi Angelique: Kagayaki no Asu']",TV,Game,12,Finished Airing,False,"{'from': '2007-01-06T00:00:00+00:00', 'to': '2007-03-24T00:00:00+00:00', 'prop': {'from': {'day': 6, 'month': 1, 'year': 2007}, 'to': {'day': 24, 'month': 3, 'year': 2007}}, 'string': 'Jan 6, 2007 to Mar 24, 2007'}",24 min per ep,PG-13 - Teens 13 or older,6.93,2933.0,4090,5405,10031,26,"Ange is now trapped in the Seijuu Universe, and cannot leave until she awakens Seijuu's Queen. In order to do this, she must gather nine new guardians. It sounds like a fairly simple task, but how can she convince these men to tear away from their own lives and protect the life of another?",,winter,2007,"{'day': None, 'time': None, 'timezone': None, 'string': 'Unknown'}","[{'mal_id': 158, 'type': 'anime', 'name': 'Kids Station', 'url': 'https://myanimelist.net/anime/producer/158/Kids_Station'}, {'mal_id': 241, 'type': 'anime', 'name': 'Koei', 'url': 'https://myanimelist.net/anime/producer/241/Koei'}]",[],"[{'mal_id': 41, 'type': 'anime', 'name': 'Satelight', 'url': 'https://myanimelist.net/anime/producer/41/Satelight'}]","[{'mal_id': 8, 'type': 'anime', 'name': 'Drama', 'url': 'https://myanimelist.net/anime/genre/8/Drama'}, {'mal_id': 10, 'type': 'anime', 'name': 'Fantasy', 'url': 'https://myanimelist.net/anime/genre/10/Fantasy'}, {'mal_id': 22, 'type': 'anime', 'name': 'Romance', 'url': 'https://myanimelist.net/anime/genre/22/Romance'}]",[],"[{'mal_id': 35, 'type': 'anime', 'name': 'Harem', 'url': 'https://myanimelist.net/anime/genre/35/Harem'}]","[{'mal_id': 25, 'type': 'anime', 'name': 'Shoujo', 'url': 'https://myanimelist.net/anime/genre/25/Shoujo'}]"
1693,https://myanimelist.net/anime/1693/Reideen,"{'jpg': {'image_url': 'https://cdn.myanimelist.net/images/anime/2/7363.jpg', 'small_image_url': 'https://cdn.myanimelist.net/images/anime/2/7363t.jpg', 'large_image_url': 'https://cdn.myanimelist.net/images/anime/2/7363l.jpg'}, 'webp': {'image_url': 'https://cdn.myanimelist.net/images/anime/2/7363.webp', 'small_image_url': 'https://cdn.myanimelist.net/images/anime/2/7363t.webp', 'large_image_url': 'https://cdn.myanimelist.net/images/anime/2/7363l.webp'}}","{'youtube_id': 'ojaYM9p9YI4', 'url': 'https://www.youtube.com/watch?v=ojaYM9p9YI4', 'embed_url': 'https://www.youtube.com/embed/ojaYM9p9YI4?enablejsapi=1&wmode=opaque&autoplay=1', 'images': {'image_url': 'https://img.youtube.com/vi/ojaYM9p9YI4/default.jpg', 'small_image_url': 'https://img.youtube.com/vi/ojaYM9p9YI4/sddefault.jpg', 'medium_image_url': 'https://img.youtube.com/vi/ojaYM9p9YI4/mqdefault.jpg', 'large_image_url': 'https://img.youtube.com/vi/ojaYM9p9YI4/hqdefault.jpg', 'maximum_image_url': 'https://img.youtube.com/vi/ojaYM9p9YI4/maxresdefault.jpg'}}","""Reideen""",Reideen,ライディーン,"['Reideen (2007)', 'Raideen']",TV,Unknown,26,Finished Airing,False,"{'from': '2007-02-04T00:00:00+00:00', 'to': '2007-08-25T00:00:00+00:00', 'prop': {'from': {'day': 4, 'month': 2, 'year': 2007}, 'to': {'day': 25, 'month': 8, 'year': 2007}}, 'string': 'Feb 4, 2007 to Aug 25, 2007'}",24 min per ep,PG-13 - Teens 13 or older,6.54,2360.0,5954,5889,8177,8,"Saiga is a normal high school student with a gift in mathematics. His daily routine is disrupted when his family gets news that his Father's remains have been discovered—a noted archeologist and researcher who had gone missing while exploring a site many years before. Among his remains were notes and artifacts that needed to be identified by the family near a notable triangular mountain in Japan known as ""Japan's pyramid"", a place suspected by some to be man-made. A meteor containing a strange robotic lifeform falls from the sky and begins to cause destruction, putting Saiga in danger and causing a mysterious bracelet from his father's research to activate and merge him with an ancient robot burried within the pyramid—a robot the runes describe as Reideen. It is now up to Saiga and guardian Reideen to fight against this unknown alien threat from the sky. (Source: ANN)",,winter,2007,"{'day': None, 'time': None, 'timezone': None, 'string': 'Unknown'}","[{'mal_id': 577, 'type': 'anime', 'name': 'Tohokushinsha Film Corporation', 'url': 'https://myanimelist.net/anime/producer/577/Tohokushinsha_Film_Corporation'}]","[{'mal_id': 376, 'type': 'anime', 'name': 'Sentai Filmworks', 'url': 'https://myanimelist.net/anime/producer/376/Sentai_Filmworks'}]","[{'mal_id': 10, 'type': 'anime', 'name': 'Production I.G', 'url': 'https://myanimelist.net/anime/producer/10/Production_IG'}]","[{'mal_id': 1, 'type': 'anime', 'name': 'Action', 'url': 'https://myanimelist.net/anime/genre/1/Action'}, {'mal_id': 24, 'type': 'anime', 'name': 'Sci-Fi', 'url': 'https://myanimelist.net/anime/genre/24/Sci-Fi'}]",[],"[{'mal_id': 18, 'type': 'anime', 'name': 'Mecha', 'url': 'https://myanimelist.net/anime/genre/18/Mecha'}]",[]
1942,https://myanimelist.net/anime/1942/Rocket_Girls,"{'jpg': {'image_url': 'https://cdn.myanimelist.net/images/anime/2/79894.jpg', 'small_image_url': 'https://cdn.myanimelist.net/images/anime/2/79894t.jpg', 'large_image_url': 'https://cdn.myanimelist.net/images/anime/2/79894l.jpg'}, 'webp': {'image_url': 'https://cdn.myanimelist.net/images/anime/2/79894.webp', 'small_image_url': 'https://cdn.myanimelist.net/images/anime/2/79894t.webp', 'large_image_url': 'https://cdn.myanimelist.net/images/anime/2/79894l.webp'}}","{'youtube_id': None, 'url': None, 'embed_url': None, 'images': {'image_url': None, 'small_image_url': None, 'medium_image_url': None, 'large_image_url': None, 'maximum_image_url': None}}","""Rocket Girls""",,ロケットガール,[],TV,Light novel,12,Finished Airing,False,"{'from': '2007-02-22T00:00:00+00:00', 'to': '2007-05-18T00:00:00+00:00', 'prop': {'from': {'day': 22, 'month': 2, 'year': 2007}, 'to': {'day': 18, 'month': 5, 'year': 2007}}, 'string': 'Feb 22, 2007 to May 18, 2007'}",23 min per ep,PG-13 - Teens 13 or older,6.93,2483.0,4101,6007,7801,10,"When Yukari Morita decided to look for her missing father who disappeared in the South Seas, she had no idea how far her journey would take her. Just traveling to the Solomon Islands is a long way for a high school girl to go on her own, but then Yukari runs into an astronaut from the Solomon Space Association, which has been trying to build a rocket powerful enough launch a man into space. Upon meeting the petite Yukari, however, SSA director Nasuda realizes that she's small enough to go up in a less powerful rocket the SSA has already built! So he offers her a deal: if Yukari agrees to become their astronaut, the SSA will help find her missing father! Will Yukari have the right stuff to blast off in the wildest space quest ever? (Source: Sentai Filmworks)",Rocket Girls adapts the first two volumes of Housuke Nojiri's light novels of the same name with some differences between the animation and the original work. The series was produced in cooperation with the Japan Aerospace Exploration Agency. It first aired on Thursdays on the WOWOW satellite network before moving to a new timeslot on Fridays.,winter,2007,"{'day': 'Fridays', 'time': '00:00', 'timezone': 'Asia/Tokyo', 'string': 'Fridays at 00:00 (JST)'}","[{'mal_id': 787, 'type': 'anime', 'name': 'Happinet Pictures', 'url': 'https://myanimelist.net/anime/producer/787/Happinet_Pictures'}]","[{'mal_id': 233, 'type': 'anime', 'name': 'Bandai Entertainment', 'url': 'https://myanimelist.net/anime/producer/233/Bandai_Entertainment'}, {'mal_id': 376, 'type': 'anime', 'name': 'Sentai Filmworks', 'url': 'https://myanimelist.net/anime/producer/376/Sentai_Filmworks'}]","[{'mal_id': 1442, 'type': 'anime', 'name': 'Mook DLE', 'url': 'https://myanimelist.net/anime/producer/1442/Mook_DLE'}]","[{'mal_id': 2, 'type': 'anime', 'name': 'Adventure', 'url': 'https://myanimelist.net/anime/genre/2/Adventure'}, {'mal_id': 24, 'type': 'anime', 'name': 'Sci-Fi', 'url': 'https://myanimelist.net/anime/genre/24/Sci-Fi'}]",[],"[{'mal_id': 29, 'type': 'anime', 'name': 'Space', 'url': 'https://myanimelist.net/anime/genre/29/Space'}]",[]
1865,https://myanimelist.net/anime/1865/Getsumen_To_Heiki_Mina,"{'jpg': {'image_url': 'https://cdn.myanimelist.net/images/anime/1/1865.jpg', 'small_image_url': 'https://cdn.myanimelist.net/images/anime/1/1865t.jpg', 'large_image_url': 'https://cdn.myanimelist.net/images/anime/1/1865l.jpg'}, 'webp': {'image_url': 'https://cdn.myanimelist.net/images/anime/1/1865.webp', 'small_image_url': 'https://cdn.myanimelist.net/images/anime/1/1865t.webp', 'large_image_url': 'https://cdn.myanimelist.net/images/anime/1/1865l.webp'}}","{'youtube_id': None, 'url': None, 'embed_url': None, 'images': {'image_url': None, 'small_image_url': None, 'medium_image_url': None, 'large_image_url': None, 'maximum_image_url': None}}","""Getsumen To Heiki Mina""",,月面兎兵器ミーナ,"['Getsumen Usagi Heiki Miina', 'Lunar Bunny Weapon Mina', 'Getsumen To Heiki Miina']",TV,Other,11,Finished Airing,False,"{'from': '2007-01-14T00:00:00+00:00', 'to': '2007-03-25T00:00:00+00:00', 'prop': {'from': {'day': 14, 'month': 1, 'year': 2007}, 'to': {'day': 25, 'month': 3, 'year': 2007}}, 'string': 'Jan 14, 2007 to Mar 25, 2007'}",23 min per ep,PG-13 - Teens 13 or older,6.27,1825.0,7347,6127,7432,13,"An animated spin-off from the Densha Otoko (Trainman) TV drama. In the drama, actor Itoh Atsushi plays the otaku Yamada, whose main love in life is the Mina anime, a cutesy busty heroine with floppy rabbit ears and carrots sticking out her rear. Mina itself is a character homage which triggers back to the Daicon Animation done by GAINAX where a similar nameless bunny girl appeared. Densha Otoko futher featured an opening with scenes which were appearing back in the Daicon Animation. (Source: AniDB)",,winter,2007,"{'day': None, 'time': None, 'timezone': None, 'string': 'Unknown'}","[{'mal_id': 144, 'type': 'anime', 'name': 'Pony Canyon', 'url': 'https://myanimelist.net/anime/producer/144/Pony_Canyon'}, {'mal_id': 210, 'type': 'anime', 'name': 'Studio Tulip', 'url': 'https://myanimelist.net/anime/producer/210/Studio_Tulip'}, {'mal_id': 757, 'type': 'anime', 'name': 'Sony Music Entertainment', 'url': 'https://myanimelist.net/anime/producer/757/Sony_Music_Entertainment'}, {'mal_id': 1597, 'type': 'anime', 'name': 'Sotsu Music Publishing', 'url': 'https://myanimelist.net/anime/producer/1597/Sotsu_Music_Publishing'}]",[],"[{'mal_id': 3, 'type': 'anime', 'name': 'Gonzo', 'url': 'https://myanimelist.net/anime/producer/3/Gonzo'}]","[{'mal_id': 4, 'type': 'anime', 'name': 'Comedy', 'url': 'https://myanimelist.net/anime/genre/4/Comedy'}, {'mal_id': 24, 'type': 'anime', 'name': 'Sci-Fi', 'url': 'https://myanimelist.net/anime/genre/24/Sci-Fi'}]",[],"[{'mal_id': 20, 'type': 'anime', 'name': 'Parody', 'url': 'https://myanimelist.net/anime/genre/20/Parody'}]",[]
1724,https://myanimelist.net/anime/1724/Saint_October,"{'jpg': {'image_url': 'https://cdn.myanimelist.net/images/anime/6/16246.jpg', 'small_image_url': 'https://cdn.myanimelist.net/images/anime/6/16246t.jpg', 'large_image_url': 'https://cdn.myanimelist.net/images/anime/6/16246l.jpg'}, 'webp': {'image_url': 'https://cdn.myanimelist.net/images/anime/6/16246.webp', 'small_image_url': 'https://cdn.myanimelist.net/images/anime/6/16246t.webp', 'large_image_url': 'https://cdn.myanimelist.net/images/anime/6/16246l.webp'}}","{'youtube_id': None, 'url': None, 'embed_url': None, 'images': {'image_url': None, 'small_image_url': None, 'medium_image_url': None, 'large_image_url': None, 'maximum_image_url': None}}","""Saint October""",,セイントオクトーバー,[],TV,Original,26,Finished Airing,False,"{'from': '2007-01-05T00:00:00+00:00', 'to': '2007-06-29T00:00:00+00:00', 'prop': {'from': {'day': 5, 'month': 1, 'year': 2007}, 'to': {'day': 29, 'month': 6, 'year': 2007}}, 'string': 'Jan 5, 2007 to Jun 29, 2007'}",25 min per ep,PG-13 - Teens 13 or older,6.51,814.0,6145,6728,5881,8,"Whether it is the future or the past it is the world of fantasy and horror hiding in the shadow of the demon city. In the city, consecutive mysterious incidents that cannot be solved by science have occurred. To solve the incidents, they gather three girl detectives possessing special abilities. Hayama Kotono. She is an orphan living in a convent. Shirafuji Natuski. She is Kotono's classmate and a pop idol. Hijiri Misaki. She is a mysterious girl who fights against nightmares of her previous life. Those who want to bring the Judgement Day to the world. Those who want to save the world. Which is justice, and which is evil? When Kotono encounters a boy who lost his memory, the wheel of the story begins to move but slowly. Then, solving the mysteries, the three girls will confront the fate that will influence the existence of the human beings. (Source: AnimeNfo)",,winter,2007,"{'day': None, 'time': None, 'timezone': None, 'string': 'Unknown'}","[{'mal_id': 85, 'type': 'anime', 'name': 'Konami', 'url': 'https://myanimelist.net/anime/producer/85/Konami'}, {'mal_id': 127, 'type': 'anime', 'name': 'Yomiko Advertising', 'url': 'https://myanimelist.net/anime/producer/127/Yomiko_Advertising'}, {'mal_id': 711, 'type': 'anime', 'name': 'Delfi Sound', 'url': 'https://myanimelist.net/anime/producer/711/Delfi_Sound'}]",[],"[{'mal_id': 126, 'type': 'anime', 'name': 'Studio Comet', 'url': 'https://myanimelist.net/anime/producer/126/Studio_Comet'}]","[{'mal_id': 2, 'type': 'anime', 'name': 'Adventure', 'url': 'https://myanimelist.net/anime/genre/2/Adventure'}, {'mal_id': 10, 'type': 'anime', 'name': 'Fantasy', 'url': 'https://myanimelist.net/anime/genre/10/Fantasy'}]",[],[],[]
1991,https://myanimelist.net/anime/1991/Juusou_Kikou_Dancougar_Nova,"{'jpg': {'image_url': 'https://cdn.myanimelist.net/images/anime/12/21707.jpg', 'small_image_url': 'https://cdn.myanimelist.net/images/anime/12/21707t.jpg', 'large_image_url': 'https://cdn.myanimelist.net/images/anime/12/21707l.jpg'}, 'webp': {'image_url': 'https://cdn.myanimelist.net/images/anime/12/21707.webp', 'small_image_url': 'https://cdn.myanimelist.net/images/anime/12/21707t.webp', 'large_image_url': 'https://cdn.myanimelist.net/images/anime/12/21707l.webp'}}","{'youtube_id': None, 'url': None, 'embed_url': None, 'images': {'image_url': None, 'small_image_url': None, 'medium_image_url': None, 'large_image_url': None, 'maximum_image_url': None}}","""Juusou Kikou Dancougar Nova""",,獣装機攻ダンクーガノヴァ,"['Kemono Soukikou Dancouga Nova', 'Juusoukikou Dancougar Nova']",TV,Original,12,Finished Airing,False,"{'from': '2007-02-15T00:00:00+00:00', 'to': '2007-05-03T00:00:00+00:00', 'prop': {'from': {'day': 15, 'month': 2, 'year': 2007}, 'to': {'day': 3, 'month': 5, 'year': 2007}}, 'string': 'Feb 15, 2007 to May 3, 2007'}",25 min per ep,R+ - Mild Nudity,5.98,1714.0,8768,7005,5251,7,"In the 22nd century, there are no longer any world wide wars. Instead, small scale wars break out all over the Earth. Meanwhile, a large robot appears who protects the weak. It is called ""Dancougar Nova"". Some even call it God. However, no one knows the reason for its existence - not even its pilots. Then, another robot, beyond anyone's expectations, reveals itself as the true enemy and begins its attack on the Earth. Dancougar Nova retaliates against this enemy with a power that was kept secret until now. Will Dancougar Nova be able to save the Earth? The prelude to this explosive confrontation rings out. (Source: AnimeNfo)",,winter,2007,"{'day': None, 'time': None, 'timezone': None, 'string': 'Unknown'}",[],[],"[{'mal_id': 196, 'type': 'anime', 'name': 'Production Reed', 'url': 'https://myanimelist.net/anime/producer/196/Production_Reed'}]",[],[],"[{'mal_id': 18, 'type': 'anime', 'name': 'Mecha', 'url': 'https://myanimelist.net/anime/genre/18/Mecha'}]",[]
3146,https://myanimelist.net/anime/3146/GR__Giant_Robo,"{'jpg': {'image_url': 'https://cdn.myanimelist.net/images/anime/6/4805.jpg', 'small_image_url': 'https://cdn.myanimelist.net/images/anime/6/4805t.jpg', 'large_image_url': 'https://cdn.myanimelist.net/images/anime/6/4805l.jpg'}, 'webp': {'image_url': 'https://cdn.myanimelist.net/images/anime/6/4805.webp', 'small_image_url': 'https://cdn.myanimelist.net/images/anime/6/4805t.webp', 'large_image_url': 'https://cdn.myanimelist.net/images/anime/6/4805l.webp'}}","{'youtube_id': None, 'url': None, 'embed_url': None, 'images': {'image_url': None, 'small_image_url': None, 'medium_image_url': None, 'large_image_url': None, 'maximum_image_url': None}}","""GR: Giant Robo""",,GR -ジャイアントロボ-,['Giant Robo 40th Anniversary'],TV,Manga,13,Finished Airing,False,"{'from': '2007-01-19T00:00:00+00:00', 'to': '2007-07-20T00:00:00+00:00', 'prop': {'from': {'day': 19, 'month': 1, 'year': 2007}, 'to': {'day': 20, 'month': 7, 'year': 2007}}, 'string': 'Jan 19, 2007 to Jul 20, 2007'}",25 min per ep,PG-13 - Teens 13 or older,6.31,482.0,7144,8433,3160,1,"The year is 20XX. Mysterious huge robots called ""Giant Robo (GR)"" started to appear all over the world and destroy cities. The earth was covered with fear. And their next target is Japan! The hero of this animation Daisaku Kusama, who works in a diving shop, encounters a mysterious girl, simply called V who leads him to make a contract with an enormous robot ""Giant Robo 1 (GR1)"" at the ancient ruins (Minami Yonaguni Island) in Okinawa. He made a contract with UNISOM (good guys) and was approved to be a commander of GR1. Thus his battle has begun against GRO (bad guys) and creates a lot of dramas. Before long, Giant Robo of the 21st century will ask the world the true meaning of its power. (Source: AniDB)",,winter,2007,"{'day': None, 'time': None, 'timezone': None, 'string': 'Fridays at Unknown'}","[{'mal_id': 254, 'type': 'anime', 'name': 'Soft Garage', 'url': 'https://myanimelist.net/anime/producer/254/Soft_Garage'}]",[],"[{'mal_id': 179, 'type': 'anime', 'name': 'A.C.G.T.', 'url': 'https://myanimelist.net/anime/producer/179/ACGT'}]","[{'mal_id': 2, 'type': 'anime', 'name': 'Adventure', 'url': 'https://myanimelist.net/anime/genre/2/Adventure'}, {'mal_id': 24, 'type': 'anime', 'name': 'Sci-Fi', 'url': 'https://myanimelist.net/anime/genre/24/Sci-Fi'}]",[],"[{'mal_id': 18, 'type': 'anime', 'name': 'Mecha', 'url': 'https://myanimelist.net/anime/genre/18/Mecha'}, {'mal_id': 38, 'type': 'anime', 'name': 'Military', 'url': 'https://myanimelist.net/anime/genre/38/Military'}]","[{'mal_id': 27, 'type': 'anime', 'name': 'Shounen', 'url': 'https://myanimelist.net/anime/genre/27/Shounen'}]"
9806,https://myanimelist.net/anime/9806/Qin_Shi_Ming_Yue__Bai_Bu_Fei_Jian,"{'jpg': {'image_url': 'https://cdn.myanimelist.net/images/anime/7/63587.jpg', 'small_image_url': 'https://cdn.myanimelist.net/images/anime/7/63587t.jpg', 'large_image_url': 'https://cdn.myanimelist.net/images/anime/7/63587l.jpg'}, 'webp': {'image_url': 'https://cdn.myanimelist.net/images/anime/7/63587.webp', 'small_image_url': 'https://cdn.myanimelist.net/images/anime/7/63587t.webp', 'large_image_url': 'https://cdn.myanimelist.net/images/anime/7/63587l.webp'}}","{'youtube_id': None, 'url': None, 'embed_url': None, 'images': {'image_url': None, 'small_image_url': None, 'medium_image_url': None, 'large_image_url': None, 'maximum_image_url': None}}","""Qin Shi Ming Yue: Bai Bu Fei Jian""",Qin's Moon: Hundred Steps Flying Sword,秦时明月,"['Qín Shí Míng Yuè', 'The Legend of Swordsman', ""Qin's Moon"", 'Qin Shi Ming Yue']",TV,Novel,10,Finished Airing,False,"{'from': '2007-02-14T00:00:00+00:00', 'to': '2007-02-23T00:00:00+00:00', 'prop': {'from': {'day': 14, 'month': 2, 'year': 2007}, 'to': {'day': 23, 'month': 2, 'year': 2007}}, 'string': 'Feb 14, 2007 to Feb 23, 2007'}",22 min per ep,PG-13 - Teens 13 or older,6.28,483.0,7290,8421,3155,14,"Set during the Qin Dynasty in ancient China, a brave assassin attempts to kill the Emperor to save his homeland. However, the assassin fails and in retaliation, the Emperor sends his troops to kill his eight year old son. A highly skilled swordsman intervenes and rescues the boy. After their escape from the forces of the Emperor, they embark on a journey to change the destiny of the empire while encountering several friends and foes along the way.",,winter,2007,"{'day': None, 'time': None, 'timezone': None, 'string': 'Unknown'}",[],[],"[{'mal_id': 1768, 'type': 'anime', 'name': 'Sparkly Key Animation Studio', 'url': 'https://myanimelist.net/anime/producer/1768/Sparkly_Key_Animation_Studio'}]","[{'mal_id': 1, 'type': 'anime', 'name': 'Action', 'url': 'https://myanimelist.net/anime/genre/1/Action'}, {'mal_id': 10, 'type': 'anime', 'name': 'Fantasy', 'url': 'https://myanimelist.net/anime/genre/10/Fantasy'}]",[],"[{'mal_id': 13, 'type': 'anime', 'name': 'Historical', 'url': 'https://myanimelist.net/anime/genre/13/Historical'}, {'mal_id': 17, 'type': 'anime', 'name': 'Martial Arts', 'url': 'https://myanimelist.net/anime/genre/17/Martial_Arts'}]",[]
1885,https://myanimelist.net/anime/1885/Master_of_Epic__The_Animation_Age,"{'jpg': {'image_url': 'https://cdn.myanimelist.net/images/anime/1/1885.jpg', 'small_image_url': 'https://cdn.myanimelist.net/images/anime/1/1885t.jpg', 'large_image_url': 'https://cdn.myanimelist.net/images/anime/1/1885l.jpg'}, 'webp': {'image_url': 'https://cdn.myanimelist.net/images/anime/1/1885.webp', 'small_image_url': 'https://cdn.myanimelist.net/images/anime/1/1885t.webp', 'large_image_url': 'https://cdn.myanimelist.net/images/anime/1/1885l.webp'}}","{'youtube_id': 'I5p4H18vZsY', 'url': 'https://www.youtube.com/watch?v=I5p4H18vZsY', 'embed_url': 'https://www.youtube.com/embed/I5p4H18vZsY?enablejsapi=1&wmode=opaque&autoplay=1', 'images': {'image_url': 'https://img.youtube.com/vi/I5p4H18vZsY/default.jpg', 'small_image_url': 'https://img.youtube.com/vi/I5p4H18vZsY/sddefault.jpg', 'medium_image_url': 'https://img.youtube.com/vi/I5p4H18vZsY/mqdefault.jpg', 'large_image_url': 'https://img.youtube.com/vi/I5p4H18vZsY/hqdefault.jpg', 'maximum_image_url': 'https://img.youtube.com/vi/I5p4H18vZsY/maxresdefault.jpg'}}","""Master of Epic: The Animation Age""",,マスター オブ エピック The Animation Age,['Master of Epic ~The Animation Age~'],TV,Game,12,Finished Airing,False,"{'from': '2007-01-08T00:00:00+00:00', 'to': '2007-03-26T00:00:00+00:00', 'prop': {'from': {'day': 8, 'month': 1, 'year': 2007}, 'to': {'day': 26, 'month': 3, 'year': 2007}}, 'string': 'Jan 8, 2007 to Mar 26, 2007'}",24 min per ep,PG-13 - Teens 13 or older,6.04,416.0,8504,9810,1858,1,"Over millions of years, there have been many ages - war, gods, and future to name a few. Each of these was infinitely less exciting than the current Animation Age! In this RPG-esque existence, becoming stronger is paramount to one's survival and leveling up is a must. From pacifists to news casting, from fishing woes to love advice, there's nothing the Animation Age can't show or teach us about life in a game world! Armed with healing spells, changes of clothes and plenty of summoned familiars, the characters of Master of Epic will do what it takes to level up and live to fight another day! (Source: Anime-Planet)",,winter,2007,"{'day': None, 'time': None, 'timezone': None, 'string': 'Unknown'}","[{'mal_id': 16, 'type': 'anime', 'name': 'TV Tokyo', 'url': 'https://myanimelist.net/anime/producer/16/TV_Tokyo'}]",[],"[{'mal_id': 3, 'type': 'anime', 'name': 'Gonzo', 'url': 'https://myanimelist.net/anime/producer/3/Gonzo'}, {'mal_id': 455, 'type': 'anime', 'name': 'Palm Studio', 'url': 'https://myanimelist.net/anime/producer/455/Palm_Studio'}]","[{'mal_id': 4, 'type': 'anime', 'name': 'Comedy', 'url': 'https://myanimelist.net/anime/genre/4/Comedy'}, {'mal_id': 10, 'type': 'anime', 'name': 'Fantasy', 'url': 'https://myanimelist.net/anime/genre/10/Fantasy'}]",[],"[{'mal_id': 11, 'type': 'anime', 'name': 'Game', 'url': 'https://myanimelist.net/anime/genre/11/Game'}]",[]
