mal_id,url,images,trailer,title,title_english,title_japanese,title_synonyms,type,source,episodes,status,airing,aired,duration,rating,score,scored_by,rank,popularity,members,favorites,synopsis,background,season,year,broadcast,producers,licensors,studios,genres,explicit_genres,themes,demographics
5081,https://myanimelist.net/anime/5081/Bakemonogatari,"{'jpg': {'image_url': 'https://cdn.myanimelist.net/images/anime/11/75274.jpg', 'small_image_url': 'https://cdn.myanimelist.net/images/anime/11/75274t.jpg', 'large_image_url': 'https://cdn.myanimelist.net/images/anime/11/75274l.jpg'}, 'webp': {'image_url': 'https://cdn.myanimelist.net/images/anime/11/75274.webp', 'small_image_url': 'https://cdn.myanimelist.net/images/anime/11/75274t.webp', 'large_image_url': 'https://cdn.myanimelist.net/images/anime/11/75274l.webp'}}","{'youtube_id': 'PugZi9QKL64', 'url': 'https://www.youtube.com/watch?v=PugZi9QKL64', 'embed_url': 'https://www.youtube.com/embed/PugZi9QKL64?enablejsapi=1&wmode=opaque&autoplay=1', 'images': {'image_url': 'https://img.youtube.com/vi/PugZi9QKL64/default.jpg', 'small_image_url': 'https://img.youtube.com/vi/PugZi9QKL64/sddefault.jpg', 'medium_image_url': 'https://img.youtube.com/vi/PugZi9QKL64/mqdefault.jpg', 'large_image_url': 'https://img.youtube.com/vi/PugZi9QKL64/hqdefault.jpg', 'maximum_image_url': 'https://img.youtube.com/vi/PugZi9QKL64/maxresdefault.jpg'}}","""Bakemonogatari""",Bakemonogatari,化物語,['Ghostory'],TV,Light novel,15,Finished Airing,False,"{'from': '2009-07-03T00:00:00+00:00', 'to': '2010-06-25T00:00:00+00:00', 'prop': {'from': {'day': 3, 'month': 7, 'year': 2009}, 'to': {'day': 25, 'month': 6, 'year': 2010}}, 'string': 'Jul 3, 2009 to Jun 25, 2010'}",25 min per ep,R - 17+ (violence & profanity),8.34,641457.0,198,79,1248658,45116,"Koyomi Araragi, a third-year high school student, manages to survive a vampire attack with the help of Meme Oshino, a strange man residing in an abandoned building. Though being saved from vampirism and now a human again, several side effects such as superhuman healing abilities and enhanced vision still remain. Regardless, Araragi tries to live the life of a normal student, with the help of his friend and the class president, Tsubasa Hanekawa. When fellow classmate Hitagi Senjougahara falls down the stairs and is caught by Araragi, the boy realizes that the girl is unnaturally weightless. Despite Senjougahara's protests, Araragi insists he help her, deciding to enlist the aid of Oshino, the very man who had once helped him with his own predicament. Through several tales involving demons and gods, Bakemonogatari follows Araragi as he attempts to help those who suffer from supernatural maladies. [Written by MAL Rewrite]",,summer,2009,"{'day': 'Fridays', 'time': '23:00', 'timezone': 'Asia/Tokyo', 'string': 'Fridays at 23:00 (JST)'}","[{'mal_id': 17, 'type': 'anime', 'name': 'Aniplex', 'url': 'https://myanimelist.net/anime/producer/17/Aniplex'}, {'mal_id': 159, 'type': 'anime', 'name': 'Kodansha', 'url': 'https://myanimelist.net/anime/producer/159/Kodansha'}]","[{'mal_id': 493, 'type': 'anime', 'name': 'Aniplex of America', 'url': 'https://myanimelist.net/anime/producer/493/Aniplex_of_America'}]","[{'mal_id': 44, 'type': 'anime', 'name': 'Shaft', 'url': 'https://myanimelist.net/anime/producer/44/Shaft'}]","[{'mal_id': 7, 'type': 'anime', 'name': 'Mystery', 'url': 'https://myanimelist.net/anime/genre/7/Mystery'}, {'mal_id': 22, 'type': 'anime', 'name': 'Romance', 'url': 'https://myanimelist.net/anime/genre/22/Romance'}, {'mal_id': 37, 'type': 'anime', 'name': 'Supernatural', 'url': 'https://myanimelist.net/anime/genre/37/Supernatural'}]",[],"[{'mal_id': 32, 'type': 'anime', 'name': 'Vampire', 'url': 'https://myanimelist.net/anime/genre/32/Vampire'}]",[]
5341,https://myanimelist.net/anime/5341/Ookami_to_Koushinryou_II,"{'jpg': {'image_url': 'https://cdn.myanimelist.net/images/anime/6/59399.jpg', 'small_image_url': 'https://cdn.myanimelist.net/images/anime/6/59399t.jpg', 'large_image_url': 'https://cdn.myanimelist.net/images/anime/6/59399l.jpg'}, 'webp': {'image_url': 'https://cdn.myanimelist.net/images/anime/6/59399.webp', 'small_image_url': 'https://cdn.myanimelist.net/images/anime/6/59399t.webp', 'large_image_url': 'https://cdn.myanimelist.net/images/anime/6/59399l.webp'}}","{'youtube_id': 'mnCXgfrjn1k', 'url': 'https://www.youtube.com/watch?v=mnCXgfrjn1k', 'embed_url': 'https://www.youtube.com/embed/mnCXgfrjn1k?enablejsapi=1&wmode=opaque&autoplay=1', 'images': {'image_url': 'https://img.youtube.com/vi/mnCXgfrjn1k/default.jpg', 'small_image_url': 'https://img.youtube.com/vi/mnCXgfrjn1k/sddefault.jpg', 'medium_image_url': 'https://img.youtube.com/vi/mnCXgfrjn1k/mqdefault.jpg', 'large_image_url': 'https://img.youtube.com/vi/mnCXgfrjn1k/hqdefault.jpg', 'maximum_image_url': 'https://img.youtube.com/vi/mnCXgfrjn1k/maxresdefault.jpg'}}","""Ookami to Koushinryou II""",Spice and Wolf II,狼と香辛料II,"['Ookami to Koushinryou 2nd Season', 'Spice and Wolf 2nd Season']",TV,Light novel,12,Finished Airing,False,"{'from': '2009-07-09T00:00:00+00:00', 'to': '2009-09-24T00:00:00+00:00', 'prop': {'from': {'day': 9, 'month': 7, 'year': 2009}, 'to': {'day': 24, 'month': 9, 'year': 2009}}, 'string': 'Jul 9, 2009 to Sep 24, 2009'}",24 min per ep,PG-13 - Teens 13 or older,8.33,244897.0,206,389,440360,4032,"Traveling merchant Kraft Lawrence continues his northward journey with wolf goddess Holo, in search of her lost home of Yoitsu. Lawrence and his sharp-witted partner continue to make some small profits along the way, while slowly uncovering more information about Holo's hometown. However, the road to Yoitsu is a bumpy one filled with many troubles—Lawrence runs into a charming young fellow merchant who has his eyes set on the female wolf companion, and he begins to doubt if Holo will remain by his side; he and the goddess will also have to consider precarious and risky business deals as Lawrence strives to achieve his dream of becoming a shopowner. All the while, with his determination tested at every turn during his journey, Lawrence must question his relationship with Holo, take on business ventures, and ask himself whether it is time for him and Holo to go their separate ways. [Written by MAL Rewrite]",,summer,2009,"{'day': None, 'time': None, 'timezone': None, 'string': 'Unknown'}","[{'mal_id': 75, 'type': 'anime', 'name': 'Imagin', 'url': 'https://myanimelist.net/anime/producer/75/Imagin'}, {'mal_id': 464, 'type': 'anime', 'name': 'flying DOG', 'url': 'https://myanimelist.net/anime/producer/464/flying_DOG'}]","[{'mal_id': 102, 'type': 'anime', 'name': 'Funimation', 'url': 'https://myanimelist.net/anime/producer/102/Funimation'}]","[{'mal_id': 112, 'type': 'anime', 'name': ""Brain's Base"", 'url': 'https://myanimelist.net/anime/producer/112/Brains_Base'}, {'mal_id': 553, 'type': 'anime', 'name': 'Marvy Jack', 'url': 'https://myanimelist.net/anime/producer/553/Marvy_Jack'}]","[{'mal_id': 2, 'type': 'anime', 'name': 'Adventure', 'url': 'https://myanimelist.net/anime/genre/2/Adventure'}, {'mal_id': 10, 'type': 'anime', 'name': 'Fantasy', 'url': 'https://myanimelist.net/anime/genre/10/Fantasy'}, {'mal_id': 22, 'type': 'anime', 'name': 'Romance', 'url': 'https://myanimelist.net/anime/genre/22/Romance'}]",[],"[{'mal_id': 13, 'type': 'anime', 'name': 'Historical', 'url': 'https://myanimelist.net/anime/genre/13/Historical'}]",[]
6211,https://myanimelist.net/anime/6211/Tokyo_Magnitude_80,"{'jpg': {'image_url': 'https://cdn.myanimelist.net/images/anime/10/13776.jpg', 'small_image_url': 'https://cdn.myanimelist.net/images/anime/10/13776t.jpg', 'large_image_url': 'https://cdn.myanimelist.net/images/anime/10/13776l.jpg'}, 'webp': {'image_url': 'https://cdn.myanimelist.net/images/anime/10/13776.webp', 'small_image_url': 'https://cdn.myanimelist.net/images/anime/10/13776t.webp', 'large_image_url': 'https://cdn.myanimelist.net/images/anime/10/13776l.webp'}}","{'youtube_id': 'IqhrKb11rEU', 'url': 'https://www.youtube.com/watch?v=IqhrKb11rEU', 'embed_url': 'https://www.youtube.com/embed/IqhrKb11rEU?enablejsapi=1&wmode=opaque&autoplay=1', 'images': {'image_url': 'https://img.youtube.com/vi/IqhrKb11rEU/default.jpg', 'small_image_url': 'https://img.youtube.com/vi/IqhrKb11rEU/sddefault.jpg', 'medium_image_url': 'https://img.youtube.com/vi/IqhrKb11rEU/mqdefault.jpg', 'large_image_url': 'https://img.youtube.com/vi/IqhrKb11rEU/hqdefault.jpg', 'maximum_image_url': 'https://img.youtube.com/vi/IqhrKb11rEU/maxresdefault.jpg'}}","""Tokyo Magnitude 8.0""",Tokyo Magnitude 8.0,東京マグニチュード8.0,[],TV,Original,11,Finished Airing,False,"{'from': '2009-07-10T00:00:00+00:00', 'to': '2009-09-18T00:00:00+00:00', 'prop': {'from': {'day': 10, 'month': 7, 'year': 2009}, 'to': {'day': 18, 'month': 9, 'year': 2009}}, 'string': 'Jul 10, 2009 to Sep 18, 2009'}",22 min per ep,PG-13 - Teens 13 or older,8.03,111576.0,527,696,269904,1659,"Middle school student Mirai Onozawa is dissatisfied with her family circumstances and, in a moment of frustration, wishes to tear everything apart. Unfortunately, these destructive thoughts seem to come true in the form of a magnitude 8.0 earthquake just a few moments later. When summer vacation begins, Mirai reluctantly takes her younger brother Yuuki to Odaiba, where a robot exhibition that he wanted to go to is being held. However, while they are in the exhibition center, the fury of a major earthquake shakes the Kanto region; helpless, both kids witness the devastating power of this natural disaster as it brings the city to its knees. In its aftermath, they stumble upon Mari Kusakabe, a motorcyclist and single mother who decides to help the young siblings. Aiming to return to their homes and reunite with their families, the group sets off on a long and hard journey through the decimated city. [Written by MAL Rewrite]",Winner of the Excellence Award on the 13th Japan Media Arts Festival.,summer,2009,"{'day': 'Fridays', 'time': '00:45', 'timezone': 'Asia/Tokyo', 'string': 'Fridays at 00:45 (JST)'}","[{'mal_id': 53, 'type': 'anime', 'name': 'Dentsu', 'url': 'https://myanimelist.net/anime/producer/53/Dentsu'}, {'mal_id': 169, 'type': 'anime', 'name': 'Fuji TV', 'url': 'https://myanimelist.net/anime/producer/169/Fuji_TV'}, {'mal_id': 245, 'type': 'anime', 'name': 'Toho', 'url': 'https://myanimelist.net/anime/producer/245/Toho'}, {'mal_id': 517, 'type': 'anime', 'name': 'Asmik Ace', 'url': 'https://myanimelist.net/anime/producer/517/Asmik_Ace'}, {'mal_id': 757, 'type': 'anime', 'name': 'Sony Music Entertainment', 'url': 'https://myanimelist.net/anime/producer/757/Sony_Music_Entertainment'}, {'mal_id': 765, 'type': 'anime', 'name': 'Sakura Create', 'url': 'https://myanimelist.net/anime/producer/765/Sakura_Create'}]","[{'mal_id': 490, 'type': 'anime', 'name': 'Maiden Japan', 'url': 'https://myanimelist.net/anime/producer/490/Maiden_Japan'}]","[{'mal_id': 4, 'type': 'anime', 'name': 'Bones', 'url': 'https://myanimelist.net/anime/producer/4/Bones'}, {'mal_id': 290, 'type': 'anime', 'name': 'Kinema Citrus', 'url': 'https://myanimelist.net/anime/producer/290/Kinema_Citrus'}]","[{'mal_id': 8, 'type': 'anime', 'name': 'Drama', 'url': 'https://myanimelist.net/anime/genre/8/Drama'}]",[],[],[]
5356,https://myanimelist.net/anime/5356/Canaan,"{'jpg': {'image_url': 'https://cdn.myanimelist.net/images/anime/4/75789.jpg', 'small_image_url': 'https://cdn.myanimelist.net/images/anime/4/75789t.jpg', 'large_image_url': 'https://cdn.myanimelist.net/images/anime/4/75789l.jpg'}, 'webp': {'image_url': 'https://cdn.myanimelist.net/images/anime/4/75789.webp', 'small_image_url': 'https://cdn.myanimelist.net/images/anime/4/75789t.webp', 'large_image_url': 'https://cdn.myanimelist.net/images/anime/4/75789l.webp'}}","{'youtube_id': '4RybBYYnQmQ', 'url': 'https://www.youtube.com/watch?v=4RybBYYnQmQ', 'embed_url': 'https://www.youtube.com/embed/4RybBYYnQmQ?enablejsapi=1&wmode=opaque&autoplay=1', 'images': {'image_url': 'https://img.youtube.com/vi/4RybBYYnQmQ/default.jpg', 'small_image_url': 'https://img.youtube.com/vi/4RybBYYnQmQ/sddefault.jpg', 'medium_image_url': 'https://img.youtube.com/vi/4RybBYYnQmQ/mqdefault.jpg', 'large_image_url': 'https://img.youtube.com/vi/4RybBYYnQmQ/hqdefault.jpg', 'maximum_image_url': 'https://img.youtube.com/vi/4RybBYYnQmQ/maxresdefault.jpg'}}","""Canaan""",Canaan,CANAAN,"['428: Fuusa Sareta Shibuya de Tokubetsu-hen', '428: Fuusasareta Shibuya de Special Chapter', '428 the animation']",TV,Visual novel,13,Finished Airing,False,"{'from': '2009-07-04T00:00:00+00:00', 'to': '2009-09-26T00:00:00+00:00', 'prop': {'from': {'day': 4, 'month': 7, 'year': 2009}, 'to': {'day': 26, 'month': 9, 'year': 2009}}, 'string': 'Jul 4, 2009 to Sep 26, 2009'}",23 min per ep,R - 17+ (violence & profanity),7.24,77600.0,2717,912,206729,821,"Oosawa Maria is a Japanese photographer currently working in Shanghai, China. Along with her partner Mino, she searches for potential newsworthy stories throughout the city. When strange events occur at a local festival, Maria and Mino immediately investigate. Quickly, the two are immersed in a battle between unknown masked men and a strange, white-haired woman. Just when Maria is about to be caught in the crossfire, an old friend by the name of Canaan appears and helps Maria escape. But a sinister plot over a deadly virus soon develops, and Canaan learns she must confront her past if she wants any chance at stopping the perpetrator and saving her friends. [Written by MAL Rewrite]",,summer,2009,"{'day': 'Saturdays', 'time': '22:30', 'timezone': 'Asia/Tokyo', 'string': 'Saturdays at 22:30 (JST)'}","[{'mal_id': 104, 'type': 'anime', 'name': 'Lantis', 'url': 'https://myanimelist.net/anime/producer/104/Lantis'}, {'mal_id': 144, 'type': 'anime', 'name': 'Pony Canyon', 'url': 'https://myanimelist.net/anime/producer/144/Pony_Canyon'}, {'mal_id': 306, 'type': 'anime', 'name': 'Magic Capsule', 'url': 'https://myanimelist.net/anime/producer/306/Magic_Capsule'}, {'mal_id': 775, 'type': 'anime', 'name': 'Bushiroad', 'url': 'https://myanimelist.net/anime/producer/775/Bushiroad'}, {'mal_id': 777, 'type': 'anime', 'name': 'Showgate', 'url': 'https://myanimelist.net/anime/producer/777/Showgate'}, {'mal_id': 1261, 'type': 'anime', 'name': 'Good Smile Company', 'url': 'https://myanimelist.net/anime/producer/1261/Good_Smile_Company'}]","[{'mal_id': 376, 'type': 'anime', 'name': 'Sentai Filmworks', 'url': 'https://myanimelist.net/anime/producer/376/Sentai_Filmworks'}]","[{'mal_id': 132, 'type': 'anime', 'name': 'P.A. Works', 'url': 'https://myanimelist.net/anime/producer/132/PA_Works'}]","[{'mal_id': 1, 'type': 'anime', 'name': 'Action', 'url': 'https://myanimelist.net/anime/genre/1/Action'}, {'mal_id': 24, 'type': 'anime', 'name': 'Sci-Fi', 'url': 'https://myanimelist.net/anime/genre/24/Sci-Fi'}, {'mal_id': 37, 'type': 'anime', 'name': 'Supernatural', 'url': 'https://myanimelist.net/anime/genre/37/Supernatural'}]",[],"[{'mal_id': 31, 'type': 'anime', 'name': 'Super Power', 'url': 'https://myanimelist.net/anime/genre/31/Super_Power'}]","[{'mal_id': 42, 'type': 'anime', 'name': 'Seinen', 'url': 'https://myanimelist.net/anime/genre/42/Seinen'}]"
4896,https://myanimelist.net/anime/4896/Umineko_no_Naku_Koro_ni,"{'jpg': {'image_url': 'https://cdn.myanimelist.net/images/anime/10/17709.jpg', 'small_image_url': 'https://cdn.myanimelist.net/images/anime/10/17709t.jpg', 'large_image_url': 'https://cdn.myanimelist.net/images/anime/10/17709l.jpg'}, 'webp': {'image_url': 'https://cdn.myanimelist.net/images/anime/10/17709.webp', 'small_image_url': 'https://cdn.myanimelist.net/images/anime/10/17709t.webp', 'large_image_url': 'https://cdn.myanimelist.net/images/anime/10/17709l.webp'}}","{'youtube_id': 'dcPNaY3EIUc', 'url': 'https://www.youtube.com/watch?v=dcPNaY3EIUc', 'embed_url': 'https://www.youtube.com/embed/dcPNaY3EIUc?enablejsapi=1&wmode=opaque&autoplay=1', 'images': {'image_url': 'https://img.youtube.com/vi/dcPNaY3EIUc/default.jpg', 'small_image_url': 'https://img.youtube.com/vi/dcPNaY3EIUc/sddefault.jpg', 'medium_image_url': 'https://img.youtube.com/vi/dcPNaY3EIUc/mqdefault.jpg', 'large_image_url': 'https://img.youtube.com/vi/dcPNaY3EIUc/hqdefault.jpg', 'maximum_image_url': 'https://img.youtube.com/vi/dcPNaY3EIUc/maxresdefault.jpg'}}","""Umineko no Naku Koro ni""",Umineko: When They Cry,うみねこのなく頃に,"['When They Cry 3', 'When the Seagulls Cry', 'When They Cry: Seagulls']",TV,Visual novel,26,Finished Airing,False,"{'from': '2009-07-02T00:00:00+00:00', 'to': '2009-12-24T00:00:00+00:00', 'prop': {'from': {'day': 2, 'month': 7, 'year': 2009}, 'to': {'day': 24, 'month': 12, 'year': 2009}}, 'string': 'Jul 2, 2009 to Dec 24, 2009'}",23 min per ep,R - 17+ (violence & profanity),7.08,82352.0,3451,940,201435,1846,"Considered as the third installment in the highly popular When They Cry series by 07th Expansion, Umineko no Naku Koro ni takes place on the island of Rokkenjima, owned by the immensely wealthy Ushiromiya family. As customary per year, the entire family is gathering on the island for a conference that discusses the current financial situations of each respective person. Because of the family head's poor health, this year involves the topic of the head of the family's inheritance and how it will be distributed. However, the family is unaware that the distribution of his wealth is the least of Ushiromiya Kinzou's (family head) concerns for this year's family conference. After being told that his end was approaching by his longtime friend and physician, Kinzou is desperate to meet his life's true love one last time: the Golden Witch, Beatrice. Having immersed himself in black magic for many of the later years in his life, Kinzou instigates a ceremony to revive his beloved upon his family's arrival on Rokkenjima. Soon after, a violent typhoon traps the family on the island and a string of mysterious murders commence, forcing the eighteen people on the island to fight for their lives in a deadly struggle between fantasy and reality. [Written by MAL Rewrite]",,summer,2009,"{'day': None, 'time': None, 'timezone': None, 'string': 'Unknown'}","[{'mal_id': 31, 'type': 'anime', 'name': 'Geneon Universal Entertainment', 'url': 'https://myanimelist.net/anime/producer/31/Geneon_Universal_Entertainment'}, {'mal_id': 61, 'type': 'anime', 'name': 'Frontier Works', 'url': 'https://myanimelist.net/anime/producer/61/Frontier_Works'}, {'mal_id': 64, 'type': 'anime', 'name': 'Sotsu', 'url': 'https://myanimelist.net/anime/producer/64/Sotsu'}, {'mal_id': 166, 'type': 'anime', 'name': 'Movic', 'url': 'https://myanimelist.net/anime/producer/166/Movic'}]","[{'mal_id': 372, 'type': 'anime', 'name': 'NIS America, Inc.', 'url': 'https://myanimelist.net/anime/producer/372/NIS_America_Inc'}]","[{'mal_id': 37, 'type': 'anime', 'name': 'Studio Deen', 'url': 'https://myanimelist.net/anime/producer/37/Studio_Deen'}]","[{'mal_id': 14, 'type': 'anime', 'name': 'Horror', 'url': 'https://myanimelist.net/anime/genre/14/Horror'}, {'mal_id': 7, 'type': 'anime', 'name': 'Mystery', 'url': 'https://myanimelist.net/anime/genre/7/Mystery'}, {'mal_id': 37, 'type': 'anime', 'name': 'Supernatural', 'url': 'https://myanimelist.net/anime/genre/37/Supernatural'}]",[],"[{'mal_id': 40, 'type': 'anime', 'name': 'Psychological', 'url': 'https://myanimelist.net/anime/genre/40/Psychological'}]",[]
6201,https://myanimelist.net/anime/6201/Princess_Lover,"{'jpg': {'image_url': 'https://cdn.myanimelist.net/images/anime/7/75519.jpg', 'small_image_url': 'https://cdn.myanimelist.net/images/anime/7/75519t.jpg', 'large_image_url': 'https://cdn.myanimelist.net/images/anime/7/75519l.jpg'}, 'webp': {'image_url': 'https://cdn.myanimelist.net/images/anime/7/75519.webp', 'small_image_url': 'https://cdn.myanimelist.net/images/anime/7/75519t.webp', 'large_image_url': 'https://cdn.myanimelist.net/images/anime/7/75519l.webp'}}","{'youtube_id': None, 'url': None, 'embed_url': None, 'images': {'image_url': None, 'small_image_url': None, 'medium_image_url': None, 'large_image_url': None, 'maximum_image_url': None}}","""Princess Lover!""",,プリンセスラバー!,['Princess Lover!'],TV,Visual novel,12,Finished Airing,False,"{'from': '2009-07-06T00:00:00+00:00', 'to': '2009-09-21T00:00:00+00:00', 'prop': {'from': {'day': 6, 'month': 7, 'year': 2009}, 'to': {'day': 21, 'month': 9, 'year': 2009}}, 'string': 'Jul 6, 2009 to Sep 21, 2009'}",23 min per ep,PG-13 - Teens 13 or older,6.72,102473.0,5038,941,201077,343,"Following an automobile accident that claims the life of his parents, Teppei Arima is taken in by his grandfather and introduced to the world of the rich and the elite. Compared to his humble upbringing, Isshin Arima's lavish lifestyle surprises and stuns the young teenager. In return for the gracious hospitality, Teppei is expected to continue the family business by replacing his grandfather as the head of Arima Financial Combine, and to prepare him for these responsibilities, he is enrolled into an esteemed high school. Along with his recently acquired celebrity status and affluence, Teppei is informed of an arranged marriage with the equally prosperous Sylvia van Hossen, thus, beginning the thrilling escapades of his new life! [Written by MAL Rewrite]",,summer,2009,"{'day': None, 'time': None, 'timezone': None, 'string': 'Mondays at Unknown'}","[{'mal_id': 399, 'type': 'anime', 'name': 'Dream Force', 'url': 'https://myanimelist.net/anime/producer/399/Dream_Force'}]",[],"[{'mal_id': 309, 'type': 'anime', 'name': 'GoHands', 'url': 'https://myanimelist.net/anime/producer/309/GoHands'}]","[{'mal_id': 4, 'type': 'anime', 'name': 'Comedy', 'url': 'https://myanimelist.net/anime/genre/4/Comedy'}, {'mal_id': 9, 'type': 'anime', 'name': 'Ecchi', 'url': 'https://myanimelist.net/anime/genre/9/Ecchi'}]",[],"[{'mal_id': 35, 'type': 'anime', 'name': 'Harem', 'url': 'https://myanimelist.net/anime/genre/35/Harem'}, {'mal_id': 23, 'type': 'anime', 'name': 'School', 'url': 'https://myanimelist.net/anime/genre/23/School'}]",[]
6030,https://myanimelist.net/anime/6030/Needless,"{'jpg': {'image_url': 'https://cdn.myanimelist.net/images/anime/2/23457.jpg', 'small_image_url': 'https://cdn.myanimelist.net/images/anime/2/23457t.jpg', 'large_image_url': 'https://cdn.myanimelist.net/images/anime/2/23457l.jpg'}, 'webp': {'image_url': 'https://cdn.myanimelist.net/images/anime/2/23457.webp', 'small_image_url': 'https://cdn.myanimelist.net/images/anime/2/23457t.webp', 'large_image_url': 'https://cdn.myanimelist.net/images/anime/2/23457l.webp'}}","{'youtube_id': 'hDomFQljDo8', 'url': 'https://www.youtube.com/watch?v=hDomFQljDo8', 'embed_url': 'https://www.youtube.com/embed/hDomFQljDo8?enablejsapi=1&wmode=opaque&autoplay=1', 'images': {'image_url': 'https://img.youtube.com/vi/hDomFQljDo8/default.jpg', 'small_image_url': 'https://img.youtube.com/vi/hDomFQljDo8/sddefault.jpg', 'medium_image_url': 'https://img.youtube.com/vi/hDomFQljDo8/mqdefault.jpg', 'large_image_url': 'https://img.youtube.com/vi/hDomFQljDo8/hqdefault.jpg', 'maximum_image_url': 'https://img.youtube.com/vi/hDomFQljDo8/maxresdefault.jpg'}}","""Needless""",Needless,ニードレス,[],TV,Manga,24,Finished Airing,False,"{'from': '2009-07-03T00:00:00+00:00', 'to': '2009-12-11T00:00:00+00:00', 'prop': {'from': {'day': 3, 'month': 7, 'year': 2009}, 'to': {'day': 11, 'month': 12, 'year': 2009}}, 'string': 'Jul 3, 2009 to Dec 11, 2009'}",24 min per ep,R - 17+ (violence & profanity),7.24,54945.0,2699,1334,134034,518,"At the onset of World War III, nobody could have predicted the effect it would have on Japan. While it had officially ended fifty years ago in 2150, its battles still persist. Large, mysterious areas known as ""Blackspots"" appeared across the country, filled with the contaminated ruins of cities and countrysides. Those inside were trapped to halt the spread of contamination, and their powers began to mutate—be they shapeshifters, pyromancers, or controllers of gravity itself—they all became known as the Needless. Adam Blade is one such Needless, possessing remarkable regenerative abilities and incredible strength. In order to restore peace to a war-torn Japan, he and his allies must fight together to rise against a heinous research group by the name of Simeon.",,summer,2009,"{'day': 'Fridays', 'time': '01:30', 'timezone': 'Asia/Tokyo', 'string': 'Fridays at 01:30 (JST)'}","[{'mal_id': 52, 'type': 'anime', 'name': 'Avex Entertainment', 'url': 'https://myanimelist.net/anime/producer/52/Avex_Entertainment'}, {'mal_id': 104, 'type': 'anime', 'name': 'Lantis', 'url': 'https://myanimelist.net/anime/producer/104/Lantis'}]","[{'mal_id': 376, 'type': 'anime', 'name': 'Sentai Filmworks', 'url': 'https://myanimelist.net/anime/producer/376/Sentai_Filmworks'}]","[{'mal_id': 11, 'type': 'anime', 'name': 'Madhouse', 'url': 'https://myanimelist.net/anime/producer/11/Madhouse'}]","[{'mal_id': 1, 'type': 'anime', 'name': 'Action', 'url': 'https://myanimelist.net/anime/genre/1/Action'}, {'mal_id': 4, 'type': 'anime', 'name': 'Comedy', 'url': 'https://myanimelist.net/anime/genre/4/Comedy'}, {'mal_id': 24, 'type': 'anime', 'name': 'Sci-Fi', 'url': 'https://myanimelist.net/anime/genre/24/Sci-Fi'}, {'mal_id': 9, 'type': 'anime', 'name': 'Ecchi', 'url': 'https://myanimelist.net/anime/genre/9/Ecchi'}]",[],"[{'mal_id': 31, 'type': 'anime', 'name': 'Super Power', 'url': 'https://myanimelist.net/anime/genre/31/Super_Power'}]","[{'mal_id': 42, 'type': 'anime', 'name': 'Seinen', 'url': 'https://myanimelist.net/anime/genre/42/Seinen'}]"
