mal_id,url,images,trailer,title,title_english,title_japanese,title_synonyms,type,source,episodes,status,airing,aired,duration,rating,score,scored_by,rank,popularity,members,favorites,synopsis,background,season,year,broadcast,producers,licensors,studios,genres,explicit_genres,themes,demographics
6377,https://myanimelist.net/anime/6377/Zan_Sayonara_Zetsubou_Sensei,"{'jpg': {'image_url': 'https://cdn.myanimelist.net/images/anime/5/14728.jpg', 'small_image_url': 'https://cdn.myanimelist.net/images/anime/5/14728t.jpg', 'large_image_url': 'https://cdn.myanimelist.net/images/anime/5/14728l.jpg'}, 'webp': {'image_url': 'https://cdn.myanimelist.net/images/anime/5/14728.webp', 'small_image_url': 'https://cdn.myanimelist.net/images/anime/5/14728t.webp', 'large_image_url': 'https://cdn.myanimelist.net/images/anime/5/14728l.webp'}}","{'youtube_id': None, 'url': None, 'embed_url': None, 'images': {'image_url': None, 'small_image_url': None, 'medium_image_url': None, 'large_image_url': None, 'maximum_image_url': None}}","""Zan Sayonara Zetsubou Sensei""",,懺・さよなら絶望先生,"['Zan Sayonara Zetsubo Sensei', 'Sayonara Zetsubou Sensei 3', 'ZSZS']",TV,Manga,13,Finished Airing,False,"{'from': '2009-07-05T00:00:00+00:00', 'to': '2009-09-27T00:00:00+00:00', 'prop': {'from': {'day': 5, 'month': 7, 'year': 2009}, 'to': {'day': 27, 'month': 9, 'year': 2009}}, 'string': 'Jul 5, 2009 to Sep 27, 2009'}",23 min per ep,R - 17+ (violence & profanity),7.89,36679.0,725,1708,98105,219,"Nozomu Itoshiki is still the bizarre teacher of the even stranger Class 2-F. He attempts to teach his students the negative aspects of the world and society, only to have each circumstance thrown at his face whenever he tries. With more students and friends than before, Zetsubo-sensei's life becomes harder and crazier than ever before. (Source: ANN)",,summer,2009,"{'day': None, 'time': None, 'timezone': None, 'string': 'Unknown'}",[],[],"[{'mal_id': 44, 'type': 'anime', 'name': 'Shaft', 'url': 'https://myanimelist.net/anime/producer/44/Shaft'}]","[{'mal_id': 4, 'type': 'anime', 'name': 'Comedy', 'url': 'https://myanimelist.net/anime/genre/4/Comedy'}]",[],"[{'mal_id': 20, 'type': 'anime', 'name': 'Parody', 'url': 'https://myanimelist.net/anime/genre/20/Parody'}, {'mal_id': 23, 'type': 'anime', 'name': 'School', 'url': 'https://myanimelist.net/anime/genre/23/School'}]","[{'mal_id': 27, 'type': 'anime', 'name': 'Shounen', 'url': 'https://myanimelist.net/anime/genre/27/Shounen'}]"
6164,https://myanimelist.net/anime/6164/Aoi_Hana,"{'jpg': {'image_url': 'https://cdn.myanimelist.net/images/anime/3/80255.jpg', 'small_image_url': 'https://cdn.myanimelist.net/images/anime/3/80255t.jpg', 'large_image_url': 'https://cdn.myanimelist.net/images/anime/3/80255l.jpg'}, 'webp': {'image_url': 'https://cdn.myanimelist.net/images/anime/3/80255.webp', 'small_image_url': 'https://cdn.myanimelist.net/images/anime/3/80255t.webp', 'large_image_url': 'https://cdn.myanimelist.net/images/anime/3/80255l.webp'}}","{'youtube_id': None, 'url': None, 'embed_url': None, 'images': {'image_url': None, 'small_image_url': None, 'medium_image_url': None, 'large_image_url': None, 'maximum_image_url': None}}","""Aoi Hana""",Sweet Blue Flowers,青い花,"['Aoihana', 'Blue Flower']",TV,Manga,11,Finished Airing,False,"{'from': '2009-07-02T00:00:00+00:00', 'to': '2009-09-10T00:00:00+00:00', 'prop': {'from': {'day': 2, 'month': 7, 'year': 2009}, 'to': {'day': 10, 'month': 9, 'year': 2009}}, 'string': 'Jul 2, 2009 to Sep 10, 2009'}",22 min per ep,PG-13 - Teens 13 or older,7.12,31864.0,3302,1812,89350,375,"Shy and soft-spoken Fumi Manjoume and upfront and caring Akira Okudaira were best friends in elementary school, but this changed when Fumi and her family moved away. Years later, Fumi moves back to her hometown after being accepted at Matsuoka Girls’ High School. She finally reunites with Akira, who is going to attend Fujigatani Girls’ Academy. Despite their reunion, their relationship isn't the same as it was years ago. As soon as Fumi starts attending school, popular senior Yasuko Sugimoto takes notice of her and flatters her more than any other underclassmen. After running to Akira for help so many times before, Fumi must figure out who she is as a person instead of standing in someone else’s shadow. However, that doesn’t stop Akira from wanting her friendship with Fumi to be as it once was. Will the girls be able to conquer the high school stage of growing up before it pulls them apart? [Written by MAL Rewrite]",,summer,2009,"{'day': 'Thursdays', 'time': '02:08', 'timezone': 'Asia/Tokyo', 'string': 'Thursdays at 02:08 (JST)'}","[{'mal_id': 169, 'type': 'anime', 'name': 'Fuji TV', 'url': 'https://myanimelist.net/anime/producer/169/Fuji_TV'}, {'mal_id': 769, 'type': 'anime', 'name': 'Fujipacific Music', 'url': 'https://myanimelist.net/anime/producer/769/Fujipacific_Music'}]","[{'mal_id': 217, 'type': 'anime', 'name': 'Nozomi Entertainment', 'url': 'https://myanimelist.net/anime/producer/217/Nozomi_Entertainment'}]","[{'mal_id': 7, 'type': 'anime', 'name': 'J.C.Staff', 'url': 'https://myanimelist.net/anime/producer/7/JCStaff'}]","[{'mal_id': 26, 'type': 'anime', 'name': 'Girls Love', 'url': 'https://myanimelist.net/anime/genre/26/Girls_Love'}, {'mal_id': 22, 'type': 'anime', 'name': 'Romance', 'url': 'https://myanimelist.net/anime/genre/22/Romance'}, {'mal_id': 36, 'type': 'anime', 'name': 'Slice of Life', 'url': 'https://myanimelist.net/anime/genre/36/Slice_of_Life'}]",[],[],[]
6098,https://myanimelist.net/anime/6098/Sora_no_Manimani,"{'jpg': {'image_url': 'https://cdn.myanimelist.net/images/anime/6/75491.jpg', 'small_image_url': 'https://cdn.myanimelist.net/images/anime/6/75491t.jpg', 'large_image_url': 'https://cdn.myanimelist.net/images/anime/6/75491l.jpg'}, 'webp': {'image_url': 'https://cdn.myanimelist.net/images/anime/6/75491.webp', 'small_image_url': 'https://cdn.myanimelist.net/images/anime/6/75491t.webp', 'large_image_url': 'https://cdn.myanimelist.net/images/anime/6/75491l.webp'}}","{'youtube_id': '3B7v07FPb3A', 'url': 'https://www.youtube.com/watch?v=3B7v07FPb3A', 'embed_url': 'https://www.youtube.com/embed/3B7v07FPb3A?enablejsapi=1&wmode=opaque&autoplay=1', 'images': {'image_url': 'https://img.youtube.com/vi/3B7v07FPb3A/default.jpg', 'small_image_url': 'https://img.youtube.com/vi/3B7v07FPb3A/sddefault.jpg', 'medium_image_url': 'https://img.youtube.com/vi/3B7v07FPb3A/mqdefault.jpg', 'large_image_url': 'https://img.youtube.com/vi/3B7v07FPb3A/hqdefault.jpg', 'maximum_image_url': 'https://img.youtube.com/vi/3B7v07FPb3A/maxresdefault.jpg'}}","""Sora no Manimani""",At The Mercy of The Sky,宙のまにまに,['Chuu no Manimani'],TV,Manga,12,Finished Airing,False,"{'from': '2009-07-07T00:00:00+00:00', 'to': '2009-09-22T00:00:00+00:00', 'prop': {'from': {'day': 7, 'month': 7, 'year': 2009}, 'to': {'day': 22, 'month': 9, 'year': 2009}}, 'string': 'Jul 7, 2009 to Sep 22, 2009'}",23 min per ep,PG-13 - Teens 13 or older,7.07,15902.0,3520,2871,40531,61,"Saku Ooyagi returns to his hometown after seven years and is soon reacquainted with his childhood friend, Mihoshi Akeno. The reunion is far from merry since the last memory they have of each other is of her falling off a tree and him saving her. In any case, Mihoshi is determined to improve their relationship and forces Saku to join the astronomy club she founded.",,summer,2009,"{'day': 'Tuesdays', 'time': '10:30', 'timezone': 'Asia/Tokyo', 'string': 'Tuesdays at 10:30 (JST)'}","[{'mal_id': 15, 'type': 'anime', 'name': 'Sony Pictures Entertainment', 'url': 'https://myanimelist.net/anime/producer/15/Sony_Pictures_Entertainment'}, {'mal_id': 82, 'type': 'anime', 'name': 'Marvelous', 'url': 'https://myanimelist.net/anime/producer/82/Marvelous'}, {'mal_id': 104, 'type': 'anime', 'name': 'Lantis', 'url': 'https://myanimelist.net/anime/producer/104/Lantis'}, {'mal_id': 144, 'type': 'anime', 'name': 'Pony Canyon', 'url': 'https://myanimelist.net/anime/producer/144/Pony_Canyon'}, {'mal_id': 238, 'type': 'anime', 'name': 'AT-X', 'url': 'https://myanimelist.net/anime/producer/238/AT-X'}, {'mal_id': 711, 'type': 'anime', 'name': 'Delfi Sound', 'url': 'https://myanimelist.net/anime/producer/711/Delfi_Sound'}]",[],"[{'mal_id': 126, 'type': 'anime', 'name': 'Studio Comet', 'url': 'https://myanimelist.net/anime/producer/126/Studio_Comet'}]","[{'mal_id': 4, 'type': 'anime', 'name': 'Comedy', 'url': 'https://myanimelist.net/anime/genre/4/Comedy'}, {'mal_id': 22, 'type': 'anime', 'name': 'Romance', 'url': 'https://myanimelist.net/anime/genre/22/Romance'}, {'mal_id': 36, 'type': 'anime', 'name': 'Slice of Life', 'url': 'https://myanimelist.net/anime/genre/36/Slice_of_Life'}]",[],"[{'mal_id': 23, 'type': 'anime', 'name': 'School', 'url': 'https://myanimelist.net/anime/genre/23/School'}]","[{'mal_id': 42, 'type': 'anime', 'name': 'Seinen', 'url': 'https://myanimelist.net/anime/genre/42/Seinen'}]"
5914,https://myanimelist.net/anime/5914/Kanamemo,"{'jpg': {'image_url': 'https://cdn.myanimelist.net/images/anime/6/52677.jpg', 'small_image_url': 'https://cdn.myanimelist.net/images/anime/6/52677t.jpg', 'large_image_url': 'https://cdn.myanimelist.net/images/anime/6/52677l.jpg'}, 'webp': {'image_url': 'https://cdn.myanimelist.net/images/anime/6/52677.webp', 'small_image_url': 'https://cdn.myanimelist.net/images/anime/6/52677t.webp', 'large_image_url': 'https://cdn.myanimelist.net/images/anime/6/52677l.webp'}}","{'youtube_id': None, 'url': None, 'embed_url': None, 'images': {'image_url': None, 'small_image_url': None, 'medium_image_url': None, 'large_image_url': None, 'maximum_image_url': None}}","""Kanamemo""",,かなめも,[],TV,4-koma manga,13,Finished Airing,False,"{'from': '2009-07-06T00:00:00+00:00', 'to': '2009-09-28T00:00:00+00:00', 'prop': {'from': {'day': 6, 'month': 7, 'year': 2009}, 'to': {'day': 28, 'month': 9, 'year': 2009}}, 'string': 'Jul 6, 2009 to Sep 28, 2009'}",24 min per ep,PG-13 - Teens 13 or older,6.87,13685.0,4357,3071,36105,62,"Middle schooler Kana Nakamachi's life drastically changes when her grandmother passes away. Leaving behind an empty house, Kana learns that no one can provide her lodging due to her young age. Eventually, she stumbles upon the Fuhshin Gazette, a local newspaper delivery business who is able to provide her with a place to stay if she works for them in return. The small store is staffed by several unique people: the sweets-loving Yume Kitaoka and her girlfriend Yuuki Minami; the frugal Hinata Azuma; the alcoholic Haruka Nishida; and the young but mature Saki Amano. It is not all fun and games at the Fuhshin Gazette, though, as Kana must deal with long working hours, energetic dogs guarding mailboxes, and confusing delivery routes. Add in a small rivalry with Mika Kujiin, a girl from a competing store, and Kana will have more than enough to keep her hands full! [Written by MAL Rewrite]",,summer,2009,"{'day': 'Mondays', 'time': '01:30', 'timezone': 'Asia/Tokyo', 'string': 'Mondays at 01:30 (JST)'}","[{'mal_id': 92, 'type': 'anime', 'name': 'Starchild Records', 'url': 'https://myanimelist.net/anime/producer/92/Starchild_Records'}, {'mal_id': 717, 'type': 'anime', 'name': 'TV Tokyo Music', 'url': 'https://myanimelist.net/anime/producer/717/TV_Tokyo_Music'}, {'mal_id': 797, 'type': 'anime', 'name': 'Houbunsha', 'url': 'https://myanimelist.net/anime/producer/797/Houbunsha'}]","[{'mal_id': 490, 'type': 'anime', 'name': 'Maiden Japan', 'url': 'https://myanimelist.net/anime/producer/490/Maiden_Japan'}]","[{'mal_id': 91, 'type': 'anime', 'name': 'feel.', 'url': 'https://myanimelist.net/anime/producer/91/feel'}]","[{'mal_id': 4, 'type': 'anime', 'name': 'Comedy', 'url': 'https://myanimelist.net/anime/genre/4/Comedy'}, {'mal_id': 26, 'type': 'anime', 'name': 'Girls Love', 'url': 'https://myanimelist.net/anime/genre/26/Girls_Love'}, {'mal_id': 36, 'type': 'anime', 'name': 'Slice of Life', 'url': 'https://myanimelist.net/anime/genre/36/Slice_of_Life'}, {'mal_id': 9, 'type': 'anime', 'name': 'Ecchi', 'url': 'https://myanimelist.net/anime/genre/9/Ecchi'}]",[],[],[]
5973,https://myanimelist.net/anime/5973/Fight_Ippatsu_Juuden-chan,"{'jpg': {'image_url': 'https://cdn.myanimelist.net/images/anime/2/12946.jpg', 'small_image_url': 'https://cdn.myanimelist.net/images/anime/2/12946t.jpg', 'large_image_url': 'https://cdn.myanimelist.net/images/anime/2/12946l.jpg'}, 'webp': {'image_url': 'https://cdn.myanimelist.net/images/anime/2/12946.webp', 'small_image_url': 'https://cdn.myanimelist.net/images/anime/2/12946t.webp', 'large_image_url': 'https://cdn.myanimelist.net/images/anime/2/12946l.webp'}}","{'youtube_id': None, 'url': None, 'embed_url': None, 'images': {'image_url': None, 'small_image_url': None, 'medium_image_url': None, 'large_image_url': None, 'maximum_image_url': None}}","""Fight Ippatsu! Juuden-chan!!""",Juden Chan Recharged,ファイト一発！充電ちゃん！！,[],TV,Manga,12,Finished Airing,False,"{'from': '2009-06-25T00:00:00+00:00', 'to': '2009-09-09T00:00:00+00:00', 'prop': {'from': {'day': 25, 'month': 6, 'year': 2009}, 'to': {'day': 9, 'month': 9, 'year': 2009}}, 'string': 'Jun 25, 2009 to Sep 9, 2009'}",24 min per ep,R+ - Mild Nudity,6.64,12856.0,5454,3308,31486,49,"Meet Plug, an unusual girl from a parallel world. Plug is a ""Juuden-chan,"" capable of ""recharging"" people down on their luck, spreading good cheer wherever she goes!",,summer,2009,"{'day': None, 'time': None, 'timezone': None, 'string': 'Unknown'}","[{'mal_id': 52, 'type': 'anime', 'name': 'Avex Entertainment', 'url': 'https://myanimelist.net/anime/producer/52/Avex_Entertainment'}, {'mal_id': 79, 'type': 'anime', 'name': 'Genco', 'url': 'https://myanimelist.net/anime/producer/79/Genco'}, {'mal_id': 1213, 'type': 'anime', 'name': 'Mobcast', 'url': 'https://myanimelist.net/anime/producer/1213/Mobcast'}]","[{'mal_id': 250, 'type': 'anime', 'name': 'Media Blasters', 'url': 'https://myanimelist.net/anime/producer/250/Media_Blasters'}]","[{'mal_id': 101, 'type': 'anime', 'name': 'Studio Hibari', 'url': 'https://myanimelist.net/anime/producer/101/Studio_Hibari'}]","[{'mal_id': 4, 'type': 'anime', 'name': 'Comedy', 'url': 'https://myanimelist.net/anime/genre/4/Comedy'}, {'mal_id': 24, 'type': 'anime', 'name': 'Sci-Fi', 'url': 'https://myanimelist.net/anime/genre/24/Sci-Fi'}, {'mal_id': 9, 'type': 'anime', 'name': 'Ecchi', 'url': 'https://myanimelist.net/anime/genre/9/Ecchi'}]",[],[],"[{'mal_id': 27, 'type': 'anime', 'name': 'Shounen', 'url': 'https://myanimelist.net/anime/genre/27/Shounen'}]"
6129,https://myanimelist.net/anime/6129/Umi_Monogatari__Anata_ga_Ite_Kureta_Koto,"{'jpg': {'image_url': 'https://cdn.myanimelist.net/images/anime/7/15586.jpg', 'small_image_url': 'https://cdn.myanimelist.net/images/anime/7/15586t.jpg', 'large_image_url': 'https://cdn.myanimelist.net/images/anime/7/15586l.jpg'}, 'webp': {'image_url': 'https://cdn.myanimelist.net/images/anime/7/15586.webp', 'small_image_url': 'https://cdn.myanimelist.net/images/anime/7/15586t.webp', 'large_image_url': 'https://cdn.myanimelist.net/images/anime/7/15586l.webp'}}","{'youtube_id': 'SeQqemYIDXA', 'url': 'https://www.youtube.com/watch?v=SeQqemYIDXA', 'embed_url': 'https://www.youtube.com/embed/SeQqemYIDXA?enablejsapi=1&wmode=opaque&autoplay=1', 'images': {'image_url': 'https://img.youtube.com/vi/SeQqemYIDXA/default.jpg', 'small_image_url': 'https://img.youtube.com/vi/SeQqemYIDXA/sddefault.jpg', 'medium_image_url': 'https://img.youtube.com/vi/SeQqemYIDXA/mqdefault.jpg', 'large_image_url': 'https://img.youtube.com/vi/SeQqemYIDXA/hqdefault.jpg', 'maximum_image_url': 'https://img.youtube.com/vi/SeQqemYIDXA/maxresdefault.jpg'}}","""Umi Monogatari: Anata ga Ite Kureta Koto""",Umi Monogatari,うみものがたり　～あなたがいてくれたコト～,"['Umimonogatari Anata ga Itekuretakoto', 'Sea Story']",TV,Game,12,Finished Airing,False,"{'from': '2009-06-25T00:00:00+00:00', 'to': '2009-09-17T00:00:00+00:00', 'prop': {'from': {'day': 25, 'month': 6, 'year': 2009}, 'to': {'day': 17, 'month': 9, 'year': 2009}}, 'string': 'Jun 25, 2009 to Sep 17, 2009'}",24 min per ep,PG-13 - Teens 13 or older,6.61,6036.0,5626,3631,25998,27,"Marin and her younger sister Urin are seafolk who happen upon something quite strange: a beautiful silver ring lost beneath the waves. The kind-hearted Marin, intent on returning it to its owner, drags a reluctant Urin along with her to the sky world despite reminders of a turtle elder who left for the surface and never returned. After locating the ring's owner, Kanon Miyamori, they learn that Kanon had tossed it into the sea after her boyfriend dumped her earlier that day. Though Marin insists that such a lovely item should not be thrown away, Kanon discards it once again. As they search for the ring, Urin becomes separated from the other two and accidently breaks the seal on a stone coffin, releasing an evil being known as Sedna. Sensing Sedna's release, the formerly missing turtle elder, Matsumoto, reveals himself to Kanon and her companions, naming Marin as the Priestess of the Sea. Together with the Priestess of the Sky, she has the power to seal Sedna away again. And as luck would have it, during an encounter with one of Sedna's minions, Kanon discovers that she is the Priestess of the Sky. Though Kanon is hesitant, she and Marin decide to work together to save the world from the evil that threatens it. [Written by MAL Rewrite]",,summer,2009,"{'day': None, 'time': None, 'timezone': None, 'string': 'Unknown'}",[],"[{'mal_id': 217, 'type': 'anime', 'name': 'Nozomi Entertainment', 'url': 'https://myanimelist.net/anime/producer/217/Nozomi_Entertainment'}]","[{'mal_id': 218, 'type': 'anime', 'name': 'Zexcs', 'url': 'https://myanimelist.net/anime/producer/218/Zexcs'}]","[{'mal_id': 8, 'type': 'anime', 'name': 'Drama', 'url': 'https://myanimelist.net/anime/genre/8/Drama'}, {'mal_id': 10, 'type': 'anime', 'name': 'Fantasy', 'url': 'https://myanimelist.net/anime/genre/10/Fantasy'}, {'mal_id': 22, 'type': 'anime', 'name': 'Romance', 'url': 'https://myanimelist.net/anime/genre/22/Romance'}, {'mal_id': 37, 'type': 'anime', 'name': 'Supernatural', 'url': 'https://myanimelist.net/anime/genre/37/Supernatural'}]",[],[],[]
5454,https://myanimelist.net/anime/5454/Yoku_Wakaru_Gendai_Mahou,"{'jpg': {'image_url': 'https://cdn.myanimelist.net/images/anime/5/88619.jpg', 'small_image_url': 'https://cdn.myanimelist.net/images/anime/5/88619t.jpg', 'large_image_url': 'https://cdn.myanimelist.net/images/anime/5/88619l.jpg'}, 'webp': {'image_url': 'https://cdn.myanimelist.net/images/anime/5/88619.webp', 'small_image_url': 'https://cdn.myanimelist.net/images/anime/5/88619t.webp', 'large_image_url': 'https://cdn.myanimelist.net/images/anime/5/88619l.webp'}}","{'youtube_id': None, 'url': None, 'embed_url': None, 'images': {'image_url': None, 'small_image_url': None, 'medium_image_url': None, 'large_image_url': None, 'maximum_image_url': None}}","""Yoku Wakaru Gendai Mahou""",Modern Magic Made Simple,よくわかる現代魔法,"['Modern Magic for Dummies', 'Properly Learned Modern Magic', 'Manageable Modern Magic']",TV,Light novel,12,Finished Airing,False,"{'from': '2009-07-12T00:00:00+00:00', 'to': '2009-09-27T00:00:00+00:00', 'prop': {'from': {'day': 12, 'month': 7, 'year': 2009}, 'to': {'day': 27, 'month': 9, 'year': 2009}}, 'string': 'Jul 12, 2009 to Sep 27, 2009'}",24 min per ep,PG-13 - Teens 13 or older,6.44,7880.0,6493,3789,23856,29,"Life hasn't been fair to Koyomi Morishita. Even though she's in high school, she's so short that everyone assumes she's still in grade school. The boys and girls in her school tease her mercilessly, and she's not exactly graceful either. On the other hand, she's still better off than Yumiko, who has a magician trying to kill her. Or at least Koyomi was until their paths crossed! Fortunately, salvation arrives in the form of master mage and graduate student Misa Anehara, who agrees to take Koyomi under her wing in learning the new style of magic, which breaks enchantment down into sequences of code. That'll be quite a task, given that so far Koyomi's talent seems to consist of making washbasins randomly fall out of the sky. But if it was easy, it wouldn't be magic, would it? (Source: Sentai Filmworks)",,summer,2009,"{'day': 'Sundays', 'time': '00:00', 'timezone': 'Asia/Tokyo', 'string': 'Sundays at 00:00 (JST)'}","[{'mal_id': 829, 'type': 'anime', 'name': 'Studio Jack', 'url': 'https://myanimelist.net/anime/producer/829/Studio_Jack'}, {'mal_id': 1365, 'type': 'anime', 'name': 'Shueisha', 'url': 'https://myanimelist.net/anime/producer/1365/Shueisha'}]","[{'mal_id': 376, 'type': 'anime', 'name': 'Sentai Filmworks', 'url': 'https://myanimelist.net/anime/producer/376/Sentai_Filmworks'}]","[{'mal_id': 70, 'type': 'anime', 'name': 'Nomad', 'url': 'https://myanimelist.net/anime/producer/70/Nomad'}]","[{'mal_id': 4, 'type': 'anime', 'name': 'Comedy', 'url': 'https://myanimelist.net/anime/genre/4/Comedy'}]",[],[],[]
6425,https://myanimelist.net/anime/6425/Weiß_Survive,"{'jpg': {'image_url': 'https://cdn.myanimelist.net/images/anime/10/17261.jpg', 'small_image_url': 'https://cdn.myanimelist.net/images/anime/10/17261t.jpg', 'large_image_url': 'https://cdn.myanimelist.net/images/anime/10/17261l.jpg'}, 'webp': {'image_url': 'https://cdn.myanimelist.net/images/anime/10/17261.webp', 'small_image_url': 'https://cdn.myanimelist.net/images/anime/10/17261t.webp', 'large_image_url': 'https://cdn.myanimelist.net/images/anime/10/17261l.webp'}}","{'youtube_id': None, 'url': None, 'embed_url': None, 'images': {'image_url': None, 'small_image_url': None, 'medium_image_url': None, 'large_image_url': None, 'maximum_image_url': None}}","""Weiß Survive""",,ヴァイス・サヴァイヴ,['Weiss Survive'],TV,Card game,16,Finished Airing,False,"{'from': '2009-06-06T00:00:00+00:00', 'to': '2009-09-26T00:00:00+00:00', 'prop': {'from': {'day': 6, 'month': 6, 'year': 2009}, 'to': {'day': 26, 'month': 9, 'year': 2009}}, 'string': 'Jun 6, 2009 to Sep 26, 2009'}",2 min per ep,PG-13 - Teens 13 or older,6.06,7778.0,8384,4090,19933,10,"Takeshi was just an ordinary guy until a perfectly innocent study session with Michi - the most beautiful girl in the school - ended up with him being mysteriously transported into the strange dimension known as the Weiss Schwarz Battle Space. Once there, a crazy but enthusiastic old man informs him that he is the chosen warrior and must win a succession of card battles to get back home. The only problem: he doesn't know how to play! However, with the expert Michi ready to teach him the ins and outs of this bizarre and improbably slapstick card game, Takeshi will learn the ropes and get ready for the card battle of a lifetime. Assuming he survives the training... (Source: ANN)",,summer,2009,"{'day': 'Saturdays', 'time': '01:25', 'timezone': 'Asia/Tokyo', 'string': 'Saturdays at 01:25 (JST)'}","[{'mal_id': 145, 'type': 'anime', 'name': 'TBS', 'url': 'https://myanimelist.net/anime/producer/145/TBS'}, {'mal_id': 775, 'type': 'anime', 'name': 'Bushiroad', 'url': 'https://myanimelist.net/anime/producer/775/Bushiroad'}]",[],"[{'mal_id': 101, 'type': 'anime', 'name': 'Studio Hibari', 'url': 'https://myanimelist.net/anime/producer/101/Studio_Hibari'}]","[{'mal_id': 4, 'type': 'anime', 'name': 'Comedy', 'url': 'https://myanimelist.net/anime/genre/4/Comedy'}, {'mal_id': 9, 'type': 'anime', 'name': 'Ecchi', 'url': 'https://myanimelist.net/anime/genre/9/Ecchi'}]",[],"[{'mal_id': 11, 'type': 'anime', 'name': 'Game', 'url': 'https://myanimelist.net/anime/genre/11/Game'}]",[]
