mal_id,url,images,trailer,title,title_english,title_japanese,title_synonyms,type,source,episodes,status,airing,aired,duration,rating,score,scored_by,rank,popularity,members,favorites,synopsis,background,season,year,broadcast,producers,licensors,studios,genres,explicit_genres,themes,demographics
4720,https://myanimelist.net/anime/4720/White_Album,"{'jpg': {'image_url': 'https://cdn.myanimelist.net/images/anime/12/43537.jpg', 'small_image_url': 'https://cdn.myanimelist.net/images/anime/12/43537t.jpg', 'large_image_url': 'https://cdn.myanimelist.net/images/anime/12/43537l.jpg'}, 'webp': {'image_url': 'https://cdn.myanimelist.net/images/anime/12/43537.webp', 'small_image_url': 'https://cdn.myanimelist.net/images/anime/12/43537t.webp', 'large_image_url': 'https://cdn.myanimelist.net/images/anime/12/43537l.webp'}}","{'youtube_id': None, 'url': None, 'embed_url': None, 'images': {'image_url': None, 'small_image_url': None, 'medium_image_url': None, 'large_image_url': None, 'maximum_image_url': None}}","""White Album""",White Album,ホワイトアルバム,['W.A.'],TV,Visual novel,13,Finished Airing,False,"{'from': '2009-01-04T00:00:00+00:00', 'to': '2009-03-29T00:00:00+00:00', 'prop': {'from': {'day': 4, 'month': 1, 'year': 2009}, 'to': {'day': 29, 'month': 3, 'year': 2009}}, 'string': 'Jan 4, 2009 to Mar 29, 2009'}",25 min per ep,PG-13 - Teens 13 or older,6.51,31849.0,6155,1563,109017,179,"Can a relationship between a regular college student and an idol singer survive? That is the question that White Album tries to answer. Touya Fujii is a normal college student with normal worries—namely balancing his classes and his job he works to pay for school. He is also concerned about the amount of time he has to spend with Yuki Morikawa, or rather, the lack of it. Being an up and coming idol singer, Yuki has concerns of her own. Even though she's not yet as popular as experienced veteran Rina Ogata, Yuki is turning heads and landing interviews on television. This should be a good thing, but not everyone is happy about the attention she receives from the media and from Rina. The idol industry is surprisingly cutthroat, and rival singers have their eyes on Yuki. While it may seem exciting to watch your girlfriend on television, how does Touya really feel about all this? Between the challenges associated with Yuki's career and other people that Touya meets at his university, their relationship may not last…",,winter,2009,"{'day': 'Sundays', 'time': '02:00', 'timezone': 'Asia/Tokyo', 'string': 'Sundays at 02:00 (JST)'}",[],[],"[{'mal_id': 35, 'type': 'anime', 'name': 'Seven Arcs', 'url': 'https://myanimelist.net/anime/producer/35/Seven_Arcs'}]","[{'mal_id': 8, 'type': 'anime', 'name': 'Drama', 'url': 'https://myanimelist.net/anime/genre/8/Drama'}, {'mal_id': 22, 'type': 'anime', 'name': 'Romance', 'url': 'https://myanimelist.net/anime/genre/22/Romance'}]",[],"[{'mal_id': 35, 'type': 'anime', 'name': 'Harem', 'url': 'https://myanimelist.net/anime/genre/35/Harem'}, {'mal_id': 19, 'type': 'anime', 'name': 'Music', 'url': 'https://myanimelist.net/anime/genre/19/Music'}]",[]
5420,https://myanimelist.net/anime/5420/Kemono_no_Souja_Erin,"{'jpg': {'image_url': 'https://cdn.myanimelist.net/images/anime/9/19845.jpg', 'small_image_url': 'https://cdn.myanimelist.net/images/anime/9/19845t.jpg', 'large_image_url': 'https://cdn.myanimelist.net/images/anime/9/19845l.jpg'}, 'webp': {'image_url': 'https://cdn.myanimelist.net/images/anime/9/19845.webp', 'small_image_url': 'https://cdn.myanimelist.net/images/anime/9/19845t.webp', 'large_image_url': 'https://cdn.myanimelist.net/images/anime/9/19845l.webp'}}","{'youtube_id': None, 'url': None, 'embed_url': None, 'images': {'image_url': None, 'small_image_url': None, 'medium_image_url': None, 'large_image_url': None, 'maximum_image_url': None}}","""Kemono no Souja Erin""",Erin,獣の奏者エリン,"['Kemono no Soujya Erin', 'Kemono no Sou-ja Erin', 'The Beast Player Erin']",TV,Novel,50,Finished Airing,False,"{'from': '2009-01-10T00:00:00+00:00', 'to': '2009-12-26T00:00:00+00:00', 'prop': {'from': {'day': 10, 'month': 1, 'year': 2009}, 'to': {'day': 26, 'month': 12, 'year': 2009}}, 'string': 'Jan 10, 2009 to Dec 26, 2009'}",25 min per ep,PG-13 - Teens 13 or older,8.33,17693.0,204,1995,76787,1418,"In the land of Ryoza, the neighboring provinces of Shin-Ou and Tai-Kou have been at peace. Queen Shinou is the ruler of Ryoza and her greatest general, Grand Duke Taikou, defends the kingdom with his army of powerful war-lizards known as the ""Touda."" Although the two regions have enjoyed a long-standing alliance, mounting tensions threaten to spark a fierce civil war. Within Ake, a village in Tai-Kou tasked with raising the Grand Duke's army, lives Erin, a bright girl who spends her days watching the work of her mother Soyon, the village's head Touda doctor. But while under Soyon's care, a disastrous incident befalls the Grand Duke's strongest Touda, and the peace that Erin and her mother had been enjoying vanishes as Soyon is punished severely. In a desperate attempt to save her mother, Erin ends up falling in a river and is swept towards Shin-Ou. Unable to return home, Erin must learn to lead a new life with completely different people, all while hunting for the truth of both beasts and humanity itself, with tensions between the two regions constantly escalating. [Written by MAL Rewrite]",,winter,2009,"{'day': None, 'time': None, 'timezone': None, 'string': 'Unknown'}","[{'mal_id': 111, 'type': 'anime', 'name': 'NHK', 'url': 'https://myanimelist.net/anime/producer/111/NHK'}]",[],"[{'mal_id': 10, 'type': 'anime', 'name': 'Production I.G', 'url': 'https://myanimelist.net/anime/producer/10/Production_IG'}, {'mal_id': 80, 'type': 'anime', 'name': 'Trans Arts', 'url': 'https://myanimelist.net/anime/producer/80/Trans_Arts'}]","[{'mal_id': 8, 'type': 'anime', 'name': 'Drama', 'url': 'https://myanimelist.net/anime/genre/8/Drama'}, {'mal_id': 10, 'type': 'anime', 'name': 'Fantasy', 'url': 'https://myanimelist.net/anime/genre/10/Fantasy'}, {'mal_id': 36, 'type': 'anime', 'name': 'Slice of Life', 'url': 'https://myanimelist.net/anime/genre/36/Slice_of_Life'}]",[],[],[]
5034,https://myanimelist.net/anime/5034/Shikabane_Hime__Kuro,"{'jpg': {'image_url': 'https://cdn.myanimelist.net/images/anime/1125/105989.jpg', 'small_image_url': 'https://cdn.myanimelist.net/images/anime/1125/105989t.jpg', 'large_image_url': 'https://cdn.myanimelist.net/images/anime/1125/105989l.jpg'}, 'webp': {'image_url': 'https://cdn.myanimelist.net/images/anime/1125/105989.webp', 'small_image_url': 'https://cdn.myanimelist.net/images/anime/1125/105989t.webp', 'large_image_url': 'https://cdn.myanimelist.net/images/anime/1125/105989l.webp'}}","{'youtube_id': 'Xvr1z07uIYA', 'url': 'https://www.youtube.com/watch?v=Xvr1z07uIYA', 'embed_url': 'https://www.youtube.com/embed/Xvr1z07uIYA?enablejsapi=1&wmode=opaque&autoplay=1', 'images': {'image_url': 'https://img.youtube.com/vi/Xvr1z07uIYA/default.jpg', 'small_image_url': 'https://img.youtube.com/vi/Xvr1z07uIYA/sddefault.jpg', 'medium_image_url': 'https://img.youtube.com/vi/Xvr1z07uIYA/mqdefault.jpg', 'large_image_url': 'https://img.youtube.com/vi/Xvr1z07uIYA/hqdefault.jpg', 'maximum_image_url': 'https://img.youtube.com/vi/Xvr1z07uIYA/maxresdefault.jpg'}}","""Shikabane Hime: Kuro""",Corpse Princess: Kuro,屍姫 玄,['Shikabane Hime Second Season'],TV,Manga,12,Finished Airing,False,"{'from': '2009-01-01T00:00:00+00:00', 'to': '2009-03-26T00:00:00+00:00', 'prop': {'from': {'day': 1, 'month': 1, 'year': 2009}, 'to': {'day': 26, 'month': 3, 'year': 2009}}, 'string': 'Jan 1, 2009 to Mar 26, 2009'}",24 min per ep,R - 17+ (violence & profanity),7.29,30325.0,2488,2073,72003,111,"A direct continuation of Shikabane Hime: Aka, taking place six months after Tagami Keisei's death at the hands of the Shichisei (Seven Stars), a group of elite Shikabane who act on more than just regrets. As per Keisei's dying wish, Kagami Ouri formed a temporary contract with Makina to save her from degenerating into a Shikabane. Since then, Ouri's been training to become a proper monk so that he can remain contracted to Makina and help her fight against the Shichisei -- the ones who originally killed Makina, the entire Hoshimura family, and now Keisei. However, the traitorous monk Shishidou Akasha has sided with the Shichisei in an attempt to destroy all Shikabane Hime and the entire monk organization that uses them -- Kougon Sect.",,winter,2009,"{'day': None, 'time': None, 'timezone': None, 'string': 'Unknown'}","[{'mal_id': 58, 'type': 'anime', 'name': 'Square Enix', 'url': 'https://myanimelist.net/anime/producer/58/Square_Enix'}, {'mal_id': 92, 'type': 'anime', 'name': 'Starchild Records', 'url': 'https://myanimelist.net/anime/producer/92/Starchild_Records'}]","[{'mal_id': 102, 'type': 'anime', 'name': 'Funimation', 'url': 'https://myanimelist.net/anime/producer/102/Funimation'}]","[{'mal_id': 6, 'type': 'anime', 'name': 'Gainax', 'url': 'https://myanimelist.net/anime/producer/6/Gainax'}, {'mal_id': 91, 'type': 'anime', 'name': 'feel.', 'url': 'https://myanimelist.net/anime/producer/91/feel'}]","[{'mal_id': 1, 'type': 'anime', 'name': 'Action', 'url': 'https://myanimelist.net/anime/genre/1/Action'}, {'mal_id': 14, 'type': 'anime', 'name': 'Horror', 'url': 'https://myanimelist.net/anime/genre/14/Horror'}, {'mal_id': 37, 'type': 'anime', 'name': 'Supernatural', 'url': 'https://myanimelist.net/anime/genre/37/Supernatural'}]",[],[],"[{'mal_id': 27, 'type': 'anime', 'name': 'Shounen', 'url': 'https://myanimelist.net/anime/genre/27/Shounen'}]"
4726,https://myanimelist.net/anime/4726/Druaga_no_Tou__The_Sword_of_Uruk,"{'jpg': {'image_url': 'https://cdn.myanimelist.net/images/anime/9/75647.jpg', 'small_image_url': 'https://cdn.myanimelist.net/images/anime/9/75647t.jpg', 'large_image_url': 'https://cdn.myanimelist.net/images/anime/9/75647l.jpg'}, 'webp': {'image_url': 'https://cdn.myanimelist.net/images/anime/9/75647.webp', 'small_image_url': 'https://cdn.myanimelist.net/images/anime/9/75647t.webp', 'large_image_url': 'https://cdn.myanimelist.net/images/anime/9/75647l.webp'}}","{'youtube_id': 'VLNW7KjjLUU', 'url': 'https://www.youtube.com/watch?v=VLNW7KjjLUU', 'embed_url': 'https://www.youtube.com/embed/VLNW7KjjLUU?enablejsapi=1&wmode=opaque&autoplay=1', 'images': {'image_url': 'https://img.youtube.com/vi/VLNW7KjjLUU/default.jpg', 'small_image_url': 'https://img.youtube.com/vi/VLNW7KjjLUU/sddefault.jpg', 'medium_image_url': 'https://img.youtube.com/vi/VLNW7KjjLUU/mqdefault.jpg', 'large_image_url': 'https://img.youtube.com/vi/VLNW7KjjLUU/hqdefault.jpg', 'maximum_image_url': 'https://img.youtube.com/vi/VLNW7KjjLUU/maxresdefault.jpg'}}","""Druaga no Tou: The Sword of Uruk""",Tower of Druaga: The Sword of Uruk,ドルアーガの塔 ～the Sword of URUK～,[],TV,Game,12,Finished Airing,False,"{'from': '2009-01-09T00:00:00+00:00', 'to': '2009-03-27T00:00:00+00:00', 'prop': {'from': {'day': 9, 'month': 1, 'year': 2009}, 'to': {'day': 27, 'month': 3, 'year': 2009}}, 'string': 'Jan 9, 2009 to Mar 27, 2009'}",24 min per ep,PG-13 - Teens 13 or older,7.21,36099.0,2840,2107,70305,78,"With broken spirits and enigmatic questions that hold no answers lingering, Jil is still trying to figure everything out. Then, a mysterious girl named Kai appears before him and says: ""Take me to the top of the tower."" Kai's request shrouded in ambiguity, Jil will have another chance to work towards completing his destiny and ascend the Tower. With his hopes and aspirations seemingly slipping out of his hands, Jil must rise to the challenge once again on this never-ending adventure. (Source: Crunchyroll)",,winter,2009,"{'day': 'Fridays', 'time': '01:30', 'timezone': 'Asia/Tokyo', 'string': 'Fridays at 01:30 (JST)'}","[{'mal_id': 1597, 'type': 'anime', 'name': 'Sotsu Music Publishing', 'url': 'https://myanimelist.net/anime/producer/1597/Sotsu_Music_Publishing'}]","[{'mal_id': 102, 'type': 'anime', 'name': 'Funimation', 'url': 'https://myanimelist.net/anime/producer/102/Funimation'}]","[{'mal_id': 3, 'type': 'anime', 'name': 'Gonzo', 'url': 'https://myanimelist.net/anime/producer/3/Gonzo'}]","[{'mal_id': 2, 'type': 'anime', 'name': 'Adventure', 'url': 'https://myanimelist.net/anime/genre/2/Adventure'}, {'mal_id': 10, 'type': 'anime', 'name': 'Fantasy', 'url': 'https://myanimelist.net/anime/genre/10/Fantasy'}]",[],[],[]
5028,https://myanimelist.net/anime/5028/Major_S5,"{'jpg': {'image_url': 'https://cdn.myanimelist.net/images/anime/9/75218.jpg', 'small_image_url': 'https://cdn.myanimelist.net/images/anime/9/75218t.jpg', 'large_image_url': 'https://cdn.myanimelist.net/images/anime/9/75218l.jpg'}, 'webp': {'image_url': 'https://cdn.myanimelist.net/images/anime/9/75218.webp', 'small_image_url': 'https://cdn.myanimelist.net/images/anime/9/75218t.webp', 'large_image_url': 'https://cdn.myanimelist.net/images/anime/9/75218l.webp'}}","{'youtube_id': None, 'url': None, 'embed_url': None, 'images': {'image_url': None, 'small_image_url': None, 'medium_image_url': None, 'large_image_url': None, 'maximum_image_url': None}}","""Major S5""",,メジャー,['Major 5th Season'],TV,Manga,25,Finished Airing,False,"{'from': '2009-01-10T00:00:00+00:00', 'to': '2009-06-27T00:00:00+00:00', 'prop': {'from': {'day': 10, 'month': 1, 'year': 2009}, 'to': {'day': 27, 'month': 6, 'year': 2009}}, 'string': 'Jan 10, 2009 to Jun 27, 2009'}",24 min per ep,PG-13 - Teens 13 or older,8.42,37144.0,152,2231,64077,595,"The Baseball World Cup is nearing, and Gorou Honda is eager to represent his country. However, one small problem stands in his way: the team roster has already been selected, and he is not a part of it. Nonetheless, Gorou remains adamant to join. He becomes a practice pitcher for the Japanese national team, hoping to demonstrate his incredible speed and skills to the team's manager. Fortunately, Gorou is given the chance to prove his worth: he must show an impressive performance in the upcoming practice match involving the veteran Japanese team and the young players who hope to replace them. The World Cup will bring together some of the strongest players from around the globe. It will also set the stage for Gorou's long-awaited showdown with his longtime rival, Joe Gibson. [Written by MAL Rewrite]",,winter,2009,"{'day': None, 'time': None, 'timezone': None, 'string': 'Unknown'}","[{'mal_id': 111, 'type': 'anime', 'name': 'NHK', 'url': 'https://myanimelist.net/anime/producer/111/NHK'}]",[],"[{'mal_id': 118, 'type': 'anime', 'name': 'SynergySP', 'url': 'https://myanimelist.net/anime/producer/118/SynergySP'}]","[{'mal_id': 4, 'type': 'anime', 'name': 'Comedy', 'url': 'https://myanimelist.net/anime/genre/4/Comedy'}, {'mal_id': 8, 'type': 'anime', 'name': 'Drama', 'url': 'https://myanimelist.net/anime/genre/8/Drama'}, {'mal_id': 22, 'type': 'anime', 'name': 'Romance', 'url': 'https://myanimelist.net/anime/genre/22/Romance'}, {'mal_id': 30, 'type': 'anime', 'name': 'Sports', 'url': 'https://myanimelist.net/anime/genre/30/Sports'}]",[],[],"[{'mal_id': 27, 'type': 'anime', 'name': 'Shounen', 'url': 'https://myanimelist.net/anime/genre/27/Shounen'}]"
5162,https://myanimelist.net/anime/5162/Minami-ke_Okaeri,"{'jpg': {'image_url': 'https://cdn.myanimelist.net/images/anime/10/11458.jpg', 'small_image_url': 'https://cdn.myanimelist.net/images/anime/10/11458t.jpg', 'large_image_url': 'https://cdn.myanimelist.net/images/anime/10/11458l.jpg'}, 'webp': {'image_url': 'https://cdn.myanimelist.net/images/anime/10/11458.webp', 'small_image_url': 'https://cdn.myanimelist.net/images/anime/10/11458t.webp', 'large_image_url': 'https://cdn.myanimelist.net/images/anime/10/11458l.webp'}}","{'youtube_id': '2iZa79sclmo', 'url': 'https://www.youtube.com/watch?v=2iZa79sclmo', 'embed_url': 'https://www.youtube.com/embed/2iZa79sclmo?enablejsapi=1&wmode=opaque&autoplay=1', 'images': {'image_url': 'https://img.youtube.com/vi/2iZa79sclmo/default.jpg', 'small_image_url': 'https://img.youtube.com/vi/2iZa79sclmo/sddefault.jpg', 'medium_image_url': 'https://img.youtube.com/vi/2iZa79sclmo/mqdefault.jpg', 'large_image_url': 'https://img.youtube.com/vi/2iZa79sclmo/hqdefault.jpg', 'maximum_image_url': 'https://img.youtube.com/vi/2iZa79sclmo/maxresdefault.jpg'}}","""Minami-ke Okaeri""",,みなみけ おかえり,[],TV,Manga,13,Finished Airing,False,"{'from': '2009-01-05T00:00:00+00:00', 'to': '2009-03-30T00:00:00+00:00', 'prop': {'from': {'day': 5, 'month': 1, 'year': 2009}, 'to': {'day': 30, 'month': 3, 'year': 2009}}, 'string': 'Jan 5, 2009 to Mar 30, 2009'}",24 min per ep,PG-13 - Teens 13 or older,7.56,32932.0,1425,2260,62835,53,"A year has passed since Okawari and the three sisters have grown up. Their likings and moods are almost the same. Haruka, the older sister, is a love-giving mother to the younger sisters and a discipline follower. Kana, the middle one, leaves everything to the last possible moment and always gives trouble to the trio. Chiaki, the little one, is the calculating and manipulating one; she likes to be admired and loved by Haruka and always gives trouble to the less blessed Kana. Despite being an unbalanced family, they love each other with all their heart. The family's daily life is as funny as ever; trouble and love are always present. Now it's time to see if they'll survive this age change since Haruka is now a young adult; she has even more responsibilities, having to watch over the young while integrating into the adult life. (Source: ANN)",,winter,2009,"{'day': 'Mondays', 'time': '01:30', 'timezone': 'Asia/Tokyo', 'string': 'Mondays at 01:30 (JST)'}",[],[],"[{'mal_id': 163, 'type': 'anime', 'name': 'asread.', 'url': 'https://myanimelist.net/anime/producer/163/asread'}]","[{'mal_id': 4, 'type': 'anime', 'name': 'Comedy', 'url': 'https://myanimelist.net/anime/genre/4/Comedy'}, {'mal_id': 36, 'type': 'anime', 'name': 'Slice of Life', 'url': 'https://myanimelist.net/anime/genre/36/Slice_of_Life'}]",[],"[{'mal_id': 23, 'type': 'anime', 'name': 'School', 'url': 'https://myanimelist.net/anime/genre/23/School'}]",[]
5074,https://myanimelist.net/anime/5074/Tetsuwan_Birdy_Decode_02,"{'jpg': {'image_url': 'https://cdn.myanimelist.net/images/anime/10/53907.jpg', 'small_image_url': 'https://cdn.myanimelist.net/images/anime/10/53907t.jpg', 'large_image_url': 'https://cdn.myanimelist.net/images/anime/10/53907l.jpg'}, 'webp': {'image_url': 'https://cdn.myanimelist.net/images/anime/10/53907.webp', 'small_image_url': 'https://cdn.myanimelist.net/images/anime/10/53907t.webp', 'large_image_url': 'https://cdn.myanimelist.net/images/anime/10/53907l.webp'}}","{'youtube_id': 'fX1a3fWQ_D4', 'url': 'https://www.youtube.com/watch?v=fX1a3fWQ_D4', 'embed_url': 'https://www.youtube.com/embed/fX1a3fWQ_D4?enablejsapi=1&wmode=opaque&autoplay=1', 'images': {'image_url': 'https://img.youtube.com/vi/fX1a3fWQ_D4/default.jpg', 'small_image_url': 'https://img.youtube.com/vi/fX1a3fWQ_D4/sddefault.jpg', 'medium_image_url': 'https://img.youtube.com/vi/fX1a3fWQ_D4/mqdefault.jpg', 'large_image_url': 'https://img.youtube.com/vi/fX1a3fWQ_D4/hqdefault.jpg', 'maximum_image_url': 'https://img.youtube.com/vi/fX1a3fWQ_D4/maxresdefault.jpg'}}","""Tetsuwan Birdy Decode:02""",Birdy the Mighty: Decode 02,鉄腕バーディー DECODE:02,['Tetsuwan Birdy Decode 2nd Season'],TV,Manga,12,Finished Airing,False,"{'from': '2009-01-10T00:00:00+00:00', 'to': '2009-03-28T00:00:00+00:00', 'prop': {'from': {'day': 10, 'month': 1, 'year': 2009}, 'to': {'day': 28, 'month': 3, 'year': 2009}}, 'string': 'Jan 10, 2009 to Mar 28, 2009'}",23 min per ep,R - 17+ (violence & profanity),7.73,22062.0,1015,2633,48073,245,"Following the Ryunka disaster, Tokyo is left in a period of social turmoil. To make matters worse, the group of aliens directly responsible for the catastrophic event have escaped from the Space Federation and are hiding on Earth. Still sharing a body, Space Federation officer Birdy Cephon Altera, and high schooler, Tsutomu Senkawa, are tasked with capturing the fugitives and bringing them to justice. However, an unexpected crisis develops when the outlaws become targets of an unknown assassin with a vendetta. Now Birdy must deal with the chaos of everyday life and also uncover the identity of the assassin before more escapees fall victim. [Written by MAL Rewrite]",,winter,2009,"{'day': 'Saturdays', 'time': '02:10', 'timezone': 'Asia/Tokyo', 'string': 'Saturdays at 02:10 (JST)'}","[{'mal_id': 17, 'type': 'anime', 'name': 'Aniplex', 'url': 'https://myanimelist.net/anime/producer/17/Aniplex'}, {'mal_id': 1430, 'type': 'anime', 'name': 'Shogakukan', 'url': 'https://myanimelist.net/anime/producer/1430/Shogakukan'}]","[{'mal_id': 102, 'type': 'anime', 'name': 'Funimation', 'url': 'https://myanimelist.net/anime/producer/102/Funimation'}]","[{'mal_id': 56, 'type': 'anime', 'name': 'A-1 Pictures', 'url': 'https://myanimelist.net/anime/producer/56/A-1_Pictures'}]","[{'mal_id': 1, 'type': 'anime', 'name': 'Action', 'url': 'https://myanimelist.net/anime/genre/1/Action'}, {'mal_id': 4, 'type': 'anime', 'name': 'Comedy', 'url': 'https://myanimelist.net/anime/genre/4/Comedy'}, {'mal_id': 24, 'type': 'anime', 'name': 'Sci-Fi', 'url': 'https://myanimelist.net/anime/genre/24/Sci-Fi'}]",[],[],[]
4618,https://myanimelist.net/anime/4618/RideBack,"{'jpg': {'image_url': 'https://cdn.myanimelist.net/images/anime/9/21745.jpg', 'small_image_url': 'https://cdn.myanimelist.net/images/anime/9/21745t.jpg', 'large_image_url': 'https://cdn.myanimelist.net/images/anime/9/21745l.jpg'}, 'webp': {'image_url': 'https://cdn.myanimelist.net/images/anime/9/21745.webp', 'small_image_url': 'https://cdn.myanimelist.net/images/anime/9/21745t.webp', 'large_image_url': 'https://cdn.myanimelist.net/images/anime/9/21745l.webp'}}","{'youtube_id': 'MXC7B-29p4g', 'url': 'https://www.youtube.com/watch?v=MXC7B-29p4g', 'embed_url': 'https://www.youtube.com/embed/MXC7B-29p4g?enablejsapi=1&wmode=opaque&autoplay=1', 'images': {'image_url': 'https://img.youtube.com/vi/MXC7B-29p4g/default.jpg', 'small_image_url': 'https://img.youtube.com/vi/MXC7B-29p4g/sddefault.jpg', 'medium_image_url': 'https://img.youtube.com/vi/MXC7B-29p4g/mqdefault.jpg', 'large_image_url': 'https://img.youtube.com/vi/MXC7B-29p4g/hqdefault.jpg', 'maximum_image_url': 'https://img.youtube.com/vi/MXC7B-29p4g/maxresdefault.jpg'}}","""RideBack""",Ride Back,ライドバック,[],TV,Manga,12,Finished Airing,False,"{'from': '2009-01-12T00:00:00+00:00', 'to': '2009-03-30T00:00:00+00:00', 'prop': {'from': {'day': 12, 'month': 1, 'year': 2009}, 'to': {'day': 30, 'month': 3, 'year': 2009}}, 'string': 'Jan 12, 2009 to Mar 30, 2009'}",24 min per ep,PG-13 - Teens 13 or older,7.28,19364.0,2507,2720,44749,120,"In the future, an organization called the GGP has taken control of the world. Rin Ogata was a promising up-and-coming ballet dancer, but suffered a serious injury while dancing and decided to quit. Years later in college, she comes across a club building and soon finds herself intrigued by a transforming motorcycle-like robotic vehicle called a ""Rideback"". She soon finds that her unique ballet skills with balance and finesse make her a born natural on a Rideback. However, those same skills also get her into serious trouble with the government. (Source: Wikipedia)",,winter,2009,"{'day': 'Mondays', 'time': '00:00', 'timezone': 'Asia/Tokyo', 'string': 'Mondays at 00:00 (JST)'}","[{'mal_id': 31, 'type': 'anime', 'name': 'Geneon Universal Entertainment', 'url': 'https://myanimelist.net/anime/producer/31/Geneon_Universal_Entertainment'}]","[{'mal_id': 102, 'type': 'anime', 'name': 'Funimation', 'url': 'https://myanimelist.net/anime/producer/102/Funimation'}]","[{'mal_id': 11, 'type': 'anime', 'name': 'Madhouse', 'url': 'https://myanimelist.net/anime/producer/11/Madhouse'}]","[{'mal_id': 1, 'type': 'anime', 'name': 'Action', 'url': 'https://myanimelist.net/anime/genre/1/Action'}, {'mal_id': 8, 'type': 'anime', 'name': 'Drama', 'url': 'https://myanimelist.net/anime/genre/8/Drama'}, {'mal_id': 24, 'type': 'anime', 'name': 'Sci-Fi', 'url': 'https://myanimelist.net/anime/genre/24/Sci-Fi'}]",[],"[{'mal_id': 18, 'type': 'anime', 'name': 'Mecha', 'url': 'https://myanimelist.net/anime/genre/18/Mecha'}, {'mal_id': 23, 'type': 'anime', 'name': 'School', 'url': 'https://myanimelist.net/anime/genre/23/School'}]",[]
