mal_id,url,images,trailer,title,title_english,title_japanese,title_synonyms,type,source,episodes,status,airing,aired,duration,rating,score,scored_by,rank,popularity,members,favorites,synopsis,background,season,year,broadcast,producers,licensors,studios,genres,explicit_genres,themes,demographics
5682,https://myanimelist.net/anime/5682/Phantom__Requiem_for_the_Phantom,"{'jpg': {'image_url': 'https://cdn.myanimelist.net/images/anime/8/22470.jpg', 'small_image_url': 'https://cdn.myanimelist.net/images/anime/8/22470t.jpg', 'large_image_url': 'https://cdn.myanimelist.net/images/anime/8/22470l.jpg'}, 'webp': {'image_url': 'https://cdn.myanimelist.net/images/anime/8/22470.webp', 'small_image_url': 'https://cdn.myanimelist.net/images/anime/8/22470t.webp', 'large_image_url': 'https://cdn.myanimelist.net/images/anime/8/22470l.webp'}}","{'youtube_id': 'pHPv47m6hRY', 'url': 'https://www.youtube.com/watch?v=pHPv47m6hRY', 'embed_url': 'https://www.youtube.com/embed/pHPv47m6hRY?enablejsapi=1&wmode=opaque&autoplay=1', 'images': {'image_url': 'https://img.youtube.com/vi/pHPv47m6hRY/default.jpg', 'small_image_url': 'https://img.youtube.com/vi/pHPv47m6hRY/sddefault.jpg', 'medium_image_url': 'https://img.youtube.com/vi/pHPv47m6hRY/mqdefault.jpg', 'large_image_url': 'https://img.youtube.com/vi/pHPv47m6hRY/hqdefault.jpg', 'maximum_image_url': 'https://img.youtube.com/vi/pHPv47m6hRY/maxresdefault.jpg'}}","""Phantom: Requiem for the Phantom""",Phantom: Requiem for the Phantom,Phantom 〜Requiem for the Phantom〜,[],TV,Visual novel,26,Finished Airing,False,"{'from': '2009-04-03T00:00:00+00:00', 'to': '2009-09-25T00:00:00+00:00', 'prop': {'from': {'day': 3, 'month': 4, 'year': 2009}, 'to': {'day': 25, 'month': 9, 'year': 2009}}, 'string': 'Apr 3, 2009 to Sep 25, 2009'}",24 min per ep,R - 17+ (violence & profanity),7.97,112261.0,596,595,303628,4251,"Mafia is rife in America where assassinations are a regular occurrence on the streets. Inferno, a mysterious company, is behind most of these dealings through the use of their near-invincible human weapon, ""Phantom."" One day, a Japanese tourist accidentally witnesses Phantom's latest murder. Desperate to escape, the tourist hides in a secluded building. However, Phantom, revealed to be a young woman named Ein, and the leader of Inferno ""Scythe Master"" captures the tourist and brainwashes him. Given the name ""Zwei,"" this once peaceful tourist is now a puppet of Inferno with no memories. Drawn into a world of lies, deceit, and violence, Zwei must fight to survive, hopefully to one day regain his memories and escape from this world where he is constantly on the brink of death. [Written by MAL Rewrite]",,spring,2009,"{'day': 'Fridays', 'time': '02:15', 'timezone': 'Asia/Tokyo', 'string': 'Fridays at 02:15 (JST)'}","[{'mal_id': 79, 'type': 'anime', 'name': 'Genco', 'url': 'https://myanimelist.net/anime/producer/79/Genco'}]","[{'mal_id': 102, 'type': 'anime', 'name': 'Funimation', 'url': 'https://myanimelist.net/anime/producer/102/Funimation'}]","[{'mal_id': 5, 'type': 'anime', 'name': 'Bee Train', 'url': 'https://myanimelist.net/anime/producer/5/Bee_Train'}]","[{'mal_id': 1, 'type': 'anime', 'name': 'Action', 'url': 'https://myanimelist.net/anime/genre/1/Action'}, {'mal_id': 8, 'type': 'anime', 'name': 'Drama', 'url': 'https://myanimelist.net/anime/genre/8/Drama'}, {'mal_id': 41, 'type': 'anime', 'name': 'Suspense', 'url': 'https://myanimelist.net/anime/genre/41/Suspense'}]",[],[],"[{'mal_id': 42, 'type': 'anime', 'name': 'Seinen', 'url': 'https://myanimelist.net/anime/genre/42/Seinen'}]"
5525,https://myanimelist.net/anime/5525/07-Ghost,"{'jpg': {'image_url': 'https://cdn.myanimelist.net/images/anime/3/22605.jpg', 'small_image_url': 'https://cdn.myanimelist.net/images/anime/3/22605t.jpg', 'large_image_url': 'https://cdn.myanimelist.net/images/anime/3/22605l.jpg'}, 'webp': {'image_url': 'https://cdn.myanimelist.net/images/anime/3/22605.webp', 'small_image_url': 'https://cdn.myanimelist.net/images/anime/3/22605t.webp', 'large_image_url': 'https://cdn.myanimelist.net/images/anime/3/22605l.webp'}}","{'youtube_id': 'vRjlJDDfhJI', 'url': 'https://www.youtube.com/watch?v=vRjlJDDfhJI', 'embed_url': 'https://www.youtube.com/embed/vRjlJDDfhJI?enablejsapi=1&wmode=opaque&autoplay=1', 'images': {'image_url': 'https://img.youtube.com/vi/vRjlJDDfhJI/default.jpg', 'small_image_url': 'https://img.youtube.com/vi/vRjlJDDfhJI/sddefault.jpg', 'medium_image_url': 'https://img.youtube.com/vi/vRjlJDDfhJI/mqdefault.jpg', 'large_image_url': 'https://img.youtube.com/vi/vRjlJDDfhJI/hqdefault.jpg', 'maximum_image_url': 'https://img.youtube.com/vi/vRjlJDDfhJI/maxresdefault.jpg'}}","""07-Ghost""",07-Ghost,セブンゴースト,"['07 Ghost', 'Seven Ghost', '7 Ghosts', 'The Seven Ghosts']",TV,Manga,25,Finished Airing,False,"{'from': '2009-04-07T00:00:00+00:00', 'to': '2009-09-22T00:00:00+00:00', 'prop': {'from': {'day': 7, 'month': 4, 'year': 2009}, 'to': {'day': 22, 'month': 9, 'year': 2009}}, 'string': 'Apr 7, 2009 to Sep 22, 2009'}",23 min per ep,PG-13 - Teens 13 or older,7.21,94029.0,2827,949,198824,2011,"Barsburg Empire's Military Academy is known for training elites who bring victory to the empire. Students of the academy freely utilize an ability called ""Zaiphon"" to fight, while the types of Zaiphon usable depends on the nature of the soldier. Teito Klein, a student at the academy, is one of the most promising soldiers produced. Although ridiculed by everyone for being a sklave (German for slave) with no memories of his past, he is befriended by a fellow student called Mikage. While preparing for the final exam, Teito uncovers a dark secret related to his past. When an attempt to assassinate Ayanami, a high-ranking official who killed his father, fails, Teito is locked away awaiting punishment. Only wanting the best for Teito, Mikage helps him escape. Teito ends up at the 7th District Church where he is taken in by the bishops. It is here that Teito attempts to evade the grasp of Ayanami and the Military, so he can rediscover his memories and learn why he is the person that can change the fate of the world. [Written by MAL Rewrite]",,spring,2009,"{'day': None, 'time': None, 'timezone': None, 'string': 'Unknown'}","[{'mal_id': 1582, 'type': 'anime', 'name': 'Ichijinsha', 'url': 'https://myanimelist.net/anime/producer/1582/Ichijinsha'}]","[{'mal_id': 467, 'type': 'anime', 'name': 'Discotek Media', 'url': 'https://myanimelist.net/anime/producer/467/Discotek_Media'}]","[{'mal_id': 37, 'type': 'anime', 'name': 'Studio Deen', 'url': 'https://myanimelist.net/anime/producer/37/Studio_Deen'}]","[{'mal_id': 1, 'type': 'anime', 'name': 'Action', 'url': 'https://myanimelist.net/anime/genre/1/Action'}, {'mal_id': 10, 'type': 'anime', 'name': 'Fantasy', 'url': 'https://myanimelist.net/anime/genre/10/Fantasy'}]",[],"[{'mal_id': 6, 'type': 'anime', 'name': 'Demons', 'url': 'https://myanimelist.net/anime/genre/6/Demons'}, {'mal_id': 38, 'type': 'anime', 'name': 'Military', 'url': 'https://myanimelist.net/anime/genre/38/Military'}]","[{'mal_id': 43, 'type': 'anime', 'name': 'Josei', 'url': 'https://myanimelist.net/anime/genre/43/Josei'}]"
5355,https://myanimelist.net/anime/5355/Sengoku_Basara,"{'jpg': {'image_url': 'https://cdn.myanimelist.net/images/anime/4/21849.jpg', 'small_image_url': 'https://cdn.myanimelist.net/images/anime/4/21849t.jpg', 'large_image_url': 'https://cdn.myanimelist.net/images/anime/4/21849l.jpg'}, 'webp': {'image_url': 'https://cdn.myanimelist.net/images/anime/4/21849.webp', 'small_image_url': 'https://cdn.myanimelist.net/images/anime/4/21849t.webp', 'large_image_url': 'https://cdn.myanimelist.net/images/anime/4/21849l.webp'}}","{'youtube_id': '80bEnMHZcos', 'url': 'https://www.youtube.com/watch?v=80bEnMHZcos', 'embed_url': 'https://www.youtube.com/embed/80bEnMHZcos?enablejsapi=1&wmode=opaque&autoplay=1', 'images': {'image_url': 'https://img.youtube.com/vi/80bEnMHZcos/default.jpg', 'small_image_url': 'https://img.youtube.com/vi/80bEnMHZcos/sddefault.jpg', 'medium_image_url': 'https://img.youtube.com/vi/80bEnMHZcos/mqdefault.jpg', 'large_image_url': 'https://img.youtube.com/vi/80bEnMHZcos/hqdefault.jpg', 'maximum_image_url': 'https://img.youtube.com/vi/80bEnMHZcos/maxresdefault.jpg'}}","""Sengoku Basara""",Sengoku Basara: Samurai Kings,戦国BASARA,[],TV,Game,12,Finished Airing,False,"{'from': '2009-04-02T00:00:00+00:00', 'to': '2009-06-18T00:00:00+00:00', 'prop': {'from': {'day': 2, 'month': 4, 'year': 2009}, 'to': {'day': 18, 'month': 6, 'year': 2009}}, 'string': 'Apr 2, 2009 to Jun 18, 2009'}",23 min per ep,PG-13 - Teens 13 or older,7.36,58263.0,2135,1229,149712,944,"During Japan's Sengoku period, several powerful warlords fought in politics and in arms with hopes of unifying the country under a central government. Nobunaga Oda had asserted himself as being the most powerful of these rulers by possessing the strength and military resource necessary to conquer all of Japan. Shingen Takeda and his trusted warrior Yukimura Sanada led one of the main clans standing in Nobunaga’s way. One night, Sanada had been ordered to lead a sneak attack against General Kenshin Uesugi, which was then thwarted by Masamune Date and his army. Sanada and Date fought to a draw, which forged a heated rivalry out of their newfound admiration for one another. Nobunaga continues to exert his forces in Sengoku Basara by doubling down on his influence across the country. Sanada and Date find themselves having to put their differences aside in order to quell the rise of Nobunaga and save feudal Japan from his tyrannical reign. Magical, militant, and political powers fly forth as these warriors and leaders clash amongst themselves and the armies of Nobunaga.","Sengoku Basara is a heavily fictionalized account of the Sengoku period of Japanese history, with the series specifically focusing on the later years of this era. Many of the characters in the series are based on historical figures, although numerous changes have been made to their histories and personal relationships.",spring,2009,"{'day': 'Thursdays', 'time': '01:29', 'timezone': 'Asia/Tokyo', 'string': 'Thursdays at 01:29 (JST)'}","[{'mal_id': 53, 'type': 'anime', 'name': 'Dentsu', 'url': 'https://myanimelist.net/anime/producer/53/Dentsu'}, {'mal_id': 109, 'type': 'anime', 'name': 'Shochiku', 'url': 'https://myanimelist.net/anime/producer/109/Shochiku'}, {'mal_id': 143, 'type': 'anime', 'name': 'Mainichi Broadcasting System', 'url': 'https://myanimelist.net/anime/producer/143/Mainichi_Broadcasting_System'}, {'mal_id': 166, 'type': 'anime', 'name': 'Movic', 'url': 'https://myanimelist.net/anime/producer/166/Movic'}, {'mal_id': 464, 'type': 'anime', 'name': 'flying DOG', 'url': 'https://myanimelist.net/anime/producer/464/flying_DOG'}]","[{'mal_id': 102, 'type': 'anime', 'name': 'Funimation', 'url': 'https://myanimelist.net/anime/producer/102/Funimation'}]","[{'mal_id': 10, 'type': 'anime', 'name': 'Production I.G', 'url': 'https://myanimelist.net/anime/producer/10/Production_IG'}]","[{'mal_id': 1, 'type': 'anime', 'name': 'Action', 'url': 'https://myanimelist.net/anime/genre/1/Action'}]",[],"[{'mal_id': 13, 'type': 'anime', 'name': 'Historical', 'url': 'https://myanimelist.net/anime/genre/13/Historical'}, {'mal_id': 17, 'type': 'anime', 'name': 'Martial Arts', 'url': 'https://myanimelist.net/anime/genre/17/Martial_Arts'}, {'mal_id': 21, 'type': 'anime', 'name': 'Samurai', 'url': 'https://myanimelist.net/anime/genre/21/Samurai'}, {'mal_id': 31, 'type': 'anime', 'name': 'Super Power', 'url': 'https://myanimelist.net/anime/genre/31/Super_Power'}]",[]
5507,https://myanimelist.net/anime/5507/Senjou_no_Valkyria,"{'jpg': {'image_url': 'https://cdn.myanimelist.net/images/anime/6/53901.jpg', 'small_image_url': 'https://cdn.myanimelist.net/images/anime/6/53901t.jpg', 'large_image_url': 'https://cdn.myanimelist.net/images/anime/6/53901l.jpg'}, 'webp': {'image_url': 'https://cdn.myanimelist.net/images/anime/6/53901.webp', 'small_image_url': 'https://cdn.myanimelist.net/images/anime/6/53901t.webp', 'large_image_url': 'https://cdn.myanimelist.net/images/anime/6/53901l.webp'}}","{'youtube_id': 'uiRAzl5Q3Ko', 'url': 'https://www.youtube.com/watch?v=uiRAzl5Q3Ko', 'embed_url': 'https://www.youtube.com/embed/uiRAzl5Q3Ko?enablejsapi=1&wmode=opaque&autoplay=1', 'images': {'image_url': 'https://img.youtube.com/vi/uiRAzl5Q3Ko/default.jpg', 'small_image_url': 'https://img.youtube.com/vi/uiRAzl5Q3Ko/sddefault.jpg', 'medium_image_url': 'https://img.youtube.com/vi/uiRAzl5Q3Ko/mqdefault.jpg', 'large_image_url': 'https://img.youtube.com/vi/uiRAzl5Q3Ko/hqdefault.jpg', 'maximum_image_url': 'https://img.youtube.com/vi/uiRAzl5Q3Ko/maxresdefault.jpg'}}","""Senjou no Valkyria""",Valkyria Chronicles,戦場のヴァルキュリア,['Battlefield Valkyria: Gallian Chronicles'],TV,Game,26,Finished Airing,False,"{'from': '2009-04-05T00:00:00+00:00', 'to': '2009-09-27T00:00:00+00:00', 'prop': {'from': {'day': 5, 'month': 4, 'year': 2009}, 'to': {'day': 27, 'month': 9, 'year': 2009}}, 'string': 'Apr 5, 2009 to Sep 27, 2009'}",24 min per ep,PG-13 - Teens 13 or older,7.59,49582.0,1357,1410,123954,593,"In its expansion west to gain resources, the Europan Imperial Alliance invades the neutral Principality of Gallia, seeking to take control of its vast Ragnite deposits. Their strategic advantage, technological superiority, and military might make opposition nonexistent, so they steamroll through the border of the sleepy principality with ease. As Imperial forces run through his quiet hometown, Welkin Gunther and his younger sister Isara jump into action, banding with the leader of the local militia to push the occupational forces out of the village. Quickly retreating to the Gallian capital, they are organized into a unit with the remnants of the militia, tasked with assisting in repelling the Imperial presence from the country. Though unfamiliar with war, the newly formed Squad Seven must defend their country from annexation. But as the battle rages on through the streets of Gallia, ancient secrets will bring the team closer than they'd ever anticipated. [Written by MAL Rewrite]",,spring,2009,"{'day': None, 'time': None, 'timezone': None, 'string': 'Unknown'}","[{'mal_id': 17, 'type': 'anime', 'name': 'Aniplex', 'url': 'https://myanimelist.net/anime/producer/17/Aniplex'}, {'mal_id': 167, 'type': 'anime', 'name': 'Sega', 'url': 'https://myanimelist.net/anime/producer/167/Sega'}, {'mal_id': 765, 'type': 'anime', 'name': 'Sakura Create', 'url': 'https://myanimelist.net/anime/producer/765/Sakura_Create'}]",[],"[{'mal_id': 56, 'type': 'anime', 'name': 'A-1 Pictures', 'url': 'https://myanimelist.net/anime/producer/56/A-1_Pictures'}]","[{'mal_id': 1, 'type': 'anime', 'name': 'Action', 'url': 'https://myanimelist.net/anime/genre/1/Action'}, {'mal_id': 22, 'type': 'anime', 'name': 'Romance', 'url': 'https://myanimelist.net/anime/genre/22/Romance'}]",[],"[{'mal_id': 38, 'type': 'anime', 'name': 'Military', 'url': 'https://myanimelist.net/anime/genre/38/Military'}]",[]
5941,https://myanimelist.net/anime/5941/Cross_Game,"{'jpg': {'image_url': 'https://cdn.myanimelist.net/images/anime/6/22103.jpg', 'small_image_url': 'https://cdn.myanimelist.net/images/anime/6/22103t.jpg', 'large_image_url': 'https://cdn.myanimelist.net/images/anime/6/22103l.jpg'}, 'webp': {'image_url': 'https://cdn.myanimelist.net/images/anime/6/22103.webp', 'small_image_url': 'https://cdn.myanimelist.net/images/anime/6/22103t.webp', 'large_image_url': 'https://cdn.myanimelist.net/images/anime/6/22103l.webp'}}","{'youtube_id': None, 'url': None, 'embed_url': None, 'images': {'image_url': None, 'small_image_url': None, 'medium_image_url': None, 'large_image_url': None, 'maximum_image_url': None}}","""Cross Game""",Cross Game,クロスゲーム,[],TV,Manga,50,Finished Airing,False,"{'from': '2009-04-05T00:00:00+00:00', 'to': '2010-03-28T00:00:00+00:00', 'prop': {'from': {'day': 5, 'month': 4, 'year': 2009}, 'to': {'day': 28, 'month': 3, 'year': 2010}}, 'string': 'Apr 5, 2009 to Mar 28, 2010'}",23 min per ep,PG-13 - Teens 13 or older,8.4,44409.0,163,1523,112310,2855,"Kou Kitamura and Aoba Tsukishima are often at odds—even though their families happen to be close friends and business partners. Although the only child of a sports shop owner, Kou has never been interested in playing baseball. Despite this, he possesses an impressive batting ability honed by frequent visits to the local baseball batting center run by the Tsukushima family. On the other hand, Aoba loves to play baseball and is a star player with exceptional pitching form. However, these two seemingly complete opposites share something very important to them—Wakaba Tsukishima, Aoba's older sister and Kou's destined sweetheart. Admired by the quarrelsome duo, Wakaba often finds herself the catalyst to their never-ending rivalry. But whether or not they realize that they have more in common than either would care to admit, only time will tell. The game of baseball may just be what the pair needs to ultimately overcome their own personal struggles. [Written by MAL Rewrite]",,spring,2009,"{'day': None, 'time': None, 'timezone': None, 'string': 'Unknown'}","[{'mal_id': 16, 'type': 'anime', 'name': 'TV Tokyo', 'url': 'https://myanimelist.net/anime/producer/16/TV_Tokyo'}, {'mal_id': 62, 'type': 'anime', 'name': 'Shogakukan-Shueisha Productions', 'url': 'https://myanimelist.net/anime/producer/62/Shogakukan-Shueisha_Productions'}]",[],"[{'mal_id': 118, 'type': 'anime', 'name': 'SynergySP', 'url': 'https://myanimelist.net/anime/producer/118/SynergySP'}]","[{'mal_id': 4, 'type': 'anime', 'name': 'Comedy', 'url': 'https://myanimelist.net/anime/genre/4/Comedy'}, {'mal_id': 8, 'type': 'anime', 'name': 'Drama', 'url': 'https://myanimelist.net/anime/genre/8/Drama'}, {'mal_id': 22, 'type': 'anime', 'name': 'Romance', 'url': 'https://myanimelist.net/anime/genre/22/Romance'}, {'mal_id': 30, 'type': 'anime', 'name': 'Sports', 'url': 'https://myanimelist.net/anime/genre/30/Sports'}]",[],"[{'mal_id': 23, 'type': 'anime', 'name': 'School', 'url': 'https://myanimelist.net/anime/genre/23/School'}]","[{'mal_id': 27, 'type': 'anime', 'name': 'Shounen', 'url': 'https://myanimelist.net/anime/genre/27/Shounen'}]"
4192,https://myanimelist.net/anime/4192/Hayate_no_Gotoku,"{'jpg': {'image_url': 'https://cdn.myanimelist.net/images/anime/11/75212.jpg', 'small_image_url': 'https://cdn.myanimelist.net/images/anime/11/75212t.jpg', 'large_image_url': 'https://cdn.myanimelist.net/images/anime/11/75212l.jpg'}, 'webp': {'image_url': 'https://cdn.myanimelist.net/images/anime/11/75212.webp', 'small_image_url': 'https://cdn.myanimelist.net/images/anime/11/75212t.webp', 'large_image_url': 'https://cdn.myanimelist.net/images/anime/11/75212l.webp'}}","{'youtube_id': 'HmWtHhwkYwg', 'url': 'https://www.youtube.com/watch?v=HmWtHhwkYwg', 'embed_url': 'https://www.youtube.com/embed/HmWtHhwkYwg?enablejsapi=1&wmode=opaque&autoplay=1', 'images': {'image_url': 'https://img.youtube.com/vi/HmWtHhwkYwg/default.jpg', 'small_image_url': 'https://img.youtube.com/vi/HmWtHhwkYwg/sddefault.jpg', 'medium_image_url': 'https://img.youtube.com/vi/HmWtHhwkYwg/mqdefault.jpg', 'large_image_url': 'https://img.youtube.com/vi/HmWtHhwkYwg/hqdefault.jpg', 'maximum_image_url': 'https://img.youtube.com/vi/HmWtHhwkYwg/maxresdefault.jpg'}}","""Hayate no Gotoku!!""",Hayate the Combat Butler!!,ハヤテのごとく!!,['Hayate the Combat Butler Season 2'],TV,Manga,25,Finished Airing,False,"{'from': '2009-04-04T00:00:00+00:00', 'to': '2009-09-19T00:00:00+00:00', 'prop': {'from': {'day': 4, 'month': 4, 'year': 2009}, 'to': {'day': 19, 'month': 9, 'year': 2009}}, 'string': 'Apr 4, 2009 to Sep 19, 2009'}",24 min per ep,PG-13 - Teens 13 or older,7.69,52248.0,1088,1582,107388,473,"Hayate Ayasaki's misfortune continues to hand him the short end of the stick. Now settled into his routine at the Sanzenins' mansion and Hakuou Academy, the butler continues to work as hard as ever in caring for his young mistress Nagi while studying the school's grueling curriculum—all on top of trying his best to survive the multitude of troubles that life relentlessly pushes onto him. The unintentional chick magnet's life is far from quiet, forced to deal not only with Nagi's yet unnoticed infatuation with him, but also the evergrowing string of accidentally seduced girls—most notably, the exceptionally plain Ayumu Nishizawa, a friend of his before he became a butler, and the diligent Hinagiku Katsura, Hakuou's student council president. While one struggles to gain his affection and the other desperately tries to deny her own, both the girls are going to make the boy's life a little more complicated than it already is. [Written by MAL Rewrite]",,spring,2009,"{'day': 'Saturdays', 'time': '01:23', 'timezone': 'Asia/Tokyo', 'string': 'Saturdays at 01:23 (JST)'}","[{'mal_id': 16, 'type': 'anime', 'name': 'TV Tokyo', 'url': 'https://myanimelist.net/anime/producer/16/TV_Tokyo'}, {'mal_id': 31, 'type': 'anime', 'name': 'Geneon Universal Entertainment', 'url': 'https://myanimelist.net/anime/producer/31/Geneon_Universal_Entertainment'}, {'mal_id': 62, 'type': 'anime', 'name': 'Shogakukan-Shueisha Productions', 'url': 'https://myanimelist.net/anime/producer/62/Shogakukan-Shueisha_Productions'}, {'mal_id': 474, 'type': 'anime', 'name': 'Shogakukan Music & Digital Entertainment', 'url': 'https://myanimelist.net/anime/producer/474/Shogakukan_Music___Digital_Entertainment'}]","[{'mal_id': 376, 'type': 'anime', 'name': 'Sentai Filmworks', 'url': 'https://myanimelist.net/anime/producer/376/Sentai_Filmworks'}]","[{'mal_id': 7, 'type': 'anime', 'name': 'J.C.Staff', 'url': 'https://myanimelist.net/anime/producer/7/JCStaff'}]","[{'mal_id': 1, 'type': 'anime', 'name': 'Action', 'url': 'https://myanimelist.net/anime/genre/1/Action'}, {'mal_id': 4, 'type': 'anime', 'name': 'Comedy', 'url': 'https://myanimelist.net/anime/genre/4/Comedy'}, {'mal_id': 22, 'type': 'anime', 'name': 'Romance', 'url': 'https://myanimelist.net/anime/genre/22/Romance'}]",[],"[{'mal_id': 35, 'type': 'anime', 'name': 'Harem', 'url': 'https://myanimelist.net/anime/genre/35/Harem'}, {'mal_id': 20, 'type': 'anime', 'name': 'Parody', 'url': 'https://myanimelist.net/anime/genre/20/Parody'}]","[{'mal_id': 27, 'type': 'anime', 'name': 'Shounen', 'url': 'https://myanimelist.net/anime/genre/27/Shounen'}]"
5342,https://myanimelist.net/anime/5342/Asura_Cryin,"{'jpg': {'image_url': 'https://cdn.myanimelist.net/images/anime/7/17071.jpg', 'small_image_url': 'https://cdn.myanimelist.net/images/anime/7/17071t.jpg', 'large_image_url': 'https://cdn.myanimelist.net/images/anime/7/17071l.jpg'}, 'webp': {'image_url': 'https://cdn.myanimelist.net/images/anime/7/17071.webp', 'small_image_url': 'https://cdn.myanimelist.net/images/anime/7/17071t.webp', 'large_image_url': 'https://cdn.myanimelist.net/images/anime/7/17071l.webp'}}","{'youtube_id': 'avjKr-VvKjI', 'url': 'https://www.youtube.com/watch?v=avjKr-VvKjI', 'embed_url': 'https://www.youtube.com/embed/avjKr-VvKjI?enablejsapi=1&wmode=opaque&autoplay=1', 'images': {'image_url': 'https://img.youtube.com/vi/avjKr-VvKjI/default.jpg', 'small_image_url': 'https://img.youtube.com/vi/avjKr-VvKjI/sddefault.jpg', 'medium_image_url': 'https://img.youtube.com/vi/avjKr-VvKjI/mqdefault.jpg', 'large_image_url': 'https://img.youtube.com/vi/avjKr-VvKjI/hqdefault.jpg', 'maximum_image_url': 'https://img.youtube.com/vi/avjKr-VvKjI/maxresdefault.jpg'}}","""Asura Cryin'""",,アスラクライン,['Asura Kurain'],TV,Light novel,13,Finished Airing,False,"{'from': '2009-04-02T00:00:00+00:00', 'to': '2009-06-25T00:00:00+00:00', 'prop': {'from': {'day': 2, 'month': 4, 'year': 2009}, 'to': {'day': 25, 'month': 6, 'year': 2009}}, 'string': 'Apr 2, 2009 to Jun 25, 2009'}",24 min per ep,PG-13 - Teens 13 or older,6.92,43559.0,4142,1734,95636,175,"Natsume Tomoharu is a normal high-school student in every way with one exception: he's being followed by the ghost of his best friend, Misao. After moving into his brother's old house, Tomoharu expects to continue living his normal life but is one day left with a mysterious and locked briefcase without any instruction. At first he plans to leave it in storage; however, his house is soon invaded by multiple groups of people after the briefcase. Although still not knowing the purpose of the briefcase, Tomoharu and Misao attempt to escape with it. From there on, Tomoharu tries to learn the secrets behind the briefcase, the connections between it and Misao, and why it has the power to change the world. [Written by MAL Rewrite]",,spring,2009,"{'day': 'Thursdays', 'time': '08:00', 'timezone': 'Asia/Tokyo', 'string': 'Thursdays at 08:00 (JST)'}","[{'mal_id': 16, 'type': 'anime', 'name': 'TV Tokyo', 'url': 'https://myanimelist.net/anime/producer/16/TV_Tokyo'}, {'mal_id': 92, 'type': 'anime', 'name': 'Starchild Records', 'url': 'https://myanimelist.net/anime/producer/92/Starchild_Records'}, {'mal_id': 729, 'type': 'anime', 'name': 'Raku High Student Council', 'url': 'https://myanimelist.net/anime/producer/729/Raku_High_Student_Council'}]","[{'mal_id': 490, 'type': 'anime', 'name': 'Maiden Japan', 'url': 'https://myanimelist.net/anime/producer/490/Maiden_Japan'}]","[{'mal_id': 35, 'type': 'anime', 'name': 'Seven Arcs', 'url': 'https://myanimelist.net/anime/producer/35/Seven_Arcs'}]","[{'mal_id': 1, 'type': 'anime', 'name': 'Action', 'url': 'https://myanimelist.net/anime/genre/1/Action'}, {'mal_id': 37, 'type': 'anime', 'name': 'Supernatural', 'url': 'https://myanimelist.net/anime/genre/37/Supernatural'}]",[],"[{'mal_id': 18, 'type': 'anime', 'name': 'Mecha', 'url': 'https://myanimelist.net/anime/genre/18/Mecha'}]",[]
