mal_id,url,images,trailer,title,title_english,title_japanese,title_synonyms,type,source,episodes,status,airing,aired,duration,rating,score,scored_by,rank,popularity,members,favorites,synopsis,background,season,year,broadcast,producers,licensors,studios,genres,explicit_genres,themes,demographics
5258,https://myanimelist.net/anime/5258/Hajime_no_Ippo__New_Challenger,"{'jpg': {'image_url': 'https://cdn.myanimelist.net/images/anime/8/56617.jpg', 'small_image_url': 'https://cdn.myanimelist.net/images/anime/8/56617t.jpg', 'large_image_url': 'https://cdn.myanimelist.net/images/anime/8/56617l.jpg'}, 'webp': {'image_url': 'https://cdn.myanimelist.net/images/anime/8/56617.webp', 'small_image_url': 'https://cdn.myanimelist.net/images/anime/8/56617t.webp', 'large_image_url': 'https://cdn.myanimelist.net/images/anime/8/56617l.webp'}}","{'youtube_id': None, 'url': None, 'embed_url': None, 'images': {'image_url': None, 'small_image_url': None, 'medium_image_url': None, 'large_image_url': None, 'maximum_image_url': None}}","""Hajime no Ippo: New Challenger""",Fighting Spirit: New Challenger,はじめの一歩 新シリーズ,"['Hajime no Ippo New Series', 'Hajime no Ippo Season II', 'Hajime no Ippo 2']",TV,Manga,26,Finished Airing,False,"{'from': '2009-01-07T00:00:00+00:00', 'to': '2009-07-01T00:00:00+00:00', 'prop': {'from': {'day': 7, 'month': 1, 'year': 2009}, 'to': {'day': 1, 'month': 7, 'year': 2009}}, 'string': 'Jan 7, 2009 to Jul 1, 2009'}",23 min per ep,PG-13 - Teens 13 or older,8.66,136420.0,60,799,234576,1534,"Japanese Featherweight Champion Ippo Makunouchi has successfully defended and retained his title. Meanwhile, his rival, Ichirou Miyata, has resurfaced in Japan, aiming for his own Featherweight belt in the Oriental Pacific Boxing Federation. When the rest of the world comes knocking, however, will Japan's best fighters rise to the challenge and achieve glory at the top? Or will the small island nation be crushed under the weight of greater entities? This time, champions will become challengers issuing a call to the rest of the world and ready to show off their fighting spirit! [Written by MAL Rewrite]",,winter,2009,"{'day': 'Wednesdays', 'time': '01:29', 'timezone': 'Asia/Tokyo', 'string': 'Wednesdays at 01:29 (JST)'}","[{'mal_id': 29, 'type': 'anime', 'name': 'VAP', 'url': 'https://myanimelist.net/anime/producer/29/VAP'}, {'mal_id': 159, 'type': 'anime', 'name': 'Kodansha', 'url': 'https://myanimelist.net/anime/producer/159/Kodansha'}, {'mal_id': 1003, 'type': 'anime', 'name': 'Nippon Television Network', 'url': 'https://myanimelist.net/anime/producer/1003/Nippon_Television_Network'}]",[],"[{'mal_id': 11, 'type': 'anime', 'name': 'Madhouse', 'url': 'https://myanimelist.net/anime/producer/11/Madhouse'}]","[{'mal_id': 4, 'type': 'anime', 'name': 'Comedy', 'url': 'https://myanimelist.net/anime/genre/4/Comedy'}, {'mal_id': 8, 'type': 'anime', 'name': 'Drama', 'url': 'https://myanimelist.net/anime/genre/8/Drama'}, {'mal_id': 30, 'type': 'anime', 'name': 'Sports', 'url': 'https://myanimelist.net/anime/genre/30/Sports'}]",[],[],"[{'mal_id': 27, 'type': 'anime', 'name': 'Shounen', 'url': 'https://myanimelist.net/anime/genre/27/Shounen'}]"
5300,https://myanimelist.net/anime/5300/Zoku_Natsume_Yuujinchou,"{'jpg': {'image_url': 'https://cdn.myanimelist.net/images/anime/4/79738.jpg', 'small_image_url': 'https://cdn.myanimelist.net/images/anime/4/79738t.jpg', 'large_image_url': 'https://cdn.myanimelist.net/images/anime/4/79738l.jpg'}, 'webp': {'image_url': 'https://cdn.myanimelist.net/images/anime/4/79738.webp', 'small_image_url': 'https://cdn.myanimelist.net/images/anime/4/79738t.webp', 'large_image_url': 'https://cdn.myanimelist.net/images/anime/4/79738l.webp'}}","{'youtube_id': 'mea4xITAo_4', 'url': 'https://www.youtube.com/watch?v=mea4xITAo_4', 'embed_url': 'https://www.youtube.com/embed/mea4xITAo_4?enablejsapi=1&wmode=opaque&autoplay=1', 'images': {'image_url': 'https://img.youtube.com/vi/mea4xITAo_4/default.jpg', 'small_image_url': 'https://img.youtube.com/vi/mea4xITAo_4/sddefault.jpg', 'medium_image_url': 'https://img.youtube.com/vi/mea4xITAo_4/mqdefault.jpg', 'large_image_url': 'https://img.youtube.com/vi/mea4xITAo_4/hqdefault.jpg', 'maximum_image_url': 'https://img.youtube.com/vi/mea4xITAo_4/maxresdefault.jpg'}}","""Zoku Natsume Yuujinchou""",Natsume's Book of Friends Season 2,続 夏目友人帳,"['Natsume Yuujinchou Two', 'Natsume Yuujinchou 2', 'Natsume Yujincho 2']",TV,Manga,13,Finished Airing,False,"{'from': '2009-01-06T00:00:00+00:00', 'to': '2009-03-31T00:00:00+00:00', 'prop': {'from': {'day': 6, 'month': 1, 'year': 2009}, 'to': {'day': 31, 'month': 3, 'year': 2009}}, 'string': 'Jan 6, 2009 to Mar 31, 2009'}",24 min per ep,PG-13 - Teens 13 or older,8.55,111765.0,88,834,222757,1350,"As with its prequel, Zoku Natsume Yuujinchou is about Takashi Natsume, a boy who has had the ability to see youkai since he was young, and his bodyguard youkai Madara, nicknamed Nyanko-sensei. Natsume attempts to return names written in his ""Book of Friends"" (which he inherited from his grandmother Reiko) to youkai in his village. Throughout these adventures, he meets some youkai that are friendly, some that want to steal the Book, and some that want to kill him, as Natsume learns about himself and his relationship with these mysterious beings along the way. [Written by MAL Rewrite]",,winter,2009,"{'day': 'Tuesdays', 'time': '01:00', 'timezone': 'Asia/Tokyo', 'string': 'Tuesdays at 01:00 (JST)'}","[{'mal_id': 17, 'type': 'anime', 'name': 'Aniplex', 'url': 'https://myanimelist.net/anime/producer/17/Aniplex'}, {'mal_id': 139, 'type': 'anime', 'name': 'Nihon Ad Systems', 'url': 'https://myanimelist.net/anime/producer/139/Nihon_Ad_Systems'}]","[{'mal_id': 372, 'type': 'anime', 'name': 'NIS America, Inc.', 'url': 'https://myanimelist.net/anime/producer/372/NIS_America_Inc'}]","[{'mal_id': 112, 'type': 'anime', 'name': ""Brain's Base"", 'url': 'https://myanimelist.net/anime/producer/112/Brains_Base'}]","[{'mal_id': 8, 'type': 'anime', 'name': 'Drama', 'url': 'https://myanimelist.net/anime/genre/8/Drama'}, {'mal_id': 36, 'type': 'anime', 'name': 'Slice of Life', 'url': 'https://myanimelist.net/anime/genre/36/Slice_of_Life'}, {'mal_id': 37, 'type': 'anime', 'name': 'Supernatural', 'url': 'https://myanimelist.net/anime/genre/37/Supernatural'}]",[],"[{'mal_id': 6, 'type': 'anime', 'name': 'Demons', 'url': 'https://myanimelist.net/anime/genre/6/Demons'}]","[{'mal_id': 25, 'type': 'anime', 'name': 'Shoujo', 'url': 'https://myanimelist.net/anime/genre/25/Shoujo'}]"
4186,https://myanimelist.net/anime/4186/Chrome_Shelled_Regios,"{'jpg': {'image_url': 'https://cdn.myanimelist.net/images/anime/9/12238.jpg', 'small_image_url': 'https://cdn.myanimelist.net/images/anime/9/12238t.jpg', 'large_image_url': 'https://cdn.myanimelist.net/images/anime/9/12238l.jpg'}, 'webp': {'image_url': 'https://cdn.myanimelist.net/images/anime/9/12238.webp', 'small_image_url': 'https://cdn.myanimelist.net/images/anime/9/12238t.webp', 'large_image_url': 'https://cdn.myanimelist.net/images/anime/9/12238l.webp'}}","{'youtube_id': 'i7dwDoEnUtg', 'url': 'https://www.youtube.com/watch?v=i7dwDoEnUtg', 'embed_url': 'https://www.youtube.com/embed/i7dwDoEnUtg?enablejsapi=1&wmode=opaque&autoplay=1', 'images': {'image_url': 'https://img.youtube.com/vi/i7dwDoEnUtg/default.jpg', 'small_image_url': 'https://img.youtube.com/vi/i7dwDoEnUtg/sddefault.jpg', 'medium_image_url': 'https://img.youtube.com/vi/i7dwDoEnUtg/mqdefault.jpg', 'large_image_url': 'https://img.youtube.com/vi/i7dwDoEnUtg/hqdefault.jpg', 'maximum_image_url': 'https://img.youtube.com/vi/i7dwDoEnUtg/maxresdefault.jpg'}}","""Chrome Shelled Regios""",Chrome Shelled Regios,鋼殻のレギオス,"['Koukaku no Regios', 'Kokaku no Regios']",TV,Light novel,24,Finished Airing,False,"{'from': '2009-01-11T00:00:00+00:00', 'to': '2009-06-21T00:00:00+00:00', 'prop': {'from': {'day': 11, 'month': 1, 'year': 2009}, 'to': {'day': 21, 'month': 6, 'year': 2009}}, 'string': 'Jan 11, 2009 to Jun 21, 2009'}",24 min per ep,R - 17+ (violence & profanity),7.31,95464.0,2356,960,195584,999,"In a post-apocalyptic world overrun with mutated beasts called Limbeekoon or Filth Monsters, humanity is forced to live in large mobile cities called Regios and learn to use special weapons called Dite, by harnessing the power of Kei to defend themselves. In the Academy City of Zuellni, Layfon Alseif is hoping to start a new life and forget his past. However, his past has caught the attention of Karian Loss, the manipulative Student Council President and Nina Antalk, a Military Arts student and Captain of the 17th Military Arts Platoon, who instantly recognizes his abilities and decides he’s the perfect candidate to join her group. However, with a secret past that won’t leave him alone and unknown powers beyond normal, Layfon just might not take it.",,winter,2009,"{'day': None, 'time': None, 'timezone': None, 'string': 'Unknown'}","[{'mal_id': 779, 'type': 'anime', 'name': 'AMG MUSIC', 'url': 'https://myanimelist.net/anime/producer/779/AMG_MUSIC'}]","[{'mal_id': 102, 'type': 'anime', 'name': 'Funimation', 'url': 'https://myanimelist.net/anime/producer/102/Funimation'}]","[{'mal_id': 218, 'type': 'anime', 'name': 'Zexcs', 'url': 'https://myanimelist.net/anime/producer/218/Zexcs'}]","[{'mal_id': 1, 'type': 'anime', 'name': 'Action', 'url': 'https://myanimelist.net/anime/genre/1/Action'}, {'mal_id': 2, 'type': 'anime', 'name': 'Adventure', 'url': 'https://myanimelist.net/anime/genre/2/Adventure'}, {'mal_id': 10, 'type': 'anime', 'name': 'Fantasy', 'url': 'https://myanimelist.net/anime/genre/10/Fantasy'}, {'mal_id': 24, 'type': 'anime', 'name': 'Sci-Fi', 'url': 'https://myanimelist.net/anime/genre/24/Sci-Fi'}]",[],"[{'mal_id': 23, 'type': 'anime', 'name': 'School', 'url': 'https://myanimelist.net/anime/genre/23/School'}]",[]
4999,https://myanimelist.net/anime/4999/Asu_no_Yoichi,"{'jpg': {'image_url': 'https://cdn.myanimelist.net/images/anime/6/20621.jpg', 'small_image_url': 'https://cdn.myanimelist.net/images/anime/6/20621t.jpg', 'large_image_url': 'https://cdn.myanimelist.net/images/anime/6/20621l.jpg'}, 'webp': {'image_url': 'https://cdn.myanimelist.net/images/anime/6/20621.webp', 'small_image_url': 'https://cdn.myanimelist.net/images/anime/6/20621t.webp', 'large_image_url': 'https://cdn.myanimelist.net/images/anime/6/20621l.webp'}}","{'youtube_id': 'Nw3K2Frc8nU', 'url': 'https://www.youtube.com/watch?v=Nw3K2Frc8nU', 'embed_url': 'https://www.youtube.com/embed/Nw3K2Frc8nU?enablejsapi=1&wmode=opaque&autoplay=1', 'images': {'image_url': 'https://img.youtube.com/vi/Nw3K2Frc8nU/default.jpg', 'small_image_url': 'https://img.youtube.com/vi/Nw3K2Frc8nU/sddefault.jpg', 'medium_image_url': 'https://img.youtube.com/vi/Nw3K2Frc8nU/mqdefault.jpg', 'large_image_url': 'https://img.youtube.com/vi/Nw3K2Frc8nU/hqdefault.jpg', 'maximum_image_url': 'https://img.youtube.com/vi/Nw3K2Frc8nU/maxresdefault.jpg'}}","""Asu no Yoichi!""",Samurai Harem,明日のよいち！,['Ashita no Yoichi!'],TV,Manga,12,Finished Airing,False,"{'from': '2009-01-09T00:00:00+00:00', 'to': '2009-03-27T00:00:00+00:00', 'prop': {'from': {'day': 9, 'month': 1, 'year': 2009}, 'to': {'day': 27, 'month': 3, 'year': 2009}}, 'string': 'Jan 9, 2009 to Mar 27, 2009'}",24 min per ep,PG-13 - Teens 13 or older,6.73,102156.0,4981,979,190878,329,"Yoichi Karasuma has spent all of his life in the mountains, training in the Soaring Wind, Divine Wind swordsmanship style. Under his father’s guidance, he is able to master the technique at the age of 17. With nothing left to learn, Yoichi is sent to a new dojo located in the city so he can continue to train and gain an understanding of modern society. Unfortunately, Yoichi has no idea how to act or speak to anyone in the present day and acts like a samurai, complete with odd speech and traditional clothing. As he goes to live with the Ikaruga sisters at the dojo, Yoichi, clueless on how to interact with others, is constantly hurtled in hilarious misunderstandings. Asu no Yoichi! follows Yoichi as he stumbles through his new life and tries to learn how to live in the modern world with his new family. [Written by MAL Rewrite]",,winter,2009,"{'day': 'Fridays', 'time': '01:29', 'timezone': 'Asia/Tokyo', 'string': 'Fridays at 01:29 (JST)'}","[{'mal_id': 104, 'type': 'anime', 'name': 'Lantis', 'url': 'https://myanimelist.net/anime/producer/104/Lantis'}, {'mal_id': 145, 'type': 'anime', 'name': 'TBS', 'url': 'https://myanimelist.net/anime/producer/145/TBS'}, {'mal_id': 166, 'type': 'anime', 'name': 'Movic', 'url': 'https://myanimelist.net/anime/producer/166/Movic'}]","[{'mal_id': 376, 'type': 'anime', 'name': 'Sentai Filmworks', 'url': 'https://myanimelist.net/anime/producer/376/Sentai_Filmworks'}]","[{'mal_id': 48, 'type': 'anime', 'name': 'AIC', 'url': 'https://myanimelist.net/anime/producer/48/AIC'}]","[{'mal_id': 4, 'type': 'anime', 'name': 'Comedy', 'url': 'https://myanimelist.net/anime/genre/4/Comedy'}, {'mal_id': 22, 'type': 'anime', 'name': 'Romance', 'url': 'https://myanimelist.net/anime/genre/22/Romance'}, {'mal_id': 9, 'type': 'anime', 'name': 'Ecchi', 'url': 'https://myanimelist.net/anime/genre/9/Ecchi'}]",[],"[{'mal_id': 35, 'type': 'anime', 'name': 'Harem', 'url': 'https://myanimelist.net/anime/genre/35/Harem'}, {'mal_id': 17, 'type': 'anime', 'name': 'Martial Arts', 'url': 'https://myanimelist.net/anime/genre/17/Martial_Arts'}]","[{'mal_id': 27, 'type': 'anime', 'name': 'Shounen', 'url': 'https://myanimelist.net/anime/genre/27/Shounen'}]"
5030,https://myanimelist.net/anime/5030/Maria†Holic,"{'jpg': {'image_url': 'https://cdn.myanimelist.net/images/anime/1240/111304.jpg', 'small_image_url': 'https://cdn.myanimelist.net/images/anime/1240/111304t.jpg', 'large_image_url': 'https://cdn.myanimelist.net/images/anime/1240/111304l.jpg'}, 'webp': {'image_url': 'https://cdn.myanimelist.net/images/anime/1240/111304.webp', 'small_image_url': 'https://cdn.myanimelist.net/images/anime/1240/111304t.webp', 'large_image_url': 'https://cdn.myanimelist.net/images/anime/1240/111304l.webp'}}","{'youtube_id': 'CLhyx2300Ec', 'url': 'https://www.youtube.com/watch?v=CLhyx2300Ec', 'embed_url': 'https://www.youtube.com/embed/CLhyx2300Ec?enablejsapi=1&wmode=opaque&autoplay=1', 'images': {'image_url': 'https://img.youtube.com/vi/CLhyx2300Ec/default.jpg', 'small_image_url': 'https://img.youtube.com/vi/CLhyx2300Ec/sddefault.jpg', 'medium_image_url': 'https://img.youtube.com/vi/CLhyx2300Ec/mqdefault.jpg', 'large_image_url': 'https://img.youtube.com/vi/CLhyx2300Ec/hqdefault.jpg', 'maximum_image_url': 'https://img.youtube.com/vi/CLhyx2300Ec/maxresdefault.jpg'}}","""Maria†Holic""",Maria†Holic,まりあ†ほりっく,"['Maria+Holic', 'MariaHolic']",TV,Manga,12,Finished Airing,False,"{'from': '2009-01-04T00:00:00+00:00', 'to': '2009-03-22T00:00:00+00:00', 'prop': {'from': {'day': 4, 'month': 1, 'year': 2009}, 'to': {'day': 22, 'month': 3, 'year': 2009}}, 'string': 'Jan 4, 2009 to Mar 22, 2009'}",24 min per ep,PG-13 - Teens 13 or older,7.02,69355.0,3773,1144,161926,474,"In search of true love, Kanako Miyamae transfers to Ame no Kisaki Catholic school, inspired by how her parents fell in love with each other there. There is just one difference, though: because men make Kanako break into hives, she has actually come to the all-girls school to find a partner of the same sex. When she meets the beautiful Mariya Shidou, Kanako believes she has found that special someone; however, there's more to Mariya than meets the eye—it turns out that Kanako's first love is actually a cross-dressing boy. Mariya threatens to expose Kanako's impure intentions unless she keeps his real gender a secret, and to make things worse, he also replaces her original roommate so that he can now keep a close eye on her. Maria†Holic follows Kanako as she looks for love in all the wrong places and searches for the girl of her dreams—that is, if she can survive being Mariya's roommate! [Written by MAL Rewrite]","Aired online on December 26, 2008. The earliest TV airing was on January 4, 2009.",winter,2009,"{'day': None, 'time': None, 'timezone': None, 'string': 'Unknown'}","[{'mal_id': 61, 'type': 'anime', 'name': 'Frontier Works', 'url': 'https://myanimelist.net/anime/producer/61/Frontier_Works'}, {'mal_id': 79, 'type': 'anime', 'name': 'Genco', 'url': 'https://myanimelist.net/anime/producer/79/Genco'}, {'mal_id': 108, 'type': 'anime', 'name': 'Media Factory', 'url': 'https://myanimelist.net/anime/producer/108/Media_Factory'}, {'mal_id': 238, 'type': 'anime', 'name': 'AT-X', 'url': 'https://myanimelist.net/anime/producer/238/AT-X'}, {'mal_id': 313, 'type': 'anime', 'name': 'Omnibus Japan', 'url': 'https://myanimelist.net/anime/producer/313/Omnibus_Japan'}]","[{'mal_id': 376, 'type': 'anime', 'name': 'Sentai Filmworks', 'url': 'https://myanimelist.net/anime/producer/376/Sentai_Filmworks'}]","[{'mal_id': 44, 'type': 'anime', 'name': 'Shaft', 'url': 'https://myanimelist.net/anime/producer/44/Shaft'}]","[{'mal_id': 4, 'type': 'anime', 'name': 'Comedy', 'url': 'https://myanimelist.net/anime/genre/4/Comedy'}, {'mal_id': 26, 'type': 'anime', 'name': 'Girls Love', 'url': 'https://myanimelist.net/anime/genre/26/Girls_Love'}]",[],"[{'mal_id': 20, 'type': 'anime', 'name': 'Parody', 'url': 'https://myanimelist.net/anime/genre/20/Parody'}, {'mal_id': 23, 'type': 'anime', 'name': 'School', 'url': 'https://myanimelist.net/anime/genre/23/School'}]",[]
5112,https://myanimelist.net/anime/5112/Akikan,"{'jpg': {'image_url': 'https://cdn.myanimelist.net/images/anime/5/47093.jpg', 'small_image_url': 'https://cdn.myanimelist.net/images/anime/5/47093t.jpg', 'large_image_url': 'https://cdn.myanimelist.net/images/anime/5/47093l.jpg'}, 'webp': {'image_url': 'https://cdn.myanimelist.net/images/anime/5/47093.webp', 'small_image_url': 'https://cdn.myanimelist.net/images/anime/5/47093t.webp', 'large_image_url': 'https://cdn.myanimelist.net/images/anime/5/47093l.webp'}}","{'youtube_id': None, 'url': None, 'embed_url': None, 'images': {'image_url': None, 'small_image_url': None, 'medium_image_url': None, 'large_image_url': None, 'maximum_image_url': None}}","""Akikan!""",Akikan!,アキカン!,['Empty Can!'],TV,Light novel,12,Finished Airing,False,"{'from': '2009-01-04T00:00:00+00:00', 'to': '2009-03-29T00:00:00+00:00', 'prop': {'from': {'day': 4, 'month': 1, 'year': 2009}, 'to': {'day': 29, 'month': 3, 'year': 2009}}, 'string': 'Jan 4, 2009 to Mar 29, 2009'}",23 min per ep,PG-13 - Teens 13 or older,6.14,56356.0,8006,1473,116604,122,"Hobbies are often a great way of meeting new people, but how could Kakeru Diachi, who collects rare juice cans, have ever suspected that he'd meet a fascinating new girl when he attempted to DRINK her? Naming her Melon, because she's got great melon... soda, Kakeru quickly learns that she's an Akikan—a beautiful girl who's also a special can created to fight other Akikans in a strange experiment to determine what kind of container is better: steel or aluminum! Will becoming involved in this ridiculously twisted research project gone amuck complicate Kakeru's life incredibly? Of course it will, but because Melon's steel body needs carbon dioxide to breathe, he's now stuck with her since she's too CO2 dependent! And when his wealthy, attractive, best childhood friend Najimi gets HER own aluminum Akikan, the trouble really begins! (Source: Sentai Filmworks)",Episode 1 was previewed at Bandai Channel on 12/22/2008. Regular broadcasting began on 01/04/2009.,winter,2009,"{'day': 'Sundays', 'time': '00:00', 'timezone': 'Asia/Tokyo', 'string': 'Sundays at 00:00 (JST)'}","[{'mal_id': 213, 'type': 'anime', 'name': 'Half H.P Studio', 'url': 'https://myanimelist.net/anime/producer/213/Half_HP_Studio'}]","[{'mal_id': 376, 'type': 'anime', 'name': 'Sentai Filmworks', 'url': 'https://myanimelist.net/anime/producer/376/Sentai_Filmworks'}]","[{'mal_id': 112, 'type': 'anime', 'name': ""Brain's Base"", 'url': 'https://myanimelist.net/anime/producer/112/Brains_Base'}]","[{'mal_id': 4, 'type': 'anime', 'name': 'Comedy', 'url': 'https://myanimelist.net/anime/genre/4/Comedy'}, {'mal_id': 10, 'type': 'anime', 'name': 'Fantasy', 'url': 'https://myanimelist.net/anime/genre/10/Fantasy'}, {'mal_id': 22, 'type': 'anime', 'name': 'Romance', 'url': 'https://myanimelist.net/anime/genre/22/Romance'}, {'mal_id': 9, 'type': 'anime', 'name': 'Ecchi', 'url': 'https://myanimelist.net/anime/genre/9/Ecchi'}]",[],[],[]
5079,https://myanimelist.net/anime/5079/Kurokami_The_Animation,"{'jpg': {'image_url': 'https://cdn.myanimelist.net/images/anime/12/78669.jpg', 'small_image_url': 'https://cdn.myanimelist.net/images/anime/12/78669t.jpg', 'large_image_url': 'https://cdn.myanimelist.net/images/anime/12/78669l.jpg'}, 'webp': {'image_url': 'https://cdn.myanimelist.net/images/anime/12/78669.webp', 'small_image_url': 'https://cdn.myanimelist.net/images/anime/12/78669t.webp', 'large_image_url': 'https://cdn.myanimelist.net/images/anime/12/78669l.webp'}}","{'youtube_id': 'hVA5WPxbbPc', 'url': 'https://www.youtube.com/watch?v=hVA5WPxbbPc', 'embed_url': 'https://www.youtube.com/embed/hVA5WPxbbPc?enablejsapi=1&wmode=opaque&autoplay=1', 'images': {'image_url': 'https://img.youtube.com/vi/hVA5WPxbbPc/default.jpg', 'small_image_url': 'https://img.youtube.com/vi/hVA5WPxbbPc/sddefault.jpg', 'medium_image_url': 'https://img.youtube.com/vi/hVA5WPxbbPc/mqdefault.jpg', 'large_image_url': 'https://img.youtube.com/vi/hVA5WPxbbPc/hqdefault.jpg', 'maximum_image_url': 'https://img.youtube.com/vi/hVA5WPxbbPc/maxresdefault.jpg'}}","""Kurokami The Animation""",Kurokami The Animation,黒神 The Animation,"['Kurokami', 'Kurogami', 'Kuro Kami', 'Dark God']",TV,Manga,23,Finished Airing,False,"{'from': '2009-01-09T00:00:00+00:00', 'to': '2009-06-19T00:00:00+00:00', 'prop': {'from': {'day': 9, 'month': 1, 'year': 2009}, 'to': {'day': 19, 'month': 6, 'year': 2009}}, 'string': 'Jan 9, 2009 to Jun 19, 2009'}",23 min per ep,R - 17+ (violence & profanity),7.15,39395.0,3153,1514,113322,309,"High school student Ibuki Keita has been haunted by misfortune for as long as he can remember. For no apparent reason, everyone around him dies tragically. Ultimately, he refuses to become too close to anyone, even his childhood friend Akane. This leaves Keita alone in a life full of misery and disgrace. While eating at his favorite ramen shop one evening, Keita meets a strange young girl named Kuro. Possessing abilities that surpass that of a normal human being, Kuro classifies herself as a Mototsumitama. She explains to Keita about ""Terra,"" a life-energy force split between three identical looking people; a global phenomenon dubbed the ""Doppeliner System."" As a Mototsumitama, Kuro guards the ""Coexistence Equilibrium,"" the beings that protect the flow of Terra around the world. Keita refuses to believe her story, until he is caught up in the crossfire of this hidden world. On the verge of death, he makes a contract with Kuro, unbeknownst to its true meaning. Now he is bound to Kuro, and must be with her at all times. Could Keita's misfortune possibly get any greater? [Written by MAL Rewrite]",,winter,2009,"{'day': 'Fridays', 'time': '02:40', 'timezone': 'Asia/Tokyo', 'string': 'Fridays at 02:40 (JST)'}","[{'mal_id': 23, 'type': 'anime', 'name': 'Bandai Visual', 'url': 'https://myanimelist.net/anime/producer/23/Bandai_Visual'}, {'mal_id': 55, 'type': 'anime', 'name': 'TV Asahi', 'url': 'https://myanimelist.net/anime/producer/55/TV_Asahi'}, {'mal_id': 58, 'type': 'anime', 'name': 'Square Enix', 'url': 'https://myanimelist.net/anime/producer/58/Square_Enix'}]","[{'mal_id': 233, 'type': 'anime', 'name': 'Bandai Entertainment', 'url': 'https://myanimelist.net/anime/producer/233/Bandai_Entertainment'}, {'mal_id': 376, 'type': 'anime', 'name': 'Sentai Filmworks', 'url': 'https://myanimelist.net/anime/producer/376/Sentai_Filmworks'}, {'mal_id': 595, 'type': 'anime', 'name': 'NYAV Post', 'url': 'https://myanimelist.net/anime/producer/595/NYAV_Post'}]","[{'mal_id': 14, 'type': 'anime', 'name': 'Sunrise', 'url': 'https://myanimelist.net/anime/producer/14/Sunrise'}]","[{'mal_id': 1, 'type': 'anime', 'name': 'Action', 'url': 'https://myanimelist.net/anime/genre/1/Action'}]",[],"[{'mal_id': 17, 'type': 'anime', 'name': 'Martial Arts', 'url': 'https://myanimelist.net/anime/genre/17/Martial_Arts'}, {'mal_id': 31, 'type': 'anime', 'name': 'Super Power', 'url': 'https://myanimelist.net/anime/genre/31/Super_Power'}]","[{'mal_id': 42, 'type': 'anime', 'name': 'Seinen', 'url': 'https://myanimelist.net/anime/genre/42/Seinen'}]"
