mal_id,url,images,trailer,title,title_english,title_japanese,title_synonyms,type,source,episodes,status,airing,aired,duration,rating,score,scored_by,rank,popularity,members,favorites,synopsis,background,season,year,broadcast,producers,licensors,studios,genres,explicit_genres,themes,demographics
5150,https://myanimelist.net/anime/5150/Hatsukoi_Limited,"{'jpg': {'image_url': 'https://cdn.myanimelist.net/images/anime/7/15520.jpg', 'small_image_url': 'https://cdn.myanimelist.net/images/anime/7/15520t.jpg', 'large_image_url': 'https://cdn.myanimelist.net/images/anime/7/15520l.jpg'}, 'webp': {'image_url': 'https://cdn.myanimelist.net/images/anime/7/15520.webp', 'small_image_url': 'https://cdn.myanimelist.net/images/anime/7/15520t.webp', 'large_image_url': 'https://cdn.myanimelist.net/images/anime/7/15520l.webp'}}","{'youtube_id': 'RcVbHyjGF8o', 'url': 'https://www.youtube.com/watch?v=RcVbHyjGF8o', 'embed_url': 'https://www.youtube.com/embed/RcVbHyjGF8o?enablejsapi=1&wmode=opaque&autoplay=1', 'images': {'image_url': 'https://img.youtube.com/vi/RcVbHyjGF8o/default.jpg', 'small_image_url': 'https://img.youtube.com/vi/RcVbHyjGF8o/sddefault.jpg', 'medium_image_url': 'https://img.youtube.com/vi/RcVbHyjGF8o/mqdefault.jpg', 'large_image_url': 'https://img.youtube.com/vi/RcVbHyjGF8o/hqdefault.jpg', 'maximum_image_url': 'https://img.youtube.com/vi/RcVbHyjGF8o/maxresdefault.jpg'}}","""Hatsukoi Limited.""",Hatsukoi Limited,初恋限定。,['Hatsukoi Gentei.'],TV,Manga,12,Finished Airing,False,"{'from': '2009-04-12T00:00:00+00:00', 'to': '2009-06-28T00:00:00+00:00', 'prop': {'from': {'day': 12, 'month': 4, 'year': 2009}, 'to': {'day': 28, 'month': 6, 'year': 2009}}, 'string': 'Apr 12, 2009 to Jun 28, 2009'}",24 min per ep,PG-13 - Teens 13 or older,7.29,37005.0,2464,1766,92664,202,"A series relating the intertwined stories about the ""first loves"" of several middle-schoolers and high-schoolers. Each episode tends to focus on a different character, however the developments established during previous episodes continue to play smaller roles in those following. As the series progresses, an array of unusual and unexpected love webs begin to blossom.",,spring,2009,"{'day': 'Sundays', 'time': '00:00', 'timezone': 'Asia/Tokyo', 'string': 'Sundays at 00:00 (JST)'}","[{'mal_id': 1365, 'type': 'anime', 'name': 'Shueisha', 'url': 'https://myanimelist.net/anime/producer/1365/Shueisha'}]","[{'mal_id': 376, 'type': 'anime', 'name': 'Sentai Filmworks', 'url': 'https://myanimelist.net/anime/producer/376/Sentai_Filmworks'}]","[{'mal_id': 7, 'type': 'anime', 'name': 'J.C.Staff', 'url': 'https://myanimelist.net/anime/producer/7/JCStaff'}]","[{'mal_id': 4, 'type': 'anime', 'name': 'Comedy', 'url': 'https://myanimelist.net/anime/genre/4/Comedy'}, {'mal_id': 22, 'type': 'anime', 'name': 'Romance', 'url': 'https://myanimelist.net/anime/genre/22/Romance'}]",[],"[{'mal_id': 23, 'type': 'anime', 'name': 'School', 'url': 'https://myanimelist.net/anime/genre/23/School'}]","[{'mal_id': 27, 'type': 'anime', 'name': 'Shounen', 'url': 'https://myanimelist.net/anime/genre/27/Shounen'}]"
4719,https://myanimelist.net/anime/4719/Queens_Blade__Rurou_no_Senshi,"{'jpg': {'image_url': 'https://cdn.myanimelist.net/images/anime/2/12410.jpg', 'small_image_url': 'https://cdn.myanimelist.net/images/anime/2/12410t.jpg', 'large_image_url': 'https://cdn.myanimelist.net/images/anime/2/12410l.jpg'}, 'webp': {'image_url': 'https://cdn.myanimelist.net/images/anime/2/12410.webp', 'small_image_url': 'https://cdn.myanimelist.net/images/anime/2/12410t.webp', 'large_image_url': 'https://cdn.myanimelist.net/images/anime/2/12410l.webp'}}","{'youtube_id': None, 'url': None, 'embed_url': None, 'images': {'image_url': None, 'small_image_url': None, 'medium_image_url': None, 'large_image_url': None, 'maximum_image_url': None}}","""Queen's Blade: Rurou no Senshi""",Queen's Blade: The Exiled Virgin,クイーンズブレイド 流浪の戦士,"[""Queen's Blade"", 'Sentou Kyoukain Alain']",TV,Other,12,Finished Airing,False,"{'from': '2009-04-02T00:00:00+00:00', 'to': '2009-06-18T00:00:00+00:00', 'prop': {'from': {'day': 2, 'month': 4, 'year': 2009}, 'to': {'day': 18, 'month': 6, 'year': 2009}}, 'string': 'Apr 2, 2009 to Jun 18, 2009'}",24 min per ep,R+ - Mild Nudity,6.15,30635.0,7951,1851,86557,154,"In a land where a queen is chosen every few years solely by winning a tournament, there can be no short supply of formidable opponents. For one woman warrior however, an early defeat clearly shows her that she is lacking in experience though she may be bountiful in body. Fortunately, while defeat could spell one's doom, her life is saved by a powerful stranger. But unfortunately for this savior, less-than-pure motives and shrewd family members mean her reward is a prison cell. Her release is prompt when the unseasoned warrior she saved, tired of her current lifestyle of nobility, sets off to prove herself. (Source: Media Blasters)",,spring,2009,"{'day': None, 'time': None, 'timezone': None, 'string': 'Unknown'}","[{'mal_id': 79, 'type': 'anime', 'name': 'Genco', 'url': 'https://myanimelist.net/anime/producer/79/Genco'}, {'mal_id': 108, 'type': 'anime', 'name': 'Media Factory', 'url': 'https://myanimelist.net/anime/producer/108/Media_Factory'}, {'mal_id': 238, 'type': 'anime', 'name': 'AT-X', 'url': 'https://myanimelist.net/anime/producer/238/AT-X'}, {'mal_id': 306, 'type': 'anime', 'name': 'Magic Capsule', 'url': 'https://myanimelist.net/anime/producer/306/Magic_Capsule'}, {'mal_id': 547, 'type': 'anime', 'name': 'Hobby Japan', 'url': 'https://myanimelist.net/anime/producer/547/Hobby_Japan'}, {'mal_id': 882, 'type': 'anime', 'name': 'Toranoana', 'url': 'https://myanimelist.net/anime/producer/882/Toranoana'}]","[{'mal_id': 250, 'type': 'anime', 'name': 'Media Blasters', 'url': 'https://myanimelist.net/anime/producer/250/Media_Blasters'}]","[{'mal_id': 38, 'type': 'anime', 'name': 'Arms', 'url': 'https://myanimelist.net/anime/producer/38/Arms'}]","[{'mal_id': 1, 'type': 'anime', 'name': 'Action', 'url': 'https://myanimelist.net/anime/genre/1/Action'}, {'mal_id': 2, 'type': 'anime', 'name': 'Adventure', 'url': 'https://myanimelist.net/anime/genre/2/Adventure'}, {'mal_id': 10, 'type': 'anime', 'name': 'Fantasy', 'url': 'https://myanimelist.net/anime/genre/10/Fantasy'}, {'mal_id': 9, 'type': 'anime', 'name': 'Ecchi', 'url': 'https://myanimelist.net/anime/genre/9/Ecchi'}]",[],[],[]
5671,https://myanimelist.net/anime/5671/Saki,"{'jpg': {'image_url': 'https://cdn.myanimelist.net/images/anime/12/73933.jpg', 'small_image_url': 'https://cdn.myanimelist.net/images/anime/12/73933t.jpg', 'large_image_url': 'https://cdn.myanimelist.net/images/anime/12/73933l.jpg'}, 'webp': {'image_url': 'https://cdn.myanimelist.net/images/anime/12/73933.webp', 'small_image_url': 'https://cdn.myanimelist.net/images/anime/12/73933t.webp', 'large_image_url': 'https://cdn.myanimelist.net/images/anime/12/73933l.webp'}}","{'youtube_id': 'ZIhXjVVsPiU', 'url': 'https://www.youtube.com/watch?v=ZIhXjVVsPiU', 'embed_url': 'https://www.youtube.com/embed/ZIhXjVVsPiU?enablejsapi=1&wmode=opaque&autoplay=1', 'images': {'image_url': 'https://img.youtube.com/vi/ZIhXjVVsPiU/default.jpg', 'small_image_url': 'https://img.youtube.com/vi/ZIhXjVVsPiU/sddefault.jpg', 'medium_image_url': 'https://img.youtube.com/vi/ZIhXjVVsPiU/mqdefault.jpg', 'large_image_url': 'https://img.youtube.com/vi/ZIhXjVVsPiU/hqdefault.jpg', 'maximum_image_url': 'https://img.youtube.com/vi/ZIhXjVVsPiU/maxresdefault.jpg'}}","""Saki""",,咲-Saki-,['Saki'],TV,Manga,25,Finished Airing,False,"{'from': '2009-04-06T00:00:00+00:00', 'to': '2009-09-28T00:00:00+00:00', 'prop': {'from': {'day': 6, 'month': 4, 'year': 2009}, 'to': {'day': 28, 'month': 9, 'year': 2009}}, 'string': 'Apr 6, 2009 to Sep 28, 2009'}",24 min per ep,PG-13 - Teens 13 or older,7.46,33140.0,1736,1857,86096,779,"Due to childhood circumstances, first-year high school student Saki Miyanaga hates anything related to mahjong. When she does play the game, she keeps a low profile to avoid standing out. One day, her friend Kyoutarou Suga drags her along to the school's mahjong club. There, she meets Nodoka Haramura, the champion of the previous year's national middle school mahjong championship, and Yuuki Kataoka, a fellow club member. As the club play a few rounds, Saki attempts to hide her talent. However, the club president, Hisa Takei, notices Saki's unusual playstyle. Realizing her potential, she puts Saki's real ability to the test—proving her to be more talented than expected. This revelation damages Nodoka's pride, and their relationship gets off to a rocky start. Saki ends up joining the club, and after clearing up the misunderstandings between her and Nodoka, friendship blooms between them. As Saki slowly warms up to mahjong once again, she and the rest of her club only have one goal—to win nationals! [Written by MAL Rewrite]",,spring,2009,"{'day': 'Mondays', 'time': '02:00', 'timezone': 'Asia/Tokyo', 'string': 'Mondays at 02:00 (JST)'}","[{'mal_id': 16, 'type': 'anime', 'name': 'TV Tokyo', 'url': 'https://myanimelist.net/anime/producer/16/TV_Tokyo'}, {'mal_id': 58, 'type': 'anime', 'name': 'Square Enix', 'url': 'https://myanimelist.net/anime/producer/58/Square_Enix'}, {'mal_id': 64, 'type': 'anime', 'name': 'Sotsu', 'url': 'https://myanimelist.net/anime/producer/64/Sotsu'}, {'mal_id': 104, 'type': 'anime', 'name': 'Lantis', 'url': 'https://myanimelist.net/anime/producer/104/Lantis'}, {'mal_id': 144, 'type': 'anime', 'name': 'Pony Canyon', 'url': 'https://myanimelist.net/anime/producer/144/Pony_Canyon'}, {'mal_id': 460, 'type': 'anime', 'name': 'KlockWorx', 'url': 'https://myanimelist.net/anime/producer/460/KlockWorx'}, {'mal_id': 717, 'type': 'anime', 'name': 'TV Tokyo Music', 'url': 'https://myanimelist.net/anime/producer/717/TV_Tokyo_Music'}, {'mal_id': 727, 'type': 'anime', 'name': 'Kiyosumi High School Mahjong Club', 'url': 'https://myanimelist.net/anime/producer/727/Kiyosumi_High_School_Mahjong_Club'}, {'mal_id': 1597, 'type': 'anime', 'name': 'Sotsu Music Publishing', 'url': 'https://myanimelist.net/anime/producer/1597/Sotsu_Music_Publishing'}]",[],"[{'mal_id': 3, 'type': 'anime', 'name': 'Gonzo', 'url': 'https://myanimelist.net/anime/producer/3/Gonzo'}, {'mal_id': 78, 'type': 'anime', 'name': 'Picture Magic', 'url': 'https://myanimelist.net/anime/producer/78/Picture_Magic'}]","[{'mal_id': 36, 'type': 'anime', 'name': 'Slice of Life', 'url': 'https://myanimelist.net/anime/genre/36/Slice_of_Life'}]",[],"[{'mal_id': 11, 'type': 'anime', 'name': 'Game', 'url': 'https://myanimelist.net/anime/genre/11/Game'}, {'mal_id': 23, 'type': 'anime', 'name': 'School', 'url': 'https://myanimelist.net/anime/genre/23/School'}]",[]
5962,https://myanimelist.net/anime/5962/Metal_Fight_Beyblade,"{'jpg': {'image_url': 'https://cdn.myanimelist.net/images/anime/13/21387.jpg', 'small_image_url': 'https://cdn.myanimelist.net/images/anime/13/21387t.jpg', 'large_image_url': 'https://cdn.myanimelist.net/images/anime/13/21387l.jpg'}, 'webp': {'image_url': 'https://cdn.myanimelist.net/images/anime/13/21387.webp', 'small_image_url': 'https://cdn.myanimelist.net/images/anime/13/21387t.webp', 'large_image_url': 'https://cdn.myanimelist.net/images/anime/13/21387l.webp'}}","{'youtube_id': 'AIRPaWLKRDw', 'url': 'https://www.youtube.com/watch?v=AIRPaWLKRDw', 'embed_url': 'https://www.youtube.com/embed/AIRPaWLKRDw?enablejsapi=1&wmode=opaque&autoplay=1', 'images': {'image_url': 'https://img.youtube.com/vi/AIRPaWLKRDw/default.jpg', 'small_image_url': 'https://img.youtube.com/vi/AIRPaWLKRDw/sddefault.jpg', 'medium_image_url': 'https://img.youtube.com/vi/AIRPaWLKRDw/mqdefault.jpg', 'large_image_url': 'https://img.youtube.com/vi/AIRPaWLKRDw/hqdefault.jpg', 'maximum_image_url': 'https://img.youtube.com/vi/AIRPaWLKRDw/maxresdefault.jpg'}}","""Metal Fight Beyblade""",Metal Fight Beyblade,メタルファイト ベイブレード,['Beyblade: Metal Fusion'],TV,Manga,51,Finished Airing,False,"{'from': '2009-04-05T00:00:00+00:00', 'to': '2010-03-28T00:00:00+00:00', 'prop': {'from': {'day': 5, 'month': 4, 'year': 2009}, 'to': {'day': 28, 'month': 3, 'year': 2010}}, 'string': 'Apr 5, 2009 to Mar 28, 2010'}",25 min per ep,PG - Children,6.8,49504.0,4643,2005,76181,307,"A new cast of characters take on the continued battle between good and evil. Ginga, our hero, and his group of loyal friends take on a dangerous group called the Dark Nebula. The Dark Nebula’s sole mission is to take over the world and unleash their evil upon it; but before they can do so, they must destroy Ginga as he is the only person that’s strong enough to stand in their way. The plot thickens as friends become enemies and enemies become allies. Everything starts and ends with Ginga as he struggles to find the strength to defend his world and the honor of Beyblade. (Source: Beyblade.com)",,spring,2009,"{'day': 'Sundays', 'time': '08:30', 'timezone': 'Asia/Tokyo', 'string': 'Sundays at 08:30 (JST)'}",[],"[{'mal_id': 215, 'type': 'anime', 'name': 'Nelvana', 'url': 'https://myanimelist.net/anime/producer/215/Nelvana'}]","[{'mal_id': 103, 'type': 'anime', 'name': 'Tatsunoko Production', 'url': 'https://myanimelist.net/anime/producer/103/Tatsunoko_Production'}, {'mal_id': 118, 'type': 'anime', 'name': 'SynergySP', 'url': 'https://myanimelist.net/anime/producer/118/SynergySP'}, {'mal_id': 541, 'type': 'anime', 'name': 'Seven', 'url': 'https://myanimelist.net/anime/producer/541/Seven'}]","[{'mal_id': 2, 'type': 'anime', 'name': 'Adventure', 'url': 'https://myanimelist.net/anime/genre/2/Adventure'}, {'mal_id': 4, 'type': 'anime', 'name': 'Comedy', 'url': 'https://myanimelist.net/anime/genre/4/Comedy'}, {'mal_id': 30, 'type': 'anime', 'name': 'Sports', 'url': 'https://myanimelist.net/anime/genre/30/Sports'}]",[],[],"[{'mal_id': 15, 'type': 'anime', 'name': 'Kids', 'url': 'https://myanimelist.net/anime/genre/15/Kids'}]"
3594,https://myanimelist.net/anime/3594/Tears_to_Tiara,"{'jpg': {'image_url': 'https://cdn.myanimelist.net/images/anime/6/18547.jpg', 'small_image_url': 'https://cdn.myanimelist.net/images/anime/6/18547t.jpg', 'large_image_url': 'https://cdn.myanimelist.net/images/anime/6/18547l.jpg'}, 'webp': {'image_url': 'https://cdn.myanimelist.net/images/anime/6/18547.webp', 'small_image_url': 'https://cdn.myanimelist.net/images/anime/6/18547t.webp', 'large_image_url': 'https://cdn.myanimelist.net/images/anime/6/18547l.webp'}}","{'youtube_id': None, 'url': None, 'embed_url': None, 'images': {'image_url': None, 'small_image_url': None, 'medium_image_url': None, 'large_image_url': None, 'maximum_image_url': None}}","""Tears to Tiara""",Tears to Tiara,ティアーズ・トゥ・ティアラ,[],TV,Visual novel,26,Finished Airing,False,"{'from': '2009-04-06T00:00:00+00:00', 'to': '2009-09-28T00:00:00+00:00', 'prop': {'from': {'day': 6, 'month': 4, 'year': 2009}, 'to': {'day': 28, 'month': 9, 'year': 2009}}, 'string': 'Apr 6, 2009 to Sep 28, 2009'}",24 min per ep,PG-13 - Teens 13 or older,7.17,27216.0,3063,2030,74179,173,"As the Holy Empire rises to power, the neighboring lands begin to gradually fall under its control. The Empire's conquest eventually reaches the small island of Erin, home to the Gael tribe. There, a priestess named Riannon is kidnapped to be offered as a living sacrifice to the demon king Arawn, a malevolent being rumored to have caused untold destruction in the past. Riannon's brother, First Warrior Arthur, rescues her, when Arawn suddenly materializes before them as a handsome grey-haired man. Hiding his true identity and remaining enigmatic, Arawn pledges his power and leadership to the tribe's cause and joins Arthur, Riannon, and their merry band of friends—including a talented swordsman, an agile hunter, and a group of ecstatic pixies—as they fight back against the Empire, while uncovering the dark secrets of the land along the way. [Written by MAL Rewrite]",Episode 1 was pre-aired online on April 3rd. TV broadcast began on April 6th.,spring,2009,"{'day': None, 'time': None, 'timezone': None, 'string': 'Unknown'}","[{'mal_id': 715, 'type': 'anime', 'name': 'Dwango', 'url': 'https://myanimelist.net/anime/producer/715/Dwango'}, {'mal_id': 775, 'type': 'anime', 'name': 'Bushiroad', 'url': 'https://myanimelist.net/anime/producer/775/Bushiroad'}, {'mal_id': 777, 'type': 'anime', 'name': 'Showgate', 'url': 'https://myanimelist.net/anime/producer/777/Showgate'}, {'mal_id': 1261, 'type': 'anime', 'name': 'Good Smile Company', 'url': 'https://myanimelist.net/anime/producer/1261/Good_Smile_Company'}]","[{'mal_id': 376, 'type': 'anime', 'name': 'Sentai Filmworks', 'url': 'https://myanimelist.net/anime/producer/376/Sentai_Filmworks'}]","[{'mal_id': 314, 'type': 'anime', 'name': 'White Fox', 'url': 'https://myanimelist.net/anime/producer/314/White_Fox'}]","[{'mal_id': 1, 'type': 'anime', 'name': 'Action', 'url': 'https://myanimelist.net/anime/genre/1/Action'}, {'mal_id': 2, 'type': 'anime', 'name': 'Adventure', 'url': 'https://myanimelist.net/anime/genre/2/Adventure'}, {'mal_id': 10, 'type': 'anime', 'name': 'Fantasy', 'url': 'https://myanimelist.net/anime/genre/10/Fantasy'}]",[],[],[]
5734,https://myanimelist.net/anime/5734/Tayutama__Kiss_on_My_Deity,"{'jpg': {'image_url': 'https://cdn.myanimelist.net/images/anime/2/11972.jpg', 'small_image_url': 'https://cdn.myanimelist.net/images/anime/2/11972t.jpg', 'large_image_url': 'https://cdn.myanimelist.net/images/anime/2/11972l.jpg'}, 'webp': {'image_url': 'https://cdn.myanimelist.net/images/anime/2/11972.webp', 'small_image_url': 'https://cdn.myanimelist.net/images/anime/2/11972t.webp', 'large_image_url': 'https://cdn.myanimelist.net/images/anime/2/11972l.webp'}}","{'youtube_id': 'CjG8v21hLko', 'url': 'https://www.youtube.com/watch?v=CjG8v21hLko', 'embed_url': 'https://www.youtube.com/embed/CjG8v21hLko?enablejsapi=1&wmode=opaque&autoplay=1', 'images': {'image_url': 'https://img.youtube.com/vi/CjG8v21hLko/default.jpg', 'small_image_url': 'https://img.youtube.com/vi/CjG8v21hLko/sddefault.jpg', 'medium_image_url': 'https://img.youtube.com/vi/CjG8v21hLko/mqdefault.jpg', 'large_image_url': 'https://img.youtube.com/vi/CjG8v21hLko/hqdefault.jpg', 'maximum_image_url': 'https://img.youtube.com/vi/CjG8v21hLko/maxresdefault.jpg'}}","""Tayutama: Kiss on My Deity""",,タユタマ -Kiss on my Deity-,['Tayutama'],TV,Visual novel,12,Finished Airing,False,"{'from': '2009-04-06T00:00:00+00:00', 'to': '2009-06-22T00:00:00+00:00', 'prop': {'from': {'day': 6, 'month': 4, 'year': 2009}, 'to': {'day': 22, 'month': 6, 'year': 2009}}, 'string': 'Apr 6, 2009 to Jun 22, 2009'}",23 min per ep,PG-13 - Teens 13 or older,6.74,27732.0,4943,2207,65767,104,"Yuuri Mito is a typical, normal Japanese teenager. He goes to school, works on people's motorcycles and performs exorcisms. Okay, that last part's a little bit unusual, but his family lives in a shrine and they do that sort of thing. Still, you would think he'd know enough to be careful with an ancient relic he finds in the woods, especially when a mysterious goddess appears and tells him to leave it alone. Unfortunately, despite Mito's best efforts, the seal gets broken anyway and a number of dangerous ""tayuti"" that it held in stasis get loose. This is bad. Mito also ends up with a beautiful goddess girl who decides that she's going to marry him. This might not be so bad. if he wasn't already caught up in the middle of a war between the entities he's released. The flesh may be weak but the spirit's more than willing to compensate. (Source: Sentai Filmworks)",,spring,2009,"{'day': 'Mondays', 'time': '00:30', 'timezone': 'Asia/Tokyo', 'string': 'Mondays at 00:30 (JST)'}","[{'mal_id': 108, 'type': 'anime', 'name': 'Media Factory', 'url': 'https://myanimelist.net/anime/producer/108/Media_Factory'}, {'mal_id': 711, 'type': 'anime', 'name': 'Delfi Sound', 'url': 'https://myanimelist.net/anime/producer/711/Delfi_Sound'}]","[{'mal_id': 376, 'type': 'anime', 'name': 'Sentai Filmworks', 'url': 'https://myanimelist.net/anime/producer/376/Sentai_Filmworks'}]","[{'mal_id': 300, 'type': 'anime', 'name': 'SILVER LINK.', 'url': 'https://myanimelist.net/anime/producer/300/SILVER_LINK'}]","[{'mal_id': 22, 'type': 'anime', 'name': 'Romance', 'url': 'https://myanimelist.net/anime/genre/22/Romance'}, {'mal_id': 37, 'type': 'anime', 'name': 'Supernatural', 'url': 'https://myanimelist.net/anime/genre/37/Supernatural'}]",[],"[{'mal_id': 35, 'type': 'anime', 'name': 'Harem', 'url': 'https://myanimelist.net/anime/genre/35/Harem'}]",[]
5835,https://myanimelist.net/anime/5835/Hanasakeru_Seishounen,"{'jpg': {'image_url': 'https://cdn.myanimelist.net/images/anime/1094/116584.jpg', 'small_image_url': 'https://cdn.myanimelist.net/images/anime/1094/116584t.jpg', 'large_image_url': 'https://cdn.myanimelist.net/images/anime/1094/116584l.jpg'}, 'webp': {'image_url': 'https://cdn.myanimelist.net/images/anime/1094/116584.webp', 'small_image_url': 'https://cdn.myanimelist.net/images/anime/1094/116584t.webp', 'large_image_url': 'https://cdn.myanimelist.net/images/anime/1094/116584l.webp'}}","{'youtube_id': None, 'url': None, 'embed_url': None, 'images': {'image_url': None, 'small_image_url': None, 'medium_image_url': None, 'large_image_url': None, 'maximum_image_url': None}}","""Hanasakeru Seishounen""",,花咲ける青少年,['Hanasakeru Seishonen'],TV,Manga,39,Finished Airing,False,"{'from': '2009-04-05T00:00:00+00:00', 'to': '2010-02-14T00:00:00+00:00', 'prop': {'from': {'day': 5, 'month': 4, 'year': 2009}, 'to': {'day': 14, 'month': 2, 'year': 2010}}, 'string': 'Apr 5, 2009 to Feb 14, 2010'}",24 min per ep,PG-13 - Teens 13 or older,7.71,22223.0,1050,2243,63388,549,"Kajika Louisa Kugami Burnsworth is the only daughter of Harry Burnsworth, an influential and respected industrialist who has the power to move the world. There was a threat on Kajika’s life when she was just two years old, and her mother died protecting her. After this tragic incident, Harry sent his only child to an isolated island, Giviolle, where she was raised by the island’s native, Maria. Kajika’s companions during her time there include a white leopard named Mustafa and a boy named Li Ren Fang, who visited her two or three times a year. Kajika, now fourteen, returns to her father's side, only to be told to begin a game to find her future husband. Harry makes sure that Kajika willingly participates in this game by telling her that she needs to face the harshness of her fate along with the man she chooses to be her husband. She needs to decide among the three candidates that Harry has personally chosen, but it won’t be easy. Kajika must figure out who they are and where they are without any information to go on except that they all possess an irresistible brilliance and charm. All the while, the men aren't even aware that they are the chosen ones. Kajika must also choose wisely, as her partner has to willingly accept her to be his bride. Hansakeru Seishounen revolves around endearing love, intense passion, noble friendship, undying loyalty, family relations, and political intrigue. The heaviness of Kajika’s fate is real, the threat on Kajika’s life is inevitable, and the husband game is more than just a mere game. Harry needs to find a suitable partner to protect his daughter before someone discovers Kajika’s deep secret—a secret even she is unaware of.",,spring,2009,"{'day': None, 'time': None, 'timezone': None, 'string': 'Unknown'}",[],"[{'mal_id': 467, 'type': 'anime', 'name': 'Discotek Media', 'url': 'https://myanimelist.net/anime/producer/467/Discotek_Media'}]","[{'mal_id': 1, 'type': 'anime', 'name': 'Studio Pierrot', 'url': 'https://myanimelist.net/anime/producer/1/Studio_Pierrot'}]","[{'mal_id': 8, 'type': 'anime', 'name': 'Drama', 'url': 'https://myanimelist.net/anime/genre/8/Drama'}, {'mal_id': 22, 'type': 'anime', 'name': 'Romance', 'url': 'https://myanimelist.net/anime/genre/22/Romance'}]",[],[],"[{'mal_id': 25, 'type': 'anime', 'name': 'Shoujo', 'url': 'https://myanimelist.net/anime/genre/25/Shoujo'}]"
