mal_id,url,images,trailer,title,title_english,title_japanese,title_synonyms,type,source,episodes,status,airing,aired,duration,rating,score,scored_by,rank,popularity,members,favorites,synopsis,background,season,year,broadcast,producers,licensors,studios,genres,explicit_genres,themes,demographics
5485,https://myanimelist.net/anime/5485/Shin_Mazinger_Shougeki_Z-hen,"{'jpg': {'image_url': 'https://cdn.myanimelist.net/images/anime/1022/92865.jpg', 'small_image_url': 'https://cdn.myanimelist.net/images/anime/1022/92865t.jpg', 'large_image_url': 'https://cdn.myanimelist.net/images/anime/1022/92865l.jpg'}, 'webp': {'image_url': 'https://cdn.myanimelist.net/images/anime/1022/92865.webp', 'small_image_url': 'https://cdn.myanimelist.net/images/anime/1022/92865t.webp', 'large_image_url': 'https://cdn.myanimelist.net/images/anime/1022/92865l.webp'}}","{'youtube_id': None, 'url': None, 'embed_url': None, 'images': {'image_url': None, 'small_image_url': None, 'medium_image_url': None, 'large_image_url': None, 'maximum_image_url': None}}","""Shin Mazinger Shougeki! Z-hen""",Mazinger Edition Z: The Impact!,Ｚマジンガー; 真マジンガー 衝撃！Z編,"['Shin Mazinger Shogeki! Z-hen', 'True Mazinger', 'Z Mazinger']",TV,Manga,26,Finished Airing,False,"{'from': '2009-04-04T00:00:00+00:00', 'to': '2009-09-26T00:00:00+00:00', 'prop': {'from': {'day': 4, 'month': 4, 'year': 2009}, 'to': {'day': 26, 'month': 9, 'year': 2009}}, 'string': 'Apr 4, 2009 to Sep 26, 2009'}",23 min per ep,R - 17+ (violence & profanity),7.67,4285.0,1154,4755,13956,147,"Set in the near future, humanity enters another energy revolution following the discovery of Photon Power. Derived from the ore discovered under the foothills of Mt. Fuji, its intended use was to solve the world's energy problems with its unimaginable power. Seeking this energy is Dr. Hell, a madman craving world domination who with his subordinates Baron Ashura, Count Brocken and Viscount Pygman, commands an army of mechanical beasts excavated from the ruins of ancient Greece to seize the Photon Power Lab for himself. Meeting the attack head on is the hot-blooded teenager Kabuto Kouji, who pilots the Photon Powered robot built by his grandfather, Mazinger Z. But in this battle between Dr. Hell and the Kabuto family, many legends surrounding the Mycenaean Civilization and Bardos Island, as well as the secrets of Mazinger Z remain shrouded in mystery. A new series based on the mecha show that started it all, Mazinger Z. Shin Mazinger Shougeki! Z-Hen starts over from the beginning with a new cast, to tell a new story unrelated to the original show. (Source: shin-mazinger.com)",,spring,2009,"{'day': None, 'time': None, 'timezone': None, 'string': 'Unknown'}","[{'mal_id': 104, 'type': 'anime', 'name': 'Lantis', 'url': 'https://myanimelist.net/anime/producer/104/Lantis'}, {'mal_id': 921, 'type': 'anime', 'name': 'Dynamic Planning', 'url': 'https://myanimelist.net/anime/producer/921/Dynamic_Planning'}]","[{'mal_id': 467, 'type': 'anime', 'name': 'Discotek Media', 'url': 'https://myanimelist.net/anime/producer/467/Discotek_Media'}]","[{'mal_id': 322, 'type': 'anime', 'name': 'Bee Media', 'url': 'https://myanimelist.net/anime/producer/322/Bee_Media'}, {'mal_id': 325, 'type': 'anime', 'name': 'Code', 'url': 'https://myanimelist.net/anime/producer/325/Code'}]","[{'mal_id': 1, 'type': 'anime', 'name': 'Action', 'url': 'https://myanimelist.net/anime/genre/1/Action'}, {'mal_id': 8, 'type': 'anime', 'name': 'Drama', 'url': 'https://myanimelist.net/anime/genre/8/Drama'}]",[],"[{'mal_id': 18, 'type': 'anime', 'name': 'Mecha', 'url': 'https://myanimelist.net/anime/genre/18/Mecha'}, {'mal_id': 31, 'type': 'anime', 'name': 'Super Power', 'url': 'https://myanimelist.net/anime/genre/31/Super_Power'}]","[{'mal_id': 27, 'type': 'anime', 'name': 'Shounen', 'url': 'https://myanimelist.net/anime/genre/27/Shounen'}]"
6008,https://myanimelist.net/anime/6008/Jewelpet,"{'jpg': {'image_url': 'https://cdn.myanimelist.net/images/anime/9/20954.jpg', 'small_image_url': 'https://cdn.myanimelist.net/images/anime/9/20954t.jpg', 'large_image_url': 'https://cdn.myanimelist.net/images/anime/9/20954l.jpg'}, 'webp': {'image_url': 'https://cdn.myanimelist.net/images/anime/9/20954.webp', 'small_image_url': 'https://cdn.myanimelist.net/images/anime/9/20954t.webp', 'large_image_url': 'https://cdn.myanimelist.net/images/anime/9/20954l.webp'}}","{'youtube_id': None, 'url': None, 'embed_url': None, 'images': {'image_url': None, 'small_image_url': None, 'medium_image_url': None, 'large_image_url': None, 'maximum_image_url': None}}","""Jewelpet""",Jewelpet,ジュエルペット,['Jewel Pet'],TV,Original,52,Finished Airing,False,"{'from': '2009-04-05T00:00:00+00:00', 'to': '2010-03-28T00:00:00+00:00', 'prop': {'from': {'day': 5, 'month': 4, 'year': 2009}, 'to': {'day': 28, 'month': 3, 'year': 2010}}, 'string': 'Apr 5, 2009 to Mar 28, 2010'}",23 min per ep,PG - Children,6.73,2846.0,5002,5341,10411,29,"When what looks to be a cluster of shooting stars appear in the sky, Rinko Kougyoku and her friend Minami each make a wish. What the girls truly saw were not stars, but 'Jewel Charms' falling to the Earth. These charms were created by three magicians in a magical world names Jewel Land, each housing one of its many native Jewelpets. Although these creatures are free to roam the world in their original form, the magicians sometimes turn them into charms so that they can be carried around with great ease. Most Jewelpets don't find this troublesome, but once a mischievous bunny by the name of Ruby feels overly claustrophobic, she devises her escape. One day, the magicians decide to move the Jewelpets, and task a pelican with delivering them to the Dream Forest. All is well until a strong gust of wind disorients the bird, who then drops all of the charms that he was carrying. Instead of heading towards the Dream Forest, all the Jewelpets but Ruby fall to Rinko’s home city on Earth. Someone must go and retrieve them all, and as Ruby was the worst-behaved of the bunch, she is given the task of going to Earth. When Ruby reaches Earth in the form of a red Jewel Charm, she falls into Rinko’s water glass, and thus begins a rather unexpected adventure. Rinko, Minami, and Ruby form an alliance to search and gather all of the fallen charms, encountering strange creatures and tons of helpful allies along the way. Will they be able to succesfully bring the Jewelpets home safely, or is Earth full of more danger than they had expected?",,spring,2009,"{'day': 'Sundays', 'time': '09:30', 'timezone': 'Asia/Tokyo', 'string': 'Sundays at 09:30 (JST)'}","[{'mal_id': 100, 'type': 'anime', 'name': 'TV Osaka', 'url': 'https://myanimelist.net/anime/producer/100/TV_Osaka'}, {'mal_id': 150, 'type': 'anime', 'name': 'Sanrio', 'url': 'https://myanimelist.net/anime/producer/150/Sanrio'}, {'mal_id': 2135, 'type': 'anime', 'name': 'Imagine', 'url': 'https://myanimelist.net/anime/producer/2135/Imagine'}]",[],"[{'mal_id': 126, 'type': 'anime', 'name': 'Studio Comet', 'url': 'https://myanimelist.net/anime/producer/126/Studio_Comet'}]","[{'mal_id': 10, 'type': 'anime', 'name': 'Fantasy', 'url': 'https://myanimelist.net/anime/genre/10/Fantasy'}]",[],[],"[{'mal_id': 25, 'type': 'anime', 'name': 'Shoujo', 'url': 'https://myanimelist.net/anime/genre/25/Shoujo'}]"
6117,https://myanimelist.net/anime/6117/Gokujou_Mecha_Mote_Iinchou,"{'jpg': {'image_url': 'https://cdn.myanimelist.net/images/anime/12/13986.jpg', 'small_image_url': 'https://cdn.myanimelist.net/images/anime/12/13986t.jpg', 'large_image_url': 'https://cdn.myanimelist.net/images/anime/12/13986l.jpg'}, 'webp': {'image_url': 'https://cdn.myanimelist.net/images/anime/12/13986.webp', 'small_image_url': 'https://cdn.myanimelist.net/images/anime/12/13986t.webp', 'large_image_url': 'https://cdn.myanimelist.net/images/anime/12/13986l.webp'}}","{'youtube_id': None, 'url': None, 'embed_url': None, 'images': {'image_url': None, 'small_image_url': None, 'medium_image_url': None, 'large_image_url': None, 'maximum_image_url': None}}","""Gokujou!! Mecha Mote Iinchou""",The Best!! Extremely Cool Student Council President,極上!!めちゃモテ委員長,['Gokujo!! Mecha Mote Iincho'],TV,Manga,51,Finished Airing,False,"{'from': '2009-04-04T00:00:00+00:00', 'to': '2010-03-27T00:00:00+00:00', 'prop': {'from': {'day': 4, 'month': 4, 'year': 2009}, 'to': {'day': 27, 'month': 3, 'year': 2010}}, 'string': 'Apr 4, 2009 to Mar 27, 2010'}",24 min per ep,PG - Children,6.34,1562.0,7005,6138,7406,16,"Mimi Kitagami is a kind, level-headed girl who aims to be the best, coolest student council president of her high school class. However, three trouble-making boys are always causing her grief — and she has a one-sided crush on one of the boys, Ushio Toujou. (Source: ANN)",,spring,2009,"{'day': 'Saturdays', 'time': '09:00', 'timezone': 'Asia/Tokyo', 'string': 'Saturdays at 09:00 (JST)'}","[{'mal_id': 16, 'type': 'anime', 'name': 'TV Tokyo', 'url': 'https://myanimelist.net/anime/producer/16/TV_Tokyo'}, {'mal_id': 62, 'type': 'anime', 'name': 'Shogakukan-Shueisha Productions', 'url': 'https://myanimelist.net/anime/producer/62/Shogakukan-Shueisha_Productions'}, {'mal_id': 913, 'type': 'anime', 'name': 'Ryukyu Asahi Broadcasting', 'url': 'https://myanimelist.net/anime/producer/913/Ryukyu_Asahi_Broadcasting'}]",[],"[{'mal_id': 118, 'type': 'anime', 'name': 'SynergySP', 'url': 'https://myanimelist.net/anime/producer/118/SynergySP'}]","[{'mal_id': 4, 'type': 'anime', 'name': 'Comedy', 'url': 'https://myanimelist.net/anime/genre/4/Comedy'}, {'mal_id': 22, 'type': 'anime', 'name': 'Romance', 'url': 'https://myanimelist.net/anime/genre/22/Romance'}]",[],"[{'mal_id': 23, 'type': 'anime', 'name': 'School', 'url': 'https://myanimelist.net/anime/genre/23/School'}]","[{'mal_id': 25, 'type': 'anime', 'name': 'Shoujo', 'url': 'https://myanimelist.net/anime/genre/25/Shoujo'}]"
5494,https://myanimelist.net/anime/5494/Konnichiwa_Anne__Before_Green_Gables,"{'jpg': {'image_url': 'https://cdn.myanimelist.net/images/anime/13/54069.jpg', 'small_image_url': 'https://cdn.myanimelist.net/images/anime/13/54069t.jpg', 'large_image_url': 'https://cdn.myanimelist.net/images/anime/13/54069l.jpg'}, 'webp': {'image_url': 'https://cdn.myanimelist.net/images/anime/13/54069.webp', 'small_image_url': 'https://cdn.myanimelist.net/images/anime/13/54069t.webp', 'large_image_url': 'https://cdn.myanimelist.net/images/anime/13/54069l.webp'}}","{'youtube_id': None, 'url': None, 'embed_url': None, 'images': {'image_url': None, 'small_image_url': None, 'medium_image_url': None, 'large_image_url': None, 'maximum_image_url': None}}","""Konnichiwa Anne: Before Green Gables""",Before Green Gables,こんにちは アン ～Before Green Gables,"['Anne of Green Gables Prequel', 'Akage no Anne Prequel']",TV,Novel,39,Finished Airing,False,"{'from': '2009-04-05T00:00:00+00:00', 'to': '2009-12-27T00:00:00+00:00', 'prop': {'from': {'day': 5, 'month': 4, 'year': 2009}, 'to': {'day': 27, 'month': 12, 'year': 2009}}, 'string': 'Apr 5, 2009 to Dec 27, 2009'}",20 min per ep,G - All Ages,7.6,1574.0,1333,6523,6326,36,The story of what happened to Anne Shirley before she was adopted.,,spring,2009,"{'day': 'Sundays', 'time': '19:30', 'timezone': 'Asia/Tokyo', 'string': 'Sundays at 19:30 (JST)'}",[],[],"[{'mal_id': 22, 'type': 'anime', 'name': 'Nippon Animation', 'url': 'https://myanimelist.net/anime/producer/22/Nippon_Animation'}]","[{'mal_id': 8, 'type': 'anime', 'name': 'Drama', 'url': 'https://myanimelist.net/anime/genre/8/Drama'}, {'mal_id': 36, 'type': 'anime', 'name': 'Slice of Life', 'url': 'https://myanimelist.net/anime/genre/36/Slice_of_Life'}]",[],"[{'mal_id': 13, 'type': 'anime', 'name': 'Historical', 'url': 'https://myanimelist.net/anime/genre/13/Historical'}]","[{'mal_id': 15, 'type': 'anime', 'name': 'Kids', 'url': 'https://myanimelist.net/anime/genre/15/Kids'}]"
5983,https://myanimelist.net/anime/5983/Higepiyo,"{'jpg': {'image_url': 'https://cdn.myanimelist.net/images/anime/5/23125.jpg', 'small_image_url': 'https://cdn.myanimelist.net/images/anime/5/23125t.jpg', 'large_image_url': 'https://cdn.myanimelist.net/images/anime/5/23125l.jpg'}, 'webp': {'image_url': 'https://cdn.myanimelist.net/images/anime/5/23125.webp', 'small_image_url': 'https://cdn.myanimelist.net/images/anime/5/23125t.webp', 'large_image_url': 'https://cdn.myanimelist.net/images/anime/5/23125l.webp'}}","{'youtube_id': None, 'url': None, 'embed_url': None, 'images': {'image_url': None, 'small_image_url': None, 'medium_image_url': None, 'large_image_url': None, 'maximum_image_url': None}}","""Higepiyo""",,"ひげぴよ, ヒゲぴよ",['Hige Piyo'],TV,Original,39,Finished Airing,False,"{'from': '2009-04-03T00:00:00+00:00', 'to': '2010-02-19T00:00:00+00:00', 'prop': {'from': {'day': 3, 'month': 4, 'year': 2009}, 'to': {'day': 19, 'month': 2, 'year': 2010}}, 'string': 'Apr 3, 2009 to Feb 19, 2010'}",5 min per ep,PG - Children,7.1,2063.0,3398,6812,5666,16,"Higepiyo is a little chick with a mustache, who is seeking to aquire masculinity with his friend Hiroshi but ends up being entangled with a skin of heated milk.",,spring,2009,"{'day': None, 'time': None, 'timezone': None, 'string': 'Unknown'}","[{'mal_id': 17, 'type': 'anime', 'name': 'Aniplex', 'url': 'https://myanimelist.net/anime/producer/17/Aniplex'}]",[],"[{'mal_id': 290, 'type': 'anime', 'name': 'Kinema Citrus', 'url': 'https://myanimelist.net/anime/producer/290/Kinema_Citrus'}]","[{'mal_id': 4, 'type': 'anime', 'name': 'Comedy', 'url': 'https://myanimelist.net/anime/genre/4/Comedy'}]",[],[],[]
6130,https://myanimelist.net/anime/6130/Marie___Gali,"{'jpg': {'image_url': 'https://cdn.myanimelist.net/images/anime/11/22111.jpg', 'small_image_url': 'https://cdn.myanimelist.net/images/anime/11/22111t.jpg', 'large_image_url': 'https://cdn.myanimelist.net/images/anime/11/22111l.jpg'}, 'webp': {'image_url': 'https://cdn.myanimelist.net/images/anime/11/22111.webp', 'small_image_url': 'https://cdn.myanimelist.net/images/anime/11/22111t.webp', 'large_image_url': 'https://cdn.myanimelist.net/images/anime/11/22111l.webp'}}","{'youtube_id': None, 'url': None, 'embed_url': None, 'images': {'image_url': None, 'small_image_url': None, 'medium_image_url': None, 'large_image_url': None, 'maximum_image_url': None}}","""Marie & Gali""",,マリー & ガリー,"['Marie to Gali', 'Marie and Gali']",TV,Original,40,Finished Airing,False,"{'from': '2009-03-31T00:00:00+00:00', 'to': '2010-03-23T00:00:00+00:00', 'prop': {'from': {'day': 31, 'month': 3, 'year': 2009}, 'to': {'day': 23, 'month': 3, 'year': 2010}}, 'string': 'Mar 31, 2009 to Mar 23, 2010'}",5 min per ep,PG-13 - Teens 13 or older,6.36,594.0,6924,7866,3916,4,"Marika is a gothic lolita who somehow ends up in the mysterious town of Galihabara. There she meets different famous scientists like Galileo Galilei, Marie Skłodowska Curie and Sir Isaac Newton.",,spring,2009,"{'day': None, 'time': None, 'timezone': None, 'string': 'Unknown'}","[{'mal_id': 111, 'type': 'anime', 'name': 'NHK', 'url': 'https://myanimelist.net/anime/producer/111/NHK'}]",[],"[{'mal_id': 18, 'type': 'anime', 'name': 'Toei Animation', 'url': 'https://myanimelist.net/anime/producer/18/Toei_Animation'}]","[{'mal_id': 4, 'type': 'anime', 'name': 'Comedy', 'url': 'https://myanimelist.net/anime/genre/4/Comedy'}]",[],[],[]
6116,https://myanimelist.net/anime/6116/Mainichi_Kaasan,"{'jpg': {'image_url': 'https://cdn.myanimelist.net/images/anime/4/70931.jpg', 'small_image_url': 'https://cdn.myanimelist.net/images/anime/4/70931t.jpg', 'large_image_url': 'https://cdn.myanimelist.net/images/anime/4/70931l.jpg'}, 'webp': {'image_url': 'https://cdn.myanimelist.net/images/anime/4/70931.webp', 'small_image_url': 'https://cdn.myanimelist.net/images/anime/4/70931t.webp', 'large_image_url': 'https://cdn.myanimelist.net/images/anime/4/70931l.webp'}}","{'youtube_id': None, 'url': None, 'embed_url': None, 'images': {'image_url': None, 'small_image_url': None, 'medium_image_url': None, 'large_image_url': None, 'maximum_image_url': None}}","""Mainichi Kaasan""",Kaasan: Mom's Life,毎日かあさん,"['Mainichi Kaa-san', 'Every Day Mom']",TV,Manga,142,Finished Airing,False,"{'from': '2009-04-01T00:00:00+00:00', 'to': '2012-03-25T00:00:00+00:00', 'prop': {'from': {'day': 1, 'month': 4, 'year': 2009}, 'to': {'day': 25, 'month': 3, 'year': 2012}}, 'string': 'Apr 1, 2009 to Mar 25, 2012'}",25 min per ep,PG - Children,7.28,566.0,2542,8719,2824,24,Based on Rieko Saibara's humorous semi-autobiographical manga about her life raising her two children.,,spring,2009,"{'day': None, 'time': None, 'timezone': None, 'string': 'Unknown'}","[{'mal_id': 139, 'type': 'anime', 'name': 'Nihon Ad Systems', 'url': 'https://myanimelist.net/anime/producer/139/Nihon_Ad_Systems'}]",[],[],"[{'mal_id': 4, 'type': 'anime', 'name': 'Comedy', 'url': 'https://myanimelist.net/anime/genre/4/Comedy'}, {'mal_id': 36, 'type': 'anime', 'name': 'Slice of Life', 'url': 'https://myanimelist.net/anime/genre/36/Slice_of_Life'}]",[],[],[]
6525,https://myanimelist.net/anime/6525/Peeping_Life,"{'jpg': {'image_url': 'https://cdn.myanimelist.net/images/anime/10/23512.jpg', 'small_image_url': 'https://cdn.myanimelist.net/images/anime/10/23512t.jpg', 'large_image_url': 'https://cdn.myanimelist.net/images/anime/10/23512l.jpg'}, 'webp': {'image_url': 'https://cdn.myanimelist.net/images/anime/10/23512.webp', 'small_image_url': 'https://cdn.myanimelist.net/images/anime/10/23512t.webp', 'large_image_url': 'https://cdn.myanimelist.net/images/anime/10/23512l.webp'}}","{'youtube_id': None, 'url': None, 'embed_url': None, 'images': {'image_url': None, 'small_image_url': None, 'medium_image_url': None, 'large_image_url': None, 'maximum_image_url': None}}","""Peeping Life""",Peeping Life: The Perfect Edition,ピーピング・ライフ,[],TV,Original,10,Finished Airing,False,"{'from': '2009-05-14T00:00:00+00:00', 'to': '2009-08-11T00:00:00+00:00', 'prop': {'from': {'day': 14, 'month': 5, 'year': 2009}, 'to': {'day': 11, 'month': 8, 'year': 2009}}, 'string': 'May 14, 2009 to Aug 11, 2009'}",5 min per ep,G - All Ages,5.22,749.0,11237,8746,2798,5,Slice of life comedy about pitfalls of Japanese society.,,spring,2009,"{'day': None, 'time': None, 'timezone': None, 'string': 'Unknown'}","[{'mal_id': 291, 'type': 'anime', 'name': 'CoMix Wave Films', 'url': 'https://myanimelist.net/anime/producer/291/CoMix_Wave_Films'}]",[],[],"[{'mal_id': 4, 'type': 'anime', 'name': 'Comedy', 'url': 'https://myanimelist.net/anime/genre/4/Comedy'}, {'mal_id': 36, 'type': 'anime', 'name': 'Slice of Life', 'url': 'https://myanimelist.net/anime/genre/36/Slice_of_Life'}]",[],[],[]
6131,https://myanimelist.net/anime/6131/Charady_no_Joke_na_Mainichi,"{'jpg': {'image_url': 'https://cdn.myanimelist.net/images/anime/2/13420.jpg', 'small_image_url': 'https://cdn.myanimelist.net/images/anime/2/13420t.jpg', 'large_image_url': 'https://cdn.myanimelist.net/images/anime/2/13420l.jpg'}, 'webp': {'image_url': 'https://cdn.myanimelist.net/images/anime/2/13420.webp', 'small_image_url': 'https://cdn.myanimelist.net/images/anime/2/13420t.webp', 'large_image_url': 'https://cdn.myanimelist.net/images/anime/2/13420l.webp'}}","{'youtube_id': None, 'url': None, 'embed_url': None, 'images': {'image_url': None, 'small_image_url': None, 'medium_image_url': None, 'large_image_url': None, 'maximum_image_url': None}}","""Charady no Joke na Mainichi""",,キャラディのジョークな毎日,"['Charady no Jokena Mainichi', ""Charady's Daily Joke""]",TV,Original,365,Finished Airing,False,"{'from': '2009-04-01T00:00:00+00:00', 'to': '2010-03-31T00:00:00+00:00', 'prop': {'from': {'day': 1, 'month': 4, 'year': 2009}, 'to': {'day': 31, 'month': 3, 'year': 2010}}, 'string': 'Apr 1, 2009 to Mar 31, 2010'}",3 min per ep,PG-13 - Teens 13 or older,5.22,269.0,11248,9165,2379,1,"A gravure idol, Asada Misako, plays the main character Charady. Other characters are played by the students of Kyoto University of Art and Design Department of Character Designing. It is a short comedy animation about jokes from all parts of the world.",,spring,2009,"{'day': None, 'time': None, 'timezone': None, 'string': 'Unknown'}",[],[],[],"[{'mal_id': 4, 'type': 'anime', 'name': 'Comedy', 'url': 'https://myanimelist.net/anime/genre/4/Comedy'}]",[],[],[]
6119,https://myanimelist.net/anime/6119/Cookin_Idol_Ai_Mai_Main,"{'jpg': {'image_url': 'https://cdn.myanimelist.net/images/anime/13/73550.jpg', 'small_image_url': 'https://cdn.myanimelist.net/images/anime/13/73550t.jpg', 'large_image_url': 'https://cdn.myanimelist.net/images/anime/13/73550l.jpg'}, 'webp': {'image_url': 'https://cdn.myanimelist.net/images/anime/13/73550.webp', 'small_image_url': 'https://cdn.myanimelist.net/images/anime/13/73550t.webp', 'large_image_url': 'https://cdn.myanimelist.net/images/anime/13/73550l.webp'}}","{'youtube_id': None, 'url': None, 'embed_url': None, 'images': {'image_url': None, 'small_image_url': None, 'medium_image_url': None, 'large_image_url': None, 'maximum_image_url': None}}","""Cookin' Idol Ai! Mai! Main!""",,クッキンアイドル　アイ！マイ！まいん！,['Cooking Idol'],TV,Original,305,Finished Airing,False,"{'from': '2009-03-30T00:00:00+00:00', 'to': '2013-03-22T00:00:00+00:00', 'prop': {'from': {'day': 30, 'month': 3, 'year': 2009}, 'to': {'day': 22, 'month': 3, 'year': 2013}}, 'string': 'Mar 30, 2009 to Mar 22, 2013'}",6 min per ep,PG - Children,6.19,227.0,7726,9837,1849,3,"Cooking Idol teaches children how to cook through instruction of the main character, MAIN. The show itself is divided into an animated segment featuring MAIN, and a live-action segment featuring the voice actor of MAIN, Fukuhara Haruka, as she practices the cooking herself. The live-action segment is not included in the avg episode duration.",,spring,2009,"{'day': None, 'time': None, 'timezone': None, 'string': 'Unknown'}","[{'mal_id': 111, 'type': 'anime', 'name': 'NHK', 'url': 'https://myanimelist.net/anime/producer/111/NHK'}, {'mal_id': 139, 'type': 'anime', 'name': 'Nihon Ad Systems', 'url': 'https://myanimelist.net/anime/producer/139/Nihon_Ad_Systems'}]",[],"[{'mal_id': 37, 'type': 'anime', 'name': 'Studio Deen', 'url': 'https://myanimelist.net/anime/producer/37/Studio_Deen'}]","[{'mal_id': 4, 'type': 'anime', 'name': 'Comedy', 'url': 'https://myanimelist.net/anime/genre/4/Comedy'}, {'mal_id': 47, 'type': 'anime', 'name': 'Gourmet', 'url': 'https://myanimelist.net/anime/genre/47/Gourmet'}]",[],[],"[{'mal_id': 15, 'type': 'anime', 'name': 'Kids', 'url': 'https://myanimelist.net/anime/genre/15/Kids'}]"
6658,https://myanimelist.net/anime/6658/Unko-san__Tsuiteru_Hito_ni_Shika_Mienai_Yousei,"{'jpg': {'image_url': 'https://cdn.myanimelist.net/images/anime/5/79398.jpg', 'small_image_url': 'https://cdn.myanimelist.net/images/anime/5/79398t.jpg', 'large_image_url': 'https://cdn.myanimelist.net/images/anime/5/79398l.jpg'}, 'webp': {'image_url': 'https://cdn.myanimelist.net/images/anime/5/79398.webp', 'small_image_url': 'https://cdn.myanimelist.net/images/anime/5/79398t.webp', 'large_image_url': 'https://cdn.myanimelist.net/images/anime/5/79398l.webp'}}","{'youtube_id': None, 'url': None, 'embed_url': None, 'images': {'image_url': None, 'small_image_url': None, 'medium_image_url': None, 'large_image_url': None, 'maximum_image_url': None}}","""Unko-san: Tsuiteru Hito ni Shika Mienai Yousei""",,うんこさん ツイてる人にしか見えない妖精,[],TV,Original,13,Finished Airing,False,"{'from': '2009-03-18T00:00:00+00:00', 'to': '2009-07-20T00:00:00+00:00', 'prop': {'from': {'day': 18, 'month': 3, 'year': 2009}, 'to': {'day': 20, 'month': 7, 'year': 2009}}, 'string': 'Mar 18, 2009 to Jul 20, 2009'}",2 min per ep,PG - Children,4.97,128.0,11689,12284,701,1,"Anime has as a fairy brown dispenser of some 'of his good fortune to those less fortunate. Unko-san lived on Lucky Island together with her friends, all of them with a different personality and culture.",,spring,2009,"{'day': None, 'time': None, 'timezone': None, 'string': 'Unknown'}",[],[],"[{'mal_id': 432, 'type': 'anime', 'name': 'Kachidoki Studio', 'url': 'https://myanimelist.net/anime/producer/432/Kachidoki_Studio'}]","[{'mal_id': 4, 'type': 'anime', 'name': 'Comedy', 'url': 'https://myanimelist.net/anime/genre/4/Comedy'}]",[],[],[]
