mal_id,url,images,trailer,title,title_english,title_japanese,title_synonyms,type,source,episodes,status,airing,aired,duration,rating,score,scored_by,rank,popularity,members,favorites,synopsis,background,season,year,broadcast,producers,licensors,studios,genres,explicit_genres,themes,demographics
5114,https://myanimelist.net/anime/5114/Fullmetal_Alchemist__Brotherhood,"{'jpg': {'image_url': 'https://cdn.myanimelist.net/images/anime/1223/96541.jpg', 'small_image_url': 'https://cdn.myanimelist.net/images/anime/1223/96541t.jpg', 'large_image_url': 'https://cdn.myanimelist.net/images/anime/1223/96541l.jpg'}, 'webp': {'image_url': 'https://cdn.myanimelist.net/images/anime/1223/96541.webp', 'small_image_url': 'https://cdn.myanimelist.net/images/anime/1223/96541t.webp', 'large_image_url': 'https://cdn.myanimelist.net/images/anime/1223/96541l.webp'}}","{'youtube_id': '--IcmZkvL0Q', 'url': 'https://www.youtube.com/watch?v=--IcmZkvL0Q', 'embed_url': 'https://www.youtube.com/embed/--IcmZkvL0Q?enablejsapi=1&wmode=opaque&autoplay=1', 'images': {'image_url': 'https://img.youtube.com/vi/--IcmZkvL0Q/default.jpg', 'small_image_url': 'https://img.youtube.com/vi/--IcmZkvL0Q/sddefault.jpg', 'medium_image_url': 'https://img.youtube.com/vi/--IcmZkvL0Q/mqdefault.jpg', 'large_image_url': 'https://img.youtube.com/vi/--IcmZkvL0Q/hqdefault.jpg', 'maximum_image_url': 'https://img.youtube.com/vi/--IcmZkvL0Q/maxresdefault.jpg'}}","""Fullmetal Alchemist: Brotherhood""",Fullmetal Alchemist: Brotherhood,鋼の錬金術師 FULLMETAL ALCHEMIST,"['Hagane no Renkinjutsushi: Fullmetal Alchemist', 'Fullmetal Alchemist (2009)', 'FMA', 'FMAB']",TV,Manga,64,Finished Airing,False,"{'from': '2009-04-05T00:00:00+00:00', 'to': '2010-07-04T00:00:00+00:00', 'prop': {'from': {'day': 5, 'month': 4, 'year': 2009}, 'to': {'day': 4, 'month': 7, 'year': 2010}}, 'string': 'Apr 5, 2009 to Jul 4, 2010'}",24 min per ep,R - 17+ (violence & profanity),9.15,1697354.0,1,3,2791144,195919,"After a horrific alchemy experiment goes wrong in the Elric household, brothers Edward and Alphonse are left in a catastrophic new reality. Ignoring the alchemical principle banning human transmutation, the boys attempted to bring their recently deceased mother back to life. Instead, they suffered brutal personal loss: Alphonse's body disintegrated while Edward lost a leg and then sacrificed an arm to keep Alphonse's soul in the physical realm by binding it to a hulking suit of armor. The brothers are rescued by their neighbor Pinako Rockbell and her granddaughter Winry. Known as a bio-mechanical engineering prodigy, Winry creates prosthetic limbs for Edward by utilizing ""automail,"" a tough, versatile metal used in robots and combat armor. After years of training, the Elric brothers set off on a quest to restore their bodies by locating the Philosopher's Stone—a powerful gem that allows an alchemist to defy the traditional laws of Equivalent Exchange. As Edward becomes an infamous alchemist and gains the nickname ""Fullmetal,"" the boys' journey embroils them in a growing conspiracy that threatens the fate of the world. [Written by MAL Rewrite]",,spring,2009,"{'day': 'Sundays', 'time': '17:00', 'timezone': 'Asia/Tokyo', 'string': 'Sundays at 17:00 (JST)'}","[{'mal_id': 17, 'type': 'anime', 'name': 'Aniplex', 'url': 'https://myanimelist.net/anime/producer/17/Aniplex'}, {'mal_id': 58, 'type': 'anime', 'name': 'Square Enix', 'url': 'https://myanimelist.net/anime/producer/58/Square_Enix'}, {'mal_id': 143, 'type': 'anime', 'name': 'Mainichi Broadcasting System', 'url': 'https://myanimelist.net/anime/producer/143/Mainichi_Broadcasting_System'}, {'mal_id': 1155, 'type': 'anime', 'name': 'Studio Moriken', 'url': 'https://myanimelist.net/anime/producer/1155/Studio_Moriken'}]","[{'mal_id': 102, 'type': 'anime', 'name': 'Funimation', 'url': 'https://myanimelist.net/anime/producer/102/Funimation'}, {'mal_id': 493, 'type': 'anime', 'name': 'Aniplex of America', 'url': 'https://myanimelist.net/anime/producer/493/Aniplex_of_America'}]","[{'mal_id': 4, 'type': 'anime', 'name': 'Bones', 'url': 'https://myanimelist.net/anime/producer/4/Bones'}]","[{'mal_id': 1, 'type': 'anime', 'name': 'Action', 'url': 'https://myanimelist.net/anime/genre/1/Action'}, {'mal_id': 2, 'type': 'anime', 'name': 'Adventure', 'url': 'https://myanimelist.net/anime/genre/2/Adventure'}, {'mal_id': 4, 'type': 'anime', 'name': 'Comedy', 'url': 'https://myanimelist.net/anime/genre/4/Comedy'}, {'mal_id': 8, 'type': 'anime', 'name': 'Drama', 'url': 'https://myanimelist.net/anime/genre/8/Drama'}, {'mal_id': 10, 'type': 'anime', 'name': 'Fantasy', 'url': 'https://myanimelist.net/anime/genre/10/Fantasy'}]",[],"[{'mal_id': 38, 'type': 'anime', 'name': 'Military', 'url': 'https://myanimelist.net/anime/genre/38/Military'}]","[{'mal_id': 27, 'type': 'anime', 'name': 'Shounen', 'url': 'https://myanimelist.net/anime/genre/27/Shounen'}]"
5680,https://myanimelist.net/anime/5680/K-On,"{'jpg': {'image_url': 'https://cdn.myanimelist.net/images/anime/10/76120.jpg', 'small_image_url': 'https://cdn.myanimelist.net/images/anime/10/76120t.jpg', 'large_image_url': 'https://cdn.myanimelist.net/images/anime/10/76120l.jpg'}, 'webp': {'image_url': 'https://cdn.myanimelist.net/images/anime/10/76120.webp', 'small_image_url': 'https://cdn.myanimelist.net/images/anime/10/76120t.webp', 'large_image_url': 'https://cdn.myanimelist.net/images/anime/10/76120l.webp'}}","{'youtube_id': None, 'url': None, 'embed_url': None, 'images': {'image_url': None, 'small_image_url': None, 'medium_image_url': None, 'large_image_url': None, 'maximum_image_url': None}}","""K-On!""",K-ON!,けいおん!,"['Keion', 'K-ON! Season 1']",TV,4-koma manga,13,Finished Airing,False,"{'from': '2009-04-03T00:00:00+00:00', 'to': '2009-06-26T00:00:00+00:00', 'prop': {'from': {'day': 3, 'month': 4, 'year': 2009}, 'to': {'day': 26, 'month': 6, 'year': 2009}}, 'string': 'Apr 3, 2009 to Jun 26, 2009'}",24 min per ep,PG-13 - Teens 13 or older,7.85,492464.0,779,122,923847,21104,"A fresh high school year always means much to come, and one of those things is joining a club. Being in a dilemma about which club to join, Yui Hirasawa stumbles upon and applies for the Light Music Club, which she misinterprets to be about playing simple instruments, such as castanets. Unable to play an instrument, she decides to visit to apologize and quit. Meanwhile, the Light Music Club faces disbandment due to a lack of members. This causes the club members to offer anything, from food to slacking off during club time, in order to convince Yui to join. Despite their efforts, Yui insists on leaving due to her lack of musical experience. As a last resort, they play a piece for Yui, which sparks her fiery passion and finally convinces her to join the club. From then onward, it's just plain messing around with bits and pieces of practice. The members of the Light Music Club are ready to make their time together a delightful one! [Written by MAL Rewrite]",The series received a Best TV Animation Award at the 2010 Tokyo International Anime Fair.,spring,2009,"{'day': 'Fridays', 'time': '01:59', 'timezone': 'Asia/Tokyo', 'string': 'Fridays at 01:59 (JST)'}","[{'mal_id': 144, 'type': 'anime', 'name': 'Pony Canyon', 'url': 'https://myanimelist.net/anime/producer/144/Pony_Canyon'}, {'mal_id': 145, 'type': 'anime', 'name': 'TBS', 'url': 'https://myanimelist.net/anime/producer/145/TBS'}, {'mal_id': 166, 'type': 'anime', 'name': 'Movic', 'url': 'https://myanimelist.net/anime/producer/166/Movic'}, {'mal_id': 211, 'type': 'anime', 'name': 'Rakuonsha', 'url': 'https://myanimelist.net/anime/producer/211/Rakuonsha'}, {'mal_id': 929, 'type': 'anime', 'name': 'Animation Do', 'url': 'https://myanimelist.net/anime/producer/929/Animation_Do'}]","[{'mal_id': 233, 'type': 'anime', 'name': 'Bandai Entertainment', 'url': 'https://myanimelist.net/anime/producer/233/Bandai_Entertainment'}, {'mal_id': 376, 'type': 'anime', 'name': 'Sentai Filmworks', 'url': 'https://myanimelist.net/anime/producer/376/Sentai_Filmworks'}]","[{'mal_id': 2, 'type': 'anime', 'name': 'Kyoto Animation', 'url': 'https://myanimelist.net/anime/producer/2/Kyoto_Animation'}]","[{'mal_id': 4, 'type': 'anime', 'name': 'Comedy', 'url': 'https://myanimelist.net/anime/genre/4/Comedy'}, {'mal_id': 36, 'type': 'anime', 'name': 'Slice of Life', 'url': 'https://myanimelist.net/anime/genre/36/Slice_of_Life'}]",[],"[{'mal_id': 19, 'type': 'anime', 'name': 'Music', 'url': 'https://myanimelist.net/anime/genre/19/Music'}, {'mal_id': 23, 'type': 'anime', 'name': 'School', 'url': 'https://myanimelist.net/anime/genre/23/School'}]",[]
5630,https://myanimelist.net/anime/5630/Higashi_no_Eden,"{'jpg': {'image_url': 'https://cdn.myanimelist.net/images/anime/9/15033.jpg', 'small_image_url': 'https://cdn.myanimelist.net/images/anime/9/15033t.jpg', 'large_image_url': 'https://cdn.myanimelist.net/images/anime/9/15033l.jpg'}, 'webp': {'image_url': 'https://cdn.myanimelist.net/images/anime/9/15033.webp', 'small_image_url': 'https://cdn.myanimelist.net/images/anime/9/15033t.webp', 'large_image_url': 'https://cdn.myanimelist.net/images/anime/9/15033l.webp'}}","{'youtube_id': 'h3dgXYQSeqI', 'url': 'https://www.youtube.com/watch?v=h3dgXYQSeqI', 'embed_url': 'https://www.youtube.com/embed/h3dgXYQSeqI?enablejsapi=1&wmode=opaque&autoplay=1', 'images': {'image_url': 'https://img.youtube.com/vi/h3dgXYQSeqI/default.jpg', 'small_image_url': 'https://img.youtube.com/vi/h3dgXYQSeqI/sddefault.jpg', 'medium_image_url': 'https://img.youtube.com/vi/h3dgXYQSeqI/mqdefault.jpg', 'large_image_url': 'https://img.youtube.com/vi/h3dgXYQSeqI/hqdefault.jpg', 'maximum_image_url': 'https://img.youtube.com/vi/h3dgXYQSeqI/maxresdefault.jpg'}}","""Higashi no Eden""",Eden of The East,東のエデン,['Higashi no Eden'],TV,Original,11,Finished Airing,False,"{'from': '2009-04-10T00:00:00+00:00', 'to': '2009-06-19T00:00:00+00:00', 'prop': {'from': {'day': 10, 'month': 4, 'year': 2009}, 'to': {'day': 19, 'month': 6, 'year': 2009}}, 'string': 'Apr 10, 2009 to Jun 19, 2009'}",23 min per ep,R - 17+ (violence & profanity),7.79,234007.0,886,331,516673,4012,"On November 22, 2010, Japan was hit by missile strikes, a terrorist act that fortunately did not harm anyone, becoming known as ""Careless Monday."" Quickly forgotten, society goes on about their lives as normal. During her graduation trip to America three months later, friendly college student Saki Morimi's life is forever changed when she finds herself saved from unexpected trouble by Akira Takizawa. Takizawa is cheerful, but odd in many ways—he is stark naked and suffers from amnesia, believing himself to be a terrorist. In addition, he possesses a strange cell phone loaded with 8.2 billion yen in digital cash. Despite Takizawa's suspicious traits, Saki quickly befriends the enigmatic young man. However, unbeknownst to her, this is the beginning of a thrilling death game involving money, cell phones, and the salvation of the world. Higashi no Eden chronicles Saki's struggle to unravel the mysteries behind her savior, while Takizawa himself battles other individuals armed with similar cell phones and returning memories which reveal his possible connection to the event from months ago. [Written by MAL Rewrite]",Higashi no Eden won the Animation Kobe Award in the Television category during the Animation Kobe festival in 2009 as well as the best television series of the year award at the ninth annual Tokyo International Anime Fair.,spring,2009,"{'day': 'Fridays', 'time': '00:45', 'timezone': 'Asia/Tokyo', 'string': 'Fridays at 00:45 (JST)'}","[{'mal_id': 53, 'type': 'anime', 'name': 'Dentsu', 'url': 'https://myanimelist.net/anime/producer/53/Dentsu'}, {'mal_id': 169, 'type': 'anime', 'name': 'Fuji TV', 'url': 'https://myanimelist.net/anime/producer/169/Fuji_TV'}, {'mal_id': 517, 'type': 'anime', 'name': 'Asmik Ace', 'url': 'https://myanimelist.net/anime/producer/517/Asmik_Ace'}, {'mal_id': 757, 'type': 'anime', 'name': 'Sony Music Entertainment', 'url': 'https://myanimelist.net/anime/producer/757/Sony_Music_Entertainment'}]","[{'mal_id': 102, 'type': 'anime', 'name': 'Funimation', 'url': 'https://myanimelist.net/anime/producer/102/Funimation'}]","[{'mal_id': 10, 'type': 'anime', 'name': 'Production I.G', 'url': 'https://myanimelist.net/anime/producer/10/Production_IG'}]","[{'mal_id': 1, 'type': 'anime', 'name': 'Action', 'url': 'https://myanimelist.net/anime/genre/1/Action'}, {'mal_id': 8, 'type': 'anime', 'name': 'Drama', 'url': 'https://myanimelist.net/anime/genre/8/Drama'}, {'mal_id': 7, 'type': 'anime', 'name': 'Mystery', 'url': 'https://myanimelist.net/anime/genre/7/Mystery'}, {'mal_id': 22, 'type': 'anime', 'name': 'Romance', 'url': 'https://myanimelist.net/anime/genre/22/Romance'}, {'mal_id': 24, 'type': 'anime', 'name': 'Sci-Fi', 'url': 'https://myanimelist.net/anime/genre/24/Sci-Fi'}, {'mal_id': 41, 'type': 'anime', 'name': 'Suspense', 'url': 'https://myanimelist.net/anime/genre/41/Suspense'}]",[],[],[]
4382,https://myanimelist.net/anime/4382/Suzumiya_Haruhi_no_Yuuutsu_2009,"{'jpg': {'image_url': 'https://cdn.myanimelist.net/images/anime/8/75377.jpg', 'small_image_url': 'https://cdn.myanimelist.net/images/anime/8/75377t.jpg', 'large_image_url': 'https://cdn.myanimelist.net/images/anime/8/75377l.jpg'}, 'webp': {'image_url': 'https://cdn.myanimelist.net/images/anime/8/75377.webp', 'small_image_url': 'https://cdn.myanimelist.net/images/anime/8/75377t.webp', 'large_image_url': 'https://cdn.myanimelist.net/images/anime/8/75377l.webp'}}","{'youtube_id': '9aOcDMV-X68', 'url': 'https://www.youtube.com/watch?v=9aOcDMV-X68', 'embed_url': 'https://www.youtube.com/embed/9aOcDMV-X68?enablejsapi=1&wmode=opaque&autoplay=1', 'images': {'image_url': 'https://img.youtube.com/vi/9aOcDMV-X68/default.jpg', 'small_image_url': 'https://img.youtube.com/vi/9aOcDMV-X68/sddefault.jpg', 'medium_image_url': 'https://img.youtube.com/vi/9aOcDMV-X68/mqdefault.jpg', 'large_image_url': 'https://img.youtube.com/vi/9aOcDMV-X68/hqdefault.jpg', 'maximum_image_url': 'https://img.youtube.com/vi/9aOcDMV-X68/maxresdefault.jpg'}}","""Suzumiya Haruhi no Yuuutsu (2009)""",The Melancholy of Haruhi Suzumiya Season 2,涼宮ハルヒの憂鬱,"['Suzumiya Haruhi no Yuutsu (2009)', 'Endless Eight', 'The Sigh of Haruhi Suzumiya']",TV,Light novel,14,Finished Airing,False,"{'from': '2009-05-22T00:00:00+00:00', 'to': '2009-09-11T00:00:00+00:00', 'prop': {'from': {'day': 22, 'month': 5, 'year': 2009}, 'to': {'day': 11, 'month': 9, 'year': 2009}}, 'string': 'May 22, 2009 to Sep 11, 2009'}",24 min per ep,PG-13 - Teens 13 or older,7.22,271565.0,2797,358,476145,2007,"Kyon has found himself dragged through many adventures as of late—all because of the SOS Brigade club and its excitable leader, Haruhi Suzumiya. He has stopped believing in the supernatural long ago, but after being forced to join this club based solely on that, he has seen things that cannot be explained logically. Joining Kyon on his various misadventures is the shy and soft-spoken Mikuru Asahina, the bookish Yuki Nagato, and the ever-cheerful Itsuki Koizumi. Whether it is summer vacation or a school festival, things involving their club and Haruhi herself always end up becoming strange. [Written by MAL Rewrite]",,spring,2009,"{'day': 'Fridays', 'time': '00:40', 'timezone': 'Asia/Tokyo', 'string': 'Fridays at 00:40 (JST)'}","[{'mal_id': 113, 'type': 'anime', 'name': 'Kadokawa Shoten', 'url': 'https://myanimelist.net/anime/producer/113/Kadokawa_Shoten'}]","[{'mal_id': 102, 'type': 'anime', 'name': 'Funimation', 'url': 'https://myanimelist.net/anime/producer/102/Funimation'}, {'mal_id': 233, 'type': 'anime', 'name': 'Bandai Entertainment', 'url': 'https://myanimelist.net/anime/producer/233/Bandai_Entertainment'}]","[{'mal_id': 2, 'type': 'anime', 'name': 'Kyoto Animation', 'url': 'https://myanimelist.net/anime/producer/2/Kyoto_Animation'}]","[{'mal_id': 4, 'type': 'anime', 'name': 'Comedy', 'url': 'https://myanimelist.net/anime/genre/4/Comedy'}, {'mal_id': 7, 'type': 'anime', 'name': 'Mystery', 'url': 'https://myanimelist.net/anime/genre/7/Mystery'}, {'mal_id': 22, 'type': 'anime', 'name': 'Romance', 'url': 'https://myanimelist.net/anime/genre/22/Romance'}, {'mal_id': 24, 'type': 'anime', 'name': 'Sci-Fi', 'url': 'https://myanimelist.net/anime/genre/24/Sci-Fi'}, {'mal_id': 36, 'type': 'anime', 'name': 'Slice of Life', 'url': 'https://myanimelist.net/anime/genre/36/Slice_of_Life'}]",[],"[{'mal_id': 20, 'type': 'anime', 'name': 'Parody', 'url': 'https://myanimelist.net/anime/genre/20/Parody'}, {'mal_id': 23, 'type': 'anime', 'name': 'School', 'url': 'https://myanimelist.net/anime/genre/23/School'}]",[]
5530,https://myanimelist.net/anime/5530/Pandora_Hearts,"{'jpg': {'image_url': 'https://cdn.myanimelist.net/images/anime/4/75535.jpg', 'small_image_url': 'https://cdn.myanimelist.net/images/anime/4/75535t.jpg', 'large_image_url': 'https://cdn.myanimelist.net/images/anime/4/75535l.jpg'}, 'webp': {'image_url': 'https://cdn.myanimelist.net/images/anime/4/75535.webp', 'small_image_url': 'https://cdn.myanimelist.net/images/anime/4/75535t.webp', 'large_image_url': 'https://cdn.myanimelist.net/images/anime/4/75535l.webp'}}","{'youtube_id': '9Psc_hBkOoc', 'url': 'https://www.youtube.com/watch?v=9Psc_hBkOoc', 'embed_url': 'https://www.youtube.com/embed/9Psc_hBkOoc?enablejsapi=1&wmode=opaque&autoplay=1', 'images': {'image_url': 'https://img.youtube.com/vi/9Psc_hBkOoc/default.jpg', 'small_image_url': 'https://img.youtube.com/vi/9Psc_hBkOoc/sddefault.jpg', 'medium_image_url': 'https://img.youtube.com/vi/9Psc_hBkOoc/mqdefault.jpg', 'large_image_url': 'https://img.youtube.com/vi/9Psc_hBkOoc/hqdefault.jpg', 'maximum_image_url': 'https://img.youtube.com/vi/9Psc_hBkOoc/maxresdefault.jpg'}}","""Pandora Hearts""",PandoraHearts,パンドラハーツ,['Pandora Hearts'],TV,Manga,25,Finished Airing,False,"{'from': '2009-04-03T00:00:00+00:00', 'to': '2009-09-25T00:00:00+00:00', 'prop': {'from': {'day': 3, 'month': 4, 'year': 2009}, 'to': {'day': 25, 'month': 9, 'year': 2009}}, 'string': 'Apr 3, 2009 to Sep 25, 2009'}",24 min per ep,PG-13 - Teens 13 or older,7.68,154709.0,1113,440,397172,4981,"To young Oz Vessalius, heir to the Vessalius Duke House, the perilous world called the Abyss is nothing more than a folktale used to scare misbehaving children. However, when Oz's coming-of-age ceremony is interrupted by the malicious Baskerville Clan intent on banishing him into the depths of the Abyss, the Vessalius heir realizes that his peaceful life of luxury is at its end. Now, he must confront the world of the Abyss and its dwellers, the monstrous ""Chains,"" which are both not quite as fake as he once believed. Based on the supernatural fantasy manga of the same name, Pandora Hearts tells the story of fifteen-year-old Oz's journey to discover the meaning behind the strange events that have overtaken his life. Assisted by a mysterious Chain named Alice, whose nickname is ""Bloodstained Black Rabbit,"" and members of a clandestine organization known as ""Pandora,"" Oz begins to realize his existence may have more meaning than he could have ever imagined. [Written by MAL Rewrite]",,spring,2009,"{'day': 'Fridays', 'time': '01:29', 'timezone': 'Asia/Tokyo', 'string': 'Fridays at 01:29 (JST)'}","[{'mal_id': 58, 'type': 'anime', 'name': 'Square Enix', 'url': 'https://myanimelist.net/anime/producer/58/Square_Enix'}, {'mal_id': 145, 'type': 'anime', 'name': 'TBS', 'url': 'https://myanimelist.net/anime/producer/145/TBS'}, {'mal_id': 464, 'type': 'anime', 'name': 'flying DOG', 'url': 'https://myanimelist.net/anime/producer/464/flying_DOG'}]","[{'mal_id': 372, 'type': 'anime', 'name': 'NIS America, Inc.', 'url': 'https://myanimelist.net/anime/producer/372/NIS_America_Inc'}]","[{'mal_id': 27, 'type': 'anime', 'name': 'Xebec', 'url': 'https://myanimelist.net/anime/producer/27/Xebec'}]","[{'mal_id': 2, 'type': 'anime', 'name': 'Adventure', 'url': 'https://myanimelist.net/anime/genre/2/Adventure'}, {'mal_id': 10, 'type': 'anime', 'name': 'Fantasy', 'url': 'https://myanimelist.net/anime/genre/10/Fantasy'}, {'mal_id': 7, 'type': 'anime', 'name': 'Mystery', 'url': 'https://myanimelist.net/anime/genre/7/Mystery'}, {'mal_id': 37, 'type': 'anime', 'name': 'Supernatural', 'url': 'https://myanimelist.net/anime/genre/37/Supernatural'}]",[],[],"[{'mal_id': 27, 'type': 'anime', 'name': 'Shounen', 'url': 'https://myanimelist.net/anime/genre/27/Shounen'}]"
6033,https://myanimelist.net/anime/6033/Dragon_Ball_Kai,"{'jpg': {'image_url': 'https://cdn.myanimelist.net/images/anime/6/14065.jpg', 'small_image_url': 'https://cdn.myanimelist.net/images/anime/6/14065t.jpg', 'large_image_url': 'https://cdn.myanimelist.net/images/anime/6/14065l.jpg'}, 'webp': {'image_url': 'https://cdn.myanimelist.net/images/anime/6/14065.webp', 'small_image_url': 'https://cdn.myanimelist.net/images/anime/6/14065t.webp', 'large_image_url': 'https://cdn.myanimelist.net/images/anime/6/14065l.webp'}}","{'youtube_id': None, 'url': None, 'embed_url': None, 'images': {'image_url': None, 'small_image_url': None, 'medium_image_url': None, 'large_image_url': None, 'maximum_image_url': None}}","""Dragon Ball Kai""",Dragon Ball Z Kai,ドラゴンボール改,"['Dragonball Kai', 'DBK', 'DB Kai', 'DBZ Kai']",TV,Manga,97,Finished Airing,False,"{'from': '2009-04-05T00:00:00+00:00', 'to': '2011-03-27T00:00:00+00:00', 'prop': {'from': {'day': 5, 'month': 4, 'year': 2009}, 'to': {'day': 27, 'month': 3, 'year': 2011}}, 'string': 'Apr 5, 2009 to Mar 27, 2011'}",23 min per ep,PG-13 - Teens 13 or older,7.71,196302.0,1046,544,328371,2643,"Five years after the events of Dragon Ball, martial arts expert Gokuu is now a grown man married to his wife Chi-Chi, with a four-year old son named Gohan. While attending a reunion on Turtle Island with his old friends Master Roshi, Krillin, Bulma and others, the festivities are interrupted when a humanoid alien named Raditz not only reveals the truth behind Gokuu's past, but kidnaps Gohan as well. With Raditz displaying power beyond anything Gokuu has seen before, he is forced to team up with his old nemesis, Piccolo, in order to rescue his son. But when Gokuu and Piccolo reveal the secret of the seven mystical wish-granting Dragon Balls to Raditz, he informs the duo that there is more of his race, the Saiyans, and they won’t pass up an opportunity to seize the power of the Dragon Balls for themselves. These events begin the saga of Dragon Ball Kai, a story that finds Gokuu and his friends and family constantly defending the galaxy from increasingly more powerful threats. Bizarre, comical, heartwarming and threatening characters come together in a series of battles that push the powers and abilities of Gokuu and his friends beyond anything they have ever experienced.","Dragon Ball Kai is an edited and condensed version of Dragon Ball Z produced and released in 2009 to coincide with the 20th anniversary of the original series. In addition to its new music tracks and re-recorded voice acting, Toei Animation updated the series' visuals to take advantage of high-definition televisions. The series concluded after 98 episodes, whereas the original Dragon Ball Z took 194 episodes to reach the same point. Kai was continued in 2014 with what is considered its own series, Dragon Ball Kai (2014).",spring,2009,"{'day': 'Sundays', 'time': '09:00', 'timezone': 'Asia/Tokyo', 'string': 'Sundays at 09:00 (JST)'}",[],"[{'mal_id': 102, 'type': 'anime', 'name': 'Funimation', 'url': 'https://myanimelist.net/anime/producer/102/Funimation'}]","[{'mal_id': 18, 'type': 'anime', 'name': 'Toei Animation', 'url': 'https://myanimelist.net/anime/producer/18/Toei_Animation'}]","[{'mal_id': 1, 'type': 'anime', 'name': 'Action', 'url': 'https://myanimelist.net/anime/genre/1/Action'}, {'mal_id': 2, 'type': 'anime', 'name': 'Adventure', 'url': 'https://myanimelist.net/anime/genre/2/Adventure'}, {'mal_id': 4, 'type': 'anime', 'name': 'Comedy', 'url': 'https://myanimelist.net/anime/genre/4/Comedy'}, {'mal_id': 10, 'type': 'anime', 'name': 'Fantasy', 'url': 'https://myanimelist.net/anime/genre/10/Fantasy'}]",[],"[{'mal_id': 17, 'type': 'anime', 'name': 'Martial Arts', 'url': 'https://myanimelist.net/anime/genre/17/Martial_Arts'}, {'mal_id': 31, 'type': 'anime', 'name': 'Super Power', 'url': 'https://myanimelist.net/anime/genre/31/Super_Power'}]","[{'mal_id': 27, 'type': 'anime', 'name': 'Shounen', 'url': 'https://myanimelist.net/anime/genre/27/Shounen'}]"
