mal_id,url,images,trailer,title,title_english,title_japanese,title_synonyms,type,source,episodes,status,airing,aired,duration,rating,score,scored_by,rank,popularity,members,favorites,synopsis,background,season,year,broadcast,producers,licensors,studios,genres,explicit_genres,themes,demographics
9074,https://myanimelist.net/anime/9074/Arakawa_Under_the_Bridge_x_Bridge,"{'jpg': {'image_url': 'https://cdn.myanimelist.net/images/anime/1851/98621.jpg', 'small_image_url': 'https://cdn.myanimelist.net/images/anime/1851/98621t.jpg', 'large_image_url': 'https://cdn.myanimelist.net/images/anime/1851/98621l.jpg'}, 'webp': {'image_url': 'https://cdn.myanimelist.net/images/anime/1851/98621.webp', 'small_image_url': 'https://cdn.myanimelist.net/images/anime/1851/98621t.webp', 'large_image_url': 'https://cdn.myanimelist.net/images/anime/1851/98621l.webp'}}","{'youtube_id': 'al_MIXJDQJE', 'url': 'https://www.youtube.com/watch?v=al_MIXJDQJE', 'embed_url': 'https://www.youtube.com/embed/al_MIXJDQJE?enablejsapi=1&wmode=opaque&autoplay=1', 'images': {'image_url': 'https://img.youtube.com/vi/al_MIXJDQJE/default.jpg', 'small_image_url': 'https://img.youtube.com/vi/al_MIXJDQJE/sddefault.jpg', 'medium_image_url': 'https://img.youtube.com/vi/al_MIXJDQJE/mqdefault.jpg', 'large_image_url': 'https://img.youtube.com/vi/al_MIXJDQJE/hqdefault.jpg', 'maximum_image_url': 'https://img.youtube.com/vi/al_MIXJDQJE/maxresdefault.jpg'}}","""Arakawa Under the Bridge x Bridge""",Arakawa Under the Bridge x Bridge,荒川アンダー ザブリッジ×ブリッジ,"['Arakawa Under the Bridge*2', 'Arakawa Under the Bridge x2', 'Arakawa Under the Bridge 2nd season']",TV,Manga,13,Finished Airing,False,"{'from': '2010-10-04T00:00:00+00:00', 'to': '2010-12-27T00:00:00+00:00', 'prop': {'from': {'day': 4, 'month': 10, 'year': 2010}, 'to': {'day': 27, 'month': 12, 'year': 2010}}, 'string': 'Oct 4, 2010 to Dec 27, 2010'}",23 min per ep,PG-13 - Teens 13 or older,7.73,77596.0,997,1225,150715,400,"Just when you thought things couldn't get any weirder by the banks of the mighty Arakawa, they go ahead and get weirder by a whole lot. Rec, Nino, and the rest of the riverside residents return, and with the addition of another batch of nutty citizens, the insanity gets turned up to eleven...thousand. Now Rec has to deal with a sci-fi loving comic nerd who's convinced he's a captain in the Earth Defense Force, and the less said about the Amazon woman living upstream with her demonic ""female"" Amazon followers, the better. On top of that, Rec struggles with the pressing issues of romantic expression, media obsession, weight loss, weight gain, beach parties, haunted houses, interplanetary travel, and the ever-present threat of global thermonuclear war! So jump on, strap in, and prepare for a non-stop romp through Crazytown! (Source: NIS America)",,fall,2010,"{'day': 'Mondays', 'time': '01:35', 'timezone': 'Asia/Tokyo', 'string': 'Mondays at 01:35 (JST)'}","[{'mal_id': 58, 'type': 'anime', 'name': 'Square Enix', 'url': 'https://myanimelist.net/anime/producer/58/Square_Enix'}, {'mal_id': 92, 'type': 'anime', 'name': 'Starchild Records', 'url': 'https://myanimelist.net/anime/producer/92/Starchild_Records'}, {'mal_id': 717, 'type': 'anime', 'name': 'TV Tokyo Music', 'url': 'https://myanimelist.net/anime/producer/717/TV_Tokyo_Music'}, {'mal_id': 721, 'type': 'anime', 'name': 'GANSIS', 'url': 'https://myanimelist.net/anime/producer/721/GANSIS'}]","[{'mal_id': 372, 'type': 'anime', 'name': 'NIS America, Inc.', 'url': 'https://myanimelist.net/anime/producer/372/NIS_America_Inc'}]","[{'mal_id': 44, 'type': 'anime', 'name': 'Shaft', 'url': 'https://myanimelist.net/anime/producer/44/Shaft'}]","[{'mal_id': 4, 'type': 'anime', 'name': 'Comedy', 'url': 'https://myanimelist.net/anime/genre/4/Comedy'}, {'mal_id': 22, 'type': 'anime', 'name': 'Romance', 'url': 'https://myanimelist.net/anime/genre/22/Romance'}]",[],[],"[{'mal_id': 42, 'type': 'anime', 'name': 'Seinen', 'url': 'https://myanimelist.net/anime/genre/42/Seinen'}]"
7662,https://myanimelist.net/anime/7662/Shinrei_Tantei_Yakumo,"{'jpg': {'image_url': 'https://cdn.myanimelist.net/images/anime/13/35829.jpg', 'small_image_url': 'https://cdn.myanimelist.net/images/anime/13/35829t.jpg', 'large_image_url': 'https://cdn.myanimelist.net/images/anime/13/35829l.jpg'}, 'webp': {'image_url': 'https://cdn.myanimelist.net/images/anime/13/35829.webp', 'small_image_url': 'https://cdn.myanimelist.net/images/anime/13/35829t.webp', 'large_image_url': 'https://cdn.myanimelist.net/images/anime/13/35829l.webp'}}","{'youtube_id': 'ldZCIMlJQck', 'url': 'https://www.youtube.com/watch?v=ldZCIMlJQck', 'embed_url': 'https://www.youtube.com/embed/ldZCIMlJQck?enablejsapi=1&wmode=opaque&autoplay=1', 'images': {'image_url': 'https://img.youtube.com/vi/ldZCIMlJQck/default.jpg', 'small_image_url': 'https://img.youtube.com/vi/ldZCIMlJQck/sddefault.jpg', 'medium_image_url': 'https://img.youtube.com/vi/ldZCIMlJQck/mqdefault.jpg', 'large_image_url': 'https://img.youtube.com/vi/ldZCIMlJQck/hqdefault.jpg', 'maximum_image_url': 'https://img.youtube.com/vi/ldZCIMlJQck/maxresdefault.jpg'}}","""Shinrei Tantei Yakumo""",Psychic Detective Yakumo,心霊探偵 八雲,['Shinrei Tantei Yakumo'],TV,Novel,13,Finished Airing,False,"{'from': '2010-10-03T00:00:00+00:00', 'to': '2010-12-26T00:00:00+00:00', 'prop': {'from': {'day': 3, 'month': 10, 'year': 2010}, 'to': {'day': 26, 'month': 12, 'year': 2010}}, 'string': 'Oct 3, 2010 to Dec 26, 2010'}",24 min per ep,PG-13 - Teens 13 or older,7.32,50806.0,2308,1422,123491,519,"Haruka Ozawa's sophomore year is getting seriously scary. One of her friends is possessed, another has committed suicide and Haruka could be the next one to flunk the still-breathing test. Her only way out of this potentially lethal dead end? Yakumo Saito, an enigmatic student born with a mysterious red eye that allows him to see and communicate with the dead. But the deceased don't always desist and some killers are more than ready to kill again to keep dead men from telling any more tales. That doesn't stop Haruka's knack for digging up buried secrets, and there's even more evidence of bodies being exhumed by both Yakumo's police contact and an investigative journalist with a newly made corpse in her closet! Can this pair of anything but normal paranormal detectives solve the ultimate dead case files or will they end up in cold storage themselves? (Source: Sentai Filmworks)",,fall,2010,"{'day': None, 'time': None, 'timezone': None, 'string': 'Unknown'}","[{'mal_id': 111, 'type': 'anime', 'name': 'NHK', 'url': 'https://myanimelist.net/anime/producer/111/NHK'}, {'mal_id': 161, 'type': 'anime', 'name': 'Sogo Vision', 'url': 'https://myanimelist.net/anime/producer/161/Sogo_Vision'}, {'mal_id': 359, 'type': 'anime', 'name': 'NHK-BS2', 'url': 'https://myanimelist.net/anime/producer/359/NHK-BS2'}]","[{'mal_id': 376, 'type': 'anime', 'name': 'Sentai Filmworks', 'url': 'https://myanimelist.net/anime/producer/376/Sentai_Filmworks'}]","[{'mal_id': 5, 'type': 'anime', 'name': 'Bee Train', 'url': 'https://myanimelist.net/anime/producer/5/Bee_Train'}]","[{'mal_id': 14, 'type': 'anime', 'name': 'Horror', 'url': 'https://myanimelist.net/anime/genre/14/Horror'}, {'mal_id': 7, 'type': 'anime', 'name': 'Mystery', 'url': 'https://myanimelist.net/anime/genre/7/Mystery'}, {'mal_id': 37, 'type': 'anime', 'name': 'Supernatural', 'url': 'https://myanimelist.net/anime/genre/37/Supernatural'}]",[],[],[]
8476,https://myanimelist.net/anime/8476/Otome_Youkai_Zakuro,"{'jpg': {'image_url': 'https://cdn.myanimelist.net/images/anime/5/85430.jpg', 'small_image_url': 'https://cdn.myanimelist.net/images/anime/5/85430t.jpg', 'large_image_url': 'https://cdn.myanimelist.net/images/anime/5/85430l.jpg'}, 'webp': {'image_url': 'https://cdn.myanimelist.net/images/anime/5/85430.webp', 'small_image_url': 'https://cdn.myanimelist.net/images/anime/5/85430t.webp', 'large_image_url': 'https://cdn.myanimelist.net/images/anime/5/85430l.webp'}}","{'youtube_id': 'TmONRcfX1Kw', 'url': 'https://www.youtube.com/watch?v=TmONRcfX1Kw', 'embed_url': 'https://www.youtube.com/embed/TmONRcfX1Kw?enablejsapi=1&wmode=opaque&autoplay=1', 'images': {'image_url': 'https://img.youtube.com/vi/TmONRcfX1Kw/default.jpg', 'small_image_url': 'https://img.youtube.com/vi/TmONRcfX1Kw/sddefault.jpg', 'medium_image_url': 'https://img.youtube.com/vi/TmONRcfX1Kw/mqdefault.jpg', 'large_image_url': 'https://img.youtube.com/vi/TmONRcfX1Kw/hqdefault.jpg', 'maximum_image_url': 'https://img.youtube.com/vi/TmONRcfX1Kw/maxresdefault.jpg'}}","""Otome Youkai Zakuro""",Zakuro,おとめ妖怪 ざくろ,['Girl Demon Zakuro'],TV,Manga,13,Finished Airing,False,"{'from': '2010-10-05T00:00:00+00:00', 'to': '2010-12-28T00:00:00+00:00', 'prop': {'from': {'day': 5, 'month': 10, 'year': 2010}, 'to': {'day': 28, 'month': 12, 'year': 2010}}, 'string': 'Oct 5, 2010 to Dec 28, 2010'}",24 min per ep,PG-13 - Teens 13 or older,7.45,44567.0,1816,1526,112233,371,"Second Lieutenant Kei Agemaki, the son of a famous general, has hidden his extreme fear of paranormal beings all his life. However, when he and two others are reassigned to live and work with youkai in the Ministry of Spirit Affairs, he is brought face-to-face with his worst nightmare. Now with the help of the fox spirit Kushimatsu, he and his fellow officers must learn to work alongside youkai maidens—Zakuro, Susukihotaru, Hoozuki, and Bonbori—to solve paranormal cases. Set in the midst of an alternate version of Japanese Westernization, Otome Youkai Zakuro explores the clashes and unions that can occur when east meets west, local meets foreign, and women meet men. The unusual alliance of the youkai maidens and human officers must learn to work together in a world that is changing around them. [Written by MAL Rewrite]",,fall,2010,"{'day': 'Tuesdays', 'time': '01:30', 'timezone': 'Asia/Tokyo', 'string': 'Tuesdays at 01:30 (JST)'}","[{'mal_id': 17, 'type': 'anime', 'name': 'Aniplex', 'url': 'https://myanimelist.net/anime/producer/17/Aniplex'}]","[{'mal_id': 372, 'type': 'anime', 'name': 'NIS America, Inc.', 'url': 'https://myanimelist.net/anime/producer/372/NIS_America_Inc'}]","[{'mal_id': 7, 'type': 'anime', 'name': 'J.C.Staff', 'url': 'https://myanimelist.net/anime/producer/7/JCStaff'}]","[{'mal_id': 22, 'type': 'anime', 'name': 'Romance', 'url': 'https://myanimelist.net/anime/genre/22/Romance'}, {'mal_id': 37, 'type': 'anime', 'name': 'Supernatural', 'url': 'https://myanimelist.net/anime/genre/37/Supernatural'}]",[],"[{'mal_id': 6, 'type': 'anime', 'name': 'Demons', 'url': 'https://myanimelist.net/anime/genre/6/Demons'}, {'mal_id': 13, 'type': 'anime', 'name': 'Historical', 'url': 'https://myanimelist.net/anime/genre/13/Historical'}, {'mal_id': 38, 'type': 'anime', 'name': 'Military', 'url': 'https://myanimelist.net/anime/genre/38/Military'}]","[{'mal_id': 42, 'type': 'anime', 'name': 'Seinen', 'url': 'https://myanimelist.net/anime/genre/42/Seinen'}]"
8536,https://myanimelist.net/anime/8536/Fortune_Arterial__Akai_Yakusoku,"{'jpg': {'image_url': 'https://cdn.myanimelist.net/images/anime/11/26876.jpg', 'small_image_url': 'https://cdn.myanimelist.net/images/anime/11/26876t.jpg', 'large_image_url': 'https://cdn.myanimelist.net/images/anime/11/26876l.jpg'}, 'webp': {'image_url': 'https://cdn.myanimelist.net/images/anime/11/26876.webp', 'small_image_url': 'https://cdn.myanimelist.net/images/anime/11/26876t.webp', 'large_image_url': 'https://cdn.myanimelist.net/images/anime/11/26876l.webp'}}","{'youtube_id': 'zCllt9ZySFw', 'url': 'https://www.youtube.com/watch?v=zCllt9ZySFw', 'embed_url': 'https://www.youtube.com/embed/zCllt9ZySFw?enablejsapi=1&wmode=opaque&autoplay=1', 'images': {'image_url': 'https://img.youtube.com/vi/zCllt9ZySFw/default.jpg', 'small_image_url': 'https://img.youtube.com/vi/zCllt9ZySFw/sddefault.jpg', 'medium_image_url': 'https://img.youtube.com/vi/zCllt9ZySFw/mqdefault.jpg', 'large_image_url': 'https://img.youtube.com/vi/zCllt9ZySFw/hqdefault.jpg', 'maximum_image_url': 'https://img.youtube.com/vi/zCllt9ZySFw/maxresdefault.jpg'}}","""Fortune Arterial: Akai Yakusoku""",,FORTUNE ARTERIAL 赤い約束,[],TV,Visual novel,12,Finished Airing,False,"{'from': '2010-10-09T00:00:00+00:00', 'to': '2010-12-25T00:00:00+00:00', 'prop': {'from': {'day': 9, 'month': 10, 'year': 2010}, 'to': {'day': 25, 'month': 12, 'year': 2010}}, 'string': 'Oct 9, 2010 to Dec 25, 2010'}",24 min per ep,PG-13 - Teens 13 or older,6.69,57261.0,5171,1554,109691,181,"Fortune Arterial's story revolves around the male protagonist Kohei Hasekura, who transfers into a prestigious public school in the style of an English six-year school encompassing junior-high and high school students. The school is on an island named Tamatsu Island off-shore from mainland Japan, and the only way to get there is by boat. Soon after transferring, he discovers that one of the student in the class next door to his, Sendo Erika, is in fact a type of vampire. (Source: Wikipedia)",Preview airing on October 2nd. Regular airing started on October 9th.,fall,2010,"{'day': None, 'time': None, 'timezone': None, 'string': 'Unknown'}","[{'mal_id': 689, 'type': 'anime', 'name': 'NTT Docomo', 'url': 'https://myanimelist.net/anime/producer/689/NTT_Docomo'}, {'mal_id': 779, 'type': 'anime', 'name': 'AMG MUSIC', 'url': 'https://myanimelist.net/anime/producer/779/AMG_MUSIC'}]",[],"[{'mal_id': 91, 'type': 'anime', 'name': 'feel.', 'url': 'https://myanimelist.net/anime/producer/91/feel'}, {'mal_id': 218, 'type': 'anime', 'name': 'Zexcs', 'url': 'https://myanimelist.net/anime/producer/218/Zexcs'}]","[{'mal_id': 4, 'type': 'anime', 'name': 'Comedy', 'url': 'https://myanimelist.net/anime/genre/4/Comedy'}, {'mal_id': 22, 'type': 'anime', 'name': 'Romance', 'url': 'https://myanimelist.net/anime/genre/22/Romance'}, {'mal_id': 37, 'type': 'anime', 'name': 'Supernatural', 'url': 'https://myanimelist.net/anime/genre/37/Supernatural'}]",[],"[{'mal_id': 23, 'type': 'anime', 'name': 'School', 'url': 'https://myanimelist.net/anime/genre/23/School'}, {'mal_id': 32, 'type': 'anime', 'name': 'Vampire', 'url': 'https://myanimelist.net/anime/genre/32/Vampire'}]",[]
8934,https://myanimelist.net/anime/8934/Star_Driver__Kagayaki_no_Takuto,"{'jpg': {'image_url': 'https://cdn.myanimelist.net/images/anime/4/25953.jpg', 'small_image_url': 'https://cdn.myanimelist.net/images/anime/4/25953t.jpg', 'large_image_url': 'https://cdn.myanimelist.net/images/anime/4/25953l.jpg'}, 'webp': {'image_url': 'https://cdn.myanimelist.net/images/anime/4/25953.webp', 'small_image_url': 'https://cdn.myanimelist.net/images/anime/4/25953t.webp', 'large_image_url': 'https://cdn.myanimelist.net/images/anime/4/25953l.webp'}}","{'youtube_id': None, 'url': None, 'embed_url': None, 'images': {'image_url': None, 'small_image_url': None, 'medium_image_url': None, 'large_image_url': None, 'maximum_image_url': None}}","""Star Driver: Kagayaki no Takuto""",Star Driver,STAR DRIVER 輝きのタクト,['STAR DRIVER: Shining Takuto'],TV,Original,25,Finished Airing,False,"{'from': '2010-10-03T00:00:00+00:00', 'to': '2011-04-03T00:00:00+00:00', 'prop': {'from': {'day': 3, 'month': 10, 'year': 2010}, 'to': {'day': 3, 'month': 4, 'year': 2011}}, 'string': 'Oct 3, 2010 to Apr 3, 2011'}",25 min per ep,PG-13 - Teens 13 or older,7.2,39641.0,2898,1612,105426,566,"Deep beneath the surface of Southern Cross Isle, a mysterious organization known as the Glittering Crux Brigade frequently gathers in their underground fortress. The group is particularly interested in ""Cybodies,"" stone giants which can transform into massive fighting humanoids but only in a realm known as ""Zero Time."" By finding and shattering the seals of the island's four seal maidens, Glittering Crux hopes to break free of Zero Time and use the Cybodies anywhere they please. One night, a young man named Takuto Tsunashi washes up on the island's shore and is rescued by Sugata Shindou and his fiancée Wako Agemaki, one of the island's seal maidens. After he awakens, Takuto quickly befriends the two and proceeds to enroll at the local academy, where many of his fellow students are secretly members of Glittering Crux. However, Takuto holds a secret: when in Zero Time, he can utilize a Cybody of his own—the Tauburn. In the forthcoming battle, Takuto and the Tauburn will be the key to preventing Glittering Crux from shattering Wako's seal and realizing its nefarious ambitions. [Written by MAL Rewrite]","There was an advance screening on September 16, 2010. The regular TV broadcast started on October 3, 2010.",fall,2010,"{'day': 'Sundays', 'time': '17:00', 'timezone': 'Asia/Tokyo', 'string': 'Sundays at 17:00 (JST)'}","[{'mal_id': 17, 'type': 'anime', 'name': 'Aniplex', 'url': 'https://myanimelist.net/anime/producer/17/Aniplex'}, {'mal_id': 53, 'type': 'anime', 'name': 'Dentsu', 'url': 'https://myanimelist.net/anime/producer/53/Dentsu'}, {'mal_id': 58, 'type': 'anime', 'name': 'Square Enix', 'url': 'https://myanimelist.net/anime/producer/58/Square_Enix'}, {'mal_id': 143, 'type': 'anime', 'name': 'Mainichi Broadcasting System', 'url': 'https://myanimelist.net/anime/producer/143/Mainichi_Broadcasting_System'}, {'mal_id': 1233, 'type': 'anime', 'name': 'Bandai Namco Entertainment', 'url': 'https://myanimelist.net/anime/producer/1233/Bandai_Namco_Entertainment'}]","[{'mal_id': 233, 'type': 'anime', 'name': 'Bandai Entertainment', 'url': 'https://myanimelist.net/anime/producer/233/Bandai_Entertainment'}, {'mal_id': 493, 'type': 'anime', 'name': 'Aniplex of America', 'url': 'https://myanimelist.net/anime/producer/493/Aniplex_of_America'}]","[{'mal_id': 4, 'type': 'anime', 'name': 'Bones', 'url': 'https://myanimelist.net/anime/producer/4/Bones'}]","[{'mal_id': 1, 'type': 'anime', 'name': 'Action', 'url': 'https://myanimelist.net/anime/genre/1/Action'}, {'mal_id': 22, 'type': 'anime', 'name': 'Romance', 'url': 'https://myanimelist.net/anime/genre/22/Romance'}]",[],"[{'mal_id': 18, 'type': 'anime', 'name': 'Mecha', 'url': 'https://myanimelist.net/anime/genre/18/Mecha'}]","[{'mal_id': 27, 'type': 'anime', 'name': 'Shounen', 'url': 'https://myanimelist.net/anime/genre/27/Shounen'}]"
9107,https://myanimelist.net/anime/9107/Pokemon_Best_Wishes,"{'jpg': {'image_url': 'https://cdn.myanimelist.net/images/anime/7/26135.jpg', 'small_image_url': 'https://cdn.myanimelist.net/images/anime/7/26135t.jpg', 'large_image_url': 'https://cdn.myanimelist.net/images/anime/7/26135l.jpg'}, 'webp': {'image_url': 'https://cdn.myanimelist.net/images/anime/7/26135.webp', 'small_image_url': 'https://cdn.myanimelist.net/images/anime/7/26135t.webp', 'large_image_url': 'https://cdn.myanimelist.net/images/anime/7/26135l.webp'}}","{'youtube_id': None, 'url': None, 'embed_url': None, 'images': {'image_url': None, 'small_image_url': None, 'medium_image_url': None, 'large_image_url': None, 'maximum_image_url': None}}","""Pokemon Best Wishes!""",Pokémon: Black & White,ポケットモンスターベストウイッシュ,"['Pocket Monsters: Best Wishes!', 'Black & White', 'BW: Rival Destinies']",TV,Game,84,Finished Airing,False,"{'from': '2010-09-23T00:00:00+00:00', 'to': '2012-06-14T00:00:00+00:00', 'prop': {'from': {'day': 23, 'month': 9, 'year': 2010}, 'to': {'day': 14, 'month': 6, 'year': 2012}}, 'string': 'Sep 23, 2010 to Jun 14, 2012'}",22 min per ep,PG - Children,6.39,48431.0,6776,1844,87163,137,"As with both the Advanced Generation and Diamond & Pearl series before it, the Best Wishes! series begins with only Satoshi, headed off to the Isshu region, located far away from Kanto, Johto, Houen, and Sinnoh, with his Pikachu. After he meets up with the new trainer and rival Shooty and the region's Professor Araragi, he gains traveling companions in Iris, a girl from a town known for its Dragon Pokémon, and Dent, Pokémon Connoisseur and the Grass Pokémon specialist of the three Sanyou City Gym Leaders.",,fall,2010,"{'day': 'Thursdays', 'time': '19:00', 'timezone': 'Asia/Tokyo', 'string': 'Thursdays at 19:00 (JST)'}","[{'mal_id': 16, 'type': 'anime', 'name': 'TV Tokyo', 'url': 'https://myanimelist.net/anime/producer/16/TV_Tokyo'}, {'mal_id': 135, 'type': 'anime', 'name': 'MediaNet', 'url': 'https://myanimelist.net/anime/producer/135/MediaNet'}, {'mal_id': 213, 'type': 'anime', 'name': 'Half H.P Studio', 'url': 'https://myanimelist.net/anime/producer/213/Half_HP_Studio'}, {'mal_id': 829, 'type': 'anime', 'name': 'Studio Jack', 'url': 'https://myanimelist.net/anime/producer/829/Studio_Jack'}]","[{'mal_id': 119, 'type': 'anime', 'name': 'VIZ Media', 'url': 'https://myanimelist.net/anime/producer/119/VIZ_Media'}, {'mal_id': 499, 'type': 'anime', 'name': 'The Pokemon Company International', 'url': 'https://myanimelist.net/anime/producer/499/The_Pokemon_Company_International'}]","[{'mal_id': 28, 'type': 'anime', 'name': 'OLM', 'url': 'https://myanimelist.net/anime/producer/28/OLM'}]","[{'mal_id': 1, 'type': 'anime', 'name': 'Action', 'url': 'https://myanimelist.net/anime/genre/1/Action'}, {'mal_id': 2, 'type': 'anime', 'name': 'Adventure', 'url': 'https://myanimelist.net/anime/genre/2/Adventure'}, {'mal_id': 4, 'type': 'anime', 'name': 'Comedy', 'url': 'https://myanimelist.net/anime/genre/4/Comedy'}, {'mal_id': 10, 'type': 'anime', 'name': 'Fantasy', 'url': 'https://myanimelist.net/anime/genre/10/Fantasy'}]",[],[],"[{'mal_id': 15, 'type': 'anime', 'name': 'Kids', 'url': 'https://myanimelist.net/anime/genre/15/Kids'}]"
8449,https://myanimelist.net/anime/8449/Togainu_no_Chi,"{'jpg': {'image_url': 'https://cdn.myanimelist.net/images/anime/5/75187.jpg', 'small_image_url': 'https://cdn.myanimelist.net/images/anime/5/75187t.jpg', 'large_image_url': 'https://cdn.myanimelist.net/images/anime/5/75187l.jpg'}, 'webp': {'image_url': 'https://cdn.myanimelist.net/images/anime/5/75187.webp', 'small_image_url': 'https://cdn.myanimelist.net/images/anime/5/75187t.webp', 'large_image_url': 'https://cdn.myanimelist.net/images/anime/5/75187l.webp'}}","{'youtube_id': 'jbbv1LYjc2Y', 'url': 'https://www.youtube.com/watch?v=jbbv1LYjc2Y', 'embed_url': 'https://www.youtube.com/embed/jbbv1LYjc2Y?enablejsapi=1&wmode=opaque&autoplay=1', 'images': {'image_url': 'https://img.youtube.com/vi/jbbv1LYjc2Y/default.jpg', 'small_image_url': 'https://img.youtube.com/vi/jbbv1LYjc2Y/sddefault.jpg', 'medium_image_url': 'https://img.youtube.com/vi/jbbv1LYjc2Y/mqdefault.jpg', 'large_image_url': 'https://img.youtube.com/vi/jbbv1LYjc2Y/hqdefault.jpg', 'maximum_image_url': 'https://img.youtube.com/vi/jbbv1LYjc2Y/maxresdefault.jpg'}}","""Togainu no Chi""",Togainu no Chi,咎狗の血,['Blood of the Reprimanded Dog'],TV,Visual novel,12,Finished Airing,False,"{'from': '2010-10-08T00:00:00+00:00', 'to': '2010-12-23T00:00:00+00:00', 'prop': {'from': {'day': 8, 'month': 10, 'year': 2010}, 'to': {'day': 23, 'month': 12, 'year': 2010}}, 'string': 'Oct 8, 2010 to Dec 23, 2010'}",24 min per ep,R - 17+ (violence & profanity),6.25,32463.0,7469,1921,82031,342,"In the wake of a third world war which left Japan in ruins, an organization known as Vischio seized control of Tokyo and renamed it Toshima. Taking place in its back alleys are battle games known as Igura, overseen by the Vischio, in which contestants battle and bathe in each other's blood to earn the chance to go up against its tournament's king, Il-re. Igura is not the only fighting tournament around; Bl@ster is a similar yet vastly different game since it prohibits murder and the use of weapons. The only way to win is by knocking out the opponent. Akira, a young man isolated from his family, is known to be undefeatable at Bl@ster. However, his life on the top is shattered when he is accused of murder. Unable to prove his own innocence, all hope is seemingly lost... that is until a mysterious woman named Emma appears and offers him a chance. Now, to regain his freedom, Akira must participate in Igura and ultimately defeat Il-re. [Written by MAL Rewrite]","Preview airing on September 23, 2010. The regular TV broadcast started on October 8, 2010.",fall,2010,"{'day': None, 'time': None, 'timezone': None, 'string': 'Unknown'}","[{'mal_id': 17, 'type': 'anime', 'name': 'Aniplex', 'url': 'https://myanimelist.net/anime/producer/17/Aniplex'}, {'mal_id': 78, 'type': 'anime', 'name': 'Picture Magic', 'url': 'https://myanimelist.net/anime/producer/78/Picture_Magic'}, {'mal_id': 104, 'type': 'anime', 'name': 'Lantis', 'url': 'https://myanimelist.net/anime/producer/104/Lantis'}, {'mal_id': 143, 'type': 'anime', 'name': 'Mainichi Broadcasting System', 'url': 'https://myanimelist.net/anime/producer/143/Mainichi_Broadcasting_System'}, {'mal_id': 166, 'type': 'anime', 'name': 'Movic', 'url': 'https://myanimelist.net/anime/producer/166/Movic'}, {'mal_id': 459, 'type': 'anime', 'name': 'Nitroplus', 'url': 'https://myanimelist.net/anime/producer/459/Nitroplus'}]","[{'mal_id': 493, 'type': 'anime', 'name': 'Aniplex of America', 'url': 'https://myanimelist.net/anime/producer/493/Aniplex_of_America'}]","[{'mal_id': 56, 'type': 'anime', 'name': 'A-1 Pictures', 'url': 'https://myanimelist.net/anime/producer/56/A-1_Pictures'}]","[{'mal_id': 1, 'type': 'anime', 'name': 'Action', 'url': 'https://myanimelist.net/anime/genre/1/Action'}, {'mal_id': 28, 'type': 'anime', 'name': 'Boys Love', 'url': 'https://myanimelist.net/anime/genre/28/Boys_Love'}, {'mal_id': 24, 'type': 'anime', 'name': 'Sci-Fi', 'url': 'https://myanimelist.net/anime/genre/24/Sci-Fi'}]",[],[],[]
