mal_id,url,images,trailer,title,title_english,title_japanese,title_synonyms,type,source,episodes,status,airing,aired,duration,rating,score,scored_by,rank,popularity,members,favorites,synopsis,background,season,year,broadcast,producers,licensors,studios,genres,explicit_genres,themes,demographics
8769,https://myanimelist.net/anime/8769/Ore_no_Imouto_ga_Konnani_Kawaii_Wake_ga_Nai,"{'jpg': {'image_url': 'https://cdn.myanimelist.net/images/anime/8/24875.jpg', 'small_image_url': 'https://cdn.myanimelist.net/images/anime/8/24875t.jpg', 'large_image_url': 'https://cdn.myanimelist.net/images/anime/8/24875l.jpg'}, 'webp': {'image_url': 'https://cdn.myanimelist.net/images/anime/8/24875.webp', 'small_image_url': 'https://cdn.myanimelist.net/images/anime/8/24875t.webp', 'large_image_url': 'https://cdn.myanimelist.net/images/anime/8/24875l.webp'}}","{'youtube_id': 'f_2F7u2-6yc', 'url': 'https://www.youtube.com/watch?v=f_2F7u2-6yc', 'embed_url': 'https://www.youtube.com/embed/f_2F7u2-6yc?enablejsapi=1&wmode=opaque&autoplay=1', 'images': {'image_url': 'https://img.youtube.com/vi/f_2F7u2-6yc/default.jpg', 'small_image_url': 'https://img.youtube.com/vi/f_2F7u2-6yc/sddefault.jpg', 'medium_image_url': 'https://img.youtube.com/vi/f_2F7u2-6yc/mqdefault.jpg', 'large_image_url': 'https://img.youtube.com/vi/f_2F7u2-6yc/hqdefault.jpg', 'maximum_image_url': 'https://img.youtube.com/vi/f_2F7u2-6yc/maxresdefault.jpg'}}","""Ore no Imouto ga Konnani Kawaii Wake ga Nai""",OreImo,俺の妹がこんなに可愛いわけがない,"[""My Little Sister Can't Be This Cute""]",TV,Light novel,12,Finished Airing,False,"{'from': '2010-10-03T00:00:00+00:00', 'to': '2010-12-19T00:00:00+00:00', 'prop': {'from': {'day': 3, 'month': 10, 'year': 2010}, 'to': {'day': 19, 'month': 12, 'year': 2010}}, 'string': 'Oct 3, 2010 to Dec 19, 2010'}",24 min per ep,PG-13 - Teens 13 or older,7.01,352155.0,3806,244,627852,4297,"Kirino Kousaka embodies the ideal student with equally entrancing looks. Her grades are near perfect, and to cover her personal expenses, she works as a professional model alongside her best friend Ayase Aragaki, who abhors liars and all things otaku. But what Ayase doesn't know is that Kirino harbors a deep, entrenched secret that will soon be brought to light. At home one day, Kyousuke, Kirino's perfectly average brother, stumbles upon an erotic game that belongs to none other than his seemingly flawless little sister. With her reputation at stake, Kirino places a gag order on her sibling while simultaneously introducing him to the world of eroge and anime. Through Kirino, Kyousuke encounters the gothic lolita Ruri Gokou and the bespectacled otaku Saori Makishima, thus jump-starting an entirely new lifestyle. But as he becomes more and more involved in his little sister's secret life, it becomes that much harder to keep under wraps. [Written by MAL Rewrite]","Ore no Imouto ga Konnani Kawaii Wake ga Nai also has a drama CD, a radio show and video games based on the franchise.",fall,2010,"{'day': 'Sundays', 'time': '23:30', 'timezone': 'Asia/Tokyo', 'string': 'Sundays at 23:30 (JST)'}","[{'mal_id': 17, 'type': 'anime', 'name': 'Aniplex', 'url': 'https://myanimelist.net/anime/producer/17/Aniplex'}, {'mal_id': 48, 'type': 'anime', 'name': 'AIC', 'url': 'https://myanimelist.net/anime/producer/48/AIC'}, {'mal_id': 166, 'type': 'anime', 'name': 'Movic', 'url': 'https://myanimelist.net/anime/producer/166/Movic'}, {'mal_id': 681, 'type': 'anime', 'name': 'ASCII Media Works', 'url': 'https://myanimelist.net/anime/producer/681/ASCII_Media_Works'}, {'mal_id': 755, 'type': 'anime', 'name': 'Jumondo', 'url': 'https://myanimelist.net/anime/producer/755/Jumondo'}]","[{'mal_id': 493, 'type': 'anime', 'name': 'Aniplex of America', 'url': 'https://myanimelist.net/anime/producer/493/Aniplex_of_America'}]","[{'mal_id': 436, 'type': 'anime', 'name': 'AIC Build', 'url': 'https://myanimelist.net/anime/producer/436/AIC_Build'}]","[{'mal_id': 4, 'type': 'anime', 'name': 'Comedy', 'url': 'https://myanimelist.net/anime/genre/4/Comedy'}, {'mal_id': 36, 'type': 'anime', 'name': 'Slice of Life', 'url': 'https://myanimelist.net/anime/genre/36/Slice_of_Life'}]",[],[],[]
8525,https://myanimelist.net/anime/8525/Kami_nomi_zo_Shiru_Sekai,"{'jpg': {'image_url': 'https://cdn.myanimelist.net/images/anime/2/43361.jpg', 'small_image_url': 'https://cdn.myanimelist.net/images/anime/2/43361t.jpg', 'large_image_url': 'https://cdn.myanimelist.net/images/anime/2/43361l.jpg'}, 'webp': {'image_url': 'https://cdn.myanimelist.net/images/anime/2/43361.webp', 'small_image_url': 'https://cdn.myanimelist.net/images/anime/2/43361t.webp', 'large_image_url': 'https://cdn.myanimelist.net/images/anime/2/43361l.webp'}}","{'youtube_id': 'OdBmj4TWqzk', 'url': 'https://www.youtube.com/watch?v=OdBmj4TWqzk', 'embed_url': 'https://www.youtube.com/embed/OdBmj4TWqzk?enablejsapi=1&wmode=opaque&autoplay=1', 'images': {'image_url': 'https://img.youtube.com/vi/OdBmj4TWqzk/default.jpg', 'small_image_url': 'https://img.youtube.com/vi/OdBmj4TWqzk/sddefault.jpg', 'medium_image_url': 'https://img.youtube.com/vi/OdBmj4TWqzk/mqdefault.jpg', 'large_image_url': 'https://img.youtube.com/vi/OdBmj4TWqzk/hqdefault.jpg', 'maximum_image_url': 'https://img.youtube.com/vi/OdBmj4TWqzk/maxresdefault.jpg'}}","""Kami nomi zo Shiru Sekai""",The World God Only Knows,神のみぞ知るセカイ,['Kaminomi'],TV,Manga,12,Finished Airing,False,"{'from': '2010-10-07T00:00:00+00:00', 'to': '2010-12-23T00:00:00+00:00', 'prop': {'from': {'day': 7, 'month': 10, 'year': 2010}, 'to': {'day': 23, 'month': 12, 'year': 2010}}, 'string': 'Oct 7, 2010 to Dec 23, 2010'}",23 min per ep,PG-13 - Teens 13 or older,7.68,301283.0,1132,290,569146,5409,"Keima Katsuragi, known online as the legendary ""God of Conquest,"" can conquer any girl's heart—in dating sim games, at least. In reality, he opts for the two-dimensional world of gaming over real life because he is an unhealthily obsessed otaku of galge games (a type of Japanese video game centered on interactions with attractive girls). When he arrogantly accepts an anonymous offer to prove his supremacy at dating sim games, Keima is misled into aiding a naïve and impish demon from hell named Elucia ""Elsie"" de Lute Ima with her mission: retrieving runaway evil spirits who have escaped from hell and scattered themselves throughout the human world. Keima discovers that the only way to capture these spirits is to conquer what he hates the most: the unpredictable hearts of three-dimensional girls! Shackled to Elsie via a deadly collar, Keima now has his title of ""God of Conquest"" put to the ultimate test as he is forced to navigate through the hearts of a multitude of real-life girls. [Written by MAL Rewrite]","There was a limited viewing on September 25, 2010. The regular TV broadcasts started on October 7, 2010.",fall,2010,"{'day': 'Thursdays', 'time': '01:50', 'timezone': 'Asia/Tokyo', 'string': 'Thursdays at 01:50 (JST)'}","[{'mal_id': 16, 'type': 'anime', 'name': 'TV Tokyo', 'url': 'https://myanimelist.net/anime/producer/16/TV_Tokyo'}, {'mal_id': 31, 'type': 'anime', 'name': 'Geneon Universal Entertainment', 'url': 'https://myanimelist.net/anime/producer/31/Geneon_Universal_Entertainment'}]","[{'mal_id': 376, 'type': 'anime', 'name': 'Sentai Filmworks', 'url': 'https://myanimelist.net/anime/producer/376/Sentai_Filmworks'}]","[{'mal_id': 32, 'type': 'anime', 'name': 'Manglobe', 'url': 'https://myanimelist.net/anime/producer/32/Manglobe'}]","[{'mal_id': 4, 'type': 'anime', 'name': 'Comedy', 'url': 'https://myanimelist.net/anime/genre/4/Comedy'}, {'mal_id': 22, 'type': 'anime', 'name': 'Romance', 'url': 'https://myanimelist.net/anime/genre/22/Romance'}, {'mal_id': 37, 'type': 'anime', 'name': 'Supernatural', 'url': 'https://myanimelist.net/anime/genre/37/Supernatural'}]",[],"[{'mal_id': 35, 'type': 'anime', 'name': 'Harem', 'url': 'https://myanimelist.net/anime/genre/35/Harem'}]","[{'mal_id': 27, 'type': 'anime', 'name': 'Shounen', 'url': 'https://myanimelist.net/anime/genre/27/Shounen'}]"
7674,https://myanimelist.net/anime/7674/Bakuman,"{'jpg': {'image_url': 'https://cdn.myanimelist.net/images/anime/6/26138.jpg', 'small_image_url': 'https://cdn.myanimelist.net/images/anime/6/26138t.jpg', 'large_image_url': 'https://cdn.myanimelist.net/images/anime/6/26138l.jpg'}, 'webp': {'image_url': 'https://cdn.myanimelist.net/images/anime/6/26138.webp', 'small_image_url': 'https://cdn.myanimelist.net/images/anime/6/26138t.webp', 'large_image_url': 'https://cdn.myanimelist.net/images/anime/6/26138l.webp'}}","{'youtube_id': 'KB7QDax8PtY', 'url': 'https://www.youtube.com/watch?v=KB7QDax8PtY', 'embed_url': 'https://www.youtube.com/embed/KB7QDax8PtY?enablejsapi=1&wmode=opaque&autoplay=1', 'images': {'image_url': 'https://img.youtube.com/vi/KB7QDax8PtY/default.jpg', 'small_image_url': 'https://img.youtube.com/vi/KB7QDax8PtY/sddefault.jpg', 'medium_image_url': 'https://img.youtube.com/vi/KB7QDax8PtY/mqdefault.jpg', 'large_image_url': 'https://img.youtube.com/vi/KB7QDax8PtY/hqdefault.jpg', 'maximum_image_url': 'https://img.youtube.com/vi/KB7QDax8PtY/maxresdefault.jpg'}}","""Bakuman.""",Bakuman.,バクマン。,['Bakuman Season 1'],TV,Manga,25,Finished Airing,False,"{'from': '2010-10-02T00:00:00+00:00', 'to': '2011-04-02T00:00:00+00:00', 'prop': {'from': {'day': 2, 'month': 10, 'year': 2010}, 'to': {'day': 2, 'month': 4, 'year': 2011}}, 'string': 'Oct 2, 2010 to Apr 2, 2011'}",24 min per ep,PG-13 - Teens 13 or older,8.2,260685.0,321,297,558042,8933,"As a child, Moritaka Mashiro dreamt of becoming a mangaka, just like his childhood hero and uncle, Tarou Kawaguchi, creator of a popular gag manga. But when tragedy strikes, he gives up on his dream and spends his middle school days studying, aiming to become a salaryman instead. One day, his classmate Akito Takagi, the school's top student and aspiring writer, notices the detailed drawings in Moritaka's notebook. Seeing the vast potential of his artistic talent, Akito approaches Moritaka, proposing that they become mangaka together. After much convincing, Moritaka realizes that if he is able to create a popular manga series, he may be able to get the girl he has a crush on, Miho Azuki, to take part in the anime adaptation as a voice actor. Thus the pair begins creating manga under the pen name Muto Ashirogi, hoping to become the greatest mangaka in Japan, the likes of which no one has ever seen. [Written by MAL Rewrite]","Bakuman. was licensed by Media Blasters in North America, but only released one 2-disc DVD containing the first 7 episodes, the rest of the releases were cancelled.",fall,2010,"{'day': None, 'time': None, 'timezone': None, 'string': 'Unknown'}","[{'mal_id': 111, 'type': 'anime', 'name': 'NHK', 'url': 'https://myanimelist.net/anime/producer/111/NHK'}, {'mal_id': 1365, 'type': 'anime', 'name': 'Shueisha', 'url': 'https://myanimelist.net/anime/producer/1365/Shueisha'}]","[{'mal_id': 250, 'type': 'anime', 'name': 'Media Blasters', 'url': 'https://myanimelist.net/anime/producer/250/Media_Blasters'}]","[{'mal_id': 7, 'type': 'anime', 'name': 'J.C.Staff', 'url': 'https://myanimelist.net/anime/producer/7/JCStaff'}]","[{'mal_id': 4, 'type': 'anime', 'name': 'Comedy', 'url': 'https://myanimelist.net/anime/genre/4/Comedy'}, {'mal_id': 8, 'type': 'anime', 'name': 'Drama', 'url': 'https://myanimelist.net/anime/genre/8/Drama'}, {'mal_id': 22, 'type': 'anime', 'name': 'Romance', 'url': 'https://myanimelist.net/anime/genre/22/Romance'}]",[],[],"[{'mal_id': 27, 'type': 'anime', 'name': 'Shounen', 'url': 'https://myanimelist.net/anime/genre/27/Shounen'}]"
8861,https://myanimelist.net/anime/8861/Yosuga_no_Sora__In_Solitude_Where_We_Are_Least_Alone,"{'jpg': {'image_url': 'https://cdn.myanimelist.net/images/anime/5/76216.jpg', 'small_image_url': 'https://cdn.myanimelist.net/images/anime/5/76216t.jpg', 'large_image_url': 'https://cdn.myanimelist.net/images/anime/5/76216l.jpg'}, 'webp': {'image_url': 'https://cdn.myanimelist.net/images/anime/5/76216.webp', 'small_image_url': 'https://cdn.myanimelist.net/images/anime/5/76216t.webp', 'large_image_url': 'https://cdn.myanimelist.net/images/anime/5/76216l.webp'}}","{'youtube_id': 'GWASk2j2CAc', 'url': 'https://www.youtube.com/watch?v=GWASk2j2CAc', 'embed_url': 'https://www.youtube.com/embed/GWASk2j2CAc?enablejsapi=1&wmode=opaque&autoplay=1', 'images': {'image_url': 'https://img.youtube.com/vi/GWASk2j2CAc/default.jpg', 'small_image_url': 'https://img.youtube.com/vi/GWASk2j2CAc/sddefault.jpg', 'medium_image_url': 'https://img.youtube.com/vi/GWASk2j2CAc/mqdefault.jpg', 'large_image_url': 'https://img.youtube.com/vi/GWASk2j2CAc/hqdefault.jpg', 'maximum_image_url': 'https://img.youtube.com/vi/GWASk2j2CAc/maxresdefault.jpg'}}","""Yosuga no Sora: In Solitude, Where We Are Least Alone.""",Yosuga no Sora,"ヨスガノソラ In solitude, where we are least alone.",['Sky of Connection'],TV,Visual novel,12,Finished Airing,False,"{'from': '2010-10-04T00:00:00+00:00', 'to': '2010-12-20T00:00:00+00:00', 'prop': {'from': {'day': 4, 'month': 10, 'year': 2010}, 'to': {'day': 20, 'month': 12, 'year': 2010}}, 'string': 'Oct 4, 2010 to Dec 20, 2010'}",25 min per ep,R+ - Mild Nudity,6.13,226857.0,8080,404,433541,2017,"Due to a sudden accident, twins Haruka and Sora Kasugano have lost both of their parents. Starting their lives anew, they return to their childhood home—living once again in the rural, quaint town like they did four years ago. However, revisiting such a nostalgic place also means recalling all the memories the two of them made together, be it those that gave them blissful joy or those that made them suffer painful sorrow. Meeting both old acquaintances and new companions alike, the story of Haruka and Sora only gets more convoluted as their lives are slowly influenced by different acts of love, friendship, envy—and perhaps even lust. [Written by MAL Rewrite]",,fall,2010,"{'day': 'Mondays', 'time': '23:30', 'timezone': 'Asia/Tokyo', 'string': 'Mondays at 23:30 (JST)'}","[{'mal_id': 92, 'type': 'anime', 'name': 'Starchild Records', 'url': 'https://myanimelist.net/anime/producer/92/Starchild_Records'}, {'mal_id': 719, 'type': 'anime', 'name': 'Studio Mausu', 'url': 'https://myanimelist.net/anime/producer/719/Studio_Mausu'}, {'mal_id': 721, 'type': 'anime', 'name': 'GANSIS', 'url': 'https://myanimelist.net/anime/producer/721/GANSIS'}, {'mal_id': 753, 'type': 'anime', 'name': 'PRA', 'url': 'https://myanimelist.net/anime/producer/753/PRA'}]","[{'mal_id': 250, 'type': 'anime', 'name': 'Media Blasters', 'url': 'https://myanimelist.net/anime/producer/250/Media_Blasters'}]","[{'mal_id': 91, 'type': 'anime', 'name': 'feel.', 'url': 'https://myanimelist.net/anime/producer/91/feel'}]","[{'mal_id': 8, 'type': 'anime', 'name': 'Drama', 'url': 'https://myanimelist.net/anime/genre/8/Drama'}, {'mal_id': 22, 'type': 'anime', 'name': 'Romance', 'url': 'https://myanimelist.net/anime/genre/22/Romance'}, {'mal_id': 9, 'type': 'anime', 'name': 'Ecchi', 'url': 'https://myanimelist.net/anime/genre/9/Ecchi'}]",[],"[{'mal_id': 35, 'type': 'anime', 'name': 'Harem', 'url': 'https://myanimelist.net/anime/genre/35/Harem'}]",[]
8937,https://myanimelist.net/anime/8937/Toaru_Majutsu_no_Index_II,"{'jpg': {'image_url': 'https://cdn.myanimelist.net/images/anime/9/75612.jpg', 'small_image_url': 'https://cdn.myanimelist.net/images/anime/9/75612t.jpg', 'large_image_url': 'https://cdn.myanimelist.net/images/anime/9/75612l.jpg'}, 'webp': {'image_url': 'https://cdn.myanimelist.net/images/anime/9/75612.webp', 'small_image_url': 'https://cdn.myanimelist.net/images/anime/9/75612t.webp', 'large_image_url': 'https://cdn.myanimelist.net/images/anime/9/75612l.webp'}}","{'youtube_id': 'iQEtwmBDqE4', 'url': 'https://www.youtube.com/watch?v=iQEtwmBDqE4', 'embed_url': 'https://www.youtube.com/embed/iQEtwmBDqE4?enablejsapi=1&wmode=opaque&autoplay=1', 'images': {'image_url': 'https://img.youtube.com/vi/iQEtwmBDqE4/default.jpg', 'small_image_url': 'https://img.youtube.com/vi/iQEtwmBDqE4/sddefault.jpg', 'medium_image_url': 'https://img.youtube.com/vi/iQEtwmBDqE4/mqdefault.jpg', 'large_image_url': 'https://img.youtube.com/vi/iQEtwmBDqE4/hqdefault.jpg', 'maximum_image_url': 'https://img.youtube.com/vi/iQEtwmBDqE4/maxresdefault.jpg'}}","""Toaru Majutsu no Index II""",A Certain Magical Index II,とある魔術の禁書目録Ⅱ,"['Toaru Majutsu no Index 2', 'Toaru Majutsu no Kinsho Mokuroku 2']",TV,Light novel,24,Finished Airing,False,"{'from': '2010-10-08T00:00:00+00:00', 'to': '2011-04-01T00:00:00+00:00', 'prop': {'from': {'day': 8, 'month': 10, 'year': 2010}, 'to': {'day': 1, 'month': 4, 'year': 2011}}, 'string': 'Oct 8, 2010 to Apr 1, 2011'}",23 min per ep,R - 17+ (violence & profanity),7.56,223559.0,1441,417,414921,1701,"As tensions between the world of magic and Academy City continues to rise, Touma Kamijou and his hand of negation must face off against both esper and magician in order to protect the lives of those around him. Of course, he is not alone in his fight; whether by his side or out of sight, allies and enemies both old and new will enter the fray to help him. Toaru Majutsu no Index II continues the story of action and comedy, as the scale of Touma and his allies' battle grows ever larger. A conflict is slowly brewing on the horizon, and magic and science will cross paths once again in the war to come. [Written by MAL Rewrite]",Toaru Majutsu no Index II adapts novels 7 to 13 of Kazuma Kamachi's light novel series of the same title and the first novel of the side story series Toaru Majutsu no Index SS.,fall,2010,"{'day': 'Fridays', 'time': '23:30', 'timezone': 'Asia/Tokyo', 'string': 'Fridays at 23:30 (JST)'}","[{'mal_id': 31, 'type': 'anime', 'name': 'Geneon Universal Entertainment', 'url': 'https://myanimelist.net/anime/producer/31/Geneon_Universal_Entertainment'}, {'mal_id': 58, 'type': 'anime', 'name': 'Square Enix', 'url': 'https://myanimelist.net/anime/producer/58/Square_Enix'}, {'mal_id': 238, 'type': 'anime', 'name': 'AT-X', 'url': 'https://myanimelist.net/anime/producer/238/AT-X'}, {'mal_id': 681, 'type': 'anime', 'name': 'ASCII Media Works', 'url': 'https://myanimelist.net/anime/producer/681/ASCII_Media_Works'}, {'mal_id': 711, 'type': 'anime', 'name': 'Delfi Sound', 'url': 'https://myanimelist.net/anime/producer/711/Delfi_Sound'}]","[{'mal_id': 102, 'type': 'anime', 'name': 'Funimation', 'url': 'https://myanimelist.net/anime/producer/102/Funimation'}]","[{'mal_id': 7, 'type': 'anime', 'name': 'J.C.Staff', 'url': 'https://myanimelist.net/anime/producer/7/JCStaff'}]","[{'mal_id': 1, 'type': 'anime', 'name': 'Action', 'url': 'https://myanimelist.net/anime/genre/1/Action'}, {'mal_id': 24, 'type': 'anime', 'name': 'Sci-Fi', 'url': 'https://myanimelist.net/anime/genre/24/Sci-Fi'}]",[],"[{'mal_id': 31, 'type': 'anime', 'name': 'Super Power', 'url': 'https://myanimelist.net/anime/genre/31/Super_Power'}]",[]
8795,https://myanimelist.net/anime/8795/Panty___Stocking_with_Garterbelt,"{'jpg': {'image_url': 'https://cdn.myanimelist.net/images/anime/12/73643.jpg', 'small_image_url': 'https://cdn.myanimelist.net/images/anime/12/73643t.jpg', 'large_image_url': 'https://cdn.myanimelist.net/images/anime/12/73643l.jpg'}, 'webp': {'image_url': 'https://cdn.myanimelist.net/images/anime/12/73643.webp', 'small_image_url': 'https://cdn.myanimelist.net/images/anime/12/73643t.webp', 'large_image_url': 'https://cdn.myanimelist.net/images/anime/12/73643l.webp'}}","{'youtube_id': 'iZbGlVqKXTM', 'url': 'https://www.youtube.com/watch?v=iZbGlVqKXTM', 'embed_url': 'https://www.youtube.com/embed/iZbGlVqKXTM?enablejsapi=1&wmode=opaque&autoplay=1', 'images': {'image_url': 'https://img.youtube.com/vi/iZbGlVqKXTM/default.jpg', 'small_image_url': 'https://img.youtube.com/vi/iZbGlVqKXTM/sddefault.jpg', 'medium_image_url': 'https://img.youtube.com/vi/iZbGlVqKXTM/mqdefault.jpg', 'large_image_url': 'https://img.youtube.com/vi/iZbGlVqKXTM/hqdefault.jpg', 'maximum_image_url': 'https://img.youtube.com/vi/iZbGlVqKXTM/maxresdefault.jpg'}}","""Panty & Stocking with Garterbelt""",Panty & Stocking with Garterbelt,パンティ＆ストッキングwithガーターベルト,"['PanSto', 'PSG']",TV,Original,13,Finished Airing,False,"{'from': '2010-10-02T00:00:00+00:00', 'to': '2010-12-25T00:00:00+00:00', 'prop': {'from': {'day': 2, 'month': 10, 'year': 2010}, 'to': {'day': 25, 'month': 12, 'year': 2010}}, 'string': 'Oct 2, 2010 to Dec 25, 2010'}",23 min per ep,R - 17+ (violence & profanity),7.72,162445.0,1022,535,334319,4748,"The ""Anarchy Sisters,"" Panty and Stocking, have been kicked out of Heaven for, to put it mildly, misbehaving. Led by a priest named Garterbelt, these angels must buy their way back by exterminating ghosts in Daten City. But this task requires unconventional weapons for these unorthodox angels—they transform their lingerie into weapons to dispatch the spirits. Unfortunately, neither of them take their duties seriously, as they rather spend their time in pursuit of other ""hobbies"": Panty prefers to sleep with anything that walks, and Stocking favors stuffing her face with sweets than hunting ghosts. Follow these two unruly angels as they battle ghosts, an overflow of bodily fluids, and their own tendency to get side-tracked in Panty & Stocking with Garterbelt. [Written by MAL Rewrite]",,fall,2010,"{'day': None, 'time': None, 'timezone': None, 'string': 'Unknown'}","[{'mal_id': 113, 'type': 'anime', 'name': 'Kadokawa Shoten', 'url': 'https://myanimelist.net/anime/producer/113/Kadokawa_Shoten'}, {'mal_id': 213, 'type': 'anime', 'name': 'Half H.P Studio', 'url': 'https://myanimelist.net/anime/producer/213/Half_HP_Studio'}, {'mal_id': 238, 'type': 'anime', 'name': 'AT-X', 'url': 'https://myanimelist.net/anime/producer/238/AT-X'}, {'mal_id': 352, 'type': 'anime', 'name': 'Kadokawa Pictures Japan', 'url': 'https://myanimelist.net/anime/producer/352/Kadokawa_Pictures_Japan'}, {'mal_id': 460, 'type': 'anime', 'name': 'KlockWorx', 'url': 'https://myanimelist.net/anime/producer/460/KlockWorx'}, {'mal_id': 464, 'type': 'anime', 'name': 'flying DOG', 'url': 'https://myanimelist.net/anime/producer/464/flying_DOG'}, {'mal_id': 685, 'type': 'anime', 'name': 'Kadokawa Contents Gate', 'url': 'https://myanimelist.net/anime/producer/685/Kadokawa_Contents_Gate'}]","[{'mal_id': 102, 'type': 'anime', 'name': 'Funimation', 'url': 'https://myanimelist.net/anime/producer/102/Funimation'}]","[{'mal_id': 6, 'type': 'anime', 'name': 'Gainax', 'url': 'https://myanimelist.net/anime/producer/6/Gainax'}]","[{'mal_id': 1, 'type': 'anime', 'name': 'Action', 'url': 'https://myanimelist.net/anime/genre/1/Action'}, {'mal_id': 4, 'type': 'anime', 'name': 'Comedy', 'url': 'https://myanimelist.net/anime/genre/4/Comedy'}, {'mal_id': 37, 'type': 'anime', 'name': 'Supernatural', 'url': 'https://myanimelist.net/anime/genre/37/Supernatural'}, {'mal_id': 9, 'type': 'anime', 'name': 'Ecchi', 'url': 'https://myanimelist.net/anime/genre/9/Ecchi'}]",[],"[{'mal_id': 20, 'type': 'anime', 'name': 'Parody', 'url': 'https://myanimelist.net/anime/genre/20/Parody'}]",[]
