mal_id,url,images,trailer,title,title_english,title_japanese,title_synonyms,type,source,episodes,status,airing,aired,duration,rating,score,scored_by,rank,popularity,members,favorites,synopsis,background,season,year,broadcast,producers,licensors,studios,genres,explicit_genres,themes,demographics
9065,https://myanimelist.net/anime/9065/Hakuouki__Hekketsuroku,"{'jpg': {'image_url': 'https://cdn.myanimelist.net/images/anime/12/71797.jpg', 'small_image_url': 'https://cdn.myanimelist.net/images/anime/12/71797t.jpg', 'large_image_url': 'https://cdn.myanimelist.net/images/anime/12/71797l.jpg'}, 'webp': {'image_url': 'https://cdn.myanimelist.net/images/anime/12/71797.webp', 'small_image_url': 'https://cdn.myanimelist.net/images/anime/12/71797t.webp', 'large_image_url': 'https://cdn.myanimelist.net/images/anime/12/71797l.webp'}}","{'youtube_id': 'T9Ar9XL1Fq8', 'url': 'https://www.youtube.com/watch?v=T9Ar9XL1Fq8', 'embed_url': 'https://www.youtube.com/embed/T9Ar9XL1Fq8?enablejsapi=1&wmode=opaque&autoplay=1', 'images': {'image_url': 'https://img.youtube.com/vi/T9Ar9XL1Fq8/default.jpg', 'small_image_url': 'https://img.youtube.com/vi/T9Ar9XL1Fq8/sddefault.jpg', 'medium_image_url': 'https://img.youtube.com/vi/T9Ar9XL1Fq8/mqdefault.jpg', 'large_image_url': 'https://img.youtube.com/vi/T9Ar9XL1Fq8/hqdefault.jpg', 'maximum_image_url': 'https://img.youtube.com/vi/T9Ar9XL1Fq8/maxresdefault.jpg'}}","""Hakuouki: Hekketsuroku""",Hakuoki: Demon of the Fleeting Blossom - Record of the Jade Blood,薄桜鬼 碧血録,"['Hakuouki 2', 'Hakuoki 2', 'Hakuouki Shinsengumi Kitan Hekketsuroku']",TV,Visual novel,10,Finished Airing,False,"{'from': '2010-10-04T00:00:00+00:00', 'to': '2010-12-06T00:00:00+00:00', 'prop': {'from': {'day': 4, 'month': 10, 'year': 2010}, 'to': {'day': 6, 'month': 12, 'year': 2010}}, 'string': 'Oct 4, 2010 to Dec 6, 2010'}",24 min per ep,R - 17+ (violence & profanity),7.58,37524.0,1392,1937,80597,482,"After the conclusion of Hakuouki, Chizuru Yukimura and the Shinsengumi are forced to flee Kyoto and set sail for Edo. In their commander Isami Kondou's absence, vice-commander Toshizou Hijikata steps in as acting commander. However, Hijikata is not only struggling with the extra leadership duties—which worries everyone around him—but also a newfound uncontrollable bloodlust. To make matters worse, the urge does not affect him alone, and it is even beginning to drive some of his subordinates mad. Finally, Kondou returns with orders from the emperor to defend the castle, and a new name for their squad: the Kouyou Chinbutai. But in war, the balance of power can shift suddenly and allegiances can waver. In Hakuouki Hekketsuroku, Chizuru follows the Shinsengumi into the heart of war and continues the search for her missing father, all while the bond between her and Hijikata grows ever stronger. [Written by MAL Rewrite]",,fall,2010,"{'day': None, 'time': None, 'timezone': None, 'string': 'Mondays at Unknown'}",[],"[{'mal_id': 376, 'type': 'anime', 'name': 'Sentai Filmworks', 'url': 'https://myanimelist.net/anime/producer/376/Sentai_Filmworks'}]","[{'mal_id': 37, 'type': 'anime', 'name': 'Studio Deen', 'url': 'https://myanimelist.net/anime/producer/37/Studio_Deen'}]","[{'mal_id': 1, 'type': 'anime', 'name': 'Action', 'url': 'https://myanimelist.net/anime/genre/1/Action'}, {'mal_id': 8, 'type': 'anime', 'name': 'Drama', 'url': 'https://myanimelist.net/anime/genre/8/Drama'}, {'mal_id': 37, 'type': 'anime', 'name': 'Supernatural', 'url': 'https://myanimelist.net/anime/genre/37/Supernatural'}]",[],"[{'mal_id': 13, 'type': 'anime', 'name': 'Historical', 'url': 'https://myanimelist.net/anime/genre/13/Historical'}, {'mal_id': 21, 'type': 'anime', 'name': 'Samurai', 'url': 'https://myanimelist.net/anime/genre/21/Samurai'}]","[{'mal_id': 43, 'type': 'anime', 'name': 'Josei', 'url': 'https://myanimelist.net/anime/genre/43/Josei'}]"
8311,https://myanimelist.net/anime/8311/Tegamibachi_Reverse,"{'jpg': {'image_url': 'https://cdn.myanimelist.net/images/anime/4/26472.jpg', 'small_image_url': 'https://cdn.myanimelist.net/images/anime/4/26472t.jpg', 'large_image_url': 'https://cdn.myanimelist.net/images/anime/4/26472l.jpg'}, 'webp': {'image_url': 'https://cdn.myanimelist.net/images/anime/4/26472.webp', 'small_image_url': 'https://cdn.myanimelist.net/images/anime/4/26472t.webp', 'large_image_url': 'https://cdn.myanimelist.net/images/anime/4/26472l.webp'}}","{'youtube_id': 'T3pZaTEEDuA', 'url': 'https://www.youtube.com/watch?v=T3pZaTEEDuA', 'embed_url': 'https://www.youtube.com/embed/T3pZaTEEDuA?enablejsapi=1&wmode=opaque&autoplay=1', 'images': {'image_url': 'https://img.youtube.com/vi/T3pZaTEEDuA/default.jpg', 'small_image_url': 'https://img.youtube.com/vi/T3pZaTEEDuA/sddefault.jpg', 'medium_image_url': 'https://img.youtube.com/vi/T3pZaTEEDuA/mqdefault.jpg', 'large_image_url': 'https://img.youtube.com/vi/T3pZaTEEDuA/hqdefault.jpg', 'maximum_image_url': 'https://img.youtube.com/vi/T3pZaTEEDuA/maxresdefault.jpg'}}","""Tegamibachi Reverse""",Tegami Bachi: Letter Bee Reverse,テガミバチ REVERSE,"['Tegami Bachi 2', 'Letter Bee 2']",TV,Manga,25,Finished Airing,False,"{'from': '2010-10-03T00:00:00+00:00', 'to': '2011-03-26T00:00:00+00:00', 'prop': {'from': {'day': 3, 'month': 10, 'year': 2010}, 'to': {'day': 26, 'month': 3, 'year': 2011}}, 'string': 'Oct 3, 2010 to Mar 26, 2011'}",20 min per ep,PG-13 - Teens 13 or older,7.75,24399.0,969,2354,58707,205,"After Niche carries the wounded and stunned Lag back to the Bee Hive, the Letter Bee finally begins to piece the puzzle together. Now he knows what's happened to Gauche, why the Marauders are so focused on stealing mail and the actual intent of the group controlling both, Reverse. However, when he's forbidden to reveal the truth, Lag is soon forced out of the artificial sunlight and back into the world of perpetual night. And soon Reverse's plot to take down the Letter Bees and overthrow the Amberground government begins to accelerate. If things weren't already bad enough, the giant insect creatures called gaichuu are apparently evolving into something new; there may be traitors working within the Hive; and Niche's sister, who's definitely not human friendly, shows up to turn family drama into a full-scale siege! It all spells serious trouble for the Letter Bees, but if anyone can weather the storms and gloom of night, Lag and his team are the ones who'll deliver. (Source: FUNimation)",,fall,2010,"{'day': 'Sundays', 'time': '00:10', 'timezone': 'Asia/Tokyo', 'string': 'Sundays at 00:10 (JST)'}","[{'mal_id': 16, 'type': 'anime', 'name': 'TV Tokyo', 'url': 'https://myanimelist.net/anime/producer/16/TV_Tokyo'}]","[{'mal_id': 376, 'type': 'anime', 'name': 'Sentai Filmworks', 'url': 'https://myanimelist.net/anime/producer/376/Sentai_Filmworks'}]","[{'mal_id': 1, 'type': 'anime', 'name': 'Studio Pierrot', 'url': 'https://myanimelist.net/anime/producer/1/Studio_Pierrot'}]","[{'mal_id': 2, 'type': 'anime', 'name': 'Adventure', 'url': 'https://myanimelist.net/anime/genre/2/Adventure'}, {'mal_id': 10, 'type': 'anime', 'name': 'Fantasy', 'url': 'https://myanimelist.net/anime/genre/10/Fantasy'}, {'mal_id': 37, 'type': 'anime', 'name': 'Supernatural', 'url': 'https://myanimelist.net/anime/genre/37/Supernatural'}]",[],[],"[{'mal_id': 27, 'type': 'anime', 'name': 'Shounen', 'url': 'https://myanimelist.net/anime/genre/27/Shounen'}]"
8726,https://myanimelist.net/anime/8726/Soredemo_Machi_wa_Mawatteiru,"{'jpg': {'image_url': 'https://cdn.myanimelist.net/images/anime/9/25880.jpg', 'small_image_url': 'https://cdn.myanimelist.net/images/anime/9/25880t.jpg', 'large_image_url': 'https://cdn.myanimelist.net/images/anime/9/25880l.jpg'}, 'webp': {'image_url': 'https://cdn.myanimelist.net/images/anime/9/25880.webp', 'small_image_url': 'https://cdn.myanimelist.net/images/anime/9/25880t.webp', 'large_image_url': 'https://cdn.myanimelist.net/images/anime/9/25880l.webp'}}","{'youtube_id': None, 'url': None, 'embed_url': None, 'images': {'image_url': None, 'small_image_url': None, 'medium_image_url': None, 'large_image_url': None, 'maximum_image_url': None}}","""Soredemo Machi wa Mawatteiru""",And Yet The Town Moves,それでも町は廻っている,['SoreMachi'],TV,Manga,12,Finished Airing,False,"{'from': '2010-10-08T00:00:00+00:00', 'to': '2010-12-24T00:00:00+00:00', 'prop': {'from': {'day': 8, 'month': 10, 'year': 2010}, 'to': {'day': 24, 'month': 12, 'year': 2010}}, 'string': 'Oct 8, 2010 to Dec 24, 2010'}",24 min per ep,PG-13 - Teens 13 or older,7.44,19116.0,1838,2428,55820,205,"Hotori Arashiyama loves mysteries, but there's one she just can't solve: why does the solution to one problem inevitably seem to lead to another? Like how when Hotori has to start working at the Seaside Maid Cafe after school to pay off a debt and her friend Toshiko fortunately knows exactly how a Maid Cafe should be run. Which is fortunate since Hotori has no clue. Except that, unfortunately, Toshiko has no interest in working at the cafe—until she discovers that Hotori's childhood friend Hiroyuki is a regular. Which SEEMS fortunate. Except that Hotori doesn't know that, while Toshiko likes Hiroyuki, Hiroyuki secretly likes Hotori, while Hotori secretly has a crush on... No, no more spoilers! But if that's not enough drama, there's work, angst with a certain math teacher, table tennis between her classmates, her younger brother versus the school's bad girl... And yet, even though everything seems like it's going to crash at any moment, somehow Hotori's life keeps going hilariously forward. (Source: Sentai Filmworks)",,fall,2010,"{'day': 'Fridays', 'time': '01:55', 'timezone': 'Asia/Tokyo', 'string': 'Fridays at 01:55 (JST)'}","[{'mal_id': 144, 'type': 'anime', 'name': 'Pony Canyon', 'url': 'https://myanimelist.net/anime/producer/144/Pony_Canyon'}, {'mal_id': 145, 'type': 'anime', 'name': 'TBS', 'url': 'https://myanimelist.net/anime/producer/145/TBS'}, {'mal_id': 166, 'type': 'anime', 'name': 'Movic', 'url': 'https://myanimelist.net/anime/producer/166/Movic'}, {'mal_id': 207, 'type': 'anime', 'name': 'Magic Bus', 'url': 'https://myanimelist.net/anime/producer/207/Magic_Bus'}, {'mal_id': 299, 'type': 'anime', 'name': 'Studio Pastoral', 'url': 'https://myanimelist.net/anime/producer/299/Studio_Pastoral'}, {'mal_id': 464, 'type': 'anime', 'name': 'flying DOG', 'url': 'https://myanimelist.net/anime/producer/464/flying_DOG'}, {'mal_id': 647, 'type': 'anime', 'name': 'Memory-Tech', 'url': 'https://myanimelist.net/anime/producer/647/Memory-Tech'}]","[{'mal_id': 376, 'type': 'anime', 'name': 'Sentai Filmworks', 'url': 'https://myanimelist.net/anime/producer/376/Sentai_Filmworks'}]","[{'mal_id': 44, 'type': 'anime', 'name': 'Shaft', 'url': 'https://myanimelist.net/anime/producer/44/Shaft'}]","[{'mal_id': 4, 'type': 'anime', 'name': 'Comedy', 'url': 'https://myanimelist.net/anime/genre/4/Comedy'}, {'mal_id': 36, 'type': 'anime', 'name': 'Slice of Life', 'url': 'https://myanimelist.net/anime/genre/36/Slice_of_Life'}]",[],[],"[{'mal_id': 42, 'type': 'anime', 'name': 'Seinen', 'url': 'https://myanimelist.net/anime/genre/42/Seinen'}]"
7768,https://myanimelist.net/anime/7768/Tantei_Opera_Milky_Holmes,"{'jpg': {'image_url': 'https://cdn.myanimelist.net/images/anime/10/26676.jpg', 'small_image_url': 'https://cdn.myanimelist.net/images/anime/10/26676t.jpg', 'large_image_url': 'https://cdn.myanimelist.net/images/anime/10/26676l.jpg'}, 'webp': {'image_url': 'https://cdn.myanimelist.net/images/anime/10/26676.webp', 'small_image_url': 'https://cdn.myanimelist.net/images/anime/10/26676t.webp', 'large_image_url': 'https://cdn.myanimelist.net/images/anime/10/26676l.webp'}}","{'youtube_id': 'JWRCOHxdkoA', 'url': 'https://www.youtube.com/watch?v=JWRCOHxdkoA', 'embed_url': 'https://www.youtube.com/embed/JWRCOHxdkoA?enablejsapi=1&wmode=opaque&autoplay=1', 'images': {'image_url': 'https://img.youtube.com/vi/JWRCOHxdkoA/default.jpg', 'small_image_url': 'https://img.youtube.com/vi/JWRCOHxdkoA/sddefault.jpg', 'medium_image_url': 'https://img.youtube.com/vi/JWRCOHxdkoA/mqdefault.jpg', 'large_image_url': 'https://img.youtube.com/vi/JWRCOHxdkoA/hqdefault.jpg', 'maximum_image_url': 'https://img.youtube.com/vi/JWRCOHxdkoA/maxresdefault.jpg'}}","""Tantei Opera Milky Holmes""",,探偵オペラ ミルキィホームズ,[],TV,Original,12,Finished Airing,False,"{'from': '2010-10-07T00:00:00+00:00', 'to': '2010-12-23T00:00:00+00:00', 'prop': {'from': {'day': 7, 'month': 10, 'year': 2010}, 'to': {'day': 23, 'month': 12, 'year': 2010}}, 'string': 'Oct 7, 2010 to Dec 23, 2010'}",24 min per ep,PG-13 - Teens 13 or older,6.92,15007.0,4130,2822,41853,210,"""Toys"" are powers bestowed upon those chosen to wield them, each having qualities that are unique to their users. Some of these individuals are born pure, using their powers to become detectives. Others bloom laced with poison and choose to become phantom thieves. These two opposing factions caused the formation of various detective academies around the globe—training detectives to fight and catch the phantom thieves. Sherlock Shellingford, Nero Yuzurizaki, Hercule Burton, and Cordelia Glauca form ""Milky Holmes"", a group recognized as the cream of the crop in the Yokohama-based Holmes Detective Academy. However, in a skirmish against the phantom thief Arsene, their Toys suddenly disappear, deeming them unfit to continue as detectives. Stripped of their prestigious life and thrown into a rundown attic, they face expulsion if they fail to regain their powers within the next three months. Tantei Opera Milky Holmes tells the story of a once-legendary group in their journey to recover their Toys, as well as attempting to continue their line of work without the powers that once defined their career. [Written by MAL Rewrite]",,fall,2010,"{'day': None, 'time': None, 'timezone': None, 'string': 'Unknown'}","[{'mal_id': 64, 'type': 'anime', 'name': 'Sotsu', 'url': 'https://myanimelist.net/anime/producer/64/Sotsu'}, {'mal_id': 104, 'type': 'anime', 'name': 'Lantis', 'url': 'https://myanimelist.net/anime/producer/104/Lantis'}, {'mal_id': 144, 'type': 'anime', 'name': 'Pony Canyon', 'url': 'https://myanimelist.net/anime/producer/144/Pony_Canyon'}, {'mal_id': 715, 'type': 'anime', 'name': 'Dwango', 'url': 'https://myanimelist.net/anime/producer/715/Dwango'}, {'mal_id': 775, 'type': 'anime', 'name': 'Bushiroad', 'url': 'https://myanimelist.net/anime/producer/775/Bushiroad'}, {'mal_id': 1261, 'type': 'anime', 'name': 'Good Smile Company', 'url': 'https://myanimelist.net/anime/producer/1261/Good_Smile_Company'}, {'mal_id': 1288, 'type': 'anime', 'name': 'Chrono Gear Creative', 'url': 'https://myanimelist.net/anime/producer/1288/Chrono_Gear_Creative'}]",[],"[{'mal_id': 7, 'type': 'anime', 'name': 'J.C.Staff', 'url': 'https://myanimelist.net/anime/producer/7/JCStaff'}]","[{'mal_id': 4, 'type': 'anime', 'name': 'Comedy', 'url': 'https://myanimelist.net/anime/genre/4/Comedy'}, {'mal_id': 7, 'type': 'anime', 'name': 'Mystery', 'url': 'https://myanimelist.net/anime/genre/7/Mystery'}]",[],"[{'mal_id': 31, 'type': 'anime', 'name': 'Super Power', 'url': 'https://myanimelist.net/anime/genre/31/Super_Power'}]",[]
9441,https://myanimelist.net/anime/9441/Yume-iro_Pâtissière_SP_Professional,"{'jpg': {'image_url': 'https://cdn.myanimelist.net/images/anime/2/27794.jpg', 'small_image_url': 'https://cdn.myanimelist.net/images/anime/2/27794t.jpg', 'large_image_url': 'https://cdn.myanimelist.net/images/anime/2/27794l.jpg'}, 'webp': {'image_url': 'https://cdn.myanimelist.net/images/anime/2/27794.webp', 'small_image_url': 'https://cdn.myanimelist.net/images/anime/2/27794t.webp', 'large_image_url': 'https://cdn.myanimelist.net/images/anime/2/27794l.webp'}}","{'youtube_id': None, 'url': None, 'embed_url': None, 'images': {'image_url': None, 'small_image_url': None, 'medium_image_url': None, 'large_image_url': None, 'maximum_image_url': None}}","""Yume-iro Pâtissière SP Professional""",,夢色パティシエールSP（スペシャル）プロフェッショナル,"['Yumeiro Patissiere SP Professional', 'YumePati Pro', 'Yume-iro Pâtissière 2', 'Dream-Colored Pastry Chef', 'Yumeiro Pâtissière SP Professional']",TV,Manga,13,Finished Airing,False,"{'from': '2010-10-03T00:00:00+00:00', 'to': '2010-12-26T00:00:00+00:00', 'prop': {'from': {'day': 3, 'month': 10, 'year': 2010}, 'to': {'day': 26, 'month': 12, 'year': 2010}}, 'string': 'Oct 3, 2010 to Dec 26, 2010'}",24 min per ep,G - All Ages,7.58,20913.0,1384,3000,37715,145,"Upon her return to Japan after a two year study break in Paris, Ichigo Amano is met with news of Team Ichigo's separation, as each of the Sweets Princes takes a different path toward their dream. Now in her first year of high school, Henri Lucas has a project in store for her, enlisting the help of Ichigo, Makoto Kashino, and new members Lemon Yamagishi and Johnny McBeal to give rise to a new Team Ichigo. As the four work together on this project, Ichigo and Makoto continue to grow closer, though Johnny and the unrelenting Miya Koshiro will not idly sit by; with Johnny's eye on Ichigo and Miya still after Makoto, it definitely seems like love won't come easily. With Ichigo's time at St. Marie Academy, she is now ever closer to her dream of starting her very own pâtisserie. However, she will soon realize that it takes more than just making delicious sweets to open up a shop. [Written by MAL Rewrite]",,fall,2010,"{'day': None, 'time': None, 'timezone': None, 'string': 'Unknown'}","[{'mal_id': 1365, 'type': 'anime', 'name': 'Shueisha', 'url': 'https://myanimelist.net/anime/producer/1365/Shueisha'}]","[{'mal_id': 490, 'type': 'anime', 'name': 'Maiden Japan', 'url': 'https://myanimelist.net/anime/producer/490/Maiden_Japan'}]","[{'mal_id': 1, 'type': 'anime', 'name': 'Studio Pierrot', 'url': 'https://myanimelist.net/anime/producer/1/Studio_Pierrot'}]","[{'mal_id': 47, 'type': 'anime', 'name': 'Gourmet', 'url': 'https://myanimelist.net/anime/genre/47/Gourmet'}, {'mal_id': 36, 'type': 'anime', 'name': 'Slice of Life', 'url': 'https://myanimelist.net/anime/genre/36/Slice_of_Life'}]",[],[],"[{'mal_id': 25, 'type': 'anime', 'name': 'Shoujo', 'url': 'https://myanimelist.net/anime/genre/25/Shoujo'}]"
6875,https://myanimelist.net/anime/6875/Iron_Man,"{'jpg': {'image_url': 'https://cdn.myanimelist.net/images/anime/13/26227.jpg', 'small_image_url': 'https://cdn.myanimelist.net/images/anime/13/26227t.jpg', 'large_image_url': 'https://cdn.myanimelist.net/images/anime/13/26227l.jpg'}, 'webp': {'image_url': 'https://cdn.myanimelist.net/images/anime/13/26227.webp', 'small_image_url': 'https://cdn.myanimelist.net/images/anime/13/26227t.webp', 'large_image_url': 'https://cdn.myanimelist.net/images/anime/13/26227l.webp'}}","{'youtube_id': 'h_ej7ZlS2oQ', 'url': 'https://www.youtube.com/watch?v=h_ej7ZlS2oQ', 'embed_url': 'https://www.youtube.com/embed/h_ej7ZlS2oQ?enablejsapi=1&wmode=opaque&autoplay=1', 'images': {'image_url': 'https://img.youtube.com/vi/h_ej7ZlS2oQ/default.jpg', 'small_image_url': 'https://img.youtube.com/vi/h_ej7ZlS2oQ/sddefault.jpg', 'medium_image_url': 'https://img.youtube.com/vi/h_ej7ZlS2oQ/mqdefault.jpg', 'large_image_url': 'https://img.youtube.com/vi/h_ej7ZlS2oQ/hqdefault.jpg', 'maximum_image_url': 'https://img.youtube.com/vi/h_ej7ZlS2oQ/maxresdefault.jpg'}}","""Iron Man""",Iron Man,アイアンマン,['Ironman'],TV,Other,12,Finished Airing,False,"{'from': '2010-10-01T00:00:00+00:00', 'to': '2010-12-17T00:00:00+00:00', 'prop': {'from': {'day': 1, 'month': 10, 'year': 2010}, 'to': {'day': 17, 'month': 12, 'year': 2010}}, 'string': 'Oct 1, 2010 to Dec 17, 2010'}",24 min per ep,PG-13 - Teens 13 or older,6.06,11366.0,8407,3592,26605,29,"Tony Stark, CEO of a large weapons manufacturer, physicist, engineer, and brilliant inventor, is wounded by shrapnel from one of his own weapons. While held captive by terrorists, he develops the Iron Man Suit and escapes. From that day on, he vows not to waste his second chance at life and to change the world for the better. For that purpose, he comes to Japan. In Lab 23 in Japan, great strides have been taken to develop, and build, a unique power station which does not run on fossil fuels, the Arc Station. Stark intends to join this project, and, for that, he is ready to announce his retirement as Iron Man. At the same time, he will also announce the Mass-produced Iron Men, to which he will pass on his duties. However, during the ceremonies, Stark is suddenly attacked by combat mecha belonging to an organization known as Zodiac.",,fall,2010,"{'day': None, 'time': None, 'timezone': None, 'string': 'Unknown'}",[],"[{'mal_id': 483, 'type': 'anime', 'name': 'Marvel Entertainment', 'url': 'https://myanimelist.net/anime/producer/483/Marvel_Entertainment'}]","[{'mal_id': 11, 'type': 'anime', 'name': 'Madhouse', 'url': 'https://myanimelist.net/anime/producer/11/Madhouse'}]","[{'mal_id': 1, 'type': 'anime', 'name': 'Action', 'url': 'https://myanimelist.net/anime/genre/1/Action'}, {'mal_id': 8, 'type': 'anime', 'name': 'Drama', 'url': 'https://myanimelist.net/anime/genre/8/Drama'}]",[],"[{'mal_id': 18, 'type': 'anime', 'name': 'Mecha', 'url': 'https://myanimelist.net/anime/genre/18/Mecha'}]",[]
9241,https://myanimelist.net/anime/9241/Super_Robot_Taisen_OG__The_Inspector,"{'jpg': {'image_url': 'https://cdn.myanimelist.net/images/anime/11/44239.jpg', 'small_image_url': 'https://cdn.myanimelist.net/images/anime/11/44239t.jpg', 'large_image_url': 'https://cdn.myanimelist.net/images/anime/11/44239l.jpg'}, 'webp': {'image_url': 'https://cdn.myanimelist.net/images/anime/11/44239.webp', 'small_image_url': 'https://cdn.myanimelist.net/images/anime/11/44239t.webp', 'large_image_url': 'https://cdn.myanimelist.net/images/anime/11/44239l.webp'}}","{'youtube_id': None, 'url': None, 'embed_url': None, 'images': {'image_url': None, 'small_image_url': None, 'medium_image_url': None, 'large_image_url': None, 'maximum_image_url': None}}","""Super Robot Taisen OG: The Inspector""",Super Robot Wars OG: The Inspector,スーパーロボット大戦OG -ジ・インスペクター-,"['Super Robot Taisen Original Generation: The Inspector', 'SRWOG']",TV,Game,26,Finished Airing,False,"{'from': '2010-10-02T00:00:00+00:00', 'to': '2011-04-02T00:00:00+00:00', 'prop': {'from': {'day': 2, 'month': 10, 'year': 2010}, 'to': {'day': 2, 'month': 4, 'year': 2011}}, 'string': 'Oct 2, 2010 to Apr 2, 2011'}",23 min per ep,PG-13 - Teens 13 or older,7.24,3017.0,2711,5753,8678,39,"With many of its central personnel lost in the war, the Earth Federation Government is forced to rebuild, and Brian Midcrid, president of the Unified Colonies, takes the position of its president. During an emergency session of the Federation Diet, he publicly acknowledges the existence of extraterrestrials, and reveals the events of the L5 campaign to the masses in what will later come to be called the ""Tokyo Declaration."" He goes on to state that these aliens pose a serious threat to humanity. (Source: Crunchyroll)",,fall,2010,"{'day': None, 'time': None, 'timezone': None, 'string': 'Unknown'}","[{'mal_id': 64, 'type': 'anime', 'name': 'Sotsu', 'url': 'https://myanimelist.net/anime/producer/64/Sotsu'}]",[],"[{'mal_id': 406, 'type': 'anime', 'name': 'Asahi Production', 'url': 'https://myanimelist.net/anime/producer/406/Asahi_Production'}]","[{'mal_id': 1, 'type': 'anime', 'name': 'Action', 'url': 'https://myanimelist.net/anime/genre/1/Action'}, {'mal_id': 24, 'type': 'anime', 'name': 'Sci-Fi', 'url': 'https://myanimelist.net/anime/genre/24/Sci-Fi'}]",[],"[{'mal_id': 18, 'type': 'anime', 'name': 'Mecha', 'url': 'https://myanimelist.net/anime/genre/18/Mecha'}, {'mal_id': 29, 'type': 'anime', 'name': 'Space', 'url': 'https://myanimelist.net/anime/genre/29/Space'}]",[]
