mal_id,url,images,trailer,title,title_english,title_japanese,title_synonyms,type,source,episodes,status,airing,aired,duration,rating,score,scored_by,rank,popularity,members,favorites,synopsis,background,season,year,broadcast,producers,licensors,studios,genres,explicit_genres,themes,demographics
9181,https://myanimelist.net/anime/9181/Motto_To_LOVE-Ru,"{'jpg': {'image_url': 'https://cdn.myanimelist.net/images/anime/4/59875.jpg', 'small_image_url': 'https://cdn.myanimelist.net/images/anime/4/59875t.jpg', 'large_image_url': 'https://cdn.myanimelist.net/images/anime/4/59875l.jpg'}, 'webp': {'image_url': 'https://cdn.myanimelist.net/images/anime/4/59875.webp', 'small_image_url': 'https://cdn.myanimelist.net/images/anime/4/59875t.webp', 'large_image_url': 'https://cdn.myanimelist.net/images/anime/4/59875l.webp'}}","{'youtube_id': 'TZlnXHWCnsE', 'url': 'https://www.youtube.com/watch?v=TZlnXHWCnsE', 'embed_url': 'https://www.youtube.com/embed/TZlnXHWCnsE?enablejsapi=1&wmode=opaque&autoplay=1', 'images': {'image_url': 'https://img.youtube.com/vi/TZlnXHWCnsE/default.jpg', 'small_image_url': 'https://img.youtube.com/vi/TZlnXHWCnsE/sddefault.jpg', 'medium_image_url': 'https://img.youtube.com/vi/TZlnXHWCnsE/mqdefault.jpg', 'large_image_url': 'https://img.youtube.com/vi/TZlnXHWCnsE/hqdefault.jpg', 'maximum_image_url': 'https://img.youtube.com/vi/TZlnXHWCnsE/maxresdefault.jpg'}}","""Motto To LOVE-Ru""",Motto To LOVE Ru,もっと To LOVEる -とらぶる-,"['Motto To-Love-Ru', 'More Trouble', 'More ToLoveRu']",TV,Manga,12,Finished Airing,False,"{'from': '2010-10-06T00:00:00+00:00', 'to': '2010-12-22T00:00:00+00:00', 'prop': {'from': {'day': 6, 'month': 10, 'year': 2010}, 'to': {'day': 22, 'month': 12, 'year': 2010}}, 'string': 'Oct 6, 2010 to Dec 22, 2010'}",24 min per ep,PG-13 - Teens 13 or older,7.3,171226.0,2396,613,297272,899,"Rito Yuuki never gets a break—he's always finding himself in lewd accidents with girls around him. Although his heart still yearns for Haruna, his childhood love, Rito can't help but question his feelings for Lala, the alien princess who appeared in front of him and declared she would marry him. But now, it's not just Lala he has to deal with: her younger twin sisters, Momo and Nana, have also traveled to Earth, wanting to meet their older sister's fiancé, and just as luck would have it, they end up staying at Rito's home. Meanwhile, amidst the bustle of his new family members, Yami, the human weapon girl, begins her pursuit for Rito. It's not an easy life for Rito as he deals with uncertain love, punishment for being a pervert, and a girl dead set on murdering him. [Written by MAL Rewrite]",,fall,2010,"{'day': None, 'time': None, 'timezone': None, 'string': 'Unknown'}","[{'mal_id': 31, 'type': 'anime', 'name': 'Geneon Universal Entertainment', 'url': 'https://myanimelist.net/anime/producer/31/Geneon_Universal_Entertainment'}, {'mal_id': 145, 'type': 'anime', 'name': 'TBS', 'url': 'https://myanimelist.net/anime/producer/145/TBS'}, {'mal_id': 306, 'type': 'anime', 'name': 'Magic Capsule', 'url': 'https://myanimelist.net/anime/producer/306/Magic_Capsule'}, {'mal_id': 753, 'type': 'anime', 'name': 'PRA', 'url': 'https://myanimelist.net/anime/producer/753/PRA'}]","[{'mal_id': 376, 'type': 'anime', 'name': 'Sentai Filmworks', 'url': 'https://myanimelist.net/anime/producer/376/Sentai_Filmworks'}]","[{'mal_id': 27, 'type': 'anime', 'name': 'Xebec', 'url': 'https://myanimelist.net/anime/producer/27/Xebec'}]","[{'mal_id': 4, 'type': 'anime', 'name': 'Comedy', 'url': 'https://myanimelist.net/anime/genre/4/Comedy'}, {'mal_id': 24, 'type': 'anime', 'name': 'Sci-Fi', 'url': 'https://myanimelist.net/anime/genre/24/Sci-Fi'}, {'mal_id': 9, 'type': 'anime', 'name': 'Ecchi', 'url': 'https://myanimelist.net/anime/genre/9/Ecchi'}]",[],"[{'mal_id': 35, 'type': 'anime', 'name': 'Harem', 'url': 'https://myanimelist.net/anime/genre/35/Harem'}, {'mal_id': 23, 'type': 'anime', 'name': 'School', 'url': 'https://myanimelist.net/anime/genre/23/School'}]","[{'mal_id': 27, 'type': 'anime', 'name': 'Shounen', 'url': 'https://myanimelist.net/anime/genre/27/Shounen'}]"
8407,https://myanimelist.net/anime/8407/Sora_no_Otoshimono__Forte,"{'jpg': {'image_url': 'https://cdn.myanimelist.net/images/anime/11/50309.jpg', 'small_image_url': 'https://cdn.myanimelist.net/images/anime/11/50309t.jpg', 'large_image_url': 'https://cdn.myanimelist.net/images/anime/11/50309l.jpg'}, 'webp': {'image_url': 'https://cdn.myanimelist.net/images/anime/11/50309.webp', 'small_image_url': 'https://cdn.myanimelist.net/images/anime/11/50309t.webp', 'large_image_url': 'https://cdn.myanimelist.net/images/anime/11/50309l.webp'}}","{'youtube_id': 'VDLlcBr0v0k', 'url': 'https://www.youtube.com/watch?v=VDLlcBr0v0k', 'embed_url': 'https://www.youtube.com/embed/VDLlcBr0v0k?enablejsapi=1&wmode=opaque&autoplay=1', 'images': {'image_url': 'https://img.youtube.com/vi/VDLlcBr0v0k/default.jpg', 'small_image_url': 'https://img.youtube.com/vi/VDLlcBr0v0k/sddefault.jpg', 'medium_image_url': 'https://img.youtube.com/vi/VDLlcBr0v0k/mqdefault.jpg', 'large_image_url': 'https://img.youtube.com/vi/VDLlcBr0v0k/hqdefault.jpg', 'maximum_image_url': 'https://img.youtube.com/vi/VDLlcBr0v0k/maxresdefault.jpg'}}","""Sora no Otoshimono: Forte""",Heaven's Lost Property: Forte,そらのおとしものf（フォルテ）,"['Sora no Otoshimono: f', 'Lost Property of the Sky 2', 'Misplaced by Heaven 2', ""Heaven's Lost Property 2""]",TV,Manga,12,Finished Airing,False,"{'from': '2010-10-02T00:00:00+00:00', 'to': '2010-12-18T00:00:00+00:00', 'prop': {'from': {'day': 2, 'month': 10, 'year': 2010}, 'to': {'day': 18, 'month': 12, 'year': 2010}}, 'string': 'Oct 2, 2010 to Dec 18, 2010'}",23 min per ep,PG-13 - Teens 13 or older,7.49,155466.0,1685,703,268270,869,"Sakurai Tomoki has settled into his life with the two angeloids, Ikaros and Nymph, and is enjoying himself immensely. However, he keeps having weird dreams and asks all of his friends to help him investigate the cause. Nymph conjures up a device that enables people, but not angeloids, to enter other people's dreams. The device malfunctions at first but eventually they get to what was supposed to be Tomoki's dream but discover that something is very wrong with it. Later, a meteor comes crashing down from the skies at the site of the large cherry blossom tree where Tomoki first discovered Ikaros. An extremely well endowed blonde angeloid with a huge sword emerges from the meteor and sets off in search of Tomoki!","The first episode was aired during a special event on Sunday, September 19, 2010 in Laforet Museum Roppongi, Tokyo. The television broadcast started on October 2, 2010.",fall,2010,"{'day': None, 'time': None, 'timezone': None, 'string': 'Unknown'}","[{'mal_id': 113, 'type': 'anime', 'name': 'Kadokawa Shoten', 'url': 'https://myanimelist.net/anime/producer/113/Kadokawa_Shoten'}, {'mal_id': 352, 'type': 'anime', 'name': 'Kadokawa Pictures Japan', 'url': 'https://myanimelist.net/anime/producer/352/Kadokawa_Pictures_Japan'}, {'mal_id': 460, 'type': 'anime', 'name': 'KlockWorx', 'url': 'https://myanimelist.net/anime/producer/460/KlockWorx'}, {'mal_id': 689, 'type': 'anime', 'name': 'NTT Docomo', 'url': 'https://myanimelist.net/anime/producer/689/NTT_Docomo'}]","[{'mal_id': 102, 'type': 'anime', 'name': 'Funimation', 'url': 'https://myanimelist.net/anime/producer/102/Funimation'}]","[{'mal_id': 88, 'type': 'anime', 'name': 'AIC ASTA', 'url': 'https://myanimelist.net/anime/producer/88/AIC_ASTA'}]","[{'mal_id': 4, 'type': 'anime', 'name': 'Comedy', 'url': 'https://myanimelist.net/anime/genre/4/Comedy'}, {'mal_id': 22, 'type': 'anime', 'name': 'Romance', 'url': 'https://myanimelist.net/anime/genre/22/Romance'}, {'mal_id': 24, 'type': 'anime', 'name': 'Sci-Fi', 'url': 'https://myanimelist.net/anime/genre/24/Sci-Fi'}, {'mal_id': 37, 'type': 'anime', 'name': 'Supernatural', 'url': 'https://myanimelist.net/anime/genre/37/Supernatural'}, {'mal_id': 9, 'type': 'anime', 'name': 'Ecchi', 'url': 'https://myanimelist.net/anime/genre/9/Ecchi'}]",[],"[{'mal_id': 35, 'type': 'anime', 'name': 'Harem', 'url': 'https://myanimelist.net/anime/genre/35/Harem'}]","[{'mal_id': 27, 'type': 'anime', 'name': 'Shounen', 'url': 'https://myanimelist.net/anime/genre/27/Shounen'}]"
8424,https://myanimelist.net/anime/8424/MM,"{'jpg': {'image_url': 'https://cdn.myanimelist.net/images/anime/8/85871.jpg', 'small_image_url': 'https://cdn.myanimelist.net/images/anime/8/85871t.jpg', 'large_image_url': 'https://cdn.myanimelist.net/images/anime/8/85871l.jpg'}, 'webp': {'image_url': 'https://cdn.myanimelist.net/images/anime/8/85871.webp', 'small_image_url': 'https://cdn.myanimelist.net/images/anime/8/85871t.webp', 'large_image_url': 'https://cdn.myanimelist.net/images/anime/8/85871l.webp'}}","{'youtube_id': 'YAIn8wNFJ6Q', 'url': 'https://www.youtube.com/watch?v=YAIn8wNFJ6Q', 'embed_url': 'https://www.youtube.com/embed/YAIn8wNFJ6Q?enablejsapi=1&wmode=opaque&autoplay=1', 'images': {'image_url': 'https://img.youtube.com/vi/YAIn8wNFJ6Q/default.jpg', 'small_image_url': 'https://img.youtube.com/vi/YAIn8wNFJ6Q/sddefault.jpg', 'medium_image_url': 'https://img.youtube.com/vi/YAIn8wNFJ6Q/mqdefault.jpg', 'large_image_url': 'https://img.youtube.com/vi/YAIn8wNFJ6Q/hqdefault.jpg', 'maximum_image_url': 'https://img.youtube.com/vi/YAIn8wNFJ6Q/maxresdefault.jpg'}}","""MM!""",MM!,えむえむっ!,"['MM! Group', 'Emu Emu!']",TV,Light novel,12,Finished Airing,False,"{'from': '2010-10-02T00:00:00+00:00', 'to': '2010-12-18T00:00:00+00:00', 'prop': {'from': {'day': 2, 'month': 10, 'year': 2010}, 'to': {'day': 18, 'month': 12, 'year': 2010}}, 'string': 'Oct 2, 2010 to Dec 18, 2010'}",23 min per ep,PG-13 - Teens 13 or older,7.07,114682.0,3503,852,220502,639,"Taro Sado is a high school student who lives his day to day life with a big secret—he's a masochist! Encouraged by his cross-dressing best friend Tatsukichi Hayama, Taro asks the Second Voluntary Club for help with his problem and ends up joining the club after they vow to ""fix"" him. However, it turns out that all of the members of the club have some serious issues. The club leader Mio Isurugi is a self-designated god who is afraid of cats, Arashiko Yuuno has a severe fear of men, and the club advisor Michiru Onigawara is a sadist who enjoys making people cosplay. Together with other wacky characters such as Yumi Mamiya, a talented masseuse and Yuuno's best friend, and Noa Hiiragi, the president of the invention club, they all learn about the importance of acceptance and kindness. [Written by MAL Rewrite]",Limited screening on September 26th. Regular TV airing started on the 2nd of October.,fall,2010,"{'day': None, 'time': None, 'timezone': None, 'string': 'Unknown'}","[{'mal_id': 104, 'type': 'anime', 'name': 'Lantis', 'url': 'https://myanimelist.net/anime/producer/104/Lantis'}, {'mal_id': 108, 'type': 'anime', 'name': 'Media Factory', 'url': 'https://myanimelist.net/anime/producer/108/Media_Factory'}, {'mal_id': 238, 'type': 'anime', 'name': 'AT-X', 'url': 'https://myanimelist.net/anime/producer/238/AT-X'}]","[{'mal_id': 376, 'type': 'anime', 'name': 'Sentai Filmworks', 'url': 'https://myanimelist.net/anime/producer/376/Sentai_Filmworks'}]","[{'mal_id': 27, 'type': 'anime', 'name': 'Xebec', 'url': 'https://myanimelist.net/anime/producer/27/Xebec'}]","[{'mal_id': 4, 'type': 'anime', 'name': 'Comedy', 'url': 'https://myanimelist.net/anime/genre/4/Comedy'}, {'mal_id': 9, 'type': 'anime', 'name': 'Ecchi', 'url': 'https://myanimelist.net/anime/genre/9/Ecchi'}]",[],"[{'mal_id': 35, 'type': 'anime', 'name': 'Harem', 'url': 'https://myanimelist.net/anime/genre/35/Harem'}, {'mal_id': 23, 'type': 'anime', 'name': 'School', 'url': 'https://myanimelist.net/anime/genre/23/School'}]",[]
8129,https://myanimelist.net/anime/8129/Kuragehime,"{'jpg': {'image_url': 'https://cdn.myanimelist.net/images/anime/3/24865.jpg', 'small_image_url': 'https://cdn.myanimelist.net/images/anime/3/24865t.jpg', 'large_image_url': 'https://cdn.myanimelist.net/images/anime/3/24865l.jpg'}, 'webp': {'image_url': 'https://cdn.myanimelist.net/images/anime/3/24865.webp', 'small_image_url': 'https://cdn.myanimelist.net/images/anime/3/24865t.webp', 'large_image_url': 'https://cdn.myanimelist.net/images/anime/3/24865l.webp'}}","{'youtube_id': 'sipUVHlDbgI', 'url': 'https://www.youtube.com/watch?v=sipUVHlDbgI', 'embed_url': 'https://www.youtube.com/embed/sipUVHlDbgI?enablejsapi=1&wmode=opaque&autoplay=1', 'images': {'image_url': 'https://img.youtube.com/vi/sipUVHlDbgI/default.jpg', 'small_image_url': 'https://img.youtube.com/vi/sipUVHlDbgI/sddefault.jpg', 'medium_image_url': 'https://img.youtube.com/vi/sipUVHlDbgI/mqdefault.jpg', 'large_image_url': 'https://img.youtube.com/vi/sipUVHlDbgI/hqdefault.jpg', 'maximum_image_url': 'https://img.youtube.com/vi/sipUVHlDbgI/maxresdefault.jpg'}}","""Kuragehime""",Princess Jellyfish,海月姫,['Kuragehime'],TV,Manga,11,Finished Airing,False,"{'from': '2010-10-15T00:00:00+00:00', 'to': '2010-12-31T00:00:00+00:00', 'prop': {'from': {'day': 15, 'month': 10, 'year': 2010}, 'to': {'day': 31, 'month': 12, 'year': 2010}}, 'string': 'Oct 15, 2010 to Dec 31, 2010'}",22 min per ep,PG-13 - Teens 13 or older,8.12,97466.0,415,909,207795,4029,"Ever since her late mother took her to an aquarium when she was young, Tsukimi Kurashita has been obsessed with jellyfish, comparing their flowing tentacles to a princess's white dress. Now living with five other unemployed otaku women, 19-year-old Tsukimi spends her days as a social outcast dreaming of becoming an illustrator. However, her life changes forever when one day, a beautiful woman unexpectedly helps her save a jellyfish in a local pet store. From then on, the stranger—confident, fashionable, and the complete opposite of Tsukimi and her roommates—begins to regularly visit the girls' building. This trendy hipster, though appearing shallow at first, harbors some secrets of her own, starting with the fact that ""she"" isn't really a girl at all, but a wealthy male college student named Kuranosuke Koibuchi! [Written by MAL Rewrite]","Kuragehime was simulcast on FUNimation in Fall 2010, and became available as a DVD and Blu-ray release the following year. Kuragehime was also briefly available for streaming on Netflix as Princess Jellyfish.",fall,2010,"{'day': 'Fridays', 'time': '00:45', 'timezone': 'Asia/Tokyo', 'string': 'Fridays at 00:45 (JST)'}","[{'mal_id': 169, 'type': 'anime', 'name': 'Fuji TV', 'url': 'https://myanimelist.net/anime/producer/169/Fuji_TV'}, {'mal_id': 517, 'type': 'anime', 'name': 'Asmik Ace', 'url': 'https://myanimelist.net/anime/producer/517/Asmik_Ace'}, {'mal_id': 757, 'type': 'anime', 'name': 'Sony Music Entertainment', 'url': 'https://myanimelist.net/anime/producer/757/Sony_Music_Entertainment'}, {'mal_id': 765, 'type': 'anime', 'name': 'Sakura Create', 'url': 'https://myanimelist.net/anime/producer/765/Sakura_Create'}, {'mal_id': 769, 'type': 'anime', 'name': 'Fujipacific Music', 'url': 'https://myanimelist.net/anime/producer/769/Fujipacific_Music'}]","[{'mal_id': 102, 'type': 'anime', 'name': 'Funimation', 'url': 'https://myanimelist.net/anime/producer/102/Funimation'}]","[{'mal_id': 112, 'type': 'anime', 'name': ""Brain's Base"", 'url': 'https://myanimelist.net/anime/producer/112/Brains_Base'}]","[{'mal_id': 4, 'type': 'anime', 'name': 'Comedy', 'url': 'https://myanimelist.net/anime/genre/4/Comedy'}, {'mal_id': 36, 'type': 'anime', 'name': 'Slice of Life', 'url': 'https://myanimelist.net/anime/genre/36/Slice_of_Life'}]",[],[],"[{'mal_id': 43, 'type': 'anime', 'name': 'Josei', 'url': 'https://myanimelist.net/anime/genre/43/Josei'}]"
8557,https://myanimelist.net/anime/8557/Shinryaku_Ika_Musume,"{'jpg': {'image_url': 'https://cdn.myanimelist.net/images/anime/1734/118930.jpg', 'small_image_url': 'https://cdn.myanimelist.net/images/anime/1734/118930t.jpg', 'large_image_url': 'https://cdn.myanimelist.net/images/anime/1734/118930l.jpg'}, 'webp': {'image_url': 'https://cdn.myanimelist.net/images/anime/1734/118930.webp', 'small_image_url': 'https://cdn.myanimelist.net/images/anime/1734/118930t.webp', 'large_image_url': 'https://cdn.myanimelist.net/images/anime/1734/118930l.webp'}}","{'youtube_id': 'rmAa-lK7C2A', 'url': 'https://www.youtube.com/watch?v=rmAa-lK7C2A', 'embed_url': 'https://www.youtube.com/embed/rmAa-lK7C2A?enablejsapi=1&wmode=opaque&autoplay=1', 'images': {'image_url': 'https://img.youtube.com/vi/rmAa-lK7C2A/default.jpg', 'small_image_url': 'https://img.youtube.com/vi/rmAa-lK7C2A/sddefault.jpg', 'medium_image_url': 'https://img.youtube.com/vi/rmAa-lK7C2A/mqdefault.jpg', 'large_image_url': 'https://img.youtube.com/vi/rmAa-lK7C2A/hqdefault.jpg', 'maximum_image_url': 'https://img.youtube.com/vi/rmAa-lK7C2A/maxresdefault.jpg'}}","""Shinryaku! Ika Musume""",The Squid Girl,侵略!イカ娘,['The Invader Comes From the Bottom of the Sea!'],TV,Manga,12,Finished Airing,False,"{'from': '2010-10-05T00:00:00+00:00', 'to': '2010-12-21T00:00:00+00:00', 'prop': {'from': {'day': 5, 'month': 10, 'year': 2010}, 'to': {'day': 21, 'month': 12, 'year': 2010}}, 'string': 'Oct 5, 2010 to Dec 21, 2010'}",24 min per ep,PG-13 - Teens 13 or older,7.43,78818.0,1890,1029,178697,952,"Humans have been polluting the ocean for a long time, carelessly pouring their garbage and desecrating the waters that many creatures call home. The denizens of the sea have suffered at their poisoning hands. Finally, one certain squid has had enough and vows to punish the humans' selfish actions. Possessing all the fearsome abilities of a squid such as powerful hair-tentacles, the ability to spit ink, and even use bioluminescence at will, Ika Musume takes it upon herself to rise from the depths of the ocean and exact revenge upon humanity! She surfaces at a certain Lemon Beach House, a restaurant managed by the sisters Eiko and Chizuru Aizawa. Thinking them to be an easy first step toward world domination, she immediately declares war against them, only to find out that she is, quite literally, a fish out of water! To make things worse, she destroys a part of a wall of the beach house in an attempt to flaunt her squiddy superiority and is consequently forced into becoming a waitress to pay the repair costs. Beached for the time being after tasting a thorough defeat at the hands of the Aizawa sisters, Ika Musume is forced to put her plans for world domination on hold. Despite these setbacks, Ika Musume soon finds herself right at home in her unexpected position as Lemon Beach House's newest employee. Wacky and hilarious, Shinryaku! Ika Musume follows her brand new life on the surface as she makes precious memories and meet lots of new people. With her newfound acquaintances, Ika Musume is looking to take the world by storm, one squid ink spaghetti at a time! [Written by MAL Rewrite]",,fall,2010,"{'day': None, 'time': None, 'timezone': None, 'string': 'Unknown'}","[{'mal_id': 16, 'type': 'anime', 'name': 'TV Tokyo', 'url': 'https://myanimelist.net/anime/producer/16/TV_Tokyo'}, {'mal_id': 104, 'type': 'anime', 'name': 'Lantis', 'url': 'https://myanimelist.net/anime/producer/104/Lantis'}, {'mal_id': 144, 'type': 'anime', 'name': 'Pony Canyon', 'url': 'https://myanimelist.net/anime/producer/144/Pony_Canyon'}, {'mal_id': 829, 'type': 'anime', 'name': 'Studio Jack', 'url': 'https://myanimelist.net/anime/producer/829/Studio_Jack'}]","[{'mal_id': 250, 'type': 'anime', 'name': 'Media Blasters', 'url': 'https://myanimelist.net/anime/producer/250/Media_Blasters'}, {'mal_id': 376, 'type': 'anime', 'name': 'Sentai Filmworks', 'url': 'https://myanimelist.net/anime/producer/376/Sentai_Filmworks'}]","[{'mal_id': 51, 'type': 'anime', 'name': 'Diomedéa', 'url': 'https://myanimelist.net/anime/producer/51/Diomed%C3%A9a'}]","[{'mal_id': 4, 'type': 'anime', 'name': 'Comedy', 'url': 'https://myanimelist.net/anime/genre/4/Comedy'}, {'mal_id': 36, 'type': 'anime', 'name': 'Slice of Life', 'url': 'https://myanimelist.net/anime/genre/36/Slice_of_Life'}]",[],[],"[{'mal_id': 27, 'type': 'anime', 'name': 'Shounen', 'url': 'https://myanimelist.net/anime/genre/27/Shounen'}]"
8277,https://myanimelist.net/anime/8277/Hyakka_Ryouran__Samurai_Girls,"{'jpg': {'image_url': 'https://cdn.myanimelist.net/images/anime/9/27705.jpg', 'small_image_url': 'https://cdn.myanimelist.net/images/anime/9/27705t.jpg', 'large_image_url': 'https://cdn.myanimelist.net/images/anime/9/27705l.jpg'}, 'webp': {'image_url': 'https://cdn.myanimelist.net/images/anime/9/27705.webp', 'small_image_url': 'https://cdn.myanimelist.net/images/anime/9/27705t.webp', 'large_image_url': 'https://cdn.myanimelist.net/images/anime/9/27705l.webp'}}","{'youtube_id': 'X9z7ljh0viw', 'url': 'https://www.youtube.com/watch?v=X9z7ljh0viw', 'embed_url': 'https://www.youtube.com/embed/X9z7ljh0viw?enablejsapi=1&wmode=opaque&autoplay=1', 'images': {'image_url': 'https://img.youtube.com/vi/X9z7ljh0viw/default.jpg', 'small_image_url': 'https://img.youtube.com/vi/X9z7ljh0viw/sddefault.jpg', 'medium_image_url': 'https://img.youtube.com/vi/X9z7ljh0viw/mqdefault.jpg', 'large_image_url': 'https://img.youtube.com/vi/X9z7ljh0viw/hqdefault.jpg', 'maximum_image_url': 'https://img.youtube.com/vi/X9z7ljh0viw/maxresdefault.jpg'}}","""Hyakka Ryouran: Samurai Girls""",Samurai Girls,百花繚乱 サムライガールズ,['Hyakka Ryouran: Samurai Girls'],TV,Light novel,12,Finished Airing,False,"{'from': '2010-09-04T00:00:00+00:00', 'to': '2010-12-20T00:00:00+00:00', 'prop': {'from': {'day': 4, 'month': 9, 'year': 2010}, 'to': {'day': 20, 'month': 12, 'year': 2010}}, 'string': 'Sep 4, 2010 to Dec 20, 2010'}",24 min per ep,R+ - Mild Nudity,6.79,70948.0,4715,1124,165286,259,"With its gorgeous landscape and prosperous people, Great Japan is the envy of all other nations. But a serious threat hovers over the country. Mysterious guardians known as Master Samurai are Great Japan's only defense. At the behest of the student council, young samurai Muneakira Yagyuu arrives at Buou Academic School. Run by the Tokugawa Shogunate, here children of warriors are given aristocratic education required to run the country. The school is led by the student council president Yoshihiko Tokugawa and his sister Sen, who also happens to be Muneakira's childhood friend. Upon arriving at the academy, Muneakira finds himself in the midst of a terrible fight. During the chaos, the sky fills with a peculiar white light and a mysterious girl named Juubei Yagyuu appears and suddenly kisses Muneakira. With his kiss, she awakens an unknown power that protects them. Just who is this girl, and where did she come from? Muneakira finds himself entangled in the fate of the country and a threat that will shake Great Japan to its core. He must learn the secret behind the Master Samurai and the kiss that awakened Juubei's power in order to protect his country. [Written by MAL Rewrite]","A preview of the first episode aired on Tokyo MX on September 4, 2010, prior to the official airing. The series serves as an alternate telling of the light novels, having a completely different storyline.",fall,2010,"{'day': None, 'time': None, 'timezone': None, 'string': 'Unknown'}","[{'mal_id': 79, 'type': 'anime', 'name': 'Genco', 'url': 'https://myanimelist.net/anime/producer/79/Genco'}, {'mal_id': 104, 'type': 'anime', 'name': 'Lantis', 'url': 'https://myanimelist.net/anime/producer/104/Lantis'}, {'mal_id': 108, 'type': 'anime', 'name': 'Media Factory', 'url': 'https://myanimelist.net/anime/producer/108/Media_Factory'}, {'mal_id': 166, 'type': 'anime', 'name': 'Movic', 'url': 'https://myanimelist.net/anime/producer/166/Movic'}, {'mal_id': 547, 'type': 'anime', 'name': 'Hobby Japan', 'url': 'https://myanimelist.net/anime/producer/547/Hobby_Japan'}, {'mal_id': 777, 'type': 'anime', 'name': 'Showgate', 'url': 'https://myanimelist.net/anime/producer/777/Showgate'}, {'mal_id': 1636, 'type': 'anime', 'name': 'Gigno Systems', 'url': 'https://myanimelist.net/anime/producer/1636/Gigno_Systems'}]","[{'mal_id': 376, 'type': 'anime', 'name': 'Sentai Filmworks', 'url': 'https://myanimelist.net/anime/producer/376/Sentai_Filmworks'}]","[{'mal_id': 38, 'type': 'anime', 'name': 'Arms', 'url': 'https://myanimelist.net/anime/producer/38/Arms'}]","[{'mal_id': 1, 'type': 'anime', 'name': 'Action', 'url': 'https://myanimelist.net/anime/genre/1/Action'}, {'mal_id': 4, 'type': 'anime', 'name': 'Comedy', 'url': 'https://myanimelist.net/anime/genre/4/Comedy'}, {'mal_id': 9, 'type': 'anime', 'name': 'Ecchi', 'url': 'https://myanimelist.net/anime/genre/9/Ecchi'}]",[],"[{'mal_id': 35, 'type': 'anime', 'name': 'Harem', 'url': 'https://myanimelist.net/anime/genre/35/Harem'}, {'mal_id': 21, 'type': 'anime', 'name': 'Samurai', 'url': 'https://myanimelist.net/anime/genre/21/Samurai'}, {'mal_id': 23, 'type': 'anime', 'name': 'School', 'url': 'https://myanimelist.net/anime/genre/23/School'}]",[]
