mal_id,url,images,trailer,title,title_english,title_japanese,title_synonyms,type,source,episodes,status,airing,aired,duration,rating,score,scored_by,rank,popularity,members,favorites,synopsis,background,season,year,broadcast,producers,licensors,studios,genres,explicit_genres,themes,demographics
7785,https://myanimelist.net/anime/7785/Yojouhan_Shinwa_Taikei,"{'jpg': {'image_url': 'https://cdn.myanimelist.net/images/anime/10/50457.jpg', 'small_image_url': 'https://cdn.myanimelist.net/images/anime/10/50457t.jpg', 'large_image_url': 'https://cdn.myanimelist.net/images/anime/10/50457l.jpg'}, 'webp': {'image_url': 'https://cdn.myanimelist.net/images/anime/10/50457.webp', 'small_image_url': 'https://cdn.myanimelist.net/images/anime/10/50457t.webp', 'large_image_url': 'https://cdn.myanimelist.net/images/anime/10/50457l.webp'}}","{'youtube_id': 'hzvU8t3TRio', 'url': 'https://www.youtube.com/watch?v=hzvU8t3TRio', 'embed_url': 'https://www.youtube.com/embed/hzvU8t3TRio?enablejsapi=1&wmode=opaque&autoplay=1', 'images': {'image_url': 'https://img.youtube.com/vi/hzvU8t3TRio/default.jpg', 'small_image_url': 'https://img.youtube.com/vi/hzvU8t3TRio/sddefault.jpg', 'medium_image_url': 'https://img.youtube.com/vi/hzvU8t3TRio/mqdefault.jpg', 'large_image_url': 'https://img.youtube.com/vi/hzvU8t3TRio/hqdefault.jpg', 'maximum_image_url': 'https://img.youtube.com/vi/hzvU8t3TRio/maxresdefault.jpg'}}","""Yojouhan Shinwa Taikei""",The Tatami Galaxy,四畳半神話大系,"['Yojo-Han Shinwa Taikei', 'Yojou-Han Shinwa Taikei', 'Yojohan Shinwa Taikei']",TV,Novel,11.0,Finished Airing,False,"{'from': '2010-04-23T00:00:00+00:00', 'to': '2010-07-02T00:00:00+00:00', 'prop': {'from': {'day': 23, 'month': 4, 'year': 2010}, 'to': {'day': 2, 'month': 7, 'year': 2010}}, 'string': 'Apr 23, 2010 to Jul 2, 2010'}",23 min per ep,R - 17+ (violence & profanity),8.58,119068.0,79,465,378413,15967,"One autumn evening at a mysterious ramen stand behind the Shimogamo Shrine, a lonely third-year college student bumps into a man with an eggplant-shaped head who calls himself a god of matrimony. Meeting this man causes the student to reflect upon his past two years at college—two years bitterly spent trying to break up couples on campus with his only friend Ozu, a ghoulish-looking man seemingly set on making his life as miserable as possible. Resolving to make the most out of the rest of his college life, the student attempts to ask out the unsociable but kind-hearted underclassman Akashi, yet fails to follow through, prompting him to regret not living out his college life differently. As soon as this thought passes through his head, however, he is hurtled through time and space to the beginning of his years at college and given another chance to live his life. Surreal, artistic, and mind-bending, Yojouhan Shinwa Taikei chronicles the misadventures of a young man on a journey to make friends, find love, and experience the rose-colored campus life he always dreamed of. [Written by MAL Rewrite]","Based on the novel by Tomihiko Morimi, published in December 2004. Yojouhan Shinwa Taikei won the grand prize for the animation category in the Japan Media Arts Festival on December 8, 2010.",spring,2010,"{'day': 'Fridays', 'time': '00:45', 'timezone': 'Asia/Tokyo', 'string': 'Fridays at 00:45 (JST)'}","[{'mal_id': 53, 'type': 'anime', 'name': 'Dentsu', 'url': 'https://myanimelist.net/anime/producer/53/Dentsu'}, {'mal_id': 113, 'type': 'anime', 'name': 'Kadokawa Shoten', 'url': 'https://myanimelist.net/anime/producer/113/Kadokawa_Shoten'}, {'mal_id': 169, 'type': 'anime', 'name': 'Fuji TV', 'url': 'https://myanimelist.net/anime/producer/169/Fuji_TV'}, {'mal_id': 245, 'type': 'anime', 'name': 'Toho', 'url': 'https://myanimelist.net/anime/producer/245/Toho'}, {'mal_id': 517, 'type': 'anime', 'name': 'Asmik Ace', 'url': 'https://myanimelist.net/anime/producer/517/Asmik_Ace'}, {'mal_id': 577, 'type': 'anime', 'name': 'Tohokushinsha Film Corporation', 'url': 'https://myanimelist.net/anime/producer/577/Tohokushinsha_Film_Corporation'}, {'mal_id': 757, 'type': 'anime', 'name': 'Sony Music Entertainment', 'url': 'https://myanimelist.net/anime/producer/757/Sony_Music_Entertainment'}, {'mal_id': 769, 'type': 'anime', 'name': 'Fujipacific Music', 'url': 'https://myanimelist.net/anime/producer/769/Fujipacific_Music'}]","[{'mal_id': 102, 'type': 'anime', 'name': 'Funimation', 'url': 'https://myanimelist.net/anime/producer/102/Funimation'}]","[{'mal_id': 11, 'type': 'anime', 'name': 'Madhouse', 'url': 'https://myanimelist.net/anime/producer/11/Madhouse'}]","[{'mal_id': 4, 'type': 'anime', 'name': 'Comedy', 'url': 'https://myanimelist.net/anime/genre/4/Comedy'}, {'mal_id': 7, 'type': 'anime', 'name': 'Mystery', 'url': 'https://myanimelist.net/anime/genre/7/Mystery'}, {'mal_id': 22, 'type': 'anime', 'name': 'Romance', 'url': 'https://myanimelist.net/anime/genre/22/Romance'}]",[],"[{'mal_id': 40, 'type': 'anime', 'name': 'Psychological', 'url': 'https://myanimelist.net/anime/genre/40/Psychological'}]",[]
7817,https://myanimelist.net/anime/7817/B-gata_H-kei,"{'jpg': {'image_url': 'https://cdn.myanimelist.net/images/anime/4/75227.jpg', 'small_image_url': 'https://cdn.myanimelist.net/images/anime/4/75227t.jpg', 'large_image_url': 'https://cdn.myanimelist.net/images/anime/4/75227l.jpg'}, 'webp': {'image_url': 'https://cdn.myanimelist.net/images/anime/4/75227.webp', 'small_image_url': 'https://cdn.myanimelist.net/images/anime/4/75227t.webp', 'large_image_url': 'https://cdn.myanimelist.net/images/anime/4/75227l.webp'}}","{'youtube_id': 'MMa47t5HP8w', 'url': 'https://www.youtube.com/watch?v=MMa47t5HP8w', 'embed_url': 'https://www.youtube.com/embed/MMa47t5HP8w?enablejsapi=1&wmode=opaque&autoplay=1', 'images': {'image_url': 'https://img.youtube.com/vi/MMa47t5HP8w/default.jpg', 'small_image_url': 'https://img.youtube.com/vi/MMa47t5HP8w/sddefault.jpg', 'medium_image_url': 'https://img.youtube.com/vi/MMa47t5HP8w/mqdefault.jpg', 'large_image_url': 'https://img.youtube.com/vi/MMa47t5HP8w/hqdefault.jpg', 'maximum_image_url': 'https://img.youtube.com/vi/MMa47t5HP8w/maxresdefault.jpg'}}","""B-gata H-kei""",Yamada's First Time: B Gata H Kei,B型H系,[],TV,4-koma manga,12.0,Finished Airing,False,"{'from': '2010-04-02T00:00:00+00:00', 'to': '2010-06-18T00:00:00+00:00', 'prop': {'from': {'day': 2, 'month': 4, 'year': 2010}, 'to': {'day': 18, 'month': 6, 'year': 2010}}, 'string': 'Apr 2, 2010 to Jun 18, 2010'}",24 min per ep,PG-13 - Teens 13 or older,6.89,198735.0,4256,494,355976,1444,"Most people, including the girl herself, would say that first year high school student Yamada is beautiful and perfect. Despite this, she is working towards a peculiar goal: to have sex with one hundred men by the end of high school. Trying to put some sense into her head, Yamada's best friend, Miharu Takeshita, points out a major flaw in that plan—she is completely inexperienced with men. However, the reason behind this is that Yamada thinks her lady parts look strange and believes others will judge her for it. As a result, Yamada decides that her first time must be with a fellow virgin, since they will not hurt or scare her. After a fateful encounter, she sets her sights on the shy and average Takashi Kosuda, an aspiring photographer with a heart of gold. With contending rivals for his affection and her own raging hormones, Yamada must find ways to seduce Kosuda and take his cherry. However, as she gets closer to Kosuda, she finds herself increasingly enjoying their time spent together. [Written by MAL Rewrite]",,spring,2010,"{'day': 'Fridays', 'time': '01:00', 'timezone': 'Asia/Tokyo', 'string': 'Fridays at 01:00 (JST)'}","[{'mal_id': 53, 'type': 'anime', 'name': 'Dentsu', 'url': 'https://myanimelist.net/anime/producer/53/Dentsu'}, {'mal_id': 238, 'type': 'anime', 'name': 'AT-X', 'url': 'https://myanimelist.net/anime/producer/238/AT-X'}, {'mal_id': 315, 'type': 'anime', 'name': 'DAX Production', 'url': 'https://myanimelist.net/anime/producer/315/DAX_Production'}, {'mal_id': 333, 'type': 'anime', 'name': 'TYO Animations', 'url': 'https://myanimelist.net/anime/producer/333/TYO_Animations'}, {'mal_id': 787, 'type': 'anime', 'name': 'Happinet Pictures', 'url': 'https://myanimelist.net/anime/producer/787/Happinet_Pictures'}, {'mal_id': 789, 'type': 'anime', 'name': 'BIGLOBE', 'url': 'https://myanimelist.net/anime/producer/789/BIGLOBE'}, {'mal_id': 1365, 'type': 'anime', 'name': 'Shueisha', 'url': 'https://myanimelist.net/anime/producer/1365/Shueisha'}, {'mal_id': 1580, 'type': 'anime', 'name': 'AG-ONE', 'url': 'https://myanimelist.net/anime/producer/1580/AG-ONE'}, {'mal_id': 1581, 'type': 'anime', 'name': 'RAY', 'url': 'https://myanimelist.net/anime/producer/1581/RAY'}]","[{'mal_id': 102, 'type': 'anime', 'name': 'Funimation', 'url': 'https://myanimelist.net/anime/producer/102/Funimation'}]","[{'mal_id': 34, 'type': 'anime', 'name': 'Hal Film Maker', 'url': 'https://myanimelist.net/anime/producer/34/Hal_Film_Maker'}]","[{'mal_id': 4, 'type': 'anime', 'name': 'Comedy', 'url': 'https://myanimelist.net/anime/genre/4/Comedy'}, {'mal_id': 22, 'type': 'anime', 'name': 'Romance', 'url': 'https://myanimelist.net/anime/genre/22/Romance'}, {'mal_id': 9, 'type': 'anime', 'name': 'Ecchi', 'url': 'https://myanimelist.net/anime/genre/9/Ecchi'}]",[],"[{'mal_id': 23, 'type': 'anime', 'name': 'School', 'url': 'https://myanimelist.net/anime/genre/23/School'}]","[{'mal_id': 42, 'type': 'anime', 'name': 'Seinen', 'url': 'https://myanimelist.net/anime/genre/42/Seinen'}]"
6114,https://myanimelist.net/anime/6114/Rainbow__Nisha_Rokubou_no_Shichinin,"{'jpg': {'image_url': 'https://cdn.myanimelist.net/images/anime/9/72697.jpg', 'small_image_url': 'https://cdn.myanimelist.net/images/anime/9/72697t.jpg', 'large_image_url': 'https://cdn.myanimelist.net/images/anime/9/72697l.jpg'}, 'webp': {'image_url': 'https://cdn.myanimelist.net/images/anime/9/72697.webp', 'small_image_url': 'https://cdn.myanimelist.net/images/anime/9/72697t.webp', 'large_image_url': 'https://cdn.myanimelist.net/images/anime/9/72697l.webp'}}","{'youtube_id': None, 'url': None, 'embed_url': None, 'images': {'image_url': None, 'small_image_url': None, 'medium_image_url': None, 'large_image_url': None, 'maximum_image_url': None}}","""Rainbow: Nisha Rokubou no Shichinin""",Rainbow,RAINBOW 二舎六房の七人,['Rainbow: Criminal Seven of Compound Two Cell Six'],TV,Manga,26.0,Finished Airing,False,"{'from': '2010-04-07T00:00:00+00:00', 'to': '2010-09-29T00:00:00+00:00', 'prop': {'from': {'day': 7, 'month': 4, 'year': 2010}, 'to': {'day': 29, 'month': 9, 'year': 2010}}, 'string': 'Apr 7, 2010 to Sep 29, 2010'}",22 min per ep,R - 17+ (violence & profanity),8.5,133667.0,116,505,350022,7750,"Japan, 1955: Mario Minakami has just arrived at Shounan Special Reform School along with five other teenagers who have been arrested on serious criminal charges. All assigned to the same cell, they meet older inmate Rokurouta Sakuragi—a former boxer—with whom they establish a close bond. Under his guidance, and with the promise that they will meet again on the outside after serving their sentences, the delinquents begin to view their hopeless situation in a better light. Rainbow: Nisha Rokubou no Shichinin follows the seven cellmates as they struggle together against the brutal suffering and humiliation inflicted upon them by Ishihara, a sadistic guard with a grudge on Rokurouta, and Gisuke Sasaki, a doctor who takes pleasure in violating boys. Facing such hellish conditions, the seven inmates must scrape together all the strength they have to survive until their sentences are up; but even if they do, just what kind of lives are waiting for them on the other side? [Written by MAL Rewrite]","FUNimation Entertainment simulcasted Rainbow: Nisha Rokubou no Shichinin in North America, but didn't give it a physical release due to poor streaming numbers. It is no longer streaming via FUNimation.",spring,2010,"{'day': None, 'time': None, 'timezone': None, 'string': 'Unknown'}","[{'mal_id': 29, 'type': 'anime', 'name': 'VAP', 'url': 'https://myanimelist.net/anime/producer/29/VAP'}, {'mal_id': 1003, 'type': 'anime', 'name': 'Nippon Television Network', 'url': 'https://myanimelist.net/anime/producer/1003/Nippon_Television_Network'}]","[{'mal_id': 102, 'type': 'anime', 'name': 'Funimation', 'url': 'https://myanimelist.net/anime/producer/102/Funimation'}]","[{'mal_id': 11, 'type': 'anime', 'name': 'Madhouse', 'url': 'https://myanimelist.net/anime/producer/11/Madhouse'}]","[{'mal_id': 8, 'type': 'anime', 'name': 'Drama', 'url': 'https://myanimelist.net/anime/genre/8/Drama'}, {'mal_id': 41, 'type': 'anime', 'name': 'Suspense', 'url': 'https://myanimelist.net/anime/genre/41/Suspense'}]",[],"[{'mal_id': 13, 'type': 'anime', 'name': 'Historical', 'url': 'https://myanimelist.net/anime/genre/13/Historical'}]","[{'mal_id': 42, 'type': 'anime', 'name': 'Seinen', 'url': 'https://myanimelist.net/anime/genre/42/Seinen'}]"
7647,https://myanimelist.net/anime/7647/Arakawa_Under_the_Bridge,"{'jpg': {'image_url': 'https://cdn.myanimelist.net/images/anime/1019/98620.jpg', 'small_image_url': 'https://cdn.myanimelist.net/images/anime/1019/98620t.jpg', 'large_image_url': 'https://cdn.myanimelist.net/images/anime/1019/98620l.jpg'}, 'webp': {'image_url': 'https://cdn.myanimelist.net/images/anime/1019/98620.webp', 'small_image_url': 'https://cdn.myanimelist.net/images/anime/1019/98620t.webp', 'large_image_url': 'https://cdn.myanimelist.net/images/anime/1019/98620l.webp'}}","{'youtube_id': 'sqeoy8k6sco', 'url': 'https://www.youtube.com/watch?v=sqeoy8k6sco', 'embed_url': 'https://www.youtube.com/embed/sqeoy8k6sco?enablejsapi=1&wmode=opaque&autoplay=1', 'images': {'image_url': 'https://img.youtube.com/vi/sqeoy8k6sco/default.jpg', 'small_image_url': 'https://img.youtube.com/vi/sqeoy8k6sco/sddefault.jpg', 'medium_image_url': 'https://img.youtube.com/vi/sqeoy8k6sco/mqdefault.jpg', 'large_image_url': 'https://img.youtube.com/vi/sqeoy8k6sco/hqdefault.jpg', 'maximum_image_url': 'https://img.youtube.com/vi/sqeoy8k6sco/maxresdefault.jpg'}}","""Arakawa Under the Bridge""",Arakawa Under the Bridge,荒川アンダー ザ ブリッジ,[],TV,Manga,13.0,Finished Airing,False,"{'from': '2010-04-05T00:00:00+00:00', 'to': '2010-06-28T00:00:00+00:00', 'prop': {'from': {'day': 5, 'month': 4, 'year': 2010}, 'to': {'day': 28, 'month': 6, 'year': 2010}}, 'string': 'Apr 5, 2010 to Jun 28, 2010'}",24 min per ep,PG-13 - Teens 13 or older,7.58,135415.0,1386,558,322353,2189,"Kou Ichinomiya is the son of a wealthy businessman who holds a firm belief in his elite status. As such, he is determined to avoid becoming indebted to anyone; but one day, after a run-in with some mischievous kids on Arakawa Bridge, he ends up falling into the river running underneath. Luckily for him, a passerby is there to save him—but now, he owes his life to this stranger! Angered by this, Kou insists on paying her back, but this may just be the worst deal the arrogant businessman has ever made. The stranger—a stoic, tracksuit-wearing homeless girl known only as Nino—lives in a cardboard box under the bridge and wants only one thing: to fall in love. Asking Kou to be her boyfriend, he has no choice but to accept, forcing him to move out of his comfortable home and start a new life under the bridge! [Written by MAL Rewrite]","Episode 4 of Arakawa Under the Bridge was longer than the airing block it was scheduled for, so the epilogue and opening were cut out and streamed online instead.",spring,2010,"{'day': 'Mondays', 'time': '01:35', 'timezone': 'Asia/Tokyo', 'string': 'Mondays at 01:35 (JST)'}","[{'mal_id': 58, 'type': 'anime', 'name': 'Square Enix', 'url': 'https://myanimelist.net/anime/producer/58/Square_Enix'}, {'mal_id': 92, 'type': 'anime', 'name': 'Starchild Records', 'url': 'https://myanimelist.net/anime/producer/92/Starchild_Records'}, {'mal_id': 211, 'type': 'anime', 'name': 'Rakuonsha', 'url': 'https://myanimelist.net/anime/producer/211/Rakuonsha'}]","[{'mal_id': 372, 'type': 'anime', 'name': 'NIS America, Inc.', 'url': 'https://myanimelist.net/anime/producer/372/NIS_America_Inc'}]","[{'mal_id': 44, 'type': 'anime', 'name': 'Shaft', 'url': 'https://myanimelist.net/anime/producer/44/Shaft'}]","[{'mal_id': 4, 'type': 'anime', 'name': 'Comedy', 'url': 'https://myanimelist.net/anime/genre/4/Comedy'}, {'mal_id': 22, 'type': 'anime', 'name': 'Romance', 'url': 'https://myanimelist.net/anime/genre/22/Romance'}]",[],[],"[{'mal_id': 42, 'type': 'anime', 'name': 'Seinen', 'url': 'https://myanimelist.net/anime/genre/42/Seinen'}]"
6895,https://myanimelist.net/anime/6895/Hakuouki,"{'jpg': {'image_url': 'https://cdn.myanimelist.net/images/anime/3/71800.jpg', 'small_image_url': 'https://cdn.myanimelist.net/images/anime/3/71800t.jpg', 'large_image_url': 'https://cdn.myanimelist.net/images/anime/3/71800l.jpg'}, 'webp': {'image_url': 'https://cdn.myanimelist.net/images/anime/3/71800.webp', 'small_image_url': 'https://cdn.myanimelist.net/images/anime/3/71800t.webp', 'large_image_url': 'https://cdn.myanimelist.net/images/anime/3/71800l.webp'}}","{'youtube_id': None, 'url': None, 'embed_url': None, 'images': {'image_url': None, 'small_image_url': None, 'medium_image_url': None, 'large_image_url': None, 'maximum_image_url': None}}","""Hakuouki""",Hakuoki ~Demon of the Fleeting Blossom~,薄桜鬼,"['Hakuoki,Hakuouki: Shinsengumi Kitan']",TV,Visual novel,12.0,Finished Airing,False,"{'from': '2010-04-04T00:00:00+00:00', 'to': '2010-06-20T00:00:00+00:00', 'prop': {'from': {'day': 4, 'month': 4, 'year': 2010}, 'to': {'day': 20, 'month': 6, 'year': 2010}}, 'string': 'Apr 4, 2010 to Jun 20, 2010'}",23 min per ep,R - 17+ (violence & profanity),7.38,63223.0,2074,1188,155746,1848,"In 1864 Japan, a young woman named Chizuru Yukimura is searching for her missing father, Koudou, a doctor by trade whose work often takes him far from home. But with no word from him in months, Chizuru disguises herself as a man and heads to Kyoto in search of him. Attracting the attention of ronin, she tries to hide and ends up witnessing a horrifying sight: the ronin being brutally murdered by crazed white-haired men. In a startling turn of events, members of the Shinsengumi arrive to dispatch the creatures. But Chizuru's safety doesn't last long, as this group of men tie her up and take her back to their headquarters, unsure of whether to let her live or silence her permanently. However, once she reveals the name of her father, the Shinsengumi decide to keep her safe, as they too have been searching for him. But Koudou is more connected to the Shinsengumi than they let on, and soon Chizuru finds herself embroiled in a conflict between the Shinsengumi and their enemies, as well as political tension in Kyoto. [Written by MAL Rewrite]",,spring,2010,"{'day': None, 'time': None, 'timezone': None, 'string': 'Unknown'}",[],"[{'mal_id': 376, 'type': 'anime', 'name': 'Sentai Filmworks', 'url': 'https://myanimelist.net/anime/producer/376/Sentai_Filmworks'}]","[{'mal_id': 37, 'type': 'anime', 'name': 'Studio Deen', 'url': 'https://myanimelist.net/anime/producer/37/Studio_Deen'}]","[{'mal_id': 1, 'type': 'anime', 'name': 'Action', 'url': 'https://myanimelist.net/anime/genre/1/Action'}, {'mal_id': 8, 'type': 'anime', 'name': 'Drama', 'url': 'https://myanimelist.net/anime/genre/8/Drama'}, {'mal_id': 37, 'type': 'anime', 'name': 'Supernatural', 'url': 'https://myanimelist.net/anime/genre/37/Supernatural'}]",[],"[{'mal_id': 13, 'type': 'anime', 'name': 'Historical', 'url': 'https://myanimelist.net/anime/genre/13/Historical'}, {'mal_id': 21, 'type': 'anime', 'name': 'Samurai', 'url': 'https://myanimelist.net/anime/genre/21/Samurai'}]","[{'mal_id': 43, 'type': 'anime', 'name': 'Josei', 'url': 'https://myanimelist.net/anime/genre/43/Josei'}]"
7590,https://myanimelist.net/anime/7590/Mayoi_Neko_Overrun,"{'jpg': {'image_url': 'https://cdn.myanimelist.net/images/anime/10/23770.jpg', 'small_image_url': 'https://cdn.myanimelist.net/images/anime/10/23770t.jpg', 'large_image_url': 'https://cdn.myanimelist.net/images/anime/10/23770l.jpg'}, 'webp': {'image_url': 'https://cdn.myanimelist.net/images/anime/10/23770.webp', 'small_image_url': 'https://cdn.myanimelist.net/images/anime/10/23770t.webp', 'large_image_url': 'https://cdn.myanimelist.net/images/anime/10/23770l.webp'}}","{'youtube_id': 'jNG4cIFBsg8', 'url': 'https://www.youtube.com/watch?v=jNG4cIFBsg8', 'embed_url': 'https://www.youtube.com/embed/jNG4cIFBsg8?enablejsapi=1&wmode=opaque&autoplay=1', 'images': {'image_url': 'https://img.youtube.com/vi/jNG4cIFBsg8/default.jpg', 'small_image_url': 'https://img.youtube.com/vi/jNG4cIFBsg8/sddefault.jpg', 'medium_image_url': 'https://img.youtube.com/vi/jNG4cIFBsg8/mqdefault.jpg', 'large_image_url': 'https://img.youtube.com/vi/jNG4cIFBsg8/hqdefault.jpg', 'maximum_image_url': 'https://img.youtube.com/vi/jNG4cIFBsg8/maxresdefault.jpg'}}","""Mayoi Neko Overrun!""",,迷い猫オーバーラン!,['Stray Cats Overrun!'],TV,Light novel,13.0,Finished Airing,False,"{'from': '2010-04-06T00:00:00+00:00', 'to': '2010-06-29T00:00:00+00:00', 'prop': {'from': {'day': 6, 'month': 4, 'year': 2010}, 'to': {'day': 29, 'month': 6, 'year': 2010}}, 'string': 'Apr 6, 2010 to Jun 29, 2010'}",24 min per ep,PG-13 - Teens 13 or older,6.68,54641.0,5260,1370,129191,189,"Takumi Tsuzuki is a high school student who attends the Umenomori Private Academy, free of charge, alongside Fumino Serizawa, a childhood friend of his whom always says the opposite of what she feels. He spends most of his time at school fending off Chise Umenomori, the granddaughter of the board chairman and a pampered princess, who is constantly roping him into her eccentric hobbies. After school, he goes to work at the ""Stray Cats"" confectionery, a cake shop run by his adoptive older sister, Otome Tsuzuki, until it's time to go to bed. This is the average routine in the day and the life of Takumi. Mayoi Neko Overrun follows another seemingly average day in the life of Takumi. With his sister away from the shop, having gone to save someone else in need of help, Fumino takes it upon herself to wake him up so that he won't be late for their usual walk to school together, giving him a glimpse of her blue and white striped panties in the process. What a nice way to start the day. When Otome returns home, she brings with her a girl named Nozomi Kiriya, whose hair and mannerisms resemble that of a large cat. It turns out that she is a runaway that Otome can't help but take in. Takumi's ordinary days are transformed into splendid chaos as he tries to unravel who this mysterious beauty is and what she's running away from...",,spring,2010,"{'day': None, 'time': None, 'timezone': None, 'string': 'Unknown'}","[{'mal_id': 31, 'type': 'anime', 'name': 'Geneon Universal Entertainment', 'url': 'https://myanimelist.net/anime/producer/31/Geneon_Universal_Entertainment'}, {'mal_id': 61, 'type': 'anime', 'name': 'Frontier Works', 'url': 'https://myanimelist.net/anime/producer/61/Frontier_Works'}, {'mal_id': 460, 'type': 'anime', 'name': 'KlockWorx', 'url': 'https://myanimelist.net/anime/producer/460/KlockWorx'}]",[],"[{'mal_id': 48, 'type': 'anime', 'name': 'AIC', 'url': 'https://myanimelist.net/anime/producer/48/AIC'}]","[{'mal_id': 4, 'type': 'anime', 'name': 'Comedy', 'url': 'https://myanimelist.net/anime/genre/4/Comedy'}, {'mal_id': 22, 'type': 'anime', 'name': 'Romance', 'url': 'https://myanimelist.net/anime/genre/22/Romance'}]",[],"[{'mal_id': 35, 'type': 'anime', 'name': 'Harem', 'url': 'https://myanimelist.net/anime/genre/35/Harem'}]",[]
