mal_id,url,images,trailer,title,title_english,title_japanese,title_synonyms,type,source,episodes,status,airing,aired,duration,rating,score,scored_by,rank,popularity,members,favorites,synopsis,background,season,year,broadcast,producers,licensors,studios,genres,explicit_genres,themes,demographics
7720,https://myanimelist.net/anime/7720/Ookiku_Furikabutte__Natsu_no_Taikai-hen,"{'jpg': {'image_url': 'https://cdn.myanimelist.net/images/anime/10/18671.jpg', 'small_image_url': 'https://cdn.myanimelist.net/images/anime/10/18671t.jpg', 'large_image_url': 'https://cdn.myanimelist.net/images/anime/10/18671l.jpg'}, 'webp': {'image_url': 'https://cdn.myanimelist.net/images/anime/10/18671.webp', 'small_image_url': 'https://cdn.myanimelist.net/images/anime/10/18671t.webp', 'large_image_url': 'https://cdn.myanimelist.net/images/anime/10/18671l.webp'}}","{'youtube_id': '7MXsHvV4rzA', 'url': 'https://www.youtube.com/watch?v=7MXsHvV4rzA', 'embed_url': 'https://www.youtube.com/embed/7MXsHvV4rzA?enablejsapi=1&wmode=opaque&autoplay=1', 'images': {'image_url': 'https://img.youtube.com/vi/7MXsHvV4rzA/default.jpg', 'small_image_url': 'https://img.youtube.com/vi/7MXsHvV4rzA/sddefault.jpg', 'medium_image_url': 'https://img.youtube.com/vi/7MXsHvV4rzA/mqdefault.jpg', 'large_image_url': 'https://img.youtube.com/vi/7MXsHvV4rzA/hqdefault.jpg', 'maximum_image_url': 'https://img.youtube.com/vi/7MXsHvV4rzA/maxresdefault.jpg'}}","""Ookiku Furikabutte: Natsu no Taikai-hen""",Big Windup! 2,おおきく振りかぶって　〜夏の大会編〜,"['Oofuri', 'Big Windup! 2', 'Swing Big! 2', 'Ookiku Furikabutte 2', 'Ookiku Furikabutte The Summer Tournament Chapter']",TV,Manga,13.0,Finished Airing,False,"{'from': '2010-04-02T00:00:00+00:00', 'to': '2010-06-25T00:00:00+00:00', 'prop': {'from': {'day': 2, 'month': 4, 'year': 2010}, 'to': {'day': 25, 'month': 6, 'year': 2010}}, 'string': 'Apr 2, 2010 to Jun 25, 2010'}",24 min per ep,PG-13 - Teens 13 or older,8.0,20714.0,554,2861,40665,174,"Picking up where the original series left off, Ren Mihashi, the ace pitcher of the newly-formed Nishiura High School baseball team, and his teammates face the Sakitama High School team in the next round of the High School Baseball Invitational Tournament as they aim to play in the finals at legendary Hanshin Koushien Stadium. (Source: ANN)",,spring,2010,"{'day': None, 'time': None, 'timezone': None, 'string': 'Unknown'}","[{'mal_id': 17, 'type': 'anime', 'name': 'Aniplex', 'url': 'https://myanimelist.net/anime/producer/17/Aniplex'}, {'mal_id': 143, 'type': 'anime', 'name': 'Mainichi Broadcasting System', 'url': 'https://myanimelist.net/anime/producer/143/Mainichi_Broadcasting_System'}, {'mal_id': 145, 'type': 'anime', 'name': 'TBS', 'url': 'https://myanimelist.net/anime/producer/145/TBS'}, {'mal_id': 159, 'type': 'anime', 'name': 'Kodansha', 'url': 'https://myanimelist.net/anime/producer/159/Kodansha'}, {'mal_id': 166, 'type': 'anime', 'name': 'Movic', 'url': 'https://myanimelist.net/anime/producer/166/Movic'}, {'mal_id': 211, 'type': 'anime', 'name': 'Rakuonsha', 'url': 'https://myanimelist.net/anime/producer/211/Rakuonsha'}]","[{'mal_id': 217, 'type': 'anime', 'name': 'Nozomi Entertainment', 'url': 'https://myanimelist.net/anime/producer/217/Nozomi_Entertainment'}]","[{'mal_id': 56, 'type': 'anime', 'name': 'A-1 Pictures', 'url': 'https://myanimelist.net/anime/producer/56/A-1_Pictures'}]","[{'mal_id': 4, 'type': 'anime', 'name': 'Comedy', 'url': 'https://myanimelist.net/anime/genre/4/Comedy'}, {'mal_id': 30, 'type': 'anime', 'name': 'Sports', 'url': 'https://myanimelist.net/anime/genre/30/Sports'}]",[],[],"[{'mal_id': 42, 'type': 'anime', 'name': 'Seinen', 'url': 'https://myanimelist.net/anime/genre/42/Seinen'}]"
4334,https://myanimelist.net/anime/4334/Heroman,"{'jpg': {'image_url': 'https://cdn.myanimelist.net/images/anime/10/23841.jpg', 'small_image_url': 'https://cdn.myanimelist.net/images/anime/10/23841t.jpg', 'large_image_url': 'https://cdn.myanimelist.net/images/anime/10/23841l.jpg'}, 'webp': {'image_url': 'https://cdn.myanimelist.net/images/anime/10/23841.webp', 'small_image_url': 'https://cdn.myanimelist.net/images/anime/10/23841t.webp', 'large_image_url': 'https://cdn.myanimelist.net/images/anime/10/23841l.webp'}}","{'youtube_id': 'cxxD9_260C0', 'url': 'https://www.youtube.com/watch?v=cxxD9_260C0', 'embed_url': 'https://www.youtube.com/embed/cxxD9_260C0?enablejsapi=1&wmode=opaque&autoplay=1', 'images': {'image_url': 'https://img.youtube.com/vi/cxxD9_260C0/default.jpg', 'small_image_url': 'https://img.youtube.com/vi/cxxD9_260C0/sddefault.jpg', 'medium_image_url': 'https://img.youtube.com/vi/cxxD9_260C0/mqdefault.jpg', 'large_image_url': 'https://img.youtube.com/vi/cxxD9_260C0/hqdefault.jpg', 'maximum_image_url': 'https://img.youtube.com/vi/cxxD9_260C0/maxresdefault.jpg'}}","""Heroman""",,ヒーローマン,[],TV,Original,26.0,Finished Airing,False,"{'from': '2010-04-01T00:00:00+00:00', 'to': '2010-09-23T00:00:00+00:00', 'prop': {'from': {'day': 1, 'month': 4, 'year': 2010}, 'to': {'day': 23, 'month': 9, 'year': 2010}}, 'string': 'Apr 1, 2010 to Sep 23, 2010'}",24 min per ep,PG - Children,6.82,12536.0,4578,3044,36717,70,"In California's Center City, shy but kindhearted Joseph Carter ""Joey"" Jones lives with his grandmother, working in a coffee shop. Though his family is financially burdened and he is bullied at school, he remains cheerful. A robotics enthusiast, he wants a top-of-the-line toy robot called a Heybo more than anything. One day Joey and his friend Simon ""Psy"" Kaina come across a destroyed Heybo discarded by a group of rich kids. He takes it home and repairs it himself, excitedly naming it Heroman. However, one night Heroman is struck by lightning and comes to life, growing several times its size in the process. That same night Center City is attacked by aliens called Skrugg whose attention was brought to Earth after Joey's acquaintance Professor Matthew Denton made attempts to contact them. Along with Joey, Heroman quickly heads to the scene of the attack, where he finds people in trouble, including his friend Lina Davis and her father. Using an arm-mounted controller, Joey is able to command Heroman to use superpowers to fight off the Skrugg and rescue civilians. As the aliens continue their invasion of Earth, the duo are the only ones separating humanity and destruction. [Written by MAL Rewrite]",,spring,2010,"{'day': 'Thursdays', 'time': '18:00', 'timezone': 'Asia/Tokyo', 'string': 'Thursdays at 18:00 (JST)'}","[{'mal_id': 16, 'type': 'anime', 'name': 'TV Tokyo', 'url': 'https://myanimelist.net/anime/producer/16/TV_Tokyo'}, {'mal_id': 53, 'type': 'anime', 'name': 'Dentsu', 'url': 'https://myanimelist.net/anime/producer/53/Dentsu'}, {'mal_id': 58, 'type': 'anime', 'name': 'Square Enix', 'url': 'https://myanimelist.net/anime/producer/58/Square_Enix'}]",[],"[{'mal_id': 4, 'type': 'anime', 'name': 'Bones', 'url': 'https://myanimelist.net/anime/producer/4/Bones'}]","[{'mal_id': 1, 'type': 'anime', 'name': 'Action', 'url': 'https://myanimelist.net/anime/genre/1/Action'}, {'mal_id': 24, 'type': 'anime', 'name': 'Sci-Fi', 'url': 'https://myanimelist.net/anime/genre/24/Sci-Fi'}]",[],[],"[{'mal_id': 27, 'type': 'anime', 'name': 'Shounen', 'url': 'https://myanimelist.net/anime/genre/27/Shounen'}]"
8057,https://myanimelist.net/anime/8057/Shin_Koihime†Musou__Otome_Tairan,"{'jpg': {'image_url': 'https://cdn.myanimelist.net/images/anime/12/74034.jpg', 'small_image_url': 'https://cdn.myanimelist.net/images/anime/12/74034t.jpg', 'large_image_url': 'https://cdn.myanimelist.net/images/anime/12/74034l.jpg'}, 'webp': {'image_url': 'https://cdn.myanimelist.net/images/anime/12/74034.webp', 'small_image_url': 'https://cdn.myanimelist.net/images/anime/12/74034t.webp', 'large_image_url': 'https://cdn.myanimelist.net/images/anime/12/74034l.webp'}}","{'youtube_id': None, 'url': None, 'embed_url': None, 'images': {'image_url': None, 'small_image_url': None, 'medium_image_url': None, 'large_image_url': None, 'maximum_image_url': None}}","""Shin Koihime†Musou: Otome Tairan""",,真恋姫†無双 ~乙女大乱~,['Shin Koihime Musou 2nd Season'],TV,Visual novel,12.0,Finished Airing,False,"{'from': '2010-03-26T00:00:00+00:00', 'to': '2010-06-17T00:00:00+00:00', 'prop': {'from': {'day': 26, 'month': 3, 'year': 2010}, 'to': {'day': 17, 'month': 6, 'year': 2010}}, 'string': 'Mar 26, 2010 to Jun 17, 2010'}",25 min per ep,R+ - Mild Nudity,6.99,7537.0,3880,4159,19274,24,"The third season of Koihime Musou. Han's high court general Kashin (何進) was forced to swallow a cursed pill from Chou Jou. The effect is slowly turning her into a cat, which she dislikes. Chou Jou also made use of the emperor's name to dispose her from the Han court as a traitor. She met Kada during her escape while Kada brought her to the Touka village, whom he believes they would help her.",,spring,2010,"{'day': None, 'time': None, 'timezone': None, 'string': 'Unknown'}","[{'mal_id': 753, 'type': 'anime', 'name': 'PRA', 'url': 'https://myanimelist.net/anime/producer/753/PRA'}, {'mal_id': 755, 'type': 'anime', 'name': 'Jumondo', 'url': 'https://myanimelist.net/anime/producer/755/Jumondo'}]","[{'mal_id': 376, 'type': 'anime', 'name': 'Sentai Filmworks', 'url': 'https://myanimelist.net/anime/producer/376/Sentai_Filmworks'}]","[{'mal_id': 95, 'type': 'anime', 'name': 'Doga Kobo', 'url': 'https://myanimelist.net/anime/producer/95/Doga_Kobo'}]","[{'mal_id': 2, 'type': 'anime', 'name': 'Adventure', 'url': 'https://myanimelist.net/anime/genre/2/Adventure'}, {'mal_id': 4, 'type': 'anime', 'name': 'Comedy', 'url': 'https://myanimelist.net/anime/genre/4/Comedy'}, {'mal_id': 10, 'type': 'anime', 'name': 'Fantasy', 'url': 'https://myanimelist.net/anime/genre/10/Fantasy'}, {'mal_id': 9, 'type': 'anime', 'name': 'Ecchi', 'url': 'https://myanimelist.net/anime/genre/9/Ecchi'}]",[],"[{'mal_id': 13, 'type': 'anime', 'name': 'Historical', 'url': 'https://myanimelist.net/anime/genre/13/Historical'}]",[]
8217,https://myanimelist.net/anime/8217/Jewelpet_Twinkle☆,"{'jpg': {'image_url': 'https://cdn.myanimelist.net/images/anime/12/73943.jpg', 'small_image_url': 'https://cdn.myanimelist.net/images/anime/12/73943t.jpg', 'large_image_url': 'https://cdn.myanimelist.net/images/anime/12/73943l.jpg'}, 'webp': {'image_url': 'https://cdn.myanimelist.net/images/anime/12/73943.webp', 'small_image_url': 'https://cdn.myanimelist.net/images/anime/12/73943t.webp', 'large_image_url': 'https://cdn.myanimelist.net/images/anime/12/73943l.webp'}}","{'youtube_id': None, 'url': None, 'embed_url': None, 'images': {'image_url': None, 'small_image_url': None, 'medium_image_url': None, 'large_image_url': None, 'maximum_image_url': None}}","""Jewelpet Twinkle☆""",,ジュエルペット てぃんくる☆,"['Jewelpet Twinkle Star', 'Jewelpet 2', 'Jewelpet Tinkle']",TV,Original,52.0,Finished Airing,False,"{'from': '2010-04-03T00:00:00+00:00', 'to': '2011-04-02T00:00:00+00:00', 'prop': {'from': {'day': 3, 'month': 4, 'year': 2010}, 'to': {'day': 2, 'month': 4, 'year': 2011}}, 'string': 'Apr 3, 2010 to Apr 2, 2011'}",24 min per ep,PG - Children,7.4,3821.0,1999,5385,10155,94,"In Jewel Land, Jewelpets, creatures who has the natural ability to use magic lived in harmony with the Witches, attending the School of Witchcraft and Wizardry to learn to use magic with their Jewel Eyes. However for Ruby, a white Japanese Hare whose magic sometimes fail, is appointed to go to the Human World to search for her partner. But when she used the card the magicians gave her, she was sent to the Human World by accident. In the Human World, A girl named Akari Sakura met her on the beach on her way to school. At first, Akari can't understand her due to her Jewel Land Language until Ruby took a special candy so she could speak and understand human language. As the day passes, Ruby knew about her problems and later apologized. A Jewel Charm appeared on Akari's hand and she realized it that she's chosen by Ruby to be her partner. After that, she decided to enter the Jewel Star Grand Prix, on the prize is that any wish that they wanted will be granted. Will she be the Next Jewel Star and her wish be granted in the end? Or It'll just end in one big disaster... (Source: Wikipedia)",,spring,2010,"{'day': None, 'time': None, 'timezone': None, 'string': 'Unknown'}","[{'mal_id': 16, 'type': 'anime', 'name': 'TV Tokyo', 'url': 'https://myanimelist.net/anime/producer/16/TV_Tokyo'}, {'mal_id': 64, 'type': 'anime', 'name': 'Sotsu', 'url': 'https://myanimelist.net/anime/producer/64/Sotsu'}, {'mal_id': 150, 'type': 'anime', 'name': 'Sanrio', 'url': 'https://myanimelist.net/anime/producer/150/Sanrio'}, {'mal_id': 829, 'type': 'anime', 'name': 'Studio Jack', 'url': 'https://myanimelist.net/anime/producer/829/Studio_Jack'}]",[],"[{'mal_id': 126, 'type': 'anime', 'name': 'Studio Comet', 'url': 'https://myanimelist.net/anime/producer/126/Studio_Comet'}]","[{'mal_id': 10, 'type': 'anime', 'name': 'Fantasy', 'url': 'https://myanimelist.net/anime/genre/10/Fantasy'}]",[],"[{'mal_id': 23, 'type': 'anime', 'name': 'School', 'url': 'https://myanimelist.net/anime/genre/23/School'}]","[{'mal_id': 25, 'type': 'anime', 'name': 'Shoujo', 'url': 'https://myanimelist.net/anime/genre/25/Shoujo'}]"
8206,https://myanimelist.net/anime/8206/Hime_Chen_Otogi_Chikku_Idol_Lilpri,"{'jpg': {'image_url': 'https://cdn.myanimelist.net/images/anime/6/71891.jpg', 'small_image_url': 'https://cdn.myanimelist.net/images/anime/6/71891t.jpg', 'large_image_url': 'https://cdn.myanimelist.net/images/anime/6/71891l.jpg'}, 'webp': {'image_url': 'https://cdn.myanimelist.net/images/anime/6/71891.webp', 'small_image_url': 'https://cdn.myanimelist.net/images/anime/6/71891t.webp', 'large_image_url': 'https://cdn.myanimelist.net/images/anime/6/71891l.webp'}}","{'youtube_id': None, 'url': None, 'embed_url': None, 'images': {'image_url': None, 'small_image_url': None, 'medium_image_url': None, 'large_image_url': None, 'maximum_image_url': None}}","""Hime Chen! Otogi Chikku Idol Lilpri""",Spellbound! Magical Princess Lilpri,ひめチェン! おとぎちっくアイドル リルぷりっ,"[""Himechan! Otogitic Idol Lil'Pri""]",TV,Game,51.0,Finished Airing,False,"{'from': '2010-04-04T00:00:00+00:00', 'to': '2011-03-27T00:00:00+00:00', 'prop': {'from': {'day': 4, 'month': 4, 'year': 2010}, 'to': {'day': 27, 'month': 3, 'year': 2011}}, 'string': 'Apr 4, 2010 to Mar 27, 2011'}",24 min per ep,PG - Children,6.99,2924.0,3863,5529,9493,48,"The Fairytale World is in trouble. Its princesses and their respective worlds are disappearing, causing a ripple effect in the human world where their stories are popular. In order to save the Fairytale World, the Queen sends three magic animals, Sei, Dai, and Ryoku, to the human world with magic gems to find three girls who can become the ""Super Miracle Idols,"" the princesses Snow White, Cinderella, and Kaguya-hime. Those ""princesses"" end up being three little girls: Yukimori Ringo, Takashiro Layla, and Sasahara Natsuki. But the gems transform them into older singing superstars, and after their accidental debut at the singer Wish's concert, they become known as ""Little Princesses,"" or ""LilPri."" Now they must collect Happiness Tones from humans in order to restore the Fairytale World.",,spring,2010,"{'day': 'Sundays', 'time': '09:00', 'timezone': 'Asia/Tokyo', 'string': 'Sundays at 09:00 (JST)'}","[{'mal_id': 16, 'type': 'anime', 'name': 'TV Tokyo', 'url': 'https://myanimelist.net/anime/producer/16/TV_Tokyo'}, {'mal_id': 62, 'type': 'anime', 'name': 'Shogakukan-Shueisha Productions', 'url': 'https://myanimelist.net/anime/producer/62/Shogakukan-Shueisha_Productions'}, {'mal_id': 213, 'type': 'anime', 'name': 'Half H.P Studio', 'url': 'https://myanimelist.net/anime/producer/213/Half_HP_Studio'}]",[],"[{'mal_id': 73, 'type': 'anime', 'name': 'TMS Entertainment', 'url': 'https://myanimelist.net/anime/producer/73/TMS_Entertainment'}]",[],[],[],"[{'mal_id': 25, 'type': 'anime', 'name': 'Shoujo', 'url': 'https://myanimelist.net/anime/genre/25/Shoujo'}]"
8287,https://myanimelist.net/anime/8287/SD_Gundam_Sangokuden_Brave_Battle_Warriors,"{'jpg': {'image_url': 'https://cdn.myanimelist.net/images/anime/6/21471.jpg', 'small_image_url': 'https://cdn.myanimelist.net/images/anime/6/21471t.jpg', 'large_image_url': 'https://cdn.myanimelist.net/images/anime/6/21471l.jpg'}, 'webp': {'image_url': 'https://cdn.myanimelist.net/images/anime/6/21471.webp', 'small_image_url': 'https://cdn.myanimelist.net/images/anime/6/21471t.webp', 'large_image_url': 'https://cdn.myanimelist.net/images/anime/6/21471l.webp'}}","{'youtube_id': None, 'url': None, 'embed_url': None, 'images': {'image_url': None, 'small_image_url': None, 'medium_image_url': None, 'large_image_url': None, 'maximum_image_url': None}}","""SD Gundam Sangokuden Brave Battle Warriors""",,SDガンダム三国伝 Brave Battle Warriors,['BB Senshi'],TV,Original,51.0,Finished Airing,False,"{'from': '2010-04-03T00:00:00+00:00', 'to': '2011-03-19T00:00:00+00:00', 'prop': {'from': {'day': 3, 'month': 4, 'year': 2010}, 'to': {'day': 19, 'month': 3, 'year': 2011}}, 'string': 'Apr 3, 2010 to Mar 19, 2011'}",12 min per ep,PG - Children,6.3,1231.0,7186,7633,4248,3,A Romance of the Three Kingdoms retelling using SD Gundams.,,spring,2010,"{'day': None, 'time': None, 'timezone': None, 'string': 'Unknown'}","[{'mal_id': 64, 'type': 'anime', 'name': 'Sotsu', 'url': 'https://myanimelist.net/anime/producer/64/Sotsu'}, {'mal_id': 717, 'type': 'anime', 'name': 'TV Tokyo Music', 'url': 'https://myanimelist.net/anime/producer/717/TV_Tokyo_Music'}]",[],"[{'mal_id': 14, 'type': 'anime', 'name': 'Sunrise', 'url': 'https://myanimelist.net/anime/producer/14/Sunrise'}]","[{'mal_id': 1, 'type': 'anime', 'name': 'Action', 'url': 'https://myanimelist.net/anime/genre/1/Action'}]",[],"[{'mal_id': 13, 'type': 'anime', 'name': 'Historical', 'url': 'https://myanimelist.net/anime/genre/13/Historical'}, {'mal_id': 18, 'type': 'anime', 'name': 'Mecha', 'url': 'https://myanimelist.net/anime/genre/18/Mecha'}]",[]
8538,https://myanimelist.net/anime/8538/Gokujou_Mecha_Mote_Iinchou_Second_Collection,"{'jpg': {'image_url': 'https://cdn.myanimelist.net/images/anime/5/23149.jpg', 'small_image_url': 'https://cdn.myanimelist.net/images/anime/5/23149t.jpg', 'large_image_url': 'https://cdn.myanimelist.net/images/anime/5/23149l.jpg'}, 'webp': {'image_url': 'https://cdn.myanimelist.net/images/anime/5/23149.webp', 'small_image_url': 'https://cdn.myanimelist.net/images/anime/5/23149t.webp', 'large_image_url': 'https://cdn.myanimelist.net/images/anime/5/23149l.webp'}}","{'youtube_id': None, 'url': None, 'embed_url': None, 'images': {'image_url': None, 'small_image_url': None, 'medium_image_url': None, 'large_image_url': None, 'maximum_image_url': None}}","""Gokujou!! Mecha Mote Iinchou Second Collection""",The Best!! Extremely Cool Student Council President Second Collection,極上!!めちゃモテ委員長 セカンドコレクション,['Gokujo!! Mecha Mote Iincho Second Collection'],TV,Manga,51.0,Finished Airing,False,"{'from': '2010-04-03T00:00:00+00:00', 'to': '2011-04-10T00:00:00+00:00', 'prop': {'from': {'day': 3, 'month': 4, 'year': 2010}, 'to': {'day': 10, 'month': 4, 'year': 2011}}, 'string': 'Apr 3, 2010 to Apr 10, 2011'}",24 min per ep,PG - Children,6.26,600.0,7419,8962,2596,2,The continuation of Gokujou!! Mecha Mote Iinchou with a new title. Episode numbers continue from 51.,,spring,2010,"{'day': None, 'time': None, 'timezone': None, 'string': 'Unknown'}","[{'mal_id': 16, 'type': 'anime', 'name': 'TV Tokyo', 'url': 'https://myanimelist.net/anime/producer/16/TV_Tokyo'}, {'mal_id': 62, 'type': 'anime', 'name': 'Shogakukan-Shueisha Productions', 'url': 'https://myanimelist.net/anime/producer/62/Shogakukan-Shueisha_Productions'}]",[],"[{'mal_id': 118, 'type': 'anime', 'name': 'SynergySP', 'url': 'https://myanimelist.net/anime/producer/118/SynergySP'}]","[{'mal_id': 4, 'type': 'anime', 'name': 'Comedy', 'url': 'https://myanimelist.net/anime/genre/4/Comedy'}, {'mal_id': 22, 'type': 'anime', 'name': 'Romance', 'url': 'https://myanimelist.net/anime/genre/22/Romance'}]",[],"[{'mal_id': 23, 'type': 'anime', 'name': 'School', 'url': 'https://myanimelist.net/anime/genre/23/School'}]","[{'mal_id': 25, 'type': 'anime', 'name': 'Shoujo', 'url': 'https://myanimelist.net/anime/genre/25/Shoujo'}]"
6902,https://myanimelist.net/anime/6902/Saikyou_Bushouden__Sangoku_Engi,"{'jpg': {'image_url': 'https://cdn.myanimelist.net/images/anime/5/32589.jpg', 'small_image_url': 'https://cdn.myanimelist.net/images/anime/5/32589t.jpg', 'large_image_url': 'https://cdn.myanimelist.net/images/anime/5/32589l.jpg'}, 'webp': {'image_url': 'https://cdn.myanimelist.net/images/anime/5/32589.webp', 'small_image_url': 'https://cdn.myanimelist.net/images/anime/5/32589t.webp', 'large_image_url': 'https://cdn.myanimelist.net/images/anime/5/32589l.webp'}}","{'youtube_id': None, 'url': None, 'embed_url': None, 'images': {'image_url': None, 'small_image_url': None, 'medium_image_url': None, 'large_image_url': None, 'maximum_image_url': None}}","""Saikyou Bushouden: Sangoku Engi""",,最強武将伝・三国演義,['Romance of the Three Kingdoms'],TV,Novel,52.0,Finished Airing,False,"{'from': '2010-04-04T00:00:00+00:00', 'to': '2011-03-27T00:00:00+00:00', 'prop': {'from': {'day': 4, 'month': 4, 'year': 2010}, 'to': {'day': 27, 'month': 3, 'year': 2011}}, 'string': 'Apr 4, 2010 to Mar 27, 2011'}",25 min per ep,PG-13 - Teens 13 or older,6.74,274.0,4933,9279,2273,5,"Chinese-Japanese anime adaptation of the ""Romance of the Three Kingdoms"" classic novel. Lui Bei embarks on a journey to quell the chaos that plagues his homeland, bringing with him his sworn brothers, Zhang Fei and Guan Yu. With only a small army and no land Lui Bei is forced to take a subservient role to other Generals, in order to keep him safe from those who continually come after his life.",,spring,2010,"{'day': 'Sundays', 'time': '09:30', 'timezone': 'Asia/Tokyo', 'string': 'Sundays at 09:30 (JST)'}","[{'mal_id': 1457, 'type': 'anime', 'name': 'Hisashishi Videos', 'url': 'https://myanimelist.net/anime/producer/1457/Hisashishi_Videos'}, {'mal_id': 1458, 'type': 'anime', 'name': 'TOMY Company', 'url': 'https://myanimelist.net/anime/producer/1458/TOMY_Company'}]",[],"[{'mal_id': 340, 'type': 'anime', 'name': 'Future Planet', 'url': 'https://myanimelist.net/anime/producer/340/Future_Planet'}, {'mal_id': 1456, 'type': 'anime', 'name': 'Beijing Huihuang Animation Company', 'url': 'https://myanimelist.net/anime/producer/1456/Beijing_Huihuang_Animation_Company'}]",[],[],"[{'mal_id': 13, 'type': 'anime', 'name': 'Historical', 'url': 'https://myanimelist.net/anime/genre/13/Historical'}]",[]
10528,https://myanimelist.net/anime/10528/Duel_Masters_Cross_Shock,"{'jpg': {'image_url': 'https://cdn.myanimelist.net/images/anime/1053/105191.jpg', 'small_image_url': 'https://cdn.myanimelist.net/images/anime/1053/105191t.jpg', 'large_image_url': 'https://cdn.myanimelist.net/images/anime/1053/105191l.jpg'}, 'webp': {'image_url': 'https://cdn.myanimelist.net/images/anime/1053/105191.webp', 'small_image_url': 'https://cdn.myanimelist.net/images/anime/1053/105191t.webp', 'large_image_url': 'https://cdn.myanimelist.net/images/anime/1053/105191l.webp'}}","{'youtube_id': None, 'url': None, 'embed_url': None, 'images': {'image_url': None, 'small_image_url': None, 'medium_image_url': None, 'large_image_url': None, 'maximum_image_url': None}}","""Duel Masters Cross Shock""",,デュエル・マスターズ クロスショック,[],TV,Original,50.0,Finished Airing,False,"{'from': '2010-04-03T00:00:00+00:00', 'to': '2011-03-26T00:00:00+00:00', 'prop': {'from': {'day': 3, 'month': 4, 'year': 2010}, 'to': {'day': 26, 'month': 3, 'year': 2011}}, 'string': 'Apr 3, 2010 to Mar 26, 2011'}",10 min per ep,PG-13 - Teens 13 or older,6.12,612.0,8108,9796,1872,1,"Shobu and friends continue to face the members of Fua Duelist in the world championship and defeat them all. And now Shobu is the world champion. Before Shobu could relax he is being called into the creature world to face Diabolos Zeta, Temporal Ruler, who is about to bring annihilation. Shobu and friends gather the new legendary cards and stop him with their new powers of these cards. (Source: Duel Masters Wikia)",,spring,2010,"{'day': None, 'time': None, 'timezone': None, 'string': 'Unknown'}","[{'mal_id': 62, 'type': 'anime', 'name': 'Shogakukan-Shueisha Productions', 'url': 'https://myanimelist.net/anime/producer/62/Shogakukan-Shueisha_Productions'}, {'mal_id': 1415, 'type': 'anime', 'name': 'Asahi Broadcasting', 'url': 'https://myanimelist.net/anime/producer/1415/Asahi_Broadcasting'}]",[],[],"[{'mal_id': 1, 'type': 'anime', 'name': 'Action', 'url': 'https://myanimelist.net/anime/genre/1/Action'}, {'mal_id': 2, 'type': 'anime', 'name': 'Adventure', 'url': 'https://myanimelist.net/anime/genre/2/Adventure'}, {'mal_id': 4, 'type': 'anime', 'name': 'Comedy', 'url': 'https://myanimelist.net/anime/genre/4/Comedy'}, {'mal_id': 10, 'type': 'anime', 'name': 'Fantasy', 'url': 'https://myanimelist.net/anime/genre/10/Fantasy'}]",[],"[{'mal_id': 11, 'type': 'anime', 'name': 'Game', 'url': 'https://myanimelist.net/anime/genre/11/Game'}]","[{'mal_id': 15, 'type': 'anime', 'name': 'Kids', 'url': 'https://myanimelist.net/anime/genre/15/Kids'}]"
