mal_id,url,images,trailer,title,title_english,title_japanese,title_synonyms,type,source,episodes,status,airing,aired,duration,rating,score,scored_by,rank,popularity,members,favorites,synopsis,background,season,year,broadcast,producers,licensors,studios,genres,explicit_genres,themes,demographics
7058,https://myanimelist.net/anime/7058/Uragiri_wa_Boku_no_Namae_wo_Shitteiru,"{'jpg': {'image_url': 'https://cdn.myanimelist.net/images/anime/4/26525.jpg', 'small_image_url': 'https://cdn.myanimelist.net/images/anime/4/26525t.jpg', 'large_image_url': 'https://cdn.myanimelist.net/images/anime/4/26525l.jpg'}, 'webp': {'image_url': 'https://cdn.myanimelist.net/images/anime/4/26525.webp', 'small_image_url': 'https://cdn.myanimelist.net/images/anime/4/26525t.webp', 'large_image_url': 'https://cdn.myanimelist.net/images/anime/4/26525l.webp'}}","{'youtube_id': 's5-_LQ3luEU', 'url': 'https://www.youtube.com/watch?v=s5-_LQ3luEU', 'embed_url': 'https://www.youtube.com/embed/s5-_LQ3luEU?enablejsapi=1&wmode=opaque&autoplay=1', 'images': {'image_url': 'https://img.youtube.com/vi/s5-_LQ3luEU/default.jpg', 'small_image_url': 'https://img.youtube.com/vi/s5-_LQ3luEU/sddefault.jpg', 'medium_image_url': 'https://img.youtube.com/vi/s5-_LQ3luEU/mqdefault.jpg', 'large_image_url': 'https://img.youtube.com/vi/s5-_LQ3luEU/hqdefault.jpg', 'maximum_image_url': 'https://img.youtube.com/vi/s5-_LQ3luEU/maxresdefault.jpg'}}","""Uragiri wa Boku no Namae wo Shitteiru""",The Betrayal Knows My Name,裏切りは僕の名前を知っている,['Uraboku'],TV,Manga,24.0,Finished Airing,False,"{'from': '2010-04-12T00:00:00+00:00', 'to': '2010-09-20T00:00:00+00:00', 'prop': {'from': {'day': 12, 'month': 4, 'year': 2010}, 'to': {'day': 20, 'month': 9, 'year': 2010}}, 'string': 'Apr 12, 2010 to Sep 20, 2010'}",23 min per ep,R - 17+ (violence & profanity),7.22,32891.0,2802,1785,91401,917,"Growing up as an orphan, Yuki Sakurai questions his reason for living and ability to see a person's painful memory by simply touching them. After receiving anonymous notes telling him to die, Yuki is unable to shake off the nagging feeling forming inside of him. Unbeknownst to him, he is being watched, both by people who want to harm him and those who want to protect him. One foggy night, Yuki's life is saved by a beautiful man with silver eyes and jet black hair—a man he has never met before yet seems familiar. With the arrival of this mysterious stranger, Yuki's forgotten past has been awakened and the purpose of his existence has appeared before him. Uragiri wa Boku no Namae wo Shitteiru tells the story of a teenage boy as he discovers who he is and where he comes from—all while making friends, experiencing betrayal, and slowly piecing together the puzzle of his past. [Written by MAL Rewrite]",,spring,2010,"{'day': None, 'time': None, 'timezone': None, 'string': 'Unknown'}",[],"[{'mal_id': 102, 'type': 'anime', 'name': 'Funimation', 'url': 'https://myanimelist.net/anime/producer/102/Funimation'}]","[{'mal_id': 7, 'type': 'anime', 'name': 'J.C.Staff', 'url': 'https://myanimelist.net/anime/producer/7/JCStaff'}]","[{'mal_id': 2, 'type': 'anime', 'name': 'Adventure', 'url': 'https://myanimelist.net/anime/genre/2/Adventure'}, {'mal_id': 28, 'type': 'anime', 'name': 'Boys Love', 'url': 'https://myanimelist.net/anime/genre/28/Boys_Love'}, {'mal_id': 8, 'type': 'anime', 'name': 'Drama', 'url': 'https://myanimelist.net/anime/genre/8/Drama'}, {'mal_id': 10, 'type': 'anime', 'name': 'Fantasy', 'url': 'https://myanimelist.net/anime/genre/10/Fantasy'}]",[],[],"[{'mal_id': 25, 'type': 'anime', 'name': 'Shoujo', 'url': 'https://myanimelist.net/anime/genre/25/Shoujo'}]"
7588,https://myanimelist.net/anime/7588/Saraiya_Goyou,"{'jpg': {'image_url': 'https://cdn.myanimelist.net/images/anime/4/75203.jpg', 'small_image_url': 'https://cdn.myanimelist.net/images/anime/4/75203t.jpg', 'large_image_url': 'https://cdn.myanimelist.net/images/anime/4/75203l.jpg'}, 'webp': {'image_url': 'https://cdn.myanimelist.net/images/anime/4/75203.webp', 'small_image_url': 'https://cdn.myanimelist.net/images/anime/4/75203t.webp', 'large_image_url': 'https://cdn.myanimelist.net/images/anime/4/75203l.webp'}}","{'youtube_id': None, 'url': None, 'embed_url': None, 'images': {'image_url': None, 'small_image_url': None, 'medium_image_url': None, 'large_image_url': None, 'maximum_image_url': None}}","""Saraiya Goyou""",House of Five Leaves,さらい屋 五葉,['Sarai-ya Goyou'],TV,Manga,12.0,Finished Airing,False,"{'from': '2010-04-16T00:00:00+00:00', 'to': '2010-07-02T00:00:00+00:00', 'prop': {'from': {'day': 16, 'month': 4, 'year': 2010}, 'to': {'day': 2, 'month': 7, 'year': 2010}}, 'string': 'Apr 16, 2010 to Jul 2, 2010'}",23 min per ep,PG-13 - Teens 13 or older,7.8,24180.0,862,1922,81888,788,"Saraiya Goyou follows Masanosuke Akitsu, a wandering ronin adrift in Japan's peaceful Edo period. Despite being a skilled swordsman, Masa's meek personality has netted him the label ""unreliable,"" and he is often abruptly dismissed by his employers, leading him to question his resolve as a samurai. As Masa reaches his lowest point, he is approached by Yaichi, a carefree man draped in pink who seemingly hires him on a whim as his bodyguard. Unbeknownst to Masa, the job is not as innocent as it seems, and he is drawn into the illicit activities of the group spearheaded by Yaichi. As he becomes further entwined with the gang known as the ""Five Leaves,"" Masa struggles with his own principles. Still, his curiosity spurs him forward to uncover the past and motivations of this mysterious band of outlaws. [Written by MAL Rewrite]",,spring,2010,"{'day': 'Fridays', 'time': '01:15', 'timezone': 'Asia/Tokyo', 'string': 'Fridays at 01:15 (JST)'}","[{'mal_id': 53, 'type': 'anime', 'name': 'Dentsu', 'url': 'https://myanimelist.net/anime/producer/53/Dentsu'}, {'mal_id': 108, 'type': 'anime', 'name': 'Media Factory', 'url': 'https://myanimelist.net/anime/producer/108/Media_Factory'}, {'mal_id': 166, 'type': 'anime', 'name': 'Movic', 'url': 'https://myanimelist.net/anime/producer/166/Movic'}, {'mal_id': 169, 'type': 'anime', 'name': 'Fuji TV', 'url': 'https://myanimelist.net/anime/producer/169/Fuji_TV'}, {'mal_id': 1430, 'type': 'anime', 'name': 'Shogakukan', 'url': 'https://myanimelist.net/anime/producer/1430/Shogakukan'}]","[{'mal_id': 372, 'type': 'anime', 'name': 'NIS America, Inc.', 'url': 'https://myanimelist.net/anime/producer/372/NIS_America_Inc'}]","[{'mal_id': 32, 'type': 'anime', 'name': 'Manglobe', 'url': 'https://myanimelist.net/anime/producer/32/Manglobe'}]","[{'mal_id': 8, 'type': 'anime', 'name': 'Drama', 'url': 'https://myanimelist.net/anime/genre/8/Drama'}, {'mal_id': 7, 'type': 'anime', 'name': 'Mystery', 'url': 'https://myanimelist.net/anime/genre/7/Mystery'}]",[],"[{'mal_id': 13, 'type': 'anime', 'name': 'Historical', 'url': 'https://myanimelist.net/anime/genre/13/Historical'}, {'mal_id': 21, 'type': 'anime', 'name': 'Samurai', 'url': 'https://myanimelist.net/anime/genre/21/Samurai'}]","[{'mal_id': 42, 'type': 'anime', 'name': 'Seinen', 'url': 'https://myanimelist.net/anime/genre/42/Seinen'}]"
7661,https://myanimelist.net/anime/7661/Giant_Killing,"{'jpg': {'image_url': 'https://cdn.myanimelist.net/images/anime/13/30191.jpg', 'small_image_url': 'https://cdn.myanimelist.net/images/anime/13/30191t.jpg', 'large_image_url': 'https://cdn.myanimelist.net/images/anime/13/30191l.jpg'}, 'webp': {'image_url': 'https://cdn.myanimelist.net/images/anime/13/30191.webp', 'small_image_url': 'https://cdn.myanimelist.net/images/anime/13/30191t.webp', 'large_image_url': 'https://cdn.myanimelist.net/images/anime/13/30191l.webp'}}","{'youtube_id': None, 'url': None, 'embed_url': None, 'images': {'image_url': None, 'small_image_url': None, 'medium_image_url': None, 'large_image_url': None, 'maximum_image_url': None}}","""Giant Killing""",Giant Killing,ジャイアントキリング,[],TV,Manga,26.0,Finished Airing,False,"{'from': '2010-04-04T00:00:00+00:00', 'to': '2010-09-26T00:00:00+00:00', 'prop': {'from': {'day': 4, 'month': 4, 'year': 2010}, 'to': {'day': 26, 'month': 9, 'year': 2010}}, 'string': 'Apr 4, 2010 to Sep 26, 2010'}",24 min per ep,PG-13 - Teens 13 or older,7.55,31247.0,1471,2238,63666,339,"East Tokyo United (ETU) has been struggling in Japan's top soccer league for the past few years. It has taken everything they have just to avoid relegation. To make matters even worse, the team has lost five matches in a row, leading to abysmal team morale. Even the fans are beginning to abandon them, and rumors hint that the home ground municipality is going to withdraw their support. With countless coaches fired and poor financial choices in hiring players, it is a downward spiral for ETU. The board of directors, under pressure from general manager Kousei Gotou, takes a gamble and hires a new coach—the slightly eccentric Takeshi Tatsumi. Though considered a great soccer player when he was younger, Tatsumi abandoned ETU years ago. However, since then, he has proven himself successful as the manager of one of England's lower division amateur teams. Tatsumi's task won't be easy; ETU fans call him a traitor, and the team is pitted against others with larger budgets and better players. Yet even the underdog can take down a goliath, and Tatsumi claims he is an expert at giant killing. [Written by MAL Rewrite]",,spring,2010,"{'day': None, 'time': None, 'timezone': None, 'string': 'Unknown'}","[{'mal_id': 111, 'type': 'anime', 'name': 'NHK', 'url': 'https://myanimelist.net/anime/producer/111/NHK'}]",[],"[{'mal_id': 37, 'type': 'anime', 'name': 'Studio Deen', 'url': 'https://myanimelist.net/anime/producer/37/Studio_Deen'}]","[{'mal_id': 8, 'type': 'anime', 'name': 'Drama', 'url': 'https://myanimelist.net/anime/genre/8/Drama'}, {'mal_id': 30, 'type': 'anime', 'name': 'Sports', 'url': 'https://myanimelist.net/anime/genre/30/Sports'}]",[],[],"[{'mal_id': 42, 'type': 'anime', 'name': 'Seinen', 'url': 'https://myanimelist.net/anime/genre/42/Seinen'}]"
5337,https://myanimelist.net/anime/5337/Bakugan_Battle_Brawlers__New_Vestroia,"{'jpg': {'image_url': 'https://cdn.myanimelist.net/images/anime/1339/117249.jpg', 'small_image_url': 'https://cdn.myanimelist.net/images/anime/1339/117249t.jpg', 'large_image_url': 'https://cdn.myanimelist.net/images/anime/1339/117249l.jpg'}, 'webp': {'image_url': 'https://cdn.myanimelist.net/images/anime/1339/117249.webp', 'small_image_url': 'https://cdn.myanimelist.net/images/anime/1339/117249t.webp', 'large_image_url': 'https://cdn.myanimelist.net/images/anime/1339/117249l.webp'}}","{'youtube_id': None, 'url': None, 'embed_url': None, 'images': {'image_url': None, 'small_image_url': None, 'medium_image_url': None, 'large_image_url': None, 'maximum_image_url': None}}","""Bakugan Battle Brawlers: New Vestroia""",Bakugan: New Vestroia,爆丸バトルブローラーズ New Vestroia,[],TV,Original,52.0,Finished Airing,False,"{'from': '2010-03-02T00:00:00+00:00', 'to': '2011-03-05T00:00:00+00:00', 'prop': {'from': {'day': 2, 'month': 3, 'year': 2010}, 'to': {'day': 5, 'month': 3, 'year': 2011}}, 'string': 'Mar 2, 2010 to Mar 5, 2011'}",24 min per ep,PG - Children,6.48,35377.0,6285,2387,57547,162,"After the final downfall of the rogue Bakugan Naga, peace was brought back to Vestroia. With the help of Danma Kuusou, his companion Pyrus Dragonoid, and other Battle Brawlers, the Infinity and Silent Cores were combined and the realm was recreated. However, New Vestroia will not be given any respite as humanoid alien invaders, the Vestals, arrive and conquer the Bakugan world in one fell swoop. Armed with a fearsome machine capable of restricting Bakugan into their ball forms, they aim to enslave the race as a form of entertainment. Now, the only force standing in their way is the Bakugan Battle Brawlers Resistance—a group of humans, Bakugan, and Vestals who oppose the idea of annihilating a sentient race. Led by Danma, they must venture into enemy-occupied New Vestroia and repel the invaders, to assure the survival of the entire world. [Written by MAL Rewrite]",,spring,2010,"{'day': None, 'time': None, 'timezone': None, 'string': 'Unknown'}","[{'mal_id': 215, 'type': 'anime', 'name': 'Nelvana', 'url': 'https://myanimelist.net/anime/producer/215/Nelvana'}]",[],"[{'mal_id': 73, 'type': 'anime', 'name': 'TMS Entertainment', 'url': 'https://myanimelist.net/anime/producer/73/TMS_Entertainment'}]","[{'mal_id': 2, 'type': 'anime', 'name': 'Adventure', 'url': 'https://myanimelist.net/anime/genre/2/Adventure'}, {'mal_id': 10, 'type': 'anime', 'name': 'Fantasy', 'url': 'https://myanimelist.net/anime/genre/10/Fantasy'}]",[],"[{'mal_id': 11, 'type': 'anime', 'name': 'Game', 'url': 'https://myanimelist.net/anime/genre/11/Game'}]","[{'mal_id': 27, 'type': 'anime', 'name': 'Shounen', 'url': 'https://myanimelist.net/anime/genre/27/Shounen'}]"
7655,https://myanimelist.net/anime/7655/Major_S6,"{'jpg': {'image_url': 'https://cdn.myanimelist.net/images/anime/2/75216.jpg', 'small_image_url': 'https://cdn.myanimelist.net/images/anime/2/75216t.jpg', 'large_image_url': 'https://cdn.myanimelist.net/images/anime/2/75216l.jpg'}, 'webp': {'image_url': 'https://cdn.myanimelist.net/images/anime/2/75216.webp', 'small_image_url': 'https://cdn.myanimelist.net/images/anime/2/75216t.webp', 'large_image_url': 'https://cdn.myanimelist.net/images/anime/2/75216l.webp'}}","{'youtube_id': 'F07zIMLLya8', 'url': 'https://www.youtube.com/watch?v=F07zIMLLya8', 'embed_url': 'https://www.youtube.com/embed/F07zIMLLya8?enablejsapi=1&wmode=opaque&autoplay=1', 'images': {'image_url': 'https://img.youtube.com/vi/F07zIMLLya8/default.jpg', 'small_image_url': 'https://img.youtube.com/vi/F07zIMLLya8/sddefault.jpg', 'medium_image_url': 'https://img.youtube.com/vi/F07zIMLLya8/mqdefault.jpg', 'large_image_url': 'https://img.youtube.com/vi/F07zIMLLya8/hqdefault.jpg', 'maximum_image_url': 'https://img.youtube.com/vi/F07zIMLLya8/maxresdefault.jpg'}}","""Major S6""",,メジャー 第6シリーズ,['Major 6th Season'],TV,Manga,25.0,Finished Airing,False,"{'from': '2010-04-03T00:00:00+00:00', 'to': '2010-09-25T00:00:00+00:00', 'prop': {'from': {'day': 3, 'month': 4, 'year': 2010}, 'to': {'day': 25, 'month': 9, 'year': 2010}}, 'string': 'Apr 3, 2010 to Sep 25, 2010'}",24 min per ep,PG-13 - Teens 13 or older,8.34,32844.0,202,2415,56520,443,"The intense Baseball World Cup has reached its conclusion. Gorou Honda has regained his passion for baseball and is once again back in full gear. He has secured a team position with the Hornets and has travelled back to America to prepare for his spectacular debut as a Major League pitcher. However, Gorou encounters a sudden series of unexpected issues and devastating events follow, crushing his motivation and potentially reducing the baseball career that he has worked tirelessly to maintain into crumbs. In the final season of Major, Gorou must yet again overcome immense hardship in order to save his baseball career. This time there is no simple solution, as the problem is deeply rooted within his own mind... [Written by MAL Rewrite]",,spring,2010,"{'day': None, 'time': None, 'timezone': None, 'string': 'Unknown'}","[{'mal_id': 111, 'type': 'anime', 'name': 'NHK', 'url': 'https://myanimelist.net/anime/producer/111/NHK'}]",[],"[{'mal_id': 118, 'type': 'anime', 'name': 'SynergySP', 'url': 'https://myanimelist.net/anime/producer/118/SynergySP'}]","[{'mal_id': 4, 'type': 'anime', 'name': 'Comedy', 'url': 'https://myanimelist.net/anime/genre/4/Comedy'}, {'mal_id': 8, 'type': 'anime', 'name': 'Drama', 'url': 'https://myanimelist.net/anime/genre/8/Drama'}, {'mal_id': 30, 'type': 'anime', 'name': 'Sports', 'url': 'https://myanimelist.net/anime/genre/30/Sports'}]",[],[],"[{'mal_id': 27, 'type': 'anime', 'name': 'Shounen', 'url': 'https://myanimelist.net/anime/genre/27/Shounen'}]"
7580,https://myanimelist.net/anime/7580/Ikkitousen__Xtreme_Xecutor,"{'jpg': {'image_url': 'https://cdn.myanimelist.net/images/anime/2/18209.jpg', 'small_image_url': 'https://cdn.myanimelist.net/images/anime/2/18209t.jpg', 'large_image_url': 'https://cdn.myanimelist.net/images/anime/2/18209l.jpg'}, 'webp': {'image_url': 'https://cdn.myanimelist.net/images/anime/2/18209.webp', 'small_image_url': 'https://cdn.myanimelist.net/images/anime/2/18209t.webp', 'large_image_url': 'https://cdn.myanimelist.net/images/anime/2/18209l.webp'}}","{'youtube_id': None, 'url': None, 'embed_url': None, 'images': {'image_url': None, 'small_image_url': None, 'medium_image_url': None, 'large_image_url': None, 'maximum_image_url': None}}","""Ikkitousen: Xtreme Xecutor""",,一騎当千 Xtreme Xecutor,"['Ikkitousen XX', 'Ikki Tousen Extreme Executor']",TV,Manga,12.0,Finished Airing,False,"{'from': '2010-03-26T00:00:00+00:00', 'to': '2010-06-11T00:00:00+00:00', 'prop': {'from': {'day': 26, 'month': 3, 'year': 2010}, 'to': {'day': 11, 'month': 6, 'year': 2010}}, 'string': 'Mar 26, 2010 to Jun 11, 2010'}",24 min per ep,R+ - Mild Nudity,6.75,18019.0,4894,2706,45267,36,"Life gets crazy for Hakufu when she takes on a pupil that acts just like her! A tournament between the school heads start, but due to Hakufu's negligence, her pupil ends up taking her place. The tournament isn't what it seems, and the girls find themselves in the middle of a plot to take over the clans. (Source: FUNimation)",,spring,2010,"{'day': None, 'time': None, 'timezone': None, 'string': 'Unknown'}","[{'mal_id': 79, 'type': 'anime', 'name': 'Genco', 'url': 'https://myanimelist.net/anime/producer/79/Genco'}]","[{'mal_id': 102, 'type': 'anime', 'name': 'Funimation', 'url': 'https://myanimelist.net/anime/producer/102/Funimation'}]","[{'mal_id': 38, 'type': 'anime', 'name': 'Arms', 'url': 'https://myanimelist.net/anime/producer/38/Arms'}, {'mal_id': 120, 'type': 'anime', 'name': 'TNK', 'url': 'https://myanimelist.net/anime/producer/120/TNK'}]","[{'mal_id': 1, 'type': 'anime', 'name': 'Action', 'url': 'https://myanimelist.net/anime/genre/1/Action'}, {'mal_id': 9, 'type': 'anime', 'name': 'Ecchi', 'url': 'https://myanimelist.net/anime/genre/9/Ecchi'}]",[],"[{'mal_id': 17, 'type': 'anime', 'name': 'Martial Arts', 'url': 'https://myanimelist.net/anime/genre/17/Martial_Arts'}, {'mal_id': 23, 'type': 'anime', 'name': 'School', 'url': 'https://myanimelist.net/anime/genre/23/School'}, {'mal_id': 31, 'type': 'anime', 'name': 'Super Power', 'url': 'https://myanimelist.net/anime/genre/31/Super_Power'}]",[]
6973,https://myanimelist.net/anime/6973/Senkou_no_Night_Raid,"{'jpg': {'image_url': 'https://cdn.myanimelist.net/images/anime/7/24229.jpg', 'small_image_url': 'https://cdn.myanimelist.net/images/anime/7/24229t.jpg', 'large_image_url': 'https://cdn.myanimelist.net/images/anime/7/24229l.jpg'}, 'webp': {'image_url': 'https://cdn.myanimelist.net/images/anime/7/24229.webp', 'small_image_url': 'https://cdn.myanimelist.net/images/anime/7/24229t.webp', 'large_image_url': 'https://cdn.myanimelist.net/images/anime/7/24229l.webp'}}","{'youtube_id': None, 'url': None, 'embed_url': None, 'images': {'image_url': None, 'small_image_url': None, 'medium_image_url': None, 'large_image_url': None, 'maximum_image_url': None}}","""Senkou no Night Raid""",Night Raid 1931,閃光のナイトレイド,[],TV,Original,13.0,Finished Airing,False,"{'from': '2010-04-06T00:00:00+00:00', 'to': '2010-06-29T00:00:00+00:00', 'prop': {'from': {'day': 6, 'month': 4, 'year': 2010}, 'to': {'day': 29, 'month': 6, 'year': 2010}}, 'string': 'Apr 6, 2010 to Jun 29, 2010'}",23 min per ep,R - 17+ (violence & profanity),6.85,10838.0,4450,2796,42311,50,"The year is 1931. The city is Shanghai. Ten years before America will enter World War II, the hydra's teeth planted by the first great global conflict are beginning to germinate. Hatching like spiders, they weave the complex web of plots and conspiracies destined to inevitably draw entire nations to the brink of destruction. Caught in the heart of these webs, desperately seeking to separate lies from truth, is ""Sakurai Kikan,"" an ultra-secret intelligence agency staffed by extraordinarily talented individuals with abilities far beyond those of normal humans. Their duty: to stop the darkest plots and eliminate the greatest threats. But in a city built on intrigue, can even a team of clairvoyants, telepaths and espers stand against the ultimate forces of destiny? (Source: Sentai Filmworks)","Alongside and , Senkou no Night Raid was part of the ""Anime no Chikara"" project, a project to create more original anime, not based on any existing media.",spring,2010,"{'day': 'Tuesdays', 'time': '01:30', 'timezone': 'Asia/Tokyo', 'string': 'Tuesdays at 01:30 (JST)'}","[{'mal_id': 16, 'type': 'anime', 'name': 'TV Tokyo', 'url': 'https://myanimelist.net/anime/producer/16/TV_Tokyo'}, {'mal_id': 17, 'type': 'anime', 'name': 'Aniplex', 'url': 'https://myanimelist.net/anime/producer/17/Aniplex'}]","[{'mal_id': 376, 'type': 'anime', 'name': 'Sentai Filmworks', 'url': 'https://myanimelist.net/anime/producer/376/Sentai_Filmworks'}]","[{'mal_id': 56, 'type': 'anime', 'name': 'A-1 Pictures', 'url': 'https://myanimelist.net/anime/producer/56/A-1_Pictures'}]","[{'mal_id': 1, 'type': 'anime', 'name': 'Action', 'url': 'https://myanimelist.net/anime/genre/1/Action'}]",[],"[{'mal_id': 13, 'type': 'anime', 'name': 'Historical', 'url': 'https://myanimelist.net/anime/genre/13/Historical'}, {'mal_id': 38, 'type': 'anime', 'name': 'Military', 'url': 'https://myanimelist.net/anime/genre/38/Military'}, {'mal_id': 31, 'type': 'anime', 'name': 'Super Power', 'url': 'https://myanimelist.net/anime/genre/31/Super_Power'}]",[]
8410,https://myanimelist.net/anime/8410/Metal_Fight_Beyblade__Baku,"{'jpg': {'image_url': 'https://cdn.myanimelist.net/images/anime/12/26363.jpg', 'small_image_url': 'https://cdn.myanimelist.net/images/anime/12/26363t.jpg', 'large_image_url': 'https://cdn.myanimelist.net/images/anime/12/26363l.jpg'}, 'webp': {'image_url': 'https://cdn.myanimelist.net/images/anime/12/26363.webp', 'small_image_url': 'https://cdn.myanimelist.net/images/anime/12/26363t.webp', 'large_image_url': 'https://cdn.myanimelist.net/images/anime/12/26363l.webp'}}","{'youtube_id': None, 'url': None, 'embed_url': None, 'images': {'image_url': None, 'small_image_url': None, 'medium_image_url': None, 'large_image_url': None, 'maximum_image_url': None}}","""Metal Fight Beyblade: Baku""",Beyblade: Metal Masters,メタルファイト ベイブレード～爆～,"['Metal Fight Beyblade: Explosion', 'Metal Fight Beyblade 2', 'Beyblade: Metal Fusion 2']",TV,Manga,51.0,Finished Airing,False,"{'from': '2010-04-04T00:00:00+00:00', 'to': '2011-03-27T00:00:00+00:00', 'prop': {'from': {'day': 4, 'month': 4, 'year': 2010}, 'to': {'day': 27, 'month': 3, 'year': 2011}}, 'string': 'Apr 4, 2010 to Mar 27, 2011'}",25 min per ep,PG - Children,6.88,27130.0,4303,2808,42267,107,"Ginga Hagane and his crew of Bladers are back and ready to take on new challenges. The World Championship beckons, and Ginga is more than prepared, now equipped with a new Beyblade, the Galaxy Pegasus W105R2F. And he will be battling with a tag-partner from the USA, Masamune Kadoya. However, Masamune has also set his eyes on the championship, and plans to defeat Gingka. Masamune may be not the only threat to Ginga's path to victory. The world's top Blader Kyoya was chosen alongside Ginga, Masamune, Tsubasa, and Yu to represent Japan, but instead decides to join the African team. Together with his teammate Benkei, he wishes to take down Ginga and the Japanese team. The stage is now set for one of the most dramatic showdowns in Metal Fight Beyblade: Baku.",,spring,2010,"{'day': None, 'time': None, 'timezone': None, 'string': 'Unknown'}",[],"[{'mal_id': 215, 'type': 'anime', 'name': 'Nelvana', 'url': 'https://myanimelist.net/anime/producer/215/Nelvana'}]","[{'mal_id': 103, 'type': 'anime', 'name': 'Tatsunoko Production', 'url': 'https://myanimelist.net/anime/producer/103/Tatsunoko_Production'}, {'mal_id': 118, 'type': 'anime', 'name': 'SynergySP', 'url': 'https://myanimelist.net/anime/producer/118/SynergySP'}]","[{'mal_id': 2, 'type': 'anime', 'name': 'Adventure', 'url': 'https://myanimelist.net/anime/genre/2/Adventure'}, {'mal_id': 4, 'type': 'anime', 'name': 'Comedy', 'url': 'https://myanimelist.net/anime/genre/4/Comedy'}, {'mal_id': 30, 'type': 'anime', 'name': 'Sports', 'url': 'https://myanimelist.net/anime/genre/30/Sports'}]",[],[],"[{'mal_id': 15, 'type': 'anime', 'name': 'Kids', 'url': 'https://myanimelist.net/anime/genre/15/Kids'}]"
