mal_id,url,images,trailer,title,title_english,title_japanese,title_synonyms,type,source,episodes,status,airing,aired,duration,rating,score,scored_by,rank,popularity,members,favorites,synopsis,background,season,year,broadcast,producers,licensors,studios,genres,explicit_genres,themes,demographics
23421,https://myanimelist.net/anime/23421/Re_␣Hamatora,"{'jpg': {'image_url': 'https://cdn.myanimelist.net/images/anime/3/75641.jpg', 'small_image_url': 'https://cdn.myanimelist.net/images/anime/3/75641t.jpg', 'large_image_url': 'https://cdn.myanimelist.net/images/anime/3/75641l.jpg'}, 'webp': {'image_url': 'https://cdn.myanimelist.net/images/anime/3/75641.webp', 'small_image_url': 'https://cdn.myanimelist.net/images/anime/3/75641t.webp', 'large_image_url': 'https://cdn.myanimelist.net/images/anime/3/75641l.webp'}}","{'youtube_id': '2wOG2K4CxsM', 'url': 'https://www.youtube.com/watch?v=2wOG2K4CxsM', 'embed_url': 'https://www.youtube.com/embed/2wOG2K4CxsM?enablejsapi=1&wmode=opaque&autoplay=1', 'images': {'image_url': 'https://img.youtube.com/vi/2wOG2K4CxsM/default.jpg', 'small_image_url': 'https://img.youtube.com/vi/2wOG2K4CxsM/sddefault.jpg', 'medium_image_url': 'https://img.youtube.com/vi/2wOG2K4CxsM/mqdefault.jpg', 'large_image_url': 'https://img.youtube.com/vi/2wOG2K4CxsM/hqdefault.jpg', 'maximum_image_url': 'https://img.youtube.com/vi/2wOG2K4CxsM/maxresdefault.jpg'}}","""Re:␣Hamatora""",Re: Hamatora: Season 2,Re:␣ ハマトラ,"['Hamatora The Animation 2nd Season', 'Reply Hamatora']",TV,Original,12,Finished Airing,False,"{'from': '2014-07-08T00:00:00+00:00', 'to': '2014-09-23T00:00:00+00:00', 'prop': {'from': {'day': 8, 'month': 7, 'year': 2014}, 'to': {'day': 23, 'month': 9, 'year': 2014}}, 'string': 'Jul 8, 2014 to Sep 23, 2014'}",24 min per ep,R - 17+ (violence & profanity),7.37,70512.0,2109,1193,155448,393,"It has been three months since the incident at Yokohama. Things have been settling down at Cafe Nowhere. Murasaki and Hajime have teamed up and started investigating again. After an unforeseen reunion, Art holds Nice at gunpoint. What are his real intentions? What will become of the connection between Art and Hamatora? (Source: Crunchyroll)",,summer,2014,"{'day': 'Tuesdays', 'time': '02:05', 'timezone': 'Asia/Tokyo', 'string': 'Tuesdays at 02:05 (JST)'}","[{'mal_id': 16, 'type': 'anime', 'name': 'TV Tokyo', 'url': 'https://myanimelist.net/anime/producer/16/TV_Tokyo'}, {'mal_id': 64, 'type': 'anime', 'name': 'Sotsu', 'url': 'https://myanimelist.net/anime/producer/64/Sotsu'}, {'mal_id': 238, 'type': 'anime', 'name': 'AT-X', 'url': 'https://myanimelist.net/anime/producer/238/AT-X'}, {'mal_id': 315, 'type': 'anime', 'name': 'DAX Production', 'url': 'https://myanimelist.net/anime/producer/315/DAX_Production'}, {'mal_id': 951, 'type': 'anime', 'name': 'NAZ', 'url': 'https://myanimelist.net/anime/producer/951/NAZ'}, {'mal_id': 1039, 'type': 'anime', 'name': 'DIVE II Entertainment', 'url': 'https://myanimelist.net/anime/producer/1039/DIVE_II_Entertainment'}, {'mal_id': 1284, 'type': 'anime', 'name': 'Avex Pictures', 'url': 'https://myanimelist.net/anime/producer/1284/Avex_Pictures'}, {'mal_id': 1287, 'type': 'anime', 'name': 'Q-Tec', 'url': 'https://myanimelist.net/anime/producer/1287/Q-Tec'}, {'mal_id': 1365, 'type': 'anime', 'name': 'Shueisha', 'url': 'https://myanimelist.net/anime/producer/1365/Shueisha'}, {'mal_id': 1390, 'type': 'anime', 'name': ""Toy's Factory"", 'url': 'https://myanimelist.net/anime/producer/1390/Toys_Factory'}]","[{'mal_id': 376, 'type': 'anime', 'name': 'Sentai Filmworks', 'url': 'https://myanimelist.net/anime/producer/376/Sentai_Filmworks'}]","[{'mal_id': 456, 'type': 'anime', 'name': 'Lerche', 'url': 'https://myanimelist.net/anime/producer/456/Lerche'}]","[{'mal_id': 4, 'type': 'anime', 'name': 'Comedy', 'url': 'https://myanimelist.net/anime/genre/4/Comedy'}, {'mal_id': 8, 'type': 'anime', 'name': 'Drama', 'url': 'https://myanimelist.net/anime/genre/8/Drama'}, {'mal_id': 7, 'type': 'anime', 'name': 'Mystery', 'url': 'https://myanimelist.net/anime/genre/7/Mystery'}]",[],"[{'mal_id': 31, 'type': 'anime', 'name': 'Super Power', 'url': 'https://myanimelist.net/anime/genre/31/Super_Power'}]",[]
23333,https://myanimelist.net/anime/23333/DRAMAtical_Murder,"{'jpg': {'image_url': 'https://cdn.myanimelist.net/images/anime/6/75642.jpg', 'small_image_url': 'https://cdn.myanimelist.net/images/anime/6/75642t.jpg', 'large_image_url': 'https://cdn.myanimelist.net/images/anime/6/75642l.jpg'}, 'webp': {'image_url': 'https://cdn.myanimelist.net/images/anime/6/75642.webp', 'small_image_url': 'https://cdn.myanimelist.net/images/anime/6/75642t.webp', 'large_image_url': 'https://cdn.myanimelist.net/images/anime/6/75642l.webp'}}","{'youtube_id': 'Hh595lgMSTQ', 'url': 'https://www.youtube.com/watch?v=Hh595lgMSTQ', 'embed_url': 'https://www.youtube.com/embed/Hh595lgMSTQ?enablejsapi=1&wmode=opaque&autoplay=1', 'images': {'image_url': 'https://img.youtube.com/vi/Hh595lgMSTQ/default.jpg', 'small_image_url': 'https://img.youtube.com/vi/Hh595lgMSTQ/sddefault.jpg', 'medium_image_url': 'https://img.youtube.com/vi/Hh595lgMSTQ/mqdefault.jpg', 'large_image_url': 'https://img.youtube.com/vi/Hh595lgMSTQ/hqdefault.jpg', 'maximum_image_url': 'https://img.youtube.com/vi/Hh595lgMSTQ/maxresdefault.jpg'}}","""DRAMAtical Murder""",DRAMAtical Murder,ドラマティカル マーダー,['DMMd'],TV,Visual novel,12,Finished Airing,False,"{'from': '2014-07-07T00:00:00+00:00', 'to': '2014-09-22T00:00:00+00:00', 'prop': {'from': {'day': 7, 'month': 7, 'year': 2014}, 'to': {'day': 22, 'month': 9, 'year': 2014}}, 'string': 'Jul 7, 2014 to Sep 22, 2014'}",24 min per ep,PG-13 - Teens 13 or older,6.06,62737.0,8403,1199,153800,562,"Some time ago, the influential and powerful Toue Inc. bought the island of Midorijima, Japan, with the plans of building Platinum Jail—a luxurious utopian facility. Those who are lucky enough to call it home are the wealthiest citizens in the world. The original residents of the island, however, were forced to relocate to the Old Residential District; and after the completion of Platinum Jail, they were completely abandoned. ""Rib"" and ""Rhyme"" are the most common games played on the island. Rib is an old school game in which gangs engage in turf wars against each other, while Rhyme is a technologically advanced game wherein participants fight in a virtual reality. To be able to play Rhyme, you must have an ""All-Mate"" (an AI that typically looks like a pet), and the match must be mediated by an ""Usui."" Aoba Seragaki has no interest in playing either game; he prefers to live a peaceful life with his grandmother and All-Mate, Ren. However, after getting forcefully dragged into a dangerous Rhyme match and hearing rumors about disappearing Rib players, all of Aoba's hopes of living a normal life are completely abolished. [Written by MAL Rewrite]",,summer,2014,"{'day': None, 'time': None, 'timezone': None, 'string': 'Unknown'}","[{'mal_id': 52, 'type': 'anime', 'name': 'Avex Entertainment', 'url': 'https://myanimelist.net/anime/producer/52/Avex_Entertainment'}, {'mal_id': 459, 'type': 'anime', 'name': 'Nitroplus', 'url': 'https://myanimelist.net/anime/producer/459/Nitroplus'}, {'mal_id': 1039, 'type': 'anime', 'name': 'DIVE II Entertainment', 'url': 'https://myanimelist.net/anime/producer/1039/DIVE_II_Entertainment'}]","[{'mal_id': 376, 'type': 'anime', 'name': 'Sentai Filmworks', 'url': 'https://myanimelist.net/anime/producer/376/Sentai_Filmworks'}]","[{'mal_id': 951, 'type': 'anime', 'name': 'NAZ', 'url': 'https://myanimelist.net/anime/producer/951/NAZ'}]","[{'mal_id': 1, 'type': 'anime', 'name': 'Action', 'url': 'https://myanimelist.net/anime/genre/1/Action'}, {'mal_id': 24, 'type': 'anime', 'name': 'Sci-Fi', 'url': 'https://myanimelist.net/anime/genre/24/Sci-Fi'}]",[],"[{'mal_id': 40, 'type': 'anime', 'name': 'Psychological', 'url': 'https://myanimelist.net/anime/genre/40/Psychological'}, {'mal_id': 31, 'type': 'anime', 'name': 'Super Power', 'url': 'https://myanimelist.net/anime/genre/31/Super_Power'}]",[]
23327,https://myanimelist.net/anime/23327/Space☆Dandy_2nd_Season,"{'jpg': {'image_url': 'https://cdn.myanimelist.net/images/anime/3/64451.jpg', 'small_image_url': 'https://cdn.myanimelist.net/images/anime/3/64451t.jpg', 'large_image_url': 'https://cdn.myanimelist.net/images/anime/3/64451l.jpg'}, 'webp': {'image_url': 'https://cdn.myanimelist.net/images/anime/3/64451.webp', 'small_image_url': 'https://cdn.myanimelist.net/images/anime/3/64451t.webp', 'large_image_url': 'https://cdn.myanimelist.net/images/anime/3/64451l.webp'}}","{'youtube_id': 'xVde2A6zqUg', 'url': 'https://www.youtube.com/watch?v=xVde2A6zqUg', 'embed_url': 'https://www.youtube.com/embed/xVde2A6zqUg?enablejsapi=1&wmode=opaque&autoplay=1', 'images': {'image_url': 'https://img.youtube.com/vi/xVde2A6zqUg/default.jpg', 'small_image_url': 'https://img.youtube.com/vi/xVde2A6zqUg/sddefault.jpg', 'medium_image_url': 'https://img.youtube.com/vi/xVde2A6zqUg/mqdefault.jpg', 'large_image_url': 'https://img.youtube.com/vi/xVde2A6zqUg/hqdefault.jpg', 'maximum_image_url': 'https://img.youtube.com/vi/xVde2A6zqUg/maxresdefault.jpg'}}","""Space☆Dandy 2nd Season""",Space Dandy 2nd Season,スペース☆ダンディ 第2シリーズ,['Space☆Dandy Second Season'],TV,Original,13,Finished Airing,False,"{'from': '2014-07-06T00:00:00+00:00', 'to': '2014-09-25T00:00:00+00:00', 'prop': {'from': {'day': 6, 'month': 7, 'year': 2014}, 'to': {'day': 25, 'month': 9, 'year': 2014}}, 'string': 'Jul 6, 2014 to Sep 25, 2014'}",24 min per ep,PG-13 - Teens 13 or older,8.26,77072.0,260,1243,148037,1641,"Second season of Space Dandy. Space Dandy is a dandy guy, in space! This dreamy adventurer with a to-die-for pompadour travels across the galaxy in search of aliens no one has ever laid eyes on. Each new species he discovers earns him a hefty reward, but this dandy has to be quick on his feet because it's first come, first served! Accompanied by his sidekicks, a rundown robot named QT and Meow the cat-looking space alien, Dandy bravely explores unknown worlds inhabited by a variety of aliens. Join the best dressed alien hunter in all of space and time as he embarks on an adventure that ends at the edge of the universe! (Source: Bandai Visual)",,summer,2014,"{'day': None, 'time': None, 'timezone': None, 'string': 'Unknown'}","[{'mal_id': 23, 'type': 'anime', 'name': 'Bandai Visual', 'url': 'https://myanimelist.net/anime/producer/23/Bandai_Visual'}, {'mal_id': 464, 'type': 'anime', 'name': 'flying DOG', 'url': 'https://myanimelist.net/anime/producer/464/flying_DOG'}, {'mal_id': 1233, 'type': 'anime', 'name': 'Bandai Namco Entertainment', 'url': 'https://myanimelist.net/anime/producer/1233/Bandai_Namco_Entertainment'}]","[{'mal_id': 102, 'type': 'anime', 'name': 'Funimation', 'url': 'https://myanimelist.net/anime/producer/102/Funimation'}]","[{'mal_id': 4, 'type': 'anime', 'name': 'Bones', 'url': 'https://myanimelist.net/anime/producer/4/Bones'}]","[{'mal_id': 4, 'type': 'anime', 'name': 'Comedy', 'url': 'https://myanimelist.net/anime/genre/4/Comedy'}, {'mal_id': 24, 'type': 'anime', 'name': 'Sci-Fi', 'url': 'https://myanimelist.net/anime/genre/24/Sci-Fi'}]",[],"[{'mal_id': 29, 'type': 'anime', 'name': 'Space', 'url': 'https://myanimelist.net/anime/genre/29/Space'}]",[]
20509,https://myanimelist.net/anime/20509/Fate_kaleid_liner_Prisma☆Illya_2wei,"{'jpg': {'image_url': 'https://cdn.myanimelist.net/images/anime/12/64175.jpg', 'small_image_url': 'https://cdn.myanimelist.net/images/anime/12/64175t.jpg', 'large_image_url': 'https://cdn.myanimelist.net/images/anime/12/64175l.jpg'}, 'webp': {'image_url': 'https://cdn.myanimelist.net/images/anime/12/64175.webp', 'small_image_url': 'https://cdn.myanimelist.net/images/anime/12/64175t.webp', 'large_image_url': 'https://cdn.myanimelist.net/images/anime/12/64175l.webp'}}","{'youtube_id': 'DgDPgDzgC3s', 'url': 'https://www.youtube.com/watch?v=DgDPgDzgC3s', 'embed_url': 'https://www.youtube.com/embed/DgDPgDzgC3s?enablejsapi=1&wmode=opaque&autoplay=1', 'images': {'image_url': 'https://img.youtube.com/vi/DgDPgDzgC3s/default.jpg', 'small_image_url': 'https://img.youtube.com/vi/DgDPgDzgC3s/sddefault.jpg', 'medium_image_url': 'https://img.youtube.com/vi/DgDPgDzgC3s/mqdefault.jpg', 'large_image_url': 'https://img.youtube.com/vi/DgDPgDzgC3s/hqdefault.jpg', 'maximum_image_url': 'https://img.youtube.com/vi/DgDPgDzgC3s/maxresdefault.jpg'}}","""Fate/kaleid liner Prisma☆Illya 2wei!""",Fate/Kaleid Liner Prisma Illya 2Wei!,Fate/kaleid liner プリズマ☆イリヤ ツヴァイ!,"['Prisma Illya 2wei!', 'Prisma☆Illya 2nd Season']",TV,Manga,10,Finished Airing,False,"{'from': '2014-07-10T00:00:00+00:00', 'to': '2014-09-11T00:00:00+00:00', 'prop': {'from': {'day': 10, 'month': 7, 'year': 2014}, 'to': {'day': 11, 'month': 9, 'year': 2014}}, 'string': 'Jul 10, 2014 to Sep 11, 2014'}",23 min per ep,PG-13 - Teens 13 or older,7.25,75623.0,2664,1268,143690,248,"Another lovely summer goes by for Illyasviel von Einzbern. Taking a break from her magical girl duties, she enjoys her time off after collecting the Class Cards with her best friend Miyu Edelfelt. However, her break comes to an abrupt end when she and Miyu are abducted by Rin Toosaka and Luviagelita Edelfelt, while out with her friends. The magical girls learn that their work is far from over, as Clock Tower informs them that the out of control mana thought to have been sealed continues to be dispersing throughout Fuyuki City. After heading to the origin point of the out of control mana, Illya and Miyu are tasked with solving the anomaly. But after casting their spell, Illyasviel discovers that she's split into two people! As this mysterious new form darts off, she can only wonder: what is to come from the existence of her dopplegänger, running amok in the unsuspecting town? [Written by MAL Rewrite]",,summer,2014,"{'day': 'Thursdays', 'time': '01:35', 'timezone': 'Asia/Tokyo', 'string': 'Thursdays at 01:35 (JST)'}","[{'mal_id': 104, 'type': 'anime', 'name': 'Lantis', 'url': 'https://myanimelist.net/anime/producer/104/Lantis'}, {'mal_id': 113, 'type': 'anime', 'name': 'Kadokawa Shoten', 'url': 'https://myanimelist.net/anime/producer/113/Kadokawa_Shoten'}, {'mal_id': 238, 'type': 'anime', 'name': 'AT-X', 'url': 'https://myanimelist.net/anime/producer/238/AT-X'}, {'mal_id': 315, 'type': 'anime', 'name': 'DAX Production', 'url': 'https://myanimelist.net/anime/producer/315/DAX_Production'}, {'mal_id': 460, 'type': 'anime', 'name': 'KlockWorx', 'url': 'https://myanimelist.net/anime/producer/460/KlockWorx'}, {'mal_id': 1211, 'type': 'anime', 'name': 'Tokyo MX', 'url': 'https://myanimelist.net/anime/producer/1211/Tokyo_MX'}, {'mal_id': 1551, 'type': 'anime', 'name': 'Kadokawa Media House', 'url': 'https://myanimelist.net/anime/producer/1551/Kadokawa_Media_House'}]","[{'mal_id': 376, 'type': 'anime', 'name': 'Sentai Filmworks', 'url': 'https://myanimelist.net/anime/producer/376/Sentai_Filmworks'}]","[{'mal_id': 300, 'type': 'anime', 'name': 'SILVER LINK.', 'url': 'https://myanimelist.net/anime/producer/300/SILVER_LINK'}]","[{'mal_id': 1, 'type': 'anime', 'name': 'Action', 'url': 'https://myanimelist.net/anime/genre/1/Action'}, {'mal_id': 4, 'type': 'anime', 'name': 'Comedy', 'url': 'https://myanimelist.net/anime/genre/4/Comedy'}, {'mal_id': 10, 'type': 'anime', 'name': 'Fantasy', 'url': 'https://myanimelist.net/anime/genre/10/Fantasy'}]",[],[],[]
20709,https://myanimelist.net/anime/20709/Sabage-bu,"{'jpg': {'image_url': 'https://cdn.myanimelist.net/images/anime/1278/98837.jpg', 'small_image_url': 'https://cdn.myanimelist.net/images/anime/1278/98837t.jpg', 'large_image_url': 'https://cdn.myanimelist.net/images/anime/1278/98837l.jpg'}, 'webp': {'image_url': 'https://cdn.myanimelist.net/images/anime/1278/98837.webp', 'small_image_url': 'https://cdn.myanimelist.net/images/anime/1278/98837t.webp', 'large_image_url': 'https://cdn.myanimelist.net/images/anime/1278/98837l.webp'}}","{'youtube_id': 'Wf8KtD5Q4dg', 'url': 'https://www.youtube.com/watch?v=Wf8KtD5Q4dg', 'embed_url': 'https://www.youtube.com/embed/Wf8KtD5Q4dg?enablejsapi=1&wmode=opaque&autoplay=1', 'images': {'image_url': 'https://img.youtube.com/vi/Wf8KtD5Q4dg/default.jpg', 'small_image_url': 'https://img.youtube.com/vi/Wf8KtD5Q4dg/sddefault.jpg', 'medium_image_url': 'https://img.youtube.com/vi/Wf8KtD5Q4dg/mqdefault.jpg', 'large_image_url': 'https://img.youtube.com/vi/Wf8KtD5Q4dg/hqdefault.jpg', 'maximum_image_url': 'https://img.youtube.com/vi/Wf8KtD5Q4dg/maxresdefault.jpg'}}","""Sabage-bu!""",Sabagebu! -Survival Game Club!-,さばげぶっ!,['Survival Game Club!'],TV,Manga,12,Finished Airing,False,"{'from': '2014-07-06T00:00:00+00:00', 'to': '2014-09-21T00:00:00+00:00', 'prop': {'from': {'day': 6, 'month': 7, 'year': 2014}, 'to': {'day': 21, 'month': 9, 'year': 2014}}, 'string': 'Jul 6, 2014 to Sep 21, 2014'}",23 min per ep,PG-13 - Teens 13 or older,7.36,50129.0,2132,1292,140724,508,"Draw your weapons and take aim, because Sabagebu! is coming at you! Momoka Sonokawa was just minding her own business on the train one day when she encountered a pervert. Before she could do anything about it, a girl named Miou appears, brandishing two pistols and and scaring him off, only to be arrested herself a few minutes later for possessing firearms. Later Momoka sees this same girl at her school and follows her to a run down building. It turns out Miou is the president of the school's Survival Game Club, and it doesn't take long for Miou to capture Momoka and force her into joining them. Over the course of the series, Momoka and her new “friends” will take part in multiple battles against enemies from other schools, a rival from the same school who wants to see the club shut down and even each other (on multiple occasions). With friends and classmates like these, will Momoka even make it to graduation?","Episode 1 was streamed in advance on June 28, 2014 on Nico Nico Douga. Regular TV broadcasting began on July 6, 2014.",summer,2014,"{'day': None, 'time': None, 'timezone': None, 'string': 'Unknown'}","[{'mal_id': 23, 'type': 'anime', 'name': 'Bandai Visual', 'url': 'https://myanimelist.net/anime/producer/23/Bandai_Visual'}, {'mal_id': 104, 'type': 'anime', 'name': 'Lantis', 'url': 'https://myanimelist.net/anime/producer/104/Lantis'}, {'mal_id': 159, 'type': 'anime', 'name': 'Kodansha', 'url': 'https://myanimelist.net/anime/producer/159/Kodansha'}, {'mal_id': 1121, 'type': 'anime', 'name': 'Banpresto', 'url': 'https://myanimelist.net/anime/producer/1121/Banpresto'}, {'mal_id': 1589, 'type': 'anime', 'name': 'NichiNare', 'url': 'https://myanimelist.net/anime/producer/1589/NichiNare'}]","[{'mal_id': 376, 'type': 'anime', 'name': 'Sentai Filmworks', 'url': 'https://myanimelist.net/anime/producer/376/Sentai_Filmworks'}]","[{'mal_id': 1129, 'type': 'anime', 'name': 'Pierrot Plus', 'url': 'https://myanimelist.net/anime/producer/1129/Pierrot_Plus'}]","[{'mal_id': 1, 'type': 'anime', 'name': 'Action', 'url': 'https://myanimelist.net/anime/genre/1/Action'}, {'mal_id': 4, 'type': 'anime', 'name': 'Comedy', 'url': 'https://myanimelist.net/anime/genre/4/Comedy'}]",[],[],"[{'mal_id': 25, 'type': 'anime', 'name': 'Shoujo', 'url': 'https://myanimelist.net/anime/genre/25/Shoujo'}]"
22835,https://myanimelist.net/anime/22835/Himegoto,"{'jpg': {'image_url': 'https://cdn.myanimelist.net/images/anime/8/75226.jpg', 'small_image_url': 'https://cdn.myanimelist.net/images/anime/8/75226t.jpg', 'large_image_url': 'https://cdn.myanimelist.net/images/anime/8/75226l.jpg'}, 'webp': {'image_url': 'https://cdn.myanimelist.net/images/anime/8/75226.webp', 'small_image_url': 'https://cdn.myanimelist.net/images/anime/8/75226t.webp', 'large_image_url': 'https://cdn.myanimelist.net/images/anime/8/75226l.webp'}}","{'youtube_id': 'LmGILOCr06g', 'url': 'https://www.youtube.com/watch?v=LmGILOCr06g', 'embed_url': 'https://www.youtube.com/embed/LmGILOCr06g?enablejsapi=1&wmode=opaque&autoplay=1', 'images': {'image_url': 'https://img.youtube.com/vi/LmGILOCr06g/default.jpg', 'small_image_url': 'https://img.youtube.com/vi/LmGILOCr06g/sddefault.jpg', 'medium_image_url': 'https://img.youtube.com/vi/LmGILOCr06g/mqdefault.jpg', 'large_image_url': 'https://img.youtube.com/vi/LmGILOCr06g/hqdefault.jpg', 'maximum_image_url': 'https://img.youtube.com/vi/LmGILOCr06g/maxresdefault.jpg'}}","""Himegoto""",,ひめゴト,['Secret Princess Himegoto'],TV,4-koma manga,13,Finished Airing,False,"{'from': '2014-07-07T00:00:00+00:00', 'to': '2014-09-29T00:00:00+00:00', 'prop': {'from': {'day': 7, 'month': 7, 'year': 2014}, 'to': {'day': 29, 'month': 9, 'year': 2014}}, 'string': 'Jul 7, 2014 to Sep 29, 2014'}",4 min per ep,PG-13 - Teens 13 or older,5.92,51179.0,9038,1546,110408,292,"Constantly on the run from loan sharks, Hime Arikawa has to deal with the debt left over from his parents' lousy spending habits, which they left under his name. Fleeing in a maid outfit forced upon him by the moneylenders, he is found and rescued by Shimoshina High School's student council, who pay the debt in full. However, now indebted to the student council for saving him, they not only make Hime transfer schools, but also make him a part of the student council as their servant! Forced to cross-dress for the rest of his high school years, Hime has no other option but to obey the demands of the girls in the student council. As he is harassed both mentally and physically, he must overcome his somewhat perverted classmates and join forces with other crossdressers throughout the school. [Written by MAL Rewrite]","Himegoto was released on Blu-ray on November 26, 2014 in Japan. Prior to and during the series' broadcast, the anime was promoted through an internet radio show hosted by I My Me Mine and produced by Japanese internet radio station Onsen. Titled Shimoshina Seitokai no Himegoto Radio, it was broadcasted from April 16, 2014 to September 24, 2014. The show was also released on six compilation CDs and DVDs from July 1, 2014 to October 18, 2014.",summer,2014,"{'day': None, 'time': None, 'timezone': None, 'string': 'Unknown'}",[],[],"[{'mal_id': 406, 'type': 'anime', 'name': 'Asahi Production', 'url': 'https://myanimelist.net/anime/producer/406/Asahi_Production'}]","[{'mal_id': 4, 'type': 'anime', 'name': 'Comedy', 'url': 'https://myanimelist.net/anime/genre/4/Comedy'}, {'mal_id': 36, 'type': 'anime', 'name': 'Slice of Life', 'url': 'https://myanimelist.net/anime/genre/36/Slice_of_Life'}, {'mal_id': 9, 'type': 'anime', 'name': 'Ecchi', 'url': 'https://myanimelist.net/anime/genre/9/Ecchi'}]",[],"[{'mal_id': 23, 'type': 'anime', 'name': 'School', 'url': 'https://myanimelist.net/anime/genre/23/School'}]",[]
