mal_id,url,images,trailer,title,title_english,title_japanese,title_synonyms,type,source,episodes,status,airing,aired,duration,rating,score,scored_by,rank,popularity,members,favorites,synopsis,background,season,year,broadcast,producers,licensors,studios,genres,explicit_genres,themes,demographics
22877,https://myanimelist.net/anime/22877/Seireitsukai_no_Blade_Dance,"{'jpg': {'image_url': 'https://cdn.myanimelist.net/images/anime/7/63031.jpg', 'small_image_url': 'https://cdn.myanimelist.net/images/anime/7/63031t.jpg', 'large_image_url': 'https://cdn.myanimelist.net/images/anime/7/63031l.jpg'}, 'webp': {'image_url': 'https://cdn.myanimelist.net/images/anime/7/63031.webp', 'small_image_url': 'https://cdn.myanimelist.net/images/anime/7/63031t.webp', 'large_image_url': 'https://cdn.myanimelist.net/images/anime/7/63031l.webp'}}","{'youtube_id': 'oHxzueWeo1E', 'url': 'https://www.youtube.com/watch?v=oHxzueWeo1E', 'embed_url': 'https://www.youtube.com/embed/oHxzueWeo1E?enablejsapi=1&wmode=opaque&autoplay=1', 'images': {'image_url': 'https://img.youtube.com/vi/oHxzueWeo1E/default.jpg', 'small_image_url': 'https://img.youtube.com/vi/oHxzueWeo1E/sddefault.jpg', 'medium_image_url': 'https://img.youtube.com/vi/oHxzueWeo1E/mqdefault.jpg', 'large_image_url': 'https://img.youtube.com/vi/oHxzueWeo1E/hqdefault.jpg', 'maximum_image_url': 'https://img.youtube.com/vi/oHxzueWeo1E/maxresdefault.jpg'}}","""Seireitsukai no Blade Dance""",Blade Dance of the Elementalers,精霊使いの剣舞〈ブレイドダンス〉,"['Seirei Tsukai no Kenbu', 'Bladedance of Elementalers']",TV,Light novel,12,Finished Airing,False,"{'from': '2014-07-14T00:00:00+00:00', 'to': '2014-09-29T00:00:00+00:00', 'prop': {'from': {'day': 14, 'month': 7, 'year': 2014}, 'to': {'day': 29, 'month': 9, 'year': 2014}}, 'string': 'Jul 14, 2014 to Sep 29, 2014'}",23 min per ep,PG-13 - Teens 13 or older,6.74,166040.0,4938,548,325551,856,"On his way to Areishia Spirit Academy, Kamito Kazehaya runs into a naked Claire Rouge, a student who had been bathing as part of a purification ceremony. She had been preparing to form a contract with a powerful spirit in order to acquire more power as an ""elementalist."" Her efforts are wasted, however, when Kamito ends up with the spirit despite the fact that only shrine maidens can become elementalists. Yet to be discouraged, Claire then announces that Kamito must become her contracted spirit instead! After reaching the school grounds, Kamito escapes from Claire and meets Headmaster Greyworth Ciel Mais, who invites him to enroll at the academy. Although his life at Areishia will be far from easy as the only male student among the shrine princesses-in-training, he begrudgingly accepts in exchange for information about his former contracted spirit, Restia Ashdoll. Adding on to that, he also must fulfill Greyworth's main request: to win in the Blade Dance, a battle festival occurring in two months, where he will face the strongest elementalist rumored to be contracted with a darkness spirit. [Written by MAL Rewrite]","Seireitsukai no Blade Dance was streamed by Crunchyroll at the same time when it first premiered, and Sentai Filmworks licensed the series in July 2014.",summer,2014,"{'day': 'Mondays', 'time': '20:30', 'timezone': 'Asia/Tokyo', 'string': 'Mondays at 20:30 (JST)'}","[{'mal_id': 79, 'type': 'anime', 'name': 'Genco', 'url': 'https://myanimelist.net/anime/producer/79/Genco'}, {'mal_id': 108, 'type': 'anime', 'name': 'Media Factory', 'url': 'https://myanimelist.net/anime/producer/108/Media_Factory'}, {'mal_id': 166, 'type': 'anime', 'name': 'Movic', 'url': 'https://myanimelist.net/anime/producer/166/Movic'}, {'mal_id': 238, 'type': 'anime', 'name': 'AT-X', 'url': 'https://myanimelist.net/anime/producer/238/AT-X'}, {'mal_id': 777, 'type': 'anime', 'name': 'Showgate', 'url': 'https://myanimelist.net/anime/producer/777/Showgate'}]","[{'mal_id': 376, 'type': 'anime', 'name': 'Sentai Filmworks', 'url': 'https://myanimelist.net/anime/producer/376/Sentai_Filmworks'}]","[{'mal_id': 120, 'type': 'anime', 'name': 'TNK', 'url': 'https://myanimelist.net/anime/producer/120/TNK'}]","[{'mal_id': 1, 'type': 'anime', 'name': 'Action', 'url': 'https://myanimelist.net/anime/genre/1/Action'}, {'mal_id': 4, 'type': 'anime', 'name': 'Comedy', 'url': 'https://myanimelist.net/anime/genre/4/Comedy'}, {'mal_id': 10, 'type': 'anime', 'name': 'Fantasy', 'url': 'https://myanimelist.net/anime/genre/10/Fantasy'}, {'mal_id': 22, 'type': 'anime', 'name': 'Romance', 'url': 'https://myanimelist.net/anime/genre/22/Romance'}, {'mal_id': 37, 'type': 'anime', 'name': 'Supernatural', 'url': 'https://myanimelist.net/anime/genre/37/Supernatural'}, {'mal_id': 9, 'type': 'anime', 'name': 'Ecchi', 'url': 'https://myanimelist.net/anime/genre/9/Ecchi'}]",[],"[{'mal_id': 35, 'type': 'anime', 'name': 'Harem', 'url': 'https://myanimelist.net/anime/genre/35/Harem'}, {'mal_id': 23, 'type': 'anime', 'name': 'School', 'url': 'https://myanimelist.net/anime/genre/23/School'}]",[]
21105,https://myanimelist.net/anime/21105/Love_Stage,"{'jpg': {'image_url': 'https://cdn.myanimelist.net/images/anime/11/76599.jpg', 'small_image_url': 'https://cdn.myanimelist.net/images/anime/11/76599t.jpg', 'large_image_url': 'https://cdn.myanimelist.net/images/anime/11/76599l.jpg'}, 'webp': {'image_url': 'https://cdn.myanimelist.net/images/anime/11/76599.webp', 'small_image_url': 'https://cdn.myanimelist.net/images/anime/11/76599t.webp', 'large_image_url': 'https://cdn.myanimelist.net/images/anime/11/76599l.webp'}}","{'youtube_id': 'RrFOU4FYWkM', 'url': 'https://www.youtube.com/watch?v=RrFOU4FYWkM', 'embed_url': 'https://www.youtube.com/embed/RrFOU4FYWkM?enablejsapi=1&wmode=opaque&autoplay=1', 'images': {'image_url': 'https://img.youtube.com/vi/RrFOU4FYWkM/default.jpg', 'small_image_url': 'https://img.youtube.com/vi/RrFOU4FYWkM/sddefault.jpg', 'medium_image_url': 'https://img.youtube.com/vi/RrFOU4FYWkM/mqdefault.jpg', 'large_image_url': 'https://img.youtube.com/vi/RrFOU4FYWkM/hqdefault.jpg', 'maximum_image_url': 'https://img.youtube.com/vi/RrFOU4FYWkM/maxresdefault.jpg'}}","""Love Stage!!""",Love Stage!!,LOVE STAGE!!,[],TV,Manga,10,Finished Airing,False,"{'from': '2014-07-10T00:00:00+00:00', 'to': '2014-09-11T00:00:00+00:00', 'prop': {'from': {'day': 10, 'month': 7, 'year': 2014}, 'to': {'day': 11, 'month': 9, 'year': 2014}}, 'string': 'Jul 10, 2014 to Sep 11, 2014'}",23 min per ep,PG-13 - Teens 13 or older,7.24,127278.0,2739,810,230869,1536,"With an actress mother, producer father, and rockstar brother, anyone would expect Izumi Sena to eventually enter showbiz himself. However, aside from a commercial for a wedding magazine when he was a child, Izumi has never been in the spotlight; instead, he aims to become a manga artist. But a decade after the shoot, the magazine calls for a 10th anniversary ad, requesting the original child actors for the project. This reunites Izumi with Ryouma Ichijou, now a popular actor who, much to Izumi's shock, has been in love with him ever since their first meeting! However, due to Izumi's feminine appearance and unisex name, Ryouma believed the boy was a girl and continues to do so to this day. Izumi's troubles are just beginning, because even after discovering the truth, Ryouma can't seem to shake off his feelings... [Written by MAL Rewrite]","Love Stage!! covers the events of the first 15 chapters of the manga. Crunchyroll licensed Love Stage!! to be streamed in North America, Latin America, Europe and Africa.",summer,2014,"{'day': 'Thursdays', 'time': '01:05', 'timezone': 'Asia/Tokyo', 'string': 'Thursdays at 01:05 (JST)'}","[{'mal_id': 113, 'type': 'anime', 'name': 'Kadokawa Shoten', 'url': 'https://myanimelist.net/anime/producer/113/Kadokawa_Shoten'}]","[{'mal_id': 376, 'type': 'anime', 'name': 'Sentai Filmworks', 'url': 'https://myanimelist.net/anime/producer/376/Sentai_Filmworks'}]","[{'mal_id': 7, 'type': 'anime', 'name': 'J.C.Staff', 'url': 'https://myanimelist.net/anime/producer/7/JCStaff'}]","[{'mal_id': 28, 'type': 'anime', 'name': 'Boys Love', 'url': 'https://myanimelist.net/anime/genre/28/Boys_Love'}, {'mal_id': 4, 'type': 'anime', 'name': 'Comedy', 'url': 'https://myanimelist.net/anime/genre/4/Comedy'}, {'mal_id': 22, 'type': 'anime', 'name': 'Romance', 'url': 'https://myanimelist.net/anime/genre/22/Romance'}]",[],[],[]
23309,https://myanimelist.net/anime/23309/Rail_Wars,"{'jpg': {'image_url': 'https://cdn.myanimelist.net/images/anime/13/65671.jpg', 'small_image_url': 'https://cdn.myanimelist.net/images/anime/13/65671t.jpg', 'large_image_url': 'https://cdn.myanimelist.net/images/anime/13/65671l.jpg'}, 'webp': {'image_url': 'https://cdn.myanimelist.net/images/anime/13/65671.webp', 'small_image_url': 'https://cdn.myanimelist.net/images/anime/13/65671t.webp', 'large_image_url': 'https://cdn.myanimelist.net/images/anime/13/65671l.webp'}}","{'youtube_id': 'gNI1s3vYoQw', 'url': 'https://www.youtube.com/watch?v=gNI1s3vYoQw', 'embed_url': 'https://www.youtube.com/embed/gNI1s3vYoQw?enablejsapi=1&wmode=opaque&autoplay=1', 'images': {'image_url': 'https://img.youtube.com/vi/gNI1s3vYoQw/default.jpg', 'small_image_url': 'https://img.youtube.com/vi/gNI1s3vYoQw/sddefault.jpg', 'medium_image_url': 'https://img.youtube.com/vi/gNI1s3vYoQw/mqdefault.jpg', 'large_image_url': 'https://img.youtube.com/vi/gNI1s3vYoQw/hqdefault.jpg', 'maximum_image_url': 'https://img.youtube.com/vi/gNI1s3vYoQw/maxresdefault.jpg'}}","""Rail Wars!""",Rail Wars!,RAIL WARS! [レールウォーズ],[],TV,Light novel,12,Finished Airing,False,"{'from': '2014-07-04T00:00:00+00:00', 'to': '2014-09-19T00:00:00+00:00', 'prop': {'from': {'day': 4, 'month': 7, 'year': 2014}, 'to': {'day': 19, 'month': 9, 'year': 2014}}, 'string': 'Jul 4, 2014 to Sep 19, 2014'}",24 min per ep,R+ - Mild Nudity,6.4,81180.0,6684,981,190386,254,"Rail Wars! takes place in an alternate universe where the Japanese government remains in control of the nation's railway systems. Because of the stability afforded by the leadership of the government, the railway system is allowed to flourish. Naoto Takayama aspires to become an employee for Japan National Railways because of the comfortable life that it will enable him to live. In order to accomplish this he enters its training program, where students must demonstrate their knowledge of trains as well as their ability to be ready for any challenge that might arise. During this time period he will encounter other students such as the athletically gifted Aoi Sakura, the constantly hungry Sho Iwaizumi, and the human encyclopedia Haruka Komi. Together they will work towards surviving their trainee period, all the while taking on purse snatchers, bomb threats, and the looming specter of the extremist “RJ” group who wants to privatize the railway system.","From June 6, 2014 to July 6, 2014, the first episodes of Rail Wars! were streamed on Niconico. The regular TV broadcast began July 4, 2014 (July 3rd, 25:46) on TBS.",summer,2014,"{'day': None, 'time': None, 'timezone': None, 'string': 'Unknown'}","[{'mal_id': 104, 'type': 'anime', 'name': 'Lantis', 'url': 'https://myanimelist.net/anime/producer/104/Lantis'}, {'mal_id': 144, 'type': 'anime', 'name': 'Pony Canyon', 'url': 'https://myanimelist.net/anime/producer/144/Pony_Canyon'}, {'mal_id': 145, 'type': 'anime', 'name': 'TBS', 'url': 'https://myanimelist.net/anime/producer/145/TBS'}]","[{'mal_id': 376, 'type': 'anime', 'name': 'Sentai Filmworks', 'url': 'https://myanimelist.net/anime/producer/376/Sentai_Filmworks'}]","[{'mal_id': 911, 'type': 'anime', 'name': 'Passione', 'url': 'https://myanimelist.net/anime/producer/911/Passione'}]","[{'mal_id': 1, 'type': 'anime', 'name': 'Action', 'url': 'https://myanimelist.net/anime/genre/1/Action'}, {'mal_id': 9, 'type': 'anime', 'name': 'Ecchi', 'url': 'https://myanimelist.net/anime/genre/9/Ecchi'}]",[],"[{'mal_id': 35, 'type': 'anime', 'name': 'Harem', 'url': 'https://myanimelist.net/anime/genre/35/Harem'}, {'mal_id': 39, 'type': 'anime', 'name': 'Police', 'url': 'https://myanimelist.net/anime/genre/39/Police'}]",[]
22865,https://myanimelist.net/anime/22865/Rokujouma_no_Shinryakusha_TV,"{'jpg': {'image_url': 'https://cdn.myanimelist.net/images/anime/2/62655.jpg', 'small_image_url': 'https://cdn.myanimelist.net/images/anime/2/62655t.jpg', 'large_image_url': 'https://cdn.myanimelist.net/images/anime/2/62655l.jpg'}, 'webp': {'image_url': 'https://cdn.myanimelist.net/images/anime/2/62655.webp', 'small_image_url': 'https://cdn.myanimelist.net/images/anime/2/62655t.webp', 'large_image_url': 'https://cdn.myanimelist.net/images/anime/2/62655l.webp'}}","{'youtube_id': '8ZKg5HOSuF4', 'url': 'https://www.youtube.com/watch?v=8ZKg5HOSuF4', 'embed_url': 'https://www.youtube.com/embed/8ZKg5HOSuF4?enablejsapi=1&wmode=opaque&autoplay=1', 'images': {'image_url': 'https://img.youtube.com/vi/8ZKg5HOSuF4/default.jpg', 'small_image_url': 'https://img.youtube.com/vi/8ZKg5HOSuF4/sddefault.jpg', 'medium_image_url': 'https://img.youtube.com/vi/8ZKg5HOSuF4/mqdefault.jpg', 'large_image_url': 'https://img.youtube.com/vi/8ZKg5HOSuF4/hqdefault.jpg', 'maximum_image_url': 'https://img.youtube.com/vi/8ZKg5HOSuF4/maxresdefault.jpg'}}","""Rokujouma no Shinryakusha!? (TV)""",Invaders of the Rokujyoma!?,六畳間の侵略者！？,['Rokujouma no Shinryakusha!?'],TV,Light novel,12,Finished Airing,False,"{'from': '2014-07-12T00:00:00+00:00', 'to': '2014-09-27T00:00:00+00:00', 'prop': {'from': {'day': 12, 'month': 7, 'year': 2014}, 'to': {'day': 27, 'month': 9, 'year': 2014}}, 'string': 'Jul 12, 2014 to Sep 27, 2014'}",23 min per ep,PG-13 - Teens 13 or older,7.15,75514.0,3168,1131,164780,389,"After Koutarou Satomi's father is suddenly relocated for his job, the first-year high school student is faced with finding a cheap place to live by himself. Naturally, he jumps at the chance to move into Corona House's Room 106 for a mere five thousand yen a month. But while everything goes well at first, Koutarou soon gets a lot more than he bargained for after stumbling upon a mysterious cave while working his part-time job. The following night, Koutarou is visited by various seemingly mythical figures, all of whom claim ownership of the poor student's apartment. Among the invaders are Sanae Higashihongan, a ghost supposedly haunting the room, magical girl Yurika, alien princess Theiamillis Gre Fortorthe, and Kiriha Kurano, a direct descendant of the Earth People. But more importantly, each of these four girls needs Koutarou's apartment for her own reasons and won’t back down without a fight! Rokujouma no Shinryakusha!? is a comedic battle royale over a six-tatami mat apartment involving supernatural beings, romantic high school hijinks, and a deceptively cordial landlady. [Written by MAL Rewrite]",Rokujouma no Shinryakusha!? adapts the first 7 novels of Takehaya's light novel series of the same title.,summer,2014,"{'day': 'Saturdays', 'time': '01:05', 'timezone': 'Asia/Tokyo', 'string': 'Saturdays at 01:05 (JST)'}","[{'mal_id': 79, 'type': 'anime', 'name': 'Genco', 'url': 'https://myanimelist.net/anime/producer/79/Genco'}, {'mal_id': 777, 'type': 'anime', 'name': 'Showgate', 'url': 'https://myanimelist.net/anime/producer/777/Showgate'}]","[{'mal_id': 376, 'type': 'anime', 'name': 'Sentai Filmworks', 'url': 'https://myanimelist.net/anime/producer/376/Sentai_Filmworks'}]","[{'mal_id': 300, 'type': 'anime', 'name': 'SILVER LINK.', 'url': 'https://myanimelist.net/anime/producer/300/SILVER_LINK'}]","[{'mal_id': 4, 'type': 'anime', 'name': 'Comedy', 'url': 'https://myanimelist.net/anime/genre/4/Comedy'}, {'mal_id': 37, 'type': 'anime', 'name': 'Supernatural', 'url': 'https://myanimelist.net/anime/genre/37/Supernatural'}]",[],"[{'mal_id': 35, 'type': 'anime', 'name': 'Harem', 'url': 'https://myanimelist.net/anime/genre/35/Harem'}, {'mal_id': 23, 'type': 'anime', 'name': 'School', 'url': 'https://myanimelist.net/anime/genre/23/School'}]",[]
21353,https://myanimelist.net/anime/21353/Tokyo_ESP,"{'jpg': {'image_url': 'https://cdn.myanimelist.net/images/anime/10/64587.jpg', 'small_image_url': 'https://cdn.myanimelist.net/images/anime/10/64587t.jpg', 'large_image_url': 'https://cdn.myanimelist.net/images/anime/10/64587l.jpg'}, 'webp': {'image_url': 'https://cdn.myanimelist.net/images/anime/10/64587.webp', 'small_image_url': 'https://cdn.myanimelist.net/images/anime/10/64587t.webp', 'large_image_url': 'https://cdn.myanimelist.net/images/anime/10/64587l.webp'}}","{'youtube_id': 'mJlKu9ZM1N8', 'url': 'https://www.youtube.com/watch?v=mJlKu9ZM1N8', 'embed_url': 'https://www.youtube.com/embed/mJlKu9ZM1N8?enablejsapi=1&wmode=opaque&autoplay=1', 'images': {'image_url': 'https://img.youtube.com/vi/mJlKu9ZM1N8/default.jpg', 'small_image_url': 'https://img.youtube.com/vi/mJlKu9ZM1N8/sddefault.jpg', 'medium_image_url': 'https://img.youtube.com/vi/mJlKu9ZM1N8/mqdefault.jpg', 'large_image_url': 'https://img.youtube.com/vi/mJlKu9ZM1N8/hqdefault.jpg', 'maximum_image_url': 'https://img.youtube.com/vi/mJlKu9ZM1N8/maxresdefault.jpg'}}","""Tokyo ESP""",Tokyo ESP,東京ESP,[],TV,Manga,12,Finished Airing,False,"{'from': '2014-07-12T00:00:00+00:00', 'to': '2014-09-27T00:00:00+00:00', 'prop': {'from': {'day': 12, 'month': 7, 'year': 2014}, 'to': {'day': 27, 'month': 9, 'year': 2014}}, 'string': 'Jul 12, 2014 to Sep 27, 2014'}",24 min per ep,R - 17+ (violence & profanity),6.55,66296.0,5940,1162,159819,179,"Rinka Urushiba works part time as a waitress to help out her unemployed father. By all accounts, her life in Tokyo is a relatively normal one—but her sense of normalcy begins to fade when she inexplicably sees a flying penguin one day. Chasing it all the way to the top of a building, she encounters more surprises, including flying goldfish and another person—a classmate named Kyoutarou Azuma—who can also see these strange things. After Rinka passes out when a goldfish phases through her, she wakes up an esper with the ability to phase her body through solid matter. However, her newfound ability is not the only strange thing about her: when she uses her powers, her hair turns white. Deciding reluctantly to use this new gift to help the city, she becomes Tokyo's new hero, dubbed the ""White Girl."" Along with Kyoutarou, who gained the power of teleportation, Rinka begins righting the wrongs in the city while fighting other espers who have much less noble intentions. [Written by MAL Rewrite]",,summer,2014,"{'day': None, 'time': None, 'timezone': None, 'string': 'Unknown'}","[{'mal_id': 104, 'type': 'anime', 'name': 'Lantis', 'url': 'https://myanimelist.net/anime/producer/104/Lantis'}, {'mal_id': 211, 'type': 'anime', 'name': 'Rakuonsha', 'url': 'https://myanimelist.net/anime/producer/211/Rakuonsha'}, {'mal_id': 460, 'type': 'anime', 'name': 'KlockWorx', 'url': 'https://myanimelist.net/anime/producer/460/KlockWorx'}, {'mal_id': 1211, 'type': 'anime', 'name': 'Tokyo MX', 'url': 'https://myanimelist.net/anime/producer/1211/Tokyo_MX'}]","[{'mal_id': 102, 'type': 'anime', 'name': 'Funimation', 'url': 'https://myanimelist.net/anime/producer/102/Funimation'}]","[{'mal_id': 27, 'type': 'anime', 'name': 'Xebec', 'url': 'https://myanimelist.net/anime/producer/27/Xebec'}]","[{'mal_id': 1, 'type': 'anime', 'name': 'Action', 'url': 'https://myanimelist.net/anime/genre/1/Action'}, {'mal_id': 4, 'type': 'anime', 'name': 'Comedy', 'url': 'https://myanimelist.net/anime/genre/4/Comedy'}, {'mal_id': 24, 'type': 'anime', 'name': 'Sci-Fi', 'url': 'https://myanimelist.net/anime/genre/24/Sci-Fi'}, {'mal_id': 37, 'type': 'anime', 'name': 'Supernatural', 'url': 'https://myanimelist.net/anime/genre/37/Supernatural'}]",[],"[{'mal_id': 31, 'type': 'anime', 'name': 'Super Power', 'url': 'https://myanimelist.net/anime/genre/31/Super_Power'}]","[{'mal_id': 27, 'type': 'anime', 'name': 'Shounen', 'url': 'https://myanimelist.net/anime/genre/27/Shounen'}]"
23079,https://myanimelist.net/anime/23079/Glasslip,"{'jpg': {'image_url': 'https://cdn.myanimelist.net/images/anime/12/64265.jpg', 'small_image_url': 'https://cdn.myanimelist.net/images/anime/12/64265t.jpg', 'large_image_url': 'https://cdn.myanimelist.net/images/anime/12/64265l.jpg'}, 'webp': {'image_url': 'https://cdn.myanimelist.net/images/anime/12/64265.webp', 'small_image_url': 'https://cdn.myanimelist.net/images/anime/12/64265t.webp', 'large_image_url': 'https://cdn.myanimelist.net/images/anime/12/64265l.webp'}}","{'youtube_id': 'bjHPAEnUiqw', 'url': 'https://www.youtube.com/watch?v=bjHPAEnUiqw', 'embed_url': 'https://www.youtube.com/embed/bjHPAEnUiqw?enablejsapi=1&wmode=opaque&autoplay=1', 'images': {'image_url': 'https://img.youtube.com/vi/bjHPAEnUiqw/default.jpg', 'small_image_url': 'https://img.youtube.com/vi/bjHPAEnUiqw/sddefault.jpg', 'medium_image_url': 'https://img.youtube.com/vi/bjHPAEnUiqw/mqdefault.jpg', 'large_image_url': 'https://img.youtube.com/vi/bjHPAEnUiqw/hqdefault.jpg', 'maximum_image_url': 'https://img.youtube.com/vi/bjHPAEnUiqw/maxresdefault.jpg'}}","""Glasslip""",Glasslip,グラスリップ,[],TV,Original,13,Finished Airing,False,"{'from': '2014-07-03T00:00:00+00:00', 'to': '2014-09-25T00:00:00+00:00', 'prop': {'from': {'day': 3, 'month': 7, 'year': 2014}, 'to': {'day': 25, 'month': 9, 'year': 2014}}, 'string': 'Jul 3, 2014 to Sep 25, 2014'}",23 min per ep,PG-13 - Teens 13 or older,5.42,72538.0,10743,1188,155668,207,"What if you hold the power to hear the voices or see fragments of images from the future? Would that be a good thing or a bad thing? Glasslip follows the life of Touko Fukami, an aspiring glass artist born from a glass artisan family. She enjoys her worry-free life in Fukui, save for the fragments of images that she sees on occasion. On her 18th summer, she meets the transfer student Kakeru Okikura at her school, and then again at her favorite café called Kazemichi together with all four of her friends. The voices from the future lead Kakeru to Touko, and his arrival disrupts her mediocre existence. All six of the friends must face their most unforgettable summer full of hope, affection, and heartache.",,summer,2014,"{'day': 'Thursdays', 'time': '22:30', 'timezone': 'Asia/Tokyo', 'string': 'Thursdays at 22:30 (JST)'}","[{'mal_id': 64, 'type': 'anime', 'name': 'Sotsu', 'url': 'https://myanimelist.net/anime/producer/64/Sotsu'}, {'mal_id': 104, 'type': 'anime', 'name': 'Lantis', 'url': 'https://myanimelist.net/anime/producer/104/Lantis'}, {'mal_id': 144, 'type': 'anime', 'name': 'Pony Canyon', 'url': 'https://myanimelist.net/anime/producer/144/Pony_Canyon'}, {'mal_id': 777, 'type': 'anime', 'name': 'Showgate', 'url': 'https://myanimelist.net/anime/producer/777/Showgate'}, {'mal_id': 1386, 'type': 'anime', 'name': 'Infinite', 'url': 'https://myanimelist.net/anime/producer/1386/Infinite'}]","[{'mal_id': 376, 'type': 'anime', 'name': 'Sentai Filmworks', 'url': 'https://myanimelist.net/anime/producer/376/Sentai_Filmworks'}]","[{'mal_id': 132, 'type': 'anime', 'name': 'P.A. Works', 'url': 'https://myanimelist.net/anime/producer/132/PA_Works'}]","[{'mal_id': 22, 'type': 'anime', 'name': 'Romance', 'url': 'https://myanimelist.net/anime/genre/22/Romance'}, {'mal_id': 36, 'type': 'anime', 'name': 'Slice of Life', 'url': 'https://myanimelist.net/anime/genre/36/Slice_of_Life'}, {'mal_id': 37, 'type': 'anime', 'name': 'Supernatural', 'url': 'https://myanimelist.net/anime/genre/37/Supernatural'}]",[],[],[]
