mal_id,url,images,trailer,title,title_english,title_japanese,title_synonyms,type,source,episodes,status,airing,aired,duration,rating,score,scored_by,rank,popularity,members,favorites,synopsis,background,season,year,broadcast,producers,licensors,studios,genres,explicit_genres,themes,demographics
21681,https://myanimelist.net/anime/21681/Hanayamata,"{'jpg': {'image_url': 'https://cdn.myanimelist.net/images/anime/1963/90831.jpg', 'small_image_url': 'https://cdn.myanimelist.net/images/anime/1963/90831t.jpg', 'large_image_url': 'https://cdn.myanimelist.net/images/anime/1963/90831l.jpg'}, 'webp': {'image_url': 'https://cdn.myanimelist.net/images/anime/1963/90831.webp', 'small_image_url': 'https://cdn.myanimelist.net/images/anime/1963/90831t.webp', 'large_image_url': 'https://cdn.myanimelist.net/images/anime/1963/90831l.webp'}}","{'youtube_id': 'GNl47QWGURc', 'url': 'https://www.youtube.com/watch?v=GNl47QWGURc', 'embed_url': 'https://www.youtube.com/embed/GNl47QWGURc?enablejsapi=1&wmode=opaque&autoplay=1', 'images': {'image_url': 'https://img.youtube.com/vi/GNl47QWGURc/default.jpg', 'small_image_url': 'https://img.youtube.com/vi/GNl47QWGURc/sddefault.jpg', 'medium_image_url': 'https://img.youtube.com/vi/GNl47QWGURc/mqdefault.jpg', 'large_image_url': 'https://img.youtube.com/vi/GNl47QWGURc/hqdefault.jpg', 'maximum_image_url': 'https://img.youtube.com/vi/GNl47QWGURc/maxresdefault.jpg'}}","""Hanayamata""",Hanayamata,ハナヤマタ,[],TV,Manga,12,Finished Airing,False,"{'from': '2014-07-08T00:00:00+00:00', 'to': '2014-09-23T00:00:00+00:00', 'prop': {'from': {'day': 8, 'month': 7, 'year': 2014}, 'to': {'day': 23, 'month': 9, 'year': 2014}}, 'string': 'Jul 8, 2014 to Sep 23, 2014'}",24 min per ep,PG-13 - Teens 13 or older,7.33,35172.0,2263,1654,102329,358,"Naru Sekiya is an average 14-year-old girl with average intelligence, average athleticism, and average talents. She once had hopes that starting high school would change all that. Unfortunately, the reality could not be further from the truth and she remains a wallflower. Why can't real life be like fairy tales where a handsome prince lifts a poor girl from obscurity and transforms her into a dazzling princess? Her average student life changes when she meets a blonde girl dancing on top of a gate to a shrine. Naru assumes the girl is a fairy, but it turns out she's just a regular girl, too. But it also just so happens that she's a transfer student named Hana from America who fell in love with yosakoi, a type of dance, and came to Japan with the intention to start her own club! Excited that she's classmates with the girl she met the night before, Hana tries to recruit Naru to become the first member of the brand new yosakoi club. Too bad the thought of dancing in front of everyone terrifies her! Can Hana convince Naru to join the club? Will Naru fall in love with yosakoi? Find out in Hanayamata!",,summer,2014,"{'day': 'Tuesdays', 'time': '01:35', 'timezone': 'Asia/Tokyo', 'string': 'Tuesdays at 01:35 (JST)'}","[{'mal_id': 16, 'type': 'anime', 'name': 'TV Tokyo', 'url': 'https://myanimelist.net/anime/producer/16/TV_Tokyo'}, {'mal_id': 52, 'type': 'anime', 'name': 'Avex Entertainment', 'url': 'https://myanimelist.net/anime/producer/52/Avex_Entertainment'}, {'mal_id': 64, 'type': 'anime', 'name': 'Sotsu', 'url': 'https://myanimelist.net/anime/producer/64/Sotsu'}, {'mal_id': 166, 'type': 'anime', 'name': 'Movic', 'url': 'https://myanimelist.net/anime/producer/166/Movic'}, {'mal_id': 238, 'type': 'anime', 'name': 'AT-X', 'url': 'https://myanimelist.net/anime/producer/238/AT-X'}, {'mal_id': 1039, 'type': 'anime', 'name': 'DIVE II Entertainment', 'url': 'https://myanimelist.net/anime/producer/1039/DIVE_II_Entertainment'}, {'mal_id': 1097, 'type': 'anime', 'name': 'Bandai Namco Games', 'url': 'https://myanimelist.net/anime/producer/1097/Bandai_Namco_Games'}]","[{'mal_id': 376, 'type': 'anime', 'name': 'Sentai Filmworks', 'url': 'https://myanimelist.net/anime/producer/376/Sentai_Filmworks'}]","[{'mal_id': 11, 'type': 'anime', 'name': 'Madhouse', 'url': 'https://myanimelist.net/anime/producer/11/Madhouse'}]","[{'mal_id': 4, 'type': 'anime', 'name': 'Comedy', 'url': 'https://myanimelist.net/anime/genre/4/Comedy'}, {'mal_id': 36, 'type': 'anime', 'name': 'Slice of Life', 'url': 'https://myanimelist.net/anime/genre/36/Slice_of_Life'}]",[],"[{'mal_id': 23, 'type': 'anime', 'name': 'School', 'url': 'https://myanimelist.net/anime/genre/23/School'}]",[]
24075,https://myanimelist.net/anime/24075/Persona_4_the_Golden_Animation,"{'jpg': {'image_url': 'https://cdn.myanimelist.net/images/anime/3/63251.jpg', 'small_image_url': 'https://cdn.myanimelist.net/images/anime/3/63251t.jpg', 'large_image_url': 'https://cdn.myanimelist.net/images/anime/3/63251l.jpg'}, 'webp': {'image_url': 'https://cdn.myanimelist.net/images/anime/3/63251.webp', 'small_image_url': 'https://cdn.myanimelist.net/images/anime/3/63251t.webp', 'large_image_url': 'https://cdn.myanimelist.net/images/anime/3/63251l.webp'}}","{'youtube_id': 'f-lcgGXCc-4', 'url': 'https://www.youtube.com/watch?v=f-lcgGXCc-4', 'embed_url': 'https://www.youtube.com/embed/f-lcgGXCc-4?enablejsapi=1&wmode=opaque&autoplay=1', 'images': {'image_url': 'https://img.youtube.com/vi/f-lcgGXCc-4/default.jpg', 'small_image_url': 'https://img.youtube.com/vi/f-lcgGXCc-4/sddefault.jpg', 'medium_image_url': 'https://img.youtube.com/vi/f-lcgGXCc-4/mqdefault.jpg', 'large_image_url': 'https://img.youtube.com/vi/f-lcgGXCc-4/hqdefault.jpg', 'maximum_image_url': 'https://img.youtube.com/vi/f-lcgGXCc-4/maxresdefault.jpg'}}","""Persona 4 the Golden Animation""",Persona 4 the Golden ANIMATION,ペルソナ4 ザ・ゴールデンアニメーション,['P4GA'],TV,Game,12,Finished Airing,False,"{'from': '2014-07-11T00:00:00+00:00', 'to': '2014-09-26T00:00:00+00:00', 'prop': {'from': {'day': 11, 'month': 7, 'year': 2014}, 'to': {'day': 26, 'month': 9, 'year': 2014}}, 'string': 'Jul 11, 2014 to Sep 26, 2014'}",23 min per ep,PG-13 - Teens 13 or older,6.62,33987.0,5536,1939,80560,129,"Spring. Far from the city, time flows peacefully in this rural town. As the cherry blossoms scatter in the wind, a young man named Yu Narukami steps off the train at Yasoinaba Station. Yu has come to this town, where his uncle lives, for family reasons; he will be transferring into the local high school, Yasogami High. And so begins his school life... The shopping mall after school. A series of murders taking place in town. The Midnight Channel, airing late at night.... What lies in store for Yu and his friends ‘this time around? (Source: Aniplex USA)",,summer,2014,"{'day': None, 'time': None, 'timezone': None, 'string': 'Unknown'}","[{'mal_id': 17, 'type': 'anime', 'name': 'Aniplex', 'url': 'https://myanimelist.net/anime/producer/17/Aniplex'}, {'mal_id': 127, 'type': 'anime', 'name': 'Yomiko Advertising', 'url': 'https://myanimelist.net/anime/producer/127/Yomiko_Advertising'}, {'mal_id': 143, 'type': 'anime', 'name': 'Mainichi Broadcasting System', 'url': 'https://myanimelist.net/anime/producer/143/Mainichi_Broadcasting_System'}, {'mal_id': 166, 'type': 'anime', 'name': 'Movic', 'url': 'https://myanimelist.net/anime/producer/166/Movic'}, {'mal_id': 167, 'type': 'anime', 'name': 'Sega', 'url': 'https://myanimelist.net/anime/producer/167/Sega'}]","[{'mal_id': 493, 'type': 'anime', 'name': 'Aniplex of America', 'url': 'https://myanimelist.net/anime/producer/493/Aniplex_of_America'}]","[{'mal_id': 56, 'type': 'anime', 'name': 'A-1 Pictures', 'url': 'https://myanimelist.net/anime/producer/56/A-1_Pictures'}]","[{'mal_id': 2, 'type': 'anime', 'name': 'Adventure', 'url': 'https://myanimelist.net/anime/genre/2/Adventure'}, {'mal_id': 7, 'type': 'anime', 'name': 'Mystery', 'url': 'https://myanimelist.net/anime/genre/7/Mystery'}, {'mal_id': 24, 'type': 'anime', 'name': 'Sci-Fi', 'url': 'https://myanimelist.net/anime/genre/24/Sci-Fi'}, {'mal_id': 37, 'type': 'anime', 'name': 'Supernatural', 'url': 'https://myanimelist.net/anime/genre/37/Supernatural'}]",[],"[{'mal_id': 23, 'type': 'anime', 'name': 'School', 'url': 'https://myanimelist.net/anime/genre/23/School'}, {'mal_id': 31, 'type': 'anime', 'name': 'Super Power', 'url': 'https://myanimelist.net/anime/genre/31/Super_Power'}]",[]
23945,https://myanimelist.net/anime/23945/Majimoji_Rurumo,"{'jpg': {'image_url': 'https://cdn.myanimelist.net/images/anime/8/64443.jpg', 'small_image_url': 'https://cdn.myanimelist.net/images/anime/8/64443t.jpg', 'large_image_url': 'https://cdn.myanimelist.net/images/anime/8/64443l.jpg'}, 'webp': {'image_url': 'https://cdn.myanimelist.net/images/anime/8/64443.webp', 'small_image_url': 'https://cdn.myanimelist.net/images/anime/8/64443t.webp', 'large_image_url': 'https://cdn.myanimelist.net/images/anime/8/64443l.webp'}}","{'youtube_id': '6UGmF4isMfg', 'url': 'https://www.youtube.com/watch?v=6UGmF4isMfg', 'embed_url': 'https://www.youtube.com/embed/6UGmF4isMfg?enablejsapi=1&wmode=opaque&autoplay=1', 'images': {'image_url': 'https://img.youtube.com/vi/6UGmF4isMfg/default.jpg', 'small_image_url': 'https://img.youtube.com/vi/6UGmF4isMfg/sddefault.jpg', 'medium_image_url': 'https://img.youtube.com/vi/6UGmF4isMfg/mqdefault.jpg', 'large_image_url': 'https://img.youtube.com/vi/6UGmF4isMfg/hqdefault.jpg', 'maximum_image_url': 'https://img.youtube.com/vi/6UGmF4isMfg/maxresdefault.jpg'}}","""Majimoji Rurumo""",Magimoji Rurumo,まじもじるるも,[],TV,Manga,12,Finished Airing,False,"{'from': '2014-07-09T00:00:00+00:00', 'to': '2014-09-24T00:00:00+00:00', 'prop': {'from': {'day': 9, 'month': 7, 'year': 2014}, 'to': {'day': 24, 'month': 9, 'year': 2014}}, 'string': 'Jul 9, 2014 to Sep 24, 2014'}",24 min per ep,PG-13 - Teens 13 or older,6.84,28376.0,4508,2145,68550,79,"After an unfortunate accident, completely normal heterosexual high school student Kouta Shibaki is branded as the school pervert. With girls avoiding Kouta like the plague, truly the young man's worst nightmare has come to fruition! One day in the school library, he stumbles upon a peculiar book said to possess the power to summon witches. Partly out of desperation, partly out of boredom, Kouta decides to play along with the joke of a book, until an apprentice witch going by the name of Rurumo Maji Mojiruka appears before him. In an unusual turn of events, Kouta ends up helping Rurumo with some general witchery tasks in exchange for his soul being spared. Majimoji Rurumo follows the misadventures of Rurumo as she attempts to persuade Kouta to use 666 magical wish-granting tickets in her efforts to become a fully-fledged witch, unaware that every time she grants a wish, Kouta's life is shortened. Aided by Rurumo's familiar Chiro, Kouta must decide between helping Rurumo or saving his own life. [Written by MAL Rewrite]",,summer,2014,"{'day': None, 'time': None, 'timezone': None, 'string': 'Unknown'}","[{'mal_id': 144, 'type': 'anime', 'name': 'Pony Canyon', 'url': 'https://myanimelist.net/anime/producer/144/Pony_Canyon'}, {'mal_id': 159, 'type': 'anime', 'name': 'Kodansha', 'url': 'https://myanimelist.net/anime/producer/159/Kodansha'}, {'mal_id': 238, 'type': 'anime', 'name': 'AT-X', 'url': 'https://myanimelist.net/anime/producer/238/AT-X'}, {'mal_id': 315, 'type': 'anime', 'name': 'DAX Production', 'url': 'https://myanimelist.net/anime/producer/315/DAX_Production'}, {'mal_id': 775, 'type': 'anime', 'name': 'Bushiroad', 'url': 'https://myanimelist.net/anime/producer/775/Bushiroad'}, {'mal_id': 2038, 'type': 'anime', 'name': 'Eswood', 'url': 'https://myanimelist.net/anime/producer/2038/Eswood'}]",[],"[{'mal_id': 7, 'type': 'anime', 'name': 'J.C.Staff', 'url': 'https://myanimelist.net/anime/producer/7/JCStaff'}]","[{'mal_id': 4, 'type': 'anime', 'name': 'Comedy', 'url': 'https://myanimelist.net/anime/genre/4/Comedy'}, {'mal_id': 10, 'type': 'anime', 'name': 'Fantasy', 'url': 'https://myanimelist.net/anime/genre/10/Fantasy'}, {'mal_id': 9, 'type': 'anime', 'name': 'Ecchi', 'url': 'https://myanimelist.net/anime/genre/9/Ecchi'}]",[],"[{'mal_id': 23, 'type': 'anime', 'name': 'School', 'url': 'https://myanimelist.net/anime/genre/23/School'}]","[{'mal_id': 27, 'type': 'anime', 'name': 'Shounen', 'url': 'https://myanimelist.net/anime/genre/27/Shounen'}]"
23121,https://myanimelist.net/anime/23121/Jinsei,"{'jpg': {'image_url': 'https://cdn.myanimelist.net/images/anime/5/64299.jpg', 'small_image_url': 'https://cdn.myanimelist.net/images/anime/5/64299t.jpg', 'large_image_url': 'https://cdn.myanimelist.net/images/anime/5/64299l.jpg'}, 'webp': {'image_url': 'https://cdn.myanimelist.net/images/anime/5/64299.webp', 'small_image_url': 'https://cdn.myanimelist.net/images/anime/5/64299t.webp', 'large_image_url': 'https://cdn.myanimelist.net/images/anime/5/64299l.webp'}}","{'youtube_id': 'd2BVEHmOLcM', 'url': 'https://www.youtube.com/watch?v=d2BVEHmOLcM', 'embed_url': 'https://www.youtube.com/embed/d2BVEHmOLcM?enablejsapi=1&wmode=opaque&autoplay=1', 'images': {'image_url': 'https://img.youtube.com/vi/d2BVEHmOLcM/default.jpg', 'small_image_url': 'https://img.youtube.com/vi/d2BVEHmOLcM/sddefault.jpg', 'medium_image_url': 'https://img.youtube.com/vi/d2BVEHmOLcM/mqdefault.jpg', 'large_image_url': 'https://img.youtube.com/vi/d2BVEHmOLcM/hqdefault.jpg', 'maximum_image_url': 'https://img.youtube.com/vi/d2BVEHmOLcM/maxresdefault.jpg'}}","""Jinsei""",JINSEI -Life Consulting-,人生相談テレビアニメーション「人生」,['Life'],TV,Light novel,13,Finished Airing,False,"{'from': '2014-07-06T00:00:00+00:00', 'to': '2014-09-28T00:00:00+00:00', 'prop': {'from': {'day': 6, 'month': 7, 'year': 2014}, 'to': {'day': 28, 'month': 9, 'year': 2014}}, 'string': 'Jul 6, 2014 to Sep 28, 2014'}",24 min per ep,PG-13 - Teens 13 or older,6.48,21697.0,6301,2230,64108,61,"Yuuki Akamatsu lives a normal high school life... that is until his cousin, Ayaka Nikaidou, convinces him to join the Journalism Club as a life consultant! His new job is to manage the advice column for the school's weekly newspaper to help him become more social. Soon, Yuuki is joined by three girls: the smart and shy Rino Endou, the athletic and outgoing Ikumi Suzuki, and the cultured and sweet Fumi Kujou. Together, they solve the personal problems of those who anonymously ask for advice. Although each of the new life consultants has their own unique perspective, they are able to reach solutions together by holding debates and social experiments throughout the week. However, as time goes on, the four slowly come to realize that they have not only been guiding other students through their troubles, but also working through problems of their own as well. [Written by MAL Rewrite]",Jinsei adapts the first 5 novels of Ougyo Kawashigi's light novel series of the same title.,summer,2014,"{'day': 'Sundays', 'time': '22:00', 'timezone': 'Asia/Tokyo', 'string': 'Sundays at 22:00 (JST)'}","[{'mal_id': 29, 'type': 'anime', 'name': 'VAP', 'url': 'https://myanimelist.net/anime/producer/29/VAP'}, {'mal_id': 76, 'type': 'anime', 'name': 'Yomiuri Telecasting', 'url': 'https://myanimelist.net/anime/producer/76/Yomiuri_Telecasting'}]","[{'mal_id': 102, 'type': 'anime', 'name': 'Funimation', 'url': 'https://myanimelist.net/anime/producer/102/Funimation'}]","[{'mal_id': 91, 'type': 'anime', 'name': 'feel.', 'url': 'https://myanimelist.net/anime/producer/91/feel'}]","[{'mal_id': 4, 'type': 'anime', 'name': 'Comedy', 'url': 'https://myanimelist.net/anime/genre/4/Comedy'}, {'mal_id': 36, 'type': 'anime', 'name': 'Slice of Life', 'url': 'https://myanimelist.net/anime/genre/36/Slice_of_Life'}]",[],"[{'mal_id': 23, 'type': 'anime', 'name': 'School', 'url': 'https://myanimelist.net/anime/genre/23/School'}]",[]
24135,https://myanimelist.net/anime/24135/Nobunaga_Concerto,"{'jpg': {'image_url': 'https://cdn.myanimelist.net/images/anime/6/64519.jpg', 'small_image_url': 'https://cdn.myanimelist.net/images/anime/6/64519t.jpg', 'large_image_url': 'https://cdn.myanimelist.net/images/anime/6/64519l.jpg'}, 'webp': {'image_url': 'https://cdn.myanimelist.net/images/anime/6/64519.webp', 'small_image_url': 'https://cdn.myanimelist.net/images/anime/6/64519t.webp', 'large_image_url': 'https://cdn.myanimelist.net/images/anime/6/64519l.webp'}}","{'youtube_id': None, 'url': None, 'embed_url': None, 'images': {'image_url': None, 'small_image_url': None, 'medium_image_url': None, 'large_image_url': None, 'maximum_image_url': None}}","""Nobunaga Concerto""",,信長協奏曲〈コンツェルト〉,"['Nobunaga Concierto', 'Nobunaga Kyousoukyoku']",TV,Manga,10,Finished Airing,False,"{'from': '2014-07-12T00:00:00+00:00', 'to': '2014-09-20T00:00:00+00:00', 'prop': {'from': {'day': 12, 'month': 7, 'year': 2014}, 'to': {'day': 20, 'month': 9, 'year': 2014}}, 'string': 'Jul 12, 2014 to Sep 20, 2014'}",22 min per ep,PG-13 - Teens 13 or older,7.57,20534.0,1416,2500,53248,276,"""Who cares about what happened in Japan's past? It has nothing to do with my life."" With these words, carefree high school student Saburou finds himself unceremoniously thrown back in time to the Sengoku Era, landing directly in front of the legendary general Nobunaga Oda. Nobunaga, on the run from his retainers and wishing to rest due to his frailty, beseeches Saburou to take his place, as the two bear an uncanny resemblance. Although Saburou is still confused by his surroundings, Nobunaga hurriedly provides the boy with the necessary items to prove that he is the bona fide feudal lord and makes a hasty getaway. Now a stand-in for someone he doesn't even know all that much about—though his modern experiences and knowledge are sure to help him—Saburou begins his unexpected quest to pose as the man who attempted to unite all of Japan. [Written by MAL Rewrite]",Nobunaga Concerto was nominated for Banff World Media Festival's Rockie Award in the animation category in 2015.,summer,2014,"{'day': None, 'time': None, 'timezone': None, 'string': 'Unknown'}","[{'mal_id': 144, 'type': 'anime', 'name': 'Pony Canyon', 'url': 'https://myanimelist.net/anime/producer/144/Pony_Canyon'}]",[],"[{'mal_id': 169, 'type': 'anime', 'name': 'Fuji TV', 'url': 'https://myanimelist.net/anime/producer/169/Fuji_TV'}]","[{'mal_id': 4, 'type': 'anime', 'name': 'Comedy', 'url': 'https://myanimelist.net/anime/genre/4/Comedy'}, {'mal_id': 22, 'type': 'anime', 'name': 'Romance', 'url': 'https://myanimelist.net/anime/genre/22/Romance'}]",[],"[{'mal_id': 13, 'type': 'anime', 'name': 'Historical', 'url': 'https://myanimelist.net/anime/genre/13/Historical'}]","[{'mal_id': 27, 'type': 'anime', 'name': 'Shounen', 'url': 'https://myanimelist.net/anime/genre/27/Shounen'}]"
22537,https://myanimelist.net/anime/22537/Yami_Shibai_2,"{'jpg': {'image_url': 'https://cdn.myanimelist.net/images/anime/2/74108.jpg', 'small_image_url': 'https://cdn.myanimelist.net/images/anime/2/74108t.jpg', 'large_image_url': 'https://cdn.myanimelist.net/images/anime/2/74108l.jpg'}, 'webp': {'image_url': 'https://cdn.myanimelist.net/images/anime/2/74108.webp', 'small_image_url': 'https://cdn.myanimelist.net/images/anime/2/74108t.webp', 'large_image_url': 'https://cdn.myanimelist.net/images/anime/2/74108l.webp'}}","{'youtube_id': None, 'url': None, 'embed_url': None, 'images': {'image_url': None, 'small_image_url': None, 'medium_image_url': None, 'large_image_url': None, 'maximum_image_url': None}}","""Yami Shibai 2""",Yamishibai: Japanese Ghost Stories 2,闇芝居 2期,"['Yamishibai: Japanese Ghost Stories Second Season', 'Theater of Darkness 2nd Season']",TV,Original,13,Finished Airing,False,"{'from': '2014-07-07T00:00:00+00:00', 'to': '2014-09-29T00:00:00+00:00', 'prop': {'from': {'day': 7, 'month': 7, 'year': 2014}, 'to': {'day': 29, 'month': 9, 'year': 2014}}, 'string': 'Jul 7, 2014 to Sep 29, 2014'}",4 min per ep,PG-13 - Teens 13 or older,6.49,25158.0,6261,2748,43666,26,"For the second time, the masked storyteller returns to tell children tales and legends of horror and woe, such as the tale of a ventriloquist's dummy, a locker that grants wishes, a capsule toy machine that returns lost possessions, and a strange food called Ominie-san. Building on the foundation that was laid by the first, Yami Shibai 2 is a collection of Japanese scary stories of the unknown and the occult that are truly terrifying, narrated in a style of art that mimics kamishibai storytelling. [Written by MAL Rewrite]",,summer,2014,"{'day': None, 'time': None, 'timezone': None, 'string': 'Unknown'}","[{'mal_id': 16, 'type': 'anime', 'name': 'TV Tokyo', 'url': 'https://myanimelist.net/anime/producer/16/TV_Tokyo'}]","[{'mal_id': 376, 'type': 'anime', 'name': 'Sentai Filmworks', 'url': 'https://myanimelist.net/anime/producer/376/Sentai_Filmworks'}]","[{'mal_id': 1169, 'type': 'anime', 'name': 'ILCA', 'url': 'https://myanimelist.net/anime/producer/1169/ILCA'}]","[{'mal_id': 5, 'type': 'anime', 'name': 'Avant Garde', 'url': 'https://myanimelist.net/anime/genre/5/Avant_Garde'}, {'mal_id': 14, 'type': 'anime', 'name': 'Horror', 'url': 'https://myanimelist.net/anime/genre/14/Horror'}, {'mal_id': 37, 'type': 'anime', 'name': 'Supernatural', 'url': 'https://myanimelist.net/anime/genre/37/Supernatural'}]",[],[],[]
22189,https://myanimelist.net/anime/22189/Futsuu_no_Joshikousei_ga_Locodol_Yattemita,"{'jpg': {'image_url': 'https://cdn.myanimelist.net/images/anime/12/65309.jpg', 'small_image_url': 'https://cdn.myanimelist.net/images/anime/12/65309t.jpg', 'large_image_url': 'https://cdn.myanimelist.net/images/anime/12/65309l.jpg'}, 'webp': {'image_url': 'https://cdn.myanimelist.net/images/anime/12/65309.webp', 'small_image_url': 'https://cdn.myanimelist.net/images/anime/12/65309t.webp', 'large_image_url': 'https://cdn.myanimelist.net/images/anime/12/65309l.webp'}}","{'youtube_id': 'xJoW7mmizDM', 'url': 'https://www.youtube.com/watch?v=xJoW7mmizDM', 'embed_url': 'https://www.youtube.com/embed/xJoW7mmizDM?enablejsapi=1&wmode=opaque&autoplay=1', 'images': {'image_url': 'https://img.youtube.com/vi/xJoW7mmizDM/default.jpg', 'small_image_url': 'https://img.youtube.com/vi/xJoW7mmizDM/sddefault.jpg', 'medium_image_url': 'https://img.youtube.com/vi/xJoW7mmizDM/mqdefault.jpg', 'large_image_url': 'https://img.youtube.com/vi/xJoW7mmizDM/hqdefault.jpg', 'maximum_image_url': 'https://img.youtube.com/vi/xJoW7mmizDM/maxresdefault.jpg'}}","""Futsuu no Joshikousei ga [Locodol] Yattemita.""",Locodol,普通の女子校生が【ろこどる】やってみた。,"['Futsuu no Joshikousei ga [Local Idol] Yattemita.', 'Futsuu no Joshikousei ga [Rokodoru] Yattemita.']",TV,4-koma manga,12,Finished Airing,False,"{'from': '2014-07-04T00:00:00+00:00', 'to': '2014-09-19T00:00:00+00:00', 'prop': {'from': {'day': 4, 'month': 7, 'year': 2014}, 'to': {'day': 19, 'month': 9, 'year': 2014}}, 'string': 'Jul 4, 2014 to Sep 19, 2014'}",24 min per ep,PG-13 - Teens 13 or older,6.89,15123.0,4266,2789,42583,73,"In the town of Nagarekawa, Nanako Usami, an ordinary high school girl, is approached by her uncle to become a local idol or ""Locodol,"" partnering with upperclassman Yukari Kohinata to form the idol unit, Nagarekawa Girls. As the girls use their talent to promote Nagarekawa and their businesses, they are joined by Yui Mikoze, who acts as the local mascot, and Mirai Nazukari, who serves as Yui's substitute. (Source: Wikipedia)",,summer,2014,"{'day': 'Fridays', 'time': '02:16', 'timezone': 'Asia/Tokyo', 'string': 'Fridays at 02:16 (JST)'}","[{'mal_id': 145, 'type': 'anime', 'name': 'TBS', 'url': 'https://myanimelist.net/anime/producer/145/TBS'}, {'mal_id': 315, 'type': 'anime', 'name': 'DAX Production', 'url': 'https://myanimelist.net/anime/producer/315/DAX_Production'}, {'mal_id': 323, 'type': 'anime', 'name': 'Nippon Columbia', 'url': 'https://myanimelist.net/anime/producer/323/Nippon_Columbia'}, {'mal_id': 1443, 'type': 'anime', 'name': 'Overlap', 'url': 'https://myanimelist.net/anime/producer/1443/Overlap'}, {'mal_id': 1556, 'type': 'anime', 'name': 'Fuji Creative', 'url': 'https://myanimelist.net/anime/producer/1556/Fuji_Creative'}, {'mal_id': 1582, 'type': 'anime', 'name': 'Ichijinsha', 'url': 'https://myanimelist.net/anime/producer/1582/Ichijinsha'}]","[{'mal_id': 376, 'type': 'anime', 'name': 'Sentai Filmworks', 'url': 'https://myanimelist.net/anime/producer/376/Sentai_Filmworks'}]","[{'mal_id': 91, 'type': 'anime', 'name': 'feel.', 'url': 'https://myanimelist.net/anime/producer/91/feel'}]","[{'mal_id': 4, 'type': 'anime', 'name': 'Comedy', 'url': 'https://myanimelist.net/anime/genre/4/Comedy'}, {'mal_id': 36, 'type': 'anime', 'name': 'Slice of Life', 'url': 'https://myanimelist.net/anime/genre/36/Slice_of_Life'}]",[],[],"[{'mal_id': 42, 'type': 'anime', 'name': 'Seinen', 'url': 'https://myanimelist.net/anime/genre/42/Seinen'}]"
