mal_id,url,images,trailer,title,title_english,title_japanese,title_synonyms,type,source,episodes,status,airing,aired,duration,rating,score,scored_by,rank,popularity,members,favorites,synopsis,background,season,year,broadcast,producers,licensors,studios,genres,explicit_genres,themes,demographics
35847,https://myanimelist.net/anime/35847/SSSSGridman,"{'jpg': {'image_url': 'https://cdn.myanimelist.net/images/anime/1973/95616.jpg', 'small_image_url': 'https://cdn.myanimelist.net/images/anime/1973/95616t.jpg', 'large_image_url': 'https://cdn.myanimelist.net/images/anime/1973/95616l.jpg'}, 'webp': {'image_url': 'https://cdn.myanimelist.net/images/anime/1973/95616.webp', 'small_image_url': 'https://cdn.myanimelist.net/images/anime/1973/95616t.webp', 'large_image_url': 'https://cdn.myanimelist.net/images/anime/1973/95616l.webp'}}","{'youtube_id': 'kZdZmbvln4g', 'url': 'https://www.youtube.com/watch?v=kZdZmbvln4g', 'embed_url': 'https://www.youtube.com/embed/kZdZmbvln4g?enablejsapi=1&wmode=opaque&autoplay=1', 'images': {'image_url': 'https://img.youtube.com/vi/kZdZmbvln4g/default.jpg', 'small_image_url': 'https://img.youtube.com/vi/kZdZmbvln4g/sddefault.jpg', 'medium_image_url': 'https://img.youtube.com/vi/kZdZmbvln4g/mqdefault.jpg', 'large_image_url': 'https://img.youtube.com/vi/kZdZmbvln4g/hqdefault.jpg', 'maximum_image_url': 'https://img.youtube.com/vi/kZdZmbvln4g/maxresdefault.jpg'}}","""SSSS.Gridman""",,SSSS.GRIDMAN,[],TV,Original,12.0,Finished Airing,False,"{'from': '2018-10-07T00:00:00+00:00', 'to': '2018-12-23T00:00:00+00:00', 'prop': {'from': {'day': 7, 'month': 10, 'year': 2018}, 'to': {'day': 23, 'month': 12, 'year': 2018}}, 'string': 'Oct 7, 2018 to Dec 23, 2018'}",23 min per ep,PG-13 - Teens 13 or older,7.14,107541.0,3194.0,737,255222,1167,"Yuuta Hibiki wakes up in the room of Rikka Takarada and notices two things: he has no memories, and he can hear a mysterious voice calling his name from a nearby room. On further inspection, he finds a robot—which introduces itself as Hyper Agent Gridman—behind the screen of an old computer. Much to Yuuta's surprise, Rikka cannot hear Gridman, nor can she see the ominous monsters looming over a thick fog as it envelopes the town outside. Another giant monster materializes in the city and proceeds to wreak havoc. Amidst the confusion, Yuuta is once again drawn to the old computer and merges with Gridman. Suddenly, he appears in the middle of the battle and is forced to fight the monster. Together with Rikka and fellow classmate Shou Utsumi, Yuuta forms the ""Gridman Alliance"" to defeat the monsters plaguing the city and find whoever is responsible for their emergence. [Written by MAL Rewrite]","SSSS.Gridman is an anime adaptation of the Tokusatsu show, Hyper-Agent Gridman, created by Tsuburaya Productions. The original aired in 1993-1994, and much like other Tokusatsu shows featured live-action, costumed actors fighting against giant monsters. The original Gridman was adapted into The Superhuman Samurai Syber-Squad. It was inspired by Ultraman, another Tokusatsu franchise created by Tsuburaya Productions.",fall,2018,"{'day': 'Sundays', 'time': '00:00', 'timezone': 'Asia/Tokyo', 'string': 'Sundays at 00:00 (JST)'}","[{'mal_id': 143, 'type': 'anime', 'name': 'Mainichi Broadcasting System', 'url': 'https://myanimelist.net/anime/producer/143/Mainichi_Broadcasting_System'}, {'mal_id': 144, 'type': 'anime', 'name': 'Pony Canyon', 'url': 'https://myanimelist.net/anime/producer/144/Pony_Canyon'}, {'mal_id': 453, 'type': 'anime', 'name': 'Tsuburaya Productions', 'url': 'https://myanimelist.net/anime/producer/453/Tsuburaya_Productions'}, {'mal_id': 460, 'type': 'anime', 'name': 'KlockWorx', 'url': 'https://myanimelist.net/anime/producer/460/KlockWorx'}, {'mal_id': 539, 'type': 'anime', 'name': 'Ultra Super Pictures', 'url': 'https://myanimelist.net/anime/producer/539/Ultra_Super_Pictures'}, {'mal_id': 894, 'type': 'anime', 'name': 'Graphinica', 'url': 'https://myanimelist.net/anime/producer/894/Graphinica'}, {'mal_id': 1334, 'type': 'anime', 'name': 'Docomo Anime Store', 'url': 'https://myanimelist.net/anime/producer/1334/Docomo_Anime_Store'}, {'mal_id': 1358, 'type': 'anime', 'name': 'Fields', 'url': 'https://myanimelist.net/anime/producer/1358/Fields'}, {'mal_id': 1416, 'type': 'anime', 'name': 'BS11', 'url': 'https://myanimelist.net/anime/producer/1416/BS11'}]","[{'mal_id': 102, 'type': 'anime', 'name': 'Funimation', 'url': 'https://myanimelist.net/anime/producer/102/Funimation'}]","[{'mal_id': 803, 'type': 'anime', 'name': 'Trigger', 'url': 'https://myanimelist.net/anime/producer/803/Trigger'}]","[{'mal_id': 1, 'type': 'anime', 'name': 'Action', 'url': 'https://myanimelist.net/anime/genre/1/Action'}, {'mal_id': 24, 'type': 'anime', 'name': 'Sci-Fi', 'url': 'https://myanimelist.net/anime/genre/24/Sci-Fi'}]",[],"[{'mal_id': 18, 'type': 'anime', 'name': 'Mecha', 'url': 'https://myanimelist.net/anime/genre/18/Mecha'}]",[]
37965,https://myanimelist.net/anime/37965/Kaze_ga_Tsuyoku_Fuiteiru,"{'jpg': {'image_url': 'https://cdn.myanimelist.net/images/anime/1692/93918.jpg', 'small_image_url': 'https://cdn.myanimelist.net/images/anime/1692/93918t.jpg', 'large_image_url': 'https://cdn.myanimelist.net/images/anime/1692/93918l.jpg'}, 'webp': {'image_url': 'https://cdn.myanimelist.net/images/anime/1692/93918.webp', 'small_image_url': 'https://cdn.myanimelist.net/images/anime/1692/93918t.webp', 'large_image_url': 'https://cdn.myanimelist.net/images/anime/1692/93918l.webp'}}","{'youtube_id': 'ANzTSVvgXVI', 'url': 'https://www.youtube.com/watch?v=ANzTSVvgXVI', 'embed_url': 'https://www.youtube.com/embed/ANzTSVvgXVI?enablejsapi=1&wmode=opaque&autoplay=1', 'images': {'image_url': 'https://img.youtube.com/vi/ANzTSVvgXVI/default.jpg', 'small_image_url': 'https://img.youtube.com/vi/ANzTSVvgXVI/sddefault.jpg', 'medium_image_url': 'https://img.youtube.com/vi/ANzTSVvgXVI/mqdefault.jpg', 'large_image_url': 'https://img.youtube.com/vi/ANzTSVvgXVI/hqdefault.jpg', 'maximum_image_url': 'https://img.youtube.com/vi/ANzTSVvgXVI/maxresdefault.jpg'}}","""Kaze ga Tsuyoku Fuiteiru""",Run with the Wind,風が強く吹いている,"['Kaze ga Tsuyoku Fuite Iru', 'Kazetsuyo']",TV,Novel,23.0,Finished Airing,False,"{'from': '2018-10-03T00:00:00+00:00', 'to': '2019-03-27T00:00:00+00:00', 'prop': {'from': {'day': 3, 'month': 10, 'year': 2018}, 'to': {'day': 27, 'month': 3, 'year': 2019}}, 'string': 'Oct 3, 2018 to Mar 27, 2019'}",23 min per ep,PG-13 - Teens 13 or older,8.41,110804.0,154.0,749,251289,5124,"Former ace runner of Sendai Josei High School, Kakeru Kurahara is chased away from a convenience store for shoplifting. Shaking off his pursuer, he runs into Haiji Kiyose, another student from his university. Haiji is impressed by Kakeru's agility and persuades him to live in Chikusei-sou, the run-down apartment where Haiji resides along with eight other students. Having lost his entire apartment deposit at a mahjong parlor, Kakeru accepts the offer reluctantly. However, Haiji reveals a secret during Kakeru's welcoming party: the apartment is actually the dormitory of the Kansei University Track Club. He unveils his ultimate goal of participating in the Hakone Ekiden—one of the most prominent university marathon relay races in Japan. Unfortunately, all the residents apart from Haiji and Kakeru are complete running novices. Worse still, none of the inhabitants are even remotely interested in being involved with Haiji's ridiculous plan! With only months before the deadline, will the fourth-year student be able to convince them otherwise and realize his elusive dream of running in the Hakone Ekiden? [Written by MAL Rewrite]",,fall,2018,"{'day': 'Wednesdays', 'time': '01:29', 'timezone': 'Asia/Tokyo', 'string': 'Wednesdays at 01:29 (JST)'}","[{'mal_id': 166, 'type': 'anime', 'name': 'Movic', 'url': 'https://myanimelist.net/anime/producer/166/Movic'}, {'mal_id': 1003, 'type': 'anime', 'name': 'Nippon Television Network', 'url': 'https://myanimelist.net/anime/producer/1003/Nippon_Television_Network'}, {'mal_id': 1143, 'type': 'anime', 'name': 'TOHO animation', 'url': 'https://myanimelist.net/anime/producer/1143/TOHO_animation'}, {'mal_id': 1390, 'type': 'anime', 'name': ""Toy's Factory"", 'url': 'https://myanimelist.net/anime/producer/1390/Toys_Factory'}, {'mal_id': 1587, 'type': 'anime', 'name': 'Cygames', 'url': 'https://myanimelist.net/anime/producer/1587/Cygames'}, {'mal_id': 1792, 'type': 'anime', 'name': 'Yomiuri Shimbun', 'url': 'https://myanimelist.net/anime/producer/1792/Yomiuri_Shimbun'}, {'mal_id': 2279, 'type': 'anime', 'name': 'MediaLink Entertainment Limited', 'url': 'https://myanimelist.net/anime/producer/2279/MediaLink_Entertainment_Limited'}]","[{'mal_id': 376, 'type': 'anime', 'name': 'Sentai Filmworks', 'url': 'https://myanimelist.net/anime/producer/376/Sentai_Filmworks'}]","[{'mal_id': 10, 'type': 'anime', 'name': 'Production I.G', 'url': 'https://myanimelist.net/anime/producer/10/Production_IG'}]","[{'mal_id': 8, 'type': 'anime', 'name': 'Drama', 'url': 'https://myanimelist.net/anime/genre/8/Drama'}, {'mal_id': 30, 'type': 'anime', 'name': 'Sports', 'url': 'https://myanimelist.net/anime/genre/30/Sports'}]",[],[],[]
36432,https://myanimelist.net/anime/36432/Toaru_Majutsu_no_Index_III,"{'jpg': {'image_url': 'https://cdn.myanimelist.net/images/anime/1583/93857.jpg', 'small_image_url': 'https://cdn.myanimelist.net/images/anime/1583/93857t.jpg', 'large_image_url': 'https://cdn.myanimelist.net/images/anime/1583/93857l.jpg'}, 'webp': {'image_url': 'https://cdn.myanimelist.net/images/anime/1583/93857.webp', 'small_image_url': 'https://cdn.myanimelist.net/images/anime/1583/93857t.webp', 'large_image_url': 'https://cdn.myanimelist.net/images/anime/1583/93857l.webp'}}","{'youtube_id': 'cigp3w-ZVKU', 'url': 'https://www.youtube.com/watch?v=cigp3w-ZVKU', 'embed_url': 'https://www.youtube.com/embed/cigp3w-ZVKU?enablejsapi=1&wmode=opaque&autoplay=1', 'images': {'image_url': 'https://img.youtube.com/vi/cigp3w-ZVKU/default.jpg', 'small_image_url': 'https://img.youtube.com/vi/cigp3w-ZVKU/sddefault.jpg', 'medium_image_url': 'https://img.youtube.com/vi/cigp3w-ZVKU/mqdefault.jpg', 'large_image_url': 'https://img.youtube.com/vi/cigp3w-ZVKU/hqdefault.jpg', 'maximum_image_url': 'https://img.youtube.com/vi/cigp3w-ZVKU/maxresdefault.jpg'}}","""Toaru Majutsu no Index III""",A Certain Magical Index III,とある魔術の禁書目録Ⅲ,"['Toaru Majutsu no Index 3', 'Toaru Majutsu no Kinsho Mokuroku 3']",TV,Light novel,26.0,Finished Airing,False,"{'from': '2018-10-05T00:00:00+00:00', 'to': '2019-04-05T00:00:00+00:00', 'prop': {'from': {'day': 5, 'month': 10, 'year': 2018}, 'to': {'day': 5, 'month': 4, 'year': 2019}}, 'string': 'Oct 5, 2018 to Apr 5, 2019'}",23 min per ep,PG-13 - Teens 13 or older,6.79,79085.0,4737.0,880,213668,760,"Touma Kamijou can't catch a break. After the invasion of Academy City, political tensions continue to rise as both the science and magic factions collide head on. It appears that Academy City intends to declare war against the Roman Catholic Church, consequently plunging the whole world into global warfare. Touma soon finds himself on the front lines once again, striving to protect his friends and allies. Toaru Majutsu no Index III serves as the last installment of the original franchise as Touma, Accelerator, and the true Level 0 Shiage Hamazura continue their separate journeys, leading up to the final act of the original light novel series. [Written by MAL Rewrite]",Toaru Majutsu no Index III adapts novels 14 to 22 of Kazuma Kamachi's light novel series of the same title.,fall,2018,"{'day': 'Fridays', 'time': '22:00', 'timezone': 'Asia/Tokyo', 'string': 'Fridays at 22:00 (JST)'}","[{'mal_id': 58, 'type': 'anime', 'name': 'Square Enix', 'url': 'https://myanimelist.net/anime/producer/58/Square_Enix'}, {'mal_id': 166, 'type': 'anime', 'name': 'Movic', 'url': 'https://myanimelist.net/anime/producer/166/Movic'}, {'mal_id': 238, 'type': 'anime', 'name': 'AT-X', 'url': 'https://myanimelist.net/anime/producer/238/AT-X'}, {'mal_id': 415, 'type': 'anime', 'name': 'Warner Bros. Japan', 'url': 'https://myanimelist.net/anime/producer/415/Warner_Bros_Japan'}, {'mal_id': 1113, 'type': 'anime', 'name': 'NBCUniversal Entertainment Japan', 'url': 'https://myanimelist.net/anime/producer/1113/NBCUniversal_Entertainment_Japan'}, {'mal_id': 1696, 'type': 'anime', 'name': 'Kadokawa', 'url': 'https://myanimelist.net/anime/producer/1696/Kadokawa'}]","[{'mal_id': 102, 'type': 'anime', 'name': 'Funimation', 'url': 'https://myanimelist.net/anime/producer/102/Funimation'}]","[{'mal_id': 7, 'type': 'anime', 'name': 'J.C.Staff', 'url': 'https://myanimelist.net/anime/producer/7/JCStaff'}]","[{'mal_id': 1, 'type': 'anime', 'name': 'Action', 'url': 'https://myanimelist.net/anime/genre/1/Action'}, {'mal_id': 24, 'type': 'anime', 'name': 'Sci-Fi', 'url': 'https://myanimelist.net/anime/genre/24/Sci-Fi'}]",[],"[{'mal_id': 31, 'type': 'anime', 'name': 'Super Power', 'url': 'https://myanimelist.net/anime/genre/31/Super_Power'}]",[]
37202,https://myanimelist.net/anime/37202/Radiant,"{'jpg': {'image_url': 'https://cdn.myanimelist.net/images/anime/1318/95345.jpg', 'small_image_url': 'https://cdn.myanimelist.net/images/anime/1318/95345t.jpg', 'large_image_url': 'https://cdn.myanimelist.net/images/anime/1318/95345l.jpg'}, 'webp': {'image_url': 'https://cdn.myanimelist.net/images/anime/1318/95345.webp', 'small_image_url': 'https://cdn.myanimelist.net/images/anime/1318/95345t.webp', 'large_image_url': 'https://cdn.myanimelist.net/images/anime/1318/95345l.webp'}}","{'youtube_id': 'qZwtUu3p1zg', 'url': 'https://www.youtube.com/watch?v=qZwtUu3p1zg', 'embed_url': 'https://www.youtube.com/embed/qZwtUu3p1zg?enablejsapi=1&wmode=opaque&autoplay=1', 'images': {'image_url': 'https://img.youtube.com/vi/qZwtUu3p1zg/default.jpg', 'small_image_url': 'https://img.youtube.com/vi/qZwtUu3p1zg/sddefault.jpg', 'medium_image_url': 'https://img.youtube.com/vi/qZwtUu3p1zg/mqdefault.jpg', 'large_image_url': 'https://img.youtube.com/vi/qZwtUu3p1zg/hqdefault.jpg', 'maximum_image_url': 'https://img.youtube.com/vi/qZwtUu3p1zg/maxresdefault.jpg'}}","""Radiant""",Radiant,ラディアン,[],TV,Other,21.0,Finished Airing,False,"{'from': '2018-10-06T00:00:00+00:00', 'to': '2019-02-23T00:00:00+00:00', 'prop': {'from': {'day': 6, 'month': 10, 'year': 2018}, 'to': {'day': 23, 'month': 2, 'year': 2019}}, 'string': 'Oct 6, 2018 to Feb 23, 2019'}",24 min per ep,PG-13 - Teens 13 or older,6.87,59772.0,4369.0,1032,178224,353,"Nemeses—powerful and mysterious demonic entities that fall from the sky and vaporize anything they touch. The only ones who can combat these creatures are Sorcerers, those who have survived an encounter with a Nemesis but were infected in the process. Seth, a Sorcerer from Pompo Hills, sets out on an adventure to exterminate all these Nemeses. Accompanying him are Doc and Mélie, fellow Sorcerers who share his ideal. Their main objective is to bring about a world where Sorcerers are no longer persecuted for being infected, and to that end, desire to destroy the source of the Nemeses themselves: the mythical Radiant. [Written by MAL Rewrite]",,fall,2018,"{'day': 'Saturdays', 'time': '17:35', 'timezone': 'Asia/Tokyo', 'string': 'Saturdays at 17:35 (JST)'}","[{'mal_id': 101, 'type': 'anime', 'name': 'Studio Hibari', 'url': 'https://myanimelist.net/anime/producer/101/Studio_Hibari'}, {'mal_id': 111, 'type': 'anime', 'name': 'NHK', 'url': 'https://myanimelist.net/anime/producer/111/NHK'}, {'mal_id': 1797, 'type': 'anime', 'name': 'NHK Enterprises', 'url': 'https://myanimelist.net/anime/producer/1797/NHK_Enterprises'}]","[{'mal_id': 102, 'type': 'anime', 'name': 'Funimation', 'url': 'https://myanimelist.net/anime/producer/102/Funimation'}]","[{'mal_id': 456, 'type': 'anime', 'name': 'Lerche', 'url': 'https://myanimelist.net/anime/producer/456/Lerche'}]","[{'mal_id': 1, 'type': 'anime', 'name': 'Action', 'url': 'https://myanimelist.net/anime/genre/1/Action'}, {'mal_id': 2, 'type': 'anime', 'name': 'Adventure', 'url': 'https://myanimelist.net/anime/genre/2/Adventure'}, {'mal_id': 10, 'type': 'anime', 'name': 'Fantasy', 'url': 'https://myanimelist.net/anime/genre/10/Fantasy'}]",[],[],[]
37989,https://myanimelist.net/anime/37989/Golden_Kamuy_2nd_Season,"{'jpg': {'image_url': 'https://cdn.myanimelist.net/images/anime/1180/95018.jpg', 'small_image_url': 'https://cdn.myanimelist.net/images/anime/1180/95018t.jpg', 'large_image_url': 'https://cdn.myanimelist.net/images/anime/1180/95018l.jpg'}, 'webp': {'image_url': 'https://cdn.myanimelist.net/images/anime/1180/95018.webp', 'small_image_url': 'https://cdn.myanimelist.net/images/anime/1180/95018t.webp', 'large_image_url': 'https://cdn.myanimelist.net/images/anime/1180/95018l.webp'}}","{'youtube_id': '2PDY8LgeS-o', 'url': 'https://www.youtube.com/watch?v=2PDY8LgeS-o', 'embed_url': 'https://www.youtube.com/embed/2PDY8LgeS-o?enablejsapi=1&wmode=opaque&autoplay=1', 'images': {'image_url': 'https://img.youtube.com/vi/2PDY8LgeS-o/default.jpg', 'small_image_url': 'https://img.youtube.com/vi/2PDY8LgeS-o/sddefault.jpg', 'medium_image_url': 'https://img.youtube.com/vi/2PDY8LgeS-o/mqdefault.jpg', 'large_image_url': 'https://img.youtube.com/vi/2PDY8LgeS-o/hqdefault.jpg', 'maximum_image_url': 'https://img.youtube.com/vi/2PDY8LgeS-o/maxresdefault.jpg'}}","""Golden Kamuy 2nd Season""",Golden Kamuy: Season 2,ゴールデンカムイ,['Golden Kamuy Second Season'],TV,Manga,12.0,Finished Airing,False,"{'from': '2018-10-08T00:00:00+00:00', 'to': '2018-12-24T00:00:00+00:00', 'prop': {'from': {'day': 8, 'month': 10, 'year': 2018}, 'to': {'day': 24, 'month': 12, 'year': 2018}}, 'string': 'Oct 8, 2018 to Dec 24, 2018'}",23 min per ep,R - 17+ (violence & profanity),8.23,81879.0,285.0,1207,153115,765,"In Hokkaido, it is rumored that there is a stash of hidden gold. This gold was supposedly stolen by a man who killed the original Ainu owners; and before being captured and imprisoned by the police, he hid it in a secret location. In order to relay the gold's location to his comrades on the outside, he tattooed the map on the bodies of his cellmates and promised them a share of the gold—provided they managed to escape and find it. In Golden Kamuy 2nd Season, First Lieutenant Tokushirou Tsurumi plans to give the 7th Division an advantage in the war for the tattoos by getting a taxidermist to create skins that only he can distinguish as fake. Meanwhile, Saichi ""The Immortal"" Sugimoto, Asirpa, and their companions continue their hunt for the skins by following a strange rumor: a thief who broke into a home in Yubari found taxidermied human corpses, among which was a torso with strange tattoos. [Written by MAL Rewrite]",,fall,2018,"{'day': 'Mondays', 'time': '23:00', 'timezone': 'Asia/Tokyo', 'string': 'Mondays at 23:00 (JST)'}","[{'mal_id': 306, 'type': 'anime', 'name': 'Magic Capsule', 'url': 'https://myanimelist.net/anime/producer/306/Magic_Capsule'}, {'mal_id': 1113, 'type': 'anime', 'name': 'NBCUniversal Entertainment Japan', 'url': 'https://myanimelist.net/anime/producer/1113/NBCUniversal_Entertainment_Japan'}, {'mal_id': 1211, 'type': 'anime', 'name': 'Tokyo MX', 'url': 'https://myanimelist.net/anime/producer/1211/Tokyo_MX'}, {'mal_id': 1261, 'type': 'anime', 'name': 'Good Smile Company', 'url': 'https://myanimelist.net/anime/producer/1261/Good_Smile_Company'}, {'mal_id': 1345, 'type': 'anime', 'name': 'Sammy', 'url': 'https://myanimelist.net/anime/producer/1345/Sammy'}, {'mal_id': 1365, 'type': 'anime', 'name': 'Shueisha', 'url': 'https://myanimelist.net/anime/producer/1365/Shueisha'}, {'mal_id': 1501, 'type': 'anime', 'name': 'JR East Marketing & Communications', 'url': 'https://myanimelist.net/anime/producer/1501/JR_East_Marketing___Communications'}, {'mal_id': 1747, 'type': 'anime', 'name': 'Twin Engine', 'url': 'https://myanimelist.net/anime/producer/1747/Twin_Engine'}]","[{'mal_id': 102, 'type': 'anime', 'name': 'Funimation', 'url': 'https://myanimelist.net/anime/producer/102/Funimation'}]","[{'mal_id': 1393, 'type': 'anime', 'name': 'Geno Studio', 'url': 'https://myanimelist.net/anime/producer/1393/Geno_Studio'}]","[{'mal_id': 1, 'type': 'anime', 'name': 'Action', 'url': 'https://myanimelist.net/anime/genre/1/Action'}, {'mal_id': 2, 'type': 'anime', 'name': 'Adventure', 'url': 'https://myanimelist.net/anime/genre/2/Adventure'}]",[],"[{'mal_id': 13, 'type': 'anime', 'name': 'Historical', 'url': 'https://myanimelist.net/anime/genre/13/Historical'}]","[{'mal_id': 42, 'type': 'anime', 'name': 'Seinen', 'url': 'https://myanimelist.net/anime/genre/42/Seinen'}]"
37597,https://myanimelist.net/anime/37597/Dakaretai_Otoko_1-i_ni_Odosarete_Imasu,"{'jpg': {'image_url': 'https://cdn.myanimelist.net/images/anime/1402/95620.jpg', 'small_image_url': 'https://cdn.myanimelist.net/images/anime/1402/95620t.jpg', 'large_image_url': 'https://cdn.myanimelist.net/images/anime/1402/95620l.jpg'}, 'webp': {'image_url': 'https://cdn.myanimelist.net/images/anime/1402/95620.webp', 'small_image_url': 'https://cdn.myanimelist.net/images/anime/1402/95620t.webp', 'large_image_url': 'https://cdn.myanimelist.net/images/anime/1402/95620l.webp'}}","{'youtube_id': 'y5-vN3E7k5c', 'url': 'https://www.youtube.com/watch?v=y5-vN3E7k5c', 'embed_url': 'https://www.youtube.com/embed/y5-vN3E7k5c?enablejsapi=1&wmode=opaque&autoplay=1', 'images': {'image_url': 'https://img.youtube.com/vi/y5-vN3E7k5c/default.jpg', 'small_image_url': 'https://img.youtube.com/vi/y5-vN3E7k5c/sddefault.jpg', 'medium_image_url': 'https://img.youtube.com/vi/y5-vN3E7k5c/mqdefault.jpg', 'large_image_url': 'https://img.youtube.com/vi/y5-vN3E7k5c/hqdefault.jpg', 'maximum_image_url': 'https://img.youtube.com/vi/y5-vN3E7k5c/maxresdefault.jpg'}}","""Dakaretai Otoko 1-i ni Odosarete Imasu.""",DAKAICHI -I'm being harassed by the sexiest man of the year-,抱かれたい男1位に脅されています。,"['Dakaretai Otoko Ichii ni Odosarete Imasu.', 'Dakaretai Otoko No.1 ni Odosareteimasu.']",TV,Manga,13.0,Finished Airing,False,"{'from': '2018-10-06T00:00:00+00:00', 'to': '2018-12-29T00:00:00+00:00', 'prop': {'from': {'day': 6, 'month': 10, 'year': 2018}, 'to': {'day': 29, 'month': 12, 'year': 2018}}, 'string': 'Oct 6, 2018 to Dec 29, 2018'}",23 min per ep,PG-13 - Teens 13 or older,7.41,60490.0,1931.0,1401,125566,1532,"Takato Saijou has held the title of ""Sexiest Man of the Year"" for five years running. He is an accomplished actor, with 20 years of experience under his belt, and is aware his good looks are well above average. Proud of his career, Takato regards the title as an appropriate indicator of his success. But when his reign is ended by acting newbie Junta Azumaya, who debuted only three years ago, Takato's initial shock gives way to jealous hostility. Even in the new drama that he has been cast in, Junta seems to have suddenly surpassed him; snatching Takato's usual spot of lead actor, Junta continually manages to get on his nerves. Most infuriating of all are the bright smile and kind words that accompany everything Junta does. All this animosity comes to a head, however, when Junta catches Takato in a rather vulnerable drunken state. Endangering his own public image, Takato confronts the junior actor with harsh words and angry comments—an opportunity Junta takes every advantage of. With the famous actor Takato Saijou now on video picking a fight with a co-star, Junta has the perfect means to blackmail him. Asking the price of his enemy's silence, Takato is shocked to find that his motivation lies far from advancing his career; instead, Junta's terms are those that can only be realized in the bedroom! [Written by MAL Rewrite]",,fall,2018,"{'day': 'Saturdays', 'time': '00:00', 'timezone': 'Asia/Tokyo', 'string': 'Saturdays at 00:00 (JST)'}","[{'mal_id': 17, 'type': 'anime', 'name': 'Aniplex', 'url': 'https://myanimelist.net/anime/producer/17/Aniplex'}, {'mal_id': 166, 'type': 'anime', 'name': 'Movic', 'url': 'https://myanimelist.net/anime/producer/166/Movic'}, {'mal_id': 1905, 'type': 'anime', 'name': 'Libre', 'url': 'https://myanimelist.net/anime/producer/1905/Libre'}, {'mal_id': 1906, 'type': 'anime', 'name': 'animate', 'url': 'https://myanimelist.net/anime/producer/1906/animate'}]","[{'mal_id': 493, 'type': 'anime', 'name': 'Aniplex of America', 'url': 'https://myanimelist.net/anime/producer/493/Aniplex_of_America'}]","[{'mal_id': 1835, 'type': 'anime', 'name': 'CloverWorks', 'url': 'https://myanimelist.net/anime/producer/1835/CloverWorks'}]","[{'mal_id': 28, 'type': 'anime', 'name': 'Boys Love', 'url': 'https://myanimelist.net/anime/genre/28/Boys_Love'}, {'mal_id': 4, 'type': 'anime', 'name': 'Comedy', 'url': 'https://myanimelist.net/anime/genre/4/Comedy'}, {'mal_id': 8, 'type': 'anime', 'name': 'Drama', 'url': 'https://myanimelist.net/anime/genre/8/Drama'}, {'mal_id': 22, 'type': 'anime', 'name': 'Romance', 'url': 'https://myanimelist.net/anime/genre/22/Romance'}]",[],[],[]
