mal_id,url,images,trailer,title,title_english,title_japanese,title_synonyms,type,source,episodes,status,airing,aired,duration,rating,score,scored_by,rank,popularity,members,favorites,synopsis,background,season,year,broadcast,producers,licensors,studios,genres,explicit_genres,themes,demographics
35828,https://myanimelist.net/anime/35828/Miira_no_Kaikata,"{'jpg': {'image_url': 'https://cdn.myanimelist.net/images/anime/1486/93811.jpg', 'small_image_url': 'https://cdn.myanimelist.net/images/anime/1486/93811t.jpg', 'large_image_url': 'https://cdn.myanimelist.net/images/anime/1486/93811l.jpg'}, 'webp': {'image_url': 'https://cdn.myanimelist.net/images/anime/1486/93811.webp', 'small_image_url': 'https://cdn.myanimelist.net/images/anime/1486/93811t.webp', 'large_image_url': 'https://cdn.myanimelist.net/images/anime/1486/93811l.webp'}}","{'youtube_id': 'n0-PpoSUs-M', 'url': 'https://www.youtube.com/watch?v=n0-PpoSUs-M', 'embed_url': 'https://www.youtube.com/embed/n0-PpoSUs-M?enablejsapi=1&wmode=opaque&autoplay=1', 'images': {'image_url': 'https://img.youtube.com/vi/n0-PpoSUs-M/default.jpg', 'small_image_url': 'https://img.youtube.com/vi/n0-PpoSUs-M/sddefault.jpg', 'medium_image_url': 'https://img.youtube.com/vi/n0-PpoSUs-M/mqdefault.jpg', 'large_image_url': 'https://img.youtube.com/vi/n0-PpoSUs-M/hqdefault.jpg', 'maximum_image_url': 'https://img.youtube.com/vi/n0-PpoSUs-M/maxresdefault.jpg'}}","""Miira no Kaikata""",How to Keep a Mummy,ミイラの飼い方,['How to keep a mummy'],TV,Web manga,12,Finished Airing,False,"{'from': '2018-01-12T00:00:00+00:00', 'to': '2018-03-30T00:00:00+00:00', 'prop': {'from': {'day': 12, 'month': 1, 'year': 2018}, 'to': {'day': 30, 'month': 3, 'year': 2018}}, 'string': 'Jan 12, 2018 to Mar 30, 2018'}",24 min per ep,PG-13 - Teens 13 or older,7.46,42390.0,1750.0,1501,114279,564,"High school student Sora Kashiwagi is accustomed to receiving bizarre presents from his father, who is on an expedition around the world. Unfortunately, these gifts have been nothing but nightmares. As a result, when his father sends him a huge package from Egypt, Sora prepares himself for the worst, only to be greeted by Mii-kun—a cute, pint-sized mummy! While initially wary, Sora soon learns that Mii-kun is harmless, a delicate creature yearning for attention. Throughout their amusing day-to-day lives, the unlikely pair meet other people with unique pets, while also strengthening their bond together. Although keeping a pet is a difficult task, Sora is set on caring for the lovable Mii-kun. [Written by MAL Rewrite]",,winter,2018,"{'day': 'Fridays', 'time': '01:58', 'timezone': 'Asia/Tokyo', 'string': 'Fridays at 01:58 (JST)'}","[{'mal_id': 145, 'type': 'anime', 'name': 'TBS', 'url': 'https://myanimelist.net/anime/producer/145/TBS'}, {'mal_id': 1254, 'type': 'anime', 'name': 'Grooove', 'url': 'https://myanimelist.net/anime/producer/1254/Grooove'}, {'mal_id': 1585, 'type': 'anime', 'name': 'Nichion', 'url': 'https://myanimelist.net/anime/producer/1585/Nichion'}, {'mal_id': 1594, 'type': 'anime', 'name': 'Exit Tunes', 'url': 'https://myanimelist.net/anime/producer/1594/Exit_Tunes'}, {'mal_id': 1783, 'type': 'anime', 'name': 'ONEMUSIC', 'url': 'https://myanimelist.net/anime/producer/1783/ONEMUSIC'}, {'mal_id': 1784, 'type': 'anime', 'name': 'Crunchyroll SC Anime Fund', 'url': 'https://myanimelist.net/anime/producer/1784/Crunchyroll_SC_Anime_Fund'}]",[],"[{'mal_id': 441, 'type': 'anime', 'name': '8bit', 'url': 'https://myanimelist.net/anime/producer/441/8bit'}]","[{'mal_id': 4, 'type': 'anime', 'name': 'Comedy', 'url': 'https://myanimelist.net/anime/genre/4/Comedy'}, {'mal_id': 36, 'type': 'anime', 'name': 'Slice of Life', 'url': 'https://myanimelist.net/anime/genre/36/Slice_of_Life'}, {'mal_id': 37, 'type': 'anime', 'name': 'Supernatural', 'url': 'https://myanimelist.net/anime/genre/37/Supernatural'}]",[],[],[]
33354,https://myanimelist.net/anime/33354/Cardcaptor_Sakura__Clear_Card-hen,"{'jpg': {'image_url': 'https://cdn.myanimelist.net/images/anime/1467/90338.jpg', 'small_image_url': 'https://cdn.myanimelist.net/images/anime/1467/90338t.jpg', 'large_image_url': 'https://cdn.myanimelist.net/images/anime/1467/90338l.jpg'}, 'webp': {'image_url': 'https://cdn.myanimelist.net/images/anime/1467/90338.webp', 'small_image_url': 'https://cdn.myanimelist.net/images/anime/1467/90338t.webp', 'large_image_url': 'https://cdn.myanimelist.net/images/anime/1467/90338l.webp'}}","{'youtube_id': 'HjdLsqei_aE', 'url': 'https://www.youtube.com/watch?v=HjdLsqei_aE', 'embed_url': 'https://www.youtube.com/embed/HjdLsqei_aE?enablejsapi=1&wmode=opaque&autoplay=1', 'images': {'image_url': 'https://img.youtube.com/vi/HjdLsqei_aE/default.jpg', 'small_image_url': 'https://img.youtube.com/vi/HjdLsqei_aE/sddefault.jpg', 'medium_image_url': 'https://img.youtube.com/vi/HjdLsqei_aE/mqdefault.jpg', 'large_image_url': 'https://img.youtube.com/vi/HjdLsqei_aE/hqdefault.jpg', 'maximum_image_url': 'https://img.youtube.com/vi/HjdLsqei_aE/maxresdefault.jpg'}}","""Cardcaptor Sakura: Clear Card-hen""",Cardcaptor Sakura: Clear Card,カードキャプターさくら クリアカード編,['Cardcaptor Sakura: Clear Card-hen'],TV,Manga,22,Finished Airing,False,"{'from': '2018-01-07T00:00:00+00:00', 'to': '2018-06-10T00:00:00+00:00', 'prop': {'from': {'day': 7, 'month': 1, 'year': 2018}, 'to': {'day': 10, 'month': 6, 'year': 2018}}, 'string': 'Jan 7, 2018 to Jun 10, 2018'}",25 min per ep,PG - Children,7.65,33855.0,1183.0,1610,105617,535,"With all of the Clow Cards recaptured and changed into her own Sakura Cards, Sakura Kinomoto now enters her first year at Tomoeda Middle School. After her initial day of classes, Sakura reunites with her love Shaoran Li, who informs her that he is permanently moving back to Tomoeda. Much to her surprise, it even turns out that Shaoran will attend the same school and it seems as if Sakura's life is heading in all the right directions. However, when Sakura goes to sleep, she encounters in her dream a mysterious cloaked figure and finds herself surrounded by transparent cards. Waking up in fear, Sakura is shocked to see her dream has come true, with the Sakura Cards having turned clear. Continued dreamlike encounters with the unknown enemy and her gaining a new magical key sets the stage for Cardcaptor Sakura's latest adventure! [Written by MAL Rewrite]",,winter,2018,"{'day': 'Sundays', 'time': '07:30', 'timezone': 'Asia/Tokyo', 'string': 'Sundays at 07:30 (JST)'}","[{'mal_id': 111, 'type': 'anime', 'name': 'NHK', 'url': 'https://myanimelist.net/anime/producer/111/NHK'}, {'mal_id': 159, 'type': 'anime', 'name': 'Kodansha', 'url': 'https://myanimelist.net/anime/producer/159/Kodansha'}, {'mal_id': 1797, 'type': 'anime', 'name': 'NHK Enterprises', 'url': 'https://myanimelist.net/anime/producer/1797/NHK_Enterprises'}]","[{'mal_id': 102, 'type': 'anime', 'name': 'Funimation', 'url': 'https://myanimelist.net/anime/producer/102/Funimation'}]","[{'mal_id': 11, 'type': 'anime', 'name': 'Madhouse', 'url': 'https://myanimelist.net/anime/producer/11/Madhouse'}]","[{'mal_id': 2, 'type': 'anime', 'name': 'Adventure', 'url': 'https://myanimelist.net/anime/genre/2/Adventure'}, {'mal_id': 4, 'type': 'anime', 'name': 'Comedy', 'url': 'https://myanimelist.net/anime/genre/4/Comedy'}, {'mal_id': 10, 'type': 'anime', 'name': 'Fantasy', 'url': 'https://myanimelist.net/anime/genre/10/Fantasy'}, {'mal_id': 22, 'type': 'anime', 'name': 'Romance', 'url': 'https://myanimelist.net/anime/genre/22/Romance'}]",[],[],"[{'mal_id': 25, 'type': 'anime', 'name': 'Shoujo', 'url': 'https://myanimelist.net/anime/genre/25/Shoujo'}]"
35078,https://myanimelist.net/anime/35078/Mitsuboshi_Colors,"{'jpg': {'image_url': 'https://cdn.myanimelist.net/images/anime/5/89984.jpg', 'small_image_url': 'https://cdn.myanimelist.net/images/anime/5/89984t.jpg', 'large_image_url': 'https://cdn.myanimelist.net/images/anime/5/89984l.jpg'}, 'webp': {'image_url': 'https://cdn.myanimelist.net/images/anime/5/89984.webp', 'small_image_url': 'https://cdn.myanimelist.net/images/anime/5/89984t.webp', 'large_image_url': 'https://cdn.myanimelist.net/images/anime/5/89984l.webp'}}","{'youtube_id': 'lqDhsdx_oqs', 'url': 'https://www.youtube.com/watch?v=lqDhsdx_oqs', 'embed_url': 'https://www.youtube.com/embed/lqDhsdx_oqs?enablejsapi=1&wmode=opaque&autoplay=1', 'images': {'image_url': 'https://img.youtube.com/vi/lqDhsdx_oqs/default.jpg', 'small_image_url': 'https://img.youtube.com/vi/lqDhsdx_oqs/sddefault.jpg', 'medium_image_url': 'https://img.youtube.com/vi/lqDhsdx_oqs/mqdefault.jpg', 'large_image_url': 'https://img.youtube.com/vi/lqDhsdx_oqs/hqdefault.jpg', 'maximum_image_url': 'https://img.youtube.com/vi/lqDhsdx_oqs/maxresdefault.jpg'}}","""Mitsuboshi Colors""",Mitsuboshi Colors,三ツ星カラーズ,[],TV,Manga,12,Finished Airing,False,"{'from': '2018-01-07T00:00:00+00:00', 'to': '2018-03-25T00:00:00+00:00', 'prop': {'from': {'day': 7, 'month': 1, 'year': 2018}, 'to': {'day': 25, 'month': 3, 'year': 2018}}, 'string': 'Jan 7, 2018 to Mar 25, 2018'}",23 min per ep,PG-13 - Teens 13 or older,7.42,27968.0,1896.0,1828,88109,303,"Residing within Tokyo's district of Ueno are the Colors, three individuals who protect their city by performing good deeds and aiding their community. Or, at the very least, they pretend to be the city's defenders. In reality, the Colors are just three young girls: the shy Yui Akamatsu, the noisy Sacchan, and the video game-loving Kotoha, who spend their time playing make-believe and exploring the city. The Colors' activities are facilitated by the grandfatherly Daigorou ""Pops"" Kujiraoka, who uses his store's inventory of knick-knacks to entertain the rambunctious trio. Not everyone is a fan of the Colors though. The local policeman Saitou just wants to deal with his regular duties, but he often finds himself the target of the Colors' attention, having been made the villain in most of their fantasies. But despite his personal feelings, Saitou always finds the time to go along with the three girls' games. Even though the Colors do not actually defend Ueno, they definitely help brighten everyone's day. [Written by MAL Rewrite]",,winter,2018,"{'day': 'Sundays', 'time': '22:30', 'timezone': 'Asia/Tokyo', 'string': 'Sundays at 22:30 (JST)'}","[{'mal_id': 61, 'type': 'anime', 'name': 'Frontier Works', 'url': 'https://myanimelist.net/anime/producer/61/Frontier_Works'}, {'mal_id': 166, 'type': 'anime', 'name': 'Movic', 'url': 'https://myanimelist.net/anime/producer/166/Movic'}, {'mal_id': 238, 'type': 'anime', 'name': 'AT-X', 'url': 'https://myanimelist.net/anime/producer/238/AT-X'}, {'mal_id': 1254, 'type': 'anime', 'name': 'Grooove', 'url': 'https://myanimelist.net/anime/producer/1254/Grooove'}, {'mal_id': 1333, 'type': 'anime', 'name': 'Hakuhodo DY Music & Pictures', 'url': 'https://myanimelist.net/anime/producer/1333/Hakuhodo_DY_Music___Pictures'}, {'mal_id': 1551, 'type': 'anime', 'name': 'Kadokawa Media House', 'url': 'https://myanimelist.net/anime/producer/1551/Kadokawa_Media_House'}, {'mal_id': 1696, 'type': 'anime', 'name': 'Kadokawa', 'url': 'https://myanimelist.net/anime/producer/1696/Kadokawa'}]","[{'mal_id': 376, 'type': 'anime', 'name': 'Sentai Filmworks', 'url': 'https://myanimelist.net/anime/producer/376/Sentai_Filmworks'}]","[{'mal_id': 300, 'type': 'anime', 'name': 'SILVER LINK.', 'url': 'https://myanimelist.net/anime/producer/300/SILVER_LINK'}]","[{'mal_id': 4, 'type': 'anime', 'name': 'Comedy', 'url': 'https://myanimelist.net/anime/genre/4/Comedy'}, {'mal_id': 36, 'type': 'anime', 'name': 'Slice of Life', 'url': 'https://myanimelist.net/anime/genre/36/Slice_of_Life'}]",[],[],"[{'mal_id': 27, 'type': 'anime', 'name': 'Shounen', 'url': 'https://myanimelist.net/anime/genre/27/Shounen'}]"
35540,https://myanimelist.net/anime/35540/Slow_Start,"{'jpg': {'image_url': 'https://cdn.myanimelist.net/images/anime/4/89982.jpg', 'small_image_url': 'https://cdn.myanimelist.net/images/anime/4/89982t.jpg', 'large_image_url': 'https://cdn.myanimelist.net/images/anime/4/89982l.jpg'}, 'webp': {'image_url': 'https://cdn.myanimelist.net/images/anime/4/89982.webp', 'small_image_url': 'https://cdn.myanimelist.net/images/anime/4/89982t.webp', 'large_image_url': 'https://cdn.myanimelist.net/images/anime/4/89982l.webp'}}","{'youtube_id': 'vXasQ2JTDew', 'url': 'https://www.youtube.com/watch?v=vXasQ2JTDew', 'embed_url': 'https://www.youtube.com/embed/vXasQ2JTDew?enablejsapi=1&wmode=opaque&autoplay=1', 'images': {'image_url': 'https://img.youtube.com/vi/vXasQ2JTDew/default.jpg', 'small_image_url': 'https://img.youtube.com/vi/vXasQ2JTDew/sddefault.jpg', 'medium_image_url': 'https://img.youtube.com/vi/vXasQ2JTDew/mqdefault.jpg', 'large_image_url': 'https://img.youtube.com/vi/vXasQ2JTDew/hqdefault.jpg', 'maximum_image_url': 'https://img.youtube.com/vi/vXasQ2JTDew/maxresdefault.jpg'}}","""Slow Start""",Slow Start,スロウスタート,[],TV,4-koma manga,12,Finished Airing,False,"{'from': '2018-01-07T00:00:00+00:00', 'to': '2018-03-25T00:00:00+00:00', 'prop': {'from': {'day': 7, 'month': 1, 'year': 2018}, 'to': {'day': 25, 'month': 3, 'year': 2018}}, 'string': 'Jan 7, 2018 to Mar 25, 2018'}",23 min per ep,PG-13 - Teens 13 or older,7.02,24287.0,3732.0,2050,73067,140,"Hana Ichinose, a 17-year-old high school student who is not only introverted, but also insecure and timid, has just moved and will be attending a new school. To make her situation more difficult, Hana is a ""slow start,"" which means that she missed a year and worries about attending a class where everyone is younger than her. During her introduction, the teacher reveals it is Hana's birthday, which gives her the jumping-off point to meet three of her classmates: Tamate Momochi, a charismatic and extroverted girl; Kanmuri Sengoku, who is shy and small; and the popular and pretty Eiko Tokura. Not wanting to lose the chance to make new friends, Hana's interactions with these three mark the beginning of some beautiful relationships that will change her life. [Written by MAL Rewrite]",,winter,2018,"{'day': 'Sundays', 'time': '00:30', 'timezone': 'Asia/Tokyo', 'string': 'Sundays at 00:30 (JST)'}","[{'mal_id': 17, 'type': 'anime', 'name': 'Aniplex', 'url': 'https://myanimelist.net/anime/producer/17/Aniplex'}, {'mal_id': 797, 'type': 'anime', 'name': 'Houbunsha', 'url': 'https://myanimelist.net/anime/producer/797/Houbunsha'}, {'mal_id': 1412, 'type': 'anime', 'name': 'Kansai Telecasting', 'url': 'https://myanimelist.net/anime/producer/1412/Kansai_Telecasting'}, {'mal_id': 1496, 'type': 'anime', 'name': 'Lawson', 'url': 'https://myanimelist.net/anime/producer/1496/Lawson'}, {'mal_id': 1653, 'type': 'anime', 'name': 'Kinoshita Group Holdings', 'url': 'https://myanimelist.net/anime/producer/1653/Kinoshita_Group_Holdings'}, {'mal_id': 1799, 'type': 'anime', 'name': 'Drecom', 'url': 'https://myanimelist.net/anime/producer/1799/Drecom'}]","[{'mal_id': 493, 'type': 'anime', 'name': 'Aniplex of America', 'url': 'https://myanimelist.net/anime/producer/493/Aniplex_of_America'}]","[{'mal_id': 1835, 'type': 'anime', 'name': 'CloverWorks', 'url': 'https://myanimelist.net/anime/producer/1835/CloverWorks'}]","[{'mal_id': 4, 'type': 'anime', 'name': 'Comedy', 'url': 'https://myanimelist.net/anime/genre/4/Comedy'}, {'mal_id': 36, 'type': 'anime', 'name': 'Slice of Life', 'url': 'https://myanimelist.net/anime/genre/36/Slice_of_Life'}]",[],"[{'mal_id': 23, 'type': 'anime', 'name': 'School', 'url': 'https://myanimelist.net/anime/genre/23/School'}]",[]
35589,https://myanimelist.net/anime/35589/Toji_no_Miko,"{'jpg': {'image_url': 'https://cdn.myanimelist.net/images/anime/13/89885.jpg', 'small_image_url': 'https://cdn.myanimelist.net/images/anime/13/89885t.jpg', 'large_image_url': 'https://cdn.myanimelist.net/images/anime/13/89885l.jpg'}, 'webp': {'image_url': 'https://cdn.myanimelist.net/images/anime/13/89885.webp', 'small_image_url': 'https://cdn.myanimelist.net/images/anime/13/89885t.webp', 'large_image_url': 'https://cdn.myanimelist.net/images/anime/13/89885l.webp'}}","{'youtube_id': 'q9jYltH5FVc', 'url': 'https://www.youtube.com/watch?v=q9jYltH5FVc', 'embed_url': 'https://www.youtube.com/embed/q9jYltH5FVc?enablejsapi=1&wmode=opaque&autoplay=1', 'images': {'image_url': 'https://img.youtube.com/vi/q9jYltH5FVc/default.jpg', 'small_image_url': 'https://img.youtube.com/vi/q9jYltH5FVc/sddefault.jpg', 'medium_image_url': 'https://img.youtube.com/vi/q9jYltH5FVc/mqdefault.jpg', 'large_image_url': 'https://img.youtube.com/vi/q9jYltH5FVc/hqdefault.jpg', 'maximum_image_url': 'https://img.youtube.com/vi/q9jYltH5FVc/maxresdefault.jpg'}}","""Toji no Miko""",Katana Maidens: Toji no Miko,刀使ノ巫女,"['Sword User Shrine Maiden', 'The Shrine Maiden Swordwielders']",TV,Original,24,Finished Airing,False,"{'from': '2018-01-05T00:00:00+00:00', 'to': '2018-06-22T00:00:00+00:00', 'prop': {'from': {'day': 5, 'month': 1, 'year': 2018}, 'to': {'day': 22, 'month': 6, 'year': 2018}}, 'string': 'Jan 5, 2018 to Jun 22, 2018'}",23 min per ep,PG-13 - Teens 13 or older,6.8,18469.0,4662.0,2078,71529,223,"Throughout history, an elite group of shrine maidens known as ""Toji"" have saved the world from ""Aratama,"" strange and malevolent beings bent on destroying humanity. In modern times, these warriors have been assigned to a special police squad to exterminate Aratama. The government has also set up five elite schools across the country to provide young girls the necessary sword fighting skills to eradicate these monsters and eventually join their fellow Toji in protecting the world. A student of one of those five schools, Kanami Etou is chosen to represent Minoseki Academy in a sword fighting tournament, where she meets the mysterious Hiyori Juujou. Although Kanami and Hiyori rise to the top of the tournament, their battle takes an unexpected turn, throwing the world of the Toji into chaos. Likely that the Toji are facing betrayal from within, the two are forced to flee the tournament, clashing with former comrades on the way. [Written by MAL Rewrite]",,winter,2018,"{'day': 'Fridays', 'time': '21:30', 'timezone': 'Asia/Tokyo', 'string': 'Fridays at 21:30 (JST)'}","[{'mal_id': 58, 'type': 'anime', 'name': 'Square Enix', 'url': 'https://myanimelist.net/anime/producer/58/Square_Enix'}, {'mal_id': 79, 'type': 'anime', 'name': 'Genco', 'url': 'https://myanimelist.net/anime/producer/79/Genco'}, {'mal_id': 143, 'type': 'anime', 'name': 'Mainichi Broadcasting System', 'url': 'https://myanimelist.net/anime/producer/143/Mainichi_Broadcasting_System'}, {'mal_id': 238, 'type': 'anime', 'name': 'AT-X', 'url': 'https://myanimelist.net/anime/producer/238/AT-X'}, {'mal_id': 1255, 'type': 'anime', 'name': 'Glovision', 'url': 'https://myanimelist.net/anime/producer/1255/Glovision'}, {'mal_id': 1696, 'type': 'anime', 'name': 'Kadokawa', 'url': 'https://myanimelist.net/anime/producer/1696/Kadokawa'}, {'mal_id': 1744, 'type': 'anime', 'name': 'My Theater D.D.', 'url': 'https://myanimelist.net/anime/producer/1744/My_Theater_DD'}]","[{'mal_id': 102, 'type': 'anime', 'name': 'Funimation', 'url': 'https://myanimelist.net/anime/producer/102/Funimation'}, {'mal_id': 1468, 'type': 'anime', 'name': 'Crunchyroll', 'url': 'https://myanimelist.net/anime/producer/1468/Crunchyroll'}]","[{'mal_id': 418, 'type': 'anime', 'name': 'Studio Gokumi', 'url': 'https://myanimelist.net/anime/producer/418/Studio_Gokumi'}]","[{'mal_id': 1, 'type': 'anime', 'name': 'Action', 'url': 'https://myanimelist.net/anime/genre/1/Action'}, {'mal_id': 10, 'type': 'anime', 'name': 'Fantasy', 'url': 'https://myanimelist.net/anime/genre/10/Fantasy'}]",[],[],[]
35298,https://myanimelist.net/anime/35298/Ramen_Daisuki_Koizumi-san,"{'jpg': {'image_url': 'https://cdn.myanimelist.net/images/anime/5/89876.jpg', 'small_image_url': 'https://cdn.myanimelist.net/images/anime/5/89876t.jpg', 'large_image_url': 'https://cdn.myanimelist.net/images/anime/5/89876l.jpg'}, 'webp': {'image_url': 'https://cdn.myanimelist.net/images/anime/5/89876.webp', 'small_image_url': 'https://cdn.myanimelist.net/images/anime/5/89876t.webp', 'large_image_url': 'https://cdn.myanimelist.net/images/anime/5/89876l.webp'}}","{'youtube_id': None, 'url': None, 'embed_url': None, 'images': {'image_url': None, 'small_image_url': None, 'medium_image_url': None, 'large_image_url': None, 'maximum_image_url': None}}","""Ramen Daisuki Koizumi-san""",Ms. Koizumi Loves Ramen Noodles,ラーメン大好き小泉さん,[],TV,Manga,12,Finished Airing,False,"{'from': '2018-01-04T00:00:00+00:00', 'to': '2018-03-22T00:00:00+00:00', 'prop': {'from': {'day': 4, 'month': 1, 'year': 2018}, 'to': {'day': 22, 'month': 3, 'year': 2018}}, 'string': 'Jan 4, 2018 to Mar 22, 2018'}",22 min per ep,PG-13 - Teens 13 or older,6.53,19515.0,6043.0,2400,56942,58,"From standing in the sun for hours to traveling miles away from home, gorgeous high school student Koizumi stops at nothing to fulfill her desire for ramen. But these previously solo trips soon change when Koizumi's classmate Yuu Oosawa develops an infatuation with her, and begins to join Koizumi uninvitedly on her adventures. As Yuu continues to be shocked by Koizumi's enormous appetite, she learns about the endless variety of ramen from, arguably, its greatest connoisseur ever! [Written by MAL Rewrite]",,winter,2018,"{'day': 'Thursdays', 'time': '20:00', 'timezone': 'Asia/Tokyo', 'string': 'Thursdays at 20:00 (JST)'}","[{'mal_id': 64, 'type': 'anime', 'name': 'Sotsu', 'url': 'https://myanimelist.net/anime/producer/64/Sotsu'}, {'mal_id': 460, 'type': 'anime', 'name': 'KlockWorx', 'url': 'https://myanimelist.net/anime/producer/460/KlockWorx'}, {'mal_id': 464, 'type': 'anime', 'name': 'flying DOG', 'url': 'https://myanimelist.net/anime/producer/464/flying_DOG'}, {'mal_id': 1254, 'type': 'anime', 'name': 'Grooove', 'url': 'https://myanimelist.net/anime/producer/1254/Grooove'}, {'mal_id': 1587, 'type': 'anime', 'name': 'Cygames', 'url': 'https://myanimelist.net/anime/producer/1587/Cygames'}, {'mal_id': 1784, 'type': 'anime', 'name': 'Crunchyroll SC Anime Fund', 'url': 'https://myanimelist.net/anime/producer/1784/Crunchyroll_SC_Anime_Fund'}]",[],"[{'mal_id': 418, 'type': 'anime', 'name': 'Studio Gokumi', 'url': 'https://myanimelist.net/anime/producer/418/Studio_Gokumi'}, {'mal_id': 1299, 'type': 'anime', 'name': 'AXsiZ', 'url': 'https://myanimelist.net/anime/producer/1299/AXsiZ'}]","[{'mal_id': 4, 'type': 'anime', 'name': 'Comedy', 'url': 'https://myanimelist.net/anime/genre/4/Comedy'}, {'mal_id': 47, 'type': 'anime', 'name': 'Gourmet', 'url': 'https://myanimelist.net/anime/genre/47/Gourmet'}, {'mal_id': 36, 'type': 'anime', 'name': 'Slice of Life', 'url': 'https://myanimelist.net/anime/genre/36/Slice_of_Life'}]",[],[],[]
