mal_id,url,images,trailer,title,title_english,title_japanese,title_synonyms,type,source,episodes,status,airing,aired,duration,rating,score,scored_by,rank,popularity,members,favorites,synopsis,background,season,year,broadcast,producers,licensors,studios,genres,explicit_genres,themes,demographics
33352,https://myanimelist.net/anime/33352/Violet_Evergarden,"{'jpg': {'image_url': 'https://cdn.myanimelist.net/images/anime/1795/95088.jpg', 'small_image_url': 'https://cdn.myanimelist.net/images/anime/1795/95088t.jpg', 'large_image_url': 'https://cdn.myanimelist.net/images/anime/1795/95088l.jpg'}, 'webp': {'image_url': 'https://cdn.myanimelist.net/images/anime/1795/95088.webp', 'small_image_url': 'https://cdn.myanimelist.net/images/anime/1795/95088t.webp', 'large_image_url': 'https://cdn.myanimelist.net/images/anime/1795/95088l.webp'}}","{'youtube_id': 'g5xWqjFglsk', 'url': 'https://www.youtube.com/watch?v=g5xWqjFglsk', 'embed_url': 'https://www.youtube.com/embed/g5xWqjFglsk?enablejsapi=1&wmode=opaque&autoplay=1', 'images': {'image_url': 'https://img.youtube.com/vi/g5xWqjFglsk/default.jpg', 'small_image_url': 'https://img.youtube.com/vi/g5xWqjFglsk/sddefault.jpg', 'medium_image_url': 'https://img.youtube.com/vi/g5xWqjFglsk/mqdefault.jpg', 'large_image_url': 'https://img.youtube.com/vi/g5xWqjFglsk/hqdefault.jpg', 'maximum_image_url': 'https://img.youtube.com/vi/g5xWqjFglsk/maxresdefault.jpg'}}","""Violet Evergarden""",Violet Evergarden,ヴァイオレット・エヴァーガーデン,[],TV,Light novel,13,Finished Airing,False,"{'from': '2018-01-11T00:00:00+00:00', 'to': '2018-04-05T00:00:00+00:00', 'prop': {'from': {'day': 11, 'month': 1, 'year': 2018}, 'to': {'day': 5, 'month': 4, 'year': 2018}}, 'string': 'Jan 11, 2018 to Apr 5, 2018'}",24 min per ep,PG-13 - Teens 13 or older,8.66,748767.0,57.0,51,1437263,48201,"The Great War finally came to an end after four long years of conflict; fractured in two, the continent of Telesis slowly began to flourish once again. Caught up in the bloodshed was Violet Evergarden, a young girl raised for the sole purpose of decimating enemy lines. Hospitalized and maimed in a bloody skirmish during the War's final leg, she was left with only words from the person she held dearest, but with no understanding of their meaning. Recovering from her wounds, Violet starts a new life working at CH Postal Services after a falling out with her new intended guardian family. There, she witnesses by pure chance the work of an ""Auto Memory Doll,"" amanuenses that transcribe people's thoughts and feelings into words on paper. Moved by the notion, Violet begins work as an Auto Memory Doll, a trade that will take her on an adventure, one that will reshape the lives of her clients and hopefully lead to self-discovery. [Written by MAL Rewrite]",,winter,2018,"{'day': 'Thursdays', 'time': '00:00', 'timezone': 'Asia/Tokyo', 'string': 'Thursdays at 00:00 (JST)'}","[{'mal_id': 104, 'type': 'anime', 'name': 'Lantis', 'url': 'https://myanimelist.net/anime/producer/104/Lantis'}, {'mal_id': 144, 'type': 'anime', 'name': 'Pony Canyon', 'url': 'https://myanimelist.net/anime/producer/144/Pony_Canyon'}, {'mal_id': 211, 'type': 'anime', 'name': 'Rakuonsha', 'url': 'https://myanimelist.net/anime/producer/211/Rakuonsha'}, {'mal_id': 1500, 'type': 'anime', 'name': 'ABC Animation', 'url': 'https://myanimelist.net/anime/producer/1500/ABC_Animation'}]","[{'mal_id': 102, 'type': 'anime', 'name': 'Funimation', 'url': 'https://myanimelist.net/anime/producer/102/Funimation'}]","[{'mal_id': 2, 'type': 'anime', 'name': 'Kyoto Animation', 'url': 'https://myanimelist.net/anime/producer/2/Kyoto_Animation'}]","[{'mal_id': 8, 'type': 'anime', 'name': 'Drama', 'url': 'https://myanimelist.net/anime/genre/8/Drama'}, {'mal_id': 10, 'type': 'anime', 'name': 'Fantasy', 'url': 'https://myanimelist.net/anime/genre/10/Fantasy'}, {'mal_id': 36, 'type': 'anime', 'name': 'Slice of Life', 'url': 'https://myanimelist.net/anime/genre/36/Slice_of_Life'}]",[],[],[]
35849,https://myanimelist.net/anime/35849/Darling_in_the_FranXX,"{'jpg': {'image_url': 'https://cdn.myanimelist.net/images/anime/1614/90408.jpg', 'small_image_url': 'https://cdn.myanimelist.net/images/anime/1614/90408t.jpg', 'large_image_url': 'https://cdn.myanimelist.net/images/anime/1614/90408l.jpg'}, 'webp': {'image_url': 'https://cdn.myanimelist.net/images/anime/1614/90408.webp', 'small_image_url': 'https://cdn.myanimelist.net/images/anime/1614/90408t.webp', 'large_image_url': 'https://cdn.myanimelist.net/images/anime/1614/90408l.webp'}}","{'youtube_id': 'giD4G9qlzDs', 'url': 'https://www.youtube.com/watch?v=giD4G9qlzDs', 'embed_url': 'https://www.youtube.com/embed/giD4G9qlzDs?enablejsapi=1&wmode=opaque&autoplay=1', 'images': {'image_url': 'https://img.youtube.com/vi/giD4G9qlzDs/default.jpg', 'small_image_url': 'https://img.youtube.com/vi/giD4G9qlzDs/sddefault.jpg', 'medium_image_url': 'https://img.youtube.com/vi/giD4G9qlzDs/mqdefault.jpg', 'large_image_url': 'https://img.youtube.com/vi/giD4G9qlzDs/hqdefault.jpg', 'maximum_image_url': 'https://img.youtube.com/vi/giD4G9qlzDs/maxresdefault.jpg'}}","""Darling in the FranXX""",DARLING in the FRANXX,ダーリン・イン・ザ・フランキス,[],TV,Original,24,Finished Airing,False,"{'from': '2018-01-13T00:00:00+00:00', 'to': '2018-07-07T00:00:00+00:00', 'prop': {'from': {'day': 13, 'month': 1, 'year': 2018}, 'to': {'day': 7, 'month': 7, 'year': 2018}}, 'string': 'Jan 13, 2018 to Jul 7, 2018'}",24 min per ep,PG-13 - Teens 13 or older,7.25,811049.0,2662.0,61,1361438,27874,"In the distant future, humanity has been driven to near-extinction by giant beasts known as Klaxosaurs, forcing the surviving humans to take refuge in massive fortress cities called Plantations. Children raised here are trained to pilot giant mechas known as FranXX—the only weapons known to be effective against the Klaxosaurs—in boy-girl pairs. Bred for the sole purpose of piloting these machines, these children know nothing of the outside world and are only able to prove their existence by defending their race. Hiro, an aspiring FranXX pilot, has lost his motivation and self-confidence after failing an aptitude test. Skipping out on his class' graduation ceremony, Hiro retreats to a forest lake, where he encounters a mysterious girl with two horns growing out of her head. She introduces herself by her codename Zero Two, which is known to belong to an infamous FranXX pilot known as the ""Partner Killer."" Before Hiro can digest the encounter, the Plantation is rocked by a sudden Klaxosaur attack. Zero Two engages the creature in her FranXX, but it is heavily damaged in the skirmish and crashes near Hiro. Finding her partner dead, Zero Two invites Hiro to pilot the mecha with her, and the duo easily defeats the Klaxosaur in the ensuing fight. With a new partner by his side, Hiro has been given a chance at redemption for his past failures, but at what cost? [Written by MAL Rewrite]",,winter,2018,"{'day': 'Saturdays', 'time': '23:30', 'timezone': 'Asia/Tokyo', 'string': 'Saturdays at 23:30 (JST)'}","[{'mal_id': 17, 'type': 'anime', 'name': 'Aniplex', 'url': 'https://myanimelist.net/anime/producer/17/Aniplex'}, {'mal_id': 47, 'type': 'anime', 'name': 'Khara', 'url': 'https://myanimelist.net/anime/producer/47/Khara'}, {'mal_id': 166, 'type': 'anime', 'name': 'Movic', 'url': 'https://myanimelist.net/anime/producer/166/Movic'}, {'mal_id': 539, 'type': 'anime', 'name': 'Ultra Super Pictures', 'url': 'https://myanimelist.net/anime/producer/539/Ultra_Super_Pictures'}, {'mal_id': 1123, 'type': 'anime', 'name': 'Lucent Pictures Entertainment', 'url': 'https://myanimelist.net/anime/producer/1123/Lucent_Pictures_Entertainment'}, {'mal_id': 1211, 'type': 'anime', 'name': 'Tokyo MX', 'url': 'https://myanimelist.net/anime/producer/1211/Tokyo_MX'}, {'mal_id': 1366, 'type': 'anime', 'name': 'Nagoya Broadcasting Network', 'url': 'https://myanimelist.net/anime/producer/1366/Nagoya_Broadcasting_Network'}, {'mal_id': 1415, 'type': 'anime', 'name': 'Asahi Broadcasting', 'url': 'https://myanimelist.net/anime/producer/1415/Asahi_Broadcasting'}, {'mal_id': 1416, 'type': 'anime', 'name': 'BS11', 'url': 'https://myanimelist.net/anime/producer/1416/BS11'}, {'mal_id': 1496, 'type': 'anime', 'name': 'Lawson', 'url': 'https://myanimelist.net/anime/producer/1496/Lawson'}, {'mal_id': 1500, 'type': 'anime', 'name': 'ABC Animation', 'url': 'https://myanimelist.net/anime/producer/1500/ABC_Animation'}, {'mal_id': 2018, 'type': 'anime', 'name': 'Rialto Entertainment', 'url': 'https://myanimelist.net/anime/producer/2018/Rialto_Entertainment'}]","[{'mal_id': 102, 'type': 'anime', 'name': 'Funimation', 'url': 'https://myanimelist.net/anime/producer/102/Funimation'}]","[{'mal_id': 56, 'type': 'anime', 'name': 'A-1 Pictures', 'url': 'https://myanimelist.net/anime/producer/56/A-1_Pictures'}, {'mal_id': 803, 'type': 'anime', 'name': 'Trigger', 'url': 'https://myanimelist.net/anime/producer/803/Trigger'}, {'mal_id': 1835, 'type': 'anime', 'name': 'CloverWorks', 'url': 'https://myanimelist.net/anime/producer/1835/CloverWorks'}]","[{'mal_id': 1, 'type': 'anime', 'name': 'Action', 'url': 'https://myanimelist.net/anime/genre/1/Action'}, {'mal_id': 8, 'type': 'anime', 'name': 'Drama', 'url': 'https://myanimelist.net/anime/genre/8/Drama'}, {'mal_id': 22, 'type': 'anime', 'name': 'Romance', 'url': 'https://myanimelist.net/anime/genre/22/Romance'}, {'mal_id': 24, 'type': 'anime', 'name': 'Sci-Fi', 'url': 'https://myanimelist.net/anime/genre/24/Sci-Fi'}]",[],"[{'mal_id': 18, 'type': 'anime', 'name': 'Mecha', 'url': 'https://myanimelist.net/anime/genre/18/Mecha'}]",[]
34577,https://myanimelist.net/anime/34577/Nanatsu_no_Taizai__Imashime_no_Fukkatsu,"{'jpg': {'image_url': 'https://cdn.myanimelist.net/images/anime/11/90089.jpg', 'small_image_url': 'https://cdn.myanimelist.net/images/anime/11/90089t.jpg', 'large_image_url': 'https://cdn.myanimelist.net/images/anime/11/90089l.jpg'}, 'webp': {'image_url': 'https://cdn.myanimelist.net/images/anime/11/90089.webp', 'small_image_url': 'https://cdn.myanimelist.net/images/anime/11/90089t.webp', 'large_image_url': 'https://cdn.myanimelist.net/images/anime/11/90089l.webp'}}","{'youtube_id': 'lgkv0Lqr-Iw', 'url': 'https://www.youtube.com/watch?v=lgkv0Lqr-Iw', 'embed_url': 'https://www.youtube.com/embed/lgkv0Lqr-Iw?enablejsapi=1&wmode=opaque&autoplay=1', 'images': {'image_url': 'https://img.youtube.com/vi/lgkv0Lqr-Iw/default.jpg', 'small_image_url': 'https://img.youtube.com/vi/lgkv0Lqr-Iw/sddefault.jpg', 'medium_image_url': 'https://img.youtube.com/vi/lgkv0Lqr-Iw/mqdefault.jpg', 'large_image_url': 'https://img.youtube.com/vi/lgkv0Lqr-Iw/hqdefault.jpg', 'maximum_image_url': 'https://img.youtube.com/vi/lgkv0Lqr-Iw/maxresdefault.jpg'}}","""Nanatsu no Taizai: Imashime no Fukkatsu""",The Seven Deadly Sins: Revival of the Commandments,七つの大罪 戒めの復活,[],TV,Manga,24,Finished Airing,False,"{'from': '2018-01-13T00:00:00+00:00', 'to': '2018-06-30T00:00:00+00:00', 'prop': {'from': {'day': 13, 'month': 1, 'year': 2018}, 'to': {'day': 30, 'month': 6, 'year': 2018}}, 'string': 'Jan 13, 2018 to Jun 30, 2018'}",24 min per ep,PG-13 - Teens 13 or older,7.66,587912.0,1159.0,117,964189,3732,"The fierce battle between Meliodas, the captain of the Seven Deadly Sins, and the Great Holy Knight Hendrickson has devastating consequences. Armed with the fragments necessary for the revival of the Demon Clan, Hendrickson breaks the seal, allowing the Commandments to escape, all of whom are mighty warriors working directly under the Demon King himself. Through a mysterious connection, Meliodas instantly identifies them; likewise, the 10 Commandments, too, seem to sense his presence. As the demons leave a path of destruction in their wake, the Seven Deadly Sins must find a way to stop them before the Demon Clan drowns Britannia in blood and terror. [Written by MAL Rewrite]",,winter,2018,"{'day': 'Saturdays', 'time': '06:30', 'timezone': 'Asia/Tokyo', 'string': 'Saturdays at 06:30 (JST)'}","[{'mal_id': 17, 'type': 'anime', 'name': 'Aniplex', 'url': 'https://myanimelist.net/anime/producer/17/Aniplex'}, {'mal_id': 53, 'type': 'anime', 'name': 'Dentsu', 'url': 'https://myanimelist.net/anime/producer/53/Dentsu'}, {'mal_id': 159, 'type': 'anime', 'name': 'Kodansha', 'url': 'https://myanimelist.net/anime/producer/159/Kodansha'}, {'mal_id': 166, 'type': 'anime', 'name': 'Movic', 'url': 'https://myanimelist.net/anime/producer/166/Movic'}, {'mal_id': 1345, 'type': 'anime', 'name': 'Sammy', 'url': 'https://myanimelist.net/anime/producer/1345/Sammy'}]",[],"[{'mal_id': 56, 'type': 'anime', 'name': 'A-1 Pictures', 'url': 'https://myanimelist.net/anime/producer/56/A-1_Pictures'}]","[{'mal_id': 1, 'type': 'anime', 'name': 'Action', 'url': 'https://myanimelist.net/anime/genre/1/Action'}, {'mal_id': 2, 'type': 'anime', 'name': 'Adventure', 'url': 'https://myanimelist.net/anime/genre/2/Adventure'}, {'mal_id': 10, 'type': 'anime', 'name': 'Fantasy', 'url': 'https://myanimelist.net/anime/genre/10/Fantasy'}, {'mal_id': 37, 'type': 'anime', 'name': 'Supernatural', 'url': 'https://myanimelist.net/anime/genre/37/Supernatural'}]",[],[],"[{'mal_id': 27, 'type': 'anime', 'name': 'Shounen', 'url': 'https://myanimelist.net/anime/genre/27/Shounen'}]"
35073,https://myanimelist.net/anime/35073/Overlord_II,"{'jpg': {'image_url': 'https://cdn.myanimelist.net/images/anime/1212/113415.jpg', 'small_image_url': 'https://cdn.myanimelist.net/images/anime/1212/113415t.jpg', 'large_image_url': 'https://cdn.myanimelist.net/images/anime/1212/113415l.jpg'}, 'webp': {'image_url': 'https://cdn.myanimelist.net/images/anime/1212/113415.webp', 'small_image_url': 'https://cdn.myanimelist.net/images/anime/1212/113415t.webp', 'large_image_url': 'https://cdn.myanimelist.net/images/anime/1212/113415l.webp'}}","{'youtube_id': 'p2ksX48PBQY', 'url': 'https://www.youtube.com/watch?v=p2ksX48PBQY', 'embed_url': 'https://www.youtube.com/embed/p2ksX48PBQY?enablejsapi=1&wmode=opaque&autoplay=1', 'images': {'image_url': 'https://img.youtube.com/vi/p2ksX48PBQY/default.jpg', 'small_image_url': 'https://img.youtube.com/vi/p2ksX48PBQY/sddefault.jpg', 'medium_image_url': 'https://img.youtube.com/vi/p2ksX48PBQY/mqdefault.jpg', 'large_image_url': 'https://img.youtube.com/vi/p2ksX48PBQY/hqdefault.jpg', 'maximum_image_url': 'https://img.youtube.com/vi/p2ksX48PBQY/maxresdefault.jpg'}}","""Overlord II""",Overlord II,オーバーロードⅡ,[],TV,Light novel,13,Finished Airing,False,"{'from': '2018-01-09T00:00:00+00:00', 'to': '2018-04-03T00:00:00+00:00', 'prop': {'from': {'day': 9, 'month': 1, 'year': 2018}, 'to': {'day': 3, 'month': 4, 'year': 2018}}, 'string': 'Jan 9, 2018 to Apr 3, 2018'}",23 min per ep,R - 17+ (violence & profanity),7.76,499069.0,935.0,153,817460,3726,"Ainz Ooal Gown, the undead sorcerer formerly known as Momonga, has accepted his place in this new world. Though it bears similarities to his beloved virtual reality game Yggdrasil, it still holds many mysteries which he intends to uncover, by utilizing his power as ruler of the Great Tomb of Nazarick. However, ever since the disastrous brainwashing of one of his subordinates, Ainz has become wary of the impending dangers of the Slane Theocracy, as well as the possible existence of other former Yggdrasil players. Meanwhile, Albedo, Demiurge and the rest of Ainz's loyal guardians set out to prepare for the next step in their campaign: Nazarick's first war… Overlord II picks up immediately after its prequel, continuing the story of Ainz Ooal Gown, his eclectic army of human-hating guardians, and the many hapless humans affected by the Overlord's arrival. [Written by MAL Rewrite]",Overlord adapts novels 4 to 6 of Kugane Maruyama's light novel series of the same name.,winter,2018,"{'day': 'Tuesdays', 'time': '22:30', 'timezone': 'Asia/Tokyo', 'string': 'Tuesdays at 22:30 (JST)'}","[{'mal_id': 238, 'type': 'anime', 'name': 'AT-X', 'url': 'https://myanimelist.net/anime/producer/238/AT-X'}, {'mal_id': 392, 'type': 'anime', 'name': 'Enterbrain', 'url': 'https://myanimelist.net/anime/producer/392/Enterbrain'}, {'mal_id': 1254, 'type': 'anime', 'name': 'Grooove', 'url': 'https://myanimelist.net/anime/producer/1254/Grooove'}, {'mal_id': 1333, 'type': 'anime', 'name': 'Hakuhodo DY Music & Pictures', 'url': 'https://myanimelist.net/anime/producer/1333/Hakuhodo_DY_Music___Pictures'}, {'mal_id': 1614, 'type': 'anime', 'name': 'NTT Plala', 'url': 'https://myanimelist.net/anime/producer/1614/NTT_Plala'}, {'mal_id': 1696, 'type': 'anime', 'name': 'Kadokawa', 'url': 'https://myanimelist.net/anime/producer/1696/Kadokawa'}]","[{'mal_id': 102, 'type': 'anime', 'name': 'Funimation', 'url': 'https://myanimelist.net/anime/producer/102/Funimation'}]","[{'mal_id': 11, 'type': 'anime', 'name': 'Madhouse', 'url': 'https://myanimelist.net/anime/producer/11/Madhouse'}]","[{'mal_id': 1, 'type': 'anime', 'name': 'Action', 'url': 'https://myanimelist.net/anime/genre/1/Action'}, {'mal_id': 2, 'type': 'anime', 'name': 'Adventure', 'url': 'https://myanimelist.net/anime/genre/2/Adventure'}, {'mal_id': 10, 'type': 'anime', 'name': 'Fantasy', 'url': 'https://myanimelist.net/anime/genre/10/Fantasy'}, {'mal_id': 37, 'type': 'anime', 'name': 'Supernatural', 'url': 'https://myanimelist.net/anime/genre/37/Supernatural'}]",[],"[{'mal_id': 11, 'type': 'anime', 'name': 'Game', 'url': 'https://myanimelist.net/anime/genre/11/Game'}]",[]
34612,https://myanimelist.net/anime/34612/Saiki_Kusuo_no_Ψ-nan_2,"{'jpg': {'image_url': 'https://cdn.myanimelist.net/images/anime/1961/91383.jpg', 'small_image_url': 'https://cdn.myanimelist.net/images/anime/1961/91383t.jpg', 'large_image_url': 'https://cdn.myanimelist.net/images/anime/1961/91383l.jpg'}, 'webp': {'image_url': 'https://cdn.myanimelist.net/images/anime/1961/91383.webp', 'small_image_url': 'https://cdn.myanimelist.net/images/anime/1961/91383t.webp', 'large_image_url': 'https://cdn.myanimelist.net/images/anime/1961/91383l.webp'}}","{'youtube_id': 'Aha1TjvvEUs', 'url': 'https://www.youtube.com/watch?v=Aha1TjvvEUs', 'embed_url': 'https://www.youtube.com/embed/Aha1TjvvEUs?enablejsapi=1&wmode=opaque&autoplay=1', 'images': {'image_url': 'https://img.youtube.com/vi/Aha1TjvvEUs/default.jpg', 'small_image_url': 'https://img.youtube.com/vi/Aha1TjvvEUs/sddefault.jpg', 'medium_image_url': 'https://img.youtube.com/vi/Aha1TjvvEUs/mqdefault.jpg', 'large_image_url': 'https://img.youtube.com/vi/Aha1TjvvEUs/hqdefault.jpg', 'maximum_image_url': 'https://img.youtube.com/vi/Aha1TjvvEUs/maxresdefault.jpg'}}","""Saiki Kusuo no Ψ-nan 2""",The Disastrous Life of Saiki K. 2,斉木楠雄のΨ難 2,['Saiki Kusuo no Psi Nan 2'],TV,Manga,24,Finished Airing,False,"{'from': '2018-01-17T00:00:00+00:00', 'to': '2018-06-27T00:00:00+00:00', 'prop': {'from': {'day': 17, 'month': 1, 'year': 2018}, 'to': {'day': 27, 'month': 6, 'year': 2018}}, 'string': 'Jan 17, 2018 to Jun 27, 2018'}",24 min per ep,PG-13 - Teens 13 or older,8.44,295255.0,136.0,336,510199,3618,"The disastrous life of the gifted psychic Kusuo Saiki continues, despite his utmost effort to live an ordinary life. Although he has certainly grown accustomed to dealing with his troublesome friends—who are his biggest hurdle to achieving a peaceful life—he still has a long way to go. Also joining the usual oddballs are a few new faces whose shenanigans add to Saiki's misery, making his dreams of a hassle-free life a distant fantasy. [Written by MAL Rewrite]",,winter,2018,"{'day': 'Wednesdays', 'time': '01:35', 'timezone': 'Asia/Tokyo', 'string': 'Wednesdays at 01:35 (JST)'}","[{'mal_id': 16, 'type': 'anime', 'name': 'TV Tokyo', 'url': 'https://myanimelist.net/anime/producer/16/TV_Tokyo'}, {'mal_id': 62, 'type': 'anime', 'name': 'Shogakukan-Shueisha Productions', 'url': 'https://myanimelist.net/anime/producer/62/Shogakukan-Shueisha_Productions'}, {'mal_id': 323, 'type': 'anime', 'name': 'Nippon Columbia', 'url': 'https://myanimelist.net/anime/producer/323/Nippon_Columbia'}, {'mal_id': 460, 'type': 'anime', 'name': 'KlockWorx', 'url': 'https://myanimelist.net/anime/producer/460/KlockWorx'}, {'mal_id': 517, 'type': 'anime', 'name': 'Asmik Ace', 'url': 'https://myanimelist.net/anime/producer/517/Asmik_Ace'}, {'mal_id': 1233, 'type': 'anime', 'name': 'Bandai Namco Entertainment', 'url': 'https://myanimelist.net/anime/producer/1233/Bandai_Namco_Entertainment'}, {'mal_id': 1365, 'type': 'anime', 'name': 'Shueisha', 'url': 'https://myanimelist.net/anime/producer/1365/Shueisha'}, {'mal_id': 1390, 'type': 'anime', 'name': ""Toy's Factory"", 'url': 'https://myanimelist.net/anime/producer/1390/Toys_Factory'}, {'mal_id': 1803, 'type': 'anime', 'name': 'Dear Stage inc.', 'url': 'https://myanimelist.net/anime/producer/1803/Dear_Stage_inc'}]",[],"[{'mal_id': 7, 'type': 'anime', 'name': 'J.C.Staff', 'url': 'https://myanimelist.net/anime/producer/7/JCStaff'}, {'mal_id': 1444, 'type': 'anime', 'name': 'Egg Firm', 'url': 'https://myanimelist.net/anime/producer/1444/Egg_Firm'}]","[{'mal_id': 4, 'type': 'anime', 'name': 'Comedy', 'url': 'https://myanimelist.net/anime/genre/4/Comedy'}, {'mal_id': 36, 'type': 'anime', 'name': 'Slice of Life', 'url': 'https://myanimelist.net/anime/genre/36/Slice_of_Life'}, {'mal_id': 37, 'type': 'anime', 'name': 'Supernatural', 'url': 'https://myanimelist.net/anime/genre/37/Supernatural'}]",[],"[{'mal_id': 23, 'type': 'anime', 'name': 'School', 'url': 'https://myanimelist.net/anime/genre/23/School'}]","[{'mal_id': 27, 'type': 'anime', 'name': 'Shounen', 'url': 'https://myanimelist.net/anime/genre/27/Shounen'}]"
35860,https://myanimelist.net/anime/35860/Karakai_Jouzu_no_Takagi-san,"{'jpg': {'image_url': 'https://cdn.myanimelist.net/images/anime/1591/95091.jpg', 'small_image_url': 'https://cdn.myanimelist.net/images/anime/1591/95091t.jpg', 'large_image_url': 'https://cdn.myanimelist.net/images/anime/1591/95091l.jpg'}, 'webp': {'image_url': 'https://cdn.myanimelist.net/images/anime/1591/95091.webp', 'small_image_url': 'https://cdn.myanimelist.net/images/anime/1591/95091t.webp', 'large_image_url': 'https://cdn.myanimelist.net/images/anime/1591/95091l.webp'}}","{'youtube_id': 'g4VJra3sLMg', 'url': 'https://www.youtube.com/watch?v=g4VJra3sLMg', 'embed_url': 'https://www.youtube.com/embed/g4VJra3sLMg?enablejsapi=1&wmode=opaque&autoplay=1', 'images': {'image_url': 'https://img.youtube.com/vi/g4VJra3sLMg/default.jpg', 'small_image_url': 'https://img.youtube.com/vi/g4VJra3sLMg/sddefault.jpg', 'medium_image_url': 'https://img.youtube.com/vi/g4VJra3sLMg/mqdefault.jpg', 'large_image_url': 'https://img.youtube.com/vi/g4VJra3sLMg/hqdefault.jpg', 'maximum_image_url': 'https://img.youtube.com/vi/g4VJra3sLMg/maxresdefault.jpg'}}","""Karakai Jouzu no Takagi-san""",Teasing Master Takagi-san,からかい上手の高木さん,['Skilled Teaser Takagi-san'],TV,Manga,12,Finished Airing,False,"{'from': '2018-01-08T00:00:00+00:00', 'to': '2018-03-26T00:00:00+00:00', 'prop': {'from': {'day': 8, 'month': 1, 'year': 2018}, 'to': {'day': 26, 'month': 3, 'year': 2018}}, 'string': 'Jan 8, 2018 to Mar 26, 2018'}",23 min per ep,PG-13 - Teens 13 or older,7.72,233331.0,1035.0,349,489004,4390,"Having a friend that knows you inside out should be a good thing, but in Nishikata's case, the opposite is true. His classmate Takagi loves to tease him on a daily basis, and she uses her extensive knowledge of his behavior to predict exactly how he will react to her teasing, making it nearly impossible for Nishikata to ever make a successful comeback. Despite this, Nishikata vows to someday give Takagi a taste of her own medicine by making her blush out of embarrassment from his teasing. [Written by MAL Rewrite]",,winter,2018,"{'day': 'Mondays', 'time': '23:00', 'timezone': 'Asia/Tokyo', 'string': 'Mondays at 23:00 (JST)'}","[{'mal_id': 73, 'type': 'anime', 'name': 'TMS Entertainment', 'url': 'https://myanimelist.net/anime/producer/73/TMS_Entertainment'}, {'mal_id': 142, 'type': 'anime', 'name': 'Asatsu DK', 'url': 'https://myanimelist.net/anime/producer/142/Asatsu_DK'}, {'mal_id': 517, 'type': 'anime', 'name': 'Asmik Ace', 'url': 'https://myanimelist.net/anime/producer/517/Asmik_Ace'}, {'mal_id': 1143, 'type': 'anime', 'name': 'TOHO animation', 'url': 'https://myanimelist.net/anime/producer/1143/TOHO_animation'}, {'mal_id': 1501, 'type': 'anime', 'name': 'JR East Marketing & Communications', 'url': 'https://myanimelist.net/anime/producer/1501/JR_East_Marketing___Communications'}]","[{'mal_id': 102, 'type': 'anime', 'name': 'Funimation', 'url': 'https://myanimelist.net/anime/producer/102/Funimation'}]","[{'mal_id': 247, 'type': 'anime', 'name': 'Shin-Ei Animation', 'url': 'https://myanimelist.net/anime/producer/247/Shin-Ei_Animation'}]","[{'mal_id': 4, 'type': 'anime', 'name': 'Comedy', 'url': 'https://myanimelist.net/anime/genre/4/Comedy'}, {'mal_id': 22, 'type': 'anime', 'name': 'Romance', 'url': 'https://myanimelist.net/anime/genre/22/Romance'}, {'mal_id': 36, 'type': 'anime', 'name': 'Slice of Life', 'url': 'https://myanimelist.net/anime/genre/36/Slice_of_Life'}]",[],"[{'mal_id': 23, 'type': 'anime', 'name': 'School', 'url': 'https://myanimelist.net/anime/genre/23/School'}]","[{'mal_id': 27, 'type': 'anime', 'name': 'Shounen', 'url': 'https://myanimelist.net/anime/genre/27/Shounen'}]"
