mal_id,url,images,trailer,title,title_english,title_japanese,title_synonyms,type,source,episodes,status,airing,aired,duration,rating,score,scored_by,rank,popularity,members,favorites,synopsis,background,season,year,broadcast,producers,licensors,studios,genres,explicit_genres,themes,demographics
34279,https://myanimelist.net/anime/34279/Grancrest_Senki,"{'jpg': {'image_url': 'https://cdn.myanimelist.net/images/anime/4/89883.jpg', 'small_image_url': 'https://cdn.myanimelist.net/images/anime/4/89883t.jpg', 'large_image_url': 'https://cdn.myanimelist.net/images/anime/4/89883l.jpg'}, 'webp': {'image_url': 'https://cdn.myanimelist.net/images/anime/4/89883.webp', 'small_image_url': 'https://cdn.myanimelist.net/images/anime/4/89883t.webp', 'large_image_url': 'https://cdn.myanimelist.net/images/anime/4/89883l.webp'}}","{'youtube_id': '6NJ9Lfqnals', 'url': 'https://www.youtube.com/watch?v=6NJ9Lfqnals', 'embed_url': 'https://www.youtube.com/embed/6NJ9Lfqnals?enablejsapi=1&wmode=opaque&autoplay=1', 'images': {'image_url': 'https://img.youtube.com/vi/6NJ9Lfqnals/default.jpg', 'small_image_url': 'https://img.youtube.com/vi/6NJ9Lfqnals/sddefault.jpg', 'medium_image_url': 'https://img.youtube.com/vi/6NJ9Lfqnals/mqdefault.jpg', 'large_image_url': 'https://img.youtube.com/vi/6NJ9Lfqnals/hqdefault.jpg', 'maximum_image_url': 'https://img.youtube.com/vi/6NJ9Lfqnals/maxresdefault.jpg'}}","""Grancrest Senki""",Record of Grancrest War,グランクレスト戦記,[],TV,Light novel,24,Finished Airing,False,"{'from': '2018-01-06T00:00:00+00:00', 'to': '2018-06-23T00:00:00+00:00', 'prop': {'from': {'day': 6, 'month': 1, 'year': 2018}, 'to': {'day': 23, 'month': 6, 'year': 2018}}, 'string': 'Jan 6, 2018 to Jun 23, 2018'}",23 min per ep,R - 17+ (violence & profanity),7.23,104237.0,2753.0,720,260705,1106,"The continent of Atlatan once again finds itself devoured by the flames of war after a horrific event known as the Great Hall Tragedy. What was supposed to be a joyful occasion that would establish peace between the Fantasia Union and the Factory Alliance, the marriage of Sir Alexis Douse and Lady Marrine Kreische, was instead a tragedy. As the bride and groom walked down the aisle, the ceremony was suddenly interrupted by a powerful convergence of ""Chaos,"" a dark energy from another dimension that corrupts the land and brings forth monsters and demons into the world. From within that energy appeared the Demon Lord of Diabolos, an evil being who instantly murdered the archdukes of both factions, shattering any hope for peace between them. Having failed to prevent this disaster, Siluca Meletes, an Alliance mage, is traveling through the Chaos-infested countryside to study under a master magician. When she is intercepted by a group of soldiers working with the Federation, Siluca is rescued by Theo Cornaro, a young warrior carrying a mysterious ""Crest,"" a magical symbol that gives its wielder the ability to banish Chaos. Bearing no allegiance to a specific domain, Theo hopes to attain the rank of Lord so that he can liberate his home town of Sistina from its tyrannical ruler and the Chaos spreading within it. Impressed by his noble goal, Siluca enters into a magical contract with Theo, and the two embark on a journey to restore balance to their war-torn land. [Written by MAL Rewrite]",,winter,2018,"{'day': 'Saturdays', 'time': '00:00', 'timezone': 'Asia/Tokyo', 'string': 'Saturdays at 00:00 (JST)'}","[{'mal_id': 17, 'type': 'anime', 'name': 'Aniplex', 'url': 'https://myanimelist.net/anime/producer/17/Aniplex'}, {'mal_id': 1233, 'type': 'anime', 'name': 'Bandai Namco Entertainment', 'url': 'https://myanimelist.net/anime/producer/1233/Bandai_Namco_Entertainment'}, {'mal_id': 1261, 'type': 'anime', 'name': 'Good Smile Company', 'url': 'https://myanimelist.net/anime/producer/1261/Good_Smile_Company'}, {'mal_id': 1416, 'type': 'anime', 'name': 'BS11', 'url': 'https://myanimelist.net/anime/producer/1416/BS11'}, {'mal_id': 1500, 'type': 'anime', 'name': 'ABC Animation', 'url': 'https://myanimelist.net/anime/producer/1500/ABC_Animation'}, {'mal_id': 1653, 'type': 'anime', 'name': 'Kinoshita Group Holdings', 'url': 'https://myanimelist.net/anime/producer/1653/Kinoshita_Group_Holdings'}, {'mal_id': 1696, 'type': 'anime', 'name': 'Kadokawa', 'url': 'https://myanimelist.net/anime/producer/1696/Kadokawa'}, {'mal_id': 1788, 'type': 'anime', 'name': 'Cromea', 'url': 'https://myanimelist.net/anime/producer/1788/Cromea'}, {'mal_id': 1858, 'type': 'anime', 'name': 'Sonilude', 'url': 'https://myanimelist.net/anime/producer/1858/Sonilude'}]","[{'mal_id': 493, 'type': 'anime', 'name': 'Aniplex of America', 'url': 'https://myanimelist.net/anime/producer/493/Aniplex_of_America'}]","[{'mal_id': 56, 'type': 'anime', 'name': 'A-1 Pictures', 'url': 'https://myanimelist.net/anime/producer/56/A-1_Pictures'}]","[{'mal_id': 1, 'type': 'anime', 'name': 'Action', 'url': 'https://myanimelist.net/anime/genre/1/Action'}, {'mal_id': 8, 'type': 'anime', 'name': 'Drama', 'url': 'https://myanimelist.net/anime/genre/8/Drama'}, {'mal_id': 10, 'type': 'anime', 'name': 'Fantasy', 'url': 'https://myanimelist.net/anime/genre/10/Fantasy'}, {'mal_id': 22, 'type': 'anime', 'name': 'Romance', 'url': 'https://myanimelist.net/anime/genre/22/Romance'}]",[],[],[]
34984,https://myanimelist.net/anime/34984/Koi_wa_Ameagari_no_You_ni,"{'jpg': {'image_url': 'https://cdn.myanimelist.net/images/anime/1271/90136.jpg', 'small_image_url': 'https://cdn.myanimelist.net/images/anime/1271/90136t.jpg', 'large_image_url': 'https://cdn.myanimelist.net/images/anime/1271/90136l.jpg'}, 'webp': {'image_url': 'https://cdn.myanimelist.net/images/anime/1271/90136.webp', 'small_image_url': 'https://cdn.myanimelist.net/images/anime/1271/90136t.webp', 'large_image_url': 'https://cdn.myanimelist.net/images/anime/1271/90136l.webp'}}","{'youtube_id': 'EHLYugCBtjs', 'url': 'https://www.youtube.com/watch?v=EHLYugCBtjs', 'embed_url': 'https://www.youtube.com/embed/EHLYugCBtjs?enablejsapi=1&wmode=opaque&autoplay=1', 'images': {'image_url': 'https://img.youtube.com/vi/EHLYugCBtjs/default.jpg', 'small_image_url': 'https://img.youtube.com/vi/EHLYugCBtjs/sddefault.jpg', 'medium_image_url': 'https://img.youtube.com/vi/EHLYugCBtjs/mqdefault.jpg', 'large_image_url': 'https://img.youtube.com/vi/EHLYugCBtjs/hqdefault.jpg', 'maximum_image_url': 'https://img.youtube.com/vi/EHLYugCBtjs/maxresdefault.jpg'}}","""Koi wa Ameagari no You ni""",After the Rain,恋は雨上がりのように,"['Koi wa Amaagari no You ni', 'Love is Like after the Rain', 'KoiAme']",TV,Manga,12,Finished Airing,False,"{'from': '2018-01-12T00:00:00+00:00', 'to': '2018-03-30T00:00:00+00:00', 'prop': {'from': {'day': 12, 'month': 1, 'year': 2018}, 'to': {'day': 30, 'month': 3, 'year': 2018}}, 'string': 'Jan 12, 2018 to Mar 30, 2018'}",22 min per ep,PG-13 - Teens 13 or older,7.51,98925.0,1610.0,753,249998,1287,"Akira Tachibana, a reserved high school student and former track runner, has not been able to race the same as she used to since she experienced a severe foot injury. And although she is regarded as attractive by her classmates, she is not interested in the boys around school. While working part-time at the Garden Cafe, Akira begins to develop feelings for the manager—a 45-year-old man named Masami Kondou—despite the large age gap. Kondou shows genuine concern and kindness toward the customers of his restaurant, which, while viewed by others as soft or weak, draws Akira to him. Spending time together at the restaurant, they grow closer, which only strengthens her feelings. Weighed down by these uncertain emotions, Akira finally resolves to confess, but what will be the result? [Written by MAL Rewrite]",,winter,2018,"{'day': 'Fridays', 'time': '00:55', 'timezone': 'Asia/Tokyo', 'string': 'Fridays at 00:55 (JST)'}","[{'mal_id': 17, 'type': 'anime', 'name': 'Aniplex', 'url': 'https://myanimelist.net/anime/producer/17/Aniplex'}, {'mal_id': 53, 'type': 'anime', 'name': 'Dentsu', 'url': 'https://myanimelist.net/anime/producer/53/Dentsu'}, {'mal_id': 169, 'type': 'anime', 'name': 'Fuji TV', 'url': 'https://myanimelist.net/anime/producer/169/Fuji_TV'}, {'mal_id': 1671, 'type': 'anime', 'name': 'DMM pictures', 'url': 'https://myanimelist.net/anime/producer/1671/DMM_pictures'}]","[{'mal_id': 376, 'type': 'anime', 'name': 'Sentai Filmworks', 'url': 'https://myanimelist.net/anime/producer/376/Sentai_Filmworks'}]","[{'mal_id': 858, 'type': 'anime', 'name': 'Wit Studio', 'url': 'https://myanimelist.net/anime/producer/858/Wit_Studio'}]","[{'mal_id': 8, 'type': 'anime', 'name': 'Drama', 'url': 'https://myanimelist.net/anime/genre/8/Drama'}, {'mal_id': 22, 'type': 'anime', 'name': 'Romance', 'url': 'https://myanimelist.net/anime/genre/22/Romance'}, {'mal_id': 36, 'type': 'anime', 'name': 'Slice of Life', 'url': 'https://myanimelist.net/anime/genre/36/Slice_of_Life'}]",[],[],"[{'mal_id': 42, 'type': 'anime', 'name': 'Seinen', 'url': 'https://myanimelist.net/anime/genre/42/Seinen'}]"
35330,https://myanimelist.net/anime/35330/Poputepipikku,"{'jpg': {'image_url': 'https://cdn.myanimelist.net/images/anime/3/88816.jpg', 'small_image_url': 'https://cdn.myanimelist.net/images/anime/3/88816t.jpg', 'large_image_url': 'https://cdn.myanimelist.net/images/anime/3/88816l.jpg'}, 'webp': {'image_url': 'https://cdn.myanimelist.net/images/anime/3/88816.webp', 'small_image_url': 'https://cdn.myanimelist.net/images/anime/3/88816t.webp', 'large_image_url': 'https://cdn.myanimelist.net/images/anime/3/88816l.webp'}}","{'youtube_id': 'xnOHKecWTJY', 'url': 'https://www.youtube.com/watch?v=xnOHKecWTJY', 'embed_url': 'https://www.youtube.com/embed/xnOHKecWTJY?enablejsapi=1&wmode=opaque&autoplay=1', 'images': {'image_url': 'https://img.youtube.com/vi/xnOHKecWTJY/default.jpg', 'small_image_url': 'https://img.youtube.com/vi/xnOHKecWTJY/sddefault.jpg', 'medium_image_url': 'https://img.youtube.com/vi/xnOHKecWTJY/mqdefault.jpg', 'large_image_url': 'https://img.youtube.com/vi/xnOHKecWTJY/hqdefault.jpg', 'maximum_image_url': 'https://img.youtube.com/vi/xnOHKecWTJY/maxresdefault.jpg'}}","""Poputepipikku""",Pop Team Epic,ポプテピピック,"['PPTP', 'Poptepipic']",TV,4-koma manga,12,Finished Airing,False,"{'from': '2018-01-07T00:00:00+00:00', 'to': '2018-03-25T00:00:00+00:00', 'prop': {'from': {'day': 7, 'month': 1, 'year': 2018}, 'to': {'day': 25, 'month': 3, 'year': 2018}}, 'string': 'Jan 7, 2018 to Mar 25, 2018'}",12 min per ep,PG-13 - Teens 13 or older,7.27,86505.0,2583.0,970,193478,1154,"Poputepipikku turns absurdist comedy up to eleven with its pop culture references and surreal hilarity. With two bonafide high school girl protagonists—the short and exceptionally quick to anger Popuko, and the tall and unshakably calm Pipimi—they throw genres against the wall and don't wait to see what sticks. Parody is interlaced with drama, action, crudeness, and the show's overarching goal—to become a real anime. [Written by MAL Rewrite]",Poputepipikku is based on bkub Ookawa's 4-koma manga series of the same title. Each episode consists of a 12-minute segment repeated twice. The repeated segment contains a different voiceover by another voice actor with variations on the skits.,winter,2018,"{'day': 'Sundays', 'time': '01:00', 'timezone': 'Asia/Tokyo', 'string': 'Sundays at 01:00 (JST)'}","[{'mal_id': 1344, 'type': 'anime', 'name': 'King Records', 'url': 'https://myanimelist.net/anime/producer/1344/King_Records'}, {'mal_id': 2272, 'type': 'anime', 'name': 'AC-Bu', 'url': 'https://myanimelist.net/anime/producer/2272/AC-Bu'}]","[{'mal_id': 102, 'type': 'anime', 'name': 'Funimation', 'url': 'https://myanimelist.net/anime/producer/102/Funimation'}, {'mal_id': 376, 'type': 'anime', 'name': 'Sentai Filmworks', 'url': 'https://myanimelist.net/anime/producer/376/Sentai_Filmworks'}]","[{'mal_id': 437, 'type': 'anime', 'name': 'Kamikaze Douga', 'url': 'https://myanimelist.net/anime/producer/437/Kamikaze_Douga'}]","[{'mal_id': 4, 'type': 'anime', 'name': 'Comedy', 'url': 'https://myanimelist.net/anime/genre/4/Comedy'}]",[],"[{'mal_id': 20, 'type': 'anime', 'name': 'Parody', 'url': 'https://myanimelist.net/anime/genre/20/Parody'}]",[]
33047,https://myanimelist.net/anime/33047/Fate_Extra__Last_Encore,"{'jpg': {'image_url': 'https://cdn.myanimelist.net/images/anime/1122/90836.jpg', 'small_image_url': 'https://cdn.myanimelist.net/images/anime/1122/90836t.jpg', 'large_image_url': 'https://cdn.myanimelist.net/images/anime/1122/90836l.jpg'}, 'webp': {'image_url': 'https://cdn.myanimelist.net/images/anime/1122/90836.webp', 'small_image_url': 'https://cdn.myanimelist.net/images/anime/1122/90836t.webp', 'large_image_url': 'https://cdn.myanimelist.net/images/anime/1122/90836l.webp'}}","{'youtube_id': 'mM0el2bZFt4', 'url': 'https://www.youtube.com/watch?v=mM0el2bZFt4', 'embed_url': 'https://www.youtube.com/embed/mM0el2bZFt4?enablejsapi=1&wmode=opaque&autoplay=1', 'images': {'image_url': 'https://img.youtube.com/vi/mM0el2bZFt4/default.jpg', 'small_image_url': 'https://img.youtube.com/vi/mM0el2bZFt4/sddefault.jpg', 'medium_image_url': 'https://img.youtube.com/vi/mM0el2bZFt4/mqdefault.jpg', 'large_image_url': 'https://img.youtube.com/vi/mM0el2bZFt4/hqdefault.jpg', 'maximum_image_url': 'https://img.youtube.com/vi/mM0el2bZFt4/maxresdefault.jpg'}}","""Fate/Extra: Last Encore""",Fate/Extra: Last Encore,Fate/EXTRA Last Encore,[],TV,Game,10,Finished Airing,False,"{'from': '2018-01-28T00:00:00+00:00', 'to': '2018-04-01T00:00:00+00:00', 'prop': {'from': {'day': 28, 'month': 1, 'year': 2018}, 'to': {'day': 1, 'month': 4, 'year': 2018}}, 'string': 'Jan 28, 2018 to Apr 1, 2018'}",24 min per ep,R - 17+ (violence & profanity),6.28,81382.0,7322.0,971,193246,450,"A technological hell masquerading as paradise, Tsukimihara Academy is an artificial high school that serves as the setting for the next Holy Grail War. Created by the Moon Cell computer, the school is inhabited by Earth-projected souls who have even the slightest aptitude for being a ""Master."" Of these 256 souls, 128 will be chosen for the main tournament and granted a Servant. With all of the Masters selected, the Academy activates a purge, targeting the remaining lifeforms for elimination. Awakening in a pool of his own blood, Hakuno Kishinami refuses to die. Fueled by unknown feelings of hatred, he vows to fight for survival. As he struggles to escape from a relentless pursuer, he finds a crimson blade plunged into the ground; and by pulling it out, Hakuno summons his own Servant, Saber, who instantly destroys his pursuer in a flurry of rose petals. With his newfound power, Hakuno must now begin his journey to Moon Cell's core, the Angelica Cage. There, he will unveil the reason for this artificial world and the secrets of his own blood-soaked past. [Written by MAL Rewrite]",,winter,2018,"{'day': 'Sundays', 'time': '00:00', 'timezone': 'Asia/Tokyo', 'string': 'Sundays at 00:00 (JST)'}","[{'mal_id': 17, 'type': 'anime', 'name': 'Aniplex', 'url': 'https://myanimelist.net/anime/producer/17/Aniplex'}, {'mal_id': 82, 'type': 'anime', 'name': 'Marvelous', 'url': 'https://myanimelist.net/anime/producer/82/Marvelous'}, {'mal_id': 703, 'type': 'anime', 'name': 'Notes', 'url': 'https://myanimelist.net/anime/producer/703/Notes'}]",[],"[{'mal_id': 44, 'type': 'anime', 'name': 'Shaft', 'url': 'https://myanimelist.net/anime/producer/44/Shaft'}]","[{'mal_id': 1, 'type': 'anime', 'name': 'Action', 'url': 'https://myanimelist.net/anime/genre/1/Action'}, {'mal_id': 10, 'type': 'anime', 'name': 'Fantasy', 'url': 'https://myanimelist.net/anime/genre/10/Fantasy'}]",[],[],[]
36838,https://myanimelist.net/anime/36838/Gintama__Shirogane_no_Tamashii-hen,"{'jpg': {'image_url': 'https://cdn.myanimelist.net/images/anime/12/89603.jpg', 'small_image_url': 'https://cdn.myanimelist.net/images/anime/12/89603t.jpg', 'large_image_url': 'https://cdn.myanimelist.net/images/anime/12/89603l.jpg'}, 'webp': {'image_url': 'https://cdn.myanimelist.net/images/anime/12/89603.webp', 'small_image_url': 'https://cdn.myanimelist.net/images/anime/12/89603t.webp', 'large_image_url': 'https://cdn.myanimelist.net/images/anime/12/89603l.webp'}}","{'youtube_id': 'vcb-D3FlaCg', 'url': 'https://www.youtube.com/watch?v=vcb-D3FlaCg', 'embed_url': 'https://www.youtube.com/embed/vcb-D3FlaCg?enablejsapi=1&wmode=opaque&autoplay=1', 'images': {'image_url': 'https://img.youtube.com/vi/vcb-D3FlaCg/default.jpg', 'small_image_url': 'https://img.youtube.com/vi/vcb-D3FlaCg/sddefault.jpg', 'medium_image_url': 'https://img.youtube.com/vi/vcb-D3FlaCg/mqdefault.jpg', 'large_image_url': 'https://img.youtube.com/vi/vcb-D3FlaCg/hqdefault.jpg', 'maximum_image_url': 'https://img.youtube.com/vi/vcb-D3FlaCg/maxresdefault.jpg'}}","""Gintama.: Shirogane no Tamashii-hen""",Gintama.: Silver Soul Arc,銀魂. 銀ノ魂篇,[],TV,Manga,12,Finished Airing,False,"{'from': '2018-01-08T00:00:00+00:00', 'to': '2018-03-26T00:00:00+00:00', 'prop': {'from': {'day': 8, 'month': 1, 'year': 2018}, 'to': {'day': 26, 'month': 3, 'year': 2018}}, 'string': 'Jan 8, 2018 to Mar 26, 2018'}",24 min per ep,PG-13 - Teens 13 or older,8.82,79905.0,27.0,1088,169200,1042,"After the fierce battle on Rakuyou, the untold past and true goal of the immortal Naraku leader, Utsuro, are finally revealed. By corrupting the Altana reserves of several planets, Utsuro has successfully triggered the intervention of the Tendoshuu’s greatest enemy: the Altana Liberation Army. With Earth as the main battleground in this interplanetary war, Utsuro's master plan to destroy the planet—and himself—is nearly complete. An attack on the O-Edo Central Terminal marks the beginning of the final battle to take back the land of the samurai. With the Yorozuya nowhere in sight, the bakufu all but collapsed, and the Shogun missing, the people are left completely helpless as the Liberation Army begins pillaging Edo in the name of freeing them from the Tendoshuu's rule. Caught in the crossfire between two equally imposing forces, can Gintoki, Kagura, Shinpachi, and the former students of Shouyou Yoshida put aside their differences and unite their allies to protect what they hold dear? [Written by MAL Rewrite]",This is the first season of Gintama's final arc and the seventh season of Gintama's continuity. In the episode continuity this corresponds to episodes 342-353 of Gintama.,winter,2018,"{'day': 'Mondays', 'time': '01:35', 'timezone': 'Asia/Tokyo', 'string': 'Mondays at 01:35 (JST)'}","[{'mal_id': 16, 'type': 'anime', 'name': 'TV Tokyo', 'url': 'https://myanimelist.net/anime/producer/16/TV_Tokyo'}, {'mal_id': 17, 'type': 'anime', 'name': 'Aniplex', 'url': 'https://myanimelist.net/anime/producer/17/Aniplex'}, {'mal_id': 53, 'type': 'anime', 'name': 'Dentsu', 'url': 'https://myanimelist.net/anime/producer/53/Dentsu'}, {'mal_id': 1365, 'type': 'anime', 'name': 'Shueisha', 'url': 'https://myanimelist.net/anime/producer/1365/Shueisha'}]",[],"[{'mal_id': 1258, 'type': 'anime', 'name': 'Bandai Namco Pictures', 'url': 'https://myanimelist.net/anime/producer/1258/Bandai_Namco_Pictures'}]","[{'mal_id': 1, 'type': 'anime', 'name': 'Action', 'url': 'https://myanimelist.net/anime/genre/1/Action'}, {'mal_id': 4, 'type': 'anime', 'name': 'Comedy', 'url': 'https://myanimelist.net/anime/genre/4/Comedy'}, {'mal_id': 24, 'type': 'anime', 'name': 'Sci-Fi', 'url': 'https://myanimelist.net/anime/genre/24/Sci-Fi'}]",[],"[{'mal_id': 13, 'type': 'anime', 'name': 'Historical', 'url': 'https://myanimelist.net/anime/genre/13/Historical'}, {'mal_id': 20, 'type': 'anime', 'name': 'Parody', 'url': 'https://myanimelist.net/anime/genre/20/Parody'}, {'mal_id': 21, 'type': 'anime', 'name': 'Samurai', 'url': 'https://myanimelist.net/anime/genre/21/Samurai'}]","[{'mal_id': 27, 'type': 'anime', 'name': 'Shounen', 'url': 'https://myanimelist.net/anime/genre/27/Shounen'}]"
35905,https://myanimelist.net/anime/35905/Ryuuou_no_Oshigoto,"{'jpg': {'image_url': 'https://cdn.myanimelist.net/images/anime/12/89979.jpg', 'small_image_url': 'https://cdn.myanimelist.net/images/anime/12/89979t.jpg', 'large_image_url': 'https://cdn.myanimelist.net/images/anime/12/89979l.jpg'}, 'webp': {'image_url': 'https://cdn.myanimelist.net/images/anime/12/89979.webp', 'small_image_url': 'https://cdn.myanimelist.net/images/anime/12/89979t.webp', 'large_image_url': 'https://cdn.myanimelist.net/images/anime/12/89979l.webp'}}","{'youtube_id': 'jrqE_yU4FKI', 'url': 'https://www.youtube.com/watch?v=jrqE_yU4FKI', 'embed_url': 'https://www.youtube.com/embed/jrqE_yU4FKI?enablejsapi=1&wmode=opaque&autoplay=1', 'images': {'image_url': 'https://img.youtube.com/vi/jrqE_yU4FKI/default.jpg', 'small_image_url': 'https://img.youtube.com/vi/jrqE_yU4FKI/sddefault.jpg', 'medium_image_url': 'https://img.youtube.com/vi/jrqE_yU4FKI/mqdefault.jpg', 'large_image_url': 'https://img.youtube.com/vi/jrqE_yU4FKI/hqdefault.jpg', 'maximum_image_url': 'https://img.youtube.com/vi/jrqE_yU4FKI/maxresdefault.jpg'}}","""Ryuuou no Oshigoto!""",The Ryuo's Work is Never Done!,りゅうおうのおしごと！,[],TV,Light novel,12,Finished Airing,False,"{'from': '2018-01-08T00:00:00+00:00', 'to': '2018-03-26T00:00:00+00:00', 'prop': {'from': {'day': 8, 'month': 1, 'year': 2018}, 'to': {'day': 26, 'month': 3, 'year': 2018}}, 'string': 'Jan 8, 2018 to Mar 26, 2018'}",23 min per ep,PG-13 - Teens 13 or older,6.87,69854.0,4369.0,1098,167944,307,"Shogi, a Japanese game similar to chess, is one of the most popular board games in the country, played by everyone from children to the elderly. Some players are talented enough to take the game to a professional level. The title of Ryuuou, meaning ""the dragon king,"" is only awarded to the person who reaches the pinnacle of competitive shogi. Yaichi Kuzuryuu has just become the youngest Ryuuou after winning the grand championship. However, the shogi community is unwelcoming to his victory, some even calling him the worst Ryuuou in history. Moreover, he forgets about the agreement he made with Ai Hinatsuru, a little girl he promised to coach if he won. After she shows up at his doorstep, he reluctantly agrees to uphold his promise and makes Ai his disciple. Together, they aim to improve and exceed the limits of their shogi prowess: Ai, to unlock her hidden talents; Yaichi, to prove to the world that he deserves his accomplishments. [Written by MAL Rewrite]",,winter,2018,"{'day': 'Mondays', 'time': '22:00', 'timezone': 'Asia/Tokyo', 'string': 'Mondays at 22:00 (JST)'}","[{'mal_id': 238, 'type': 'anime', 'name': 'AT-X', 'url': 'https://myanimelist.net/anime/producer/238/AT-X'}, {'mal_id': 306, 'type': 'anime', 'name': 'Magic Capsule', 'url': 'https://myanimelist.net/anime/producer/306/Magic_Capsule'}, {'mal_id': 323, 'type': 'anime', 'name': 'Nippon Columbia', 'url': 'https://myanimelist.net/anime/producer/323/Nippon_Columbia'}, {'mal_id': 460, 'type': 'anime', 'name': 'KlockWorx', 'url': 'https://myanimelist.net/anime/producer/460/KlockWorx'}, {'mal_id': 843, 'type': 'anime', 'name': 'BS Fuji', 'url': 'https://myanimelist.net/anime/producer/843/BS_Fuji'}, {'mal_id': 1211, 'type': 'anime', 'name': 'Tokyo MX', 'url': 'https://myanimelist.net/anime/producer/1211/Tokyo_MX'}, {'mal_id': 1333, 'type': 'anime', 'name': 'Hakuhodo DY Music & Pictures', 'url': 'https://myanimelist.net/anime/producer/1333/Hakuhodo_DY_Music___Pictures'}, {'mal_id': 1631, 'type': 'anime', 'name': 'Radio Osaka', 'url': 'https://myanimelist.net/anime/producer/1631/Radio_Osaka'}, {'mal_id': 1801, 'type': 'anime', 'name': 'Aquamarine', 'url': 'https://myanimelist.net/anime/producer/1801/Aquamarine'}, {'mal_id': 2090, 'type': 'anime', 'name': 'Dream Shift', 'url': 'https://myanimelist.net/anime/producer/2090/Dream_Shift'}]",[],"[{'mal_id': 439, 'type': 'anime', 'name': 'Project No.9', 'url': 'https://myanimelist.net/anime/producer/439/Project_No9'}]","[{'mal_id': 4, 'type': 'anime', 'name': 'Comedy', 'url': 'https://myanimelist.net/anime/genre/4/Comedy'}, {'mal_id': 36, 'type': 'anime', 'name': 'Slice of Life', 'url': 'https://myanimelist.net/anime/genre/36/Slice_of_Life'}]",[],"[{'mal_id': 11, 'type': 'anime', 'name': 'Game', 'url': 'https://myanimelist.net/anime/genre/11/Game'}]",[]
