mal_id,url,images,trailer,title,title_english,title_japanese,title_synonyms,type,source,episodes,status,airing,aired,duration,rating,score,scored_by,rank,popularity,members,favorites,synopsis,background,season,year,broadcast,producers,licensors,studios,genres,explicit_genres,themes,demographics
37450,https://myanimelist.net/anime/37450/Seishun_Buta_Yarou_wa_Bunny_Girl_Senpai_no_Yume_wo_Minai,"{'jpg': {'image_url': 'https://cdn.myanimelist.net/images/anime/1301/93586.jpg', 'small_image_url': 'https://cdn.myanimelist.net/images/anime/1301/93586t.jpg', 'large_image_url': 'https://cdn.myanimelist.net/images/anime/1301/93586l.jpg'}, 'webp': {'image_url': 'https://cdn.myanimelist.net/images/anime/1301/93586.webp', 'small_image_url': 'https://cdn.myanimelist.net/images/anime/1301/93586t.webp', 'large_image_url': 'https://cdn.myanimelist.net/images/anime/1301/93586l.webp'}}","{'youtube_id': 'ku7XxxXpIKI', 'url': 'https://www.youtube.com/watch?v=ku7XxxXpIKI', 'embed_url': 'https://www.youtube.com/embed/ku7XxxXpIKI?enablejsapi=1&wmode=opaque&autoplay=1', 'images': {'image_url': 'https://img.youtube.com/vi/ku7XxxXpIKI/default.jpg', 'small_image_url': 'https://img.youtube.com/vi/ku7XxxXpIKI/sddefault.jpg', 'medium_image_url': 'https://img.youtube.com/vi/ku7XxxXpIKI/mqdefault.jpg', 'large_image_url': 'https://img.youtube.com/vi/ku7XxxXpIKI/hqdefault.jpg', 'maximum_image_url': 'https://img.youtube.com/vi/ku7XxxXpIKI/maxresdefault.jpg'}}","""Seishun Buta Yarou wa Bunny Girl Senpai no Yume wo Minai""",Rascal Does Not Dream of Bunny Girl Senpai,青春ブタ野郎はバニーガール先輩の夢を見ない,['AoButa'],TV,Light novel,13.0,Finished Airing,False,"{'from': '2018-10-04T00:00:00+00:00', 'to': '2018-12-27T00:00:00+00:00', 'prop': {'from': {'day': 4, 'month': 10, 'year': 2018}, 'to': {'day': 27, 'month': 12, 'year': 2018}}, 'string': 'Oct 4, 2018 to Dec 27, 2018'}",24 min per ep,PG-13 - Teens 13 or older,8.29,866062.0,243.0,59,1389454,39892,"The rare and inexplicable Puberty Syndrome is thought of as a myth. It is a rare disease which only affects teenagers, and its symptoms are so supernatural that hardly anyone recognizes it as a legitimate occurrence. However, high school student Sakuta Azusagawa knows from personal experience that it is very much real, and happens to be quite prevalent in his school. Mai Sakurajima is a third-year high school student who gained fame in her youth as a child actress, but recently halted her promising career for reasons unknown to the public. With an air of unapproachability, she is well known throughout the school, but none dare interact with her—that is until Sakuta sees her wandering the library in a bunny girl costume. Despite the getup, no one seems to notice her, and after confronting her, he realizes that she is another victim of Puberty Syndrome. As Sakuta tries to help Mai through her predicament, his actions bring him into contact with more girls afflicted with the elusive disease. [Written by MAL Rewrite]",,fall,2018,"{'day': 'Thursdays', 'time': '02:20', 'timezone': 'Asia/Tokyo', 'string': 'Thursdays at 02:20 (JST)'}","[{'mal_id': 17, 'type': 'anime', 'name': 'Aniplex', 'url': 'https://myanimelist.net/anime/producer/17/Aniplex'}, {'mal_id': 1211, 'type': 'anime', 'name': 'Tokyo MX', 'url': 'https://myanimelist.net/anime/producer/1211/Tokyo_MX'}, {'mal_id': 1333, 'type': 'anime', 'name': 'Hakuhodo DY Music & Pictures', 'url': 'https://myanimelist.net/anime/producer/1333/Hakuhodo_DY_Music___Pictures'}, {'mal_id': 1366, 'type': 'anime', 'name': 'Nagoya Broadcasting Network', 'url': 'https://myanimelist.net/anime/producer/1366/Nagoya_Broadcasting_Network'}, {'mal_id': 1416, 'type': 'anime', 'name': 'BS11', 'url': 'https://myanimelist.net/anime/producer/1416/BS11'}, {'mal_id': 1500, 'type': 'anime', 'name': 'ABC Animation', 'url': 'https://myanimelist.net/anime/producer/1500/ABC_Animation'}, {'mal_id': 1696, 'type': 'anime', 'name': 'Kadokawa', 'url': 'https://myanimelist.net/anime/producer/1696/Kadokawa'}]","[{'mal_id': 493, 'type': 'anime', 'name': 'Aniplex of America', 'url': 'https://myanimelist.net/anime/producer/493/Aniplex_of_America'}]","[{'mal_id': 1835, 'type': 'anime', 'name': 'CloverWorks', 'url': 'https://myanimelist.net/anime/producer/1835/CloverWorks'}]","[{'mal_id': 4, 'type': 'anime', 'name': 'Comedy', 'url': 'https://myanimelist.net/anime/genre/4/Comedy'}, {'mal_id': 8, 'type': 'anime', 'name': 'Drama', 'url': 'https://myanimelist.net/anime/genre/8/Drama'}, {'mal_id': 22, 'type': 'anime', 'name': 'Romance', 'url': 'https://myanimelist.net/anime/genre/22/Romance'}, {'mal_id': 37, 'type': 'anime', 'name': 'Supernatural', 'url': 'https://myanimelist.net/anime/genre/37/Supernatural'}]",[],"[{'mal_id': 23, 'type': 'anime', 'name': 'School', 'url': 'https://myanimelist.net/anime/genre/23/School'}]",[]
37430,https://myanimelist.net/anime/37430/Tensei_shitara_Slime_Datta_Ken,"{'jpg': {'image_url': 'https://cdn.myanimelist.net/images/anime/1694/93337.jpg', 'small_image_url': 'https://cdn.myanimelist.net/images/anime/1694/93337t.jpg', 'large_image_url': 'https://cdn.myanimelist.net/images/anime/1694/93337l.jpg'}, 'webp': {'image_url': 'https://cdn.myanimelist.net/images/anime/1694/93337.webp', 'small_image_url': 'https://cdn.myanimelist.net/images/anime/1694/93337t.webp', 'large_image_url': 'https://cdn.myanimelist.net/images/anime/1694/93337l.webp'}}","{'youtube_id': 'bkQkyzXEXKE', 'url': 'https://www.youtube.com/watch?v=bkQkyzXEXKE', 'embed_url': 'https://www.youtube.com/embed/bkQkyzXEXKE?enablejsapi=1&wmode=opaque&autoplay=1', 'images': {'image_url': 'https://img.youtube.com/vi/bkQkyzXEXKE/default.jpg', 'small_image_url': 'https://img.youtube.com/vi/bkQkyzXEXKE/sddefault.jpg', 'medium_image_url': 'https://img.youtube.com/vi/bkQkyzXEXKE/mqdefault.jpg', 'large_image_url': 'https://img.youtube.com/vi/bkQkyzXEXKE/hqdefault.jpg', 'maximum_image_url': 'https://img.youtube.com/vi/bkQkyzXEXKE/maxresdefault.jpg'}}","""Tensei shitara Slime Datta Ken""",That Time I Got Reincarnated as a Slime,転生したらスライムだった件,['TenSura'],TV,Manga,24.0,Finished Airing,False,"{'from': '2018-10-02T00:00:00+00:00', 'to': '2019-03-19T00:00:00+00:00', 'prop': {'from': {'day': 2, 'month': 10, 'year': 2018}, 'to': {'day': 19, 'month': 3, 'year': 2019}}, 'string': 'Oct 2, 2018 to Mar 19, 2019'}",23 min per ep,PG-13 - Teens 13 or older,8.13,652789.0,399.0,90,1103113,21815,"Thirty-seven-year-old Satoru Mikami is a typical corporate worker, who is perfectly content with his monotonous lifestyle in Tokyo, other than failing to nail down a girlfriend even once throughout his life. In the midst of a casual encounter with his colleague, he falls victim to a random assailant on the streets and is stabbed. However, while succumbing to his injuries, a peculiar voice echoes in his mind, and recites a bunch of commands which the dying man cannot make sense of. When Satoru regains consciousness, he discovers that he has reincarnated as a goop of slime in an unfamiliar realm. In doing so, he acquires newfound skills—notably, the power to devour anything and mimic its appearance and abilities. He then stumbles upon the sealed Catastrophe-level monster ""Storm Dragon"" Veldora who had been sealed away for the past 300 years for devastating a town to ashes. Sympathetic to his predicament, Satoru befriends him, promising to assist in destroying the seal. In return, Veldora bestows upon him the name Rimuru Tempest to grant him divine protection. Now, liberated from the mundanities of his past life, Rimuru embarks on a fresh journey with a distinct goal in mind. As he grows accustomed to his new physique, his gooey antics ripple throughout the world, gradually altering his fate. [Written by MAL Rewrite]",,fall,2018,"{'day': 'Tuesdays', 'time': '00:00', 'timezone': 'Asia/Tokyo', 'string': 'Tuesdays at 00:00 (JST)'}","[{'mal_id': 104, 'type': 'anime', 'name': 'Lantis', 'url': 'https://myanimelist.net/anime/producer/104/Lantis'}, {'mal_id': 159, 'type': 'anime', 'name': 'Kodansha', 'url': 'https://myanimelist.net/anime/producer/159/Kodansha'}, {'mal_id': 1416, 'type': 'anime', 'name': 'BS11', 'url': 'https://myanimelist.net/anime/producer/1416/BS11'}, {'mal_id': 1840, 'type': 'anime', 'name': 'Bandai Namco Arts', 'url': 'https://myanimelist.net/anime/producer/1840/Bandai_Namco_Arts'}, {'mal_id': 1896, 'type': 'anime', 'name': 'Micro Magazine Publishing', 'url': 'https://myanimelist.net/anime/producer/1896/Micro_Magazine_Publishing'}]","[{'mal_id': 102, 'type': 'anime', 'name': 'Funimation', 'url': 'https://myanimelist.net/anime/producer/102/Funimation'}]","[{'mal_id': 441, 'type': 'anime', 'name': '8bit', 'url': 'https://myanimelist.net/anime/producer/441/8bit'}]","[{'mal_id': 1, 'type': 'anime', 'name': 'Action', 'url': 'https://myanimelist.net/anime/genre/1/Action'}, {'mal_id': 2, 'type': 'anime', 'name': 'Adventure', 'url': 'https://myanimelist.net/anime/genre/2/Adventure'}, {'mal_id': 4, 'type': 'anime', 'name': 'Comedy', 'url': 'https://myanimelist.net/anime/genre/4/Comedy'}, {'mal_id': 10, 'type': 'anime', 'name': 'Fantasy', 'url': 'https://myanimelist.net/anime/genre/10/Fantasy'}]",[],"[{'mal_id': 6, 'type': 'anime', 'name': 'Demons', 'url': 'https://myanimelist.net/anime/genre/6/Demons'}]",[]
37349,https://myanimelist.net/anime/37349/Goblin_Slayer,"{'jpg': {'image_url': 'https://cdn.myanimelist.net/images/anime/1719/95621.jpg', 'small_image_url': 'https://cdn.myanimelist.net/images/anime/1719/95621t.jpg', 'large_image_url': 'https://cdn.myanimelist.net/images/anime/1719/95621l.jpg'}, 'webp': {'image_url': 'https://cdn.myanimelist.net/images/anime/1719/95621.webp', 'small_image_url': 'https://cdn.myanimelist.net/images/anime/1719/95621t.webp', 'large_image_url': 'https://cdn.myanimelist.net/images/anime/1719/95621l.webp'}}","{'youtube_id': '6sdxN30qNrw', 'url': 'https://www.youtube.com/watch?v=6sdxN30qNrw', 'embed_url': 'https://www.youtube.com/embed/6sdxN30qNrw?enablejsapi=1&wmode=opaque&autoplay=1', 'images': {'image_url': 'https://img.youtube.com/vi/6sdxN30qNrw/default.jpg', 'small_image_url': 'https://img.youtube.com/vi/6sdxN30qNrw/sddefault.jpg', 'medium_image_url': 'https://img.youtube.com/vi/6sdxN30qNrw/mqdefault.jpg', 'large_image_url': 'https://img.youtube.com/vi/6sdxN30qNrw/hqdefault.jpg', 'maximum_image_url': 'https://img.youtube.com/vi/6sdxN30qNrw/maxresdefault.jpg'}}","""Goblin Slayer""",Goblin Slayer,ゴブリンスレイヤー,[],TV,Light novel,12.0,Finished Airing,False,"{'from': '2018-10-07T00:00:00+00:00', 'to': '2018-12-30T00:00:00+00:00', 'prop': {'from': {'day': 7, 'month': 10, 'year': 2018}, 'to': {'day': 30, 'month': 12, 'year': 2018}}, 'string': 'Oct 7, 2018 to Dec 30, 2018'}",23 min per ep,R - 17+ (violence & profanity),7.42,523574.0,1915.0,128,906936,5840,"Goblins are known for their ferocity, cunning, and rapid reproduction, but their reputation as the lowliest of monsters causes their threat to be overlooked. Raiding rural civilizations to kidnap females of other species for breeding, these vile creatures are free to continue their onslaught as adventurers turn a blind eye in favor of more rewarding assignments with larger bounties. To commemorate her first day as a Porcelain-ranked adventurer, the 15-year-old Priestess joins a band of young, enthusiastic rookies to investigate a tribe of goblins responsible for the disappearance of several village women. Unprepared and inexperienced, the group soon faces its inevitable demise from an ambush while exploring a cave. With no one else left standing, the terrified Priestess accepts her fate—until the Goblin Slayer unexpectedly appears to not only rescue her with little effort, but destroy the entire goblin nest. As a holder of the prestigious Silver rank, the Goblin Slayer allows her to accompany him as he assists the Adventurer's Guild in all goblin-related matters. Together with the Priestess, High Elf, Dwarf, and Lizard-man, the armored warrior will not rest until every single goblin in the frontier lands has been eradicated for good. [Written by MAL Rewrite]","Based on the light novel series written by Kumo Kagyu, published by SoftBank Creative since February 15, 2016. The series has been adapted to a manga written by Kosuke Kurose, published by Square Enix since May 25, 2016. Both the light novels and manga have been published in English by Yen Press.",fall,2018,"{'day': 'Sundays', 'time': '00:30', 'timezone': 'Asia/Tokyo', 'string': 'Sundays at 00:30 (JST)'}","[{'mal_id': 15, 'type': 'anime', 'name': 'Sony Pictures Entertainment', 'url': 'https://myanimelist.net/anime/producer/15/Sony_Pictures_Entertainment'}, {'mal_id': 61, 'type': 'anime', 'name': 'Frontier Works', 'url': 'https://myanimelist.net/anime/producer/61/Frontier_Works'}, {'mal_id': 238, 'type': 'anime', 'name': 'AT-X', 'url': 'https://myanimelist.net/anime/producer/238/AT-X'}, {'mal_id': 621, 'type': 'anime', 'name': 'SoftBank Creative', 'url': 'https://myanimelist.net/anime/producer/621/SoftBank_Creative'}, {'mal_id': 775, 'type': 'anime', 'name': 'Bushiroad', 'url': 'https://myanimelist.net/anime/producer/775/Bushiroad'}, {'mal_id': 1333, 'type': 'anime', 'name': 'Hakuhodo DY Music & Pictures', 'url': 'https://myanimelist.net/anime/producer/1333/Hakuhodo_DY_Music___Pictures'}, {'mal_id': 1899, 'type': 'anime', 'name': 'Good Smile Film', 'url': 'https://myanimelist.net/anime/producer/1899/Good_Smile_Film'}, {'mal_id': 1900, 'type': 'anime', 'name': 'Artist Management Office', 'url': 'https://myanimelist.net/anime/producer/1900/Artist_Management_Office'}]","[{'mal_id': 102, 'type': 'anime', 'name': 'Funimation', 'url': 'https://myanimelist.net/anime/producer/102/Funimation'}]","[{'mal_id': 314, 'type': 'anime', 'name': 'White Fox', 'url': 'https://myanimelist.net/anime/producer/314/White_Fox'}]","[{'mal_id': 1, 'type': 'anime', 'name': 'Action', 'url': 'https://myanimelist.net/anime/genre/1/Action'}, {'mal_id': 2, 'type': 'anime', 'name': 'Adventure', 'url': 'https://myanimelist.net/anime/genre/2/Adventure'}, {'mal_id': 10, 'type': 'anime', 'name': 'Fantasy', 'url': 'https://myanimelist.net/anime/genre/10/Fantasy'}]",[],[],[]
36474,https://myanimelist.net/anime/36474/Sword_Art_Online__Alicization,"{'jpg': {'image_url': 'https://cdn.myanimelist.net/images/anime/1993/93837.jpg', 'small_image_url': 'https://cdn.myanimelist.net/images/anime/1993/93837t.jpg', 'large_image_url': 'https://cdn.myanimelist.net/images/anime/1993/93837l.jpg'}, 'webp': {'image_url': 'https://cdn.myanimelist.net/images/anime/1993/93837.webp', 'small_image_url': 'https://cdn.myanimelist.net/images/anime/1993/93837t.webp', 'large_image_url': 'https://cdn.myanimelist.net/images/anime/1993/93837l.webp'}}","{'youtube_id': 'W_XoPy-VNt0', 'url': 'https://www.youtube.com/watch?v=W_XoPy-VNt0', 'embed_url': 'https://www.youtube.com/embed/W_XoPy-VNt0?enablejsapi=1&wmode=opaque&autoplay=1', 'images': {'image_url': 'https://img.youtube.com/vi/W_XoPy-VNt0/default.jpg', 'small_image_url': 'https://img.youtube.com/vi/W_XoPy-VNt0/sddefault.jpg', 'medium_image_url': 'https://img.youtube.com/vi/W_XoPy-VNt0/mqdefault.jpg', 'large_image_url': 'https://img.youtube.com/vi/W_XoPy-VNt0/hqdefault.jpg', 'maximum_image_url': 'https://img.youtube.com/vi/W_XoPy-VNt0/maxresdefault.jpg'}}","""Sword Art Online: Alicization""",Sword Art Online: Alicization,ソードアート・オンライン アリシゼーション,"['Sword Art Online III', 'SAO Alicization', 'Sword Art Online 3', 'SAO 3']",TV,Light novel,24.0,Finished Airing,False,"{'from': '2018-10-07T00:00:00+00:00', 'to': '2019-03-31T00:00:00+00:00', 'prop': {'from': {'day': 7, 'month': 10, 'year': 2018}, 'to': {'day': 31, 'month': 3, 'year': 2019}}, 'string': 'Oct 7, 2018 to Mar 31, 2019'}",24 min per ep,R - 17+ (violence & profanity),7.56,487200.0,1435.0,140,861467,6443,"The Soul Translator is a state-of-the-art full-dive interface which interacts with the user's Fluctlight—the technological equivalent of a human soul—and fundamentally differs from the orthodox method of sending signals to the brain. The private institute Rath aims to perfect their creation by enlisting the aid of Sword Art Online survivor Kazuto Kirigaya. He works there as a part-time employee to test the system's capabilities in the Underworld: the fantastical realm generated by the Soul Translator. As per the confidentiality contract, any memories created by the machine in the virtual world are wiped upon returning to the real world. Kazuto can only vaguely recall a single name, Alice, which provokes a sense of unease when mentioned in reality. When Kazuto escorts Asuna Yuuki home one evening, they chance upon a familiar foe. Kazuto is mortally wounded in the ensuing fight and loses consciousness. When he comes to, he discovers that he has made a full-dive into the Underworld with seemingly no way to escape. He sets off on a quest, seeking a way back to the physical world once again. [Written by MAL Rewrite]",Sword Art Online: Alicization is an adaptation of volumes 9 through 14 of Reki Kawahara's Sword Art Online light novel series.,fall,2018,"{'day': 'Sundays', 'time': '00:00', 'timezone': 'Asia/Tokyo', 'string': 'Sundays at 00:00 (JST)'}","[{'mal_id': 17, 'type': 'anime', 'name': 'Aniplex', 'url': 'https://myanimelist.net/anime/producer/17/Aniplex'}, {'mal_id': 79, 'type': 'anime', 'name': 'Genco', 'url': 'https://myanimelist.net/anime/producer/79/Genco'}, {'mal_id': 1233, 'type': 'anime', 'name': 'Bandai Namco Entertainment', 'url': 'https://myanimelist.net/anime/producer/1233/Bandai_Namco_Entertainment'}, {'mal_id': 1444, 'type': 'anime', 'name': 'Egg Firm', 'url': 'https://myanimelist.net/anime/producer/1444/Egg_Firm'}, {'mal_id': 1683, 'type': 'anime', 'name': 'Straight Edge', 'url': 'https://myanimelist.net/anime/producer/1683/Straight_Edge'}, {'mal_id': 1696, 'type': 'anime', 'name': 'Kadokawa', 'url': 'https://myanimelist.net/anime/producer/1696/Kadokawa'}]","[{'mal_id': 493, 'type': 'anime', 'name': 'Aniplex of America', 'url': 'https://myanimelist.net/anime/producer/493/Aniplex_of_America'}]","[{'mal_id': 56, 'type': 'anime', 'name': 'A-1 Pictures', 'url': 'https://myanimelist.net/anime/producer/56/A-1_Pictures'}]","[{'mal_id': 1, 'type': 'anime', 'name': 'Action', 'url': 'https://myanimelist.net/anime/genre/1/Action'}, {'mal_id': 2, 'type': 'anime', 'name': 'Adventure', 'url': 'https://myanimelist.net/anime/genre/2/Adventure'}, {'mal_id': 10, 'type': 'anime', 'name': 'Fantasy', 'url': 'https://myanimelist.net/anime/genre/10/Fantasy'}, {'mal_id': 22, 'type': 'anime', 'name': 'Romance', 'url': 'https://myanimelist.net/anime/genre/22/Romance'}]",[],"[{'mal_id': 11, 'type': 'anime', 'name': 'Game', 'url': 'https://myanimelist.net/anime/genre/11/Game'}]",[]
37991,https://myanimelist.net/anime/37991/JoJo_no_Kimyou_na_Bouken_Part_5__Ougon_no_Kaze,"{'jpg': {'image_url': 'https://cdn.myanimelist.net/images/anime/1572/95010.jpg', 'small_image_url': 'https://cdn.myanimelist.net/images/anime/1572/95010t.jpg', 'large_image_url': 'https://cdn.myanimelist.net/images/anime/1572/95010l.jpg'}, 'webp': {'image_url': 'https://cdn.myanimelist.net/images/anime/1572/95010.webp', 'small_image_url': 'https://cdn.myanimelist.net/images/anime/1572/95010t.webp', 'large_image_url': 'https://cdn.myanimelist.net/images/anime/1572/95010l.webp'}}","{'youtube_id': 'R92KmKcg07Y', 'url': 'https://www.youtube.com/watch?v=R92KmKcg07Y', 'embed_url': 'https://www.youtube.com/embed/R92KmKcg07Y?enablejsapi=1&wmode=opaque&autoplay=1', 'images': {'image_url': 'https://img.youtube.com/vi/R92KmKcg07Y/default.jpg', 'small_image_url': 'https://img.youtube.com/vi/R92KmKcg07Y/sddefault.jpg', 'medium_image_url': 'https://img.youtube.com/vi/R92KmKcg07Y/mqdefault.jpg', 'large_image_url': 'https://img.youtube.com/vi/R92KmKcg07Y/hqdefault.jpg', 'maximum_image_url': 'https://img.youtube.com/vi/R92KmKcg07Y/maxresdefault.jpg'}}","""JoJo no Kimyou na Bouken Part 5: Ougon no Kaze""",JoJo's Bizarre Adventure: Golden Wind,ジョジョの奇妙な冒険 黄金の風,"[""JoJo's Bizarre Adventure Part 5: Golden Wind"", 'JoJo no Kimyou na Bouken Part 5: Ougon no Kaze', 'Le Bizzarre Avventure Di GioGio Parte 5: Vento Aureo']",TV,Manga,39.0,Finished Airing,False,"{'from': '2018-10-06T00:00:00+00:00', 'to': '2019-07-28T00:00:00+00:00', 'prop': {'from': {'day': 6, 'month': 10, 'year': 2018}, 'to': {'day': 28, 'month': 7, 'year': 2019}}, 'string': 'Oct 6, 2018 to Jul 28, 2019'}",23 min per ep,R - 17+ (violence & profanity),8.58,504064.0,76.0,162,791674,25717,"In the coastal city of Naples, corruption is teeming—the police blatantly conspire with outlaws, drugs run rampant around the youth, and the mafia governs the streets with an iron fist. However, various fateful encounters will soon occur. Enter Giorno Giovanna, a 15-year-old boy with an eccentric connection to the Joestar family, who makes a living out of part-time jobs and pickpocketing. Furthermore, he is gifted with the unexplained Stand ability to give and create life—growing plants from the ground and turning inanimate objects into live animals, an ability he has dubbed ""Gold Experience."" Fascinated by the might of local gangsters, Giorno has dreamed of rising up in their ranks and becoming a ""Gang-Star,"" a feat made possible by his encounter with Bruno Buccellati, a member of the Passione gang with his own sense of justice. JoJo no Kimyou na Bouken: Ougon no Kaze follows the endeavors of Giorno after joining Bruno's team while working under Passione, fending off other gangsters and secretly plotting to overthrow their mysterious boss. [Written by MAL Rewrite]",JoJo no Kimyou na Bouken: Ougon no Kaze is a full adaptation of the fifth part of the JoJo no Kimyou na Bouken manga series.,fall,2018,"{'day': 'Saturdays', 'time': '01:05', 'timezone': 'Asia/Tokyo', 'string': 'Saturdays at 01:05 (JST)'}","[{'mal_id': 415, 'type': 'anime', 'name': 'Warner Bros. Japan', 'url': 'https://myanimelist.net/anime/producer/415/Warner_Bros_Japan'}, {'mal_id': 460, 'type': 'anime', 'name': 'KlockWorx', 'url': 'https://myanimelist.net/anime/producer/460/KlockWorx'}, {'mal_id': 1337, 'type': 'anime', 'name': 'Medicos Entertainment', 'url': 'https://myanimelist.net/anime/producer/1337/Medicos_Entertainment'}, {'mal_id': 1365, 'type': 'anime', 'name': 'Shueisha', 'url': 'https://myanimelist.net/anime/producer/1365/Shueisha'}]","[{'mal_id': 119, 'type': 'anime', 'name': 'VIZ Media', 'url': 'https://myanimelist.net/anime/producer/119/VIZ_Media'}]","[{'mal_id': 287, 'type': 'anime', 'name': 'David Production', 'url': 'https://myanimelist.net/anime/producer/287/David_Production'}]","[{'mal_id': 1, 'type': 'anime', 'name': 'Action', 'url': 'https://myanimelist.net/anime/genre/1/Action'}, {'mal_id': 2, 'type': 'anime', 'name': 'Adventure', 'url': 'https://myanimelist.net/anime/genre/2/Adventure'}]",[],[],"[{'mal_id': 27, 'type': 'anime', 'name': 'Shounen', 'url': 'https://myanimelist.net/anime/genre/27/Shounen'}]"
