mal_id,url,images,trailer,title,title_english,title_japanese,title_synonyms,type,source,episodes,status,airing,aired,duration,rating,score,scored_by,rank,popularity,members,favorites,synopsis,background,season,year,broadcast,producers,licensors,studios,genres,explicit_genres,themes,demographics
37584,https://myanimelist.net/anime/37584/Bakumatsu,"{'jpg': {'image_url': 'https://cdn.myanimelist.net/images/anime/1764/95110.jpg', 'small_image_url': 'https://cdn.myanimelist.net/images/anime/1764/95110t.jpg', 'large_image_url': 'https://cdn.myanimelist.net/images/anime/1764/95110l.jpg'}, 'webp': {'image_url': 'https://cdn.myanimelist.net/images/anime/1764/95110.webp', 'small_image_url': 'https://cdn.myanimelist.net/images/anime/1764/95110t.webp', 'large_image_url': 'https://cdn.myanimelist.net/images/anime/1764/95110l.webp'}}","{'youtube_id': 'FFUJNaJY-f8', 'url': 'https://www.youtube.com/watch?v=FFUJNaJY-f8', 'embed_url': 'https://www.youtube.com/embed/FFUJNaJY-f8?enablejsapi=1&wmode=opaque&autoplay=1', 'images': {'image_url': 'https://img.youtube.com/vi/FFUJNaJY-f8/default.jpg', 'small_image_url': 'https://img.youtube.com/vi/FFUJNaJY-f8/sddefault.jpg', 'medium_image_url': 'https://img.youtube.com/vi/FFUJNaJY-f8/mqdefault.jpg', 'large_image_url': 'https://img.youtube.com/vi/FFUJNaJY-f8/hqdefault.jpg', 'maximum_image_url': 'https://img.youtube.com/vi/FFUJNaJY-f8/maxresdefault.jpg'}}","""Bakumatsu""",,BAKUMATSU,['Renai Bakumatsu Kareshi'],TV,Game,12.0,Finished Airing,False,"{'from': '2018-10-05T00:00:00+00:00', 'to': '2018-12-21T00:00:00+00:00', 'prop': {'from': {'day': 5, 'month': 10, 'year': 2018}, 'to': {'day': 21, 'month': 12, 'year': 2018}}, 'string': 'Oct 5, 2018 to Dec 21, 2018'}",24 min per ep,PG-13 - Teens 13 or older,5.71,3760.0,9765.0,3951,21773,29,"The Bakumatsu was an era in which the souls of young men burned with anxiety for their country's future. Takasugi Shinsaku, a soldier of fortune from Choshu, sneaks aboard a government ship with his comrade Katsura Kogorou in search of a mysterious ""timepiece"" with the power to manipulate time that he fears the government wishes to keep for themselves. Rather than allow such power to fall into the wrong hands, Takasugi plans to destroy the artifact, but having obtained it, the artifact is quickly stolen, forcing the pair to follow the mysterious thief to the seat of government in Kyoto. However, when they arrive in the capital, they discover that the government has been overthrown and the deity Susanoo now reigns in its place. The streets of the city and the people in them are much different than Takasugi and Katsura remembered. The times may have changed but their mission hasn't - Takasugi and Katsura resolve to reset time and save their nation from the nefarious forces trying to hijack it. (Source: Tokyo Otaku Mode)",,fall,2018,"{'day': 'Fridays', 'time': '01:58', 'timezone': 'Asia/Tokyo', 'string': 'Fridays at 01:58 (JST)'}","[{'mal_id': 145, 'type': 'anime', 'name': 'TBS', 'url': 'https://myanimelist.net/anime/producer/145/TBS'}, {'mal_id': 963, 'type': 'anime', 'name': 'MAGES.', 'url': 'https://myanimelist.net/anime/producer/963/MAGES'}, {'mal_id': 1590, 'type': 'anime', 'name': 'FuRyu', 'url': 'https://myanimelist.net/anime/producer/1590/FuRyu'}]",[],"[{'mal_id': 37, 'type': 'anime', 'name': 'Studio Deen', 'url': 'https://myanimelist.net/anime/producer/37/Studio_Deen'}]","[{'mal_id': 1, 'type': 'anime', 'name': 'Action', 'url': 'https://myanimelist.net/anime/genre/1/Action'}]",[],"[{'mal_id': 13, 'type': 'anime', 'name': 'Historical', 'url': 'https://myanimelist.net/anime/genre/13/Historical'}, {'mal_id': 21, 'type': 'anime', 'name': 'Samurai', 'url': 'https://myanimelist.net/anime/genre/21/Samurai'}]",[]
38235,https://myanimelist.net/anime/38235/Inazuma_Eleven__Orion_no_Kokuin,"{'jpg': {'image_url': 'https://cdn.myanimelist.net/images/anime/1965/117638.jpg', 'small_image_url': 'https://cdn.myanimelist.net/images/anime/1965/117638t.jpg', 'large_image_url': 'https://cdn.myanimelist.net/images/anime/1965/117638l.jpg'}, 'webp': {'image_url': 'https://cdn.myanimelist.net/images/anime/1965/117638.webp', 'small_image_url': 'https://cdn.myanimelist.net/images/anime/1965/117638t.webp', 'large_image_url': 'https://cdn.myanimelist.net/images/anime/1965/117638l.webp'}}","{'youtube_id': 'KpzhDpU2huk', 'url': 'https://www.youtube.com/watch?v=KpzhDpU2huk', 'embed_url': 'https://www.youtube.com/embed/KpzhDpU2huk?enablejsapi=1&wmode=opaque&autoplay=1', 'images': {'image_url': 'https://img.youtube.com/vi/KpzhDpU2huk/default.jpg', 'small_image_url': 'https://img.youtube.com/vi/KpzhDpU2huk/sddefault.jpg', 'medium_image_url': 'https://img.youtube.com/vi/KpzhDpU2huk/mqdefault.jpg', 'large_image_url': 'https://img.youtube.com/vi/KpzhDpU2huk/hqdefault.jpg', 'maximum_image_url': 'https://img.youtube.com/vi/KpzhDpU2huk/maxresdefault.jpg'}}","""Inazuma Eleven: Orion no Kokuin""",,イナズマイレブン オリオンの刻印,[],TV,Game,49.0,Finished Airing,False,"{'from': '2018-10-05T00:00:00+00:00', 'to': '2019-09-27T00:00:00+00:00', 'prop': {'from': {'day': 5, 'month': 10, 'year': 2018}, 'to': {'day': 27, 'month': 9, 'year': 2019}}, 'string': 'Oct 5, 2018 to Sep 27, 2019'}",23 min per ep,G - All Ages,6.82,10207.0,4580.0,3966,21627,81,"The moment of reckoning has arrived as the illustrious Football Frontier International is finally underway. After winning the national Football Frontier, the newly assembled Raimon Junior High School soccer team awaits the announcement of Inazuma Japan—the team of players who will represent Japan at the international tournament. Asuto Inamori, along with the ""Demon of the Field"" Ryouhei Haizaki and the ""Emperor of the Pitch"" Yuuma Nosaka, quickly realize that they are up against forces far greater and more powerful than they anticipated. In Inazuma Eleven: Orion no Kokuin, mysterious powers are at play within the tournament that threatens to alter the course of history and the game of soccer itself. With the help of their cunning coach Zhao Jinyun and the inexplicable newcomer Ichihoshi Mitsuru, Inazuma Japan must defend the world of soccer in their most difficult challenge yet. [Written by MAL Rewrite]",,fall,2018,"{'day': 'Fridays', 'time': '17:55', 'timezone': 'Asia/Tokyo', 'string': 'Fridays at 17:55 (JST)'}","[{'mal_id': 16, 'type': 'anime', 'name': 'TV Tokyo', 'url': 'https://myanimelist.net/anime/producer/16/TV_Tokyo'}, {'mal_id': 53, 'type': 'anime', 'name': 'Dentsu', 'url': 'https://myanimelist.net/anime/producer/53/Dentsu'}]",[],"[{'mal_id': 28, 'type': 'anime', 'name': 'OLM', 'url': 'https://myanimelist.net/anime/producer/28/OLM'}]","[{'mal_id': 30, 'type': 'anime', 'name': 'Sports', 'url': 'https://myanimelist.net/anime/genre/30/Sports'}]",[],[],[]
37106,https://myanimelist.net/anime/37106/Kitsune_no_Koe,"{'jpg': {'image_url': 'https://cdn.myanimelist.net/images/anime/1305/97626.jpg', 'small_image_url': 'https://cdn.myanimelist.net/images/anime/1305/97626t.jpg', 'large_image_url': 'https://cdn.myanimelist.net/images/anime/1305/97626l.jpg'}, 'webp': {'image_url': 'https://cdn.myanimelist.net/images/anime/1305/97626.webp', 'small_image_url': 'https://cdn.myanimelist.net/images/anime/1305/97626t.webp', 'large_image_url': 'https://cdn.myanimelist.net/images/anime/1305/97626l.webp'}}","{'youtube_id': '1Cf6iFflN1E', 'url': 'https://www.youtube.com/watch?v=1Cf6iFflN1E', 'embed_url': 'https://www.youtube.com/embed/1Cf6iFflN1E?enablejsapi=1&wmode=opaque&autoplay=1', 'images': {'image_url': 'https://img.youtube.com/vi/1Cf6iFflN1E/default.jpg', 'small_image_url': 'https://img.youtube.com/vi/1Cf6iFflN1E/sddefault.jpg', 'medium_image_url': 'https://img.youtube.com/vi/1Cf6iFflN1E/mqdefault.jpg', 'large_image_url': 'https://img.youtube.com/vi/1Cf6iFflN1E/hqdefault.jpg', 'maximum_image_url': 'https://img.youtube.com/vi/1Cf6iFflN1E/maxresdefault.jpg'}}","""Kitsune no Koe""",Voice of Fox,狐狸之声,['Kori no Koe'],TV,Manga,12.0,Finished Airing,False,"{'from': '2018-10-05T00:00:00+00:00', 'to': '2018-12-21T00:00:00+00:00', 'prop': {'from': {'day': 5, 'month': 10, 'year': 2018}, 'to': {'day': 21, 'month': 12, 'year': 2018}}, 'string': 'Oct 5, 2018 to Dec 21, 2018'}",13 min per ep,PG-13 - Teens 13 or older,6.41,6996.0,6648.0,4115,19701,56,"The series follows 16-year-old Hu Li, who dreams of becoming a popular singer. However, he has neither good looks nor the financial means to pursue his dream, so Hu uploads his singing online using a fox avatar. (Source: MAL News)","Adaptation of the Chinese manhua series, Huli Zhi Sheng, by Guangxian Jun.",fall,2018,"{'day': 'Fridays', 'time': '22:30', 'timezone': 'Asia/Tokyo', 'string': 'Fridays at 22:30 (JST)'}","[{'mal_id': 1593, 'type': 'anime', 'name': 'Success Corp.', 'url': 'https://myanimelist.net/anime/producer/1593/Success_Corp'}, {'mal_id': 1761, 'type': 'anime', 'name': 'Tavac', 'url': 'https://myanimelist.net/anime/producer/1761/Tavac'}, {'mal_id': 1806, 'type': 'anime', 'name': 'iQIYI', 'url': 'https://myanimelist.net/anime/producer/1806/iQIYI'}]",[],"[{'mal_id': 96, 'type': 'anime', 'name': 'Yumeta Company', 'url': 'https://myanimelist.net/anime/producer/96/Yumeta_Company'}]",[],[],"[{'mal_id': 19, 'type': 'anime', 'name': 'Music', 'url': 'https://myanimelist.net/anime/genre/19/Music'}]",[]
36000,https://myanimelist.net/anime/36000/Sora_to_Umi_no_Aida,"{'jpg': {'image_url': 'https://cdn.myanimelist.net/images/anime/1297/97156.jpg', 'small_image_url': 'https://cdn.myanimelist.net/images/anime/1297/97156t.jpg', 'large_image_url': 'https://cdn.myanimelist.net/images/anime/1297/97156l.jpg'}, 'webp': {'image_url': 'https://cdn.myanimelist.net/images/anime/1297/97156.webp', 'small_image_url': 'https://cdn.myanimelist.net/images/anime/1297/97156t.webp', 'large_image_url': 'https://cdn.myanimelist.net/images/anime/1297/97156l.webp'}}","{'youtube_id': 'DcAfBkSXFxs', 'url': 'https://www.youtube.com/watch?v=DcAfBkSXFxs', 'embed_url': 'https://www.youtube.com/embed/DcAfBkSXFxs?enablejsapi=1&wmode=opaque&autoplay=1', 'images': {'image_url': 'https://img.youtube.com/vi/DcAfBkSXFxs/default.jpg', 'small_image_url': 'https://img.youtube.com/vi/DcAfBkSXFxs/sddefault.jpg', 'medium_image_url': 'https://img.youtube.com/vi/DcAfBkSXFxs/mqdefault.jpg', 'large_image_url': 'https://img.youtube.com/vi/DcAfBkSXFxs/hqdefault.jpg', 'maximum_image_url': 'https://img.youtube.com/vi/DcAfBkSXFxs/maxresdefault.jpg'}}","""Sora to Umi no Aida""",Between the Sky and Sea,ソラとウミのアイダ,[],TV,Game,12.0,Finished Airing,False,"{'from': '2018-10-04T00:00:00+00:00', 'to': '2018-12-20T00:00:00+00:00', 'prop': {'from': {'day': 4, 'month': 10, 'year': 2018}, 'to': {'day': 20, 'month': 12, 'year': 2018}}, 'string': 'Oct 4, 2018 to Dec 20, 2018'}",23 min per ep,PG-13 - Teens 13 or older,5.66,4511.0,9963.0,4135,19476,21,"In the future in Onomichi, Hiroshima fish disappear from the sea around the world and only whales live in the ocean. The Ministry of Fishery decides to set up giant experimental Universe Fish Tanks in space. The Onomichi Universe Fishery Union is established and begins to train space fishermen. Female fishermen are in demand due to the strengthening of an equal employment law for men and women. Six new female space fishermen are selected, and the story centers on supporting their growth. (Source: ANN)",,fall,2018,"{'day': 'Thursdays', 'time': '00:00', 'timezone': 'Asia/Tokyo', 'string': 'Thursdays at 00:00 (JST)'}","[{'mal_id': 213, 'type': 'anime', 'name': 'Half H.P Studio', 'url': 'https://myanimelist.net/anime/producer/213/Half_HP_Studio'}]","[{'mal_id': 376, 'type': 'anime', 'name': 'Sentai Filmworks', 'url': 'https://myanimelist.net/anime/producer/376/Sentai_Filmworks'}]","[{'mal_id': 73, 'type': 'anime', 'name': 'TMS Entertainment', 'url': 'https://myanimelist.net/anime/producer/73/TMS_Entertainment'}]","[{'mal_id': 2, 'type': 'anime', 'name': 'Adventure', 'url': 'https://myanimelist.net/anime/genre/2/Adventure'}, {'mal_id': 10, 'type': 'anime', 'name': 'Fantasy', 'url': 'https://myanimelist.net/anime/genre/10/Fantasy'}, {'mal_id': 24, 'type': 'anime', 'name': 'Sci-Fi', 'url': 'https://myanimelist.net/anime/genre/24/Sci-Fi'}]",[],"[{'mal_id': 29, 'type': 'anime', 'name': 'Space', 'url': 'https://myanimelist.net/anime/genre/29/Space'}]",[]
38212,https://myanimelist.net/anime/38212/Shuudengo_Capsule_Hotel_de_Joushi_ni_Binetsu_Tsutawaru_Yoru,"{'jpg': {'image_url': 'https://cdn.myanimelist.net/images/anime/1418/93509.jpg', 'small_image_url': 'https://cdn.myanimelist.net/images/anime/1418/93509t.jpg', 'large_image_url': 'https://cdn.myanimelist.net/images/anime/1418/93509l.jpg'}, 'webp': {'image_url': 'https://cdn.myanimelist.net/images/anime/1418/93509.webp', 'small_image_url': 'https://cdn.myanimelist.net/images/anime/1418/93509t.webp', 'large_image_url': 'https://cdn.myanimelist.net/images/anime/1418/93509l.webp'}}","{'youtube_id': 'aoLSt6B5T8w', 'url': 'https://www.youtube.com/watch?v=aoLSt6B5T8w', 'embed_url': 'https://www.youtube.com/embed/aoLSt6B5T8w?enablejsapi=1&wmode=opaque&autoplay=1', 'images': {'image_url': 'https://img.youtube.com/vi/aoLSt6B5T8w/default.jpg', 'small_image_url': 'https://img.youtube.com/vi/aoLSt6B5T8w/sddefault.jpg', 'medium_image_url': 'https://img.youtube.com/vi/aoLSt6B5T8w/mqdefault.jpg', 'large_image_url': 'https://img.youtube.com/vi/aoLSt6B5T8w/hqdefault.jpg', 'maximum_image_url': 'https://img.youtube.com/vi/aoLSt6B5T8w/maxresdefault.jpg'}}","""Shuudengo, Capsule Hotel de, Joushi ni Binetsu Tsutawaru Yoru.""",,終電後、カプセルホテルで、上司に微熱伝わる夜。,['The Night When Me and My Boss Spent the Night at the Capsule Hotel After the Last Train and He Passed His Fever to Me'],TV,Manga,12.0,Finished Airing,False,"{'from': '2018-10-08T00:00:00+00:00', 'to': '2018-12-24T00:00:00+00:00', 'prop': {'from': {'day': 8, 'month': 10, 'year': 2018}, 'to': {'day': 24, 'month': 12, 'year': 2018}}, 'string': 'Oct 8, 2018 to Dec 24, 2018'}",3 min per ep,R+ - Mild Nudity,5.54,5388.0,,4325,17693,48,"The anime centers on Minori, an office worker, and her boss Hadano, who are constantly arguing with each other. One night, after a company drinking party, Minori and Hadano are having their usual argument, when Minori realizes that she has missed the last train. They decide to spend the night at a nearby capsule hotel, but an incident forces them to share the same unit. (Source: ANN)",The anime aired in two versions: an all-ages broadcast version and an uncut 18+ version streamed on ComicFesta Anime Zone.,fall,2018,"{'day': 'Mondays', 'time': '01:00', 'timezone': 'Asia/Tokyo', 'string': 'Mondays at 01:00 (JST)'}","[{'mal_id': 719, 'type': 'anime', 'name': 'Studio Mausu', 'url': 'https://myanimelist.net/anime/producer/719/Studio_Mausu'}, {'mal_id': 1536, 'type': 'anime', 'name': 'Namu Animation', 'url': 'https://myanimelist.net/anime/producer/1536/Namu_Animation'}]",[],"[{'mal_id': 1760, 'type': 'anime', 'name': 'Suiseisha', 'url': 'https://myanimelist.net/anime/producer/1760/Suiseisha'}]","[{'mal_id': 22, 'type': 'anime', 'name': 'Romance', 'url': 'https://myanimelist.net/anime/genre/22/Romance'}, {'mal_id': 49, 'type': 'anime', 'name': 'Erotica', 'url': 'https://myanimelist.net/anime/genre/49/Erotica'}]",[],[],"[{'mal_id': 43, 'type': 'anime', 'name': 'Josei', 'url': 'https://myanimelist.net/anime/genre/43/Josei'}]"
37657,https://myanimelist.net/anime/37657/Gakuen_Basara,"{'jpg': {'image_url': 'https://cdn.myanimelist.net/images/anime/1278/93829.jpg', 'small_image_url': 'https://cdn.myanimelist.net/images/anime/1278/93829t.jpg', 'large_image_url': 'https://cdn.myanimelist.net/images/anime/1278/93829l.jpg'}, 'webp': {'image_url': 'https://cdn.myanimelist.net/images/anime/1278/93829.webp', 'small_image_url': 'https://cdn.myanimelist.net/images/anime/1278/93829t.webp', 'large_image_url': 'https://cdn.myanimelist.net/images/anime/1278/93829l.webp'}}","{'youtube_id': '1E9KkY3j9xA', 'url': 'https://www.youtube.com/watch?v=1E9KkY3j9xA', 'embed_url': 'https://www.youtube.com/embed/1E9KkY3j9xA?enablejsapi=1&wmode=opaque&autoplay=1', 'images': {'image_url': 'https://img.youtube.com/vi/1E9KkY3j9xA/default.jpg', 'small_image_url': 'https://img.youtube.com/vi/1E9KkY3j9xA/sddefault.jpg', 'medium_image_url': 'https://img.youtube.com/vi/1E9KkY3j9xA/mqdefault.jpg', 'large_image_url': 'https://img.youtube.com/vi/1E9KkY3j9xA/hqdefault.jpg', 'maximum_image_url': 'https://img.youtube.com/vi/1E9KkY3j9xA/maxresdefault.jpg'}}","""Gakuen Basara""",Gakuen Basara: Samurai High School,学園BASARA,[],TV,Game,12.0,Finished Airing,False,"{'from': '2018-10-05T00:00:00+00:00', 'to': '2018-12-21T00:00:00+00:00', 'prop': {'from': {'day': 5, 'month': 10, 'year': 2018}, 'to': {'day': 21, 'month': 12, 'year': 2018}}, 'string': 'Oct 5, 2018 to Dec 21, 2018'}",24 min per ep,PG-13 - Teens 13 or older,6.17,2982.0,7823.0,4440,16660,26,"A heated battle is once again revving up at Basara Academy between baseball star Masamune Date and soccer ace Yukimura Sanada. What's more, ever since student council chairman Hideyoshi Toyotomi received a suspension, leaving the seat up for grabs, a host of class ""warlords"" have become embroiled in a quest for supreme power. Amid Ieyasu Tokugawa's appeals to bonds of kinship and Mitsunari Ishida's fervor to defeat him, who will wrest ultimate control of the domain in ""troubled"" times? (Source: TBS Global Business)",,fall,2018,"{'day': 'Fridays', 'time': '01:28', 'timezone': 'Asia/Tokyo', 'string': 'Fridays at 01:28 (JST)'}","[{'mal_id': 145, 'type': 'anime', 'name': 'TBS', 'url': 'https://myanimelist.net/anime/producer/145/TBS'}, {'mal_id': 315, 'type': 'anime', 'name': 'DAX Production', 'url': 'https://myanimelist.net/anime/producer/315/DAX_Production'}, {'mal_id': 1904, 'type': 'anime', 'name': 'High Kick Entertainment', 'url': 'https://myanimelist.net/anime/producer/1904/High_Kick_Entertainment'}]","[{'mal_id': 376, 'type': 'anime', 'name': 'Sentai Filmworks', 'url': 'https://myanimelist.net/anime/producer/376/Sentai_Filmworks'}]","[{'mal_id': 112, 'type': 'anime', 'name': ""Brain's Base"", 'url': 'https://myanimelist.net/anime/producer/112/Brains_Base'}]","[{'mal_id': 1, 'type': 'anime', 'name': 'Action', 'url': 'https://myanimelist.net/anime/genre/1/Action'}, {'mal_id': 4, 'type': 'anime', 'name': 'Comedy', 'url': 'https://myanimelist.net/anime/genre/4/Comedy'}]",[],"[{'mal_id': 23, 'type': 'anime', 'name': 'School', 'url': 'https://myanimelist.net/anime/genre/23/School'}]",[]
36945,https://myanimelist.net/anime/36945/Himote_House,"{'jpg': {'image_url': 'https://cdn.myanimelist.net/images/anime/1790/94342.jpg', 'small_image_url': 'https://cdn.myanimelist.net/images/anime/1790/94342t.jpg', 'large_image_url': 'https://cdn.myanimelist.net/images/anime/1790/94342l.jpg'}, 'webp': {'image_url': 'https://cdn.myanimelist.net/images/anime/1790/94342.webp', 'small_image_url': 'https://cdn.myanimelist.net/images/anime/1790/94342t.webp', 'large_image_url': 'https://cdn.myanimelist.net/images/anime/1790/94342l.webp'}}","{'youtube_id': 'lH_K83Jou7w', 'url': 'https://www.youtube.com/watch?v=lH_K83Jou7w', 'embed_url': 'https://www.youtube.com/embed/lH_K83Jou7w?enablejsapi=1&wmode=opaque&autoplay=1', 'images': {'image_url': 'https://img.youtube.com/vi/lH_K83Jou7w/default.jpg', 'small_image_url': 'https://img.youtube.com/vi/lH_K83Jou7w/sddefault.jpg', 'medium_image_url': 'https://img.youtube.com/vi/lH_K83Jou7w/mqdefault.jpg', 'large_image_url': 'https://img.youtube.com/vi/lH_K83Jou7w/hqdefault.jpg', 'maximum_image_url': 'https://img.youtube.com/vi/lH_K83Jou7w/maxresdefault.jpg'}}","""Himote House""",HIMOTE HOUSE: A share house of super psychic girls,ひもてはうす,[],TV,Original,12.0,Finished Airing,False,"{'from': '2018-10-08T00:00:00+00:00', 'to': '2018-12-24T00:00:00+00:00', 'prop': {'from': {'day': 8, 'month': 10, 'year': 2018}, 'to': {'day': 24, 'month': 12, 'year': 2018}}, 'string': 'Oct 8, 2018 to Dec 24, 2018'}",12 min per ep,PG-13 - Teens 13 or older,5.68,3181.0,9914.0,4520,15833,17,"The comedy anime centers on five girls and one cat all living as housemates in Nakano, Tokyo: the three Himote sisters (Tokiyo, Kinami, and Kokoro) whose family manages the ""Himote House,"" Kokoro's classmates Tae and Minamo, and the cat Enishi. The girls live their daily lives trying to figure out ways to be popular, and they (and the cat) all possess a mysterious secret power... (Source: ANN)",,fall,2018,"{'day': 'Mondays', 'time': '00:45', 'timezone': 'Asia/Tokyo', 'string': 'Mondays at 00:45 (JST)'}","[{'mal_id': 15, 'type': 'anime', 'name': 'Sony Pictures Entertainment', 'url': 'https://myanimelist.net/anime/producer/15/Sony_Pictures_Entertainment'}, {'mal_id': 1336, 'type': 'anime', 'name': 'Chugai Mining', 'url': 'https://myanimelist.net/anime/producer/1336/Chugai_Mining'}, {'mal_id': 1563, 'type': 'anime', 'name': 'Hakuhodo', 'url': 'https://myanimelist.net/anime/producer/1563/Hakuhodo'}, {'mal_id': 1602, 'type': 'anime', 'name': 'GYAO!', 'url': 'https://myanimelist.net/anime/producer/1602/GYAO'}, {'mal_id': 1684, 'type': 'anime', 'name': 'THINKR', 'url': 'https://myanimelist.net/anime/producer/1684/THINKR'}, {'mal_id': 1730, 'type': 'anime', 'name': 'Moonbell', 'url': 'https://myanimelist.net/anime/producer/1730/Moonbell'}, {'mal_id': 1865, 'type': 'anime', 'name': 'LinkedBrain', 'url': 'https://myanimelist.net/anime/producer/1865/LinkedBrain'}]",[],"[{'mal_id': 1487, 'type': 'anime', 'name': 'Bouncy', 'url': 'https://myanimelist.net/anime/producer/1487/Bouncy'}]","[{'mal_id': 4, 'type': 'anime', 'name': 'Comedy', 'url': 'https://myanimelist.net/anime/genre/4/Comedy'}]",[],"[{'mal_id': 31, 'type': 'anime', 'name': 'Super Power', 'url': 'https://myanimelist.net/anime/genre/31/Super_Power'}]",[]
38083,https://myanimelist.net/anime/38083/Ken_En_Ken__Aoki_Kagayaki,"{'jpg': {'image_url': 'https://cdn.myanimelist.net/images/anime/1339/95573.jpg', 'small_image_url': 'https://cdn.myanimelist.net/images/anime/1339/95573t.jpg', 'large_image_url': 'https://cdn.myanimelist.net/images/anime/1339/95573l.jpg'}, 'webp': {'image_url': 'https://cdn.myanimelist.net/images/anime/1339/95573.webp', 'small_image_url': 'https://cdn.myanimelist.net/images/anime/1339/95573t.webp', 'large_image_url': 'https://cdn.myanimelist.net/images/anime/1339/95573l.webp'}}","{'youtube_id': 'KO_Qar16S08', 'url': 'https://www.youtube.com/watch?v=KO_Qar16S08', 'embed_url': 'https://www.youtube.com/embed/KO_Qar16S08?enablejsapi=1&wmode=opaque&autoplay=1', 'images': {'image_url': 'https://img.youtube.com/vi/KO_Qar16S08/default.jpg', 'small_image_url': 'https://img.youtube.com/vi/KO_Qar16S08/sddefault.jpg', 'medium_image_url': 'https://img.youtube.com/vi/KO_Qar16S08/mqdefault.jpg', 'large_image_url': 'https://img.youtube.com/vi/KO_Qar16S08/hqdefault.jpg', 'maximum_image_url': 'https://img.youtube.com/vi/KO_Qar16S08/maxresdefault.jpg'}}","""Ken En Ken: Aoki Kagayaki""",Xuan Yuan Sword Luminary,軒轅剣・蒼き曜,['Xuan-Yuan Sword: Lights of the Bleak'],TV,Game,13.0,Finished Airing,False,"{'from': '2018-10-02T00:00:00+00:00', 'to': '2018-12-25T00:00:00+00:00', 'prop': {'from': {'day': 2, 'month': 10, 'year': 2018}, 'to': {'day': 25, 'month': 12, 'year': 2018}}, 'string': 'Oct 2, 2018 to Dec 25, 2018'}",24 min per ep,PG-13 - Teens 13 or older,6.03,3963.0,8530.0,4580,15307,16,"Yin and Ning are two sisters who have been wandering the land together ever since their village was destroyed by the villainous Taibai Empire. Their childhood friend, Zhao, has been enslaved by the Taibai himself, and uses his brilliance at tinkering and inventing to get by as a slave to the Empire's whims. One day, Yin accidentally discovers a legendary sword, which grants her fantastic abilities in combat, and allows her to summon a mystical, mechanical fox spirit named Yun, who is sworn to fight by her side. Meanwhile, Zhao is making fast friends with a mysterious young girl who just may hold a great amount of power within the Taibai Empire. As Zhao and the Fu sisters find themselves increasingly caught up in the Empire's battle for supremacy over the land, it will take all of the magic and might that the budding resistance armies can muster to turn the tide of war once and for all. (Source: ANN)","Ken En Ken: Aoki Kagayaki is based on the 2004 Taiwanese role-playing game Xuan Yuan Jian Waizhuan: Cang zhi Tao, whose story is set in the Spring and Autumn period of Chinese history (approximately 770–476 BC).",fall,2018,"{'day': 'Tuesdays', 'time': '02:05', 'timezone': 'Asia/Tokyo', 'string': 'Tuesdays at 02:05 (JST)'}","[{'mal_id': 16, 'type': 'anime', 'name': 'TV Tokyo', 'url': 'https://myanimelist.net/anime/producer/16/TV_Tokyo'}, {'mal_id': 1041, 'type': 'anime', 'name': 'Ai Addiction', 'url': 'https://myanimelist.net/anime/producer/1041/Ai_Addiction'}]",[],"[{'mal_id': 37, 'type': 'anime', 'name': 'Studio Deen', 'url': 'https://myanimelist.net/anime/producer/37/Studio_Deen'}]","[{'mal_id': 1, 'type': 'anime', 'name': 'Action', 'url': 'https://myanimelist.net/anime/genre/1/Action'}, {'mal_id': 2, 'type': 'anime', 'name': 'Adventure', 'url': 'https://myanimelist.net/anime/genre/2/Adventure'}, {'mal_id': 10, 'type': 'anime', 'name': 'Fantasy', 'url': 'https://myanimelist.net/anime/genre/10/Fantasy'}]",[],"[{'mal_id': 6, 'type': 'anime', 'name': 'Demons', 'url': 'https://myanimelist.net/anime/genre/6/Demons'}, {'mal_id': 17, 'type': 'anime', 'name': 'Martial Arts', 'url': 'https://myanimelist.net/anime/genre/17/Martial_Arts'}]",[]
