mal_id,url,images,trailer,title,title_english,title_japanese,title_synonyms,type,source,episodes,status,airing,aired,duration,rating,score,scored_by,rank,popularity,members,favorites,synopsis,background,season,year,broadcast,producers,licensors,studios,genres,explicit_genres,themes,demographics
35997,https://myanimelist.net/anime/35997/Märchen_Mädchen,"{'jpg': {'image_url': 'https://cdn.myanimelist.net/images/anime/8/90088.jpg', 'small_image_url': 'https://cdn.myanimelist.net/images/anime/8/90088t.jpg', 'large_image_url': 'https://cdn.myanimelist.net/images/anime/8/90088l.jpg'}, 'webp': {'image_url': 'https://cdn.myanimelist.net/images/anime/8/90088.webp', 'small_image_url': 'https://cdn.myanimelist.net/images/anime/8/90088t.webp', 'large_image_url': 'https://cdn.myanimelist.net/images/anime/8/90088l.webp'}}","{'youtube_id': 'JTZFjcYGwNk', 'url': 'https://www.youtube.com/watch?v=JTZFjcYGwNk', 'embed_url': 'https://www.youtube.com/embed/JTZFjcYGwNk?enablejsapi=1&wmode=opaque&autoplay=1', 'images': {'image_url': 'https://img.youtube.com/vi/JTZFjcYGwNk/default.jpg', 'small_image_url': 'https://img.youtube.com/vi/JTZFjcYGwNk/sddefault.jpg', 'medium_image_url': 'https://img.youtube.com/vi/JTZFjcYGwNk/mqdefault.jpg', 'large_image_url': 'https://img.youtube.com/vi/JTZFjcYGwNk/hqdefault.jpg', 'maximum_image_url': 'https://img.youtube.com/vi/JTZFjcYGwNk/maxresdefault.jpg'}}","""Märchen Mädchen""",Maerchen Maedchen,メルヘン・メドヘン,['Fairy Tale Girls'],TV,Light novel,10,Finished Airing,False,"{'from': '2018-01-11T00:00:00+00:00', 'to': '2018-03-29T00:00:00+00:00', 'prop': {'from': {'day': 11, 'month': 1, 'year': 2018}, 'to': {'day': 29, 'month': 3, 'year': 2018}}, 'string': 'Jan 11, 2018 to Mar 29, 2018'}",23 min per ep,PG-13 - Teens 13 or older,5.39,12068.0,10826.0,2992,37844,35,"Hazuki Kagimura is a socially awkward girl with no friends; and having been recently adopted, she struggles to connect with her new family as well. Her only refuge from this painful reality is between the pages of stories where her vivid imagination allows her to live out her dreams of friendship and adventure. However, one day, an old and mysterious text appears in her book bag. On her way back to the library to return it, Hazuki sees a familiar girl who is seemingly invisible to everyone but her. Deciding to follow her, Hazuki is led a hidden library where a world she thought only existed in her dreams awaits her. Märchen Mädchen tells the story of Hazuki's meeting with Shizuka Tsuchimikado, her very first friend, and discovering she has been chosen by the original print of Cinderella to become a powerful mage known as an Origin Master. Hazuki enrolls at Kuzunoha Girl's Magic Academy where she learns to conquer her fears and believe in her ability to create her own amazing story. [Written by MAL Rewrite]",,winter,2018,"{'day': 'Thursdays', 'time': '21:00', 'timezone': 'Asia/Tokyo', 'string': 'Thursdays at 21:00 (JST)'}","[{'mal_id': 104, 'type': 'anime', 'name': 'Lantis', 'url': 'https://myanimelist.net/anime/producer/104/Lantis'}, {'mal_id': 238, 'type': 'anime', 'name': 'AT-X', 'url': 'https://myanimelist.net/anime/producer/238/AT-X'}, {'mal_id': 1113, 'type': 'anime', 'name': 'NBCUniversal Entertainment Japan', 'url': 'https://myanimelist.net/anime/producer/1113/NBCUniversal_Entertainment_Japan'}, {'mal_id': 1337, 'type': 'anime', 'name': 'Medicos Entertainment', 'url': 'https://myanimelist.net/anime/producer/1337/Medicos_Entertainment'}, {'mal_id': 1365, 'type': 'anime', 'name': 'Shueisha', 'url': 'https://myanimelist.net/anime/producer/1365/Shueisha'}, {'mal_id': 1494, 'type': 'anime', 'name': 'Kanon Sound', 'url': 'https://myanimelist.net/anime/producer/1494/Kanon_Sound'}, {'mal_id': 1542, 'type': 'anime', 'name': 'DMM.com', 'url': 'https://myanimelist.net/anime/producer/1542/DMMcom'}, {'mal_id': 1589, 'type': 'anime', 'name': 'NichiNare', 'url': 'https://myanimelist.net/anime/producer/1589/NichiNare'}]",[],"[{'mal_id': 346, 'type': 'anime', 'name': 'Hoods Entertainment', 'url': 'https://myanimelist.net/anime/producer/346/Hoods_Entertainment'}]","[{'mal_id': 10, 'type': 'anime', 'name': 'Fantasy', 'url': 'https://myanimelist.net/anime/genre/10/Fantasy'}]",[],"[{'mal_id': 23, 'type': 'anime', 'name': 'School', 'url': 'https://myanimelist.net/anime/genre/23/School'}]",[]
36840,https://myanimelist.net/anime/36840/25-sai_no_Joshikousei,"{'jpg': {'image_url': 'https://cdn.myanimelist.net/images/anime/12/89091.jpg', 'small_image_url': 'https://cdn.myanimelist.net/images/anime/12/89091t.jpg', 'large_image_url': 'https://cdn.myanimelist.net/images/anime/12/89091l.jpg'}, 'webp': {'image_url': 'https://cdn.myanimelist.net/images/anime/12/89091.webp', 'small_image_url': 'https://cdn.myanimelist.net/images/anime/12/89091t.webp', 'large_image_url': 'https://cdn.myanimelist.net/images/anime/12/89091l.webp'}}","{'youtube_id': None, 'url': None, 'embed_url': None, 'images': {'image_url': None, 'small_image_url': None, 'medium_image_url': None, 'large_image_url': None, 'maximum_image_url': None}}","""25-sai no Joshikousei""",,25歳の女子高生,['The 25 Year Old High School Girl'],TV,Web manga,12,Finished Airing,False,"{'from': '2018-01-08T00:00:00+00:00', 'to': '2018-03-26T00:00:00+00:00', 'prop': {'from': {'day': 8, 'month': 1, 'year': 2018}, 'to': {'day': 26, 'month': 3, 'year': 2018}}, 'string': 'Jan 8, 2018 to Mar 26, 2018'}",3 min per ep,R+ - Mild Nudity,5.58,12309.0,,3079,35937,104,"Once most students are done with high school, they leave and never come back. However, at 25 years old, Hana Natori finds herself in the role of a student once more at her aunt's request. Since Hana's cousin, Kaho Miyoshi, refuses to go to school, her aunt begs Hana to take Kaho's place, since the two of them are practically identical. But as luck would have it, she is recognized by Okito Kanie—an old classmate from her days in high school—who is now a teacher! With her cover blown, Hana assumes Kanie will expose her secret. But when he suddenly kisses her, she soon learns he has other ideas. [Written by MAL Rewrite]","The anime aired in three versions: an all-ages broadcast version, a 15+ version on AT-X, and an uncut 18+ version streamed on ComicFesta Anime Zone.",winter,2018,"{'day': 'Mondays', 'time': '01:00', 'timezone': 'Asia/Tokyo', 'string': 'Mondays at 01:00 (JST)'}","[{'mal_id': 745, 'type': 'anime', 'name': 'Cosmic Ray', 'url': 'https://myanimelist.net/anime/producer/745/Cosmic_Ray'}, {'mal_id': 1758, 'type': 'anime', 'name': 'Picante Circus', 'url': 'https://myanimelist.net/anime/producer/1758/Picante_Circus'}, {'mal_id': 1760, 'type': 'anime', 'name': 'Suiseisha', 'url': 'https://myanimelist.net/anime/producer/1760/Suiseisha'}, {'mal_id': 1761, 'type': 'anime', 'name': 'Tavac', 'url': 'https://myanimelist.net/anime/producer/1761/Tavac'}]",[],"[{'mal_id': 1759, 'type': 'anime', 'name': 'Lilix', 'url': 'https://myanimelist.net/anime/producer/1759/Lilix'}]","[{'mal_id': 22, 'type': 'anime', 'name': 'Romance', 'url': 'https://myanimelist.net/anime/genre/22/Romance'}, {'mal_id': 49, 'type': 'anime', 'name': 'Erotica', 'url': 'https://myanimelist.net/anime/genre/49/Erotica'}]",[],"[{'mal_id': 23, 'type': 'anime', 'name': 'School', 'url': 'https://myanimelist.net/anime/genre/23/School'}]",[]
35964,https://myanimelist.net/anime/35964/Basilisk__Ouka_Ninpouchou,"{'jpg': {'image_url': 'https://cdn.myanimelist.net/images/anime/2/88384.jpg', 'small_image_url': 'https://cdn.myanimelist.net/images/anime/2/88384t.jpg', 'large_image_url': 'https://cdn.myanimelist.net/images/anime/2/88384l.jpg'}, 'webp': {'image_url': 'https://cdn.myanimelist.net/images/anime/2/88384.webp', 'small_image_url': 'https://cdn.myanimelist.net/images/anime/2/88384t.webp', 'large_image_url': 'https://cdn.myanimelist.net/images/anime/2/88384l.webp'}}","{'youtube_id': 'r6NjqnGIHWA', 'url': 'https://www.youtube.com/watch?v=r6NjqnGIHWA', 'embed_url': 'https://www.youtube.com/embed/r6NjqnGIHWA?enablejsapi=1&wmode=opaque&autoplay=1', 'images': {'image_url': 'https://img.youtube.com/vi/r6NjqnGIHWA/default.jpg', 'small_image_url': 'https://img.youtube.com/vi/r6NjqnGIHWA/sddefault.jpg', 'medium_image_url': 'https://img.youtube.com/vi/r6NjqnGIHWA/mqdefault.jpg', 'large_image_url': 'https://img.youtube.com/vi/r6NjqnGIHWA/hqdefault.jpg', 'maximum_image_url': 'https://img.youtube.com/vi/r6NjqnGIHWA/maxresdefault.jpg'}}","""Basilisk: Ouka Ninpouchou""",Basilisk: The Ouka Ninja Scrolls,バジリスク ～桜花忍法帖～,[],TV,Manga,24,Finished Airing,False,"{'from': '2018-01-09T00:00:00+00:00', 'to': '2018-06-19T00:00:00+00:00', 'prop': {'from': {'day': 9, 'month': 1, 'year': 2018}, 'to': {'day': 19, 'month': 6, 'year': 2018}}, 'string': 'Jan 9, 2018 to Jun 19, 2018'}",23 min per ep,R - 17+ (violence & profanity),5.5,7431.0,10488.0,3217,33230,27,"It has been 10 years since the war between the Iga and Kouga ninja clans came to an end. The two groups have since made peace, supposedly dispelling the animosity that once existed between them. Hachirou Kouga and Hibiki Iga, the successors of their respective bloodlines, seem to have the perfect conditions for their love to bloom, but not everyone is satisfied with the results of the age-old battle. Different tales of the final showdown between Gennosuke Kouga and Oboro Iga have spread, leaving Tadanaga Tokugawa—whom the Kouga represented—dissatisfied. As tension between the two clans rises once again, the brewing political climate threatens to keep the two fated lovers apart, just as it had in the previous generation. [Written by MAL Rewrite]",,winter,2018,"{'day': 'Tuesdays', 'time': '00:00', 'timezone': 'Asia/Tokyo', 'string': 'Tuesdays at 00:00 (JST)'}","[{'mal_id': 159, 'type': 'anime', 'name': 'Kodansha', 'url': 'https://myanimelist.net/anime/producer/159/Kodansha'}, {'mal_id': 1255, 'type': 'anime', 'name': 'Glovision', 'url': 'https://myanimelist.net/anime/producer/1255/Glovision'}, {'mal_id': 1344, 'type': 'anime', 'name': 'King Records', 'url': 'https://myanimelist.net/anime/producer/1344/King_Records'}, {'mal_id': 1785, 'type': 'anime', 'name': 'Universal Entertainment', 'url': 'https://myanimelist.net/anime/producer/1785/Universal_Entertainment'}]","[{'mal_id': 102, 'type': 'anime', 'name': 'Funimation', 'url': 'https://myanimelist.net/anime/producer/102/Funimation'}]","[{'mal_id': 1569, 'type': 'anime', 'name': 'Seven Arcs Pictures', 'url': 'https://myanimelist.net/anime/producer/1569/Seven_Arcs_Pictures'}]","[{'mal_id': 1, 'type': 'anime', 'name': 'Action', 'url': 'https://myanimelist.net/anime/genre/1/Action'}, {'mal_id': 8, 'type': 'anime', 'name': 'Drama', 'url': 'https://myanimelist.net/anime/genre/8/Drama'}]",[],"[{'mal_id': 13, 'type': 'anime', 'name': 'Historical', 'url': 'https://myanimelist.net/anime/genre/13/Historical'}, {'mal_id': 17, 'type': 'anime', 'name': 'Martial Arts', 'url': 'https://myanimelist.net/anime/genre/17/Martial_Arts'}]",[]
35988,https://myanimelist.net/anime/35988/Dame_x_Prince_Anime_Caravan,"{'jpg': {'image_url': 'https://cdn.myanimelist.net/images/anime/9/87462.jpg', 'small_image_url': 'https://cdn.myanimelist.net/images/anime/9/87462t.jpg', 'large_image_url': 'https://cdn.myanimelist.net/images/anime/9/87462l.jpg'}, 'webp': {'image_url': 'https://cdn.myanimelist.net/images/anime/9/87462.webp', 'small_image_url': 'https://cdn.myanimelist.net/images/anime/9/87462t.webp', 'large_image_url': 'https://cdn.myanimelist.net/images/anime/9/87462l.webp'}}","{'youtube_id': '0nZIPaq_nUA', 'url': 'https://www.youtube.com/watch?v=0nZIPaq_nUA', 'embed_url': 'https://www.youtube.com/embed/0nZIPaq_nUA?enablejsapi=1&wmode=opaque&autoplay=1', 'images': {'image_url': 'https://img.youtube.com/vi/0nZIPaq_nUA/default.jpg', 'small_image_url': 'https://img.youtube.com/vi/0nZIPaq_nUA/sddefault.jpg', 'medium_image_url': 'https://img.youtube.com/vi/0nZIPaq_nUA/mqdefault.jpg', 'large_image_url': 'https://img.youtube.com/vi/0nZIPaq_nUA/hqdefault.jpg', 'maximum_image_url': 'https://img.youtube.com/vi/0nZIPaq_nUA/maxresdefault.jpg'}}","""Dame x Prince Anime Caravan""",Damepri Anime Caravan,ダメプリ ANIME CARAVAN,[],TV,Visual novel,12,Finished Airing,False,"{'from': '2018-01-10T00:00:00+00:00', 'to': '2018-03-28T00:00:00+00:00', 'prop': {'from': {'day': 10, 'month': 1, 'year': 2018}, 'to': {'day': 28, 'month': 3, 'year': 2018}}, 'string': 'Jan 10, 2018 to Mar 28, 2018'}",23 min per ep,PG-13 - Teens 13 or older,6.5,7189.0,6195.0,3628,26050,73,"Inako is a minor country, enclosed by two superior countries: the militaristic Milidonia, with its goal of conquering as much land as possible, and the monotheiestic Selenfalen, devoted to the deity Saint Philia. Ani Inako is the sole princess of her country, and in order to eliminate hostility between the three countries, she is sent as Inako's representative to a peace treaty signing in Selenfalen. However, Ani's hopes of a smooth ceremony are shattered when she meets the eccentric princes from her rival countries. With the treaty binding the three countries together, Ani and the princes must learn to overcome their differences. Together, they search for common ground on which to develop their friendship. [Written by MAL Rewrite]",,winter,2018,"{'day': 'Wednesdays', 'time': '22:30', 'timezone': 'Asia/Tokyo', 'string': 'Wednesdays at 22:30 (JST)'}","[{'mal_id': 1694, 'type': 'anime', 'name': 'AZ Creative', 'url': 'https://myanimelist.net/anime/producer/1694/AZ_Creative'}]","[{'mal_id': 376, 'type': 'anime', 'name': 'Sentai Filmworks', 'url': 'https://myanimelist.net/anime/producer/376/Sentai_Filmworks'}]","[{'mal_id': 1693, 'type': 'anime', 'name': 'Studio Flad', 'url': 'https://myanimelist.net/anime/producer/1693/Studio_Flad'}]","[{'mal_id': 2, 'type': 'anime', 'name': 'Adventure', 'url': 'https://myanimelist.net/anime/genre/2/Adventure'}, {'mal_id': 4, 'type': 'anime', 'name': 'Comedy', 'url': 'https://myanimelist.net/anime/genre/4/Comedy'}, {'mal_id': 10, 'type': 'anime', 'name': 'Fantasy', 'url': 'https://myanimelist.net/anime/genre/10/Fantasy'}, {'mal_id': 22, 'type': 'anime', 'name': 'Romance', 'url': 'https://myanimelist.net/anime/genre/22/Romance'}]",[],[],[]
34863,https://myanimelist.net/anime/34863/Zoku_Touken_Ranbu__Hanamaru,"{'jpg': {'image_url': 'https://cdn.myanimelist.net/images/anime/5/89579.jpg', 'small_image_url': 'https://cdn.myanimelist.net/images/anime/5/89579t.jpg', 'large_image_url': 'https://cdn.myanimelist.net/images/anime/5/89579l.jpg'}, 'webp': {'image_url': 'https://cdn.myanimelist.net/images/anime/5/89579.webp', 'small_image_url': 'https://cdn.myanimelist.net/images/anime/5/89579t.webp', 'large_image_url': 'https://cdn.myanimelist.net/images/anime/5/89579l.webp'}}","{'youtube_id': 'xaACzaIUgq8', 'url': 'https://www.youtube.com/watch?v=xaACzaIUgq8', 'embed_url': 'https://www.youtube.com/embed/xaACzaIUgq8?enablejsapi=1&wmode=opaque&autoplay=1', 'images': {'image_url': 'https://img.youtube.com/vi/xaACzaIUgq8/default.jpg', 'small_image_url': 'https://img.youtube.com/vi/xaACzaIUgq8/sddefault.jpg', 'medium_image_url': 'https://img.youtube.com/vi/xaACzaIUgq8/mqdefault.jpg', 'large_image_url': 'https://img.youtube.com/vi/xaACzaIUgq8/hqdefault.jpg', 'maximum_image_url': 'https://img.youtube.com/vi/xaACzaIUgq8/maxresdefault.jpg'}}","""Zoku Touken Ranbu: Hanamaru""",,続 刀剣乱舞-花丸-,['Touken Ranbu: Hanamaru Second Season'],TV,Game,12,Finished Airing,False,"{'from': '2018-01-08T00:00:00+00:00', 'to': '2018-03-26T00:00:00+00:00', 'prop': {'from': {'day': 8, 'month': 1, 'year': 2018}, 'to': {'day': 26, 'month': 3, 'year': 2018}}, 'string': 'Jan 8, 2018 to Mar 26, 2018'}",24 min per ep,PG-13 - Teens 13 or older,7.3,6756.0,2415.0,3648,25725,129,Sequel of Touken Ranbu: Hanamaru.,,winter,2018,"{'day': 'Mondays', 'time': '00:00', 'timezone': 'Asia/Tokyo', 'string': 'Mondays at 00:00 (JST)'}","[{'mal_id': 82, 'type': 'anime', 'name': 'Marvelous', 'url': 'https://myanimelist.net/anime/producer/82/Marvelous'}, {'mal_id': 459, 'type': 'anime', 'name': 'Nitroplus', 'url': 'https://myanimelist.net/anime/producer/459/Nitroplus'}, {'mal_id': 1143, 'type': 'anime', 'name': 'TOHO animation', 'url': 'https://myanimelist.net/anime/producer/1143/TOHO_animation'}, {'mal_id': 1261, 'type': 'anime', 'name': 'Good Smile Company', 'url': 'https://myanimelist.net/anime/producer/1261/Good_Smile_Company'}, {'mal_id': 1542, 'type': 'anime', 'name': 'DMM.com', 'url': 'https://myanimelist.net/anime/producer/1542/DMMcom'}]","[{'mal_id': 102, 'type': 'anime', 'name': 'Funimation', 'url': 'https://myanimelist.net/anime/producer/102/Funimation'}]","[{'mal_id': 95, 'type': 'anime', 'name': 'Doga Kobo', 'url': 'https://myanimelist.net/anime/producer/95/Doga_Kobo'}]","[{'mal_id': 1, 'type': 'anime', 'name': 'Action', 'url': 'https://myanimelist.net/anime/genre/1/Action'}, {'mal_id': 4, 'type': 'anime', 'name': 'Comedy', 'url': 'https://myanimelist.net/anime/genre/4/Comedy'}, {'mal_id': 8, 'type': 'anime', 'name': 'Drama', 'url': 'https://myanimelist.net/anime/genre/8/Drama'}, {'mal_id': 10, 'type': 'anime', 'name': 'Fantasy', 'url': 'https://myanimelist.net/anime/genre/10/Fantasy'}, {'mal_id': 36, 'type': 'anime', 'name': 'Slice of Life', 'url': 'https://myanimelist.net/anime/genre/36/Slice_of_Life'}]",[],"[{'mal_id': 13, 'type': 'anime', 'name': 'Historical', 'url': 'https://myanimelist.net/anime/genre/13/Historical'}]",[]
36029,https://myanimelist.net/anime/36029/Hakyuu_Houshin_Engi,"{'jpg': {'image_url': 'https://cdn.myanimelist.net/images/anime/11/88796.jpg', 'small_image_url': 'https://cdn.myanimelist.net/images/anime/11/88796t.jpg', 'large_image_url': 'https://cdn.myanimelist.net/images/anime/11/88796l.jpg'}, 'webp': {'image_url': 'https://cdn.myanimelist.net/images/anime/11/88796.webp', 'small_image_url': 'https://cdn.myanimelist.net/images/anime/11/88796t.webp', 'large_image_url': 'https://cdn.myanimelist.net/images/anime/11/88796l.webp'}}","{'youtube_id': '8sztcJ_aJYI', 'url': 'https://www.youtube.com/watch?v=8sztcJ_aJYI', 'embed_url': 'https://www.youtube.com/embed/8sztcJ_aJYI?enablejsapi=1&wmode=opaque&autoplay=1', 'images': {'image_url': 'https://img.youtube.com/vi/8sztcJ_aJYI/default.jpg', 'small_image_url': 'https://img.youtube.com/vi/8sztcJ_aJYI/sddefault.jpg', 'medium_image_url': 'https://img.youtube.com/vi/8sztcJ_aJYI/mqdefault.jpg', 'large_image_url': 'https://img.youtube.com/vi/8sztcJ_aJYI/hqdefault.jpg', 'maximum_image_url': 'https://img.youtube.com/vi/8sztcJ_aJYI/maxresdefault.jpg'}}","""Hakyuu Houshin Engi""",Hakyu Hoshin Engi,覇穹 封神演義,[],TV,Manga,23,Finished Airing,False,"{'from': '2018-01-12T00:00:00+00:00', 'to': '2018-06-29T00:00:00+00:00', 'prop': {'from': {'day': 12, 'month': 1, 'year': 2018}, 'to': {'day': 29, 'month': 6, 'year': 2018}}, 'string': 'Jan 12, 2018 to Jun 29, 2018'}",23 min per ep,PG-13 - Teens 13 or older,5.37,3194.0,10882.0,4174,19077,18,"When his clan is wiped out by a beautiful demon, young Taikobo finds himself in charge of the mysterious Houshin Project. Its mission: find all immortals living in the human world and seal them away forever. But who do you trust—and whose side are you really on—when you've been trained to hunt demons by a demon? (Source: VIZ Media)",,winter,2018,"{'day': 'Fridays', 'time': '22:00', 'timezone': 'Asia/Tokyo', 'string': 'Fridays at 22:00 (JST)'}","[{'mal_id': 1113, 'type': 'anime', 'name': 'NBCUniversal Entertainment Japan', 'url': 'https://myanimelist.net/anime/producer/1113/NBCUniversal_Entertainment_Japan'}, {'mal_id': 1331, 'type': 'anime', 'name': 'i0+', 'url': 'https://myanimelist.net/anime/producer/1331/i0_'}]","[{'mal_id': 102, 'type': 'anime', 'name': 'Funimation', 'url': 'https://myanimelist.net/anime/producer/102/Funimation'}]","[{'mal_id': 1075, 'type': 'anime', 'name': 'C-Station', 'url': 'https://myanimelist.net/anime/producer/1075/C-Station'}]","[{'mal_id': 2, 'type': 'anime', 'name': 'Adventure', 'url': 'https://myanimelist.net/anime/genre/2/Adventure'}, {'mal_id': 10, 'type': 'anime', 'name': 'Fantasy', 'url': 'https://myanimelist.net/anime/genre/10/Fantasy'}, {'mal_id': 37, 'type': 'anime', 'name': 'Supernatural', 'url': 'https://myanimelist.net/anime/genre/37/Supernatural'}]",[],"[{'mal_id': 6, 'type': 'anime', 'name': 'Demons', 'url': 'https://myanimelist.net/anime/genre/6/Demons'}]","[{'mal_id': 27, 'type': 'anime', 'name': 'Shounen', 'url': 'https://myanimelist.net/anime/genre/27/Shounen'}]"
36593,https://myanimelist.net/anime/36593/Hug_tto_Precure,"{'jpg': {'image_url': 'https://cdn.myanimelist.net/images/anime/1220/92883.jpg', 'small_image_url': 'https://cdn.myanimelist.net/images/anime/1220/92883t.jpg', 'large_image_url': 'https://cdn.myanimelist.net/images/anime/1220/92883l.jpg'}, 'webp': {'image_url': 'https://cdn.myanimelist.net/images/anime/1220/92883.webp', 'small_image_url': 'https://cdn.myanimelist.net/images/anime/1220/92883t.webp', 'large_image_url': 'https://cdn.myanimelist.net/images/anime/1220/92883l.webp'}}","{'youtube_id': 'My1u0ka_xck', 'url': 'https://www.youtube.com/watch?v=My1u0ka_xck', 'embed_url': 'https://www.youtube.com/embed/My1u0ka_xck?enablejsapi=1&wmode=opaque&autoplay=1', 'images': {'image_url': 'https://img.youtube.com/vi/My1u0ka_xck/default.jpg', 'small_image_url': 'https://img.youtube.com/vi/My1u0ka_xck/sddefault.jpg', 'medium_image_url': 'https://img.youtube.com/vi/My1u0ka_xck/mqdefault.jpg', 'large_image_url': 'https://img.youtube.com/vi/My1u0ka_xck/hqdefault.jpg', 'maximum_image_url': 'https://img.youtube.com/vi/My1u0ka_xck/maxresdefault.jpg'}}","""Hug tto! Precure""",,HuGっと！プリキュア,['Hugtto Precure'],TV,Original,49,Finished Airing,False,"{'from': '2018-02-04T00:00:00+00:00', 'to': '2019-01-27T00:00:00+00:00', 'prop': {'from': {'day': 4, 'month': 2, 'year': 2018}, 'to': {'day': 27, 'month': 1, 'year': 2019}}, 'string': 'Feb 4, 2018 to Jan 27, 2019'}",24 min per ep,G - All Ages,7.77,3505.0,923.0,4820,13381,207,"It's her first day at a new school, and the cheerful Hana Nono is ready to make a fresh start, dreaming of becoming mature and reliable—a far cry from her usual childish self. Although she makes a disastrous first impression, Hana soon befriends two of her classmates: the gentle and studious class representative Saaya Yakushiji, and a cool and mysterious girl Homare Kagayaki. That night, a magical baby falls from the sky right onto Hana's balcony. She is immediately smitten with her and names her Hug-tan. Alongside Hug-tan is a snarky talking hamster, Hariham Harry, who mutters that Hana ""isn't the one"" before vanishing with the baby. The next day, Hana believes the encounter to be a dream, until people all over the city begin collapsing and a giant monster appears, feeding on their energy. As Hana escapes, she spots Hug-tan and Harry under attack. Making a stand to protect them, she and Hug-tan suddenly both glow with energy and a heart-shaped gem forms. With the crystal's power, Hana transforms into a hero called ""Cure Yell"" and defeats the monster. Surprised at Hana's power, Harry explains that he and Hug-tan came from a future frozen in time by the Criasu Corporation, the same organization that created the monster. Only the Future Crystals, manifestations of one's hopes and dreams, and the Precure they create have a chance at defeating Criasu and saving the future! [Written by MAL Rewrite]",,winter,2018,"{'day': 'Sundays', 'time': '08:30', 'timezone': 'Asia/Tokyo', 'string': 'Sundays at 08:30 (JST)'}","[{'mal_id': 1415, 'type': 'anime', 'name': 'Asahi Broadcasting', 'url': 'https://myanimelist.net/anime/producer/1415/Asahi_Broadcasting'}, {'mal_id': 1500, 'type': 'anime', 'name': 'ABC Animation', 'url': 'https://myanimelist.net/anime/producer/1500/ABC_Animation'}, {'mal_id': 1522, 'type': 'anime', 'name': 'Echoes', 'url': 'https://myanimelist.net/anime/producer/1522/Echoes'}]",[],"[{'mal_id': 18, 'type': 'anime', 'name': 'Toei Animation', 'url': 'https://myanimelist.net/anime/producer/18/Toei_Animation'}]","[{'mal_id': 1, 'type': 'anime', 'name': 'Action', 'url': 'https://myanimelist.net/anime/genre/1/Action'}, {'mal_id': 10, 'type': 'anime', 'name': 'Fantasy', 'url': 'https://myanimelist.net/anime/genre/10/Fantasy'}]",[],[],"[{'mal_id': 25, 'type': 'anime', 'name': 'Shoujo', 'url': 'https://myanimelist.net/anime/genre/25/Shoujo'}]"
