mal_id,url,images,trailer,title,title_english,title_japanese,title_synonyms,type,source,episodes,status,airing,aired,duration,rating,score,scored_by,rank,popularity,members,favorites,synopsis,background,season,year,broadcast,producers,licensors,studios,genres,explicit_genres,themes,demographics
37579,https://myanimelist.net/anime/37579/Tonari_no_Kyuuketsuki-san,"{'jpg': {'image_url': 'https://cdn.myanimelist.net/images/anime/1851/96154.jpg', 'small_image_url': 'https://cdn.myanimelist.net/images/anime/1851/96154t.jpg', 'large_image_url': 'https://cdn.myanimelist.net/images/anime/1851/96154l.jpg'}, 'webp': {'image_url': 'https://cdn.myanimelist.net/images/anime/1851/96154.webp', 'small_image_url': 'https://cdn.myanimelist.net/images/anime/1851/96154t.webp', 'large_image_url': 'https://cdn.myanimelist.net/images/anime/1851/96154l.webp'}}","{'youtube_id': 'WNtmFBt3yzM', 'url': 'https://www.youtube.com/watch?v=WNtmFBt3yzM', 'embed_url': 'https://www.youtube.com/embed/WNtmFBt3yzM?enablejsapi=1&wmode=opaque&autoplay=1', 'images': {'image_url': 'https://img.youtube.com/vi/WNtmFBt3yzM/default.jpg', 'small_image_url': 'https://img.youtube.com/vi/WNtmFBt3yzM/sddefault.jpg', 'medium_image_url': 'https://img.youtube.com/vi/WNtmFBt3yzM/mqdefault.jpg', 'large_image_url': 'https://img.youtube.com/vi/WNtmFBt3yzM/hqdefault.jpg', 'maximum_image_url': 'https://img.youtube.com/vi/WNtmFBt3yzM/maxresdefault.jpg'}}","""Tonari no Kyuuketsuki-san""",Ms. vampire who lives in my neighborhood.,となりの吸血鬼さん,[],TV,4-koma manga,12.0,Finished Airing,False,"{'from': '2018-10-05T00:00:00+00:00', 'to': '2018-12-21T00:00:00+00:00', 'prop': {'from': {'day': 5, 'month': 10, 'year': 2018}, 'to': {'day': 21, 'month': 12, 'year': 2018}}, 'string': 'Oct 5, 2018 to Dec 21, 2018'}",23 min per ep,PG-13 - Teens 13 or older,7.09,34802.0,3436.0,1794,90842,288,"Rumors tell about an ageless girl who only comes out at night, living in a mansion in the middle of the forest. Some say that she is a living doll with a soul. Upon hearing these rumors, Akari Amano seeks out this girl, only to find herself lost as she treks through the woods amidst the darkness. A vampire named Sophie Twilight saves her, turning out to be the rumored girl. However, unlike the vampires told in myths, Sophie does not attack humans and instead orders her blood online. Akari instantly becomes charmed with her doll-like appearance and proceeds to abruptly move in with her, thus starting their life together. [Written by MAL Rewrite]",,fall,2018,"{'day': 'Fridays', 'time': '21:00', 'timezone': 'Asia/Tokyo', 'string': 'Fridays at 21:00 (JST)'}","[{'mal_id': 323, 'type': 'anime', 'name': 'Nippon Columbia', 'url': 'https://myanimelist.net/anime/producer/323/Nippon_Columbia'}]",[],"[{'mal_id': 418, 'type': 'anime', 'name': 'Studio Gokumi', 'url': 'https://myanimelist.net/anime/producer/418/Studio_Gokumi'}, {'mal_id': 1299, 'type': 'anime', 'name': 'AXsiZ', 'url': 'https://myanimelist.net/anime/producer/1299/AXsiZ'}]","[{'mal_id': 4, 'type': 'anime', 'name': 'Comedy', 'url': 'https://myanimelist.net/anime/genre/4/Comedy'}, {'mal_id': 26, 'type': 'anime', 'name': 'Girls Love', 'url': 'https://myanimelist.net/anime/genre/26/Girls_Love'}, {'mal_id': 36, 'type': 'anime', 'name': 'Slice of Life', 'url': 'https://myanimelist.net/anime/genre/36/Slice_of_Life'}, {'mal_id': 37, 'type': 'anime', 'name': 'Supernatural', 'url': 'https://myanimelist.net/anime/genre/37/Supernatural'}]",[],"[{'mal_id': 32, 'type': 'anime', 'name': 'Vampire', 'url': 'https://myanimelist.net/anime/genre/32/Vampire'}]",[]
36510,https://myanimelist.net/anime/36510/Ulysses__Jehanne_Darc_to_Renkin_no_Kishi,"{'jpg': {'image_url': 'https://cdn.myanimelist.net/images/anime/1143/96156.jpg', 'small_image_url': 'https://cdn.myanimelist.net/images/anime/1143/96156t.jpg', 'large_image_url': 'https://cdn.myanimelist.net/images/anime/1143/96156l.jpg'}, 'webp': {'image_url': 'https://cdn.myanimelist.net/images/anime/1143/96156.webp', 'small_image_url': 'https://cdn.myanimelist.net/images/anime/1143/96156t.webp', 'large_image_url': 'https://cdn.myanimelist.net/images/anime/1143/96156l.webp'}}","{'youtube_id': 'urU8KadLj10', 'url': 'https://www.youtube.com/watch?v=urU8KadLj10', 'embed_url': 'https://www.youtube.com/embed/urU8KadLj10?enablejsapi=1&wmode=opaque&autoplay=1', 'images': {'image_url': 'https://img.youtube.com/vi/urU8KadLj10/default.jpg', 'small_image_url': 'https://img.youtube.com/vi/urU8KadLj10/sddefault.jpg', 'medium_image_url': 'https://img.youtube.com/vi/urU8KadLj10/mqdefault.jpg', 'large_image_url': 'https://img.youtube.com/vi/urU8KadLj10/hqdefault.jpg', 'maximum_image_url': 'https://img.youtube.com/vi/urU8KadLj10/maxresdefault.jpg'}}","""Ulysses: Jehanne Darc to Renkin no Kishi""",Ulysses: Jeanne d'Arc and the Alchemist Knight,ユリシーズ ジャンヌ・ダルクと錬金の騎士,"[""Ulysses: Jeanne d'Arc to Renkin no Kishi""]",TV,Light novel,12.0,Finished Airing,False,"{'from': '2018-10-07T00:00:00+00:00', 'to': '2018-12-30T00:00:00+00:00', 'prop': {'from': {'day': 7, 'month': 10, 'year': 2018}, 'to': {'day': 30, 'month': 12, 'year': 2018}}, 'string': 'Oct 7, 2018 to Dec 30, 2018'}",23 min per ep,PG-13 - Teens 13 or older,5.33,25895.0,11004.0,1901,83398,94,"The story is set in the 15th century, during the Hundred Years' War between France and England over the succession to the French throne. Montmorency, the son of a noble, immerses himself in the studies of magic and alchemy at a royal knight training school. However, following France's crushing defeat at Agincourt, the school is dissolved. Having lost everything and now a wanted man, Montmorency, who had just become an alchemist, encounters a mysterious village girl named Jehanne. (Source: MAL News)",,fall,2018,"{'day': 'Sundays', 'time': '22:00', 'timezone': 'Asia/Tokyo', 'string': 'Sundays at 22:00 (JST)'}","[{'mal_id': 104, 'type': 'anime', 'name': 'Lantis', 'url': 'https://myanimelist.net/anime/producer/104/Lantis'}, {'mal_id': 719, 'type': 'anime', 'name': 'Studio Mausu', 'url': 'https://myanimelist.net/anime/producer/719/Studio_Mausu'}, {'mal_id': 1365, 'type': 'anime', 'name': 'Shueisha', 'url': 'https://myanimelist.net/anime/producer/1365/Shueisha'}, {'mal_id': 1492, 'type': 'anime', 'name': 'Yomiuri TV Enterprise', 'url': 'https://myanimelist.net/anime/producer/1492/Yomiuri_TV_Enterprise'}, {'mal_id': 1530, 'type': 'anime', 'name': 'Emon', 'url': 'https://myanimelist.net/anime/producer/1530/Emon'}, {'mal_id': 1671, 'type': 'anime', 'name': 'DMM pictures', 'url': 'https://myanimelist.net/anime/producer/1671/DMM_pictures'}, {'mal_id': 1784, 'type': 'anime', 'name': 'Crunchyroll SC Anime Fund', 'url': 'https://myanimelist.net/anime/producer/1784/Crunchyroll_SC_Anime_Fund'}, {'mal_id': 1840, 'type': 'anime', 'name': 'Bandai Namco Arts', 'url': 'https://myanimelist.net/anime/producer/1840/Bandai_Namco_Arts'}]","[{'mal_id': 102, 'type': 'anime', 'name': 'Funimation', 'url': 'https://myanimelist.net/anime/producer/102/Funimation'}]","[{'mal_id': 1299, 'type': 'anime', 'name': 'AXsiZ', 'url': 'https://myanimelist.net/anime/producer/1299/AXsiZ'}]","[{'mal_id': 1, 'type': 'anime', 'name': 'Action', 'url': 'https://myanimelist.net/anime/genre/1/Action'}, {'mal_id': 10, 'type': 'anime', 'name': 'Fantasy', 'url': 'https://myanimelist.net/anime/genre/10/Fantasy'}]",[],[],[]
37716,https://myanimelist.net/anime/37716/Beelzebub-jou_no_Okinimesu_mama,"{'jpg': {'image_url': 'https://cdn.myanimelist.net/images/anime/1827/95738.jpg', 'small_image_url': 'https://cdn.myanimelist.net/images/anime/1827/95738t.jpg', 'large_image_url': 'https://cdn.myanimelist.net/images/anime/1827/95738l.jpg'}, 'webp': {'image_url': 'https://cdn.myanimelist.net/images/anime/1827/95738.webp', 'small_image_url': 'https://cdn.myanimelist.net/images/anime/1827/95738t.webp', 'large_image_url': 'https://cdn.myanimelist.net/images/anime/1827/95738l.webp'}}","{'youtube_id': 'txdgfgErcgw', 'url': 'https://www.youtube.com/watch?v=txdgfgErcgw', 'embed_url': 'https://www.youtube.com/embed/txdgfgErcgw?enablejsapi=1&wmode=opaque&autoplay=1', 'images': {'image_url': 'https://img.youtube.com/vi/txdgfgErcgw/default.jpg', 'small_image_url': 'https://img.youtube.com/vi/txdgfgErcgw/sddefault.jpg', 'medium_image_url': 'https://img.youtube.com/vi/txdgfgErcgw/mqdefault.jpg', 'large_image_url': 'https://img.youtube.com/vi/txdgfgErcgw/hqdefault.jpg', 'maximum_image_url': 'https://img.youtube.com/vi/txdgfgErcgw/maxresdefault.jpg'}}","""Beelzebub-jou no Okinimesu mama.""",As Miss Beelzebub Likes.,ベルゼブブ嬢のお気に召すまま。,[],TV,4-koma manga,12.0,Finished Airing,False,"{'from': '2018-10-11T00:00:00+00:00', 'to': '2018-12-27T00:00:00+00:00', 'prop': {'from': {'day': 11, 'month': 10, 'year': 2018}, 'to': {'day': 27, 'month': 12, 'year': 2018}}, 'string': 'Oct 11, 2018 to Dec 27, 2018'}",24 min per ep,PG-13 - Teens 13 or older,7.25,28906.0,2657.0,1931,81027,291,"According to legend, Beelzebub, one of the seven princes of Hell, betrayed God and was banished from Heaven for eternity. Beelzebub now leads the kingdom of Pandemonium, where all former angels roam and work every single day of their immortal lives. A devil like him would give people chills at the mere mention of his name, but... What if Beelzebub is not as evil as initially thought? What if he was obsessed with fluffy things? And what if Beelzebub is actually a woman? That is what new assistant Myurin discovers when he is hired to serve Her Majesty Beelzebub. She may know exactly what to do to keep Pandemonium running like clockwork, but whenever she leaves the professionalism of the office, the girl needs some assistance in order to function like a normal... devil. As much as Myurin can't stand being unprofessional, he is secretly obsessed with her adorable antics, and his new job teaches him that everything is not exactly what it seems, especially with the other head devils of Pandemonium. [Written by MAL Rewrite]",,fall,2018,"{'day': 'Thursdays', 'time': '02:50', 'timezone': 'Asia/Tokyo', 'string': 'Thursdays at 02:50 (JST)'}","[{'mal_id': 17, 'type': 'anime', 'name': 'Aniplex', 'url': 'https://myanimelist.net/anime/producer/17/Aniplex'}, {'mal_id': 58, 'type': 'anime', 'name': 'Square Enix', 'url': 'https://myanimelist.net/anime/producer/58/Square_Enix'}, {'mal_id': 166, 'type': 'anime', 'name': 'Movic', 'url': 'https://myanimelist.net/anime/producer/166/Movic'}, {'mal_id': 719, 'type': 'anime', 'name': 'Studio Mausu', 'url': 'https://myanimelist.net/anime/producer/719/Studio_Mausu'}, {'mal_id': 1211, 'type': 'anime', 'name': 'Tokyo MX', 'url': 'https://myanimelist.net/anime/producer/1211/Tokyo_MX'}, {'mal_id': 1287, 'type': 'anime', 'name': 'Q-Tec', 'url': 'https://myanimelist.net/anime/producer/1287/Q-Tec'}, {'mal_id': 1500, 'type': 'anime', 'name': 'ABC Animation', 'url': 'https://myanimelist.net/anime/producer/1500/ABC_Animation'}, {'mal_id': 1901, 'type': 'anime', 'name': 'CA-Cygames Anime Fund', 'url': 'https://myanimelist.net/anime/producer/1901/CA-Cygames_Anime_Fund'}]",[],"[{'mal_id': 839, 'type': 'anime', 'name': 'LIDENFILMS', 'url': 'https://myanimelist.net/anime/producer/839/LIDENFILMS'}]","[{'mal_id': 4, 'type': 'anime', 'name': 'Comedy', 'url': 'https://myanimelist.net/anime/genre/4/Comedy'}, {'mal_id': 10, 'type': 'anime', 'name': 'Fantasy', 'url': 'https://myanimelist.net/anime/genre/10/Fantasy'}, {'mal_id': 22, 'type': 'anime', 'name': 'Romance', 'url': 'https://myanimelist.net/anime/genre/22/Romance'}]",[],"[{'mal_id': 6, 'type': 'anime', 'name': 'Demons', 'url': 'https://myanimelist.net/anime/genre/6/Demons'}]","[{'mal_id': 27, 'type': 'anime', 'name': 'Shounen', 'url': 'https://myanimelist.net/anime/genre/27/Shounen'}]"
37221,https://myanimelist.net/anime/37221/Release_the_Spyce,"{'jpg': {'image_url': 'https://cdn.myanimelist.net/images/anime/1623/95617.jpg', 'small_image_url': 'https://cdn.myanimelist.net/images/anime/1623/95617t.jpg', 'large_image_url': 'https://cdn.myanimelist.net/images/anime/1623/95617l.jpg'}, 'webp': {'image_url': 'https://cdn.myanimelist.net/images/anime/1623/95617.webp', 'small_image_url': 'https://cdn.myanimelist.net/images/anime/1623/95617t.webp', 'large_image_url': 'https://cdn.myanimelist.net/images/anime/1623/95617l.webp'}}","{'youtube_id': 'hHXDkXq39yM', 'url': 'https://www.youtube.com/watch?v=hHXDkXq39yM', 'embed_url': 'https://www.youtube.com/embed/hHXDkXq39yM?enablejsapi=1&wmode=opaque&autoplay=1', 'images': {'image_url': 'https://img.youtube.com/vi/hHXDkXq39yM/default.jpg', 'small_image_url': 'https://img.youtube.com/vi/hHXDkXq39yM/sddefault.jpg', 'medium_image_url': 'https://img.youtube.com/vi/hHXDkXq39yM/mqdefault.jpg', 'large_image_url': 'https://img.youtube.com/vi/hHXDkXq39yM/hqdefault.jpg', 'maximum_image_url': 'https://img.youtube.com/vi/hHXDkXq39yM/maxresdefault.jpg'}}","""Release the Spyce""",Release the Spyce,RELEASE THE SPYCE,[],TV,Original,12.0,Finished Airing,False,"{'from': '2018-10-07T00:00:00+00:00', 'to': '2018-12-23T00:00:00+00:00', 'prop': {'from': {'day': 7, 'month': 10, 'year': 2018}, 'to': {'day': 23, 'month': 12, 'year': 2018}}, 'string': 'Oct 7, 2018 to Dec 23, 2018'}",24 min per ep,PG-13 - Teens 13 or older,6.95,20420.0,4022.0,2251,63087,190,"Momo Minamoto is a shy teenager who simply wants to do good in the world. Her dream is to follow in her police officer father's footsteps and support law and order. And just like him, she has a very unique ability: her senses are much more refined than those of any average person. A simple lick will enable her to determine what someone is feeling. One night, as she admires the landscape, Momo sees suspicious shades moving in the distance. After learning that those shades were spies, she is recruited by their captain Yuki Hanzoumon, a senior at her school. The members of their secret agency, called the Tsukikage, also have the power to gain strength after ingesting spices. Release the Spyce is an action-packed spy series about the Tsukikage's missions as they fight in the shadows to protect the city from crime while keeping up with their high school life. [Written by MAL Rewrite]",,fall,2018,"{'day': 'Sundays', 'time': '02:38', 'timezone': 'Asia/Tokyo', 'string': 'Sundays at 02:38 (JST)'}","[{'mal_id': 143, 'type': 'anime', 'name': 'Mainichi Broadcasting System', 'url': 'https://myanimelist.net/anime/producer/143/Mainichi_Broadcasting_System'}, {'mal_id': 144, 'type': 'anime', 'name': 'Pony Canyon', 'url': 'https://myanimelist.net/anime/producer/144/Pony_Canyon'}, {'mal_id': 213, 'type': 'anime', 'name': 'Half H.P Studio', 'url': 'https://myanimelist.net/anime/producer/213/Half_HP_Studio'}, {'mal_id': 460, 'type': 'anime', 'name': 'KlockWorx', 'url': 'https://myanimelist.net/anime/producer/460/KlockWorx'}, {'mal_id': 1261, 'type': 'anime', 'name': 'Good Smile Company', 'url': 'https://myanimelist.net/anime/producer/1261/Good_Smile_Company'}, {'mal_id': 1622, 'type': 'anime', 'name': 'Tablier Communications', 'url': 'https://myanimelist.net/anime/producer/1622/Tablier_Communications'}, {'mal_id': 1696, 'type': 'anime', 'name': 'Kadokawa', 'url': 'https://myanimelist.net/anime/producer/1696/Kadokawa'}, {'mal_id': 1908, 'type': 'anime', 'name': 'Legs', 'url': 'https://myanimelist.net/anime/producer/1908/Legs'}, {'mal_id': 1946, 'type': 'anime', 'name': 'Hawkeye', 'url': 'https://myanimelist.net/anime/producer/1946/Hawkeye'}]","[{'mal_id': 376, 'type': 'anime', 'name': 'Sentai Filmworks', 'url': 'https://myanimelist.net/anime/producer/376/Sentai_Filmworks'}]","[{'mal_id': 1087, 'type': 'anime', 'name': 'Lay-duce', 'url': 'https://myanimelist.net/anime/producer/1087/Lay-duce'}]","[{'mal_id': 1, 'type': 'anime', 'name': 'Action', 'url': 'https://myanimelist.net/anime/genre/1/Action'}]",[],"[{'mal_id': 23, 'type': 'anime', 'name': 'School', 'url': 'https://myanimelist.net/anime/genre/23/School'}]",[]
37206,https://myanimelist.net/anime/37206/Anima_Yell,"{'jpg': {'image_url': 'https://cdn.myanimelist.net/images/anime/1051/93862.jpg', 'small_image_url': 'https://cdn.myanimelist.net/images/anime/1051/93862t.jpg', 'large_image_url': 'https://cdn.myanimelist.net/images/anime/1051/93862l.jpg'}, 'webp': {'image_url': 'https://cdn.myanimelist.net/images/anime/1051/93862.webp', 'small_image_url': 'https://cdn.myanimelist.net/images/anime/1051/93862t.webp', 'large_image_url': 'https://cdn.myanimelist.net/images/anime/1051/93862l.webp'}}","{'youtube_id': 'QFe8KUjB7qA', 'url': 'https://www.youtube.com/watch?v=QFe8KUjB7qA', 'embed_url': 'https://www.youtube.com/embed/QFe8KUjB7qA?enablejsapi=1&wmode=opaque&autoplay=1', 'images': {'image_url': 'https://img.youtube.com/vi/QFe8KUjB7qA/default.jpg', 'small_image_url': 'https://img.youtube.com/vi/QFe8KUjB7qA/sddefault.jpg', 'medium_image_url': 'https://img.youtube.com/vi/QFe8KUjB7qA/mqdefault.jpg', 'large_image_url': 'https://img.youtube.com/vi/QFe8KUjB7qA/hqdefault.jpg', 'maximum_image_url': 'https://img.youtube.com/vi/QFe8KUjB7qA/maxresdefault.jpg'}}","""Anima Yell!""",,アニマエール！,[],TV,4-koma manga,12.0,Finished Airing,False,"{'from': '2018-10-07T00:00:00+00:00', 'to': '2018-12-23T00:00:00+00:00', 'prop': {'from': {'day': 7, 'month': 10, 'year': 2018}, 'to': {'day': 23, 'month': 12, 'year': 2018}}, 'string': 'Oct 7, 2018 to Dec 23, 2018'}",23 min per ep,PG-13 - Teens 13 or older,6.9,13808.0,4232.0,2975,38252,79,"Kohane Hatoya’s most lovable trait is also her greatest flaw. She loves to help others no matter how far she has to go in order to get the job done. Her biggest inspiration to do so comes to light when she sees what cheerleading looks like for the first time in middle school. Now a highschooler but as enthusiastic as ever, Kohane wants nothing more than to start her very own cheerleading squad. She's encouraged by her best friend, Uki Sawatari, who often has to help her get out of trouble. There is just one problem: Kohane does not have any experience in cheerleading. She has absolutely no idea what to do, what to wear, or how to perform. To make matters worse, she has been scared of heights since childhood, and this new sport is full of stunts pulled far from the ground for a girl her size. Enter Hizume Arima, a former cheerleader who wishes to leave her pastime behind. Unfortunately for her, Kohane recognizes Hizume, and will stop at nothing just so she can lead the new squad, even if it means facing her childhood fear. [Written by MAL Rewrite]",,fall,2018,"{'day': 'Sundays', 'time': '23:30', 'timezone': 'Asia/Tokyo', 'string': 'Sundays at 23:30 (JST)'}","[{'mal_id': 1517, 'type': 'anime', 'name': 'Jinnan Studio', 'url': 'https://myanimelist.net/anime/producer/1517/Jinnan_Studio'}]",[],"[{'mal_id': 95, 'type': 'anime', 'name': 'Doga Kobo', 'url': 'https://myanimelist.net/anime/producer/95/Doga_Kobo'}]","[{'mal_id': 4, 'type': 'anime', 'name': 'Comedy', 'url': 'https://myanimelist.net/anime/genre/4/Comedy'}, {'mal_id': 30, 'type': 'anime', 'name': 'Sports', 'url': 'https://myanimelist.net/anime/genre/30/Sports'}]",[],"[{'mal_id': 23, 'type': 'anime', 'name': 'School', 'url': 'https://myanimelist.net/anime/genre/23/School'}]",[]
35835,https://myanimelist.net/anime/35835/RErideD__Tokigoe_no_Derrida,"{'jpg': {'image_url': 'https://cdn.myanimelist.net/images/anime/1481/95784.jpg', 'small_image_url': 'https://cdn.myanimelist.net/images/anime/1481/95784t.jpg', 'large_image_url': 'https://cdn.myanimelist.net/images/anime/1481/95784l.jpg'}, 'webp': {'image_url': 'https://cdn.myanimelist.net/images/anime/1481/95784.webp', 'small_image_url': 'https://cdn.myanimelist.net/images/anime/1481/95784t.webp', 'large_image_url': 'https://cdn.myanimelist.net/images/anime/1481/95784l.webp'}}","{'youtube_id': 'f1oWXEqZQt8', 'url': 'https://www.youtube.com/watch?v=f1oWXEqZQt8', 'embed_url': 'https://www.youtube.com/embed/f1oWXEqZQt8?enablejsapi=1&wmode=opaque&autoplay=1', 'images': {'image_url': 'https://img.youtube.com/vi/f1oWXEqZQt8/default.jpg', 'small_image_url': 'https://img.youtube.com/vi/f1oWXEqZQt8/sddefault.jpg', 'medium_image_url': 'https://img.youtube.com/vi/f1oWXEqZQt8/mqdefault.jpg', 'large_image_url': 'https://img.youtube.com/vi/f1oWXEqZQt8/hqdefault.jpg', 'maximum_image_url': 'https://img.youtube.com/vi/f1oWXEqZQt8/maxresdefault.jpg'}}","""RErideD: Tokigoe no Derrida""","RErideD: Derrida, who leaps through time",RErideD－刻越えのデリダ－,[],TV,Original,12.0,Finished Airing,False,"{'from': '2018-09-22T00:00:00+00:00', 'to': '2018-11-21T00:00:00+00:00', 'prop': {'from': {'day': 22, 'month': 9, 'year': 2018}, 'to': {'day': 21, 'month': 11, 'year': 2018}}, 'string': 'Sep 22, 2018 to Nov 21, 2018'}",23 min per ep,PG-13 - Teens 13 or older,5.69,10434.0,9883.0,2997,37710,18,"The year is 2050. A young engineer named Derrida Yvain became famous thanks to his contribution to the development of the ""Autonomous Machine DZ"" at Rebuild, the manufacturing company founded by his father. One day, Derrida and his colleague Nathan discover a flaw in the DZs and try to warn their boss, but are ignored. Although Derrida and Nathan are aware of the danger, they reluctantly decide to put off taking any measures, and instead go to Nathan's daughter Mage's birthday party. The next day, after enjoying a peaceful day, Derrida and Nathan are suddenly attacked by unknown forces. At the end of the escape, Derrida falls into a cold sleep machine and 10 years later, he wakes up to a devastated world in the middle of a war. While Derrida is attacked by a group of out of control DZs, he almost gives up, but he recalls Nathan's last words. ""Take care of Mage."" Despite the harsh fate that has fallen upon him, Derrida sets off to seek Mage. (Source: ANN)",,fall,2018,"{'day': 'Thursdays', 'time': '01:05', 'timezone': 'Asia/Tokyo', 'string': 'Thursdays at 01:05 (JST)'}","[{'mal_id': 213, 'type': 'anime', 'name': 'Half H.P Studio', 'url': 'https://myanimelist.net/anime/producer/213/Half_HP_Studio'}, {'mal_id': 1696, 'type': 'anime', 'name': 'Kadokawa', 'url': 'https://myanimelist.net/anime/producer/1696/Kadokawa'}, {'mal_id': 2279, 'type': 'anime', 'name': 'MediaLink Entertainment Limited', 'url': 'https://myanimelist.net/anime/producer/2279/MediaLink_Entertainment_Limited'}]","[{'mal_id': 102, 'type': 'anime', 'name': 'Funimation', 'url': 'https://myanimelist.net/anime/producer/102/Funimation'}]","[{'mal_id': 1857, 'type': 'anime', 'name': 'GEEK TOYS', 'url': 'https://myanimelist.net/anime/producer/1857/GEEK_TOYS'}]","[{'mal_id': 1, 'type': 'anime', 'name': 'Action', 'url': 'https://myanimelist.net/anime/genre/1/Action'}, {'mal_id': 8, 'type': 'anime', 'name': 'Drama', 'url': 'https://myanimelist.net/anime/genre/8/Drama'}, {'mal_id': 24, 'type': 'anime', 'name': 'Sci-Fi', 'url': 'https://myanimelist.net/anime/genre/24/Sci-Fi'}]",[],[],[]
37992,https://myanimelist.net/anime/37992/Jingai-san_no_Yome,"{'jpg': {'image_url': 'https://cdn.myanimelist.net/images/anime/1050/108631.jpg', 'small_image_url': 'https://cdn.myanimelist.net/images/anime/1050/108631t.jpg', 'large_image_url': 'https://cdn.myanimelist.net/images/anime/1050/108631l.jpg'}, 'webp': {'image_url': 'https://cdn.myanimelist.net/images/anime/1050/108631.webp', 'small_image_url': 'https://cdn.myanimelist.net/images/anime/1050/108631t.webp', 'large_image_url': 'https://cdn.myanimelist.net/images/anime/1050/108631l.webp'}}","{'youtube_id': 'UOnZ4eJHZRE', 'url': 'https://www.youtube.com/watch?v=UOnZ4eJHZRE', 'embed_url': 'https://www.youtube.com/embed/UOnZ4eJHZRE?enablejsapi=1&wmode=opaque&autoplay=1', 'images': {'image_url': 'https://img.youtube.com/vi/UOnZ4eJHZRE/default.jpg', 'small_image_url': 'https://img.youtube.com/vi/UOnZ4eJHZRE/sddefault.jpg', 'medium_image_url': 'https://img.youtube.com/vi/UOnZ4eJHZRE/mqdefault.jpg', 'large_image_url': 'https://img.youtube.com/vi/UOnZ4eJHZRE/hqdefault.jpg', 'maximum_image_url': 'https://img.youtube.com/vi/UOnZ4eJHZRE/maxresdefault.jpg'}}","""Jingai-san no Yome""",Jingai-san no Yome,人外さんの嫁,[],TV,4-koma manga,12.0,Finished Airing,False,"{'from': '2018-10-03T00:00:00+00:00', 'to': '2018-12-18T00:00:00+00:00', 'prop': {'from': {'day': 3, 'month': 10, 'year': 2018}, 'to': {'day': 18, 'month': 12, 'year': 2018}}, 'string': 'Oct 3, 2018 to Dec 18, 2018'}",3 min per ep,PG-13 - Teens 13 or older,5.72,15028.0,9752.0,3018,37309,75,"High schooler Tomori Hinowa is called to the principal's office one day to hear some shocking news: he's getting married! A mysterious fluffy creature called Kanenogi has chosen him as their wife, and despite Tomori's initial misgivings, he decides to accept. What follows are a series of delightful tales from this new couple's monstrous married life. Adorable and absurd, Jingai-san no Yome is a story that will leave audiences equally charmed and bemused after each short episode. [Written by MAL Rewrite]",,fall,2018,"{'day': 'Wednesdays', 'time': '01:00', 'timezone': 'Asia/Tokyo', 'string': 'Wednesdays at 01:00 (JST)'}","[{'mal_id': 963, 'type': 'anime', 'name': 'MAGES.', 'url': 'https://myanimelist.net/anime/producer/963/MAGES'}, {'mal_id': 2088, 'type': 'anime', 'name': 'Cloud22', 'url': 'https://myanimelist.net/anime/producer/2088/Cloud22'}]",[],"[{'mal_id': 1853, 'type': 'anime', 'name': 'Saetta', 'url': 'https://myanimelist.net/anime/producer/1853/Saetta'}]","[{'mal_id': 4, 'type': 'anime', 'name': 'Comedy', 'url': 'https://myanimelist.net/anime/genre/4/Comedy'}, {'mal_id': 10, 'type': 'anime', 'name': 'Fantasy', 'url': 'https://myanimelist.net/anime/genre/10/Fantasy'}, {'mal_id': 22, 'type': 'anime', 'name': 'Romance', 'url': 'https://myanimelist.net/anime/genre/22/Romance'}]",[],[],"[{'mal_id': 43, 'type': 'anime', 'name': 'Josei', 'url': 'https://myanimelist.net/anime/genre/43/Josei'}]"
