mal_id,url,images,trailer,title,title_english,title_japanese,title_synonyms,type,source,episodes,status,airing,aired,duration,rating,score,scored_by,rank,popularity,members,favorites,synopsis,background,season,year,broadcast,producers,licensors,studios,genres,explicit_genres,themes,demographics
38408,https://myanimelist.net/anime/38408/Boku_no_Hero_Academia_4th_Season,"{'jpg': {'image_url': 'https://cdn.myanimelist.net/images/anime/1412/107914.jpg', 'small_image_url': 'https://cdn.myanimelist.net/images/anime/1412/107914t.jpg', 'large_image_url': 'https://cdn.myanimelist.net/images/anime/1412/107914l.jpg'}, 'webp': {'image_url': 'https://cdn.myanimelist.net/images/anime/1412/107914.webp', 'small_image_url': 'https://cdn.myanimelist.net/images/anime/1412/107914t.webp', 'large_image_url': 'https://cdn.myanimelist.net/images/anime/1412/107914l.webp'}}","{'youtube_id': '5VQwDC5jqzQ', 'url': 'https://www.youtube.com/watch?v=5VQwDC5jqzQ', 'embed_url': 'https://www.youtube.com/embed/5VQwDC5jqzQ?enablejsapi=1&wmode=opaque&autoplay=1', 'images': {'image_url': 'https://img.youtube.com/vi/5VQwDC5jqzQ/default.jpg', 'small_image_url': 'https://img.youtube.com/vi/5VQwDC5jqzQ/sddefault.jpg', 'medium_image_url': 'https://img.youtube.com/vi/5VQwDC5jqzQ/mqdefault.jpg', 'large_image_url': 'https://img.youtube.com/vi/5VQwDC5jqzQ/hqdefault.jpg', 'maximum_image_url': 'https://img.youtube.com/vi/5VQwDC5jqzQ/maxresdefault.jpg'}}","""Boku no Hero Academia 4th Season""",My Hero Academia Season 4,僕のヒーローアカデミア,[],TV,Manga,25.0,Finished Airing,False,"{'from': '2019-10-12T00:00:00+00:00', 'to': '2020-04-04T00:00:00+00:00', 'prop': {'from': {'day': 12, 'month': 10, 'year': 2019}, 'to': {'day': 4, 'month': 4, 'year': 2020}}, 'string': 'Oct 12, 2019 to Apr 4, 2020'}",24 min per ep,PG-13 - Teens 13 or older,7.97,834682.0,589.0,58,1390024,7913,"After successfully passing his Provisional Hero License exam, Izuku ""Deku"" Midoriya seeks out an extracurricular internship with a professional hero agency. At the recommendation of his mentor All Might, Midoriya lands a position under All Might's former sidekick, Sir Nighteye, now a famous hero in his own right. As Midoriya's classmates further their own abilities through various internships, up-and-coming villain Kai Chisaki utilizes his terrifying powers to gather favor in the criminal underworld. Known by the moniker Overhaul, Chisaki's ambitions collide with the League of Villains and its leader, Tomura Shigaraki. Through his work with Sir Nighteye, Midoriya discovers Chisaki's crime syndicate and the villain's hostile relationship with a mysterious young girl named Eri. Fearing for the child's safety, Midoriya and his upperclassman Mirio Toogata must work together to put an end to Chisaki's reign of terror. [Written by MAL Rewrite]",,fall,2019,"{'day': 'Saturdays', 'time': '17:30', 'timezone': 'Asia/Tokyo', 'string': 'Saturdays at 17:30 (JST)'}","[{'mal_id': 53, 'type': 'anime', 'name': 'Dentsu', 'url': 'https://myanimelist.net/anime/producer/53/Dentsu'}, {'mal_id': 76, 'type': 'anime', 'name': 'Yomiuri Telecasting', 'url': 'https://myanimelist.net/anime/producer/76/Yomiuri_Telecasting'}, {'mal_id': 166, 'type': 'anime', 'name': 'Movic', 'url': 'https://myanimelist.net/anime/producer/166/Movic'}, {'mal_id': 757, 'type': 'anime', 'name': 'Sony Music Entertainment', 'url': 'https://myanimelist.net/anime/producer/757/Sony_Music_Entertainment'}, {'mal_id': 1143, 'type': 'anime', 'name': 'TOHO animation', 'url': 'https://myanimelist.net/anime/producer/1143/TOHO_animation'}, {'mal_id': 1365, 'type': 'anime', 'name': 'Shueisha', 'url': 'https://myanimelist.net/anime/producer/1365/Shueisha'}]","[{'mal_id': 102, 'type': 'anime', 'name': 'Funimation', 'url': 'https://myanimelist.net/anime/producer/102/Funimation'}]","[{'mal_id': 4, 'type': 'anime', 'name': 'Bones', 'url': 'https://myanimelist.net/anime/producer/4/Bones'}]","[{'mal_id': 1, 'type': 'anime', 'name': 'Action', 'url': 'https://myanimelist.net/anime/genre/1/Action'}, {'mal_id': 4, 'type': 'anime', 'name': 'Comedy', 'url': 'https://myanimelist.net/anime/genre/4/Comedy'}]",[],"[{'mal_id': 23, 'type': 'anime', 'name': 'School', 'url': 'https://myanimelist.net/anime/genre/23/School'}, {'mal_id': 31, 'type': 'anime', 'name': 'Super Power', 'url': 'https://myanimelist.net/anime/genre/31/Super_Power'}]","[{'mal_id': 27, 'type': 'anime', 'name': 'Shounen', 'url': 'https://myanimelist.net/anime/genre/27/Shounen'}]"
39195,https://myanimelist.net/anime/39195/Beastars,"{'jpg': {'image_url': 'https://cdn.myanimelist.net/images/anime/1234/102008.jpg', 'small_image_url': 'https://cdn.myanimelist.net/images/anime/1234/102008t.jpg', 'large_image_url': 'https://cdn.myanimelist.net/images/anime/1234/102008l.jpg'}, 'webp': {'image_url': 'https://cdn.myanimelist.net/images/anime/1234/102008.webp', 'small_image_url': 'https://cdn.myanimelist.net/images/anime/1234/102008t.webp', 'large_image_url': 'https://cdn.myanimelist.net/images/anime/1234/102008l.webp'}}","{'youtube_id': 'bDudMKQBgWc', 'url': 'https://www.youtube.com/watch?v=bDudMKQBgWc', 'embed_url': 'https://www.youtube.com/embed/bDudMKQBgWc?enablejsapi=1&wmode=opaque&autoplay=1', 'images': {'image_url': 'https://img.youtube.com/vi/bDudMKQBgWc/default.jpg', 'small_image_url': 'https://img.youtube.com/vi/bDudMKQBgWc/sddefault.jpg', 'medium_image_url': 'https://img.youtube.com/vi/bDudMKQBgWc/mqdefault.jpg', 'large_image_url': 'https://img.youtube.com/vi/bDudMKQBgWc/hqdefault.jpg', 'maximum_image_url': 'https://img.youtube.com/vi/bDudMKQBgWc/maxresdefault.jpg'}}","""Beastars""",,BEASTARS,[],TV,Manga,12.0,Finished Airing,False,"{'from': '2019-10-10T00:00:00+00:00', 'to': '2019-12-26T00:00:00+00:00', 'prop': {'from': {'day': 10, 'month': 10, 'year': 2019}, 'to': {'day': 26, 'month': 12, 'year': 2019}}, 'string': 'Oct 10, 2019 to Dec 26, 2019'}",22 min per ep,R - 17+ (violence & profanity),7.9,423508.0,701.0,213,695801,8575,"In a civilized society of anthropomorphic animals, an uneasy tension exists between carnivores and herbivores. At Cherryton Academy, this mutual distrust peaks after a predation incident results in the death of Tem, an alpaca in the school's drama club. Tem's friend Legoshi, a grey wolf in the stage crew, has been an object of fear and suspicion for his whole life. In the immediate aftermath of the tragedy, he continues to lay low and hide his menacing traits, much to the disapproval of Louis, a red deer and the domineering star actor of the drama club. When Louis sneaks into the auditorium to train Tem's replacement for an upcoming play, he assigns Legoshi to lookout duty. That very night, Legoshi has a fateful encounter with Haru, a white dwarf rabbit scorned by her peers. His growing feelings for Haru, complicated by his predatory instincts, force him to confront his own true nature, the circumstances surrounding the death of his friend, and the undercurrent of violence plaguing the world around him. [Written by MAL Rewrite]",,fall,2019,"{'day': 'Thursdays', 'time': '00:55', 'timezone': 'Asia/Tokyo', 'string': 'Thursdays at 00:55 (JST)'}","[{'mal_id': 166, 'type': 'anime', 'name': 'Movic', 'url': 'https://myanimelist.net/anime/producer/166/Movic'}, {'mal_id': 169, 'type': 'anime', 'name': 'Fuji TV', 'url': 'https://myanimelist.net/anime/producer/169/Fuji_TV'}, {'mal_id': 230, 'type': 'anime', 'name': 'Bandai', 'url': 'https://myanimelist.net/anime/producer/230/Bandai'}, {'mal_id': 245, 'type': 'anime', 'name': 'Toho', 'url': 'https://myanimelist.net/anime/producer/245/Toho'}, {'mal_id': 843, 'type': 'anime', 'name': 'BS Fuji', 'url': 'https://myanimelist.net/anime/producer/843/BS_Fuji'}, {'mal_id': 1143, 'type': 'anime', 'name': 'TOHO animation', 'url': 'https://myanimelist.net/anime/producer/1143/TOHO_animation'}, {'mal_id': 1287, 'type': 'anime', 'name': 'Q-Tec', 'url': 'https://myanimelist.net/anime/producer/1287/Q-Tec'}, {'mal_id': 1373, 'type': 'anime', 'name': 'Akita Shoten', 'url': 'https://myanimelist.net/anime/producer/1373/Akita_Shoten'}, {'mal_id': 1488, 'type': 'anime', 'name': 'Hakuhodo DY Media Partners', 'url': 'https://myanimelist.net/anime/producer/1488/Hakuhodo_DY_Media_Partners'}, {'mal_id': 1992, 'type': 'anime', 'name': 'Bandai Spirits', 'url': 'https://myanimelist.net/anime/producer/1992/Bandai_Spirits'}, {'mal_id': 2229, 'type': 'anime', 'name': 'Toho Music', 'url': 'https://myanimelist.net/anime/producer/2229/Toho_Music'}]",[],"[{'mal_id': 1109, 'type': 'anime', 'name': 'Orange', 'url': 'https://myanimelist.net/anime/producer/1109/Orange'}]","[{'mal_id': 8, 'type': 'anime', 'name': 'Drama', 'url': 'https://myanimelist.net/anime/genre/8/Drama'}, {'mal_id': 36, 'type': 'anime', 'name': 'Slice of Life', 'url': 'https://myanimelist.net/anime/genre/36/Slice_of_Life'}]",[],"[{'mal_id': 40, 'type': 'anime', 'name': 'Psychological', 'url': 'https://myanimelist.net/anime/genre/40/Psychological'}, {'mal_id': 23, 'type': 'anime', 'name': 'School', 'url': 'https://myanimelist.net/anime/genre/23/School'}]","[{'mal_id': 27, 'type': 'anime', 'name': 'Shounen', 'url': 'https://myanimelist.net/anime/genre/27/Shounen'}]"
39597,https://myanimelist.net/anime/39597/Sword_Art_Online__Alicization_-_War_of_Underworld,"{'jpg': {'image_url': 'https://cdn.myanimelist.net/images/anime/1630/103417.jpg', 'small_image_url': 'https://cdn.myanimelist.net/images/anime/1630/103417t.jpg', 'large_image_url': 'https://cdn.myanimelist.net/images/anime/1630/103417l.jpg'}, 'webp': {'image_url': 'https://cdn.myanimelist.net/images/anime/1630/103417.webp', 'small_image_url': 'https://cdn.myanimelist.net/images/anime/1630/103417t.webp', 'large_image_url': 'https://cdn.myanimelist.net/images/anime/1630/103417l.webp'}}","{'youtube_id': 'rUpEl-nQ360', 'url': 'https://www.youtube.com/watch?v=rUpEl-nQ360', 'embed_url': 'https://www.youtube.com/embed/rUpEl-nQ360?enablejsapi=1&wmode=opaque&autoplay=1', 'images': {'image_url': 'https://img.youtube.com/vi/rUpEl-nQ360/default.jpg', 'small_image_url': 'https://img.youtube.com/vi/rUpEl-nQ360/sddefault.jpg', 'medium_image_url': 'https://img.youtube.com/vi/rUpEl-nQ360/mqdefault.jpg', 'large_image_url': 'https://img.youtube.com/vi/rUpEl-nQ360/hqdefault.jpg', 'maximum_image_url': 'https://img.youtube.com/vi/rUpEl-nQ360/maxresdefault.jpg'}}","""Sword Art Online: Alicization - War of Underworld""",Sword Art Online Alicization War of Underworld,ソードアート・オンライン アリシゼーション War of Underworld,"['Sword Art Online: Alicization 2nd Season', 'Sword Art Online III 2nd Season', 'SAO Alicization 2nd Season', 'Sword Art Online 3 2nd Season', 'SAO 3 2nd Season', 'SAO III 2nd Season']",TV,Light novel,12.0,Finished Airing,False,"{'from': '2019-10-13T00:00:00+00:00', 'to': '2019-12-29T00:00:00+00:00', 'prop': {'from': {'day': 13, 'month': 10, 'year': 2019}, 'to': {'day': 29, 'month': 12, 'year': 2019}}, 'string': 'Oct 13, 2019 to Dec 29, 2019'}",23 min per ep,R - 17+ (violence & profanity),7.58,348354.0,1374.0,262,600366,3184,"Despite the defeat of Quinella—the pontifex of the Axiom Church—things have not seemed to calm down yet. Upon contacting the real world, Kazuto ""Kirito"" Kirigaya finds out that the Ocean Turtle—a mega-float controlled by Rath—was raided. Due to a sudden short-circuit caused by the raiders, Kirito's fluctlight is damaged, leaving him comatose. Feeling insecure about the people at the Axiom Church, Alice brings the unconscious Kirito back to their hometown—Rulid Village, disregarding her banishment due to an unabsolved crime. Now, Alice is living an ordinary and peaceful life close by the village, wishing for Kirito to wake up. However, tragedy strikes when Alice notices that the Dark Territory has already started to invade the Human Empire. Reassuming her previous alias, Alice Synthesis Thirty, she promises to defeat the Dark Territory in order to defend the world that Kirito and Eugeo worked so hard to protect. [Written by MAL Rewrite]",Sword Art Online: Alicization - War of Underworld is an adaptation of volumes 15 through 18 of Reki Kawahara's Sword Art Online light novel series.,fall,2019,"{'day': 'Sundays', 'time': '00:00', 'timezone': 'Asia/Tokyo', 'string': 'Sundays at 00:00 (JST)'}","[{'mal_id': 17, 'type': 'anime', 'name': 'Aniplex', 'url': 'https://myanimelist.net/anime/producer/17/Aniplex'}, {'mal_id': 1233, 'type': 'anime', 'name': 'Bandai Namco Entertainment', 'url': 'https://myanimelist.net/anime/producer/1233/Bandai_Namco_Entertainment'}, {'mal_id': 1444, 'type': 'anime', 'name': 'Egg Firm', 'url': 'https://myanimelist.net/anime/producer/1444/Egg_Firm'}, {'mal_id': 1683, 'type': 'anime', 'name': 'Straight Edge', 'url': 'https://myanimelist.net/anime/producer/1683/Straight_Edge'}, {'mal_id': 1696, 'type': 'anime', 'name': 'Kadokawa', 'url': 'https://myanimelist.net/anime/producer/1696/Kadokawa'}, {'mal_id': 1858, 'type': 'anime', 'name': 'Sonilude', 'url': 'https://myanimelist.net/anime/producer/1858/Sonilude'}]","[{'mal_id': 493, 'type': 'anime', 'name': 'Aniplex of America', 'url': 'https://myanimelist.net/anime/producer/493/Aniplex_of_America'}]","[{'mal_id': 56, 'type': 'anime', 'name': 'A-1 Pictures', 'url': 'https://myanimelist.net/anime/producer/56/A-1_Pictures'}]","[{'mal_id': 1, 'type': 'anime', 'name': 'Action', 'url': 'https://myanimelist.net/anime/genre/1/Action'}, {'mal_id': 2, 'type': 'anime', 'name': 'Adventure', 'url': 'https://myanimelist.net/anime/genre/2/Adventure'}, {'mal_id': 10, 'type': 'anime', 'name': 'Fantasy', 'url': 'https://myanimelist.net/anime/genre/10/Fantasy'}, {'mal_id': 22, 'type': 'anime', 'name': 'Romance', 'url': 'https://myanimelist.net/anime/genre/22/Romance'}]",[],"[{'mal_id': 11, 'type': 'anime', 'name': 'Game', 'url': 'https://myanimelist.net/anime/genre/11/Game'}]",[]
39701,https://myanimelist.net/anime/39701/Nanatsu_no_Taizai__Kamigami_no_Gekirin,"{'jpg': {'image_url': 'https://cdn.myanimelist.net/images/anime/1546/103418.jpg', 'small_image_url': 'https://cdn.myanimelist.net/images/anime/1546/103418t.jpg', 'large_image_url': 'https://cdn.myanimelist.net/images/anime/1546/103418l.jpg'}, 'webp': {'image_url': 'https://cdn.myanimelist.net/images/anime/1546/103418.webp', 'small_image_url': 'https://cdn.myanimelist.net/images/anime/1546/103418t.webp', 'large_image_url': 'https://cdn.myanimelist.net/images/anime/1546/103418l.webp'}}","{'youtube_id': 'gIAElO1gVJA', 'url': 'https://www.youtube.com/watch?v=gIAElO1gVJA', 'embed_url': 'https://www.youtube.com/embed/gIAElO1gVJA?enablejsapi=1&wmode=opaque&autoplay=1', 'images': {'image_url': 'https://img.youtube.com/vi/gIAElO1gVJA/default.jpg', 'small_image_url': 'https://img.youtube.com/vi/gIAElO1gVJA/sddefault.jpg', 'medium_image_url': 'https://img.youtube.com/vi/gIAElO1gVJA/mqdefault.jpg', 'large_image_url': 'https://img.youtube.com/vi/gIAElO1gVJA/hqdefault.jpg', 'maximum_image_url': 'https://img.youtube.com/vi/gIAElO1gVJA/maxresdefault.jpg'}}","""Nanatsu no Taizai: Kamigami no Gekirin""",The Seven Deadly Sins: Wrath of the Gods,七つの大罪 神々の逆鱗,['The Seven Deadly Sins: Imperial Wrath of The Gods'],TV,Manga,24.0,Finished Airing,False,"{'from': '2019-10-09T00:00:00+00:00', 'to': '2020-03-25T00:00:00+00:00', 'prop': {'from': {'day': 9, 'month': 10, 'year': 2019}, 'to': {'day': 25, 'month': 3, 'year': 2020}}, 'string': 'Oct 9, 2019 to Mar 25, 2020'}",24 min per ep,PG-13 - Teens 13 or older,6.45,314058.0,6449.0,265,597837,1329,"After saving the Kingdom of Liones from the 10 Commandments, Meliodas and the Seven Deadly Sins are enjoying their time off. However, things aren't as peaceful as they seem, as the Sins are put through various trials to become strong enough to defeat the 10 Commandments and to overcome their past trauma. With help from past figures, the Sins are tasked with defeating the 10 Commandments and putting an end to their evil plans that began ten thousand years ago. The Sins begin to uncover the truth about each other, as well as those who stood before them. With this knowledge in hand, the battle against the 10 Commandments has only just begun. Nanatsu no Taizai: Kamigami no Gekirin continues to follow the Seven Deadly Sins and those that they meet on their journey. Through their adventures, they realize that their actions have had greater consequences on the present than they could have ever expected. [Written by MAL Rewrite]",,fall,2019,"{'day': 'Wednesdays', 'time': '17:55', 'timezone': 'Asia/Tokyo', 'string': 'Wednesdays at 17:55 (JST)'}","[{'mal_id': 16, 'type': 'anime', 'name': 'TV Tokyo', 'url': 'https://myanimelist.net/anime/producer/16/TV_Tokyo'}, {'mal_id': 29, 'type': 'anime', 'name': 'VAP', 'url': 'https://myanimelist.net/anime/producer/29/VAP'}, {'mal_id': 53, 'type': 'anime', 'name': 'Dentsu', 'url': 'https://myanimelist.net/anime/producer/53/Dentsu'}, {'mal_id': 159, 'type': 'anime', 'name': 'Kodansha', 'url': 'https://myanimelist.net/anime/producer/159/Kodansha'}, {'mal_id': 166, 'type': 'anime', 'name': 'Movic', 'url': 'https://myanimelist.net/anime/producer/166/Movic'}, {'mal_id': 553, 'type': 'anime', 'name': 'Marvy Jack', 'url': 'https://myanimelist.net/anime/producer/553/Marvy_Jack'}, {'mal_id': 1345, 'type': 'anime', 'name': 'Sammy', 'url': 'https://myanimelist.net/anime/producer/1345/Sammy'}]",[],"[{'mal_id': 37, 'type': 'anime', 'name': 'Studio Deen', 'url': 'https://myanimelist.net/anime/producer/37/Studio_Deen'}]","[{'mal_id': 1, 'type': 'anime', 'name': 'Action', 'url': 'https://myanimelist.net/anime/genre/1/Action'}, {'mal_id': 2, 'type': 'anime', 'name': 'Adventure', 'url': 'https://myanimelist.net/anime/genre/2/Adventure'}, {'mal_id': 10, 'type': 'anime', 'name': 'Fantasy', 'url': 'https://myanimelist.net/anime/genre/10/Fantasy'}, {'mal_id': 37, 'type': 'anime', 'name': 'Supernatural', 'url': 'https://myanimelist.net/anime/genre/37/Supernatural'}]",[],[],"[{'mal_id': 27, 'type': 'anime', 'name': 'Shounen', 'url': 'https://myanimelist.net/anime/genre/27/Shounen'}]"
39940,https://myanimelist.net/anime/39940/Shokugeki_no_Souma__Shin_no_Sara,"{'jpg': {'image_url': 'https://cdn.myanimelist.net/images/anime/1072/110175.jpg', 'small_image_url': 'https://cdn.myanimelist.net/images/anime/1072/110175t.jpg', 'large_image_url': 'https://cdn.myanimelist.net/images/anime/1072/110175l.jpg'}, 'webp': {'image_url': 'https://cdn.myanimelist.net/images/anime/1072/110175.webp', 'small_image_url': 'https://cdn.myanimelist.net/images/anime/1072/110175t.webp', 'large_image_url': 'https://cdn.myanimelist.net/images/anime/1072/110175l.webp'}}","{'youtube_id': 'WcTl85qHc8Y', 'url': 'https://www.youtube.com/watch?v=WcTl85qHc8Y', 'embed_url': 'https://www.youtube.com/embed/WcTl85qHc8Y?enablejsapi=1&wmode=opaque&autoplay=1', 'images': {'image_url': 'https://img.youtube.com/vi/WcTl85qHc8Y/default.jpg', 'small_image_url': 'https://img.youtube.com/vi/WcTl85qHc8Y/sddefault.jpg', 'medium_image_url': 'https://img.youtube.com/vi/WcTl85qHc8Y/mqdefault.jpg', 'large_image_url': 'https://img.youtube.com/vi/WcTl85qHc8Y/hqdefault.jpg', 'maximum_image_url': 'https://img.youtube.com/vi/WcTl85qHc8Y/maxresdefault.jpg'}}","""Shokugeki no Souma: Shin no Sara""",Food Wars! The Fourth Plate,食戟のソーマ 神ノ皿,['Shokugeki no Soma 4th Season'],TV,Manga,12.0,Finished Airing,False,"{'from': '2019-10-12T00:00:00+00:00', 'to': '2019-12-28T00:00:00+00:00', 'prop': {'from': {'day': 12, 'month': 10, 'year': 2019}, 'to': {'day': 28, 'month': 12, 'year': 2019}}, 'string': 'Oct 12, 2019 to Dec 28, 2019'}",24 min per ep,PG-13 - Teens 13 or older,7.75,272871.0,967.0,350,501960,1218,"At Tootsuki Culinary Academy, a heated eight-on-eight Shokugeki known as the Régiment de Cuisine rages on between Central and the rebel forces led by Souma Yukihira and Erina Nakiri. Though they won a stunning perfect victory in the first bout, the rebels face an uphill battle ahead, as they must now face off against the rest of the Elite Ten Council. With the future of Tootsuki at stake, Souma and Erina must push far beyond the limits of their abilities, using everything they learned from their mentors and ultimately drawing from their experiences cooking together as friends. [Written by MAL Rewrite]",,fall,2019,"{'day': 'Saturdays', 'time': '00:30', 'timezone': 'Asia/Tokyo', 'string': 'Saturdays at 00:30 (JST)'}","[{'mal_id': 415, 'type': 'anime', 'name': 'Warner Bros. Japan', 'url': 'https://myanimelist.net/anime/producer/415/Warner_Bros_Japan'}, {'mal_id': 460, 'type': 'anime', 'name': 'KlockWorx', 'url': 'https://myanimelist.net/anime/producer/460/KlockWorx'}, {'mal_id': 1365, 'type': 'anime', 'name': 'Shueisha', 'url': 'https://myanimelist.net/anime/producer/1365/Shueisha'}, {'mal_id': 1840, 'type': 'anime', 'name': 'Bandai Namco Arts', 'url': 'https://myanimelist.net/anime/producer/1840/Bandai_Namco_Arts'}]",[],"[{'mal_id': 7, 'type': 'anime', 'name': 'J.C.Staff', 'url': 'https://myanimelist.net/anime/producer/7/JCStaff'}]","[{'mal_id': 47, 'type': 'anime', 'name': 'Gourmet', 'url': 'https://myanimelist.net/anime/genre/47/Gourmet'}, {'mal_id': 9, 'type': 'anime', 'name': 'Ecchi', 'url': 'https://myanimelist.net/anime/genre/9/Ecchi'}]",[],"[{'mal_id': 23, 'type': 'anime', 'name': 'School', 'url': 'https://myanimelist.net/anime/genre/23/School'}]","[{'mal_id': 27, 'type': 'anime', 'name': 'Shounen', 'url': 'https://myanimelist.net/anime/genre/27/Shounen'}]"
38659,https://myanimelist.net/anime/38659/Shinchou_Yuusha__Kono_Yuusha_ga_Ore_Tueee_Kuse_ni_Shinchou_Sugiru,"{'jpg': {'image_url': 'https://cdn.myanimelist.net/images/anime/1715/103419.jpg', 'small_image_url': 'https://cdn.myanimelist.net/images/anime/1715/103419t.jpg', 'large_image_url': 'https://cdn.myanimelist.net/images/anime/1715/103419l.jpg'}, 'webp': {'image_url': 'https://cdn.myanimelist.net/images/anime/1715/103419.webp', 'small_image_url': 'https://cdn.myanimelist.net/images/anime/1715/103419t.webp', 'large_image_url': 'https://cdn.myanimelist.net/images/anime/1715/103419l.webp'}}","{'youtube_id': '-K4TaXrKHRc', 'url': 'https://www.youtube.com/watch?v=-K4TaXrKHRc', 'embed_url': 'https://www.youtube.com/embed/-K4TaXrKHRc?enablejsapi=1&wmode=opaque&autoplay=1', 'images': {'image_url': 'https://img.youtube.com/vi/-K4TaXrKHRc/default.jpg', 'small_image_url': 'https://img.youtube.com/vi/-K4TaXrKHRc/sddefault.jpg', 'medium_image_url': 'https://img.youtube.com/vi/-K4TaXrKHRc/mqdefault.jpg', 'large_image_url': 'https://img.youtube.com/vi/-K4TaXrKHRc/hqdefault.jpg', 'maximum_image_url': 'https://img.youtube.com/vi/-K4TaXrKHRc/maxresdefault.jpg'}}","""Shinchou Yuusha: Kono Yuusha ga Ore Tueee Kuse ni Shinchou Sugiru""",Cautious Hero: The Hero Is Overpowered but Overly Cautious,慎重勇者 ～この勇者が俺TUEEEくせに慎重すぎる～,['Shinchou Yuusha: Kono Yuusha ga Ore Tsueee Kuse ni Shinchou Sugiru'],TV,Light novel,12.0,Finished Airing,False,"{'from': '2019-10-02T00:00:00+00:00', 'to': '2019-12-27T00:00:00+00:00', 'prop': {'from': {'day': 2, 'month': 10, 'year': 2019}, 'to': {'day': 27, 'month': 12, 'year': 2019}}, 'string': 'Oct 2, 2019 to Dec 27, 2019'}",23 min per ep,PG-13 - Teens 13 or older,7.5,277316.0,1631.0,352,485450,1770,"There is a popular saying: ""you can never be too careful."" It is very important to prepare for every situation you may face, even if it seems like an unnecessary waste of time. Also, in games like RPGs, it is good to exceed the level of your enemies to achieve total victory. These words describe Seiya Ryuuguuin a little too perfectly. After being summoned by the goddess Ristarte to save the world of Gaeabrande from destruction, the hero prepares himself for his noble journey. While this might be normal, he spends a very long time training himself, despite having overpowered stats. He fights weak enemies using his strongest skills and buys excessive amounts of supplies and potions—all to stay safe. While his attitude may be a bit annoying, it might just be the saving grace of Gaeabrande, especially considering that it is a world where the forces of evil dominate each and every expectation. [Written by MAL Rewrite]",,fall,2019,"{'day': 'Wednesdays', 'time': '22:30', 'timezone': 'Asia/Tokyo', 'string': 'Wednesdays at 22:30 (JST)'}","[{'mal_id': 238, 'type': 'anime', 'name': 'AT-X', 'url': 'https://myanimelist.net/anime/producer/238/AT-X'}, {'mal_id': 1551, 'type': 'anime', 'name': 'Kadokawa Media House', 'url': 'https://myanimelist.net/anime/producer/1551/Kadokawa_Media_House'}, {'mal_id': 1696, 'type': 'anime', 'name': 'Kadokawa', 'url': 'https://myanimelist.net/anime/producer/1696/Kadokawa'}, {'mal_id': 1908, 'type': 'anime', 'name': 'Legs', 'url': 'https://myanimelist.net/anime/producer/1908/Legs'}]","[{'mal_id': 102, 'type': 'anime', 'name': 'Funimation', 'url': 'https://myanimelist.net/anime/producer/102/Funimation'}]","[{'mal_id': 314, 'type': 'anime', 'name': 'White Fox', 'url': 'https://myanimelist.net/anime/producer/314/White_Fox'}]","[{'mal_id': 1, 'type': 'anime', 'name': 'Action', 'url': 'https://myanimelist.net/anime/genre/1/Action'}, {'mal_id': 2, 'type': 'anime', 'name': 'Adventure', 'url': 'https://myanimelist.net/anime/genre/2/Adventure'}, {'mal_id': 4, 'type': 'anime', 'name': 'Comedy', 'url': 'https://myanimelist.net/anime/genre/4/Comedy'}, {'mal_id': 10, 'type': 'anime', 'name': 'Fantasy', 'url': 'https://myanimelist.net/anime/genre/10/Fantasy'}]",[],[],[]
