mal_id,url,images,trailer,title,title_english,title_japanese,title_synonyms,type,source,episodes,status,airing,aired,duration,rating,score,scored_by,rank,popularity,members,favorites,synopsis,background,season,year,broadcast,producers,licensors,studios,genres,explicit_genres,themes,demographics
39959,https://myanimelist.net/anime/39959/Ani_ni_Tsukeru_Kusuri_wa_Nai_3,"{'jpg': {'image_url': 'https://cdn.myanimelist.net/images/anime/1756/103441.jpg', 'small_image_url': 'https://cdn.myanimelist.net/images/anime/1756/103441t.jpg', 'large_image_url': 'https://cdn.myanimelist.net/images/anime/1756/103441l.jpg'}, 'webp': {'image_url': 'https://cdn.myanimelist.net/images/anime/1756/103441.webp', 'small_image_url': 'https://cdn.myanimelist.net/images/anime/1756/103441t.webp', 'large_image_url': 'https://cdn.myanimelist.net/images/anime/1756/103441l.webp'}}","{'youtube_id': 'GHhEI980jgM', 'url': 'https://www.youtube.com/watch?v=GHhEI980jgM', 'embed_url': 'https://www.youtube.com/embed/GHhEI980jgM?enablejsapi=1&wmode=opaque&autoplay=1', 'images': {'image_url': 'https://img.youtube.com/vi/GHhEI980jgM/default.jpg', 'small_image_url': 'https://img.youtube.com/vi/GHhEI980jgM/sddefault.jpg', 'medium_image_url': 'https://img.youtube.com/vi/GHhEI980jgM/mqdefault.jpg', 'large_image_url': 'https://img.youtube.com/vi/GHhEI980jgM/hqdefault.jpg', 'maximum_image_url': 'https://img.youtube.com/vi/GHhEI980jgM/maxresdefault.jpg'}}","""Ani ni Tsukeru Kusuri wa Nai! 3""",,兄に付ける薬はない！3,"['Please Take My Brother Away 3', 'Ani ni Tsukeru Kusuri wa Nai! 3rd Season']",TV,Web manga,12.0,Finished Airing,False,"{'from': '2019-10-07T00:00:00+00:00', 'to': '2019-12-23T00:00:00+00:00', 'prop': {'from': {'day': 7, 'month': 10, 'year': 2019}, 'to': {'day': 23, 'month': 12, 'year': 2019}}, 'string': 'Oct 7, 2019 to Dec 23, 2019'}",3 min per ep,PG-13 - Teens 13 or older,7.68,14307.0,1122.0,3413,30501,40,"Shi Miao is still stuck with her irresponsible elder brother Shi Fen, who lives in neverending fear of his younger sister's stormy temper. As the siblings continue enjoying their carefree high school days alongside their friends and classmates, they realize that there truly is no cure for family. [Written by MAL Rewrite]",,fall,2019,"{'day': 'Mondays', 'time': '09:54', 'timezone': 'Asia/Tokyo', 'string': 'Mondays at 09:54 (JST)'}","[{'mal_id': 1727, 'type': 'anime', 'name': 'Tencent Penguin Pictures', 'url': 'https://myanimelist.net/anime/producer/1727/Tencent_Penguin_Pictures'}]",[],"[{'mal_id': 2371, 'type': 'anime', 'name': 'Planet Cartoon', 'url': 'https://myanimelist.net/anime/producer/2371/Planet_Cartoon'}]","[{'mal_id': 4, 'type': 'anime', 'name': 'Comedy', 'url': 'https://myanimelist.net/anime/genre/4/Comedy'}, {'mal_id': 36, 'type': 'anime', 'name': 'Slice of Life', 'url': 'https://myanimelist.net/anime/genre/36/Slice_of_Life'}]",[],"[{'mal_id': 23, 'type': 'anime', 'name': 'School', 'url': 'https://myanimelist.net/anime/genre/23/School'}]",[]
40254,https://myanimelist.net/anime/40254/XL_Joushi,"{'jpg': {'image_url': 'https://cdn.myanimelist.net/images/anime/1306/111409.jpg', 'small_image_url': 'https://cdn.myanimelist.net/images/anime/1306/111409t.jpg', 'large_image_url': 'https://cdn.myanimelist.net/images/anime/1306/111409l.jpg'}, 'webp': {'image_url': 'https://cdn.myanimelist.net/images/anime/1306/111409.webp', 'small_image_url': 'https://cdn.myanimelist.net/images/anime/1306/111409t.webp', 'large_image_url': 'https://cdn.myanimelist.net/images/anime/1306/111409l.webp'}}","{'youtube_id': 'rTYjLocNI6g', 'url': 'https://www.youtube.com/watch?v=rTYjLocNI6g', 'embed_url': 'https://www.youtube.com/embed/rTYjLocNI6g?enablejsapi=1&wmode=opaque&autoplay=1', 'images': {'image_url': 'https://img.youtube.com/vi/rTYjLocNI6g/default.jpg', 'small_image_url': 'https://img.youtube.com/vi/rTYjLocNI6g/sddefault.jpg', 'medium_image_url': 'https://img.youtube.com/vi/rTYjLocNI6g/mqdefault.jpg', 'large_image_url': 'https://img.youtube.com/vi/rTYjLocNI6g/hqdefault.jpg', 'maximum_image_url': 'https://img.youtube.com/vi/rTYjLocNI6g/maxresdefault.jpg'}}","""XL Joushi.""",,XL上司。,['XL Boss'],TV,Manga,8.0,Finished Airing,False,"{'from': '2019-10-07T00:00:00+00:00', 'to': '2019-11-25T00:00:00+00:00', 'prop': {'from': {'day': 7, 'month': 10, 'year': 2019}, 'to': {'day': 25, 'month': 11, 'year': 2019}}, 'string': 'Oct 7, 2019 to Nov 25, 2019'}",3 min per ep,R+ - Mild Nudity,6.15,9364.0,,3440,29642,110,"With the hopes of making a bit of extra cash, office worker Saki Watase registers for a product review program. But when the first product her new part-time job sends her is a huge box of XL condoms, Saki decides to put the task to the side. Later on, while at a drinking party with her coworkers—including her competent but infuriating ""demon boss"" Keisuke Sudou—Saki ends up drunk out of her mind, so Keisuke offers to escort her home. Upon their arrival at Saki's apartment, however, Keisuke immediately takes notice of his subordinate's substantial amount of XL condoms. When she explains the circumstances of her part time job, Keisuke offers to help out with the testing—revealing himself to be XL-sized! [Written by MAL Rewrite] Note: The standard TV version of the anime debuted on October 7 at 1:00 a.m. on Tokyo MX, as well as YouTube and Niconico. A complete version began streaming the same day on the ComicFesta Anime website. This entry reflects standard TV version of the anime.",,fall,2019,"{'day': 'Mondays', 'time': '01:00', 'timezone': 'Asia/Tokyo', 'string': 'Mondays at 01:00 (JST)'}","[{'mal_id': 1758, 'type': 'anime', 'name': 'Picante Circus', 'url': 'https://myanimelist.net/anime/producer/1758/Picante_Circus'}, {'mal_id': 1760, 'type': 'anime', 'name': 'Suiseisha', 'url': 'https://myanimelist.net/anime/producer/1760/Suiseisha'}]",[],"[{'mal_id': 207, 'type': 'anime', 'name': 'Magic Bus', 'url': 'https://myanimelist.net/anime/producer/207/Magic_Bus'}]","[{'mal_id': 22, 'type': 'anime', 'name': 'Romance', 'url': 'https://myanimelist.net/anime/genre/22/Romance'}, {'mal_id': 49, 'type': 'anime', 'name': 'Erotica', 'url': 'https://myanimelist.net/anime/genre/49/Erotica'}]",[],[],"[{'mal_id': 43, 'type': 'anime', 'name': 'Josei', 'url': 'https://myanimelist.net/anime/genre/43/Josei'}]"
39590,https://myanimelist.net/anime/39590/Africa_no_Salaryman_TV,"{'jpg': {'image_url': 'https://cdn.myanimelist.net/images/anime/1937/102309.jpg', 'small_image_url': 'https://cdn.myanimelist.net/images/anime/1937/102309t.jpg', 'large_image_url': 'https://cdn.myanimelist.net/images/anime/1937/102309l.jpg'}, 'webp': {'image_url': 'https://cdn.myanimelist.net/images/anime/1937/102309.webp', 'small_image_url': 'https://cdn.myanimelist.net/images/anime/1937/102309t.webp', 'large_image_url': 'https://cdn.myanimelist.net/images/anime/1937/102309l.webp'}}","{'youtube_id': '4XhZHjhsRGI', 'url': 'https://www.youtube.com/watch?v=4XhZHjhsRGI', 'embed_url': 'https://www.youtube.com/embed/4XhZHjhsRGI?enablejsapi=1&wmode=opaque&autoplay=1', 'images': {'image_url': 'https://img.youtube.com/vi/4XhZHjhsRGI/default.jpg', 'small_image_url': 'https://img.youtube.com/vi/4XhZHjhsRGI/sddefault.jpg', 'medium_image_url': 'https://img.youtube.com/vi/4XhZHjhsRGI/mqdefault.jpg', 'large_image_url': 'https://img.youtube.com/vi/4XhZHjhsRGI/hqdefault.jpg', 'maximum_image_url': 'https://img.youtube.com/vi/4XhZHjhsRGI/maxresdefault.jpg'}}","""Africa no Salaryman (TV)""",Africa Salaryman,アフリカのサラリーマン (TV),"['Businessman in Africa (TV)', 'African Office Worker (TV)']",TV,Web manga,12.0,Finished Airing,False,"{'from': '2019-10-07T00:00:00+00:00', 'to': '2019-12-23T00:00:00+00:00', 'prop': {'from': {'day': 7, 'month': 10, 'year': 2019}, 'to': {'day': 23, 'month': 12, 'year': 2019}}, 'string': 'Oct 7, 2019 to Dec 23, 2019'}",23 min per ep,PG-13 - Teens 13 or older,6.55,6706.0,5889.0,3843,23098,55,"Africa no Salaryman is a slapstick workplace comedy that follows the adventures of kind Lion, jaded Lizard, and perverted Toucan, as they trudge through office life while also becoming caught up in antics no regular office worker should. Of course, most of these are the fault of Toucan, whose selfish actions and lack of filter still haven't gotten him fired. It's up to Lizard and Lion to keep themselves out of trouble and hang on to their jobs at the office. But trouble is never too far away from these savannah-treading folk. [Written by MAL Rewrite]","Africa no Salaryman was originally serialized online on pixiv Comic beginning in December, 2014. Media Factory has since compiled its chapters into four tankoubon volumes. In June of 2017, an ONA streamed on Production I.G.'s Tate Anime (since renamed Anime Beans) before the production of a television anime series.",fall,2019,"{'day': 'Mondays', 'time': '00:30', 'timezone': 'Asia/Tokyo', 'string': 'Mondays at 00:30 (JST)'}","[{'mal_id': 144, 'type': 'anime', 'name': 'Pony Canyon', 'url': 'https://myanimelist.net/anime/producer/144/Pony_Canyon'}, {'mal_id': 166, 'type': 'anime', 'name': 'Movic', 'url': 'https://myanimelist.net/anime/producer/166/Movic'}, {'mal_id': 687, 'type': 'anime', 'name': 'Bandai Namco Live Creative', 'url': 'https://myanimelist.net/anime/producer/687/Bandai_Namco_Live_Creative'}, {'mal_id': 1041, 'type': 'anime', 'name': 'Ai Addiction', 'url': 'https://myanimelist.net/anime/producer/1041/Ai_Addiction'}, {'mal_id': 1345, 'type': 'anime', 'name': 'Sammy', 'url': 'https://myanimelist.net/anime/producer/1345/Sammy'}, {'mal_id': 1551, 'type': 'anime', 'name': 'Kadokawa Media House', 'url': 'https://myanimelist.net/anime/producer/1551/Kadokawa_Media_House'}, {'mal_id': 1696, 'type': 'anime', 'name': 'Kadokawa', 'url': 'https://myanimelist.net/anime/producer/1696/Kadokawa'}, {'mal_id': 1751, 'type': 'anime', 'name': 'pH Studio', 'url': 'https://myanimelist.net/anime/producer/1751/pH_Studio'}]","[{'mal_id': 102, 'type': 'anime', 'name': 'Funimation', 'url': 'https://myanimelist.net/anime/producer/102/Funimation'}]","[{'mal_id': 1972, 'type': 'anime', 'name': 'HOTZIPANG', 'url': 'https://myanimelist.net/anime/producer/1972/HOTZIPANG'}]","[{'mal_id': 4, 'type': 'anime', 'name': 'Comedy', 'url': 'https://myanimelist.net/anime/genre/4/Comedy'}, {'mal_id': 36, 'type': 'anime', 'name': 'Slice of Life', 'url': 'https://myanimelist.net/anime/genre/36/Slice_of_Life'}]",[],[],[]
38331,https://myanimelist.net/anime/38331/Stand_My_Heroes__Piece_of_Truth,"{'jpg': {'image_url': 'https://cdn.myanimelist.net/images/anime/1042/101018.jpg', 'small_image_url': 'https://cdn.myanimelist.net/images/anime/1042/101018t.jpg', 'large_image_url': 'https://cdn.myanimelist.net/images/anime/1042/101018l.jpg'}, 'webp': {'image_url': 'https://cdn.myanimelist.net/images/anime/1042/101018.webp', 'small_image_url': 'https://cdn.myanimelist.net/images/anime/1042/101018t.webp', 'large_image_url': 'https://cdn.myanimelist.net/images/anime/1042/101018l.webp'}}","{'youtube_id': '-6mit6RYUaY', 'url': 'https://www.youtube.com/watch?v=-6mit6RYUaY', 'embed_url': 'https://www.youtube.com/embed/-6mit6RYUaY?enablejsapi=1&wmode=opaque&autoplay=1', 'images': {'image_url': 'https://img.youtube.com/vi/-6mit6RYUaY/default.jpg', 'small_image_url': 'https://img.youtube.com/vi/-6mit6RYUaY/sddefault.jpg', 'medium_image_url': 'https://img.youtube.com/vi/-6mit6RYUaY/mqdefault.jpg', 'large_image_url': 'https://img.youtube.com/vi/-6mit6RYUaY/hqdefault.jpg', 'maximum_image_url': 'https://img.youtube.com/vi/-6mit6RYUaY/maxresdefault.jpg'}}","""Stand My Heroes: Piece of Truth""",Stand My Heroes: Piece of Truth,スタンドマイヒーローズ PIECE OF TRUTH,[],TV,Game,12.0,Finished Airing,False,"{'from': '2019-10-07T00:00:00+00:00', 'to': '2019-12-23T00:00:00+00:00', 'prop': {'from': {'day': 7, 'month': 10, 'year': 2019}, 'to': {'day': 23, 'month': 12, 'year': 2019}}, 'string': 'Oct 7, 2019 to Dec 23, 2019'}",24 min per ep,PG-13 - Teens 13 or older,5.73,4890.0,9716.0,3887,22544,69,"Drugs have become the center of conflict in Japan, and crime involving them has been increasing at an alarming rate. Unable to control the chaos, the police department settled on creating a unit—STAND—that would include unique, specialized experts and professionals better suited to handle the pressing issue. Rei Izumi is a novice joining the narcotics investigation unit, assigned the daunting task of recruiting the potential representatives of STAND. While recommended for her moral sense of justice and devotion to police work, Rei also has a unique aspect of her own that may have earned her the job—she has an immunity to many, if not most, kinds of drugs. Eager to seek the possible members of STAND, Rei quickly learns that scouting the different individuals will be more difficult than she expected, as each candidate harbors their own feelings, ideologies, and willingness toward joining the team and regulating drugs as a whole. Her capability as a narcotics officer is also questioned by the many colorful personalities she meets, stirring conflict and unpredictability in Rei's daily life. However, persuading the various contenders for STAND isn't the only obstacle she faces, as becoming involved in the treacherous underworld of drugs, overflowing with deceit and secrecy, will be more hazardous than she ever imagined. [Written by MAL Rewrite]",,fall,2019,"{'day': 'Mondays', 'time': '23:00', 'timezone': 'Asia/Tokyo', 'string': 'Mondays at 23:00 (JST)'}","[{'mal_id': 109, 'type': 'anime', 'name': 'Shochiku', 'url': 'https://myanimelist.net/anime/producer/109/Shochiku'}, {'mal_id': 236, 'type': 'anime', 'name': 'YTV', 'url': 'https://myanimelist.net/anime/producer/236/YTV'}, {'mal_id': 1211, 'type': 'anime', 'name': 'Tokyo MX', 'url': 'https://myanimelist.net/anime/producer/1211/Tokyo_MX'}, {'mal_id': 1416, 'type': 'anime', 'name': 'BS11', 'url': 'https://myanimelist.net/anime/producer/1416/BS11'}, {'mal_id': 1501, 'type': 'anime', 'name': 'JR East Marketing & Communications', 'url': 'https://myanimelist.net/anime/producer/1501/JR_East_Marketing___Communications'}, {'mal_id': 1800, 'type': 'anime', 'name': 'Marui Group', 'url': 'https://myanimelist.net/anime/producer/1800/Marui_Group'}, {'mal_id': 1817, 'type': 'anime', 'name': 'Rakuten', 'url': 'https://myanimelist.net/anime/producer/1817/Rakuten'}]","[{'mal_id': 102, 'type': 'anime', 'name': 'Funimation', 'url': 'https://myanimelist.net/anime/producer/102/Funimation'}]","[{'mal_id': 463, 'type': 'anime', 'name': 'M.S.C', 'url': 'https://myanimelist.net/anime/producer/463/MSC'}]","[{'mal_id': 7, 'type': 'anime', 'name': 'Mystery', 'url': 'https://myanimelist.net/anime/genre/7/Mystery'}, {'mal_id': 22, 'type': 'anime', 'name': 'Romance', 'url': 'https://myanimelist.net/anime/genre/22/Romance'}]",[],[],[]
39506,https://myanimelist.net/anime/39506/Phantasy_Star_Online_2__Episode_Oracle,"{'jpg': {'image_url': 'https://cdn.myanimelist.net/images/anime/1923/99744.jpg', 'small_image_url': 'https://cdn.myanimelist.net/images/anime/1923/99744t.jpg', 'large_image_url': 'https://cdn.myanimelist.net/images/anime/1923/99744l.jpg'}, 'webp': {'image_url': 'https://cdn.myanimelist.net/images/anime/1923/99744.webp', 'small_image_url': 'https://cdn.myanimelist.net/images/anime/1923/99744t.webp', 'large_image_url': 'https://cdn.myanimelist.net/images/anime/1923/99744l.webp'}}","{'youtube_id': 'ucsfnbsDv9c', 'url': 'https://www.youtube.com/watch?v=ucsfnbsDv9c', 'embed_url': 'https://www.youtube.com/embed/ucsfnbsDv9c?enablejsapi=1&wmode=opaque&autoplay=1', 'images': {'image_url': 'https://img.youtube.com/vi/ucsfnbsDv9c/default.jpg', 'small_image_url': 'https://img.youtube.com/vi/ucsfnbsDv9c/sddefault.jpg', 'medium_image_url': 'https://img.youtube.com/vi/ucsfnbsDv9c/mqdefault.jpg', 'large_image_url': 'https://img.youtube.com/vi/ucsfnbsDv9c/hqdefault.jpg', 'maximum_image_url': 'https://img.youtube.com/vi/ucsfnbsDv9c/maxresdefault.jpg'}}","""Phantasy Star Online 2: Episode Oracle""",Phantasy Star Online 2: Episode Oracle,ファンタシースターオンライン2 エピソード・オラクル,[],TV,Game,25.0,Finished Airing,False,"{'from': '2019-10-07T00:00:00+00:00', 'to': '2020-03-30T00:00:00+00:00', 'prop': {'from': {'day': 7, 'month': 10, 'year': 2019}, 'to': {'day': 30, 'month': 3, 'year': 2020}}, 'string': 'Oct 7, 2019 to Mar 30, 2020'}",23 min per ep,PG-13 - Teens 13 or older,6.54,4745.0,5955.0,3961,21682,37,"A TV anime adaptation of episode 1-3 out of 5 the total episodes from the Phantasy Star Online 2 game. Some anime-original content will be created as well. Episode 1: During their qualification exam in planet Naberius, the player and fellow ARKS trainee Afin were attacked by vile organisms known as Darkers. This is followed by the two discovering a mysterious girl who lost most of her memories, and the truth regarding Naberius and the recent spike of Darker activities. Episode 2: The plot follows the player and Matoi as they try to unravel a dark conspiracy regarding the origin and purpose of ARKS. Episode 3: The discovery of the planet Harukotan brought a new quest into the fray, as the peace between the Shironian and Kuronites that dwell in the planet is disturbed by the Kuronites' sudden attack. The newly-reformed ARKS is tasked to investigate the reason behind it all, and it seems like the truth is more complicated and horrifying than expected... (Source: phantasystar.fandom.com)",,fall,2019,"{'day': 'Mondays', 'time': '22:30', 'timezone': 'Asia/Tokyo', 'string': 'Mondays at 22:30 (JST)'}","[{'mal_id': 61, 'type': 'anime', 'name': 'Frontier Works', 'url': 'https://myanimelist.net/anime/producer/61/Frontier_Works'}, {'mal_id': 144, 'type': 'anime', 'name': 'Pony Canyon', 'url': 'https://myanimelist.net/anime/producer/144/Pony_Canyon'}, {'mal_id': 167, 'type': 'anime', 'name': 'Sega', 'url': 'https://myanimelist.net/anime/producer/167/Sega'}, {'mal_id': 1211, 'type': 'anime', 'name': 'Tokyo MX', 'url': 'https://myanimelist.net/anime/producer/1211/Tokyo_MX'}, {'mal_id': 1345, 'type': 'anime', 'name': 'Sammy', 'url': 'https://myanimelist.net/anime/producer/1345/Sammy'}, {'mal_id': 1997, 'type': 'anime', 'name': 'Studio Kai', 'url': 'https://myanimelist.net/anime/producer/1997/Studio_Kai'}, {'mal_id': 2118, 'type': 'anime', 'name': 'ADK Emotions', 'url': 'https://myanimelist.net/anime/producer/2118/ADK_Emotions'}]","[{'mal_id': 102, 'type': 'anime', 'name': 'Funimation', 'url': 'https://myanimelist.net/anime/producer/102/Funimation'}]","[{'mal_id': 3, 'type': 'anime', 'name': 'Gonzo', 'url': 'https://myanimelist.net/anime/producer/3/Gonzo'}]","[{'mal_id': 1, 'type': 'anime', 'name': 'Action', 'url': 'https://myanimelist.net/anime/genre/1/Action'}, {'mal_id': 24, 'type': 'anime', 'name': 'Sci-Fi', 'url': 'https://myanimelist.net/anime/genre/24/Sci-Fi'}]",[],"[{'mal_id': 29, 'type': 'anime', 'name': 'Space', 'url': 'https://myanimelist.net/anime/genre/29/Space'}]",[]
38670,https://myanimelist.net/anime/38670/Actors__Songs_Connection,"{'jpg': {'image_url': 'https://cdn.myanimelist.net/images/anime/1383/103339.jpg', 'small_image_url': 'https://cdn.myanimelist.net/images/anime/1383/103339t.jpg', 'large_image_url': 'https://cdn.myanimelist.net/images/anime/1383/103339l.jpg'}, 'webp': {'image_url': 'https://cdn.myanimelist.net/images/anime/1383/103339.webp', 'small_image_url': 'https://cdn.myanimelist.net/images/anime/1383/103339t.webp', 'large_image_url': 'https://cdn.myanimelist.net/images/anime/1383/103339l.webp'}}","{'youtube_id': 'QQqJgfAG7dk', 'url': 'https://www.youtube.com/watch?v=QQqJgfAG7dk', 'embed_url': 'https://www.youtube.com/embed/QQqJgfAG7dk?enablejsapi=1&wmode=opaque&autoplay=1', 'images': {'image_url': 'https://img.youtube.com/vi/QQqJgfAG7dk/default.jpg', 'small_image_url': 'https://img.youtube.com/vi/QQqJgfAG7dk/sddefault.jpg', 'medium_image_url': 'https://img.youtube.com/vi/QQqJgfAG7dk/mqdefault.jpg', 'large_image_url': 'https://img.youtube.com/vi/QQqJgfAG7dk/hqdefault.jpg', 'maximum_image_url': 'https://img.youtube.com/vi/QQqJgfAG7dk/maxresdefault.jpg'}}","""Actors: Songs Connection""",,ACTORS -Songs Connection-,[],TV,Music,12.0,Finished Airing,False,"{'from': '2019-10-06T00:00:00+00:00', 'to': '2019-12-22T00:00:00+00:00', 'prop': {'from': {'day': 6, 'month': 10, 'year': 2019}, 'to': {'day': 22, 'month': 12, 'year': 2019}}, 'string': 'Oct 6, 2019 to Dec 22, 2019'}",23 min per ep,PG-13 - Teens 13 or older,6.29,4235.0,7233.0,4575,15404,64,"Tensho School is located in the 7th Ward of Thrive Central, where emphasis is put on extracurricular activities and all clubs participate in an annual fall singing contest. Having to delay the start of his school year due to his older sister's hospitalization, transfer student Saku Otonomiya finds himself struggling to adapt to his hectic new life. Balancing his part-time job and caring for his sister, he finds it difficult to make time to join a school club. In preparation for the upcoming singing contest, the school's singing club wishes to use Sousuke Kagura's song ""Cloudy Days,"" but Kagura is reluctant to grant his permission. The song requires someone with a three-octave range to sing it and he believes that only a VOCALOID can meet the standards. He allows for the club to use his song on the condition that they can find someone who possesses that vocal range to properly sing it. While racking his brain over the composition of his next song, Kagura stumbles upon Otonomiya singing ""Cloudy Days"" perfectly. He invites Otonomiya to form a unit with him for the competition. At the same time, the singing club tries to goad him into joining so they can use Kagura's song. As the contest inches closer, Otonomiya must overcome his uncertainty and decide who to team up with. [Written by MAL Rewrite]","Actors: Songs Connection is a collaboration between VOCALOID and voice actors with EXIT TUNES, producing many of the songs featured in the show. The series was released on Blu-ray by Funimation on November 3, 2020.",fall,2019,"{'day': 'Sundays', 'time': '23:30', 'timezone': 'Asia/Tokyo', 'string': 'Sundays at 23:30 (JST)'}","[{'mal_id': 64, 'type': 'anime', 'name': 'Sotsu', 'url': 'https://myanimelist.net/anime/producer/64/Sotsu'}, {'mal_id': 144, 'type': 'anime', 'name': 'Pony Canyon', 'url': 'https://myanimelist.net/anime/producer/144/Pony_Canyon'}, {'mal_id': 238, 'type': 'anime', 'name': 'AT-X', 'url': 'https://myanimelist.net/anime/producer/238/AT-X'}, {'mal_id': 1003, 'type': 'anime', 'name': 'Nippon Television Network', 'url': 'https://myanimelist.net/anime/producer/1003/Nippon_Television_Network'}, {'mal_id': 1211, 'type': 'anime', 'name': 'Tokyo MX', 'url': 'https://myanimelist.net/anime/producer/1211/Tokyo_MX'}, {'mal_id': 1735, 'type': 'anime', 'name': 'JY Animation', 'url': 'https://myanimelist.net/anime/producer/1735/JY_Animation'}]","[{'mal_id': 102, 'type': 'anime', 'name': 'Funimation', 'url': 'https://myanimelist.net/anime/producer/102/Funimation'}]","[{'mal_id': 1967, 'type': 'anime', 'name': 'Drive', 'url': 'https://myanimelist.net/anime/producer/1967/Drive'}]",[],[],"[{'mal_id': 19, 'type': 'anime', 'name': 'Music', 'url': 'https://myanimelist.net/anime/genre/19/Music'}, {'mal_id': 23, 'type': 'anime', 'name': 'School', 'url': 'https://myanimelist.net/anime/genre/23/School'}]",[]
40228,https://myanimelist.net/anime/40228/Bananya__Fushigi_na_Nakama-tachi,"{'jpg': {'image_url': 'https://cdn.myanimelist.net/images/anime/1449/102481.jpg', 'small_image_url': 'https://cdn.myanimelist.net/images/anime/1449/102481t.jpg', 'large_image_url': 'https://cdn.myanimelist.net/images/anime/1449/102481l.jpg'}, 'webp': {'image_url': 'https://cdn.myanimelist.net/images/anime/1449/102481.webp', 'small_image_url': 'https://cdn.myanimelist.net/images/anime/1449/102481t.webp', 'large_image_url': 'https://cdn.myanimelist.net/images/anime/1449/102481l.webp'}}","{'youtube_id': '08Jxzj3YSAc', 'url': 'https://www.youtube.com/watch?v=08Jxzj3YSAc', 'embed_url': 'https://www.youtube.com/embed/08Jxzj3YSAc?enablejsapi=1&wmode=opaque&autoplay=1', 'images': {'image_url': 'https://img.youtube.com/vi/08Jxzj3YSAc/default.jpg', 'small_image_url': 'https://img.youtube.com/vi/08Jxzj3YSAc/sddefault.jpg', 'medium_image_url': 'https://img.youtube.com/vi/08Jxzj3YSAc/mqdefault.jpg', 'large_image_url': 'https://img.youtube.com/vi/08Jxzj3YSAc/hqdefault.jpg', 'maximum_image_url': 'https://img.youtube.com/vi/08Jxzj3YSAc/maxresdefault.jpg'}}","""Bananya: Fushigi na Nakama-tachi""",Bananya and the Curious Bunch,ばなにゃ ふしぎななかまたち,[],TV,Original,13.0,Finished Airing,False,"{'from': '2019-10-01T00:00:00+00:00', 'to': '2019-12-24T00:00:00+00:00', 'prop': {'from': {'day': 1, 'month': 10, 'year': 2019}, 'to': {'day': 24, 'month': 12, 'year': 2019}}, 'string': 'Oct 1, 2019 to Dec 24, 2019'}",2 min per ep,G - All Ages,6.6,5787.0,5660.0,5099,12221,27,"On a little planet live little creatures called ""Bananyas."" Come watch their daily lifes full of adventures and discoveries.",,fall,2019,"{'day': 'Tuesdays', 'time': '07:30', 'timezone': 'Asia/Tokyo', 'string': 'Tuesdays at 07:30 (JST)'}",[],"[{'mal_id': 467, 'type': 'anime', 'name': 'Discotek Media', 'url': 'https://myanimelist.net/anime/producer/467/Discotek_Media'}]","[{'mal_id': 73, 'type': 'anime', 'name': 'TMS Entertainment', 'url': 'https://myanimelist.net/anime/producer/73/TMS_Entertainment'}, {'mal_id': 400, 'type': 'anime', 'name': 'Gathering', 'url': 'https://myanimelist.net/anime/producer/400/Gathering'}]","[{'mal_id': 4, 'type': 'anime', 'name': 'Comedy', 'url': 'https://myanimelist.net/anime/genre/4/Comedy'}, {'mal_id': 36, 'type': 'anime', 'name': 'Slice of Life', 'url': 'https://myanimelist.net/anime/genre/36/Slice_of_Life'}]",[],[],"[{'mal_id': 15, 'type': 'anime', 'name': 'Kids', 'url': 'https://myanimelist.net/anime/genre/15/Kids'}]"
