mal_id,url,images,trailer,title,title_english,title_japanese,title_synonyms,type,source,episodes,status,airing,aired,duration,rating,score,scored_by,rank,popularity,members,favorites,synopsis,background,season,year,broadcast,producers,licensors,studios,genres,explicit_genres,themes,demographics
39570,https://myanimelist.net/anime/39570/High_Score_Girl_II,"{'jpg': {'image_url': 'https://cdn.myanimelist.net/images/anime/1560/99904.jpg', 'small_image_url': 'https://cdn.myanimelist.net/images/anime/1560/99904t.jpg', 'large_image_url': 'https://cdn.myanimelist.net/images/anime/1560/99904l.jpg'}, 'webp': {'image_url': 'https://cdn.myanimelist.net/images/anime/1560/99904.webp', 'small_image_url': 'https://cdn.myanimelist.net/images/anime/1560/99904t.webp', 'large_image_url': 'https://cdn.myanimelist.net/images/anime/1560/99904l.webp'}}","{'youtube_id': '2CQkLZVLTvc', 'url': 'https://www.youtube.com/watch?v=2CQkLZVLTvc', 'embed_url': 'https://www.youtube.com/embed/2CQkLZVLTvc?enablejsapi=1&wmode=opaque&autoplay=1', 'images': {'image_url': 'https://img.youtube.com/vi/2CQkLZVLTvc/default.jpg', 'small_image_url': 'https://img.youtube.com/vi/2CQkLZVLTvc/sddefault.jpg', 'medium_image_url': 'https://img.youtube.com/vi/2CQkLZVLTvc/mqdefault.jpg', 'large_image_url': 'https://img.youtube.com/vi/2CQkLZVLTvc/hqdefault.jpg', 'maximum_image_url': 'https://img.youtube.com/vi/2CQkLZVLTvc/maxresdefault.jpg'}}","""High Score Girl II""",,ハイスコアガール II,['High Score Girl 2'],TV,Manga,9.0,Finished Airing,False,"{'from': '2019-10-26T00:00:00+00:00', 'to': '2019-12-21T00:00:00+00:00', 'prop': {'from': {'day': 26, 'month': 10, 'year': 2019}, 'to': {'day': 21, 'month': 12, 'year': 2019}}, 'string': 'Oct 26, 2019 to Dec 21, 2019'}",23 min per ep,PG-13 - Teens 13 or older,8.0,63049.0,566.0,1529,111939,707,"The year is 1996, and second-year high school students Haruo Yaguchi, Akira Oono, and Koharu Hidaka live their lives as passionately about video games as they were five years ago. Brought together by arcade games, what began as a healthy rivalry and friendship has turned into something more. As they endeavour towards understanding their unfamiliar feelings, they work with allies, navigate high school, and find that, although life has its many challenges, there's always a game or two they can rely on. [Written by MAL Rewrite]",,fall,2019,"{'day': 'Saturdays', 'time': '01:05', 'timezone': 'Asia/Tokyo', 'string': 'Saturdays at 01:05 (JST)'}","[{'mal_id': 58, 'type': 'anime', 'name': 'Square Enix', 'url': 'https://myanimelist.net/anime/producer/58/Square_Enix'}, {'mal_id': 143, 'type': 'anime', 'name': 'Mainichi Broadcasting System', 'url': 'https://myanimelist.net/anime/producer/143/Mainichi_Broadcasting_System'}, {'mal_id': 306, 'type': 'anime', 'name': 'Magic Capsule', 'url': 'https://myanimelist.net/anime/producer/306/Magic_Capsule'}, {'mal_id': 415, 'type': 'anime', 'name': 'Warner Bros. Japan', 'url': 'https://myanimelist.net/anime/producer/415/Warner_Bros_Japan'}, {'mal_id': 460, 'type': 'anime', 'name': 'KlockWorx', 'url': 'https://myanimelist.net/anime/producer/460/KlockWorx'}, {'mal_id': 1261, 'type': 'anime', 'name': 'Good Smile Company', 'url': 'https://myanimelist.net/anime/producer/1261/Good_Smile_Company'}]","[{'mal_id': 1977, 'type': 'anime', 'name': 'Netflix', 'url': 'https://myanimelist.net/anime/producer/1977/Netflix'}]","[{'mal_id': 7, 'type': 'anime', 'name': 'J.C.Staff', 'url': 'https://myanimelist.net/anime/producer/7/JCStaff'}]","[{'mal_id': 4, 'type': 'anime', 'name': 'Comedy', 'url': 'https://myanimelist.net/anime/genre/4/Comedy'}, {'mal_id': 22, 'type': 'anime', 'name': 'Romance', 'url': 'https://myanimelist.net/anime/genre/22/Romance'}]",[],"[{'mal_id': 11, 'type': 'anime', 'name': 'Game', 'url': 'https://myanimelist.net/anime/genre/11/Game'}, {'mal_id': 23, 'type': 'anime', 'name': 'School', 'url': 'https://myanimelist.net/anime/genre/23/School'}]","[{'mal_id': 42, 'type': 'anime', 'name': 'Seinen', 'url': 'https://myanimelist.net/anime/genre/42/Seinen'}]"
39355,https://myanimelist.net/anime/39355/Radiant_2nd_Season,"{'jpg': {'image_url': 'https://cdn.myanimelist.net/images/anime/1974/108398.jpg', 'small_image_url': 'https://cdn.myanimelist.net/images/anime/1974/108398t.jpg', 'large_image_url': 'https://cdn.myanimelist.net/images/anime/1974/108398l.jpg'}, 'webp': {'image_url': 'https://cdn.myanimelist.net/images/anime/1974/108398.webp', 'small_image_url': 'https://cdn.myanimelist.net/images/anime/1974/108398t.webp', 'large_image_url': 'https://cdn.myanimelist.net/images/anime/1974/108398l.webp'}}","{'youtube_id': 'lv4OplOOJaI', 'url': 'https://www.youtube.com/watch?v=lv4OplOOJaI', 'embed_url': 'https://www.youtube.com/embed/lv4OplOOJaI?enablejsapi=1&wmode=opaque&autoplay=1', 'images': {'image_url': 'https://img.youtube.com/vi/lv4OplOOJaI/default.jpg', 'small_image_url': 'https://img.youtube.com/vi/lv4OplOOJaI/sddefault.jpg', 'medium_image_url': 'https://img.youtube.com/vi/lv4OplOOJaI/mqdefault.jpg', 'large_image_url': 'https://img.youtube.com/vi/lv4OplOOJaI/hqdefault.jpg', 'maximum_image_url': 'https://img.youtube.com/vi/lv4OplOOJaI/maxresdefault.jpg'}}","""Radiant 2nd Season""",RADIANT Season 2,ラディアン 第2シリーズ,[],TV,Other,21.0,Finished Airing,False,"{'from': '2019-10-02T00:00:00+00:00', 'to': '2020-02-26T00:00:00+00:00', 'prop': {'from': {'day': 2, 'month': 10, 'year': 2019}, 'to': {'day': 26, 'month': 2, 'year': 2020}}, 'string': 'Oct 2, 2019 to Feb 26, 2020'}",24 min per ep,PG-13 - Teens 13 or older,7.58,34510.0,1371.0,1818,89069,205,"After fleeing from Rumble Town, Seth, Doc and Melie are back at the Artemis Institute. Thanks to Alma, Seth learns more about Piodon, his mysterious brother. But the quest for the Nemeses mythical nest Radiant has already waited too long, so the Horned Boy and his friends head to the island-continent of the Wizard Knights. This location may be a new city for audiences, but it's a decaying world that's falling apart! Not only must Seth deal with these hardships, but he must also face a personal phenomenon where visions are invading his mind a little more each day. (Source: monstersandcritics)",,fall,2019,"{'day': 'Wednesdays', 'time': '19:25', 'timezone': 'Asia/Tokyo', 'string': 'Wednesdays at 19:25 (JST)'}","[{'mal_id': 1797, 'type': 'anime', 'name': 'NHK Enterprises', 'url': 'https://myanimelist.net/anime/producer/1797/NHK_Enterprises'}]","[{'mal_id': 102, 'type': 'anime', 'name': 'Funimation', 'url': 'https://myanimelist.net/anime/producer/102/Funimation'}]","[{'mal_id': 456, 'type': 'anime', 'name': 'Lerche', 'url': 'https://myanimelist.net/anime/producer/456/Lerche'}]","[{'mal_id': 1, 'type': 'anime', 'name': 'Action', 'url': 'https://myanimelist.net/anime/genre/1/Action'}, {'mal_id': 2, 'type': 'anime', 'name': 'Adventure', 'url': 'https://myanimelist.net/anime/genre/2/Adventure'}, {'mal_id': 10, 'type': 'anime', 'name': 'Fantasy', 'url': 'https://myanimelist.net/anime/genre/10/Fantasy'}]",[],[],[]
39799,https://myanimelist.net/anime/39799/Val_x_Love,"{'jpg': {'image_url': 'https://cdn.myanimelist.net/images/anime/1577/111404.jpg', 'small_image_url': 'https://cdn.myanimelist.net/images/anime/1577/111404t.jpg', 'large_image_url': 'https://cdn.myanimelist.net/images/anime/1577/111404l.jpg'}, 'webp': {'image_url': 'https://cdn.myanimelist.net/images/anime/1577/111404.webp', 'small_image_url': 'https://cdn.myanimelist.net/images/anime/1577/111404t.webp', 'large_image_url': 'https://cdn.myanimelist.net/images/anime/1577/111404l.webp'}}","{'youtube_id': 'PBgKIbRY4RY', 'url': 'https://www.youtube.com/watch?v=PBgKIbRY4RY', 'embed_url': 'https://www.youtube.com/embed/PBgKIbRY4RY?enablejsapi=1&wmode=opaque&autoplay=1', 'images': {'image_url': 'https://img.youtube.com/vi/PBgKIbRY4RY/default.jpg', 'small_image_url': 'https://img.youtube.com/vi/PBgKIbRY4RY/sddefault.jpg', 'medium_image_url': 'https://img.youtube.com/vi/PBgKIbRY4RY/mqdefault.jpg', 'large_image_url': 'https://img.youtube.com/vi/PBgKIbRY4RY/hqdefault.jpg', 'maximum_image_url': 'https://img.youtube.com/vi/PBgKIbRY4RY/maxresdefault.jpg'}}","""Val x Love""",,戦×恋（ヴァルラヴ）,"['Vallove', 'Ikusa x Koi']",TV,Manga,12.0,Finished Airing,False,"{'from': '2019-10-05T00:00:00+00:00', 'to': '2019-12-21T00:00:00+00:00', 'prop': {'from': {'day': 5, 'month': 10, 'year': 2019}, 'to': {'day': 21, 'month': 12, 'year': 2019}}, 'string': 'Oct 5, 2019 to Dec 21, 2019'}",23 min per ep,R - 17+ (violence & profanity),5.9,25886.0,9100.0,1956,81120,134,"Valkyries—legendary female warriors from the land of gods, Asgard—are sent by Odin to protect Earth against the growing threat of demons. To overcome these threats, nine valkyries under the guise of the Saotome sisters will have to level up by performing a variety of romantic acts with their official lover, Einherjar. Meanwhile, the socially anxious Takuma Akutsu learns that Odin has chosen him as the valkyries' lover. Despite his utter horror, however, he agrees to let the sisters stay in his big yet empty house to help them in their war against demons. With nine beautiful women sharing his roof, will Takuma manage to prevail over his fear of society and become someone worthy of saving the world? [Written by MAL Rewrite]",,fall,2019,"{'day': 'Saturdays', 'time': '23:00', 'timezone': 'Asia/Tokyo', 'string': 'Saturdays at 23:00 (JST)'}","[{'mal_id': 58, 'type': 'anime', 'name': 'Square Enix', 'url': 'https://myanimelist.net/anime/producer/58/Square_Enix'}, {'mal_id': 64, 'type': 'anime', 'name': 'Sotsu', 'url': 'https://myanimelist.net/anime/producer/64/Sotsu'}, {'mal_id': 238, 'type': 'anime', 'name': 'AT-X', 'url': 'https://myanimelist.net/anime/producer/238/AT-X'}, {'mal_id': 1211, 'type': 'anime', 'name': 'Tokyo MX', 'url': 'https://myanimelist.net/anime/producer/1211/Tokyo_MX'}, {'mal_id': 1284, 'type': 'anime', 'name': 'Avex Pictures', 'url': 'https://myanimelist.net/anime/producer/1284/Avex_Pictures'}, {'mal_id': 1334, 'type': 'anime', 'name': 'Docomo Anime Store', 'url': 'https://myanimelist.net/anime/producer/1334/Docomo_Anime_Store'}, {'mal_id': 1416, 'type': 'anime', 'name': 'BS11', 'url': 'https://myanimelist.net/anime/producer/1416/BS11'}, {'mal_id': 1602, 'type': 'anime', 'name': 'GYAO!', 'url': 'https://myanimelist.net/anime/producer/1602/GYAO'}, {'mal_id': 1635, 'type': 'anime', 'name': 'A-Sketch', 'url': 'https://myanimelist.net/anime/producer/1635/A-Sketch'}, {'mal_id': 1996, 'type': 'anime', 'name': 'MAGNET', 'url': 'https://myanimelist.net/anime/producer/1996/MAGNET'}, {'mal_id': 2107, 'type': 'anime', 'name': 'entama', 'url': 'https://myanimelist.net/anime/producer/2107/entama'}]","[{'mal_id': 376, 'type': 'anime', 'name': 'Sentai Filmworks', 'url': 'https://myanimelist.net/anime/producer/376/Sentai_Filmworks'}]","[{'mal_id': 346, 'type': 'anime', 'name': 'Hoods Entertainment', 'url': 'https://myanimelist.net/anime/producer/346/Hoods_Entertainment'}]","[{'mal_id': 4, 'type': 'anime', 'name': 'Comedy', 'url': 'https://myanimelist.net/anime/genre/4/Comedy'}, {'mal_id': 22, 'type': 'anime', 'name': 'Romance', 'url': 'https://myanimelist.net/anime/genre/22/Romance'}, {'mal_id': 37, 'type': 'anime', 'name': 'Supernatural', 'url': 'https://myanimelist.net/anime/genre/37/Supernatural'}, {'mal_id': 9, 'type': 'anime', 'name': 'Ecchi', 'url': 'https://myanimelist.net/anime/genre/9/Ecchi'}]",[],"[{'mal_id': 35, 'type': 'anime', 'name': 'Harem', 'url': 'https://myanimelist.net/anime/genre/35/Harem'}, {'mal_id': 23, 'type': 'anime', 'name': 'School', 'url': 'https://myanimelist.net/anime/genre/23/School'}]","[{'mal_id': 27, 'type': 'anime', 'name': 'Shounen', 'url': 'https://myanimelist.net/anime/genre/27/Shounen'}]"
38161,https://myanimelist.net/anime/38161/Kabukichou_Sherlock,"{'jpg': {'image_url': 'https://cdn.myanimelist.net/images/anime/1657/111622.jpg', 'small_image_url': 'https://cdn.myanimelist.net/images/anime/1657/111622t.jpg', 'large_image_url': 'https://cdn.myanimelist.net/images/anime/1657/111622l.jpg'}, 'webp': {'image_url': 'https://cdn.myanimelist.net/images/anime/1657/111622.webp', 'small_image_url': 'https://cdn.myanimelist.net/images/anime/1657/111622t.webp', 'large_image_url': 'https://cdn.myanimelist.net/images/anime/1657/111622l.webp'}}","{'youtube_id': 'YTi544iLlFw', 'url': 'https://www.youtube.com/watch?v=YTi544iLlFw', 'embed_url': 'https://www.youtube.com/embed/YTi544iLlFw?enablejsapi=1&wmode=opaque&autoplay=1', 'images': {'image_url': 'https://img.youtube.com/vi/YTi544iLlFw/default.jpg', 'small_image_url': 'https://img.youtube.com/vi/YTi544iLlFw/sddefault.jpg', 'medium_image_url': 'https://img.youtube.com/vi/YTi544iLlFw/mqdefault.jpg', 'large_image_url': 'https://img.youtube.com/vi/YTi544iLlFw/hqdefault.jpg', 'maximum_image_url': 'https://img.youtube.com/vi/YTi544iLlFw/maxresdefault.jpg'}}","""Kabukichou Sherlock""",Case File nº221: Kabukicho,歌舞伎町シャーロック,[],TV,Original,24.0,Finished Airing,False,"{'from': '2019-10-12T00:00:00+00:00', 'to': '2020-03-28T00:00:00+00:00', 'prop': {'from': {'day': 12, 'month': 10, 'year': 2019}, 'to': {'day': 28, 'month': 3, 'year': 2020}}, 'string': 'Oct 12, 2019 to Mar 28, 2020'}",24 min per ep,None,6.9,18671.0,4248.0,2010,75905,185,"In Shinjuku ward's east side lies Kabukichou, a vibrant city of chaos that glows brilliantly with neon lights but also hides unseen darkness. Employed at a university hospital on the west side, John H. Watson is looking for someone who can assist him with an odd case. His search leads him to the Pipe Cat, an underground bar that serves as a meetup venue and job board for some of the best detectives in Shinjuku, the most prominent among them being Sherlock Holmes. Upon finding the bar and meeting the peculiar investigators, John learns that they are pursuing a case involving Jack the Ripper, an infamous serial killer. Due to subsequent events, John ends up driving Sherlock to the crime scene of a murder supposedly carried out by Jack the Ripper. Even though John is only there to enlist Sherlock's help with his case, he witnesses Sherlock brilliantly uncover the truth behind the crime scene. However, he begins to realize that Sherlock is not only a genius detective but also an eccentric character. As John continues to request Sherlock to assist him with his case, he finds himself spiraling into the detective lifestyle of solving cases beyond the minds of ordinary civilians. Through this work, John begins to see the true colors of the chaotic city that is Kabukichou and starts to unravel the unsettling mystery behind his own case. [Written by MAL Rewrite]",,fall,2019,"{'day': 'Saturdays', 'time': '01:55', 'timezone': 'Asia/Tokyo', 'string': 'Saturdays at 01:55 (JST)'}","[{'mal_id': 143, 'type': 'anime', 'name': 'Mainichi Broadcasting System', 'url': 'https://myanimelist.net/anime/producer/143/Mainichi_Broadcasting_System'}, {'mal_id': 166, 'type': 'anime', 'name': 'Movic', 'url': 'https://myanimelist.net/anime/producer/166/Movic'}, {'mal_id': 1255, 'type': 'anime', 'name': 'Glovision', 'url': 'https://myanimelist.net/anime/producer/1255/Glovision'}, {'mal_id': 1671, 'type': 'anime', 'name': 'DMM pictures', 'url': 'https://myanimelist.net/anime/producer/1671/DMM_pictures'}, {'mal_id': 1696, 'type': 'anime', 'name': 'Kadokawa', 'url': 'https://myanimelist.net/anime/producer/1696/Kadokawa'}]","[{'mal_id': 102, 'type': 'anime', 'name': 'Funimation', 'url': 'https://myanimelist.net/anime/producer/102/Funimation'}]","[{'mal_id': 10, 'type': 'anime', 'name': 'Production I.G', 'url': 'https://myanimelist.net/anime/producer/10/Production_IG'}]","[{'mal_id': 4, 'type': 'anime', 'name': 'Comedy', 'url': 'https://myanimelist.net/anime/genre/4/Comedy'}, {'mal_id': 8, 'type': 'anime', 'name': 'Drama', 'url': 'https://myanimelist.net/anime/genre/8/Drama'}, {'mal_id': 7, 'type': 'anime', 'name': 'Mystery', 'url': 'https://myanimelist.net/anime/genre/7/Mystery'}]",[],[],[]
40351,https://myanimelist.net/anime/40351/Pokemon_2019,"{'jpg': {'image_url': 'https://cdn.myanimelist.net/images/anime/1689/105554.jpg', 'small_image_url': 'https://cdn.myanimelist.net/images/anime/1689/105554t.jpg', 'large_image_url': 'https://cdn.myanimelist.net/images/anime/1689/105554l.jpg'}, 'webp': {'image_url': 'https://cdn.myanimelist.net/images/anime/1689/105554.webp', 'small_image_url': 'https://cdn.myanimelist.net/images/anime/1689/105554t.webp', 'large_image_url': 'https://cdn.myanimelist.net/images/anime/1689/105554l.webp'}}","{'youtube_id': 'dHyYZtWrTD4', 'url': 'https://www.youtube.com/watch?v=dHyYZtWrTD4', 'embed_url': 'https://www.youtube.com/embed/dHyYZtWrTD4?enablejsapi=1&wmode=opaque&autoplay=1', 'images': {'image_url': 'https://img.youtube.com/vi/dHyYZtWrTD4/default.jpg', 'small_image_url': 'https://img.youtube.com/vi/dHyYZtWrTD4/sddefault.jpg', 'medium_image_url': 'https://img.youtube.com/vi/dHyYZtWrTD4/mqdefault.jpg', 'large_image_url': 'https://img.youtube.com/vi/dHyYZtWrTD4/hqdefault.jpg', 'maximum_image_url': 'https://img.youtube.com/vi/dHyYZtWrTD4/maxresdefault.jpg'}}","""Pokemon (2019)""",Pokemon Journeys: The Series,ポケットモンスター,"['Pocket Monsters', 'Pokemon 2019', 'Pokémon']",TV,Game,,Currently Airing,True,"{'from': '2019-11-17T00:00:00+00:00', 'to': None, 'prop': {'from': {'day': 17, 'month': 11, 'year': 2019}, 'to': {'day': None, 'month': None, 'year': None}}, 'string': 'Nov 17, 2019 to ?'}",23 min,PG - Children,7.16,20067.0,3077.0,2332,59579,393,"On a new day in the Kanto region, Satoshi gets invited by Professor Yukinari Ookido over to Professor Sakuragi's lab-opening ceremony in Vermillion City. During the ceremonial speech, Professor Sakuragi receives an alert of a possibly rare Pokémon appearing in Vermillion City's harbor, leading Satoshi and the other trainers to rush to the area in hopes of finding the mysterious Pokémon. At the harbor, they find Lugia—a Legendary Pokémon—engaged in combat with other trainers. Noticing the other trainers' tactics, Satoshi has his partner, Pikachu, strike Lugia with a Thunderbolt attack. Unfazed, Lugia flees, but not before Satoshi determinedly leaps onto its back. To Satoshi's surprise, he meets another boy, Gou, who leapt onto Lugia's back as well. The two ride on Lugia's back as it brings them along on a bizarre adventure across the seas. As it lets the two back on the ground, Satoshi and Gou bid their farewells to Lugia and return to Sakuragi Institute. Impressed by Gou's findings and Satoshi's insight taken during their encounter, Sakuragi requests for the duo to be his new research partners. And so the duo's journey begins, traveling across multiple regions to meet many new Pokémon—including ones that have the ability to Gigantamax! [Written by MAL Rewrite]","The airing time was Sundays 18:00 between November 17, 2019 - September 27, 2020. The airing time is changed to Fridays 18:55 beginning October 9, 2020.",fall,2019,"{'day': 'Fridays', 'time': '18:55', 'timezone': 'Asia/Tokyo', 'string': 'Fridays at 18:55 (JST)'}","[{'mal_id': 16, 'type': 'anime', 'name': 'TV Tokyo', 'url': 'https://myanimelist.net/anime/producer/16/TV_Tokyo'}, {'mal_id': 62, 'type': 'anime', 'name': 'Shogakukan-Shueisha Productions', 'url': 'https://myanimelist.net/anime/producer/62/Shogakukan-Shueisha_Productions'}, {'mal_id': 135, 'type': 'anime', 'name': 'MediaNet', 'url': 'https://myanimelist.net/anime/producer/135/MediaNet'}]","[{'mal_id': 499, 'type': 'anime', 'name': 'The Pokemon Company International', 'url': 'https://myanimelist.net/anime/producer/499/The_Pokemon_Company_International'}]","[{'mal_id': 28, 'type': 'anime', 'name': 'OLM', 'url': 'https://myanimelist.net/anime/producer/28/OLM'}]","[{'mal_id': 1, 'type': 'anime', 'name': 'Action', 'url': 'https://myanimelist.net/anime/genre/1/Action'}, {'mal_id': 2, 'type': 'anime', 'name': 'Adventure', 'url': 'https://myanimelist.net/anime/genre/2/Adventure'}, {'mal_id': 4, 'type': 'anime', 'name': 'Comedy', 'url': 'https://myanimelist.net/anime/genre/4/Comedy'}, {'mal_id': 10, 'type': 'anime', 'name': 'Fantasy', 'url': 'https://myanimelist.net/anime/genre/10/Fantasy'}]",[],[],"[{'mal_id': 15, 'type': 'anime', 'name': 'Kids', 'url': 'https://myanimelist.net/anime/genre/15/Kids'}]"
36587,https://myanimelist.net/anime/36587/Granblue_Fantasy_The_Animation_Season_2,"{'jpg': {'image_url': 'https://cdn.myanimelist.net/images/anime/1948/103308.jpg', 'small_image_url': 'https://cdn.myanimelist.net/images/anime/1948/103308t.jpg', 'large_image_url': 'https://cdn.myanimelist.net/images/anime/1948/103308l.jpg'}, 'webp': {'image_url': 'https://cdn.myanimelist.net/images/anime/1948/103308.webp', 'small_image_url': 'https://cdn.myanimelist.net/images/anime/1948/103308t.webp', 'large_image_url': 'https://cdn.myanimelist.net/images/anime/1948/103308l.webp'}}","{'youtube_id': '5W5tvt1WhMo', 'url': 'https://www.youtube.com/watch?v=5W5tvt1WhMo', 'embed_url': 'https://www.youtube.com/embed/5W5tvt1WhMo?enablejsapi=1&wmode=opaque&autoplay=1', 'images': {'image_url': 'https://img.youtube.com/vi/5W5tvt1WhMo/default.jpg', 'small_image_url': 'https://img.youtube.com/vi/5W5tvt1WhMo/sddefault.jpg', 'medium_image_url': 'https://img.youtube.com/vi/5W5tvt1WhMo/mqdefault.jpg', 'large_image_url': 'https://img.youtube.com/vi/5W5tvt1WhMo/hqdefault.jpg', 'maximum_image_url': 'https://img.youtube.com/vi/5W5tvt1WhMo/maxresdefault.jpg'}}","""Granblue Fantasy The Animation Season 2""",GRANBLUE FANTASY The Animation Season2,グランブルーファンタジー The Animation Season2,[],TV,Game,12.0,Finished Airing,False,"{'from': '2019-10-05T00:00:00+00:00', 'to': '2019-12-28T00:00:00+00:00', 'prop': {'from': {'day': 5, 'month': 10, 'year': 2019}, 'to': {'day': 28, 'month': 12, 'year': 2019}}, 'string': 'Oct 5, 2019 to Dec 28, 2019'}",23 min per ep,PG-13 - Teens 13 or older,6.74,16721.0,4967.0,2415,56552,60,"On the run from the Erste Empire, Gran and the crew of the Grandcypher receive an offer to negotiate a ceasefire. Meeting at the neutral territory of Albion Citadel, they are welcomed and hosted by Vira Lillie: current Lord Commander of Albion and a friend of Katalina Alize from her officer training at Albion. Imperial General Furias grants the Skyfarers an official pardon, but fails to defuse the tense situation. Given time to unwind, the Skyfarers attend a gala hosted by Vira to celebrate the arrival of the crew. However, tensions run high, as Furias and the Erste delegation remain at Albion even after the negotiations conclude. Learning about the existence of a Primal Beast on the island, the crew is shocked to discover a letter from Katalina announcing her resignation. While Gran heads off to find their former comrade, Eugen and Rackam decide to investigate the Imperial presence on the island, suspecting a more sinister scheme lying up the Empire's sleeve. [Written by MAL Rewrite]",,fall,2019,"{'day': 'Saturdays', 'time': '00:00', 'timezone': 'Asia/Tokyo', 'string': 'Saturdays at 00:00 (JST)'}","[{'mal_id': 17, 'type': 'anime', 'name': 'Aniplex', 'url': 'https://myanimelist.net/anime/producer/17/Aniplex'}, {'mal_id': 1587, 'type': 'anime', 'name': 'Cygames', 'url': 'https://myanimelist.net/anime/producer/1587/Cygames'}, {'mal_id': 1856, 'type': 'anime', 'name': 'dugout', 'url': 'https://myanimelist.net/anime/producer/1856/dugout'}]","[{'mal_id': 493, 'type': 'anime', 'name': 'Aniplex of America', 'url': 'https://myanimelist.net/anime/producer/493/Aniplex_of_America'}]","[{'mal_id': 569, 'type': 'anime', 'name': 'MAPPA', 'url': 'https://myanimelist.net/anime/producer/569/MAPPA'}]","[{'mal_id': 2, 'type': 'anime', 'name': 'Adventure', 'url': 'https://myanimelist.net/anime/genre/2/Adventure'}, {'mal_id': 10, 'type': 'anime', 'name': 'Fantasy', 'url': 'https://myanimelist.net/anime/genre/10/Fantasy'}]",[],[],[]
