mal_id,url,images,trailer,title,title_english,title_japanese,title_synonyms,type,source,episodes,status,airing,aired,duration,rating,score,scored_by,rank,popularity,members,favorites,synopsis,background,season,year,broadcast,producers,licensors,studios,genres,explicit_genres,themes,demographics
39523,https://myanimelist.net/anime/39523/Choujin_Koukousei-tachi_wa_Isekai_demo_Yoyuu_de_Ikinuku_you_desu,"{'jpg': {'image_url': 'https://cdn.myanimelist.net/images/anime/1132/111619.jpg', 'small_image_url': 'https://cdn.myanimelist.net/images/anime/1132/111619t.jpg', 'large_image_url': 'https://cdn.myanimelist.net/images/anime/1132/111619l.jpg'}, 'webp': {'image_url': 'https://cdn.myanimelist.net/images/anime/1132/111619.webp', 'small_image_url': 'https://cdn.myanimelist.net/images/anime/1132/111619t.webp', 'large_image_url': 'https://cdn.myanimelist.net/images/anime/1132/111619l.webp'}}","{'youtube_id': 'TZjmff4PFNA', 'url': 'https://www.youtube.com/watch?v=TZjmff4PFNA', 'embed_url': 'https://www.youtube.com/embed/TZjmff4PFNA?enablejsapi=1&wmode=opaque&autoplay=1', 'images': {'image_url': 'https://img.youtube.com/vi/TZjmff4PFNA/default.jpg', 'small_image_url': 'https://img.youtube.com/vi/TZjmff4PFNA/sddefault.jpg', 'medium_image_url': 'https://img.youtube.com/vi/TZjmff4PFNA/mqdefault.jpg', 'large_image_url': 'https://img.youtube.com/vi/TZjmff4PFNA/hqdefault.jpg', 'maximum_image_url': 'https://img.youtube.com/vi/TZjmff4PFNA/maxresdefault.jpg'}}","""Choujin Koukousei-tachi wa Isekai demo Yoyuu de Ikinuku you desu!""",CHOYOYU!: High School Prodigies Have It Easy Even in Another World!,超人高校生たちは異世界でも余裕で生き抜くようです！,"['Super Human High Schoolers Are in Another World', 'But Seem to be Living in Comfort!']",TV,Light novel,12.0,Finished Airing,False,"{'from': '2019-10-03T00:00:00+00:00', 'to': '2019-12-19T00:00:00+00:00', 'prop': {'from': {'day': 3, 'month': 10, 'year': 2019}, 'to': {'day': 19, 'month': 12, 'year': 2019}}, 'string': 'Oct 3, 2019 to Dec 19, 2019'}",23 min per ep,PG-13 - Teens 13 or older,6.36,104313.0,6909.0,898,209905,424,"Seven Japanese high school students enjoy international renown for their remarkable talents. One day, these friends survive a plane crash only to find themselves in the medieval fantasy world of Freyjagard, where two human races live side by side in a feudal society: the byuma, who have animal features and formidable strength, and the hyuma, who have a small chance of magical aptitude. After being rescued by the byuma Winona and her adopted elven daughter Lyrule, the group pledges to use their advanced skills and knowledge to pay back the people of Elm Village for their hospitality and find a way to return back home. Tsukasa Mikogami, the prime minister of Japan, acts as the leader of these young geniuses and organizes their efforts to intervene in Freyjagard and gather the information and resources necessary for achieving their goals. Believing that there is a connection between their current situation and an ancient legend about seven heroes from another world who defeated an evil dragon, Tsukasa directs the others to learn about the culture around them and search for any clues leading them back to Earth. But he also gives another instruction: to take it nice and easy, lest they ruin this world by giving it their all. [Written by MAL Rewrite]",,fall,2019,"{'day': 'Thursdays', 'time': '21:00', 'timezone': 'Asia/Tokyo', 'string': 'Thursdays at 21:00 (JST)'}","[{'mal_id': 64, 'type': 'anime', 'name': 'Sotsu', 'url': 'https://myanimelist.net/anime/producer/64/Sotsu'}, {'mal_id': 135, 'type': 'anime', 'name': 'MediaNet', 'url': 'https://myanimelist.net/anime/producer/135/MediaNet'}, {'mal_id': 144, 'type': 'anime', 'name': 'Pony Canyon', 'url': 'https://myanimelist.net/anime/producer/144/Pony_Canyon'}, {'mal_id': 238, 'type': 'anime', 'name': 'AT-X', 'url': 'https://myanimelist.net/anime/producer/238/AT-X'}, {'mal_id': 460, 'type': 'anime', 'name': 'KlockWorx', 'url': 'https://myanimelist.net/anime/producer/460/KlockWorx'}, {'mal_id': 843, 'type': 'anime', 'name': 'BS Fuji', 'url': 'https://myanimelist.net/anime/producer/843/BS_Fuji'}, {'mal_id': 1211, 'type': 'anime', 'name': 'Tokyo MX', 'url': 'https://myanimelist.net/anime/producer/1211/Tokyo_MX'}, {'mal_id': 1869, 'type': 'anime', 'name': 'Bit Promotion', 'url': 'https://myanimelist.net/anime/producer/1869/Bit_Promotion'}, {'mal_id': 1933, 'type': 'anime', 'name': 'Happinet', 'url': 'https://myanimelist.net/anime/producer/1933/Happinet'}, {'mal_id': 2090, 'type': 'anime', 'name': 'Dream Shift', 'url': 'https://myanimelist.net/anime/producer/2090/Dream_Shift'}, {'mal_id': 2117, 'type': 'anime', 'name': 'SB Creative', 'url': 'https://myanimelist.net/anime/producer/2117/SB_Creative'}]",[],"[{'mal_id': 439, 'type': 'anime', 'name': 'Project No.9', 'url': 'https://myanimelist.net/anime/producer/439/Project_No9'}]","[{'mal_id': 10, 'type': 'anime', 'name': 'Fantasy', 'url': 'https://myanimelist.net/anime/genre/10/Fantasy'}]",[],[],[]
39468,https://myanimelist.net/anime/39468/Honzuki_no_Gekokujou__Shisho_ni_Naru_Tame_ni_wa_Shudan_wo_Erandeiraremasen,"{'jpg': {'image_url': 'https://cdn.myanimelist.net/images/anime/1582/101697.jpg', 'small_image_url': 'https://cdn.myanimelist.net/images/anime/1582/101697t.jpg', 'large_image_url': 'https://cdn.myanimelist.net/images/anime/1582/101697l.jpg'}, 'webp': {'image_url': 'https://cdn.myanimelist.net/images/anime/1582/101697.webp', 'small_image_url': 'https://cdn.myanimelist.net/images/anime/1582/101697t.webp', 'large_image_url': 'https://cdn.myanimelist.net/images/anime/1582/101697l.webp'}}","{'youtube_id': 'KfPyxG-ZbFM', 'url': 'https://www.youtube.com/watch?v=KfPyxG-ZbFM', 'embed_url': 'https://www.youtube.com/embed/KfPyxG-ZbFM?enablejsapi=1&wmode=opaque&autoplay=1', 'images': {'image_url': 'https://img.youtube.com/vi/KfPyxG-ZbFM/default.jpg', 'small_image_url': 'https://img.youtube.com/vi/KfPyxG-ZbFM/sddefault.jpg', 'medium_image_url': 'https://img.youtube.com/vi/KfPyxG-ZbFM/mqdefault.jpg', 'large_image_url': 'https://img.youtube.com/vi/KfPyxG-ZbFM/hqdefault.jpg', 'maximum_image_url': 'https://img.youtube.com/vi/KfPyxG-ZbFM/maxresdefault.jpg'}}","""Honzuki no Gekokujou: Shisho ni Naru Tame ni wa Shudan wo Erandeiraremasen""",Ascendance of a Bookworm,本好きの下剋上 ～司書になるためには手段を選んでいられません～,[],TV,Light novel,14.0,Finished Airing,False,"{'from': '2019-10-03T00:00:00+00:00', 'to': '2019-12-26T00:00:00+00:00', 'prop': {'from': {'day': 3, 'month': 10, 'year': 2019}, 'to': {'day': 26, 'month': 12, 'year': 2019}}, 'string': 'Oct 3, 2019 to Dec 26, 2019'}",23 min per ep,PG-13 - Teens 13 or older,8.01,106231.0,547.0,904,208826,1788,"Urano Motosu loves books and has an endless desire to read literature, no matter the subject. She almost fulfills her dream job of becoming a librarian before her life is ended in an accident. As she draws her last breath, she wishes to be able to read more books in her next life. As if fate was listening to her prayer, she wakes up reincarnated as Myne—a frail five-year-old girl living in a medieval era. What immediately comes to her mind is her passion. She tries to find something to read, only to become frustrated by the lack of books at her disposal. Without the printing press, books have to be written and copied by hand, making them very expensive; as such, only a few nobles can afford them—but this won't stop Myne. She will prove that her will to read is unbreakable, and if there are no books around, she will make them herself! [Written by MAL Rewrite]",,fall,2019,"{'day': 'Thursdays', 'time': '00:30', 'timezone': 'Asia/Tokyo', 'string': 'Thursdays at 00:30 (JST)'}","[{'mal_id': 33, 'type': 'anime', 'name': 'WOWOW', 'url': 'https://myanimelist.net/anime/producer/33/WOWOW'}, {'mal_id': 79, 'type': 'anime', 'name': 'Genco', 'url': 'https://myanimelist.net/anime/producer/79/Genco'}, {'mal_id': 135, 'type': 'anime', 'name': 'MediaNet', 'url': 'https://myanimelist.net/anime/producer/135/MediaNet'}, {'mal_id': 460, 'type': 'anime', 'name': 'KlockWorx', 'url': 'https://myanimelist.net/anime/producer/460/KlockWorx'}, {'mal_id': 464, 'type': 'anime', 'name': 'flying DOG', 'url': 'https://myanimelist.net/anime/producer/464/flying_DOG'}, {'mal_id': 843, 'type': 'anime', 'name': 'BS Fuji', 'url': 'https://myanimelist.net/anime/producer/843/BS_Fuji'}, {'mal_id': 1492, 'type': 'anime', 'name': 'Yomiuri TV Enterprise', 'url': 'https://myanimelist.net/anime/producer/1492/Yomiuri_TV_Enterprise'}, {'mal_id': 1933, 'type': 'anime', 'name': 'Happinet', 'url': 'https://myanimelist.net/anime/producer/1933/Happinet'}, {'mal_id': 1987, 'type': 'anime', 'name': 'Tokyo Animator Gakuin', 'url': 'https://myanimelist.net/anime/producer/1987/Tokyo_Animator_Gakuin'}, {'mal_id': 1988, 'type': 'anime', 'name': 'TO Books', 'url': 'https://myanimelist.net/anime/producer/1988/TO_Books'}, {'mal_id': 1989, 'type': 'anime', 'name': 'JTB Next Creation', 'url': 'https://myanimelist.net/anime/producer/1989/JTB_Next_Creation'}]","[{'mal_id': 1468, 'type': 'anime', 'name': 'Crunchyroll', 'url': 'https://myanimelist.net/anime/producer/1468/Crunchyroll'}]","[{'mal_id': 30, 'type': 'anime', 'name': 'Ajia-Do', 'url': 'https://myanimelist.net/anime/producer/30/Ajia-Do'}]","[{'mal_id': 10, 'type': 'anime', 'name': 'Fantasy', 'url': 'https://myanimelist.net/anime/genre/10/Fantasy'}, {'mal_id': 36, 'type': 'anime', 'name': 'Slice of Life', 'url': 'https://myanimelist.net/anime/genre/36/Slice_of_Life'}]",[],[],[]
39539,https://myanimelist.net/anime/39539/No_Guns_Life,"{'jpg': {'image_url': 'https://cdn.myanimelist.net/images/anime/1531/102113.jpg', 'small_image_url': 'https://cdn.myanimelist.net/images/anime/1531/102113t.jpg', 'large_image_url': 'https://cdn.myanimelist.net/images/anime/1531/102113l.jpg'}, 'webp': {'image_url': 'https://cdn.myanimelist.net/images/anime/1531/102113.webp', 'small_image_url': 'https://cdn.myanimelist.net/images/anime/1531/102113t.webp', 'large_image_url': 'https://cdn.myanimelist.net/images/anime/1531/102113l.webp'}}","{'youtube_id': 'MCBjBrM1AOE', 'url': 'https://www.youtube.com/watch?v=MCBjBrM1AOE', 'embed_url': 'https://www.youtube.com/embed/MCBjBrM1AOE?enablejsapi=1&wmode=opaque&autoplay=1', 'images': {'image_url': 'https://img.youtube.com/vi/MCBjBrM1AOE/default.jpg', 'small_image_url': 'https://img.youtube.com/vi/MCBjBrM1AOE/sddefault.jpg', 'medium_image_url': 'https://img.youtube.com/vi/MCBjBrM1AOE/mqdefault.jpg', 'large_image_url': 'https://img.youtube.com/vi/MCBjBrM1AOE/hqdefault.jpg', 'maximum_image_url': 'https://img.youtube.com/vi/MCBjBrM1AOE/maxresdefault.jpg'}}","""No Guns Life""",No Guns Life,ノー・ガンズ・ライフ,[],TV,Manga,12.0,Finished Airing,False,"{'from': '2019-10-11T00:00:00+00:00', 'to': '2019-12-27T00:00:00+00:00', 'prop': {'from': {'day': 11, 'month': 10, 'year': 2019}, 'to': {'day': 27, 'month': 12, 'year': 2019}}, 'string': 'Oct 11, 2019 to Dec 27, 2019'}",24 min per ep,PG-13 - Teens 13 or older,6.86,60366.0,4377.0,1082,169384,246,"The technology to create powerful cyborg soldiers has been released for public use by the Berühren Corporation. Those outfitted with robotic parts are known as the Extended. Juuzou Inui, one such Extended, was created as a soldier and has no memories of his former life. But now, after the war, he runs a business that takes care of Extended-related incidents around the city. Rumors of a renegade Extended that kidnapped a child reach his ears; lo and behold, as Juuzo returns to his office, a giant robotic man with a boy on his back crashes in, asking for help. While Juuzou could just turn the guy in and be done with it, something about this situation is too fishy to ignore. It seems that everyone wants hold of this kid and, whether he likes it or not, Juuzou must find out why this Extended is on the run, how it connects to the Berühren Corporation, and just how far the treachery runs in this city. [Written by MAL Rewrite]",,fall,2019,"{'day': 'Fridays', 'time': '01:28', 'timezone': 'Asia/Tokyo', 'string': 'Fridays at 01:28 (JST)'}","[{'mal_id': 15, 'type': 'anime', 'name': 'Sony Pictures Entertainment', 'url': 'https://myanimelist.net/anime/producer/15/Sony_Pictures_Entertainment'}, {'mal_id': 145, 'type': 'anime', 'name': 'TBS', 'url': 'https://myanimelist.net/anime/producer/145/TBS'}, {'mal_id': 238, 'type': 'anime', 'name': 'AT-X', 'url': 'https://myanimelist.net/anime/producer/238/AT-X'}, {'mal_id': 1333, 'type': 'anime', 'name': 'Hakuhodo DY Music & Pictures', 'url': 'https://myanimelist.net/anime/producer/1333/Hakuhodo_DY_Music___Pictures'}, {'mal_id': 1416, 'type': 'anime', 'name': 'BS11', 'url': 'https://myanimelist.net/anime/producer/1416/BS11'}, {'mal_id': 1444, 'type': 'anime', 'name': 'Egg Firm', 'url': 'https://myanimelist.net/anime/producer/1444/Egg_Firm'}, {'mal_id': 1899, 'type': 'anime', 'name': 'Good Smile Film', 'url': 'https://myanimelist.net/anime/producer/1899/Good_Smile_Film'}]","[{'mal_id': 102, 'type': 'anime', 'name': 'Funimation', 'url': 'https://myanimelist.net/anime/producer/102/Funimation'}]","[{'mal_id': 11, 'type': 'anime', 'name': 'Madhouse', 'url': 'https://myanimelist.net/anime/producer/11/Madhouse'}]","[{'mal_id': 1, 'type': 'anime', 'name': 'Action', 'url': 'https://myanimelist.net/anime/genre/1/Action'}, {'mal_id': 8, 'type': 'anime', 'name': 'Drama', 'url': 'https://myanimelist.net/anime/genre/8/Drama'}, {'mal_id': 24, 'type': 'anime', 'name': 'Sci-Fi', 'url': 'https://myanimelist.net/anime/genre/24/Sci-Fi'}]",[],[],"[{'mal_id': 42, 'type': 'anime', 'name': 'Seinen', 'url': 'https://myanimelist.net/anime/genre/42/Seinen'}]"
37403,https://myanimelist.net/anime/37403/Ahiru_no_Sora,"{'jpg': {'image_url': 'https://cdn.myanimelist.net/images/anime/1975/108030.jpg', 'small_image_url': 'https://cdn.myanimelist.net/images/anime/1975/108030t.jpg', 'large_image_url': 'https://cdn.myanimelist.net/images/anime/1975/108030l.jpg'}, 'webp': {'image_url': 'https://cdn.myanimelist.net/images/anime/1975/108030.webp', 'small_image_url': 'https://cdn.myanimelist.net/images/anime/1975/108030t.webp', 'large_image_url': 'https://cdn.myanimelist.net/images/anime/1975/108030l.webp'}}","{'youtube_id': 'Yt4N0UUEd90', 'url': 'https://www.youtube.com/watch?v=Yt4N0UUEd90', 'embed_url': 'https://www.youtube.com/embed/Yt4N0UUEd90?enablejsapi=1&wmode=opaque&autoplay=1', 'images': {'image_url': 'https://img.youtube.com/vi/Yt4N0UUEd90/default.jpg', 'small_image_url': 'https://img.youtube.com/vi/Yt4N0UUEd90/sddefault.jpg', 'medium_image_url': 'https://img.youtube.com/vi/Yt4N0UUEd90/mqdefault.jpg', 'large_image_url': 'https://img.youtube.com/vi/Yt4N0UUEd90/hqdefault.jpg', 'maximum_image_url': 'https://img.youtube.com/vi/Yt4N0UUEd90/maxresdefault.jpg'}}","""Ahiru no Sora""",,あひるの空,[],TV,Manga,50.0,Finished Airing,False,"{'from': '2019-10-02T00:00:00+00:00', 'to': '2020-09-30T00:00:00+00:00', 'prop': {'from': {'day': 2, 'month': 10, 'year': 2019}, 'to': {'day': 30, 'month': 9, 'year': 2020}}, 'string': 'Oct 2, 2019 to Sep 30, 2020'}",24 min per ep,PG-13 - Teens 13 or older,7.29,61987.0,2446.0,1101,167350,705,"Lacking what is considered the most important asset in basketball, Sora Kurumatani has struggled with his short height since the inception of his love for the game. Despite missing this beneficial aspect, Sora's unwavering drive never allowed his small stature to dictate his ability to play, believing strongly in trying his hardest and persistently practicing to prove his capability. In hopes of satisfying his mother's wishes, Sora enters Kuzuryuu High School to become a member of the basketball club and compete wholeheartedly in tournaments. However, Sora is disappointed to find out that the boy's basketball team is nothing but a retreat for punks who have no interest in the sport. Sora also comes to learn that brothers Chiaki and Momoharu Hanazono—whom he becomes acquainted with—have also lost their once spirited motivation to play. Determined to revive the basketball team, Sora challenges the boys to a match against him, where his quick feet and swift movements overwhelm the group. Gradually affected by Sora's impressive skills, sheer effort, and tireless devotion to basketball, the boys unexpectedly find their burnt-out passion for the game rekindling once again. [Written by MAL Rewrite]","The airing time was Wednesdays 18:25 between October 2, 2019 - March 25, 2020. The airing time is changed to 17:55 beginning April 1, 2020.",fall,2019,"{'day': 'Wednesdays', 'time': '17:55', 'timezone': 'Asia/Tokyo', 'string': 'Wednesdays at 17:55 (JST)'}","[{'mal_id': 16, 'type': 'anime', 'name': 'TV Tokyo', 'url': 'https://myanimelist.net/anime/producer/16/TV_Tokyo'}, {'mal_id': 159, 'type': 'anime', 'name': 'Kodansha', 'url': 'https://myanimelist.net/anime/producer/159/Kodansha'}, {'mal_id': 238, 'type': 'anime', 'name': 'AT-X', 'url': 'https://myanimelist.net/anime/producer/238/AT-X'}, {'mal_id': 1344, 'type': 'anime', 'name': 'King Records', 'url': 'https://myanimelist.net/anime/producer/1344/King_Records'}, {'mal_id': 1671, 'type': 'anime', 'name': 'DMM pictures', 'url': 'https://myanimelist.net/anime/producer/1671/DMM_pictures'}]","[{'mal_id': 376, 'type': 'anime', 'name': 'Sentai Filmworks', 'url': 'https://myanimelist.net/anime/producer/376/Sentai_Filmworks'}]","[{'mal_id': 51, 'type': 'anime', 'name': 'Diomedéa', 'url': 'https://myanimelist.net/anime/producer/51/Diomed%C3%A9a'}]","[{'mal_id': 4, 'type': 'anime', 'name': 'Comedy', 'url': 'https://myanimelist.net/anime/genre/4/Comedy'}, {'mal_id': 8, 'type': 'anime', 'name': 'Drama', 'url': 'https://myanimelist.net/anime/genre/8/Drama'}, {'mal_id': 30, 'type': 'anime', 'name': 'Sports', 'url': 'https://myanimelist.net/anime/genre/30/Sports'}]",[],"[{'mal_id': 23, 'type': 'anime', 'name': 'School', 'url': 'https://myanimelist.net/anime/genre/23/School'}]","[{'mal_id': 27, 'type': 'anime', 'name': 'Shounen', 'url': 'https://myanimelist.net/anime/genre/27/Shounen'}]"
39030,https://myanimelist.net/anime/39030/Hataage_Kemono_Michi,"{'jpg': {'image_url': 'https://cdn.myanimelist.net/images/anime/1736/103512.jpg', 'small_image_url': 'https://cdn.myanimelist.net/images/anime/1736/103512t.jpg', 'large_image_url': 'https://cdn.myanimelist.net/images/anime/1736/103512l.jpg'}, 'webp': {'image_url': 'https://cdn.myanimelist.net/images/anime/1736/103512.webp', 'small_image_url': 'https://cdn.myanimelist.net/images/anime/1736/103512t.webp', 'large_image_url': 'https://cdn.myanimelist.net/images/anime/1736/103512l.webp'}}","{'youtube_id': 'Qv99fLExcVs', 'url': 'https://www.youtube.com/watch?v=Qv99fLExcVs', 'embed_url': 'https://www.youtube.com/embed/Qv99fLExcVs?enablejsapi=1&wmode=opaque&autoplay=1', 'images': {'image_url': 'https://img.youtube.com/vi/Qv99fLExcVs/default.jpg', 'small_image_url': 'https://img.youtube.com/vi/Qv99fLExcVs/sddefault.jpg', 'medium_image_url': 'https://img.youtube.com/vi/Qv99fLExcVs/mqdefault.jpg', 'large_image_url': 'https://img.youtube.com/vi/Qv99fLExcVs/hqdefault.jpg', 'maximum_image_url': 'https://img.youtube.com/vi/Qv99fLExcVs/maxresdefault.jpg'}}","""Hataage! Kemono Michi""",Kemono Michi: Rise Up,旗揚! けものみち,[],TV,Manga,12.0,Finished Airing,False,"{'from': '2019-10-02T00:00:00+00:00', 'to': '2019-12-18T00:00:00+00:00', 'prop': {'from': {'day': 2, 'month': 10, 'year': 2019}, 'to': {'day': 18, 'month': 12, 'year': 2019}}, 'string': 'Oct 2, 2019 to Dec 18, 2019'}",23 min per ep,PG-13 - Teens 13 or older,6.63,77115.0,5481.0,1102,167117,216,"Professional wrestler Genzou Shibata sports the body of a mountain, but beneath his hulking appearance is a man with an extreme affection for animals. Facing off his opponents in the ring as the legendary ""Animal Mask,"" Genzou wins the hearts of crowds everywhere with his iconic tiger persona. During the bout for the title of World Champion against his greatest rival, the Macadamian Ogre, Genzou is suddenly summoned to a fantasy world by a princess. With her kingdom being threatened by a monster infestation, she pleads the wrestler for assistance—to which he answers by knocking her out with a German suplex! Escaping the castle and finding himself stranded in a mysterious land, Genzou decides to begin his career as a beast hunter to capture and befriend creatures far and wide. Joined by the wolf-girl Shigure, the dragon-girl Hanako, and the vampire Carmilla Vanstein, the professional wrestler pursues all kinds of dangerous requests for the sake of fulfilling his dream as a pet shop owner. [Written by MAL Rewrite]",,fall,2019,"{'day': 'Wednesdays', 'time': '22:00', 'timezone': 'Asia/Tokyo', 'string': 'Wednesdays at 22:00 (JST)'}","[{'mal_id': 238, 'type': 'anime', 'name': 'AT-X', 'url': 'https://myanimelist.net/anime/producer/238/AT-X'}, {'mal_id': 323, 'type': 'anime', 'name': 'Nippon Columbia', 'url': 'https://myanimelist.net/anime/producer/323/Nippon_Columbia'}, {'mal_id': 1345, 'type': 'anime', 'name': 'Sammy', 'url': 'https://myanimelist.net/anime/producer/1345/Sammy'}, {'mal_id': 1551, 'type': 'anime', 'name': 'Kadokawa Media House', 'url': 'https://myanimelist.net/anime/producer/1551/Kadokawa_Media_House'}, {'mal_id': 1696, 'type': 'anime', 'name': 'Kadokawa', 'url': 'https://myanimelist.net/anime/producer/1696/Kadokawa'}, {'mal_id': 1901, 'type': 'anime', 'name': 'CA-Cygames Anime Fund', 'url': 'https://myanimelist.net/anime/producer/1901/CA-Cygames_Anime_Fund'}]","[{'mal_id': 102, 'type': 'anime', 'name': 'Funimation', 'url': 'https://myanimelist.net/anime/producer/102/Funimation'}]","[{'mal_id': 1974, 'type': 'anime', 'name': 'ENGI', 'url': 'https://myanimelist.net/anime/producer/1974/ENGI'}]","[{'mal_id': 4, 'type': 'anime', 'name': 'Comedy', 'url': 'https://myanimelist.net/anime/genre/4/Comedy'}, {'mal_id': 10, 'type': 'anime', 'name': 'Fantasy', 'url': 'https://myanimelist.net/anime/genre/10/Fantasy'}]",[],[],"[{'mal_id': 27, 'type': 'anime', 'name': 'Shounen', 'url': 'https://myanimelist.net/anime/genre/27/Shounen'}]"
