mal_id,url,images,trailer,title,title_english,title_japanese,title_synonyms,type,source,episodes,status,airing,aired,duration,rating,score,scored_by,rank,popularity,members,favorites,synopsis,background,season,year,broadcast,producers,licensors,studios,genres,explicit_genres,themes,demographics
42205,https://myanimelist.net/anime/42205/Shaman_King_2021,"{'jpg': {'image_url': 'https://cdn.myanimelist.net/images/anime/1416/113270.jpg', 'small_image_url': 'https://cdn.myanimelist.net/images/anime/1416/113270t.jpg', 'large_image_url': 'https://cdn.myanimelist.net/images/anime/1416/113270l.jpg'}, 'webp': {'image_url': 'https://cdn.myanimelist.net/images/anime/1416/113270.webp', 'small_image_url': 'https://cdn.myanimelist.net/images/anime/1416/113270t.webp', 'large_image_url': 'https://cdn.myanimelist.net/images/anime/1416/113270l.webp'}}","{'youtube_id': 'rV8RZrZskdk', 'url': 'https://www.youtube.com/watch?v=rV8RZrZskdk', 'embed_url': 'https://www.youtube.com/embed/rV8RZrZskdk?enablejsapi=1&wmode=opaque&autoplay=1', 'images': {'image_url': 'https://img.youtube.com/vi/rV8RZrZskdk/default.jpg', 'small_image_url': 'https://img.youtube.com/vi/rV8RZrZskdk/sddefault.jpg', 'medium_image_url': 'https://img.youtube.com/vi/rV8RZrZskdk/mqdefault.jpg', 'large_image_url': 'https://img.youtube.com/vi/rV8RZrZskdk/hqdefault.jpg', 'maximum_image_url': 'https://img.youtube.com/vi/rV8RZrZskdk/maxresdefault.jpg'}}","""Shaman King (2021)""",,SHAMAN KING,[],TV,Manga,52.0,Currently Airing,True,"{'from': '2021-04-01T00:00:00+00:00', 'to': None, 'prop': {'from': {'day': 1, 'month': 4, 'year': 2021}, 'to': {'day': None, 'month': None, 'year': None}}, 'string': 'Apr 1, 2021 to ?'}",23 min per ep,PG-13 - Teens 13 or older,6.66,38422.0,5331.0,896,210186,1381,"Shamans are extraordinary individuals with the ability to communicate with ghosts, spirits, and gods, which are invisible to ordinary people. The Shaman Fight—a prestigious tournament pitting shamans from all over the world against each other—is held every five hundred years, where the winner is crowned Shaman King. This title allows the current incumbent to call upon the Great Spirit and shape the world as they see fit. Finding himself late for class one night, Manta Oyamada, an ordinary middle school student, decides to take a shortcut through the local cemetery. Noticing him, a lone boy sitting on a gravestone invites Manta to stargaze with ""them."" Realizing that ""them"" refers to the boy and his ghostly friends, Manta flees the terror. Later, the boy introduces himself as You Asakura, a Shaman-in-training, and demonstrates his powers by teaming up with the ghost of six-hundred-year-old samurai Amidamaru to save Manta from a group of thugs. You befriends Manta due to his ability to see spirits, and with the help of Amidamaru, they set out to accomplish You's goal of becoming the next Shaman King. [Written by MAL Rewrite]",,spring,2021,"{'day': 'Thursdays', 'time': '17:55', 'timezone': 'Asia/Tokyo', 'string': 'Thursdays at 17:55 (JST)'}","[{'mal_id': 16, 'type': 'anime', 'name': 'TV Tokyo', 'url': 'https://myanimelist.net/anime/producer/16/TV_Tokyo'}, {'mal_id': 1344, 'type': 'anime', 'name': 'King Records', 'url': 'https://myanimelist.net/anime/producer/1344/King_Records'}, {'mal_id': 1499, 'type': 'anime', 'name': 'Techno Sound', 'url': 'https://myanimelist.net/anime/producer/1499/Techno_Sound'}]",[],"[{'mal_id': 397, 'type': 'anime', 'name': 'Bridge', 'url': 'https://myanimelist.net/anime/producer/397/Bridge'}]","[{'mal_id': 2, 'type': 'anime', 'name': 'Adventure', 'url': 'https://myanimelist.net/anime/genre/2/Adventure'}, {'mal_id': 4, 'type': 'anime', 'name': 'Comedy', 'url': 'https://myanimelist.net/anime/genre/4/Comedy'}, {'mal_id': 37, 'type': 'anime', 'name': 'Supernatural', 'url': 'https://myanimelist.net/anime/genre/37/Supernatural'}]",[],"[{'mal_id': 31, 'type': 'anime', 'name': 'Super Power', 'url': 'https://myanimelist.net/anime/genre/31/Super_Power'}]","[{'mal_id': 27, 'type': 'anime', 'name': 'Shounen', 'url': 'https://myanimelist.net/anime/genre/27/Shounen'}]"
43007,https://myanimelist.net/anime/43007/Osananajimi_ga_Zettai_ni_Makenai_Love_Comedy,"{'jpg': {'image_url': 'https://cdn.myanimelist.net/images/anime/1111/113327.jpg', 'small_image_url': 'https://cdn.myanimelist.net/images/anime/1111/113327t.jpg', 'large_image_url': 'https://cdn.myanimelist.net/images/anime/1111/113327l.jpg'}, 'webp': {'image_url': 'https://cdn.myanimelist.net/images/anime/1111/113327.webp', 'small_image_url': 'https://cdn.myanimelist.net/images/anime/1111/113327t.webp', 'large_image_url': 'https://cdn.myanimelist.net/images/anime/1111/113327l.webp'}}","{'youtube_id': 'U330AyuQIOY', 'url': 'https://www.youtube.com/watch?v=U330AyuQIOY', 'embed_url': 'https://www.youtube.com/embed/U330AyuQIOY?enablejsapi=1&wmode=opaque&autoplay=1', 'images': {'image_url': 'https://img.youtube.com/vi/U330AyuQIOY/default.jpg', 'small_image_url': 'https://img.youtube.com/vi/U330AyuQIOY/sddefault.jpg', 'medium_image_url': 'https://img.youtube.com/vi/U330AyuQIOY/mqdefault.jpg', 'large_image_url': 'https://img.youtube.com/vi/U330AyuQIOY/hqdefault.jpg', 'maximum_image_url': 'https://img.youtube.com/vi/U330AyuQIOY/maxresdefault.jpg'}}","""Osananajimi ga Zettai ni Makenai Love Comedy""",Osamake: Romcom Where The Childhood Friend Won't Lose,幼なじみが絶対に負けないラブコメ,"[""The Romcom Where The Childhood Friend Won't Lose!"", 'Osamake']",TV,Light novel,12.0,Finished Airing,False,"{'from': '2021-04-14T00:00:00+00:00', 'to': '2021-06-30T00:00:00+00:00', 'prop': {'from': {'day': 14, 'month': 4, 'year': 2021}, 'to': {'day': 30, 'month': 6, 'year': 2021}}, 'string': 'Apr 14, 2021 to Jun 30, 2021'}",23 min per ep,PG-13 - Teens 13 or older,6.09,78440.0,8238.0,938,208666,1641,"Suehara Maru is childhood best friends with one of Hozumino High School's most popular girls, Kuroha Shida. Cute, outgoing, and affectionate, Kuroha is the perfect older sister type. She has boys constantly begging at her feet to be with her. Yet, when she confesses to Suehara one day, he immediately rejects her; he just can't think of her in that way! Besides, he already has his sights set on his first love—school idol and renowned author Shirokusa Kachi. Suehara believes that he has a chance with Kachi after one fateful meeting, but soon, he finds out that Kachi has a boyfriend! With his dreams now shattered, Suehara agonizes over what could have been. That is, until Kuroha approaches him with a proposal: ""let's get revenge."" [Written by MAL Rewrite]",,spring,2021,"{'day': 'Wednesdays', 'time': '21:00', 'timezone': 'Asia/Tokyo', 'string': 'Wednesdays at 21:00 (JST)'}","[{'mal_id': 711, 'type': 'anime', 'name': 'Delfi Sound', 'url': 'https://myanimelist.net/anime/producer/711/Delfi_Sound'}, {'mal_id': 1696, 'type': 'anime', 'name': 'Kadokawa', 'url': 'https://myanimelist.net/anime/producer/1696/Kadokawa'}]",[],"[{'mal_id': 95, 'type': 'anime', 'name': 'Doga Kobo', 'url': 'https://myanimelist.net/anime/producer/95/Doga_Kobo'}]","[{'mal_id': 4, 'type': 'anime', 'name': 'Comedy', 'url': 'https://myanimelist.net/anime/genre/4/Comedy'}, {'mal_id': 22, 'type': 'anime', 'name': 'Romance', 'url': 'https://myanimelist.net/anime/genre/22/Romance'}]",[],"[{'mal_id': 35, 'type': 'anime', 'name': 'Harem', 'url': 'https://myanimelist.net/anime/genre/35/Harem'}, {'mal_id': 23, 'type': 'anime', 'name': 'School', 'url': 'https://myanimelist.net/anime/genre/23/School'}]",[]
41402,https://myanimelist.net/anime/41402/Mairimashita_Iruma-kun_2nd_Season,"{'jpg': {'image_url': 'https://cdn.myanimelist.net/images/anime/1527/113656.jpg', 'small_image_url': 'https://cdn.myanimelist.net/images/anime/1527/113656t.jpg', 'large_image_url': 'https://cdn.myanimelist.net/images/anime/1527/113656l.jpg'}, 'webp': {'image_url': 'https://cdn.myanimelist.net/images/anime/1527/113656.webp', 'small_image_url': 'https://cdn.myanimelist.net/images/anime/1527/113656t.webp', 'large_image_url': 'https://cdn.myanimelist.net/images/anime/1527/113656l.webp'}}","{'youtube_id': 'NxqfMRZfVTA', 'url': 'https://www.youtube.com/watch?v=NxqfMRZfVTA', 'embed_url': 'https://www.youtube.com/embed/NxqfMRZfVTA?enablejsapi=1&wmode=opaque&autoplay=1', 'images': {'image_url': 'https://img.youtube.com/vi/NxqfMRZfVTA/default.jpg', 'small_image_url': 'https://img.youtube.com/vi/NxqfMRZfVTA/sddefault.jpg', 'medium_image_url': 'https://img.youtube.com/vi/NxqfMRZfVTA/mqdefault.jpg', 'large_image_url': 'https://img.youtube.com/vi/NxqfMRZfVTA/hqdefault.jpg', 'maximum_image_url': 'https://img.youtube.com/vi/NxqfMRZfVTA/maxresdefault.jpg'}}","""Mairimashita! Iruma-kun 2nd Season""",,魔入りました！入間くん,['Welcome to Demon School! Iruma-kun 2nd Season'],TV,Manga,21.0,Finished Airing,False,"{'from': '2021-04-17T00:00:00+00:00', 'to': '2021-09-11T00:00:00+00:00', 'prop': {'from': {'day': 17, 'month': 4, 'year': 2021}, 'to': {'day': 11, 'month': 9, 'year': 2021}}, 'string': 'Apr 17, 2021 to Sep 11, 2021'}",24 min per ep,PG-13 - Teens 13 or older,8.09,75584.0,452.0,977,202667,1921,"After many trials and tribulations, Iruma Suzuki is finally happily living among demons despite having to hide his true identity as a human. Even more so, he has now found his ambition in life: keep ranking up in this world! However, that plan is halted when Iruma's club is temporarily dismissed, and he is forced to be part of the student council, known for its strictness toward rowdy students. Its cold-hearted president is Amelie Azazel, Iruma's friend. Although Iruma is not used to following their rigid schedule and many rules, he still wants to prove himself and help Amelie alongside all of the other members of the council. But trouble arises when Amelie's personality completely changes due to strange circumstances, putting the student council's reputation in jeopardy. Will Iruma be able to save them and avoid having the whole school turn into pure chaos? [Written by MAL Rewrite]",,spring,2021,"{'day': 'Saturdays', 'time': '17:35', 'timezone': 'Asia/Tokyo', 'string': 'Saturdays at 17:35 (JST)'}","[{'mal_id': 111, 'type': 'anime', 'name': 'NHK', 'url': 'https://myanimelist.net/anime/producer/111/NHK'}, {'mal_id': 1797, 'type': 'anime', 'name': 'NHK Enterprises', 'url': 'https://myanimelist.net/anime/producer/1797/NHK_Enterprises'}]",[],"[{'mal_id': 1258, 'type': 'anime', 'name': 'Bandai Namco Pictures', 'url': 'https://myanimelist.net/anime/producer/1258/Bandai_Namco_Pictures'}]","[{'mal_id': 4, 'type': 'anime', 'name': 'Comedy', 'url': 'https://myanimelist.net/anime/genre/4/Comedy'}, {'mal_id': 10, 'type': 'anime', 'name': 'Fantasy', 'url': 'https://myanimelist.net/anime/genre/10/Fantasy'}, {'mal_id': 37, 'type': 'anime', 'name': 'Supernatural', 'url': 'https://myanimelist.net/anime/genre/37/Supernatural'}]",[],"[{'mal_id': 6, 'type': 'anime', 'name': 'Demons', 'url': 'https://myanimelist.net/anime/genre/6/Demons'}, {'mal_id': 23, 'type': 'anime', 'name': 'School', 'url': 'https://myanimelist.net/anime/genre/23/School'}]","[{'mal_id': 27, 'type': 'anime', 'name': 'Shounen', 'url': 'https://myanimelist.net/anime/genre/27/Shounen'}]"
41103,https://myanimelist.net/anime/41103/Koi_to_Yobu_ni_wa_Kimochi_Warui,"{'jpg': {'image_url': 'https://cdn.myanimelist.net/images/anime/1519/110527.jpg', 'small_image_url': 'https://cdn.myanimelist.net/images/anime/1519/110527t.jpg', 'large_image_url': 'https://cdn.myanimelist.net/images/anime/1519/110527l.jpg'}, 'webp': {'image_url': 'https://cdn.myanimelist.net/images/anime/1519/110527.webp', 'small_image_url': 'https://cdn.myanimelist.net/images/anime/1519/110527t.webp', 'large_image_url': 'https://cdn.myanimelist.net/images/anime/1519/110527l.webp'}}","{'youtube_id': 'hqPv_THxIPU', 'url': 'https://www.youtube.com/watch?v=hqPv_THxIPU', 'embed_url': 'https://www.youtube.com/embed/hqPv_THxIPU?enablejsapi=1&wmode=opaque&autoplay=1', 'images': {'image_url': 'https://img.youtube.com/vi/hqPv_THxIPU/default.jpg', 'small_image_url': 'https://img.youtube.com/vi/hqPv_THxIPU/sddefault.jpg', 'medium_image_url': 'https://img.youtube.com/vi/hqPv_THxIPU/mqdefault.jpg', 'large_image_url': 'https://img.youtube.com/vi/hqPv_THxIPU/hqdefault.jpg', 'maximum_image_url': 'https://img.youtube.com/vi/hqPv_THxIPU/maxresdefault.jpg'}}","""Koi to Yobu ni wa Kimochi Warui""",Koikimo,恋と呼ぶには気持ち悪い,"[""It's Too Sick to Call this Love""]",TV,Web manga,12.0,Finished Airing,False,"{'from': '2021-04-05T00:00:00+00:00', 'to': '2021-06-14T00:00:00+00:00', 'prop': {'from': {'day': 5, 'month': 4, 'year': 2021}, 'to': {'day': 14, 'month': 6, 'year': 2021}}, 'string': 'Apr 5, 2021 to Jun 14, 2021'}",23 min per ep,PG-13 - Teens 13 or older,7.17,74173.0,3040.0,1030,185800,1513,"People fall in love in the most mysterious of ways. This statement seems to be especially true for the affluent genius playboy Ryou Amakusa. When he nearly falls off the stairs one rainy morning, a girl named Ichika Arima saves him. As if by fate, Ryou encounters Ichika again later that night; she happens to be the best friend of his little sister, Rio. Wanting to ""thank"" her, Ryou attempts to woo Ichika by employing his usual flirtatious tactics only to be immediately shot down, his target creeped out by his behavior. Rather than being discouraged, Ryou instead becomes more enthralled by her, and he begins to do everything he can to steal Ichika's heart despite receiving disgusted reactions each time. However, as time passes by, will Ichika remain repulsed by Ryou's creepy yet dedicated advances? [Written by MAL Rewrite]",,spring,2021,"{'day': 'Mondays', 'time': '22:00', 'timezone': 'Asia/Tokyo', 'string': 'Mondays at 22:00 (JST)'}","[{'mal_id': 843, 'type': 'anime', 'name': 'BS Fuji', 'url': 'https://myanimelist.net/anime/producer/843/BS_Fuji'}, {'mal_id': 1221, 'type': 'anime', 'name': 'Hokkaido Cultural Broadcasting', 'url': 'https://myanimelist.net/anime/producer/1221/Hokkaido_Cultural_Broadcasting'}, {'mal_id': 1401, 'type': 'anime', 'name': 'Amusement Media Academy', 'url': 'https://myanimelist.net/anime/producer/1401/Amusement_Media_Academy'}, {'mal_id': 1582, 'type': 'anime', 'name': 'Ichijinsha', 'url': 'https://myanimelist.net/anime/producer/1582/Ichijinsha'}, {'mal_id': 1677, 'type': 'anime', 'name': 'Kanetsu Investment', 'url': 'https://myanimelist.net/anime/producer/1677/Kanetsu_Investment'}, {'mal_id': 1858, 'type': 'anime', 'name': 'Sonilude', 'url': 'https://myanimelist.net/anime/producer/1858/Sonilude'}, {'mal_id': 1985, 'type': 'anime', 'name': 'Toyo Recording', 'url': 'https://myanimelist.net/anime/producer/1985/Toyo_Recording'}, {'mal_id': 2144, 'type': 'anime', 'name': 'BloomZ', 'url': 'https://myanimelist.net/anime/producer/2144/BloomZ'}, {'mal_id': 2221, 'type': 'anime', 'name': 'AMG Entertainment', 'url': 'https://myanimelist.net/anime/producer/2221/AMG_Entertainment'}, {'mal_id': 2222, 'type': 'anime', 'name': 'MediaNet Pictures', 'url': 'https://myanimelist.net/anime/producer/2222/MediaNet_Pictures'}, {'mal_id': 2223, 'type': 'anime', 'name': 'Christmas Holly', 'url': 'https://myanimelist.net/anime/producer/2223/Christmas_Holly'}, {'mal_id': 2224, 'type': 'anime', 'name': 'Miyazaki Broadcasting', 'url': 'https://myanimelist.net/anime/producer/2224/Miyazaki_Broadcasting'}, {'mal_id': 2225, 'type': 'anime', 'name': 'C-one', 'url': 'https://myanimelist.net/anime/producer/2225/C-one'}]",[],"[{'mal_id': 70, 'type': 'anime', 'name': 'Nomad', 'url': 'https://myanimelist.net/anime/producer/70/Nomad'}]","[{'mal_id': 4, 'type': 'anime', 'name': 'Comedy', 'url': 'https://myanimelist.net/anime/genre/4/Comedy'}, {'mal_id': 22, 'type': 'anime', 'name': 'Romance', 'url': 'https://myanimelist.net/anime/genre/22/Romance'}]",[],[],[]
44276,https://myanimelist.net/anime/44276/Kyuukyoku_Shinka_shita_Full_Dive_RPG_ga_Genjitsu_yori_mo_Kusoge_Dattara,"{'jpg': {'image_url': 'https://cdn.myanimelist.net/images/anime/1357/113277.jpg', 'small_image_url': 'https://cdn.myanimelist.net/images/anime/1357/113277t.jpg', 'large_image_url': 'https://cdn.myanimelist.net/images/anime/1357/113277l.jpg'}, 'webp': {'image_url': 'https://cdn.myanimelist.net/images/anime/1357/113277.webp', 'small_image_url': 'https://cdn.myanimelist.net/images/anime/1357/113277t.webp', 'large_image_url': 'https://cdn.myanimelist.net/images/anime/1357/113277l.webp'}}","{'youtube_id': '6TDRXYZ_K_c', 'url': 'https://www.youtube.com/watch?v=6TDRXYZ_K_c', 'embed_url': 'https://www.youtube.com/embed/6TDRXYZ_K_c?enablejsapi=1&wmode=opaque&autoplay=1', 'images': {'image_url': 'https://img.youtube.com/vi/6TDRXYZ_K_c/default.jpg', 'small_image_url': 'https://img.youtube.com/vi/6TDRXYZ_K_c/sddefault.jpg', 'medium_image_url': 'https://img.youtube.com/vi/6TDRXYZ_K_c/mqdefault.jpg', 'large_image_url': 'https://img.youtube.com/vi/6TDRXYZ_K_c/hqdefault.jpg', 'maximum_image_url': 'https://img.youtube.com/vi/6TDRXYZ_K_c/maxresdefault.jpg'}}","""Kyuukyoku Shinka shita Full Dive RPG ga Genjitsu yori mo Kusoge Dattara""",Full Dive: The Ultimate Next-Gen Full Dive RPG Is Even Shittier than Real Life!,究極進化したフルダイブRPGが現実よりもクソゲーだったら,['What If the Ultimately Evolved Full Dive RPG was a Crappier Game than Reality'],TV,Light novel,12.0,Finished Airing,False,"{'from': '2021-04-07T00:00:00+00:00', 'to': '2021-06-23T00:00:00+00:00', 'prop': {'from': {'day': 7, 'month': 4, 'year': 2021}, 'to': {'day': 23, 'month': 6, 'year': 2021}}, 'string': 'Apr 7, 2021 to Jun 23, 2021'}",23 min per ep,PG-13 - Teens 13 or older,6.5,72789.0,6209.0,1070,180308,933,"Ten years ago, at the peak of the VRMMO development industry, a game titled ""Kiwame Quest"" entered the scene with potential like no other. Boasting a colossal total of 10 sexdecillion branches of possible story scenarios, this game pursued ultimate realism, ranging from humanlike NPCs to the perfect replication of all senses and physical abilities. But it soon became apparent that the game was too realistic, and the popularity of VRMMOs in general gradually began to plunge. At present, due to an accident a few years prior, the high school student Hiroshi Yuuki now immerses himself in full-dive RPGs as a form of escapism. After failing to acquire the latest version of his favorite game, Hiroshi stumbles upon a game shop and meets its beautiful clerk Reona Kisaragi who convinces him to buy a copy of Kiwame Quest so that they can play together. The first time Hiroshi plays the game, he marvels at the realism it offers. However, his astonishment is short-lived as he sets off a series of misfortunes, quickly realizing that the game is even worse than his already stressful life. Nevertheless, Hiroshi still finds himself logging on again despite his growing contempt for the game. With no do-overs in his current disadvantageous situation, Hiroshi only has one goal—clearing the game! [Written by MAL Rewrite]",,spring,2021,"{'day': 'Wednesdays', 'time': '22:30', 'timezone': 'Asia/Tokyo', 'string': 'Wednesdays at 22:30 (JST)'}","[{'mal_id': 1696, 'type': 'anime', 'name': 'Kadokawa', 'url': 'https://myanimelist.net/anime/producer/1696/Kadokawa'}, {'mal_id': 2074, 'type': 'anime', 'name': 'Bit grooove promotion', 'url': 'https://myanimelist.net/anime/producer/2074/Bit_grooove_promotion'}]","[{'mal_id': 102, 'type': 'anime', 'name': 'Funimation', 'url': 'https://myanimelist.net/anime/producer/102/Funimation'}]","[{'mal_id': 1974, 'type': 'anime', 'name': 'ENGI', 'url': 'https://myanimelist.net/anime/producer/1974/ENGI'}]","[{'mal_id': 1, 'type': 'anime', 'name': 'Action', 'url': 'https://myanimelist.net/anime/genre/1/Action'}, {'mal_id': 4, 'type': 'anime', 'name': 'Comedy', 'url': 'https://myanimelist.net/anime/genre/4/Comedy'}, {'mal_id': 10, 'type': 'anime', 'name': 'Fantasy', 'url': 'https://myanimelist.net/anime/genre/10/Fantasy'}]",[],"[{'mal_id': 11, 'type': 'anime', 'name': 'Game', 'url': 'https://myanimelist.net/anime/genre/11/Game'}]",[]
42192,https://myanimelist.net/anime/42192/Edens_Zero,"{'jpg': {'image_url': 'https://cdn.myanimelist.net/images/anime/1011/111811.jpg', 'small_image_url': 'https://cdn.myanimelist.net/images/anime/1011/111811t.jpg', 'large_image_url': 'https://cdn.myanimelist.net/images/anime/1011/111811l.jpg'}, 'webp': {'image_url': 'https://cdn.myanimelist.net/images/anime/1011/111811.webp', 'small_image_url': 'https://cdn.myanimelist.net/images/anime/1011/111811t.webp', 'large_image_url': 'https://cdn.myanimelist.net/images/anime/1011/111811l.webp'}}","{'youtube_id': 'pB_o3-2etA8', 'url': 'https://www.youtube.com/watch?v=pB_o3-2etA8', 'embed_url': 'https://www.youtube.com/embed/pB_o3-2etA8?enablejsapi=1&wmode=opaque&autoplay=1', 'images': {'image_url': 'https://img.youtube.com/vi/pB_o3-2etA8/default.jpg', 'small_image_url': 'https://img.youtube.com/vi/pB_o3-2etA8/sddefault.jpg', 'medium_image_url': 'https://img.youtube.com/vi/pB_o3-2etA8/mqdefault.jpg', 'large_image_url': 'https://img.youtube.com/vi/pB_o3-2etA8/hqdefault.jpg', 'maximum_image_url': 'https://img.youtube.com/vi/pB_o3-2etA8/maxresdefault.jpg'}}","""Edens Zero""",Edens Zero,EDENS ZERO,[],TV,Manga,25.0,Finished Airing,False,"{'from': '2021-04-11T00:00:00+00:00', 'to': '2021-10-03T00:00:00+00:00', 'prop': {'from': {'day': 11, 'month': 4, 'year': 2021}, 'to': {'day': 3, 'month': 10, 'year': 2021}}, 'string': 'Apr 11, 2021 to Oct 3, 2021'}",23 min per ep,PG-13 - Teens 13 or older,7.35,40012.0,2175.0,1089,178831,1635,"All his life, Shiki has been surrounded by machines. At Granbell Kingdom, a long-abandoned amusement park, he is the only one of his kind around. That is, until Rebecca Bluegarden and her feline companion Happy arrive, unaware that they are Granbell's first visitors in one hundred years. Their goal is to make fun videos for their B-Cube channel, but what they find instead is a friend in the socially awkward Shiki. When Granbell becomes too dangerous for the three of them, they set off on an adventure through the Sakura Cosmos. They hope to make more interesting videos and even find the elusive goddess Mother, while Shiki wants to make more friends, spurred on by the words of his late grandfather. Of course, the journey will not be easy, as no one has seen Mother before, but Shiki is determined to reach his goal and explore the boundless reaches of space together with his new friends. [Written by MAL Rewrite]",,spring,2021,"{'day': 'Sundays', 'time': '00:55', 'timezone': 'Asia/Tokyo', 'string': 'Sundays at 00:55 (JST)'}","[{'mal_id': 159, 'type': 'anime', 'name': 'Kodansha', 'url': 'https://myanimelist.net/anime/producer/159/Kodansha'}, {'mal_id': 306, 'type': 'anime', 'name': 'Magic Capsule', 'url': 'https://myanimelist.net/anime/producer/306/Magic_Capsule'}, {'mal_id': 1418, 'type': 'anime', 'name': 'Nippon Television Music', 'url': 'https://myanimelist.net/anime/producer/1418/Nippon_Television_Music'}]",[],"[{'mal_id': 7, 'type': 'anime', 'name': 'J.C.Staff', 'url': 'https://myanimelist.net/anime/producer/7/JCStaff'}]","[{'mal_id': 2, 'type': 'anime', 'name': 'Adventure', 'url': 'https://myanimelist.net/anime/genre/2/Adventure'}, {'mal_id': 4, 'type': 'anime', 'name': 'Comedy', 'url': 'https://myanimelist.net/anime/genre/4/Comedy'}, {'mal_id': 10, 'type': 'anime', 'name': 'Fantasy', 'url': 'https://myanimelist.net/anime/genre/10/Fantasy'}, {'mal_id': 24, 'type': 'anime', 'name': 'Sci-Fi', 'url': 'https://myanimelist.net/anime/genre/24/Sci-Fi'}]",[],"[{'mal_id': 29, 'type': 'anime', 'name': 'Space', 'url': 'https://myanimelist.net/anime/genre/29/Space'}]","[{'mal_id': 27, 'type': 'anime', 'name': 'Shounen', 'url': 'https://myanimelist.net/anime/genre/27/Shounen'}]"
