mal_id,url,images,trailer,title,title_english,title_japanese,title_synonyms,type,source,episodes,status,airing,aired,duration,rating,score,scored_by,rank,popularity,members,favorites,synopsis,background,season,year,broadcast,producers,licensors,studios,genres,explicit_genres,themes,demographics
42249,https://myanimelist.net/anime/42249/Tokyo_Revengers,"{'jpg': {'image_url': 'https://cdn.myanimelist.net/images/anime/1884/114790.jpg', 'small_image_url': 'https://cdn.myanimelist.net/images/anime/1884/114790t.jpg', 'large_image_url': 'https://cdn.myanimelist.net/images/anime/1884/114790l.jpg'}, 'webp': {'image_url': 'https://cdn.myanimelist.net/images/anime/1884/114790.webp', 'small_image_url': 'https://cdn.myanimelist.net/images/anime/1884/114790t.webp', 'large_image_url': 'https://cdn.myanimelist.net/images/anime/1884/114790l.webp'}}","{'youtube_id': 'r9M34VgTfzY', 'url': 'https://www.youtube.com/watch?v=r9M34VgTfzY', 'embed_url': 'https://www.youtube.com/embed/r9M34VgTfzY?enablejsapi=1&wmode=opaque&autoplay=1', 'images': {'image_url': 'https://img.youtube.com/vi/r9M34VgTfzY/default.jpg', 'small_image_url': 'https://img.youtube.com/vi/r9M34VgTfzY/sddefault.jpg', 'medium_image_url': 'https://img.youtube.com/vi/r9M34VgTfzY/mqdefault.jpg', 'large_image_url': 'https://img.youtube.com/vi/r9M34VgTfzY/hqdefault.jpg', 'maximum_image_url': 'https://img.youtube.com/vi/r9M34VgTfzY/maxresdefault.jpg'}}","""Tokyo Revengers""",Tokyo Revengers,東京リベンジャーズ,[],TV,Manga,24.0,Finished Airing,False,"{'from': '2021-04-11T00:00:00+00:00', 'to': '2021-09-19T00:00:00+00:00', 'prop': {'from': {'day': 11, 'month': 4, 'year': 2021}, 'to': {'day': 19, 'month': 9, 'year': 2021}}, 'string': 'Apr 11, 2021 to Sep 19, 2021'}",23 min per ep,R - 17+ (violence & profanity),8.24,352925.0,277.0,163,849679,21260,"Takemichi Hanagaki’s second year of middle school was the highest point in his life. He had respect, a gang of friends he could count on, and even a girlfriend. But that was twelve years ago. Today, he’s a nobody: a washed-up nonentity made fun of by children and always forced to apologize to his younger boss. A sudden news report on the Tokyo Manji Gang’s cruel murder of the only girlfriend he ever had alongside her brother only adds insult to injury. Half a second before a train ends his pitiful life for good, Takemichi flashes back to that same day twelve years ago, when he was still dating Hinata Tachibana. After being forced to relive the very same day that began his downward spiral, Takemichi meets Hinata’s younger brother. Without thinking, he admits to his seeming death before flashing back to the past. Takemichi urges him to protect his sister before inexplicably returning to the future. Miraculously, he isn’t dead. Stranger still, the future has changed. It seems as though Takemichi can alter the flow of time. Given the chance to prevent his ex-girlfriend’s tragic death at the hands of the Tokyo Manji Gang, Takemichi decides to fly through time to change the course of the future. [Written by MAL Rewrite]",,spring,2021,"{'day': 'Sundays', 'time': '02:08', 'timezone': 'Asia/Tokyo', 'string': 'Sundays at 02:08 (JST)'}","[{'mal_id': 144, 'type': 'anime', 'name': 'Pony Canyon', 'url': 'https://myanimelist.net/anime/producer/144/Pony_Canyon'}]",[],"[{'mal_id': 839, 'type': 'anime', 'name': 'LIDENFILMS', 'url': 'https://myanimelist.net/anime/producer/839/LIDENFILMS'}]","[{'mal_id': 1, 'type': 'anime', 'name': 'Action', 'url': 'https://myanimelist.net/anime/genre/1/Action'}, {'mal_id': 8, 'type': 'anime', 'name': 'Drama', 'url': 'https://myanimelist.net/anime/genre/8/Drama'}, {'mal_id': 37, 'type': 'anime', 'name': 'Supernatural', 'url': 'https://myanimelist.net/anime/genre/37/Supernatural'}]",[],"[{'mal_id': 23, 'type': 'anime', 'name': 'School', 'url': 'https://myanimelist.net/anime/genre/23/School'}]","[{'mal_id': 27, 'type': 'anime', 'name': 'Shounen', 'url': 'https://myanimelist.net/anime/genre/27/Shounen'}]"
41587,https://myanimelist.net/anime/41587/Boku_no_Hero_Academia_5th_Season,"{'jpg': {'image_url': 'https://cdn.myanimelist.net/images/anime/1911/113611.jpg', 'small_image_url': 'https://cdn.myanimelist.net/images/anime/1911/113611t.jpg', 'large_image_url': 'https://cdn.myanimelist.net/images/anime/1911/113611l.jpg'}, 'webp': {'image_url': 'https://cdn.myanimelist.net/images/anime/1911/113611.webp', 'small_image_url': 'https://cdn.myanimelist.net/images/anime/1911/113611t.webp', 'large_image_url': 'https://cdn.myanimelist.net/images/anime/1911/113611l.webp'}}","{'youtube_id': 'kkmW-tppFPM', 'url': 'https://www.youtube.com/watch?v=kkmW-tppFPM', 'embed_url': 'https://www.youtube.com/embed/kkmW-tppFPM?enablejsapi=1&wmode=opaque&autoplay=1', 'images': {'image_url': 'https://img.youtube.com/vi/kkmW-tppFPM/default.jpg', 'small_image_url': 'https://img.youtube.com/vi/kkmW-tppFPM/sddefault.jpg', 'medium_image_url': 'https://img.youtube.com/vi/kkmW-tppFPM/mqdefault.jpg', 'large_image_url': 'https://img.youtube.com/vi/kkmW-tppFPM/hqdefault.jpg', 'maximum_image_url': 'https://img.youtube.com/vi/kkmW-tppFPM/maxresdefault.jpg'}}","""Boku no Hero Academia 5th Season""",My Hero Academia Season 5,僕のヒーローアカデミア,['My Hero Academia 5'],TV,Manga,25.0,Finished Airing,False,"{'from': '2021-03-27T00:00:00+00:00', 'to': '2021-09-25T00:00:00+00:00', 'prop': {'from': {'day': 27, 'month': 3, 'year': 2021}, 'to': {'day': 25, 'month': 9, 'year': 2021}}, 'string': 'Mar 27, 2021 to Sep 25, 2021'}",23 min per ep,PG-13 - Teens 13 or older,7.46,293169.0,1768.0,158,846477,9594,"UA Academy's Class 1-A has been the focus of a substantial amount of public attention due to the multiple villain attacks they have faced over the past school year. This attention has left Class 1-A's rivals, Class 1-B, feeling quite bitter. Desiring to prove their skills, they look forward to the opportunity that has been given to them: a set of mock battles between the students of each class. The classes are split into squads of four, each of which is tasked with capturing the other group members. The winner is the group who first secures all of the opposing team. While this sounds simple, a curveball is thrown into the mix with the inclusion of General Course Student Hitoshi Shinsou, who wishes to transfer into the Hero Course. Despite using his training with Class 1-A's homeroom teacher Shouta ""Eraserhead"" Aizawa to prove that he's capable of being a real hero, he is still far behind the others due to his lack of experience. However, Shinsou is determined to overcome this challenge. Thus begins the fiery competition between Class 1-A and 1-B as each tries to prove that they are superior to the other. [Written by MAL Rewrite]",,spring,2021,"{'day': 'Saturdays', 'time': '17:30', 'timezone': 'Asia/Tokyo', 'string': 'Saturdays at 17:30 (JST)'}","[{'mal_id': 53, 'type': 'anime', 'name': 'Dentsu', 'url': 'https://myanimelist.net/anime/producer/53/Dentsu'}, {'mal_id': 166, 'type': 'anime', 'name': 'Movic', 'url': 'https://myanimelist.net/anime/producer/166/Movic'}, {'mal_id': 236, 'type': 'anime', 'name': 'YTV', 'url': 'https://myanimelist.net/anime/producer/236/YTV'}, {'mal_id': 757, 'type': 'anime', 'name': 'Sony Music Entertainment', 'url': 'https://myanimelist.net/anime/producer/757/Sony_Music_Entertainment'}, {'mal_id': 1143, 'type': 'anime', 'name': 'TOHO animation', 'url': 'https://myanimelist.net/anime/producer/1143/TOHO_animation'}, {'mal_id': 1365, 'type': 'anime', 'name': 'Shueisha', 'url': 'https://myanimelist.net/anime/producer/1365/Shueisha'}]","[{'mal_id': 102, 'type': 'anime', 'name': 'Funimation', 'url': 'https://myanimelist.net/anime/producer/102/Funimation'}]","[{'mal_id': 4, 'type': 'anime', 'name': 'Bones', 'url': 'https://myanimelist.net/anime/producer/4/Bones'}]","[{'mal_id': 1, 'type': 'anime', 'name': 'Action', 'url': 'https://myanimelist.net/anime/genre/1/Action'}, {'mal_id': 4, 'type': 'anime', 'name': 'Comedy', 'url': 'https://myanimelist.net/anime/genre/4/Comedy'}]",[],"[{'mal_id': 23, 'type': 'anime', 'name': 'School', 'url': 'https://myanimelist.net/anime/genre/23/School'}, {'mal_id': 31, 'type': 'anime', 'name': 'Super Power', 'url': 'https://myanimelist.net/anime/genre/31/Super_Power'}]","[{'mal_id': 27, 'type': 'anime', 'name': 'Shounen', 'url': 'https://myanimelist.net/anime/genre/27/Shounen'}]"
41025,https://myanimelist.net/anime/41025/Fumetsu_no_Anata_e,"{'jpg': {'image_url': 'https://cdn.myanimelist.net/images/anime/1880/118484.jpg', 'small_image_url': 'https://cdn.myanimelist.net/images/anime/1880/118484t.jpg', 'large_image_url': 'https://cdn.myanimelist.net/images/anime/1880/118484l.jpg'}, 'webp': {'image_url': 'https://cdn.myanimelist.net/images/anime/1880/118484.webp', 'small_image_url': 'https://cdn.myanimelist.net/images/anime/1880/118484t.webp', 'large_image_url': 'https://cdn.myanimelist.net/images/anime/1880/118484l.webp'}}","{'youtube_id': 'YOn779f6lwI', 'url': 'https://www.youtube.com/watch?v=YOn779f6lwI', 'embed_url': 'https://www.youtube.com/embed/YOn779f6lwI?enablejsapi=1&wmode=opaque&autoplay=1', 'images': {'image_url': 'https://img.youtube.com/vi/YOn779f6lwI/default.jpg', 'small_image_url': 'https://img.youtube.com/vi/YOn779f6lwI/sddefault.jpg', 'medium_image_url': 'https://img.youtube.com/vi/YOn779f6lwI/mqdefault.jpg', 'large_image_url': 'https://img.youtube.com/vi/YOn779f6lwI/hqdefault.jpg', 'maximum_image_url': 'https://img.youtube.com/vi/YOn779f6lwI/maxresdefault.jpg'}}","""Fumetsu no Anata e""",To Your Eternity,不滅のあなたへ,"['To You', 'the Immortal']",TV,Manga,20.0,Finished Airing,False,"{'from': '2021-04-12T00:00:00+00:00', 'to': '2021-08-30T00:00:00+00:00', 'prop': {'from': {'day': 12, 'month': 4, 'year': 2021}, 'to': {'day': 30, 'month': 8, 'year': 2021}}, 'string': 'Apr 12, 2021 to Aug 30, 2021'}",25 min per ep,R - 17+ (violence & profanity),8.42,196834.0,151.0,261,635208,10718,"An Orb, known only as It, is cast to Earth to be observed from afar. Capable of changing forms from beings whose reflections It captures, It first becomes a rock and then, due to the rising temperature, moss. It does not move until one snowy day, a wolf at death's door barely crosses by. When It takes the animal's form, It attains awareness of its consciousness and starts to wander with an unclear destination in mind. Soon, It comes across the wolf's master—a young boy waiting for his tribe to return from a paradise abundant with fish and fruit in the south. Although the boy is lonely, he still hopes those whom he holds dear in his memories have not forgotten him and that he will reunite with them one day. The boy wants to explore new surroundings and decides to abandon his home with It to find the paradise using the traces his tribe left behind. However, with a heavily injured body and no sight of his elder comrades, what will become of the boy? Fumetsu no Anata e illustrates the story of an immortal being experiencing humanity, meeting all types of people in many places throughout time. [Written by MAL Rewrite]",,spring,2021,"{'day': 'Mondays', 'time': '22:50', 'timezone': 'Asia/Tokyo', 'string': 'Mondays at 22:50 (JST)'}","[{'mal_id': 111, 'type': 'anime', 'name': 'NHK', 'url': 'https://myanimelist.net/anime/producer/111/NHK'}, {'mal_id': 1797, 'type': 'anime', 'name': 'NHK Enterprises', 'url': 'https://myanimelist.net/anime/producer/1797/NHK_Enterprises'}]",[],"[{'mal_id': 112, 'type': 'anime', 'name': ""Brain's Base"", 'url': 'https://myanimelist.net/anime/producer/112/Brains_Base'}]","[{'mal_id': 2, 'type': 'anime', 'name': 'Adventure', 'url': 'https://myanimelist.net/anime/genre/2/Adventure'}, {'mal_id': 8, 'type': 'anime', 'name': 'Drama', 'url': 'https://myanimelist.net/anime/genre/8/Drama'}, {'mal_id': 37, 'type': 'anime', 'name': 'Supernatural', 'url': 'https://myanimelist.net/anime/genre/37/Supernatural'}]",[],[],"[{'mal_id': 27, 'type': 'anime', 'name': 'Shounen', 'url': 'https://myanimelist.net/anime/genre/27/Shounen'}]"
42361,https://myanimelist.net/anime/42361/Ijiranaide_Nagatoro-san,"{'jpg': {'image_url': 'https://cdn.myanimelist.net/images/anime/1900/110097.jpg', 'small_image_url': 'https://cdn.myanimelist.net/images/anime/1900/110097t.jpg', 'large_image_url': 'https://cdn.myanimelist.net/images/anime/1900/110097l.jpg'}, 'webp': {'image_url': 'https://cdn.myanimelist.net/images/anime/1900/110097.webp', 'small_image_url': 'https://cdn.myanimelist.net/images/anime/1900/110097t.webp', 'large_image_url': 'https://cdn.myanimelist.net/images/anime/1900/110097l.webp'}}","{'youtube_id': 'Bw5jwgdbqKc', 'url': 'https://www.youtube.com/watch?v=Bw5jwgdbqKc', 'embed_url': 'https://www.youtube.com/embed/Bw5jwgdbqKc?enablejsapi=1&wmode=opaque&autoplay=1', 'images': {'image_url': 'https://img.youtube.com/vi/Bw5jwgdbqKc/default.jpg', 'small_image_url': 'https://img.youtube.com/vi/Bw5jwgdbqKc/sddefault.jpg', 'medium_image_url': 'https://img.youtube.com/vi/Bw5jwgdbqKc/mqdefault.jpg', 'large_image_url': 'https://img.youtube.com/vi/Bw5jwgdbqKc/hqdefault.jpg', 'maximum_image_url': 'https://img.youtube.com/vi/Bw5jwgdbqKc/maxresdefault.jpg'}}","""Ijiranaide, Nagatoro-san""","Don't Toy with Me, Miss Nagatoro",イジらないで、長瀞さん,"[""Please don't bully me"", 'Nagatoro']",TV,Manga,12.0,Finished Airing,False,"{'from': '2021-04-11T00:00:00+00:00', 'to': '2021-06-27T00:00:00+00:00', 'prop': {'from': {'day': 11, 'month': 4, 'year': 2021}, 'to': {'day': 27, 'month': 6, 'year': 2021}}, 'string': 'Apr 11, 2021 to Jun 27, 2021'}",23 min per ep,PG-13 - Teens 13 or older,7.44,262146.0,1858.0,291,598128,7762,"Every day, Naoto Hachiouji is teased relentlessly by Hayase Nagatoro, a first year student he meets one day in the library while working on his manga. After reading his story and seeing his awkward demeanor, she decides from that moment on to toy with him, even calling him ""Senpai"" in lieu of using his real name. At first, Nagatoro's relentless antics are more bothersome than anything and leave him feeling embarrassed, as he is forced to cater to her whims. However, as they spend more time together, a strange sort of friendship develops between them, and Naoto finds that life with Nagatoro can even be fun. But one thing's for sure: his days will never be dull again. [Written by MAL Rewrite]",,spring,2021,"{'day': 'Sundays', 'time': '01:00', 'timezone': 'Asia/Tokyo', 'string': 'Sundays at 01:00 (JST)'}","[{'mal_id': 1344, 'type': 'anime', 'name': 'King Records', 'url': 'https://myanimelist.net/anime/producer/1344/King_Records'}]",[],"[{'mal_id': 94, 'type': 'anime', 'name': 'Telecom Animation Film', 'url': 'https://myanimelist.net/anime/producer/94/Telecom_Animation_Film'}]","[{'mal_id': 4, 'type': 'anime', 'name': 'Comedy', 'url': 'https://myanimelist.net/anime/genre/4/Comedy'}, {'mal_id': 22, 'type': 'anime', 'name': 'Romance', 'url': 'https://myanimelist.net/anime/genre/22/Romance'}, {'mal_id': 36, 'type': 'anime', 'name': 'Slice of Life', 'url': 'https://myanimelist.net/anime/genre/36/Slice_of_Life'}]",[],[],[]
40938,https://myanimelist.net/anime/40938/Hige_wo_Soru_Soshite_Joshikousei_wo_Hirou,"{'jpg': {'image_url': 'https://cdn.myanimelist.net/images/anime/1146/113477.jpg', 'small_image_url': 'https://cdn.myanimelist.net/images/anime/1146/113477t.jpg', 'large_image_url': 'https://cdn.myanimelist.net/images/anime/1146/113477l.jpg'}, 'webp': {'image_url': 'https://cdn.myanimelist.net/images/anime/1146/113477.webp', 'small_image_url': 'https://cdn.myanimelist.net/images/anime/1146/113477t.webp', 'large_image_url': 'https://cdn.myanimelist.net/images/anime/1146/113477l.webp'}}","{'youtube_id': '8zZiwvF8IeY', 'url': 'https://www.youtube.com/watch?v=8zZiwvF8IeY', 'embed_url': 'https://www.youtube.com/embed/8zZiwvF8IeY?enablejsapi=1&wmode=opaque&autoplay=1', 'images': {'image_url': 'https://img.youtube.com/vi/8zZiwvF8IeY/default.jpg', 'small_image_url': 'https://img.youtube.com/vi/8zZiwvF8IeY/sddefault.jpg', 'medium_image_url': 'https://img.youtube.com/vi/8zZiwvF8IeY/mqdefault.jpg', 'large_image_url': 'https://img.youtube.com/vi/8zZiwvF8IeY/hqdefault.jpg', 'maximum_image_url': 'https://img.youtube.com/vi/8zZiwvF8IeY/maxresdefault.jpg'}}","""Hige wo Soru. Soshite Joshikousei wo Hirou.""","Higehiro: After Being Rejected, I Shaved and Took in a High School Runaway",ひげを剃る。そして女子高生を拾う。,"['I Shaved. Then I Brought a High School Girl Home.', 'Higehiro']",TV,Light novel,13.0,Finished Airing,False,"{'from': '2021-04-05T00:00:00+00:00', 'to': '2021-06-28T00:00:00+00:00', 'prop': {'from': {'day': 5, 'month': 4, 'year': 2021}, 'to': {'day': 28, 'month': 6, 'year': 2021}}, 'string': 'Apr 5, 2021 to Jun 28, 2021'}",23 min per ep,PG-13 - Teens 13 or older,7.33,218400.0,2266.0,377,469273,5396,"When regular salaryman Yoshida wakes up one Sunday morning after a long night at the bar, the last thing he expects to see is that his tiny apartment has a new resident—an unfamiliar high school girl. The previous night, despite finally gathering the courage to confess to his boss and longtime crush, Airi Gotou, Yoshida was rejected. After drowning his sorrows at a bar with his good friend Hashimoto, Yoshida headed back to his home in a drunken stupor, only to run into Sayu Ogiwara, a runaway high schooler. She asked him to let her stay the night, and with his judgment clouded by alcohol, Yoshida complied. Now, with his head on straight but with no memory of last night's events, Yoshida has Sayu explain just how she ended up sleeping at his apartment. Having listened to her story, Yoshida finds himself unable to kick her out—especially after learning that she came all the way from Hokkaido! So, despite his reservations about sheltering an underage girl, Yoshida allows her to stay, and their life together begins. [Written by MAL Rewrite]",,spring,2021,"{'day': 'Mondays', 'time': '22:30', 'timezone': 'Asia/Tokyo', 'string': 'Mondays at 22:30 (JST)'}","[{'mal_id': 144, 'type': 'anime', 'name': 'Pony Canyon', 'url': 'https://myanimelist.net/anime/producer/144/Pony_Canyon'}, {'mal_id': 306, 'type': 'anime', 'name': 'Magic Capsule', 'url': 'https://myanimelist.net/anime/producer/306/Magic_Capsule'}, {'mal_id': 2090, 'type': 'anime', 'name': 'Dream Shift', 'url': 'https://myanimelist.net/anime/producer/2090/Dream_Shift'}]",[],"[{'mal_id': 439, 'type': 'anime', 'name': 'Project No.9', 'url': 'https://myanimelist.net/anime/producer/439/Project_No9'}]","[{'mal_id': 8, 'type': 'anime', 'name': 'Drama', 'url': 'https://myanimelist.net/anime/genre/8/Drama'}, {'mal_id': 22, 'type': 'anime', 'name': 'Romance', 'url': 'https://myanimelist.net/anime/genre/22/Romance'}]",[],[],[]
41457,https://myanimelist.net/anime/41457/86,"{'jpg': {'image_url': 'https://cdn.myanimelist.net/images/anime/1987/117507.jpg', 'small_image_url': 'https://cdn.myanimelist.net/images/anime/1987/117507t.jpg', 'large_image_url': 'https://cdn.myanimelist.net/images/anime/1987/117507l.jpg'}, 'webp': {'image_url': 'https://cdn.myanimelist.net/images/anime/1987/117507.webp', 'small_image_url': 'https://cdn.myanimelist.net/images/anime/1987/117507t.webp', 'large_image_url': 'https://cdn.myanimelist.net/images/anime/1987/117507l.webp'}}","{'youtube_id': 'WVegRUOgkPM', 'url': 'https://www.youtube.com/watch?v=WVegRUOgkPM', 'embed_url': 'https://www.youtube.com/embed/WVegRUOgkPM?enablejsapi=1&wmode=opaque&autoplay=1', 'images': {'image_url': 'https://img.youtube.com/vi/WVegRUOgkPM/default.jpg', 'small_image_url': 'https://img.youtube.com/vi/WVegRUOgkPM/sddefault.jpg', 'medium_image_url': 'https://img.youtube.com/vi/WVegRUOgkPM/mqdefault.jpg', 'large_image_url': 'https://img.youtube.com/vi/WVegRUOgkPM/hqdefault.jpg', 'maximum_image_url': 'https://img.youtube.com/vi/WVegRUOgkPM/maxresdefault.jpg'}}","""86""",,86―エイティシックス―,['Eighty Six'],TV,Light novel,11.0,Finished Airing,False,"{'from': '2021-04-11T00:00:00+00:00', 'to': '2021-06-20T00:00:00+00:00', 'prop': {'from': {'day': 11, 'month': 4, 'year': 2021}, 'to': {'day': 20, 'month': 6, 'year': 2021}}, 'string': 'Apr 11, 2021 to Jun 20, 2021'}",23 min per ep,R - 17+ (violence & profanity),8.2,191827.0,320.0,403,466497,8692,"According to the Republic of San Magnolia, their ongoing war against the Giadian Empire has no casualties—however, that is mere propaganda. While the silver-haired Alba of the Republic's eighty-five sectors live safely behind protective walls, those of different appearances are interned in a secret eighty-sixth faction. Known within the military as the Eighty-Six, they are forced to fight against the Empire's autonomous Legion under the command of the Republican ""Handlers."" Vladilena Milizé is assigned to the Spearhead squadron to replace their previous Handler. Shunned by her peers for being a fellow Eighty-Six supporter, she continues to fight against their inhumane discrimination. Shinei Nouzen is the captain of the Spearhead squadron. Infamous for being the sole survivor of every squadron he's been in, he insists on shouldering the names and wishes of his fallen comrades. When the fates of these young souls from two different worlds collide, will it ignite the spark that lights their path to salvation, or will they burn themselves in the flames of despair? [Written by MAL Rewrite]",,spring,2021,"{'day': 'Sundays', 'time': '00:00', 'timezone': 'Asia/Tokyo', 'string': 'Sundays at 00:00 (JST)'}","[{'mal_id': 17, 'type': 'anime', 'name': 'Aniplex', 'url': 'https://myanimelist.net/anime/producer/17/Aniplex'}, {'mal_id': 1696, 'type': 'anime', 'name': 'Kadokawa', 'url': 'https://myanimelist.net/anime/producer/1696/Kadokawa'}, {'mal_id': 1992, 'type': 'anime', 'name': 'Bandai Spirits', 'url': 'https://myanimelist.net/anime/producer/1992/Bandai_Spirits'}]",[],"[{'mal_id': 56, 'type': 'anime', 'name': 'A-1 Pictures', 'url': 'https://myanimelist.net/anime/producer/56/A-1_Pictures'}]","[{'mal_id': 1, 'type': 'anime', 'name': 'Action', 'url': 'https://myanimelist.net/anime/genre/1/Action'}, {'mal_id': 8, 'type': 'anime', 'name': 'Drama', 'url': 'https://myanimelist.net/anime/genre/8/Drama'}, {'mal_id': 24, 'type': 'anime', 'name': 'Sci-Fi', 'url': 'https://myanimelist.net/anime/genre/24/Sci-Fi'}]",[],"[{'mal_id': 18, 'type': 'anime', 'name': 'Mecha', 'url': 'https://myanimelist.net/anime/genre/18/Mecha'}, {'mal_id': 38, 'type': 'anime', 'name': 'Military', 'url': 'https://myanimelist.net/anime/genre/38/Military'}]",[]
46095,https://myanimelist.net/anime/46095/Vivy__Fluorite_Eyes_Song,"{'jpg': {'image_url': 'https://cdn.myanimelist.net/images/anime/1637/115052.jpg', 'small_image_url': 'https://cdn.myanimelist.net/images/anime/1637/115052t.jpg', 'large_image_url': 'https://cdn.myanimelist.net/images/anime/1637/115052l.jpg'}, 'webp': {'image_url': 'https://cdn.myanimelist.net/images/anime/1637/115052.webp', 'small_image_url': 'https://cdn.myanimelist.net/images/anime/1637/115052t.webp', 'large_image_url': 'https://cdn.myanimelist.net/images/anime/1637/115052l.webp'}}","{'youtube_id': 't3IHpQZHPFY', 'url': 'https://www.youtube.com/watch?v=t3IHpQZHPFY', 'embed_url': 'https://www.youtube.com/embed/t3IHpQZHPFY?enablejsapi=1&wmode=opaque&autoplay=1', 'images': {'image_url': 'https://img.youtube.com/vi/t3IHpQZHPFY/default.jpg', 'small_image_url': 'https://img.youtube.com/vi/t3IHpQZHPFY/sddefault.jpg', 'medium_image_url': 'https://img.youtube.com/vi/t3IHpQZHPFY/mqdefault.jpg', 'large_image_url': 'https://img.youtube.com/vi/t3IHpQZHPFY/hqdefault.jpg', 'maximum_image_url': 'https://img.youtube.com/vi/t3IHpQZHPFY/maxresdefault.jpg'}}","""Vivy: Fluorite Eye's Song""",Vivy -Fluorite Eye's Song-,Vivy -Fluorite Eye's Song- (ヴィヴィ -フローライトアイズソング-),[],TV,Original,13.0,Finished Airing,False,"{'from': '2021-04-03T00:00:00+00:00', 'to': '2021-06-19T00:00:00+00:00', 'prop': {'from': {'day': 3, 'month': 4, 'year': 2021}, 'to': {'day': 19, 'month': 6, 'year': 2021}}, 'string': 'Apr 3, 2021 to Jun 19, 2021'}",24 min per ep,R - 17+ (violence & profanity),8.48,145587.0,124.0,503,387990,8015,"When highly evolved AIs set out to eradicate mankind, the carnage that ensues fills the air with the stench of fresh blood and burning bodies. In a desperate bid to prevent the calamity from ever occurring, a scientist bets everything on a remnant from the past. Turning the clock back a hundred years, AIs are already an integral part of human society, programmed with specific missions meant to be carried out for their entire course of operation. Vivy, the first ever autonomous AI, is a songstress tasked with spreading happiness through her voice. In a theme park where she hardly ever gets a proper audience, she strives to pour her heart out into her performances, bound to repeat it day after day—that is, until an advanced AI from the future appears before her and enlists her help in stopping a devastating war a hundred years in the making. With no time to process the revelation that flips her world upside down, Vivy is catapulted into a century-long journey to avert the violent history yet to come. [Written by MAL Rewrite]",,spring,2021,"{'day': 'Saturdays', 'time': '23:30', 'timezone': 'Asia/Tokyo', 'string': 'Saturdays at 23:30 (JST)'}","[{'mal_id': 17, 'type': 'anime', 'name': 'Aniplex', 'url': 'https://myanimelist.net/anime/producer/17/Aniplex'}]","[{'mal_id': 493, 'type': 'anime', 'name': 'Aniplex of America', 'url': 'https://myanimelist.net/anime/producer/493/Aniplex_of_America'}]","[{'mal_id': 858, 'type': 'anime', 'name': 'Wit Studio', 'url': 'https://myanimelist.net/anime/producer/858/Wit_Studio'}]","[{'mal_id': 1, 'type': 'anime', 'name': 'Action', 'url': 'https://myanimelist.net/anime/genre/1/Action'}, {'mal_id': 24, 'type': 'anime', 'name': 'Sci-Fi', 'url': 'https://myanimelist.net/anime/genre/24/Sci-Fi'}, {'mal_id': 41, 'type': 'anime', 'name': 'Suspense', 'url': 'https://myanimelist.net/anime/genre/41/Suspense'}]",[],"[{'mal_id': 19, 'type': 'anime', 'name': 'Music', 'url': 'https://myanimelist.net/anime/genre/19/Music'}]",[]
