mal_id,url,images,trailer,title,title_english,title_japanese,title_synonyms,type,source,episodes,status,airing,aired,duration,rating,score,scored_by,rank,popularity,members,favorites,synopsis,background,season,year,broadcast,producers,licensors,studios,genres,explicit_genres,themes,demographics
45665,https://myanimelist.net/anime/45665/Fairy_Ranmaru__Anata_no_Kokoro_Otasuke_Shimasu,"{'jpg': {'image_url': 'https://cdn.myanimelist.net/images/anime/1476/114026.jpg', 'small_image_url': 'https://cdn.myanimelist.net/images/anime/1476/114026t.jpg', 'large_image_url': 'https://cdn.myanimelist.net/images/anime/1476/114026l.jpg'}, 'webp': {'image_url': 'https://cdn.myanimelist.net/images/anime/1476/114026.webp', 'small_image_url': 'https://cdn.myanimelist.net/images/anime/1476/114026t.webp', 'large_image_url': 'https://cdn.myanimelist.net/images/anime/1476/114026l.webp'}}","{'youtube_id': 'UwL5SqHQAdc', 'url': 'https://www.youtube.com/watch?v=UwL5SqHQAdc', 'embed_url': 'https://www.youtube.com/embed/UwL5SqHQAdc?enablejsapi=1&wmode=opaque&autoplay=1', 'images': {'image_url': 'https://img.youtube.com/vi/UwL5SqHQAdc/default.jpg', 'small_image_url': 'https://img.youtube.com/vi/UwL5SqHQAdc/sddefault.jpg', 'medium_image_url': 'https://img.youtube.com/vi/UwL5SqHQAdc/mqdefault.jpg', 'large_image_url': 'https://img.youtube.com/vi/UwL5SqHQAdc/hqdefault.jpg', 'maximum_image_url': 'https://img.youtube.com/vi/UwL5SqHQAdc/maxresdefault.jpg'}}","""Fairy Ranmaru: Anata no Kokoro Otasuke Shimasu""",,Fairy蘭丸~あなたの心お助けします~,[],TV,Original,12.0,Finished Airing,False,"{'from': '2021-04-08T00:00:00+00:00', 'to': '2021-06-24T00:00:00+00:00', 'prop': {'from': {'day': 8, 'month': 4, 'year': 2021}, 'to': {'day': 24, 'month': 6, 'year': 2021}}, 'string': 'Apr 8, 2021 to Jun 24, 2021'}",23 min per ep,PG-13 - Teens 13 or older,5.96,3125.0,8866.0,4361,18255,131,"In a world where negative emotions fester, five fairies from the strongest clans are sent to Earth to collect ""attachment"" in order to sustain their world. The fairies establish Bar F and live their lives as normal high school boys and a barkeep in order to protect their true identities and fulfill their mission. The boys encounter various female clientele at Bar F, each hiding dark feelings within their hearts, and the boys offer to help them overcome their troubles. The only thing they ask for in return is the client's permission to steal their heart. As the boys investigate the cause of each client's distress, they come across an individual who wishes to sow chaos and sin. With their quest on the line, the fairies of Bar F must unmask this individual's identity and put a stop to their plans, all while holding true to themselves. [Written by MAL Rewrite]",,spring,2021,"{'day': 'Thursdays', 'time': '23:00', 'timezone': 'Asia/Tokyo', 'string': 'Thursdays at 23:00 (JST)'}","[{'mal_id': 144, 'type': 'anime', 'name': 'Pony Canyon', 'url': 'https://myanimelist.net/anime/producer/144/Pony_Canyon'}]",[],"[{'mal_id': 126, 'type': 'anime', 'name': 'Studio Comet', 'url': 'https://myanimelist.net/anime/producer/126/Studio_Comet'}]","[{'mal_id': 1, 'type': 'anime', 'name': 'Action', 'url': 'https://myanimelist.net/anime/genre/1/Action'}, {'mal_id': 36, 'type': 'anime', 'name': 'Slice of Life', 'url': 'https://myanimelist.net/anime/genre/36/Slice_of_Life'}]",[],[],[]
43763,https://myanimelist.net/anime/43763/Cestvs__The_Roman_Fighter,"{'jpg': {'image_url': 'https://cdn.myanimelist.net/images/anime/1291/114014.jpg', 'small_image_url': 'https://cdn.myanimelist.net/images/anime/1291/114014t.jpg', 'large_image_url': 'https://cdn.myanimelist.net/images/anime/1291/114014l.jpg'}, 'webp': {'image_url': 'https://cdn.myanimelist.net/images/anime/1291/114014.webp', 'small_image_url': 'https://cdn.myanimelist.net/images/anime/1291/114014t.webp', 'large_image_url': 'https://cdn.myanimelist.net/images/anime/1291/114014l.webp'}}","{'youtube_id': 'BUB4VjlB4G8', 'url': 'https://www.youtube.com/watch?v=BUB4VjlB4G8', 'embed_url': 'https://www.youtube.com/embed/BUB4VjlB4G8?enablejsapi=1&wmode=opaque&autoplay=1', 'images': {'image_url': 'https://img.youtube.com/vi/BUB4VjlB4G8/default.jpg', 'small_image_url': 'https://img.youtube.com/vi/BUB4VjlB4G8/sddefault.jpg', 'medium_image_url': 'https://img.youtube.com/vi/BUB4VjlB4G8/mqdefault.jpg', 'large_image_url': 'https://img.youtube.com/vi/BUB4VjlB4G8/hqdefault.jpg', 'maximum_image_url': 'https://img.youtube.com/vi/BUB4VjlB4G8/maxresdefault.jpg'}}","""Cestvs: The Roman Fighter""",,セスタス-The Roman Fighter-,"['Kentou Ankokuden Cestv', 'Cestus: The Legend of Boxing in the Dark Ages']",TV,Manga,11.0,Finished Airing,False,"{'from': '2021-04-15T00:00:00+00:00', 'to': '2021-06-24T00:00:00+00:00', 'prop': {'from': {'day': 15, 'month': 4, 'year': 2021}, 'to': {'day': 24, 'month': 6, 'year': 2021}}, 'string': 'Apr 15, 2021 to Jun 24, 2021'}",22 min per ep,PG-13 - Teens 13 or older,5.97,5079.0,8788.0,4366,17688,81,"In the year 54 AD, 15-year-old slave fighter Cestvs desires one thing—an escape from his violent life. It is the wish Cestvs' owner has promised to grant him, but only after he wins 100 battles. However, Cestvs quickly comes to terms with the fact that, as a slave, his life is expendable. After the death of his friend, the possibility of freedom is the only thing keeping him going. With a burning ambition to attain it, Cestvs embarks on a journey to earn himself back, even if it means fighting other slaves for the entertainment of the public. [Written by MAL Rewrite]",,spring,2021,"{'day': 'Thursdays', 'time': '00:55', 'timezone': 'Asia/Tokyo', 'string': 'Thursdays at 00:55 (JST)'}","[{'mal_id': 148, 'type': 'anime', 'name': 'Hakusensha', 'url': 'https://myanimelist.net/anime/producer/148/Hakusensha'}, {'mal_id': 169, 'type': 'anime', 'name': 'Fuji TV', 'url': 'https://myanimelist.net/anime/producer/169/Fuji_TV'}, {'mal_id': 230, 'type': 'anime', 'name': 'Bandai', 'url': 'https://myanimelist.net/anime/producer/230/Bandai'}, {'mal_id': 687, 'type': 'anime', 'name': 'Bandai Namco Live Creative', 'url': 'https://myanimelist.net/anime/producer/687/Bandai_Namco_Live_Creative'}, {'mal_id': 843, 'type': 'anime', 'name': 'BS Fuji', 'url': 'https://myanimelist.net/anime/producer/843/BS_Fuji'}, {'mal_id': 1488, 'type': 'anime', 'name': 'Hakuhodo DY Media Partners', 'url': 'https://myanimelist.net/anime/producer/1488/Hakuhodo_DY_Media_Partners'}, {'mal_id': 1992, 'type': 'anime', 'name': 'Bandai Spirits', 'url': 'https://myanimelist.net/anime/producer/1992/Bandai_Spirits'}]",[],"[{'mal_id': 1258, 'type': 'anime', 'name': 'Bandai Namco Pictures', 'url': 'https://myanimelist.net/anime/producer/1258/Bandai_Namco_Pictures'}]","[{'mal_id': 1, 'type': 'anime', 'name': 'Action', 'url': 'https://myanimelist.net/anime/genre/1/Action'}, {'mal_id': 8, 'type': 'anime', 'name': 'Drama', 'url': 'https://myanimelist.net/anime/genre/8/Drama'}]",[],"[{'mal_id': 13, 'type': 'anime', 'name': 'Historical', 'url': 'https://myanimelist.net/anime/genre/13/Historical'}]","[{'mal_id': 42, 'type': 'anime', 'name': 'Seinen', 'url': 'https://myanimelist.net/anime/genre/42/Seinen'}]"
42516,https://myanimelist.net/anime/42516/Cardfight_Vanguard__overDress,"{'jpg': {'image_url': 'https://cdn.myanimelist.net/images/anime/1520/113748.jpg', 'small_image_url': 'https://cdn.myanimelist.net/images/anime/1520/113748t.jpg', 'large_image_url': 'https://cdn.myanimelist.net/images/anime/1520/113748l.jpg'}, 'webp': {'image_url': 'https://cdn.myanimelist.net/images/anime/1520/113748.webp', 'small_image_url': 'https://cdn.myanimelist.net/images/anime/1520/113748t.webp', 'large_image_url': 'https://cdn.myanimelist.net/images/anime/1520/113748l.webp'}}","{'youtube_id': 'O0MEPPLTtd0', 'url': 'https://www.youtube.com/watch?v=O0MEPPLTtd0', 'embed_url': 'https://www.youtube.com/embed/O0MEPPLTtd0?enablejsapi=1&wmode=opaque&autoplay=1', 'images': {'image_url': 'https://img.youtube.com/vi/O0MEPPLTtd0/default.jpg', 'small_image_url': 'https://img.youtube.com/vi/O0MEPPLTtd0/sddefault.jpg', 'medium_image_url': 'https://img.youtube.com/vi/O0MEPPLTtd0/mqdefault.jpg', 'large_image_url': 'https://img.youtube.com/vi/O0MEPPLTtd0/hqdefault.jpg', 'maximum_image_url': 'https://img.youtube.com/vi/O0MEPPLTtd0/maxresdefault.jpg'}}","""Cardfight!! Vanguard: overDress""",,カードファイト!! ヴァンガード overDress,['Cardfight!! Vanguard: Over Dress'],TV,Original,12.0,Finished Airing,False,"{'from': '2021-04-03T00:00:00+00:00', 'to': '2021-06-26T00:00:00+00:00', 'prop': {'from': {'day': 3, 'month': 4, 'year': 2021}, 'to': {'day': 26, 'month': 6, 'year': 2021}}, 'string': 'Apr 3, 2021 to Jun 26, 2021'}",24 min per ep,PG-13 - Teens 13 or older,5.88,2613.0,9181.0,5286,11090,48,"Yu-yu is a boy living in Kanazawa, Kaga Province. He is 15 years old and in his third year of junior high school. He has the ability to sense the feelings of others, but he is troubled by the fact that he cannot say no when asked. One day, Yu-yu could no longer stand going along with his sister's hobby, so he ran away from home. The one who saves him is Megumi Okura. Megumi invites Yu-yu to a nighttime amusement park called ""Wonder Hill"" where her friends hang out. At the amusement park, Yu-yu meets Megumi, Zakusa Ishikame, and Tomari Seto, members of ""Team Blackout,"" a group that meets to play Vanguard every night. Tonight, a serious fight for the team's flag will take place. Blackout's leader, Danji Momoyama, and the mysterious and powerful fighter, Touya Ebata. As Yu-yu stares at them, the card fight is soon eroded into a world of images. This is how Yu-yu encounters Vanguard, a world he has never seen before, and is drawn in by its powerful allure- making new friends along the way. (Source: ANN)",,spring,2021,"{'day': 'Saturdays', 'time': '08:00', 'timezone': 'Asia/Tokyo', 'string': 'Saturdays at 08:00 (JST)'}","[{'mal_id': 775, 'type': 'anime', 'name': 'Bushiroad', 'url': 'https://myanimelist.net/anime/producer/775/Bushiroad'}]","[{'mal_id': 376, 'type': 'anime', 'name': 'Sentai Filmworks', 'url': 'https://myanimelist.net/anime/producer/376/Sentai_Filmworks'}]","[{'mal_id': 290, 'type': 'anime', 'name': 'Kinema Citrus', 'url': 'https://myanimelist.net/anime/producer/290/Kinema_Citrus'}, {'mal_id': 2299, 'type': 'anime', 'name': 'GIFTanimation', 'url': 'https://myanimelist.net/anime/producer/2299/GIFTanimation'}, {'mal_id': 2300, 'type': 'anime', 'name': 'Studio Jemi', 'url': 'https://myanimelist.net/anime/producer/2300/Studio_Jemi'}]","[{'mal_id': 4, 'type': 'anime', 'name': 'Comedy', 'url': 'https://myanimelist.net/anime/genre/4/Comedy'}]",[],"[{'mal_id': 11, 'type': 'anime', 'name': 'Game', 'url': 'https://myanimelist.net/anime/genre/11/Game'}]",[]
42321,https://myanimelist.net/anime/42321/Battle_Athletess_Daiundoukai_ReSTART,"{'jpg': {'image_url': 'https://cdn.myanimelist.net/images/anime/1752/113795.jpg', 'small_image_url': 'https://cdn.myanimelist.net/images/anime/1752/113795t.jpg', 'large_image_url': 'https://cdn.myanimelist.net/images/anime/1752/113795l.jpg'}, 'webp': {'image_url': 'https://cdn.myanimelist.net/images/anime/1752/113795.webp', 'small_image_url': 'https://cdn.myanimelist.net/images/anime/1752/113795t.webp', 'large_image_url': 'https://cdn.myanimelist.net/images/anime/1752/113795l.webp'}}","{'youtube_id': 'MnE1iFaTOwA', 'url': 'https://www.youtube.com/watch?v=MnE1iFaTOwA', 'embed_url': 'https://www.youtube.com/embed/MnE1iFaTOwA?enablejsapi=1&wmode=opaque&autoplay=1', 'images': {'image_url': 'https://img.youtube.com/vi/MnE1iFaTOwA/default.jpg', 'small_image_url': 'https://img.youtube.com/vi/MnE1iFaTOwA/sddefault.jpg', 'medium_image_url': 'https://img.youtube.com/vi/MnE1iFaTOwA/mqdefault.jpg', 'large_image_url': 'https://img.youtube.com/vi/MnE1iFaTOwA/hqdefault.jpg', 'maximum_image_url': 'https://img.youtube.com/vi/MnE1iFaTOwA/maxresdefault.jpg'}}","""Battle Athletess Daiundoukai ReSTART!""",,バトルアスリーテス 大運動会ReSTART!,[],TV,Original,12.0,Finished Airing,False,"{'from': '2021-04-11T00:00:00+00:00', 'to': '2021-06-27T00:00:00+00:00', 'prop': {'from': {'day': 11, 'month': 4, 'year': 2021}, 'to': {'day': 27, 'month': 6, 'year': 2021}}, 'string': 'Apr 11, 2021 to Jun 27, 2021'}",23 min per ep,PG-13 - Teens 13 or older,5.13,1612.0,11432.0,6381,6842,13,"As technology advanced, humanity gradually colonized the entire solar system, occupying planetary facilities from Mercury to Pluto. This results in a large-scale athletic tournament, the ""Daiundoukai,"" where several aspiring female athletes from all around the solar system compete. The winner of the tournament is crowned the ""Cosmo Beauty,"" obtaining a queenlike status. When outgoing potato farmer Kanata Akehoshi was a child, she witnessed a meteor-like object falling from the sky, crashing in a nearby forest. When she came to investigate the wreckage, she saw a damaged spaceship and a girl who seemed to have been in it weakened by the impact. The girl gave Kanata two wristbands, alongside a request that Kanata join the Daiundoukai and become the Cosmo Beauty. Kanata obliged, but before she could ask for the girl's name, she mysteriously disappeared—leaving nothing,not even the crater caused by the crash. Since then, Kanata has devoted herself to training, aiming to fulfill her promise. After winning the qualifying round to represent the planet Earth, Kanata goes to the University Satellite—an institution where she and other candidates study to prepare themselves for the upcoming competition. There, she meets and befriends her fellow competitors, helping them get along with each other to perform better in the games. As Kanata grows closer to the coveted title, so do her chances of meeting the girl who changed her fate—and she discovers an underlying mystery behind the Daiundoukai along the way. [Written by MAL Rewrite]",,spring,2021,"{'day': 'Sundays', 'time': '01:30', 'timezone': 'Asia/Tokyo', 'string': 'Sundays at 01:30 (JST)'}","[{'mal_id': 55, 'type': 'anime', 'name': 'TV Asahi', 'url': 'https://myanimelist.net/anime/producer/55/TV_Asahi'}, {'mal_id': 323, 'type': 'anime', 'name': 'Nippon Columbia', 'url': 'https://myanimelist.net/anime/producer/323/Nippon_Columbia'}, {'mal_id': 460, 'type': 'anime', 'name': 'KlockWorx', 'url': 'https://myanimelist.net/anime/producer/460/KlockWorx'}, {'mal_id': 843, 'type': 'anime', 'name': 'BS Fuji', 'url': 'https://myanimelist.net/anime/producer/843/BS_Fuji'}, {'mal_id': 2052, 'type': 'anime', 'name': 'Wolfsbane', 'url': 'https://myanimelist.net/anime/producer/2052/Wolfsbane'}, {'mal_id': 2108, 'type': 'anime', 'name': 'SUPA LOVE', 'url': 'https://myanimelist.net/anime/producer/2108/SUPA_LOVE'}, {'mal_id': 2233, 'type': 'anime', 'name': 'Starry Cube', 'url': 'https://myanimelist.net/anime/producer/2233/Starry_Cube'}, {'mal_id': 2234, 'type': 'anime', 'name': 'TV Asahi Music', 'url': 'https://myanimelist.net/anime/producer/2234/TV_Asahi_Music'}, {'mal_id': 2235, 'type': 'anime', 'name': 'tamakoshi', 'url': 'https://myanimelist.net/anime/producer/2235/tamakoshi'}, {'mal_id': 2236, 'type': 'anime', 'name': 'CTW', 'url': 'https://myanimelist.net/anime/producer/2236/CTW'}, {'mal_id': 2237, 'type': 'anime', 'name': 'FUTURE LEAP', 'url': 'https://myanimelist.net/anime/producer/2237/FUTURE_LEAP_'}, {'mal_id': 2255, 'type': 'anime', 'name': 'AIC Rights', 'url': 'https://myanimelist.net/anime/producer/2255/AIC_Rights'}]","[{'mal_id': 102, 'type': 'anime', 'name': 'Funimation', 'url': 'https://myanimelist.net/anime/producer/102/Funimation'}]","[{'mal_id': 541, 'type': 'anime', 'name': 'Seven', 'url': 'https://myanimelist.net/anime/producer/541/Seven'}]","[{'mal_id': 1, 'type': 'anime', 'name': 'Action', 'url': 'https://myanimelist.net/anime/genre/1/Action'}, {'mal_id': 2, 'type': 'anime', 'name': 'Adventure', 'url': 'https://myanimelist.net/anime/genre/2/Adventure'}, {'mal_id': 4, 'type': 'anime', 'name': 'Comedy', 'url': 'https://myanimelist.net/anime/genre/4/Comedy'}, {'mal_id': 24, 'type': 'anime', 'name': 'Sci-Fi', 'url': 'https://myanimelist.net/anime/genre/24/Sci-Fi'}, {'mal_id': 30, 'type': 'anime', 'name': 'Sports', 'url': 'https://myanimelist.net/anime/genre/30/Sports'}]",[],"[{'mal_id': 23, 'type': 'anime', 'name': 'School', 'url': 'https://myanimelist.net/anime/genre/23/School'}]",[]
45587,https://myanimelist.net/anime/45587/Itazuraguma_no_Gloomy,"{'jpg': {'image_url': 'https://cdn.myanimelist.net/images/anime/1289/113575.jpg', 'small_image_url': 'https://cdn.myanimelist.net/images/anime/1289/113575t.jpg', 'large_image_url': 'https://cdn.myanimelist.net/images/anime/1289/113575l.jpg'}, 'webp': {'image_url': 'https://cdn.myanimelist.net/images/anime/1289/113575.webp', 'small_image_url': 'https://cdn.myanimelist.net/images/anime/1289/113575t.webp', 'large_image_url': 'https://cdn.myanimelist.net/images/anime/1289/113575l.webp'}}","{'youtube_id': '5Yv8JL0hal8', 'url': 'https://www.youtube.com/watch?v=5Yv8JL0hal8', 'embed_url': 'https://www.youtube.com/embed/5Yv8JL0hal8?enablejsapi=1&wmode=opaque&autoplay=1', 'images': {'image_url': 'https://img.youtube.com/vi/5Yv8JL0hal8/default.jpg', 'small_image_url': 'https://img.youtube.com/vi/5Yv8JL0hal8/sddefault.jpg', 'medium_image_url': 'https://img.youtube.com/vi/5Yv8JL0hal8/mqdefault.jpg', 'large_image_url': 'https://img.youtube.com/vi/5Yv8JL0hal8/hqdefault.jpg', 'maximum_image_url': 'https://img.youtube.com/vi/5Yv8JL0hal8/maxresdefault.jpg'}}","""Itazuraguma no Gloomy""",GLOOMY The Naughty Grizzly,いたずらぐまのグル～ミ～,[],TV,Other,12.0,Finished Airing,False,"{'from': '2021-04-12T00:00:00+00:00', 'to': '2021-06-28T00:00:00+00:00', 'prop': {'from': {'day': 12, 'month': 4, 'year': 2021}, 'to': {'day': 28, 'month': 6, 'year': 2021}}, 'string': 'Apr 12, 2021 to Jun 28, 2021'}",1 min per ep,R - 17+ (violence & profanity),5.16,2393.0,11375.0,6727,6178,32,"Gloomy, an abandoned little bear, is rescued by Pitty (the little boy). At first, he is cute and cuddly, but becomes wilder as he grows up. Since bears do not become attached to people like dogs by nature, Gloomy attacks Pitty even though he is the owner. So Gloomy has blood on him from biting and/or scratching Pitty. (Source: Cube Works)",,spring,2021,"{'day': 'Mondays', 'time': '23:57', 'timezone': 'Asia/Tokyo', 'string': 'Mondays at 23:57 (JST)'}","[{'mal_id': 1554, 'type': 'anime', 'name': 'Contents Seed', 'url': 'https://myanimelist.net/anime/producer/1554/Contents_Seed'}, {'mal_id': 2098, 'type': 'anime', 'name': 'Mixer', 'url': 'https://myanimelist.net/anime/producer/2098/Mixer'}]",[],"[{'mal_id': 951, 'type': 'anime', 'name': 'NAZ', 'url': 'https://myanimelist.net/anime/producer/951/NAZ'}]","[{'mal_id': 4, 'type': 'anime', 'name': 'Comedy', 'url': 'https://myanimelist.net/anime/genre/4/Comedy'}]",[],[],[]
42071,https://myanimelist.net/anime/42071/Yuuki_Yuuna_wa_Yuusha_de_Aru_Churutto,"{'jpg': {'image_url': 'https://cdn.myanimelist.net/images/anime/1827/107735.jpg', 'small_image_url': 'https://cdn.myanimelist.net/images/anime/1827/107735t.jpg', 'large_image_url': 'https://cdn.myanimelist.net/images/anime/1827/107735l.jpg'}, 'webp': {'image_url': 'https://cdn.myanimelist.net/images/anime/1827/107735.webp', 'small_image_url': 'https://cdn.myanimelist.net/images/anime/1827/107735t.webp', 'large_image_url': 'https://cdn.myanimelist.net/images/anime/1827/107735l.webp'}}","{'youtube_id': None, 'url': None, 'embed_url': None, 'images': {'image_url': None, 'small_image_url': None, 'medium_image_url': None, 'large_image_url': None, 'maximum_image_url': None}}","""Yuuki Yuuna wa Yuusha de Aru Churutto!""",,結城友奈は勇者である ちゅるっと！,[],TV,Game,12.0,Finished Airing,False,"{'from': '2021-04-10T00:00:00+00:00', 'to': '2021-06-26T00:00:00+00:00', 'prop': {'from': {'day': 10, 'month': 4, 'year': 2021}, 'to': {'day': 26, 'month': 6, 'year': 2021}}, 'string': 'Apr 10, 2021 to Jun 26, 2021'}",5 min per ep,PG-13 - Teens 13 or older,5.92,953.0,9017.0,6723,6030,20,"Set in year 300 of the Era of the Gods, heroes and shrine maidens were summoned after a crisis befell on the sacred tree. The Sanshu Middle School Hero Club was transformed into a bountiful household with 27 of them gathered together. Headed by someone who has a strong sense of companionship, Fu Inubozaki, she is determined to make it an Udon Hero Club! (Source: MAL News)",,spring,2021,"{'day': 'Saturdays', 'time': '01:50', 'timezone': 'Asia/Tokyo', 'string': 'Saturdays at 01:50 (JST)'}","[{'mal_id': 143, 'type': 'anime', 'name': 'Mainichi Broadcasting System', 'url': 'https://myanimelist.net/anime/producer/143/Mainichi_Broadcasting_System'}]",[],"[{'mal_id': 1396, 'type': 'anime', 'name': 'W-Toon Studio', 'url': 'https://myanimelist.net/anime/producer/1396/W-Toon_Studio'}, {'mal_id': 1673, 'type': 'anime', 'name': 'DMM.futureworks', 'url': 'https://myanimelist.net/anime/producer/1673/DMMfutureworks'}]","[{'mal_id': 4, 'type': 'anime', 'name': 'Comedy', 'url': 'https://myanimelist.net/anime/genre/4/Comedy'}, {'mal_id': 8, 'type': 'anime', 'name': 'Drama', 'url': 'https://myanimelist.net/anime/genre/8/Drama'}, {'mal_id': 10, 'type': 'anime', 'name': 'Fantasy', 'url': 'https://myanimelist.net/anime/genre/10/Fantasy'}, {'mal_id': 36, 'type': 'anime', 'name': 'Slice of Life', 'url': 'https://myanimelist.net/anime/genre/36/Slice_of_Life'}]",[],[],[]
45618,https://myanimelist.net/anime/45618/Dinosaur_Biyori,"{'jpg': {'image_url': 'https://cdn.myanimelist.net/images/anime/1382/116139.jpg', 'small_image_url': 'https://cdn.myanimelist.net/images/anime/1382/116139t.jpg', 'large_image_url': 'https://cdn.myanimelist.net/images/anime/1382/116139l.jpg'}, 'webp': {'image_url': 'https://cdn.myanimelist.net/images/anime/1382/116139.webp', 'small_image_url': 'https://cdn.myanimelist.net/images/anime/1382/116139t.webp', 'large_image_url': 'https://cdn.myanimelist.net/images/anime/1382/116139l.webp'}}","{'youtube_id': 'VgZntI2xd6Y', 'url': 'https://www.youtube.com/watch?v=VgZntI2xd6Y', 'embed_url': 'https://www.youtube.com/embed/VgZntI2xd6Y?enablejsapi=1&wmode=opaque&autoplay=1', 'images': {'image_url': 'https://img.youtube.com/vi/VgZntI2xd6Y/default.jpg', 'small_image_url': 'https://img.youtube.com/vi/VgZntI2xd6Y/sddefault.jpg', 'medium_image_url': 'https://img.youtube.com/vi/VgZntI2xd6Y/mqdefault.jpg', 'large_image_url': 'https://img.youtube.com/vi/VgZntI2xd6Y/hqdefault.jpg', 'maximum_image_url': 'https://img.youtube.com/vi/VgZntI2xd6Y/maxresdefault.jpg'}}","""Dinosaur Biyori""",,ダイナ荘びより,[],TV,Original,26.0,Finished Airing,False,"{'from': '2021-04-04T00:00:00+00:00', 'to': '2021-09-26T00:00:00+00:00', 'prop': {'from': {'day': 4, 'month': 4, 'year': 2021}, 'to': {'day': 26, 'month': 9, 'year': 2021}}, 'string': 'Apr 4, 2021 to Sep 26, 2021'}",1 min per ep,G - All Ages,,,15702.0,9990,1766,15,"The story follows the lives of three modern day dinosaurs as they share a room in the Dino-Shou (""Dino Manor"") apartment building complex. (Source: Crunchyroll)",,spring,2021,"{'day': 'Sundays', 'time': '00:57', 'timezone': 'Asia/Tokyo', 'string': 'Sundays at 00:57 (JST)'}","[{'mal_id': 17, 'type': 'anime', 'name': 'Aniplex', 'url': 'https://myanimelist.net/anime/producer/17/Aniplex'}, {'mal_id': 757, 'type': 'anime', 'name': 'Sony Music Entertainment', 'url': 'https://myanimelist.net/anime/producer/757/Sony_Music_Entertainment'}, {'mal_id': 2000, 'type': 'anime', 'name': 'Sony Creative Products', 'url': 'https://myanimelist.net/anime/producer/2000/Sony_Creative_Products'}]",[],"[{'mal_id': 866, 'type': 'anime', 'name': 'Fanworks', 'url': 'https://myanimelist.net/anime/producer/866/Fanworks'}]","[{'mal_id': 36, 'type': 'anime', 'name': 'Slice of Life', 'url': 'https://myanimelist.net/anime/genre/36/Slice_of_Life'}]",[],[],[]
48365,https://myanimelist.net/anime/48365/Youkai_Watch_♪,"{'jpg': {'image_url': 'https://cdn.myanimelist.net/images/anime/1682/118273.jpg', 'small_image_url': 'https://cdn.myanimelist.net/images/anime/1682/118273t.jpg', 'large_image_url': 'https://cdn.myanimelist.net/images/anime/1682/118273l.jpg'}, 'webp': {'image_url': 'https://cdn.myanimelist.net/images/anime/1682/118273.webp', 'small_image_url': 'https://cdn.myanimelist.net/images/anime/1682/118273t.webp', 'large_image_url': 'https://cdn.myanimelist.net/images/anime/1682/118273l.webp'}}","{'youtube_id': None, 'url': None, 'embed_url': None, 'images': {'image_url': None, 'small_image_url': None, 'medium_image_url': None, 'large_image_url': None, 'maximum_image_url': None}}","""Youkai Watch ♪""",,妖怪ウォッチ♪,[],TV,Game,,Currently Airing,True,"{'from': '2021-04-09T00:00:00+00:00', 'to': None, 'prop': {'from': {'day': 9, 'month': 4, 'year': 2021}, 'to': {'day': None, 'month': None, 'year': None}}, 'string': 'Apr 9, 2021 to ?'}",24 min,G - All Ages,6.21,330.0,7669.0,10460,1435,25,"The new show will feature unique and returning Yo-kai. The comedy will also center on the original series' main characters: fifth-grader Keita (Nate in the English version), ghost butler Whisper, and popular Yo-kai like Jibanyan and Komasan. The original cast members for these four characters are returning for this new series. (Source: ANN)",,spring,2021,"{'day': None, 'time': None, 'timezone': None, 'string': 'Unknown'}",[],[],"[{'mal_id': 28, 'type': 'anime', 'name': 'OLM', 'url': 'https://myanimelist.net/anime/producer/28/OLM'}]","[{'mal_id': 4, 'type': 'anime', 'name': 'Comedy', 'url': 'https://myanimelist.net/anime/genre/4/Comedy'}, {'mal_id': 37, 'type': 'anime', 'name': 'Supernatural', 'url': 'https://myanimelist.net/anime/genre/37/Supernatural'}]",[],"[{'mal_id': 6, 'type': 'anime', 'name': 'Demons', 'url': 'https://myanimelist.net/anime/genre/6/Demons'}]","[{'mal_id': 15, 'type': 'anime', 'name': 'Kids', 'url': 'https://myanimelist.net/anime/genre/15/Kids'}]"
