mal_id,url,images,trailer,title,title_english,title_japanese,title_synonyms,type,source,episodes,status,airing,aired,duration,rating,score,scored_by,rank,popularity,members,favorites,synopsis,background,season,year,broadcast,producers,licensors,studios,genres,explicit_genres,themes,demographics
40870,https://myanimelist.net/anime/40870/SSSSDynazenon,"{'jpg': {'image_url': 'https://cdn.myanimelist.net/images/anime/1880/113766.jpg', 'small_image_url': 'https://cdn.myanimelist.net/images/anime/1880/113766t.jpg', 'large_image_url': 'https://cdn.myanimelist.net/images/anime/1880/113766l.jpg'}, 'webp': {'image_url': 'https://cdn.myanimelist.net/images/anime/1880/113766.webp', 'small_image_url': 'https://cdn.myanimelist.net/images/anime/1880/113766t.webp', 'large_image_url': 'https://cdn.myanimelist.net/images/anime/1880/113766l.webp'}}","{'youtube_id': 'qzZB6Z1YbSs', 'url': 'https://www.youtube.com/watch?v=qzZB6Z1YbSs', 'embed_url': 'https://www.youtube.com/embed/qzZB6Z1YbSs?enablejsapi=1&wmode=opaque&autoplay=1', 'images': {'image_url': 'https://img.youtube.com/vi/qzZB6Z1YbSs/default.jpg', 'small_image_url': 'https://img.youtube.com/vi/qzZB6Z1YbSs/sddefault.jpg', 'medium_image_url': 'https://img.youtube.com/vi/qzZB6Z1YbSs/mqdefault.jpg', 'large_image_url': 'https://img.youtube.com/vi/qzZB6Z1YbSs/hqdefault.jpg', 'maximum_image_url': 'https://img.youtube.com/vi/qzZB6Z1YbSs/maxresdefault.jpg'}}","""SSSS.Dynazenon""",,SSSS.DYNAZENON,[],TV,Original,12.0,Finished Airing,False,"{'from': '2021-04-02T00:00:00+00:00', 'to': '2021-06-18T00:00:00+00:00', 'prop': {'from': {'day': 2, 'month': 4, 'year': 2021}, 'to': {'day': 18, 'month': 6, 'year': 2021}}, 'string': 'Apr 2, 2021 to Jun 18, 2021'}",23 min per ep,PG-13 - Teens 13 or older,7.45,27189.0,1824.0,1710,100990,689,"One day after school, first-year high school student Yomogi Asanaka comes across a starving man under a bridge. Introducing himself as Gauma, the strange drifter informs Yomogi that he is a ""kaiju user,"" a person who deals with the ""kaiju""—monsters who bring harm to the city and its citizens. The following evening, Yomogi runs into Gauma and his classmate Yume Minami. Simultaneously, a kaiju appears in a populated area of the city. Due to Gauma's lack of experience controlling the kaiju, he brings out a mysterious object from a glowing pouch, summoning a giant robot known as Dynazenon. Requiring the cooperation of four people, the mecha drags Gauma, Yomogi, Minami, and Koyomi Yamanaka—an unemployed man who was wandering on the street—into its cockpit. Their encounter with the kaiju marks the beginning of their entanglement with kaiju eugenicists—kaiju users who manipulate kaiju with ill intent—and their efforts toward bringing out the full potential of Dynazenon. [Written by MAL Rewrite]",SSSS.Dynazenon is a part of the 2018 Gridman Universe shared media project by Tsuburaya Productions. It was first announced in December 2019 during Tsuburaya Productions' Tsubucon convention.,spring,2021,"{'day': 'Fridays', 'time': '22:00', 'timezone': 'Asia/Tokyo', 'string': 'Fridays at 22:00 (JST)'}","[{'mal_id': 143, 'type': 'anime', 'name': 'Mainichi Broadcasting System', 'url': 'https://myanimelist.net/anime/producer/143/Mainichi_Broadcasting_System'}, {'mal_id': 144, 'type': 'anime', 'name': 'Pony Canyon', 'url': 'https://myanimelist.net/anime/producer/144/Pony_Canyon'}, {'mal_id': 453, 'type': 'anime', 'name': 'Tsuburaya Productions', 'url': 'https://myanimelist.net/anime/producer/453/Tsuburaya_Productions'}, {'mal_id': 539, 'type': 'anime', 'name': 'Ultra Super Pictures', 'url': 'https://myanimelist.net/anime/producer/539/Ultra_Super_Pictures'}, {'mal_id': 647, 'type': 'anime', 'name': 'Memory-Tech', 'url': 'https://myanimelist.net/anime/producer/647/Memory-Tech'}, {'mal_id': 1261, 'type': 'anime', 'name': 'Good Smile Company', 'url': 'https://myanimelist.net/anime/producer/1261/Good_Smile_Company'}, {'mal_id': 1416, 'type': 'anime', 'name': 'BS11', 'url': 'https://myanimelist.net/anime/producer/1416/BS11'}]","[{'mal_id': 102, 'type': 'anime', 'name': 'Funimation', 'url': 'https://myanimelist.net/anime/producer/102/Funimation'}]","[{'mal_id': 803, 'type': 'anime', 'name': 'Trigger', 'url': 'https://myanimelist.net/anime/producer/803/Trigger'}]","[{'mal_id': 1, 'type': 'anime', 'name': 'Action', 'url': 'https://myanimelist.net/anime/genre/1/Action'}, {'mal_id': 24, 'type': 'anime', 'name': 'Sci-Fi', 'url': 'https://myanimelist.net/anime/genre/24/Sci-Fi'}]",[],"[{'mal_id': 18, 'type': 'anime', 'name': 'Mecha', 'url': 'https://myanimelist.net/anime/genre/18/Mecha'}]",[]
40685,https://myanimelist.net/anime/40685/Super_Cub,"{'jpg': {'image_url': 'https://cdn.myanimelist.net/images/anime/1776/111172.jpg', 'small_image_url': 'https://cdn.myanimelist.net/images/anime/1776/111172t.jpg', 'large_image_url': 'https://cdn.myanimelist.net/images/anime/1776/111172l.jpg'}, 'webp': {'image_url': 'https://cdn.myanimelist.net/images/anime/1776/111172.webp', 'small_image_url': 'https://cdn.myanimelist.net/images/anime/1776/111172t.webp', 'large_image_url': 'https://cdn.myanimelist.net/images/anime/1776/111172l.webp'}}","{'youtube_id': 'NbWU6B0qjMY', 'url': 'https://www.youtube.com/watch?v=NbWU6B0qjMY', 'embed_url': 'https://www.youtube.com/embed/NbWU6B0qjMY?enablejsapi=1&wmode=opaque&autoplay=1', 'images': {'image_url': 'https://img.youtube.com/vi/NbWU6B0qjMY/default.jpg', 'small_image_url': 'https://img.youtube.com/vi/NbWU6B0qjMY/sddefault.jpg', 'medium_image_url': 'https://img.youtube.com/vi/NbWU6B0qjMY/mqdefault.jpg', 'large_image_url': 'https://img.youtube.com/vi/NbWU6B0qjMY/hqdefault.jpg', 'maximum_image_url': 'https://img.youtube.com/vi/NbWU6B0qjMY/maxresdefault.jpg'}}","""Super Cub""",Super Cub,スーパーカブ,[],TV,Light novel,12.0,Finished Airing,False,"{'from': '2021-04-07T00:00:00+00:00', 'to': '2021-06-23T00:00:00+00:00', 'prop': {'from': {'day': 7, 'month': 4, 'year': 2021}, 'to': {'day': 23, 'month': 6, 'year': 2021}}, 'string': 'Apr 7, 2021 to Jun 23, 2021'}",24 min per ep,PG-13 - Teens 13 or older,7.44,30008.0,1840.0,1898,86659,722,"Koguma, a reserved second-year high school student, has nothing—no parents, hobbies, friends, or goals. On her way home one afternoon, she visits a vehicle shop in hopes of acquiring a motor scooter. With only enough money to make ends meet, she is disheartened by the price tags and prepares to turn back. However, as she is about to leave, the shop's owner offers her a pre-owned Honda Super Cub for ten thousand yen. Believing that the motorcycle will help brighten her monotonous world, she accepts the deal. As Koguma journeys through her town on small adventures with her Super Cub, she begins to build irreplaceable friendships and eagerly advances toward her new life. [Written by MAL Rewrite]",,spring,2021,"{'day': 'Wednesdays', 'time': '23:00', 'timezone': 'Asia/Tokyo', 'string': 'Wednesdays at 23:00 (JST)'}","[{'mal_id': 1840, 'type': 'anime', 'name': 'Bandai Namco Arts', 'url': 'https://myanimelist.net/anime/producer/1840/Bandai_Namco_Arts'}]","[{'mal_id': 102, 'type': 'anime', 'name': 'Funimation', 'url': 'https://myanimelist.net/anime/producer/102/Funimation'}]","[{'mal_id': 1997, 'type': 'anime', 'name': 'Studio Kai', 'url': 'https://myanimelist.net/anime/producer/1997/Studio_Kai'}]","[{'mal_id': 36, 'type': 'anime', 'name': 'Slice of Life', 'url': 'https://myanimelist.net/anime/genre/36/Slice_of_Life'}]",[],"[{'mal_id': 23, 'type': 'anime', 'name': 'School', 'url': 'https://myanimelist.net/anime/genre/23/School'}]",[]
42395,https://myanimelist.net/anime/42395/Shakunetsu_Kabaddi,"{'jpg': {'image_url': 'https://cdn.myanimelist.net/images/anime/1936/114022.jpg', 'small_image_url': 'https://cdn.myanimelist.net/images/anime/1936/114022t.jpg', 'large_image_url': 'https://cdn.myanimelist.net/images/anime/1936/114022l.jpg'}, 'webp': {'image_url': 'https://cdn.myanimelist.net/images/anime/1936/114022.webp', 'small_image_url': 'https://cdn.myanimelist.net/images/anime/1936/114022t.webp', 'large_image_url': 'https://cdn.myanimelist.net/images/anime/1936/114022l.webp'}}","{'youtube_id': 'CeUcyCPcDa4', 'url': 'https://www.youtube.com/watch?v=CeUcyCPcDa4', 'embed_url': 'https://www.youtube.com/embed/CeUcyCPcDa4?enablejsapi=1&wmode=opaque&autoplay=1', 'images': {'image_url': 'https://img.youtube.com/vi/CeUcyCPcDa4/default.jpg', 'small_image_url': 'https://img.youtube.com/vi/CeUcyCPcDa4/sddefault.jpg', 'medium_image_url': 'https://img.youtube.com/vi/CeUcyCPcDa4/mqdefault.jpg', 'large_image_url': 'https://img.youtube.com/vi/CeUcyCPcDa4/hqdefault.jpg', 'maximum_image_url': 'https://img.youtube.com/vi/CeUcyCPcDa4/maxresdefault.jpg'}}","""Shakunetsu Kabaddi""",Burning Kabaddi,灼熱カバディ,[],TV,Web manga,12.0,Finished Airing,False,"{'from': '2021-04-03T00:00:00+00:00', 'to': '2021-06-19T00:00:00+00:00', 'prop': {'from': {'day': 3, 'month': 4, 'year': 2021}, 'to': {'day': 19, 'month': 6, 'year': 2021}}, 'string': 'Apr 3, 2021 to Jun 19, 2021'}",23 min per ep,PG-13 - Teens 13 or older,7.08,27978.0,3450.0,1906,85282,720,"Tatsuya Yoigoshi, a once nationally recognized soccer player, is now a first-year student at Noukin High School. Due to his developed hatred for sports, he has abandoned his previous aspirations to become a famous livestreamer on the internet. One day, Souma Azemichi, a first-year on the kabaddi team, seeks to recruit Yoigoshi and spontaneously interrupts his livestream. Without any expectations, Yoigoshi follows Souma to the school gym, where he witnesses second-years Kyouhei Misumi and Shinji Date engaged in the primal contact sport of kabaddi. Despite ridiculing the rules of play, Yoigoshi is stunned by the intensity of the round. Because of an enticing deal and slight coercion, he agrees to settle the prospect of his recruitment through the most invigorating way: a battle of kabbadi, a team sport played empty-handed. [Written by MAL Rewrite]",,spring,2021,"{'day': 'Saturdays', 'time': '01:23', 'timezone': 'Asia/Tokyo', 'string': 'Saturdays at 01:23 (JST)'}","[{'mal_id': 16, 'type': 'anime', 'name': 'TV Tokyo', 'url': 'https://myanimelist.net/anime/producer/16/TV_Tokyo'}]",[],"[{'mal_id': 73, 'type': 'anime', 'name': 'TMS Entertainment', 'url': 'https://myanimelist.net/anime/producer/73/TMS_Entertainment'}]","[{'mal_id': 4, 'type': 'anime', 'name': 'Comedy', 'url': 'https://myanimelist.net/anime/genre/4/Comedy'}, {'mal_id': 30, 'type': 'anime', 'name': 'Sports', 'url': 'https://myanimelist.net/anime/genre/30/Sports'}]",[],"[{'mal_id': 23, 'type': 'anime', 'name': 'School', 'url': 'https://myanimelist.net/anime/genre/23/School'}]",[]
47250,https://myanimelist.net/anime/47250/Jouran__The_Princess_of_Snow_and_Blood,"{'jpg': {'image_url': 'https://cdn.myanimelist.net/images/anime/1289/115673.jpg', 'small_image_url': 'https://cdn.myanimelist.net/images/anime/1289/115673t.jpg', 'large_image_url': 'https://cdn.myanimelist.net/images/anime/1289/115673l.jpg'}, 'webp': {'image_url': 'https://cdn.myanimelist.net/images/anime/1289/115673.webp', 'small_image_url': 'https://cdn.myanimelist.net/images/anime/1289/115673t.webp', 'large_image_url': 'https://cdn.myanimelist.net/images/anime/1289/115673l.webp'}}","{'youtube_id': 'KdTZ-XQhFdE', 'url': 'https://www.youtube.com/watch?v=KdTZ-XQhFdE', 'embed_url': 'https://www.youtube.com/embed/KdTZ-XQhFdE?enablejsapi=1&wmode=opaque&autoplay=1', 'images': {'image_url': 'https://img.youtube.com/vi/KdTZ-XQhFdE/default.jpg', 'small_image_url': 'https://img.youtube.com/vi/KdTZ-XQhFdE/sddefault.jpg', 'medium_image_url': 'https://img.youtube.com/vi/KdTZ-XQhFdE/mqdefault.jpg', 'large_image_url': 'https://img.youtube.com/vi/KdTZ-XQhFdE/hqdefault.jpg', 'maximum_image_url': 'https://img.youtube.com/vi/KdTZ-XQhFdE/maxresdefault.jpg'}}","""Jouran: The Princess of Snow and Blood""",Joran The Princess of Snow and Blood,擾乱 THE PRINCESS OF SNOW AND BLOOD,[],TV,Original,12.0,Finished Airing,False,"{'from': '2021-04-07T00:00:00+00:00', 'to': '2021-06-23T00:00:00+00:00', 'prop': {'from': {'day': 7, 'month': 4, 'year': 2021}, 'to': {'day': 23, 'month': 6, 'year': 2021}}, 'string': 'Apr 7, 2021 to Jun 23, 2021'}",22 min per ep,R - 17+ (violence & profanity),6.1,19953.0,8206.0,1919,84009,365,"In 1931, the Tokugawa Shogunate remains in power, marking the 64th year of the Meiji era. Holding a monopoly over the newly discovered ""Dragon Vein,"" the government is leading Japan toward an advanced Edo period. During this time, an elite force of executioners called ""Nue"" is tasked with defending the Shogunate from a rebel institution known as the ""Kuchinawa."" As the owner of the Tsuyukasa Bookshop, Sawa Yukimura runs the store's day-to-day business inconspicuously. But behind the scenes, she seeks vengeance against the man who slaughtered her tribe and family. With a special ability to transform granted by her blue blood, Sawa joins Nue after being promised information regarding the target of her revenge: Janome, the leader of the Kuchinawa. [Written by MAL Rewrite]",,spring,2021,"{'day': 'Wednesdays', 'time': '01:29', 'timezone': 'Asia/Tokyo', 'string': 'Wednesdays at 01:29 (JST)'}","[{'mal_id': 53, 'type': 'anime', 'name': 'Dentsu', 'url': 'https://myanimelist.net/anime/producer/53/Dentsu'}, {'mal_id': 103, 'type': 'anime', 'name': 'Tatsunoko Production', 'url': 'https://myanimelist.net/anime/producer/103/Tatsunoko_Production'}, {'mal_id': 775, 'type': 'anime', 'name': 'Bushiroad', 'url': 'https://myanimelist.net/anime/producer/775/Bushiroad'}, {'mal_id': 1003, 'type': 'anime', 'name': 'Nippon Television Network', 'url': 'https://myanimelist.net/anime/producer/1003/Nippon_Television_Network'}, {'mal_id': 1634, 'type': 'anime', 'name': 'Bushiroad Music', 'url': 'https://myanimelist.net/anime/producer/1634/Bushiroad_Music'}, {'mal_id': 1858, 'type': 'anime', 'name': 'Sonilude', 'url': 'https://myanimelist.net/anime/producer/1858/Sonilude'}, {'mal_id': 2227, 'type': 'anime', 'name': 'HJ Holdings', 'url': 'https://myanimelist.net/anime/producer/2227/HJ_Holdings'}, {'mal_id': 2228, 'type': 'anime', 'name': 'Bushiroad Move', 'url': 'https://myanimelist.net/anime/producer/2228/Bushiroad_Move'}]",[],"[{'mal_id': 1984, 'type': 'anime', 'name': 'Bakken Record', 'url': 'https://myanimelist.net/anime/producer/1984/Bakken_Record'}]","[{'mal_id': 1, 'type': 'anime', 'name': 'Action', 'url': 'https://myanimelist.net/anime/genre/1/Action'}, {'mal_id': 37, 'type': 'anime', 'name': 'Supernatural', 'url': 'https://myanimelist.net/anime/genre/37/Supernatural'}]",[],"[{'mal_id': 13, 'type': 'anime', 'name': 'Historical', 'url': 'https://myanimelist.net/anime/genre/13/Historical'}]",[]
43756,https://myanimelist.net/anime/43756/Bakuten,"{'jpg': {'image_url': 'https://cdn.myanimelist.net/images/anime/1827/113510.jpg', 'small_image_url': 'https://cdn.myanimelist.net/images/anime/1827/113510t.jpg', 'large_image_url': 'https://cdn.myanimelist.net/images/anime/1827/113510l.jpg'}, 'webp': {'image_url': 'https://cdn.myanimelist.net/images/anime/1827/113510.webp', 'small_image_url': 'https://cdn.myanimelist.net/images/anime/1827/113510t.webp', 'large_image_url': 'https://cdn.myanimelist.net/images/anime/1827/113510l.webp'}}","{'youtube_id': 'IOu25DQuc3Q', 'url': 'https://www.youtube.com/watch?v=IOu25DQuc3Q', 'embed_url': 'https://www.youtube.com/embed/IOu25DQuc3Q?enablejsapi=1&wmode=opaque&autoplay=1', 'images': {'image_url': 'https://img.youtube.com/vi/IOu25DQuc3Q/default.jpg', 'small_image_url': 'https://img.youtube.com/vi/IOu25DQuc3Q/sddefault.jpg', 'medium_image_url': 'https://img.youtube.com/vi/IOu25DQuc3Q/mqdefault.jpg', 'large_image_url': 'https://img.youtube.com/vi/IOu25DQuc3Q/hqdefault.jpg', 'maximum_image_url': 'https://img.youtube.com/vi/IOu25DQuc3Q/maxresdefault.jpg'}}","""Bakuten!!""",Backflip!!,バクテン!!,[],TV,Original,12.0,Finished Airing,False,"{'from': '2021-04-09T00:00:00+00:00', 'to': '2021-06-25T00:00:00+00:00', 'prop': {'from': {'day': 9, 'month': 4, 'year': 2021}, 'to': {'day': 25, 'month': 6, 'year': 2021}}, 'string': 'Apr 9, 2021 to Jun 25, 2021'}",22 min per ep,PG-13 - Teens 13 or older,7.58,25339.0,1387.0,1957,82405,774,"Shoutarou Futaba has always loved sports, but he never became more than a benchwarmer on his middle school baseball team. After noticing a group of gymnasts practicing in the park, he decides to watch a rhythmic gymnastics tournament on a whim. Although displaying an exhilarating performance at the competition, the Shoushukan High School's Rhythmic Gymnastics Club places second-to-last due to penalties acquired from not fielding a full six-man roster. The demonstration of skill captivates Shoutarou, and he decides to enroll at Shoushukan in hopes of joining the team despite having no background in the sport. The club recruits him alongside Ryouya Misato, a prodigal gymnast who was the runner-up in a junior tournament. Now with a full six-man roster, the team sets out to compete in the upcoming Inter-High tournament. As he strives to accomplish this ambitious endeavor, Shoutarou must learn and master the basics of rhythmic gymnastics all while working in tandem with his new teammates if Shoushukan wants to stand a chance at claiming the title. [Written by MAL Rewrite]",,spring,2021,"{'day': 'Fridays', 'time': '00:55', 'timezone': 'Asia/Tokyo', 'string': 'Fridays at 00:55 (JST)'}","[{'mal_id': 17, 'type': 'anime', 'name': 'Aniplex', 'url': 'https://myanimelist.net/anime/producer/17/Aniplex'}, {'mal_id': 53, 'type': 'anime', 'name': 'Dentsu', 'url': 'https://myanimelist.net/anime/producer/53/Dentsu'}, {'mal_id': 140, 'type': 'anime', 'name': 'Animax', 'url': 'https://myanimelist.net/anime/producer/140/Animax'}, {'mal_id': 166, 'type': 'anime', 'name': 'Movic', 'url': 'https://myanimelist.net/anime/producer/166/Movic'}, {'mal_id': 169, 'type': 'anime', 'name': 'Fuji TV', 'url': 'https://myanimelist.net/anime/producer/169/Fuji_TV'}, {'mal_id': 843, 'type': 'anime', 'name': 'BS Fuji', 'url': 'https://myanimelist.net/anime/producer/843/BS_Fuji'}, {'mal_id': 1886, 'type': 'anime', 'name': 'Aeon Entertainment', 'url': 'https://myanimelist.net/anime/producer/1886/Aeon_Entertainment'}]",[],"[{'mal_id': 218, 'type': 'anime', 'name': 'Zexcs', 'url': 'https://myanimelist.net/anime/producer/218/Zexcs'}]","[{'mal_id': 30, 'type': 'anime', 'name': 'Sports', 'url': 'https://myanimelist.net/anime/genre/30/Sports'}]",[],[],[]
40752,https://myanimelist.net/anime/40752/Bishounen_Tanteidan,"{'jpg': {'image_url': 'https://cdn.myanimelist.net/images/anime/1693/115133.jpg', 'small_image_url': 'https://cdn.myanimelist.net/images/anime/1693/115133t.jpg', 'large_image_url': 'https://cdn.myanimelist.net/images/anime/1693/115133l.jpg'}, 'webp': {'image_url': 'https://cdn.myanimelist.net/images/anime/1693/115133.webp', 'small_image_url': 'https://cdn.myanimelist.net/images/anime/1693/115133t.webp', 'large_image_url': 'https://cdn.myanimelist.net/images/anime/1693/115133l.webp'}}","{'youtube_id': 'fqZ00e22IZc', 'url': 'https://www.youtube.com/watch?v=fqZ00e22IZc', 'embed_url': 'https://www.youtube.com/embed/fqZ00e22IZc?enablejsapi=1&wmode=opaque&autoplay=1', 'images': {'image_url': 'https://img.youtube.com/vi/fqZ00e22IZc/default.jpg', 'small_image_url': 'https://img.youtube.com/vi/fqZ00e22IZc/sddefault.jpg', 'medium_image_url': 'https://img.youtube.com/vi/fqZ00e22IZc/mqdefault.jpg', 'large_image_url': 'https://img.youtube.com/vi/fqZ00e22IZc/hqdefault.jpg', 'maximum_image_url': 'https://img.youtube.com/vi/fqZ00e22IZc/maxresdefault.jpg'}}","""Bishounen Tanteidan""",Pretty Boy Detective Club,美少年探偵団,['Bishounen Series'],TV,Novel,12.0,Finished Airing,False,"{'from': '2021-04-11T00:00:00+00:00', 'to': '2021-06-27T00:00:00+00:00', 'prop': {'from': {'day': 11, 'month': 4, 'year': 2021}, 'to': {'day': 27, 'month': 6, 'year': 2021}}, 'string': 'Apr 11, 2021 to Jun 27, 2021'}",23 min per ep,PG-13 - Teens 13 or older,7.18,20627.0,2998.0,1961,81761,490,"Mayumi Doujima promises her parents that she will give up on her dreams of becoming an astronaut on her 14th birthday if she cannot find a star she once saw long ago. Overhearing her troubles, the eccentric Manabu Soutouin offers to help her search for the star alongside the rest of Yubiwa Academy's mysterious Pretty Boy Detective Club, whose rules are as follows: ""Be pretty, be a boy, and be a detective!"" However, Mayumi is unique—she can see many things that ordinary people cannot. Her eyesight allows her to see the tiniest of details, from people approaching her at a distance to hidden traps that would otherwise go undetected. When the search for the lost star begins to sour, the Pretty Boy Detective Club end up entangled in something far beyond what they ever imagined. [Written by MAL Rewrite]",,spring,2021,"{'day': 'Sundays', 'time': '02:00', 'timezone': 'Asia/Tokyo', 'string': 'Sundays at 02:00 (JST)'}","[{'mal_id': 17, 'type': 'anime', 'name': 'Aniplex', 'url': 'https://myanimelist.net/anime/producer/17/Aniplex'}, {'mal_id': 159, 'type': 'anime', 'name': 'Kodansha', 'url': 'https://myanimelist.net/anime/producer/159/Kodansha'}]","[{'mal_id': 493, 'type': 'anime', 'name': 'Aniplex of America', 'url': 'https://myanimelist.net/anime/producer/493/Aniplex_of_America'}]","[{'mal_id': 44, 'type': 'anime', 'name': 'Shaft', 'url': 'https://myanimelist.net/anime/producer/44/Shaft'}]","[{'mal_id': 7, 'type': 'anime', 'name': 'Mystery', 'url': 'https://myanimelist.net/anime/genre/7/Mystery'}]",[],"[{'mal_id': 23, 'type': 'anime', 'name': 'School', 'url': 'https://myanimelist.net/anime/genre/23/School'}]",[]
42307,https://myanimelist.net/anime/42307/Subarashiki_Kono_Sekai_The_Animation,"{'jpg': {'image_url': 'https://cdn.myanimelist.net/images/anime/1016/111566.jpg', 'small_image_url': 'https://cdn.myanimelist.net/images/anime/1016/111566t.jpg', 'large_image_url': 'https://cdn.myanimelist.net/images/anime/1016/111566l.jpg'}, 'webp': {'image_url': 'https://cdn.myanimelist.net/images/anime/1016/111566.webp', 'small_image_url': 'https://cdn.myanimelist.net/images/anime/1016/111566t.webp', 'large_image_url': 'https://cdn.myanimelist.net/images/anime/1016/111566l.webp'}}","{'youtube_id': 'PyIt1obb1dE', 'url': 'https://www.youtube.com/watch?v=PyIt1obb1dE', 'embed_url': 'https://www.youtube.com/embed/PyIt1obb1dE?enablejsapi=1&wmode=opaque&autoplay=1', 'images': {'image_url': 'https://img.youtube.com/vi/PyIt1obb1dE/default.jpg', 'small_image_url': 'https://img.youtube.com/vi/PyIt1obb1dE/sddefault.jpg', 'medium_image_url': 'https://img.youtube.com/vi/PyIt1obb1dE/mqdefault.jpg', 'large_image_url': 'https://img.youtube.com/vi/PyIt1obb1dE/hqdefault.jpg', 'maximum_image_url': 'https://img.youtube.com/vi/PyIt1obb1dE/maxresdefault.jpg'}}","""Subarashiki Kono Sekai The Animation""",The World Ends with You The Animation,すばらしきこのせかい The Animation,"[""It's a Wonderful World"", 'This Wonderful World', 'Subarashiki Konosekai', 'Subaseka', 'TWEWY']",TV,Game,12.0,Finished Airing,False,"{'from': '2021-04-10T00:00:00+00:00', 'to': '2021-06-26T00:00:00+00:00', 'prop': {'from': {'day': 10, 'month': 4, 'year': 2021}, 'to': {'day': 26, 'month': 6, 'year': 2021}}, 'string': 'Apr 10, 2021 to Jun 26, 2021'}",23 min per ep,PG-13 - Teens 13 or older,6.14,13766.0,7994.0,2336,60818,288,"One day in the bustling city of Shibuya, a boy named Neku Sakuraba finds himself holding two black pins that enable him to read the minds of people around him. However, these pins also give him the ability to see the ""Noise,"" hostile creatures capable of ""erasing"" people from existence. After discovering that he is trapped within the confines of the city, Neku receives a message regarding a mission that will nevertheless erase him should he fail. While trying to fend off a Noise attack, Neku meets a girl named Shiki Misaki who asks him to form a partnership pact with her to fight against the monsters. Shiki explains that she and Neku have become ""Players"" participating in the ""Reaper's Game""—an event spanning over seven days, each featuring a different mission. As Neku and Shiki both strive to survive each day that passes, they begin to meet other Players and Reapers alike, battle stronger Noise, and learn the truth behind the mystery that this game is shrouded in. [Written by MAL Rewrite]",,spring,2021,"{'day': 'Saturdays', 'time': '02:25', 'timezone': 'Asia/Tokyo', 'string': 'Saturdays at 02:25 (JST)'}","[{'mal_id': 143, 'type': 'anime', 'name': 'Mainichi Broadcasting System', 'url': 'https://myanimelist.net/anime/producer/143/Mainichi_Broadcasting_System'}]","[{'mal_id': 102, 'type': 'anime', 'name': 'Funimation', 'url': 'https://myanimelist.net/anime/producer/102/Funimation'}]","[{'mal_id': 247, 'type': 'anime', 'name': 'Shin-Ei Animation', 'url': 'https://myanimelist.net/anime/producer/247/Shin-Ei_Animation'}, {'mal_id': 1380, 'type': 'anime', 'name': 'domerica', 'url': 'https://myanimelist.net/anime/producer/1380/domerica'}]","[{'mal_id': 1, 'type': 'anime', 'name': 'Action', 'url': 'https://myanimelist.net/anime/genre/1/Action'}, {'mal_id': 2, 'type': 'anime', 'name': 'Adventure', 'url': 'https://myanimelist.net/anime/genre/2/Adventure'}]",[],[],[]
